text,label,source,reliability,bias,source_bias,date
Dan Johnson suicide: Lawmaker accused of molesting teen killed himself. His widow calls it a 'high-tech lynching.',0.7272727272727273,washington-post,38.8,-6.85,left-center,2017-12-15
LOUISVILLE - Dan Johnson posted a final message on Facebook to his friends and family on Wednesday afternoon.,0.36363636363636365,washington-post,38.8,-6.85,left-center,2017-12-15
It appeared to be a goodbye.,0.7272727272727273,washington-post,38.8,-6.85,left-center,2017-12-15
"In it, he denied the accusations that had tormented him and his family for the past 48 hours - that he, a Kentucky state representative and the self-proclaimed ""Pope"" of his Louisville church - had gotten drunk and molested a 17-year-old girl during ",0.5454545454545454,washington-post,38.8,-6.85,left-center,2017-12-15
"""GOD knows the truth, nothing is the way they make it out to be,"" he wrote in the since-deleted post.",0.36363636363636365,washington-post,38.8,-6.85,left-center,2017-12-15
"""I cannot handle it any longer .",0.2727272727272727,washington-post,38.8,-6.85,left-center,2017-12-15
"BUT HEAVEN IS MY HOME.""",0.2727272727272727,washington-post,38.8,-6.85,left-center,2017-12-15
"Johnson then drove to a graffiti-covered bridge outside of Mount Washington, Ky., a quiet and isolated spot called the River Bottoms.",0.2727272727272727,washington-post,38.8,-6.85,left-center,2017-12-15
"He parked, got out of his car, and shot himself with a .40-caliber handgun, according to Bullitt County Sheriff Donnie Tinnell.",0.36363636363636365,washington-post,38.8,-6.85,left-center,2017-12-15
"The apparent suicide of a well-known local Republican here was another dark and dramatic turn in the nation's recent reckoning with sexual assault and harassment, with near-daily revelations about powerful men leading to sudden falls from positions o",0.6363636363636364,washington-post,38.8,-6.85,left-center,2017-12-15
"Many of those cases have led to denials, resignations, apologies; though Johnson denied the allegations, some believe they pushed him over the edge.",0.2727272727272727,washington-post,38.8,-6.85,left-center,2017-12-15
"Johnson's wife, Rebecca, announced Thursday that she plans to replace him in the state legislature.",0.36363636363636365,washington-post,38.8,-6.85,left-center,2017-12-15
"She spent the day at a funeral home arranging her husband's service, consoling her relatives and continuing to do what she does best - fighting for her family, said David Adams, a family friend and spokesman.",0.5454545454545454,washington-post,38.8,-6.85,left-center,2017-12-15
"""Dan is gone but the story of his life is far from over,"" Rebecca Johnson said through Adams.",0.2727272727272727,washington-post,38.8,-6.85,left-center,2017-12-15
"""These high-tech lynchings based on lies and half-truths can't be allowed to win the day.",0.6363636363636364,washington-post,38.8,-6.85,left-center,2017-12-15
"I've been fighting behind my husband for 30 years and his fight will go on.""",0.6363636363636364,washington-post,38.8,-6.85,left-center,2017-12-15
"Johnson's death shook his family, friends, constituents and members of his church, with Kentucky's political elite immediately expressing their sadness.",0.5454545454545454,washington-post,38.8,-6.85,left-center,2017-12-15
Gov.,0.2727272727272727,washington-post,38.8,-6.85,left-center,2017-12-15
"Matt Bevin (R) wrote on Twitter: ""My heart breaks for his family   May God indeed shed His grace on us all"" and Sen. Rand Paul (R-Ky.) said in a tweet: ""I cannot imagine his pain or the heartbreak his family is dealing with.""",0.45454545454545453,washington-post,38.8,-6.85,left-center,2017-12-15
"[White House urges Roy Moore to concede, as supporters look for evidence of 'voter fraud']",0.5454545454545454,washington-post,38.8,-6.85,left-center,2017-12-15
"The tumult began Monday, when the Kentucky Center for Investigative Reporting published allegations that Johnson sexually assaulted his daughter's friend during a sleepover in 2013.",1.0,washington-post,38.8,-6.85,left-center,2017-12-15
Kentucky lawmaker Dan Johnson killed himself after sexual assault allegations,0.6363636363636364,cnn,42.06,-6.28,left,2017-12-15
"(CNN) A Kentucky lawmaker accused of sexually assaulting a teenage girl in 2013 killed himself Wednesday, officials say, a day after he denied the allegations.",0.45454545454545453,cnn,42.06,-6.28,left,2017-12-15
"Republican state Rep. Dan Johnson was found dead of a single gunshot wound near Mount Washington, Bullitt County Coroner Dave Billings said.",0.5454545454545454,cnn,42.06,-6.28,left,2017-12-15
"Johnson drove onto a bridge in a rural area southeast of Louisville, parked and shot himself in front of his car, Sheriff Donnie Tinnell told CNN affiliate WDRB",0.2727272727272727,cnn,42.06,-6.28,left,2017-12-15
"Billings ruled Johnson's death a suicide on Thursday after an autopsy, Deputy Coroner Clayton Brunson said.",0.6363636363636364,cnn,42.06,-6.28,left,2017-12-15
"Shortly before his death, Johnson posted a rambling message on social media, denying the sexual assault allegations and urging his family to stay strong for his wife.",0.5454545454545454,cnn,42.06,-6.28,left,2017-12-15
"Relatives became concerned after seeing the post and reached out to law enforcement, who pinged Johnson's phone and later discovered his body, according to Billings.",0.36363636363636365,cnn,42.06,-6.28,left,2017-12-15
Billings said he was called to the scene around 7:30 p.m.,0.2727272727272727,cnn,42.06,-6.28,left,2017-12-15
"Authorities discovered Johnson's body in front of his truck and a 40-caliber semi-automatic handgun nearby, he said.",0.8181818181818182,cnn,42.06,-6.28,left,2017-12-15
CNN has reached out to the Bullitt County Sheriff's Office and the Kentucky governor's office but has not heard back.,0.36363636363636365,cnn,42.06,-6.28,left,2017-12-15
"His accuser said the alleged sexual assault took place in the early hours of New Year's Day in 2013 when she was 17, according to the center's explosive investigative report published Monday.",0.36363636363636365,cnn,42.06,-6.28,left,2017-12-15
"The accuser, identified as Maranda Richmond, is now 21.",0.45454545454545453,cnn,42.06,-6.28,left,2017-12-15
"She said she was staying in a living area of Louisville's Heart of Fire Church, where Johnson was pastor, when he drunkenly kissed and fondled her underneath her clothes, according to the investigative report.",0.45454545454545453,cnn,42.06,-6.28,left,2017-12-15
"The center got its hands on police documents about the accusations and interviewed Richmond, leading to its story on how Johnson allegedly forced himself on her when she was a teenager.",0.45454545454545453,cnn,42.06,-6.28,left,2017-12-15
"Johnson denied the allegations, a day after the center published its report, saying Richmond was motivated by his political opponents.",0.5454545454545454,cnn,42.06,-6.28,left,2017-12-15
"""This allegation concerning this young girl absolutely has no merit,"" he said.",0.5454545454545454,cnn,42.06,-6.28,left,2017-12-15
"""As a matter of fact, some of this I heard yesterday for the first time as I read the story.""",0.2727272727272727,cnn,42.06,-6.28,left,2017-12-15
"The same day Johnson held a news conference, Louisville detectives reopened the investigation, according to the Kentucky Center for Investigative Reporting.",0.36363636363636365,cnn,42.06,-6.28,left,2017-12-15
"Johnson posted a message on his Facebook page Wednesday evening, saying the accusations ""are false"" and ""only God knows the truth.""",0.2727272727272727,cnn,42.06,-6.28,left,2017-12-15
The post appears to have been deleted.,0.45454545454545453,cnn,42.06,-6.28,left,2017-12-15
"""GOD and only GOD knows the truth, nothing is the way they make it out to be.",0.36363636363636365,cnn,42.06,-6.28,left,2017-12-15
"Dan Johnson, Kentucky lawmaker who killed himself, claimed he raised woman from the dead",0.7272727272727273,nbc-news,43.21,-5.79,left-center,2017-12-15
"The Kentucky preacher-turned-politician who killed himself after being accused of molesting a teenager claimed he once raised a woman ""from the dead.""",0.9090909090909091,nbc-news,43.21,-5.79,left-center,2017-12-15
State Rep. Dan Johnson also declared that he watched the second hijacked plane slam into the World Trade Center from his hotel room and spent the next two weeks blessing bodies as they were removed from the ruins at a morgue he set up at Ground Zero.,0.45454545454545453,nbc-news,43.21,-5.79,left-center,2017-12-15
"Johnson also boasted about being a White House chaplain for both Bush presidents and Bill Clinton, and professed to have been a peacemaker in Los Angeles during the 1992 Rodney King riots.",0.5454545454545454,nbc-news,43.21,-5.79,left-center,2017-12-15
"These were some of the unlikely stories that ""Bishop Johnson"" posted on the web site of his Heart of Fire Church, in a rural county south of Louisville.",0.5454545454545454,nbc-news,43.21,-5.79,left-center,2017-12-15
Those tales were largely debunked in a Kentucky Center for Investigative Reporting expose that revealed that Johnson was accused by a then 17-year-old Maranda Richmond of drunkenly sexually assaulting her on New Year's Eve 2012.,0.45454545454545453,nbc-news,43.21,-5.79,left-center,2017-12-15
"Johnson, a 57-year-old Republican who represented mostly rural Bullitt County, denied the allegation Tuesday during a news conference at his church.",0.2727272727272727,nbc-news,43.21,-5.79,left-center,2017-12-15
He also defied bipartisan calls for him to resign.,0.2727272727272727,nbc-news,43.21,-5.79,left-center,2017-12-15
"""This allegation concerning this lady, this young girl, absolutely has no merit, these are unfounded accusations, totally,"" he said.",0.2727272727272727,nbc-news,43.21,-5.79,left-center,2017-12-15
"But a little after 7 p.m. Wednesday, Johnson killed himself with a gunshot to the head, police said, about two hours after posting another strident denial on a since-deleted Facebook post in which he also wrote that post-traumatic stress disorder fro",0.5454545454545454,nbc-news,43.21,-5.79,left-center,2017-12-15
"""I cannot handle it any longer .",0.45454545454545453,nbc-news,43.21,-5.79,left-center,2017-12-15
"BUT HEAVEN IS MY HOME,"" he wrote.",0.45454545454545453,nbc-news,43.21,-5.79,left-center,2017-12-15
"Not long after his death was ruled a suicide, Johnson's wife, Rebecca, who is the ""pastor"" of their church, announced Thursday that she will run for his seat and called her husband's death a ""high-tech lynching based on lies and half-truths.""",0.8181818181818182,nbc-news,43.21,-5.79,left-center,2017-12-15
KCIP found that Johnson's claim that he had brought a dead woman back to life while serving as a missionary in South America was based on a letter written by another preacher who admitted he hadn't seen the supposed miracle and only heard about it.,0.36363636363636365,nbc-news,43.21,-5.79,left-center,2017-12-15
"And while the Kentucky reporters found records that placed Johnson in New York City on or around 9/11, it's unlikely he watched a plane crash into one of the Twin Towers from ""The New Yorker Hotel,"" as he claimed on the web site.",0.2727272727272727,nbc-news,43.21,-5.79,left-center,2017-12-15
"The Wyndham New Yorker Hotel is not a mile away, as Johnson wrote.",0.2727272727272727,nbc-news,43.21,-5.79,left-center,2017-12-15
"It's about three miles north of Ground Zero, in Midtown Manhattan.",0.5454545454545454,nbc-news,43.21,-5.79,left-center,2017-12-15
"Before his suicide, Johnson made national news during his campaign for posting racist remarks online about former President Barack Obama and Michelle Obama.",0.7272727272727273,nbc-news,43.21,-5.79,left-center,2017-12-15
That didn't stop him from getting elected last year in an overwhelmingly white and conservative corner of Kentucky.,0.5454545454545454,nbc-news,43.21,-5.79,left-center,2017-12-15
"Johnson claimed to have a ""doctorate of divinity"" from a Des Moines, Iowa, bible school.",0.36363636363636365,nbc-news,43.21,-5.79,left-center,2017-12-15
The Kentucky Center for Investigative Reporting found no evidence to support that.,0.45454545454545453,nbc-news,43.21,-5.79,left-center,2017-12-15
"Matt Bevin, Rand Paul Respond to Dan Johnson's Death",0.6363636363636364,time-magazine,41.12,-7.42,left-center,2017-12-15
"After Kentucky State Rep. Dan Johnson died Wednesday in an apparent suicide amid allegations that he sexually assaulted a teenager, politicians in the state called for kindness and an end to ""nasty, vulgar comments"" about Johnson's death.",0.7272727272727273,time-magazine,41.12,-7.42,left-center,2017-12-15
The allegations against Johnson surfaced in an investigation published by the Kentucky Center for Investigative Reporting.,0.45454545454545453,time-magazine,41.12,-7.42,left-center,2017-12-15
"Maranda Richmond, who did not respond to TIME's request for comment on Thursday, told the news organization that Johnson molested her on New Year's Eve in 2012 when he was a pastor at the Heart of Fire Church.",0.36363636363636365,time-magazine,41.12,-7.42,left-center,2017-12-15
"The Kentucky Center for Investigative Reporting said it corroborated her account with her family members, Facebook messages she sent to Johnson and notes from her therapist.",0.5454545454545454,time-magazine,41.12,-7.42,left-center,2017-12-15
Richmond said that she reported the incident to the Louisville police in 2013.,0.36363636363636365,time-magazine,41.12,-7.42,left-center,2017-12-15
"Police investigated the matter, but never pressed charges.",0.6363636363636364,time-magazine,41.12,-7.42,left-center,2017-12-15
Louisville police did not immediately respond to TIME's request for comment.,0.36363636363636365,time-magazine,41.12,-7.42,left-center,2017-12-15
"After the allegations broke, Kentucky lawmakers on both sides of the aisle called for Johnson to resign.",0.5454545454545454,time-magazine,41.12,-7.42,left-center,2017-12-15
"At a press conference on Tuesday, Johnson denied the allegations and vowed to stay in the Kentucky House of Representatives.",0.5454545454545454,time-magazine,41.12,-7.42,left-center,2017-12-15
He was found dead on Wednesday night.,0.7272727272727273,time-magazine,41.12,-7.42,left-center,2017-12-15
"Paul Ham, the chairman of the Bullit County GOP, criticized the Kentucky Center for Investigative Reporting in a Thursday interview with the Washington Post.",0.36363636363636365,time-magazine,41.12,-7.42,left-center,2017-12-15
"""The story was based on hearsay: no arrest, no conviction, no jail time,"" he said.",0.45454545454545453,time-magazine,41.12,-7.42,left-center,2017-12-15
"""Back when the Constitution meant something, a man could stand before a jury of his peers.",0.45454545454545453,time-magazine,41.12,-7.42,left-center,2017-12-15
"But now, it's just, 'Let's just make some accusations and run with it.'",0.5454545454545454,time-magazine,41.12,-7.42,left-center,2017-12-15
"We're in a very bad place.""",0.36363636363636365,time-magazine,41.12,-7.42,left-center,2017-12-15
"Others, like Republican Reps. Wesley Morgan and Jeff Hoover, seemed to echo Ham's sentiment.",0.5454545454545454,time-magazine,41.12,-7.42,left-center,2017-12-15
"Hoover resigned as the House's Speaker last month (but kept his seat in the chamber) following allegations of sexual harassment, which he denied.",0.8181818181818182,time-magazine,41.12,-7.42,left-center,2017-12-15
"Michael Skoler, the president of Louisville Public Media, which owns the Kentucky Center for Investigative Reporting, said that it was ""deeply sad"" over Johnson's death, but noted that Johnson had declined their numerous requests to speak about Rich",0.8181818181818182,time-magazine,41.12,-7.42,left-center,2017-12-15
Other state lawmakers called for kindness in the wake of Johnson's death.,0.7272727272727273,time-magazine,41.12,-7.42,left-center,2017-12-15
"On Thursday afternoon, Johnson's widow said she wanted to take his seat in the Kentucky House.",0.2727272727272727,time-magazine,41.12,-7.42,left-center,2017-12-15
Widow of Kentucky State Rep. Dan Johnson says she'll pursue his seat,0.6363636363636364,fox-news,35.44,11.06,right,2017-12-15
"The wife of Kentucky State Rep. Dan Johnson, who killed himself on Wednesday amid a bombshell report's accusations of sexual assault, announced Thursday that she would pursue her husband's seat, saying ""his fight will go on.""",0.7272727272727273,fox-news,35.44,11.06,right,2017-12-15
"Dan Johnson, a preacher and a Republican, committed suicide Wednesday on a bridge in Mt.",0.6363636363636364,fox-news,35.44,11.06,right,2017-12-15
"Washington, according to Bullitt County Sheriff Donnie Tinnell.",0.2727272727272727,fox-news,35.44,11.06,right,2017-12-15
"The coroner confirmed that Johnson died of a single gunshot wound to the head, and the weapon was found near the 57-year-old's body.",0.7272727272727273,fox-news,35.44,11.06,right,2017-12-15
"The statement from Johnson's widow, Rebecca, said she was running for the position because ""these high-tech lynchings based on lies and half-truths can't be allowed to win the day.""",0.5454545454545454,fox-news,35.44,11.06,right,2017-12-15
"""Dan is gone but the story of his life is far from over,"" she said.",0.6363636363636364,fox-news,35.44,11.06,right,2017-12-15
His death occurred just days after the Kentucky Center for Investigative Reporting published a detailed set of allegations from a woman who claimed that Johnson sexually assaulted her when she was 17.,0.5454545454545454,fox-news,35.44,11.06,right,2017-12-15
"The lawmaker denied the accusations on Tuesday, calling them ""totally false.""",0.6363636363636364,fox-news,35.44,11.06,right,2017-12-15
"He said they were part of a nationwide strategy for defeating conservative Republicans, referencing claims also made against Republican Alabama Senate candidate Roy Moore.",0.36363636363636365,fox-news,35.44,11.06,right,2017-12-15
"But the next day, Johnson posted an ominous message on his Facebook page, part of which prompted his family to report him missing, the sheriff said Thursday.",0.5454545454545454,fox-news,35.44,11.06,right,2017-12-15
"In the post, he asked for people to take care of his wife and wrote that post-traumatic stress disorder ""is a sickness that will take my life, I cannot handle it any longer.",0.5454545454545454,fox-news,35.44,11.06,right,2017-12-15
"It has won this life, BUT HEAVEN IS MY HOME.""",0.45454545454545453,fox-news,35.44,11.06,right,2017-12-15
The post appears to have been removed.,0.6363636363636364,fox-news,35.44,11.06,right,2017-12-15
"The woman who made the accusations against Dan Johnson, Maranda Richmond, said she attended a New Year's Eve party at his house in 2012.",0.6363636363636364,fox-news,35.44,11.06,right,2017-12-15
"She reportedly fell asleep on the couch, and in the early hours of Jan. 1, 2013, claimed she woke up to him kneeling over her and alleged he assaulted her.",0.5454545454545454,fox-news,35.44,11.06,right,2017-12-15
Richmond said that she reported the episode but Louisville police closed the case without charges.,0.6363636363636364,fox-news,35.44,11.06,right,2017-12-15
The case has since been reopened.,0.36363636363636365,fox-news,35.44,11.06,right,2017-12-15
"Johnson was elected to the State Legislature in 2016, part of a wave of Republican victories that gave the GOP control of the Kentucky House of Representatives for the first time in nearly 100 years.",0.45454545454545453,fox-news,35.44,11.06,right,2017-12-15
"The pastor of Heart of Fire church in Louisville, Johnson sponsored a number of bills involving religious liberty and teaching the Bible in public schools.",0.2727272727272727,fox-news,35.44,11.06,right,2017-12-15
But he was mostly out of the spotlight until the investigative story broke.,0.2727272727272727,fox-news,35.44,11.06,right,2017-12-15
Widow of Kentucky state rep Dan Johnson plans to run for his seat,0.14545454545454542,rare,,,right-center,2017-12-15
"""Dan is gone,"" says Rebecca Johnson, wife of deceased Kentucky state rep Dan Johnson, ""but the story of his life is far from over.""",0.29090909090909095,rare,,,right-center,2017-12-15
Rep. Dan Johnson took his life on a bridge in Mt.,0.509090909090909,rare,,,right-center,2017-12-15
"Washington, Kentucky on Wednesday.",0.07272727272727271,rare,,,right-center,2017-12-15
"Now, according to WRAL, his widow plans to run for the office he vacated with a handgun.",0.6545454545454544,rare,,,right-center,2017-12-15
RELATED: An investigation into a state lawmaker accused of child molestation has ended with a single gunshot,0.5818181818181819,rare,,,right-center,2017-12-15
Johnson stood accused of molestation of a 17-year-old girl in an apartment underneath the Heart of Fire City Church's Fellowship Hall on New Year's Eve 2012.,0.43636363636363645,rare,,,right-center,2017-12-15
An investigation by the Kentucky Center for Investigative Reporting found that a case to the allegations was closed.,0.29090909090909095,rare,,,right-center,2017-12-15
"Following their report and an on-the-record interview with alleged victim Maranda Richmond, who is now 21, police reopened the case.",0.14545454545454542,rare,,,right-center,2017-12-15
No charges were filed before Johnson took his life.,0.29090909090909095,rare,,,right-center,2017-12-15
"""These high-tech lynchings based on lies and half-truths can't be allowed to win the day,"" said Rebecca Johnson, who stood by her husband's side as he dismissed the molestation allegations in a press conference on Tuesday.",0.43636363636363645,rare,,,right-center,2017-12-15
"That press conference saw Rep. Johnson say he was ""mad as can be"" about the charges, which he said were made into ""political stones and political rocks.""",0.5818181818181819,rare,,,right-center,2017-12-15
"He said the allegations against him were ""something that's totally false.""",0.43636363636363645,rare,,,right-center,2017-12-15
"Rebecca Johnson says she has stood by her husband's side for 30 years and plans to continue his ""fight.""",0.509090909090909,rare,,,right-center,2017-12-15
"In expressing their condolences, Louisville Public Media, which oversees the Kentucky Center for Investigative Reporting, says they contacted Johnson several times in the course of writing their story, which called Johnson's life a ""long con"" and a ",0.509090909090909,rare,,,right-center,2017-12-15
"They say they did not receive a response, but added:",0.43636363636363645,rare,,,right-center,2017-12-15
"All of us at Louisville Public Media are deeply sad to hear that State Representative Dan Johnson has died, apparently of suicide.",0.29090909090909095,rare,,,right-center,2017-12-15
"We grieve for his family, friends, church community and constituents.",0.07272727272727271,rare,,,right-center,2017-12-15
Our Kentucky Center for Investigative Reporting released a report on Johnson this week.,0.14545454545454542,rare,,,right-center,2017-12-15
"Our aim, as always, is to provide the public with fact-based, un3 reporting and hold public officials accountable for their actions.",0.14545454545454542,rare,,,right-center,2017-12-15
"As part of our process, we reached out to Representative Johnson numerous times over the course of a seven-month investigation.",0.14545454545454542,rare,,,right-center,2017-12-15
Wife to run for seat of Kentucky lawmaker who killed self,0.36363636363636365,daily-mail,31.81,4.17,right,2017-12-15
The widow of the Kentucky lawmaker who killed himself after a sexual assault allegation surfaced this week said she will run for his seat because he was pushed to suicide by 'high-tech lynching mobs'.,0.8,daily-mail,31.81,4.17,right,2017-12-15
"In a statement on Thursday, the day after Dan Johnson's suicide, Rebecca Johnson said she has been fighting behind her husband for 30 years and 'his fight will go on.'",0.36363636363636365,daily-mail,31.81,4.17,right,2017-12-15
"'Dan is gone but the story of his life is far from over,' she said.",0.29090909090909095,daily-mail,31.81,4.17,right,2017-12-15
'These high-tech lynchings based on lies and half-truths can't be allowed to win the day.',0.6545454545454544,daily-mail,31.81,4.17,right,2017-12-15
"Johnson, who is best known for a racist comment likening Barack and Michelle Obama to monkeys, shot himself Wednesday night near a road in a secluded area.",0.36363636363636365,daily-mail,31.81,4.17,right,2017-12-15
"Two days earlier, the Kentucky Center for Investigative Reporting published a story detailing allegations that he sexually assaulted a 17-year-old girl in his basement in 2013.",0.43636363636363645,daily-mail,31.81,4.17,right,2017-12-15
"On Monday the paper published a graphic account quoting Maranda Richmond as saying that Johnson had sexually assaulted her in his basement on January 1, 2013.",0.36363636363636365,daily-mail,31.81,4.17,right,2017-12-15
"According to court documents, Richmond was living at Heart of Fire City Church accommodations.",0.43636363636363645,daily-mail,31.81,4.17,right,2017-12-15
"Richmond said the married lawmaker groped her and stuck his tongue in her mouth, then put his hand down her pants and slipped it inside her vagina.",0.5818181818181819,daily-mail,31.81,4.17,right,2017-12-15
"She said she begged him to stop, but Johnson kept telling her she would like it.",0.509090909090909,daily-mail,31.81,4.17,right,2017-12-15
"Eventually, he left and she slipped away early that morning before he woke up.",0.509090909090909,daily-mail,31.81,4.17,right,2017-12-15
Richmond went to the police.,0.43636363636363645,daily-mail,31.81,4.17,right,2017-12-15
"Records show investigators with the Louisville Metro Police Department recorded a phone call between Johnson and Richmond's father, Clifford, in which Johnson said he 'couldn't imagine doing that to Maranda.'",0.29090909090909095,daily-mail,31.81,4.17,right,2017-12-15
