text,label,source,reliability,bias,source_bias,date
"""Even though our campaign went ahead, we decided not to cooperate with SCL.",0.509090909090909,the-new-york-times,40.94,-7.94,left-center,2018-03-18
"No contracts were signed.""",0.509090909090909,the-new-york-times,40.94,-7.94,left-center,2018-03-18
"But Christopher Wylie, who helped found Cambridge Analytica and develop the company's voter-profiling technology, said Lukoil showed interest in how the company used data to tailor messaging to American voters.",0.509090909090909,the-new-york-times,40.94,-7.94,left-center,2018-03-18
"""I remember being super confused,"" said Mr. Wylie, who took part in one of the Lukoil meetings.",0.6545454545454544,the-new-york-times,40.94,-7.94,left-center,2018-03-18
Senate Judiciary Dem calls on Zuckerberg to testify before committee,0.509090909090909,hill-reporter,32.56,-13.11,left-center,2018-03-18
Sen. Amy Klobuchar Amy Jean KlobucharOvernight Health Care: Trump eases rules on insurance outside ObamaCare | HHS office on religious rights gets 300 complaints in a month | GOP chair eyes opioid bill vote by Memorial Day Overnight Regulation: Trump,0.509090909090909,hill-reporter,32.56,-13.11,left-center,2018-03-18
"""Facebook breach: This is a major breach that must be investigated.",0.509090909090909,hill-reporter,32.56,-13.11,left-center,2018-03-18
It's clear these platforms can't police themselves.,0.5818181818181819,hill-reporter,32.56,-13.11,left-center,2018-03-18
I've called for more transparency & accountability for online political ads.,0.43636363636363645,hill-reporter,32.56,-13.11,left-center,2018-03-18
"They say ""trust us.""",0.509090909090909,hill-reporter,32.56,-13.11,left-center,2018-03-18
"Mark Zuckerberg needs to testify before Senate Judiciary,"" Klobuchar, a member of the committee, wrote on Twitter.",0.5818181818181819,hill-reporter,32.56,-13.11,left-center,2018-03-18
"Her comment came in response to the news that  Cambridge Analytica, the data firm used by the Trump campaign, obtained private information of more than 50 million people without their permission for campaign uses.",0.509090909090909,hill-reporter,32.56,-13.11,left-center,2018-03-18
It was also reported that senior members of Cambridge Analytica met with Russian business executives ahead of the 2016 campaign.,0.509090909090909,hill-reporter,32.56,-13.11,left-center,2018-03-18
Facebook suspended the group on Friday for not fully deleting all of the data it had obtained.,0.5818181818181819,hill-reporter,32.56,-13.11,left-center,2018-03-18
Klobucar also said that Cambridge Analytica taking data on Facebook users is further justification for regulating technology companies via her Honest Ads Act.,0.7272727272727273,hill-reporter,32.56,-13.11,left-center,2018-03-18
"She introduced the bill in late 2017, which would hold internet platforms like Facebook to similar political ad disclosure standards as radio, TV and print outlets.",0.6545454545454544,hill-reporter,32.56,-13.11,left-center,2018-03-18
"Sen. Mark Warner Mark Robert WarnerLawmakers worry about rise of fake video technology Mueller indictment reveals sophisticated Russian manipulation effort GOP cautious, Dems strident in reaction to new indictments MORE (D-Va.) who co-sponsored the ",0.43636363636363645,hill-reporter,32.56,-13.11,left-center,2018-03-18
"""Whether it's allowing Russians to purchase political ads, or extensive micro-targeting based on ill-gotten user data, it's clear that, left unregulated, this market will continue to be prone to deception and lacking in transparency,"" he said in a s",0.43636363636363645,hill-reporter,32.56,-13.11,left-center,2018-03-18
"""This is another strong indication of the need for Congress to quickly pass the Honest Ads Act to bring transparency and accountability to online political advertisements.""",0.509090909090909,hill-reporter,32.56,-13.11,left-center,2018-03-18
"Facebook's general counsel, Colin Stretch, testified in front of the Judiciary Committee alongside top lawyers from Google and Twitter, at the end of October about Russian manipulation on its platform.",0.5818181818181819,hill-reporter,32.56,-13.11,left-center,2018-03-18
"At the time, some lawmakers said that they would also like to see top executives from the firm appear before Congress.",0.36363636363636365,hill-reporter,32.56,-13.11,left-center,2018-03-18
"The social media platform has already been under increased scrutiny after it was revealed that Russian actors potentially linked to Russia spent $100,000 on political advertisements on the site during the presidential campaign.",0.5818181818181819,hill-reporter,32.56,-13.11,left-center,2018-03-18
Facebook has been cooperating with investigators.,0.5818181818181819,hill-reporter,32.56,-13.11,left-center,2018-03-18
The information about the ads was handed to Congress and special counsel Robert Mueller Robert Swan MuellerSasse: US should applaud choice of Mueller to lead Russia probe MORE for their investigations into Russian interference in the election.,0.6545454545454544,hill-reporter,32.56,-13.11,left-center,2018-03-18
Trump-linked Cambridge Analytica tapped 50M Facebook profiles,0.5818181818181819,daily-mail,31.81,4.17,right,2018-03-18
A data analysis firm employed by President Donald Trump's 2016 campaign tapped the Facebook profiles of more than 50 million users without their permission.,0.5818181818181819,daily-mail,31.81,4.17,right,2018-03-18
"The move allowed Cambridge Analytica to capitalize on the private social media activity of a large portion of the U.S. electorate, developing techniques that underpinned its work on President Trump's campaign in 2016, according to two major reports o",0.509090909090909,daily-mail,31.81,4.17,right,2018-03-18
"One of the largest data leaks in Facebook history allowed Cambridge Analytica, which had ties to Trump campaign strategist Steve Bannon, to develop techniques that formed the basis of its work on the Trump campaign, The New York Times and The Guardia",0.6545454545454544,daily-mail,31.81,4.17,right,2018-03-18
"Facebook said it has suspended Cambridge Analytica- it has also suspended University of Cambridge psychology professor Aleksandr Kogan who created the harvesting app in question; and another individual, Christopher Wylie of Eunoia Technologies (previ",0.5818181818181819,daily-mail,31.81,4.17,right,2018-03-18
"Wylie, former Cambride Analytica worker, turned whistleblower has become a focal point in the illegitimate acquisitions of the 50million Facebook profiles and user data.",0.5818181818181819,daily-mail,31.81,4.17,right,2018-03-18
"Wylie, who is now just 28-years-old, and arguably a tech prodigy, told the Guardian he has a paper trail of the harvested 50million-user data, along with receipts, invoices, emails and legal letters - that all support how between June and August of 2",0.5818181818181819,daily-mail,31.81,4.17,right,2018-03-18
"Most damning of all, in 2014, he had a letter from Facebook's own lawyers admitting that Cambridge Analytica had acquired the data illegitimately.",0.5818181818181819,daily-mail,31.81,4.17,right,2018-03-18
"By opening up his records during the time of his employment with Cambridge Analytica, he is breaking a non-disclosure agreement and risks being sued.",0.7272727272727273,daily-mail,31.81,4.17,right,2018-03-18
"Additionally, he is breaking the confidence of Steve Bannon and Robert Mercer, the CEO of Cambridge Analytica.",0.5818181818181819,daily-mail,31.81,4.17,right,2018-03-18
"In 2014, Bannon had become a board member for Cambridge Analytica, and went on to become Trump's chief campaign strategist.",0.36363636363636365,daily-mail,31.81,4.17,right,2018-03-18
Facebook said it suspended Cambridge Analytica over allegations that it kept the improperly obtained user data after telling Facebook it had been deleted.,0.509090909090909,daily-mail,31.81,4.17,right,2018-03-18
"In a blog post, Facebook explained that Cambridge Analytica had years ago received user data from a Facebook app that purported to be a psychological research tool, though the firm was not authorized to have the information.",0.29090909090909095,daily-mail,31.81,4.17,right,2018-03-18
"Cambridge Analytica later certified in 2015 that it had destroyed the information it had received, according to Facebook, although the social network said it received reports 'several days ago' that not all the data was deleted.",0.7272727272727273,daily-mail,31.81,4.17,right,2018-03-18
Facebook says it is investigating.,0.5818181818181819,daily-mail,31.81,4.17,right,2018-03-18
Cambridge Analytica denied wrongdoing in a statement.,0.5818181818181819,daily-mail,31.81,4.17,right,2018-03-18
"It said the parent company's SCL Elections unit hired Kogan to undertake 'a large scale research project in the U.S.,' but subsequently deleted all data it received from Kogan's company after learning that Kogan had obtained data in violation of Fac",0.5818181818181819,daily-mail,31.81,4.17,right,2018-03-18
"According to Cambridge Analytica's parent company, SCL Elections, the firm said none of Kogan's data was used in its 2016 election work for the 'avoidance of doubt.'",0.43636363636363645,daily-mail,31.81,4.17,right,2018-03-18
Kogan did not immediately reply to an emailed request for comment.,0.509090909090909,daily-mail,31.81,4.17,right,2018-03-18
Wylie could not immediately be located.,0.509090909090909,daily-mail,31.81,4.17,right,2018-03-18
"The Facebook blog post, written by deputy general counsel Paul Grewal, cited the 'public prominence' of Cambridge Analytica, called the alleged data retention an 'unacceptable violation of trust' and said the social network will take legal action if",0.509090909090909,daily-mail,31.81,4.17,right,2018-03-18
Facebook faces new calls for regulation,0.21818181818181823,rte,,,least,2018-03-18
Facebook faces new calls for regulation from within US Congress and was hit with questions about personal data safeguards after reports that a political consultant gained inappropriate access to 50 million users' data starting in 2014.,0.509090909090909,rte,,,least,2018-03-18
"Facebook disclosed the issue in a blog post on Friday, hours before media reports that conservative-leaning Cambridge Analytica, a data company known for its work on Donald Trump's 2016 presidential campaign, was given access to the data and may not ",0.6545454545454544,rte,,,least,2018-03-18
"The scrutiny presented a new threat to Facebook's reputation, which was already under attack over Russia's alleged use of Facebook tools to sway American voters before and after the 2016 US elections.",0.509090909090909,rte,,,least,2018-03-18
"""It's clear these platforms can't police themselves,"" Democratic US Senator Amy Klobuchar tweeted.",0.36363636363636365,rte,,,least,2018-03-18
"""They say 'trust us.'",0.36363636363636365,rte,,,least,2018-03-18
"Mark Zuckerberg needs to testify before Senate Judiciary,"" she added, referring to Facebook's CEO and a committee she sits on.",0.509090909090909,rte,,,least,2018-03-18
"Facebook said the root of the problem was that researchers and Cambridge Analytica lied to it and abused its policies, but critics have thrown the blame at Facebook as well, demanding answers on behalf of users and calling for new regulation.",0.509090909090909,rte,,,least,2018-03-18
"Facebook insisted the data was misused but not stolen, because users gave permission, sparking a debate about what constitutes a hack that must be disclosed to customers.",0.36363636363636365,rte,,,least,2018-03-18
"""The lid is being opened on the black box of Facebook's data practices, and the picture is not pretty,"" said Frank Pasquale, a University of Maryland law professor who has written about Silicon Valley's use of data.",0.43636363636363645,rte,,,least,2018-03-18
Pasquale said Facebook's response that data had not technically been stolen seemed to obfuscate the central issue that data was apparently used in a way contrary to the expectations of users.,0.29090909090909095,rte,,,least,2018-03-18
"Democratic US Senator Mark Warner said the episode bolstered the need for new regulations about internet advertising, describing the industry as the ""Wild West.""",0.36363636363636365,rte,,,least,2018-03-18
"""Whether it's allowing Russians to purchase political ads, or extensive micro-targeting based on ill-gotten user data, it's clear that, left unregulated, this market will continue to be prone to deception and lacking in transparency,"" he said.",0.29090909090909095,rte,,,least,2018-03-18
"With Republicans controlling the Senate's majority, though, it was not clear if Klobuchar and Warner would prevail.",0.43636363636363645,rte,,,least,2018-03-18
"The New York Times and London's Observer reported that private information from more than 50 million Facebook users improperly ended up in the hands of Cambridge Analytica, and the information has not been deleted despite Facebook's demands beginnin",0.5818181818181819,rte,,,least,2018-03-18
"Some 270,000 people allowed use of their data by a researcher, who scraped the data of all their friends as well, a move allowed by Facebook until 2015.",0.509090909090909,rte,,,least,2018-03-18
"The researcher sold the data to Cambridge, which was against Facebook rules, the newspapers said.",0.509090909090909,rte,,,least,2018-03-18
Cambridge Analytica worked on Trump's 2016 campaign.,0.29090909090909095,rte,,,least,2018-03-18
"A Trump campaign official said, though, that it used Republican data sources, not Cambridge Analytica, for its voter information.",0.509090909090909,rte,,,least,2018-03-18
"Facebook, in a series of written statements, said its policies had been broken by Cambridge Analytica and researchers and that it was exploring legal action.",0.36363636363636365,rte,,,least,2018-03-18
Cambridge Analytica in turn said it had deleted all the data and that the company supplying it had been responsible for obtaining it.,0.36363636363636365,rte,,,least,2018-03-18
Trump-linked Cambridge Analytica suspended from Facebook after 'harvesting 50 million profiles',0.43636363636363645,telegraph,,,right-center,2018-03-18
A data analytics firm that worked with Donald Trump's election team has been suspended from Facebook amid claims it harvested 50 million profiles from the social media site.,0.36363636363636365,telegraph,,,right-center,2018-03-18
Cambridge Analytica got information from an academic who was asking Facebook users to fill out surveys via an app as it sought to develop an effective campaigning tool.,0.43636363636363645,telegraph,,,right-center,2018-03-18
"Around 270,000 Facebook users download the app but it allowed for information about hundreds of their online friends to be obtained without consent, a whistleblower claimed.",0.29090909090909095,telegraph,,,right-center,2018-03-18
"Christopher Wylie, the former research director at Cambridge Analytica, went public about the alleged behaviour after admitting regret over his involvement.",0.36363636363636365,telegraph,,,right-center,2018-03-18
"""It allowed us to move into the hearts and minds of American voters in a way that had never been done before,"" Mr Wylie told Channel 4 News.",0.43636363636363645,telegraph,,,right-center,2018-03-18
"Elizabeth Denham, the Information Commissioner, said she would be ""investigating the circumstances in which Facebook data may have been illegally acquired and used"".",0.43636363636363645,telegraph,,,right-center,2018-03-18
Maura Healey to probe Brit data firm,0.36363636363636365,boston-herald,36.31,9.68,right-center,2018-03-18
"Massachusetts Attorney General Maura Healey is launching a probe into British-based Cambridge Analytica, a data-analysis firm that worked for President Trump's 2016 campaign, over allegations that it held onto improperly obtained user data after tell",0.29090909090909095,boston-herald,36.31,9.68,right-center,2018-03-18
"""Massachusetts residents deserve answers immediately from Facebook and Cambridge Analytica,"" Healey said in a post on Twitter yesterday.",0.29090909090909095,boston-herald,36.31,9.68,right-center,2018-03-18
"""We are launching an investigation.""",0.29090909090909095,boston-herald,36.31,9.68,right-center,2018-03-18
"Healey's office has already reached out to Facebook to determine what data was accessed, how it was used, and whether Bay State residents were impacted.",0.36363636363636365,boston-herald,36.31,9.68,right-center,2018-03-18
Healey's announcement came hours after the social network issued a blog post explaining its decision to suspended the firm.,0.43636363636363645,boston-herald,36.31,9.68,right-center,2018-03-18
"Years ago, Facebook said, Cambridge Analytica received user data from a Facebook app that purported to be a psychological research tool, though the firm wasn't authorized to have that information.",0.36363636363636365,boston-herald,36.31,9.68,right-center,2018-03-18
"About 270,000 people downloaded the app and shared their personal details with it, Facebook said.",0.43636363636363645,boston-herald,36.31,9.68,right-center,2018-03-18
"Cambridge Analytica later certified in 2015 that it had destroyed the information that it received, according to Facebook, although the social network said it received reports ""several days ago"" that not all of the data was deleted.",0.36363636363636365,boston-herald,36.31,9.68,right-center,2018-03-18
"While it investigates the matter, Facebook has also suspended the access of Cambridge Analytica's parent company, Strategic Communication Laboratories; the academic who created the app in question, a University of Cambridge psychology professor named",0.36363636363636365,boston-herald,36.31,9.68,right-center,2018-03-18
Exactly why the handling of this data warranted both suspension and Facebook's unusual public explanation of the move wasn't clear.,0.36363636363636365,boston-herald,36.31,9.68,right-center,2018-03-18
"The blog post, written by Facebook deputy general counsel Paul Grewal, cited the ""public prominence"" of Cambridge Analytica, called the alleged data retention an ""unacceptable violation of trust"" and said the social network will take legal action if",0.5818181818181819,boston-herald,36.31,9.68,right-center,2018-03-18
"In a statement, a Cambridge Analytica spokesman denied any wrongdoing.",0.509090909090909,boston-herald,36.31,9.68,right-center,2018-03-18
"He said the parent company's SCL Elections unit hired Kogan to undertake ""a large-scale research project in the U.S.,"" but later learned that he had obtained data in violation of Facebook policies, and subsequently deleted all data it received from ",0.5818181818181819,boston-herald,36.31,9.68,right-center,2018-03-18
"For the ""avoidance of doubt,"" the spokesman said, none of Kogan's data was used in Cambridge Analytica's 2016 election work.",0.43636363636363645,boston-herald,36.31,9.68,right-center,2018-03-18
Kogan did not immediately reply to an emailed request for comment.,0.36363636363636365,boston-herald,36.31,9.68,right-center,2018-03-18
Wylie could not immediately be located.,0.36363636363636365,boston-herald,36.31,9.68,right-center,2018-03-18
Cambridge Analytica CEO Alexander Nix also disclosed in November that the company reached out to WikiLeaks founder Julian Assange during the campaign to request emails related to the Hillary Clinton campaign.,0.29090909090909095,boston-herald,36.31,9.68,right-center,2018-03-18
Nix said Assange said no.,0.21818181818181823,boston-herald,36.31,9.68,right-center,2018-03-18
"Facebook, Establishment Media Spar over Data Obtained by Cambridge Analytica",0.21818181818181823,breitbart,31.15,13.7,right-extream,2018-03-18
"Facebook recently banned Strategic Communication Laboratories, the parent company of Cambridge Analytica, from using their platform.",0.36363636363636365,breitbart,31.15,13.7,right-extream,2018-03-18
"According to Facebook, the data analytics firm - which played a key role in the Trump and Brexit campaigns - improperly obtained user data from University of Cambridge psychologist Aleksandr Kogan.",0.43636363636363645,breitbart,31.15,13.7,right-extream,2018-03-18
"Although Kogan obtained the data from Facebook in accordance with their policies, the social media company claims that he then passed the data to Cambridge Analytica, and to Christopher Wylie, an employee of Eunoia Technologies.",0.36363636363636365,breitbart,31.15,13.7,right-extream,2018-03-18
Kogan and Wylie have also been banned from Facebook.,0.509090909090909,breitbart,31.15,13.7,right-extream,2018-03-18
"Facebook conceded that Kogan ""gained access to this information in a legitimate way and through the proper channels that governed all developers on Facebook at that time,"" but said that by passing the data to third parties ""he did not subsequently ab",0.43636363636363645,breitbart,31.15,13.7,right-extream,2018-03-18
"Nevertheless, The Observer, a British newspaper owned by the left-leaning Guardian Media Group, claimed that Cambridge Analytica's use of the data constituted ""one of the tech giant's biggest ever data breaches.""",0.43636363636363645,breitbart,31.15,13.7,right-extream,2018-03-18
"The New York Times also framed the incident as a ""breach"" and a ""data leak.""",0.43636363636363645,breitbart,31.15,13.7,right-extream,2018-03-18
Facebook strongly disputes this version of events.,0.43636363636363645,breitbart,31.15,13.7,right-extream,2018-03-18
"According to The Observer, the social media giant's lawyers warned the newspaper that their claims were ""false and defamatory,"" and reserved their legal position.",0.43636363636363645,breitbart,31.15,13.7,right-extream,2018-03-18
"The New York Times and Observer stories are based on the testimony of Christopher Wylie, a former Cambridge Analytica employee who left the company in 2014 - two years before the 2016 election.",0.43636363636363645,breitbart,31.15,13.7,right-extream,2018-03-18
"When asked if his use of Facebook data constituted a ""hack,"" Wylie told The Observer that he assumed that it was all ""entirely legal and above board.""",0.509090909090909,breitbart,31.15,13.7,right-extream,2018-03-18
Cambridge Analytica CEO Alexander Nix was previously questioned by British politicians on his company's role in Brexit at the Trump campaign.,0.43636363636363645,breitbart,31.15,13.7,right-extream,2018-03-18
"Nix has said that his company uses ""data and technology to engage with voters in a more informed and relevant way.",0.509090909090909,breitbart,31.15,13.7,right-extream,2018-03-18
"That can only be good for politics and democracy.""",0.36363636363636365,breitbart,31.15,13.7,right-extream,2018-03-18
The company is partially owned by the family of hedge fund manager Robert Mercer.,0.36363636363636365,breitbart,31.15,13.7,right-extream,2018-03-18
Former Breitbart News executive director Stephen K. Bannon previously worked as vice president of Cambridge Analytica's board.,0.36363636363636365,breitbart,31.15,13.7,right-extream,2018-03-18
The company worked for the presidential campaigns of both Sen. Ted Cruz and Donald Trump.,0.43636363636363645,breitbart,31.15,13.7,right-extream,2018-03-18
"In a statement, Cambridge Analytica denied that they had knowingly breached Facebook's terms of service.",0.43636363636363645,breitbart,31.15,13.7,right-extream,2018-03-18
"""Cambridge Analytica fully complies with Facebook's terms of service and is currently in touch with Facebook following its recent statement that it had suspended the company from its platform, in order to resolve this matter as quickly as possible"" ",0.509090909090909,breitbart,31.15,13.7,right-extream,2018-03-18
"""Cambridge Analytica's Commercial and Political divisions use social media platforms for outward marketing, delivering data-led and creative content to targeted audiences.",0.36363636363636365,breitbart,31.15,13.7,right-extream,2018-03-18
Trump Campaign Purloined Data Of 50 Million Facebook Users,0.43636363636363645,the-national-memo-(blog),,,left,2018-03-18
"Cambridge Analytica, the Trump campaign's data firm, harvested private information from more than 50 million unwitting Facebook users in what is being described as one of the largest data breaches in the social media giant's history.",0.5818181818181819,the-national-memo-(blog),,,left,2018-03-18
"That data - taken without authorization - was used to build a digital operation that guided Trump's campaign for the presidency, according to a pair of bombshell reports published Saturday by the New York Times and The Observer of London.",0.6545454545454544,the-national-memo-(blog),,,left,2018-03-18
The revelation that a firm working for a U.S. presidential candidate stole personal data from millions of Americans has sparked outcry across the country.,0.509090909090909,the-national-memo-(blog),,,left,2018-03-18
"Within hours of being published, the explosive reports had already prompted at least one state attorney general to launch an investigation into the allegedly fraudulent practices.",0.509090909090909,the-national-memo-(blog),,,left,2018-03-18
"But Trump, whose campaign paid Cambridge Analytica nearly $6 million for its work, has not said a word about the massive scandal engulfing the data company that the campaign once touted as integral to Trump's victory.",0.5818181818181819,the-national-memo-(blog),,,left,2018-03-18
"His silence on the matter raises a host of startling questions, particularly given that he has already started making moves to organize his re-election campaign - and until he says otherwise, it's reasonable to wonder if he plans to rely on the firm ",0.509090909090909,the-national-memo-(blog),,,left,2018-03-18
The Trump campaign hired Cambridge Analytica in June 2016.,0.36363636363636365,the-national-memo-(blog),,,left,2018-03-18
