text,source_party,label,source,reliability,bias
"21 Limitation of Liability; Disclaimers Except with respect to indemnification and confidentiality obligations, in no event will Client, on the one hand, and Publisher, any Service Provider, any Vendor and any of their respective affiliates, on the other hand, be liable to the other or any third party for any consequential, incidental, indirect, exemplary, special or punitive damages whatsoever (including damages for loss of use, revenue or profit, business interruption and loss of information or data), whether arising out of breach of contract, tort (including negligence) or otherwise, regardless of whether such damage was foreseeable and whether or not such party has been advised of the possibility of such damages.",Lean Left,0,san-diego-union-tribune,45.68,-1.76
"ArtReach received $74,501 in combined grants for its programs, which use visual art in schools and the community to promote the advancement of social, racial, and economic equity.",Lean Left,0,san-diego-union-tribune,45.68,-1.76
"Liyan Chen is joined by her son, Kai, as she chops roast duck for her congee, a thick porridge of leftover roast meat, jasmine rice and water, at home in Montclair, N.J. (Rachel Vanni / The New York Times) Instant Pot Congee Makes 4 to 6 servings 2 to 3 cups diced roasted duck, chicken or turkey (preferably dark meat), with some of the skin 1 cup jasmine rice, rinsed 1½ teaspoon fine salt, plus more to taste ½ teaspoon ground white pepper, plus more to taste 2 cups chopped romaine (optional) Thinly sliced scallions, for garnish Thinly slivered ginger, soy sauce, sesame oil or chile crisp, for garnish (optional) In the pot of an electric pressure cooker, add roasted meat, rice, salt, pepper and 6 cups water.",Lean Left,0,san-diego-union-tribune,45.68,-1.76
"Years later, family members participating in genetic testing found they had a genetic mutation that increases the family’s risk of frontotemporal dementia.",Lean Left,0,san-diego-union-tribune,45.68,-1.76
SPRING VALLEY Enchanted Village: Noah Homes hosts its Enchanted Village from 5 to 8 p.m. Dec. 15 through Dec. 22 at 12526 Campo Road.,Lean Left,0,san-diego-union-tribune,45.68,-1.76
"Donald Parham dropped a huge, easy catch that could have ended things.",Lean Left,0,san-diego-union-tribune,45.68,-1.76
"And in the new Washington governed by President Barack Obama and a Democratic Congress, K Streeters with Democratic credentials are poised to exploit their party ties more than ever.",Left,1,alternet,32.71,-14.76
"Flores, who is Black, was fired last month by Miami after leading the Dolphins to a 24-25 record over three years.",Left,0,alternet,32.71,-14.76
The company moved its alfalfa-growing operations out of Saudi Arabia - another water-scarce region suffering from longterm drought.,Left,0,alternet,32.71,-14.76
"Police have also detained at least 28 people in riots in Réunion, a French territory in the Indian Ocean, according to authorities there.",Left,0,alternet,32.71,-14.76
"Investigated by Review Board 2005 after woman reported her brother, who died by suicide in 1993, may have been abused in the 1970s.",Left,0,alternet,32.71,-14.76
"The lawyer who argued against Trump’s immunity in the appeal heard last December, Joseph Sellers, told POLITICO last week that he had no update from the court on where it stands.",Left,0,alternet,32.71,-14.76
"Only about half the states, mostly in the Western U.S., allow some form of citizen ballot initiative.",Left,0,alternet,32.71,-14.76
"Disclosure: The Association of Electric Companies of Texas (AECT), CenterPoint Energy, Rice University, the Texas Alliance of Energy Producers and Texas Pipeline Association have been financial supporters of The Texas Tribune, a nonprofit, nonpartisan news organization that is funded in part by donations from members, foundations and corporate sponsors.",Left,0,alternet,32.71,-14.76
And they have ignored their sworn duty to protect the American public so they can pander to perceived political constituencies.,Lean Right,1,boston-herald,36.31,9.68
"Part of the stress from the reintroduction is the potential to lose animals and income, Deal said.",Lean Right,0,boston-herald,36.31,9.68
And then - in a game that featured 16 lead changes and incredible shot-making on both sides - he made the difference late.,Lean Right,0,boston-herald,36.31,9.68
"When that happens, Breslow said the Red Sox will be ready.",Lean Right,0,boston-herald,36.31,9.68
"He plays with so much passion and energy, playing on a back-to-back and with a little bit of fatigue ... I’m so happy for him.",Lean Right,0,boston-herald,36.31,9.68
Obviously you guys have been here longer than me watching Patriots games.,Lean Right,0,boston-herald,36.31,9.68
"People just love a good story She has the unenviable task of performing Don’t Rain on My Parade by Jewish pop culture’s ultimate icon, Barbra Streisand.",Lean Left,1,the-guardian,40.67,-7.97
"Holly is trying to get into the Teamsters union by working on commercial shoots so she can better look after her ailing teenage son, and is meant to be an ace driver who takes part in desert drag races with her souped-up black truck.",Lean Left,0,the-guardian,40.67,-7.97
"People shower the band with cash, an act of showing off, but done in the spirit of fun.",Lean Left,0,the-guardian,40.67,-7.97
"Until that becomes clear, patients and the NHS will continue to be caught in the middle.",Lean Left,0,the-guardian,40.67,-7.97
"But even before this infernal summer, the cheap, spontaneous August holiday on our islands was becoming unattainable for many ordinary mainlanders.",Lean Left,1,the-guardian,40.67,-7.97
"Meet the Fockers is the sequel to the cringe-comedy Meet the Parents, in which Stiller’s girlfriend’s insufferably attractive and charismatic ex-boyfriend (Wilson) turns up, again briefly, playing a New Age interfaith priest.",Lean Left,1,the-guardian,40.67,-7.97
"They had also won the Asian Cup seven times in a row and looked fearsome through the earlier rounds of the 1999 World Cup - three wins from three in the group stage, with 12 goals scored and only two conceded, followed by a 2-0 quarter-final victory over Russia and a 5-0 thrashing of Norway in the semis.",Lean Left,0,the-guardian,40.67,-7.97
"He still promotes that general ambition, but with synthetic enthusiasm that contains more exasperation than confidence.",Lean Left,1,the-guardian,40.67,-7.97
"Tragically, America has already endured painful consequences from the similarly wrongheaded settlement of masses of Afghans resulting from Biden’s botched withdrawal.",Right,1,american-greatness,18.93,22.45
"Appointed to the Supreme Court by Biden specifically for being black and female, Jackson may be the most prominent BLAFIWHIMP and like most BLAFIWHIMPs, she hails from a privileged and wealthy family who was educated at the Marxist-dominated Harvard Law School.",Right,1,american-greatness,18.93,22.45
"Simultaneously, rising rates in the U.S. create a massive headache for Chinese government-run industries, which are heavily indebted in U.S.",Right,0,american-greatness,18.93,22.45
But our real object is more comprehensive and our methods aim to be more expansive in their reach.,Right,1,american-greatness,18.93,22.45
"Instead, it would put these claims on hold to negotiate with a future post-Putin Russian government.",Right,1,american-greatness,18.93,22.45
"The event is being marketed as an opportunity to showcase two competing visions for America’s future - with Newsom’s California, the largest state in the union, representing an agenda of modern liberalism for America, and DeSantis’ Florida, the second largest red state in the union, carrying the putative banner for conservatism.",Right,1,american-greatness,18.93,22.45
"Build, and give thanks to God, with good cheer and wholesome delight in the world he has made, and man in it, male and female.",Right,1,american-greatness,18.93,22.45
"They had bequeathed to the Baby Boomer generation a well-run state, renowned for its state-of-the-art infrastructure.",Right,0,american-greatness,18.93,22.45
"If Shokin was not in fact soft on Burisma and Joe Biden did not press for his ouster to better fight corruption, it would seem to leave just one possible reason for his ham-fisted demand: to protect Burisma for the sake of his son - and the millions he was hauling in.",Right,1,american-greatness,18.93,22.45
"In Miami, the hegemony of the United Teachers of Dade, an affiliate of Randi Weingarten’s American Federation of Teachers, is in trouble.",Right,1,american-greatness,18.93,22.45
"‘Of course people are free to believe whatever they wish,’ they’d likely say.",Right,0,townhall,24.95,19.79
"Johnson’s welfare and government expansion programs are responsible for the explosion of our national debt and most of our challenges controlling budget deficits, and the jurisprudence has entrenched laws that are as difficult to repeal or amend as ever.",Right,1,townhall,24.95,19.79
"Christie portrayed himself as the adult in the room and someone who would answer the questions directly, something that former Trump White House Press Secretary Sean Spicer said set him apart from the rest, which should make him stick out with independent voters.",Right,1,townhall,24.95,19.79
"And there are many single parents who are doing their best, and doing well, to raise children of virtue and honor.",Right,0,townhall,24.95,19.79
Advertisement One more thing related to the environment for those actually concerned and not just using it for another round of blaming Israel for everything.,Right,1,townhall,24.95,19.79
Hamas shot any of its own supporters who refused to shield Hamas gunmen.,Right,1,townhall,24.95,19.79
"Recall the humility of Ronald Reagan, and his ability to take responsibility.",Right,1,townhall,24.95,19.79
"The games are grouped into different categories namely slots, poker, table games, specialty games, and blackjack.",Right,0,newsmax,28.9,13.54
The elector plan hatched in seven battleground states was central to the federal indictment filed against Trump earlier in August that alleged he tried to overturn results of the 2020 election.,Right,0,newsmax,28.9,13.54
"It was ratified by the union's leadership two days later, though not unanimously.",Right,0,newsmax,28.9,13.54
"El Royale (Best newcomer online casino site) Massive slots library Lots of slots bonuses Huge crypto welcome bonus The platform is optimized for mobile El Royale Casino is one of the latest entrants in the online gambling scene, having been launched in 2020.",Right,1,newsmax,28.9,13.54
That’s just a bit less than the U.S. spent during the entirety of World War II.,Right,0,newsmax,28.9,13.54
The company filed for bankruptcy in 2017 and was shuttered the following year.,Right,0,newsmax,28.9,13.54
They landed and opened fire on music fans who had been dancing until dawn at an overnight psychedelic rave.,Right,0,newsmax,28.9,13.54
And the forums lit up after the trailer hinted Lucia will go on a crime spree with a male partner.,Right,0,newsmax,28.9,13.54
"The breakdown in the bipartisan Senate talks, according to these sources, stems from Republicans’ continued insistence on including elements of H.R.",Right,0,infowars,15.78,23.58
"The meltdown, which took place on the eve of a critical test vote in the Senate on a $110.5 billion emergency spending bill, not only made it clear that the measure would fail, but severely dimmed the prospects for any bipartisan agreement soon.",Right,0,infowars,15.78,23.58
He has recently confessed to painting a misleadingly optimistic picture of the war to save Ukrainians and help them get through the war.,Right,1,infowars,15.78,23.58
"American officials say they fear that Ukraine has become casualty averse, one reason it has been cautious about pressing ahead with the counteroffensive.",Right,0,infowars,15.78,23.58
"During their Special Status period, these regions would have to be administered by local officials acceptable to both Russia and Ukraine, perhaps under the supervision of a special United Nations administrator At the end of some specified period of time, a referendum should be held to determine the final status of each region.",Right,0,infowars,15.78,23.58
A big gamble on China that alienates America could leave the Gulf in a difficult spot.,Lean Left,1,the-economist,42.4,-1.43
"As a political movement, with the ideology and the ideas it stands on, Hamas cannot be destroyed.",Lean Left,1,the-economist,42.4,-1.43
"A Roosevelt Democrat, he believed in an activist federal role, and he despised the tax-cutting, anti-government drift of the Republican Party.",Lean Left,1,the-economist,42.4,-1.43
The collective punishment of Palestinians is incomparable to any conflict in recent memory.,Lean Left,1,the-economist,42.4,-1.43
"Antony Blinken, America’s secretary of state, has spent almost every waking hour shuttling between Middle Eastern capitals over the past six weeks.",Lean Left,0,the-economist,42.4,-1.43
Such pauses are usually limited to a defined period and to a specific area where the humanitarian activities are to be carried out.,Lean Left,0,the-economist,42.4,-1.43
It's true that federal taxpayers are getting screwed by a bailout of Boeing.,Lean Right,1,reason,36.26,4.84
"Indeed, the natural right of visitation jointly enjoyed by the noncustodial parent and the child is more precious than any property right.",Lean Right,1,reason,36.26,4.84
"Similarly, public school districts don’t have to post their open enrollment policies and procedures on their websites.",Lean Right,0,reason,36.26,4.84
Negotiate international agreements to repeal cabotage restrictions that prevent foreign carriers from serving domestic routes.,Lean Right,0,reason,36.26,4.84
"Solutions to Enable Continued Growth and Lower Costs Public-private partnerships (P3s) provide a new and innovative source of capital for needed capacity improvements, as well as a delivery method that does not punish taxpayers for missed deadlines and cost overruns.",Lean Right,0,reason,36.26,4.84
"To be sure, the technologies involved are impressive and offer many potential benefits over conventional aircraft and aviation services.",Lean Right,0,reason,36.26,4.84
"That's an average of about 1,800 citations and $110,000 in revenue per month.",Lean Right,0,reason,36.26,4.84
"The optimistic scenario envisioned by anti-smoking advocates is that these policies will effectively cut off the supply of forbidden products, nudging smokers to quit or switch to safer alternatives with little complication.",Lean Right,0,reason,36.26,4.84
"American students trail their peers globally in math scores, possibly attributable to pandemic learning disruptions.",Lean Right,0,reason,36.26,4.84
Is it a good thing or a bad thing that fewer men between the ages of 25 and 54 are actively in the labor force?,Lean Right,0,reason,36.26,4.84
"An award of child support is payable to the custodial parent by the non-custodial parent (see DRL § 240[1-b][f]); see also Papier v. Papier, 274 AD2d 806 (3d Dept.",Lean Right,0,reason,36.26,4.84
"Federal, state, and local taxpayers already provide large amounts of tax money to provide subsidized transit services, justified largely because transit offers car-less individuals better mobility.",Lean Right,0,reason,36.26,4.84
"See also El-Dehdan v. El-Dehdan, 26 NY3d 19 (2015) (courts can issue preliminary injunctions aimed at the preservation of marital assets pending equitable distribution); see also Joseph v. Joseph, 230 AD2d 716 (2d Dept.",Lean Right,0,reason,36.26,4.84
That’s another reason for rethinking the antiquated way we pay for air traffic control in this country.,Lean Right,1,reason,36.26,4.84
"It's served as a graveyard/dumping ground for mobsters, and had a Federation of Black Cowboys outpost, replete with horses.",Lean Right,0,reason,36.26,4.84
"While Kissinger might argue that all the seemingly abhorrent policies he pursued during his career were necessary to secure America's national interest, his actions conspicuously always aligned with his own accumulation of power and prestige.",Lean Right,1,reason,36.26,4.84
It's really forcing processes of democratic solutions on two stages where most people have huge debates and issues.,Lean Right,1,reason,36.26,4.84
"So, Dr. McGill, did you have the power to stop this event?",Lean Left,1,washington-post,38.8,-6.85
"Sometimes, the impediments preventing them from finding a job aren’t what you would expect.",Lean Left,0,washington-post,38.8,-6.85
KORNBLUTH: I’ve heard chants which can be antisemitic depending on the context when calling for the elimination of the Jewish people.,Lean Left,1,washington-post,38.8,-6.85
"Welcome to Mulletfest, where Australia lets its hair down - and wholeheartedly embraces its bogan, or redneck, side.",Lean Left,1,washington-post,38.8,-6.85
"Naughty is an encounter with an especially fearsome Krampus, who has a hunchback, antlers and a mouth that resembles the Predator.",Lean Left,1,washington-post,38.8,-6.85
"The White House and Congress, she said, should force drugmakers to negotiate with states to start importation programs.",Lean Left,0,washington-post,38.8,-6.85
"We have an opportunity now to respond, but we have to do it quickly,"" Cramer said.",Lean Right,0,fox-business,38.81,9.11
"Labor unrest, we could see UPS, for example, go on strike, which would have a devastating impact on the economy.""",Lean Right,1,fox-business,38.81,9.11
"Sioux Falls, South Dakota, lies on the banks of the Big Sioux River, and its abundance of outdoor activities and gorgeous scenery make it a draw for outdoorsy types like hikers, bikers and boaters.",Lean Right,0,fox-business,38.81,9.11
Reselling used items at a loss or sending money to family and friends is not taxable under the law.,Lean Right,0,fox-business,38.81,9.11
THE FUSE ON AMERICA'S DEBT BOMB JUST GOT SHORTER More - and better - victories are possible.,Lean Right,1,fox-business,38.81,9.11
"The activewear market is extremely competitive, Riccobono added, saying Greatness Wins stands out by combining good-looking products with performance, while producing something that doesn't yet exist in its own way.",Lean Right,1,fox-business,38.81,9.11
While dominance in hockey and basketball have allowed Boston to claim the No.,Lean Right,0,fox-business,38.81,9.11
The company also forecast its monthly listeners would reach 601 million this quarter alone.,Lean Right,0,fox-business,38.81,9.11
"FED SKIPS AN INTEREST RATE HIKE, BUT HIGH MORTGAGE RATES COULD BE HERE TO STAY In fact, many investors expect the central bank to begin cutting rates in the middle of next year amid signs the economy is cooling.",Lean Right,1,fox-business,38.81,9.11
Ultralow mortgage-interest rates and a need for more space to work from home have driven robust home-buying demand in the past year and a half.,Lean Right,0,fox-business,38.81,9.11
"Cold winter weather has rolled in, and so has dull, flaky skin-but it doesn’t have to stick around.",Lean Left,0,global-news,44.54,-4.26
Jacob recorded the entire incident and posted footage of himself abandoning a 1940 Taylorcraft plane to YouTube.,Lean Left,0,global-news,44.54,-4.26
Jeff Semple gets an inside look at how a volunteer team of high-tech experts are helping track down the hostages.,Lean Left,0,global-news,44.54,-4.26
The aircraft occurrence summary says the Canadian CC150 Polaris military transport plane flew to Andersen Air Force Base in Guam on July 21 to pick up Canadian service members participating in a multinational military exercise centred on Indo-Pacific security.,Lean Left,0,global-news,44.54,-4.26
Greer and Mikael Backlund created unforgettable moments for the young fans undergoing treatment.,Lean Left,0,global-news,44.54,-4.26
"The NIA found that while most older Canadians report they have a network of family and friends they can count on, more than four in 10 are considered to be socially isolated.",Lean Left,0,global-news,44.54,-4.26
"They punched us, slapped us, boxed us and kicked us with their legs.",Lean Right,1,the-christian-post,36.41,10.31
Which is really something that everybody wants to happen in their heart.,Lean Right,0,the-christian-post,36.41,10.31
"The goal must be delivering the next generation of Palestinians, as well as Israelis, from the current barbarization fomented by Hamas and their Iranian puppet masters.",Lean Right,1,the-christian-post,36.41,10.31
"This, apparently, is foreign territory for those like Kendi who pontificate academically regarding something they know nothing about personally.",Lean Right,1,the-christian-post,36.41,10.31
Josiah is a figure who lives in a very dark apostate time and yet he turns it around.,Lean Right,1,the-christian-post,36.41,10.31
"The media, after all, heightened the dynamics of her relationship with Timberlake: When they were together, Spears recalls how the questions he’d get asked by talk show hosts were different from what they asked her.",Left,0,vox,39.59,-10.05
"The American medical system doesn’t really consider dental care an essential service, despite mounds of evidence linking a healthy mouth to the well-being of the rest of the body, from better pregnancy outcomes to a healthier heart.",Left,1,vox,39.59,-10.05
"That has led some to conclude that the reason for Biden’s bad numbers is, well, Biden.",Left,1,vox,39.59,-10.05
"What makes this crisis especially harrowing, however, is that it’s undoing years or perhaps even decades of work to revive Florida’s reefs through restoration.",Left,1,vox,39.59,-10.05
We’re afraid of what’s happening in our world right now and we want to be in our little boxes and look for any signal from other groups that they might be a danger to us.,Left,1,vox,39.59,-10.05
"What it has to do with charity is that the vast majority of nonprofits have no evidence of positive impact at all, and even charities brave enough to agree to rigorous tests of their impact see widely variable effectiveness.",Left,0,vox,39.59,-10.05
All of which is a long way of saying that Idaho and Moyle should be very easy cases.,Left,1,vox,39.59,-10.05
"In South Korea, the birth rate is down to 0.81 children per woman.",Left,0,vox,39.59,-10.05
The anti-abortion movement threw everything they had at the campaign and still fell far short.,Left,0,vox,39.59,-10.05
The ease with which many of us can shop now - through the same digital panopticon that encourages us to always present ourselves as something new - is a quick comfort.,Left,1,vox,39.59,-10.05
"Even as they try to pick apart opposing research, Mearsheimer and Rosato barely mention foundational studies that demonstrate how leaders are motivated by emotions, preexisting beliefs, concerns about reputation, and other factors.",Center,1,foreign-affairs,44.56,-6.55
"In recent years, the United States was underutilizing or even undermining them.",Center,1,foreign-affairs,44.56,-6.55
"Indeed, the tendency of each side to overestimate the freedom of man?uvre of the other has almost certainly increased distrust.",Center,1,foreign-affairs,44.56,-6.55
"But the proposal was categorically rejected by Andrei Gromyko, the Soviet representative to the UN.",Center,1,foreign-affairs,44.56,-6.55
Our strategy is designed to work in a wide variety of scenarios.,Center,0,foreign-affairs,44.56,-6.55
"At that stage, the authors claim, the current war might have been avoided.",Center,0,foreign-affairs,44.56,-6.55
"Cooperation between Russia, which is modernizing its strategic nuclear force, and China, which is vastly expanding its once small force, tests the credibility of the U.S. nuclear deterrent-as do North Korea’s expanding nuclear capabilities and Iran’s weapons potential.",Center,0,foreign-affairs,44.56,-6.55
But the joint U.S.-South Vietnamese invasion in 1970 obliterated what was left of Cambodian neutrality.,Center,1,foreign-affairs,44.56,-6.55
"While broad-based action is critical, however, the fact is that just a few key actors have the power to bring about a radical reduction in global emissions.",Center,0,foreign-affairs,44.56,-6.55
"The cancellation of Biden's commercials... CORONELL: Forgive me, Mrs. María del Rosario.",Right,0,newsbusters,19.99,20.48
"She is a member of the caravan, she is from Guatemala, and is traveling with her 2 children.",Right,0,newsbusters,19.99,20.48
"He told me that San Francisco hired him to install fencing to wall off certain areas downtown, so the Chinese leader would not see the city’s homeless.",Right,1,newsbusters,19.99,20.48
"Family Guy routinely targets former President Donald Trump, Republicans and MAGA voters.",Right,1,newsbusters,19.99,20.48
"In 2021, the Reedy Creek district paid $1.5 million on complementary tickets reserved for its employees.",Right,0,newsbusters,19.99,20.48
"The thing is, if that little girl in the image grows up to be a brain surgeon or cure cancer, she’ll be no more or less of a woman than one who chooses to stay home and raise her babies, and vice versa.",Right,0,newsbusters,19.99,20.48
"Dozens of times a day, he will suddenly stop whatever he is doing, clasp his hands together, clench his jaw and tense every muscle in his body while staring off into space.",Lean Left,0,usa-today,40.78,-4.12
He appealed the order and we just got a decision on Thursday from an appellate court saying the order would stand for now.,Lean Left,0,usa-today,40.78,-4.12
"From the impact of artificial intelligence on job creation and displacement to demographic shifts and climate change, these issues require a collaborative, global approach.",Lean Left,0,usa-today,40.78,-4.12
