text,source_party,label,source,reliability,bias
This 4K TV even has Dolby Atmos support inside for high-quality audio and 3D virtual surround sound.,Lean Left,0,variety,41.29,-3.85
Let’s just hope she has changed the 0287 PIN code we saw her use to check her balance in a glossy little coda that checked in on several of the players back home in their real lives!,Lean Left,1,variety,41.29,-3.85
It’s not hard to understand why Doja Cat sometimes seems to have a chip on her shoulder.,Lean Left,1,variety,41.29,-3.85
Circumstances throughout history have forced people to hide defining aspects of themselves.,Lean Left,0,variety,41.29,-3.85
"There were hairy legs in the kimono, so we were laying on hair on her completely beautiful smooth legs.",Lean Left,1,variety,41.29,-3.85
"The classic show, from Kander and Ebb/Bob Fosse, centers on Roxie Hart and Velma Kelly, two merry murderesses who try to leverage their celebrity as they await trial in jail.",Lean Left,0,variety,41.29,-3.85
"So, what is private credit, and why the interest in media production?",Lean Left,0,variety,41.29,-3.85
"Some friends have lost their apartments, others their health care, and many their shows due to cancellation.",Lean Left,0,variety,41.29,-3.85
"Well, besides the fact that she already had 16 corkers, you can see a few areas of lyrical or thematic overlap that were probably best avoided.",Lean Left,1,variety,41.29,-3.85
There are also hilarious sequences involving Gitlow and Cotchipee and later Cotchipee’s mousey integrationist son Charlie (Noah Robbins) and his housekeeper Idella (Vanessa Bell Calloway).,Lean Left,0,variety,41.29,-3.85
The Taylor Swift of 2014 was at a particular nexus point in her attitude and concerns that wasn’t too close to what she’d written before or what she would turn to years later.,Lean Left,0,variety,41.29,-3.85
"Paramount, of course, is clearly feeling even more pressure, with strong subscriber growth but still subpar scale for Paramount+ (63 million subs worldwide) and a stock that hasn’t crested $20 per share in over six months.",Lean Left,1,variety,41.29,-3.85
Barrino is no stranger to playing Celie - she reprises the role she inhabited on Broadway in a 2007 musical adaptation of Alice Walker’s beloved 1982 book.,Lean Left,0,variety,41.29,-3.85
"Right wing commentators previously lost it over Swift’s colossal success, taking time out of their very busy days to give sage insight into her relationship with the Chiefs tight end after their relationship went public in September.",Lean Left,1,variety,41.29,-3.85
"LYNSKEY: We had to go to the Kiss concert, contractually, as people who had been in the Kiss movie.",Lean Left,0,variety,41.29,-3.85
"And it was your little face - this beautiful, slightly baffled face.",Lean Left,0,variety,41.29,-3.85
"There’s a wide range of services to choose from depending on someone’s preferences: if you already know your mom’s go-to coffee shops, you can play it safe with brand-specific subscriptions like Blue Bottle and Verve, or you can go with services like Trade Coffee or Misto Box for those who like to be more adventurous with their beans.",Lean Left,0,variety,41.29,-3.85
It’s right upon that utterance that you realize they’re being played by the same overtaxed actress - Nancy Zamit as the fictional actress Annie Twiloil... as Mrs.,Lean Left,1,variety,41.29,-3.85
"Because in certain scenes he’s so duplicitous or villainous or just a massive dickhead, but that’s boring on its own, so you want him to be as likable within that framework.",Lean Left,1,variety,41.29,-3.85
People were itching for the next Chris Nolan film and itching for the next Greta Gerwig film.,Lean Left,0,variety,41.29,-3.85
Music supervision for the evening was handled by DJ Daisy O’Dell.,Lean Left,0,variety,41.29,-3.85
"There are probably 20 different producers and 40 songwriters in the credits, but her primary collaborators are seasoned vets with vast track records: Kurt McKenzie, Earl on the Beat, Fallen, Jean Baptiste and Jay Versace, whose collective work ranges from Lil Yachty, Childish Gambino, Drake and Lil Baby to Selena Gomez and Black Eyed Peas.",Lean Left,0,variety,41.29,-3.85
"Scott may be skeptical of the man, but he can’t resist the desire to re-create some of history’s most notorious conflicts, and so psychology is sacrificed for the sake of spectacle.",Lean Left,1,variety,41.29,-3.85
"With her high-billed Coachella performance in 2022, she proved that she has the talent, catalog and charisma to headline hold a major stage.",Lean Left,0,variety,41.29,-3.85
The one person who emerges with dignity utterly intact is Jones as the central character.,Lean Left,1,variety,41.29,-3.85
Bleacher Report has noticed a trend in younger viewers not watching full games so brought out a line of quick-resolving bets that have seen upticks in engagement and wagering with their sportsbook partners.,Lean Left,0,variety,41.29,-3.85
"Today’s complaint was filed under California’s Sexual Abuse and Cover-Up Accountability Act, similar to Portnow’s suit in New York under the recently expired Adult Survivors Act.",Lean Left,0,variety,41.29,-3.85
"Was it a huge release to be done shooting not only the film, but also be done wearing the wig?",Lean Left,0,variety,41.29,-3.85
"If you’re looking to kill time and be wildly distracted from your surroundings, trust the overwhelmingly positive Amazon reviews and buy yourself a little mystery.",Lean Left,0,variety,41.29,-3.85
"And if you aren’t a crafty ceramicist or knitter yourself, you can feel out of luck.",Lean Left,1,variety,41.29,-3.85
But production designer Nicky Shaw opts instead for a thuddingly literal approach.,Lean Left,1,variety,41.29,-3.85
"Perhaps they might have crafted something more fresh and tuneful, with goosebump moments that come not from hydraulics but from theatrical know-how.",Lean Left,1,variety,41.29,-3.85
ITV Studios Execs on the Rise of Streamers: ‘This Is a Time of Chaos and Opportunity’,Lean Left,0,variety,41.29,-3.85
"Throughout the animated film, Mahito is haunted by visions of fire while futilely trying to rescue his mother.",Lean Left,0,variety,41.29,-3.85
"Lear, who was honored with a place in the Television Academy’s Hall of Fame, a lifetime achievement award from the Producers Guild of America and multiple awards from the Writers Guild of America, was the recipient of the National Medal of Arts in 1999 and feted at the Kennedy Center Honors in 2017.",Lean Left,0,variety,41.29,-3.85
"It’s quite an achievement, considering the esteemed company he shared the screen with.",Lean Left,1,variety,41.29,-3.85
He also pointed out that music is a universal form of communication transcendent of language barriers.,Lean Left,0,variety,41.29,-3.85
"Yet the brilliance of the performers in this first Broadway revival since its original run, and their ability to lean into the playfulness of Davis’ comedy, present the euphoric and revelatory experiences of being Black while commenting on the absolute absurdity of racism.",Lean Left,1,variety,41.29,-3.85
"The house’s staff are, of course, all in thrall to Mrs. Danvers.",Lean Left,1,variety,41.29,-3.85
"Indeed, speculating on the company’s M&A future has become something of a pastime for analysts, with most observers agreeing Paramount Global is not long for this world as an independent entity.",Lean Left,0,variety,41.29,-3.85
"The loss of King, who moved from the Yankees’ bullpen to their rotation late in the season, is a more immediate blow to a pitching staff that lacked both quality and depth in 2023 behind AL Cy Young winner Gerrit Cole, but the team remains in the hunt for prized Japanese free-agent ace Yoshinobu Yamamoto.",Lean Left,0,variety,41.29,-3.85
"Meanwhile, the original disruptor, Netflix, has seen its public image shift from that of a renegade TV resurrector to an ax-wielding slasher, ready to cancel viewers’ favorite shows at the drop of a hat.",Lean Left,1,variety,41.29,-3.85
"Several months later, upon arrival in London, Nan is greeted by a despondent and heavily pregnant Conchita suffering under the judgment of the unbearably cold and cruel Marables.",Lean Left,1,variety,41.29,-3.85
"Immediately taken by Tim’s adorable naiveté, enthusiasm and enjoyment of milk, Hawk, who arms himself with his war medals and charm, quickly draws Tim into a sexual relationship.",Lean Left,1,variety,41.29,-3.85
"Destin Daniel Cretton and Lisa Ling, co-chairs of the UNFO awards selection committee, will deliver this year’s keynote addresses.",Lean Left,0,variety,41.29,-3.85
Did you have a thing that would get you into him?,Lean Left,1,variety,41.29,-3.85
"Both Scott and Phoenix embrace a touch of camp, portraying the enigma that was Napoleon as a petulant brat-cum-military genius: someone who knew how to get his way on the battlefield, but resorted to food fights at home.",Lean Left,1,variety,41.29,-3.85
"Join Amazon Prime Courtesy of Amazon $1,095 $1,445.00 The bike widely known as the fitness world’s pandemic darling is on sale at its lowest price to date on Amazon.",Lean Left,1,variety,41.29,-3.85
"For almost every moment in which a thesp mortifyingly screws up, there’s also one in which someone comes up with a quick fix that makes it possible at least to get to the next scene, if not actually turn disaster into success.",Lean Left,0,variety,41.29,-3.85
"Discovery, Paramount Global and Sony Corp. That’s an astounding figure, and one that underscores how much money Hollywood has committed to content production in recent years.",Lean Left,0,variety,41.29,-3.85
"Pendleton opened their archives for West, sending her the color palettes of what the Osage would order.",Lean Left,0,variety,41.29,-3.85
Ten years is a good amount of time to birth something into the world.,Lean Left,0,variety,41.29,-3.85
"Because he’s set up at the start as being somebody who is very, very far away from himself and very, very unhappy.",Lean Left,1,variety,41.29,-3.85
"But he moved into comedy writing after partnering with Ed Simmons, his cousin’s husband.",Lean Left,0,variety,41.29,-3.85
"Pinned beneath the beast, the bloody young officer heaves himself to his feet and carries on with the siege.",Lean Left,1,variety,41.29,-3.85
"Bruce Lee’s daughter Shannon Lee will accept the Lexus Legacy Award on behalf of her late father, honored at the 50th anniversary of his death.",Lean Left,0,variety,41.29,-3.85
"Still, the movie may well send audiences back to their history books for an explanation of something so fundamental as why the French dictator is warmongering at all.",Lean Left,0,variety,41.29,-3.85
It also showcases how women have always sought to save themselves and each other while lacking societal powers or autonomy.,Lean Left,1,variety,41.29,-3.85
"But every time she appears on-screen, it distracts from the film’s main selling point: expansive, cast-of-hundreds combat scenes that prove both Napoleon’s keen military strategy and Scott’s gift for staging such clashes.",Lean Left,1,variety,41.29,-3.85
"Instead, it is a feminist love story about female friendships, shocking betrayals and the sacrifices women have made across time to release themselves and others from the shackles of shame.",Lean Left,1,variety,41.29,-3.85
"What was the most difficult bloodletting, as it were, in this book?",Lean Left,1,variety,41.29,-3.85
"Gladstone speaks with a slight drawl and wandering eyes, in long, slow, carefully constructed circles.",Lean Left,0,variety,41.29,-3.85
"She’s like a water lily - the roots go deep, but everything else is in full view on the surface.",Lean Left,0,variety,41.29,-3.85
She also learned of another lawsuit in which Pierre was accused of grooming and sexually assaulting his former assistant.,Lean Left,0,variety,41.29,-3.85
He’s just another person that owes a lot of people a lot of money.,Lean Left,1,variety,41.29,-3.85
"The Padres also missed the playoffs in 2023, finishing third in the NL West.",Lean Left,0,variety,41.29,-3.85
And the way she speaks hints at many Sundays spent in a pew listening to ministers evangelize about heavenly rewards and earthly tribulations.,Lean Left,1,variety,41.29,-3.85
"From the inescapable presence of podcast platforms to new voices utilizing everything that social media apps have to offer, the business of audio content remains as relevant as ever.",Lean Left,0,variety,41.29,-3.85
"To the extent that some improv is encourged out of star guests, Whitford has been playing it as a mixture of vainglorious - bringing multiple Emmys out on stage with him - and righteous, working in advocacy for the current Hollywood strikes.",Lean Left,1,variety,41.29,-3.85
"Yet even as Barrino recounts her darkest moments, she has an effervescence about her.",Lean Left,0,variety,41.29,-3.85
"Despite conservative backlash, O’Connor was unanimously confirmed by the Senate and made history as the first woman Supreme Court justice.",Lean Left,0,variety,41.29,-3.85
"However, the script could have done without turning the 1955 dad (Hugh Coles) into a peeping tom.",Lean Left,1,variety,41.29,-3.85
"Once people finally reach their final destination, their luggage may not even make it with them.",Lean Left,0,variety,41.29,-3.85
"Barrino’s art has always been her testimony, resounding with all the trials that she, I, you, and all our mamas have been through.",Lean Left,0,variety,41.29,-3.85
"The number of states where it’s legal grew by five, including gambling heavyweight New York, leading to record amounts wagered across the country.",Lean Left,0,variety,41.29,-3.85
"Variety’s Hitmaker of the Year doesn’t play an instrument - those gloriously supple melodies and intense lyrics just burst out of her and into a microphone, usually the one on her phone.",Lean Left,0,variety,41.29,-3.85
"It’s a slippery slope that lends toward a culture of abuse, misogyny, and miseducation, survivors of the institute share.",Lean Left,1,variety,41.29,-3.85
The movie arrives in cinemas this week following its premiere earlier this year at the Tribeca Film Festival.,Lean Left,0,variety,41.29,-3.85
"Nevertheless, Neon’s vigorous awards campaign and its dual trophies (the only two-time winner of the night) could sway voter attention.",Lean Left,1,variety,41.29,-3.85
"If we want to talk about courage under fire, the fact that 11 seconds into this performance, you are buck naked and going for it in a way that, again, wasn’t gratuitous, but it was very... Ruffalo: ...raw.",Lean Left,1,variety,41.29,-3.85
"Both actors stretched far beyond their well-established movie star personas, and they were eager to ask each other about how they’d done it.",Lean Left,0,variety,41.29,-3.85
"To be clear, this doesn’t mean the hard-won changes now enshrined in the guild contracts aren’t worth implementing.",Lean Left,0,variety,41.29,-3.85
"So it all just seemed futile - obviously, they were going to enter the lot.",Lean Left,1,variety,41.29,-3.85
"But she does love her dynamics, and sometimes the quiet parts seem like an excuse to jolt you back awake when her whispery voice turns into a sweet snarl and she pumps up the volume again.",Lean Left,1,variety,41.29,-3.85
"In this album’s spunkiest or scream-iest moments, you get the satisfying rush of what it might feel like if Taylor Swift decided to not just befriend but be Paramore for a day.",Lean Left,1,variety,41.29,-3.85
The typical eligibility period is between June 1 and May 31 of any given year.,Lean Left,0,variety,41.29,-3.85
"Much of the show’s humor once again comes from the comic ick of incest, along with out-of-time references from 1955 and 1985 (plus one amusing shout-out to 2020).",Lean Left,1,variety,41.29,-3.85
"But where a union leader’s cause gets a fair hearing, Bertha’s staging of a pivotal dinner party gets an entire dramatic arc, with the string-laden score hitting a crescendo as a fleet of servants rolls out a soup course.",Lean Left,1,variety,41.29,-3.85
"One caveat-filled analysis by the Entertainment Strategy Guy, for instance, found only about 14% of first-season streaming shows released between 2021 and 2023 would qualify.",Lean Left,0,variety,41.29,-3.85
"This philosophy would likely get you thrown out of most Hollywood boardrooms these days, given the studios’ focus on IP-driven blockbusters.",Lean Left,1,variety,41.29,-3.85
"Some of Mike’s writing is about the hilarity of the mundane, the hilarity of the privileged.",Lean Left,0,variety,41.29,-3.85
"But over the past few years, the real artist - a weird, fearless, sex-positive, empowered and funny-as-hell rapper - has gradually emerged.",Lean Left,1,variety,41.29,-3.85
Buy Now: HEADSPACE MEMBERSHIP Audible Plus Membership Courtesy of Audible An Audible membership not only works as a great last-minute gift that saves you a trip to the store but will also feel like a thoughtful touch to those who can’t stop talking about their favorite audiobooks or podcasts.,Lean Left,1,variety,41.29,-3.85
Emmys’ Limited Series Race May See a Book Adaptation Face-Off With ‘Daisy Jones and the Six’ and ‘Fleishman Is in Trouble’,Lean Left,0,variety,41.29,-3.85
"A midseason episode sends Peggy on a reporting trip to Tuskegee, Alabama, complete with a cameo from Booker T. Washington (Michael Braugher), that results in a disturbing brush with racist violence.",Lean Left,1,variety,41.29,-3.85
"She’s spoken often of being bullied and considered weird at school, and her rebellious phase found her dropping out of Delaware State University and mortifying her parents by working in a strip club before enrolling in New York’s Fashion Institute of Technology.",Lean Left,0,variety,41.29,-3.85
"Robin Thicke went with Perry Farrell, Jenny McCarthy Wahlberg named Adam Lambert and Ken Jeong went with Jon Bon Jovi.",Lean Left,0,variety,41.29,-3.85
"What we get instead is a paradoxical, probably unsustainable mix of lighthearted distraction with historical education, where etiquette and inequality receive equal weight.",Lean Left,1,variety,41.29,-3.85
"It would be weird, and probably terribly wrong, if Rodrigo weren’t deeply steeped in some of those mannerisms that Swift has made into a whole new pop lexicon: It would be like a rock band in the early ’70s going out of its way to not be influenced by the Beatles.",Lean Left,1,variety,41.29,-3.85
"And one of the pieces of advice he gave Kobe was when you’re around someone you admire, don’t be a fan.",Lean Left,1,variety,41.29,-3.85
Such behavior and comments like this are intolerable regardless of the situation or topic of conversation.,Left,1,occupy-democrats,25.3,-21.06
Roman said Gat called him at around 7:30 a.m. on Oct. 8 and told him what had happened the previous day.,Lean Left,0,washington-blade,42.71,-7.49
"It is a fair view of the world today, and where we in the United States fit in.",Lean Left,1,washington-blade,42.71,-7.49
She’s a drug dealer who sells to the White House staff.,Lean Left,1,washington-blade,42.71,-7.49
My partner is an African-American video artist and I’m more words driven.,Lean Left,0,washington-blade,42.71,-7.49
None of us made it out completely OK. Everybody is hurt.,Lean Left,0,truthout,34.51,-16.87
"Before the events of the past few months, villages like Eid’s Umm al-Khair faced the near-constant threat of violent eviction.",Lean Left,0,truthout,34.51,-16.87
"Just this weekend, Israeli forces carried out a raid at Ibn Sina Hospital, one of the largest in the occupied West Bank, paralleling Israel’s brutal assault on hospitals in Gaza.",Lean Left,1,truthout,34.51,-16.87
"The past two years of Supreme Court cases have also had a stunning amount of influence from dark money puppetmaster Leonard Leo, a new analysis finds.",Lean Left,1,truthout,34.51,-16.87
"In the aftermath of the 2022 midterms, the fast-approaching 2024 Republican primary was largely seen as a two-person race, and for good reason: Trump remained a commanding presence in the party and still had a stranglehold on a large percentage of the Republican base, some of whom, it seems, would not abandon Trump under any circumstances.",Lean Left,1,nbc-news,43.21,-5.79
"They worried that if the president continued picking fights, they, too, would be pulled into the battle.",Lean Left,1,nbc-news,43.21,-5.79
"Last week, Comer and Jordan accused Hunter Biden of seeking special treatment in requesting a public hearing instead of appearing for a closed-door deposition.",Lean Left,0,nbc-news,43.21,-5.79
Several more children sickened by fruit pouches tainted with lead More children were apparently sickened by apple puree pouches recently recalled due to dangerous lead contamination.,Lean Left,0,nbc-news,43.21,-5.79
"Haley named the provinces during the debate, but it was drowned out by the bickering of other candidates.",Lean Left,0,nbc-news,43.21,-5.79
"Share this - Copied Allan Smith writes: DeSantis and Ramaswamy's are teaming up against Haley to attack her for being supported by Larry Fink, the CEO of BlackRock, who they say is at the forefront of the ESG effort - a top target for conservatives in recent years.",Lean Left,1,nbc-news,43.21,-5.79
Ramaswamy isn't the only Republican politician to have promoted a Jan. 6 conspiracy theory in recent weeks.,Lean Left,0,nbc-news,43.21,-5.79
This makes it essential for each member of our community to feel secure and welcomed and to thoroughly understand and believe that their ideas are respected by all.,Center,1,poynter,41.75,-7.32
"All over the country, the few journalists remaining in gutted newsrooms are scrambling just to keep up with the police blotter and city council meetings.",Center,1,poynter,41.75,-7.32
How do we keep the public’s trust when almost anything can be faked?,Center,0,poynter,41.75,-7.32
"Deprived of office, the right invented the myth that growing unemployment was due to immigrant labor, forgetting that however low it would stoop, Le Pen could get lower still.",Left,1,the-nation,31.32,-19.23
"The Israeli retribution was immediate, with high numbers of Palestinian civilians being killed.",Left,1,the-nation,31.32,-19.23
"At this point, that’s the expected stunt, yet it appears no one wants to take up that mantle.",Left,1,huffpost,37.82,-10.75
"Even the most open-minded person might ask, how does a drag queen, a person typically endemic to big coastal cities, find themself in the mountains of Colorado?",Left,1,huffpost,37.82,-10.75
"If we stay grounded in love and rise up in rage, we can render our wrath into something that is both a weapon and a salve.",Left,1,huffpost,37.82,-10.75
"Pattie genuinely thinks that the tide is changing in environmentalism and that marginalized communities, specifically people of color and queer people, are finally being listened to.",Left,0,huffpost,37.82,-10.75
"If you walk through Battery Park in lower Manhattan, you will find the Netherland Monument - a 1926 piece by the Dutch sculptor Hendrik van den Eijnde, and one of the many structures in New York that perpetuate the myth of the sale of this island.",Left,1,huffpost,37.82,-10.75
"The fifth guy, who doesn’t have the guts to show up and stand here, he’s the one who, as you just put it, is way ahead in the polls.",Left,1,huffpost,37.82,-10.75
"But the lyrics in Japanese reveal that the song is in fact an ode to their bandmate Yuuki’s moles, which they depict as nibbles of sweetness.",Left,0,huffpost,37.82,-10.75
"But even beyond that, the entire series revolves around the historical tensions between Evermore Academy, a so-called school for outcasts, and the people of the nearby town of Jericho.",Left,1,huffpost,37.82,-10.75
Advertisement But Pattie Gonia frolics in fields in elaborate dresses made of camping tents while educating her followers about the nuances and importance of recycling.,Left,1,huffpost,37.82,-10.75
Shannen Doherty arrives at the FOX Summer TCA 2019 All-Star Party in 2019.,Left,0,huffpost,37.82,-10.75
"For more info on how to avoid being swindled, read about how to spot Social Security scams.",Center,0,cnet,40.02,-1.39
"On r/HairTransplants, there’s a good deal of anxiety about being perceived as odd, conceited, or otherwise unattractive because of your hair transplant.",Left,1,vice,38.96,-9.39
"There, perfection-defined not by the gender you’re attempting to attract but by your online competition-is measured in millimeters and graphs.",Left,1,vice,38.96,-9.39
"ABSTRACT breaks down mind-bending scientific research, future tech, new discoveries, and major breakthroughs.",Left,0,vice,38.96,-9.39
"Peter Smith, a researcher and journalist for the Canadian Anti-Hate Network , has studied Active Clubs since they began to pop up in Canada.",Left,0,vice,38.96,-9.39
"But now, a much smaller, potentially much more nefarious, and less understood threat is drawing scientist’s attention-nanoplastics.",Left,1,vice,38.96,-9.39
"Atomwaffen was an infamous neo-Nazi terrorist organization that emerged in 2016, and has been linked to five murders in the United States .",Left,0,vice,38.96,-9.39
"Citing policy, the RCMP could not confirm if Nippak is a part of the MacDonald investigation.",Left,0,vice,38.96,-9.39
"But it was a little bit more comforting when they told me that they would pick me up directly from the airport, chauffeur me right to the hotel, and pick me up for the procedure.",Left,0,vice,38.96,-9.39
"The Hammerskins are a decades-old skinhead group, formed in the 1980s, that has been linked to criminal activity.",Left,1,vice,38.96,-9.39
"Once airborne, they can float for thousands of kilometers, as far as the Earth’s poles The infinitesimal size of nanoplastics is partly why scientists know little about them.",Left,0,vice,38.96,-9.39
"Meeting several times a month, members of the semi-autonomous cells train martial arts, put up racist posters, and recruit young, easily manipulated white men to their cause.",Left,1,vice,38.96,-9.39
