text,source_party,label,source,reliability,bias
"But as we met more people, we realized that very little the Climate Generation does is truly isolated; this is a generation that is spectacularly connected.",Center,1,christian-science-monitor,44.22,-2.47
"Courtesy of Rodale Books Hand-holding for newbies Since commercial kitchens and restaurants are enormous contributors to food waste, one way to slow the tide of garbage is to cut back on dialing Uber Eats and start cooking at home.",Center,1,christian-science-monitor,44.22,-2.47
The United Nations COP28 climate summit has become something of a Davos-style show - a place to see and be seen.,Center,1,christian-science-monitor,44.22,-2.47
"Wind gusts of more than 30 mph hit the D.C. area Tuesday, and the tree fell over around 1 p.m.",Lean Right,0,just-the-news,33.31,10.7
"Recent reports have suggested that Zelensky is ill-inclined to negotiate, or even acknowledge the significant barriers to Ukraine reclaiming most of its territory.",Lean Right,1,just-the-news,33.31,10.7
"But in 2016 you voted to stand up to those liars, losers, crooks, and creeps and you elected an outsider as your president, and it was about America first.",Lean Right,1,just-the-news,33.31,10.7
"By the fall of 2018, Hunter Biden was receiving his last payments from the Ye Jianming-connected business venture.",Lean Right,0,just-the-news,33.31,10.7
"Crime has surged in D.C. in 2023, with violent crime increasing by 40% year-to-date and motor vehicle theft up 91%.",Lean Right,0,just-the-news,33.31,10.7
"They actually aired portions of these tapes on their televised hearings, which means they had to keep those.",Lean Right,1,just-the-news,33.31,10.7
NLRB dropped a similar investigation against The Daily Wire following NCLA intervention.,Lean Right,0,just-the-news,33.31,10.7
"That pattern suggests that Joe and Hunter Biden’s finances were intertwined, while Hunter Biden was raking in millions from his foreign business deals.",Lean Right,1,just-the-news,33.31,10.7
But there are millions of women in this country who are the victims of regular physical and psychological abuse at the hands of their husbands.,Left,1,the-new-yorker,40.91,-12.25
"The surprisingly high stakes of the documentary are her happiness, with the viewer not so much wondering whether a B.B.L.",Left,1,the-new-yorker,40.91,-12.25
"The film does not dwell on Miller’s past, and does not even mention the specifics of her life story as a child of poor immigrant parents, who had fled the Soviet Union and Poland, respectively, before the Second World War.",Left,0,the-new-yorker,40.91,-12.25
"We are increasingly getting our news from video clips, and doctoring those clips has become alarmingly simple.",Left,0,the-new-yorker,40.91,-12.25
"After graduating from college, she enrolled in culinary school, where a scheduling miscommunication led to her visa status being revoked; she remained in the country as an undocumented immigrant, until marrying her husband a decade later.",Left,0,the-new-yorker,40.91,-12.25
"But, for Rush, the continent presented a different kind of threshold-a prologue to a personal transformation.",Left,0,the-new-yorker,40.91,-12.25
Despite the fact that we're in the middle of a world war and a pandemic.,Left,1,the-new-yorker,40.91,-12.25
"This film tells the story of one tragic raid, from both perspectives: the soldiers conducting it and the families caught up in it, offering a glimpse into one small part of a much bigger picture-a series of traumas experienced by hundreds of families.",Left,0,the-new-yorker,40.91,-12.25
"A score composed of swelling, overlapping voices lends an air of spirituality.",Left,1,the-new-yorker,40.91,-12.25
"No sooner had she grasped the inviting paw than Bogie stood up, and, in her telling, twisted her wrist and pushed her.",Left,0,the-new-yorker,40.91,-12.25
"It is more of a challenge to evoke feeling, to arrest the listener, and Benjamin’s ensemble occasionally reaches those celestial highs.",Left,0,the-new-yorker,40.91,-12.25
"All over the country, Ukrainians were pivoting to the defense effort.",Left,0,the-new-yorker,40.91,-12.25
It takes a lot for a historical figure to be memorialized for nearly 500 years as an eponymous adjective.,Lean Left,1,washington-monthly,35.78,-12.08
"How can any country, or company, compete with state-subsidized operations with few environmental safeguards that are accused of forcing slaves to dig for silica, which is then used in solar panels, electronics, and other types of goods dumped into the world at below-market rates?",Lean Left,1,washington-monthly,35.78,-12.08
"Moderates-politically engaged centrists-are most consequential in El Norte where, at 18 percent of the population, they are the largest single Tribe after the Politically Disengaged; they are the least present in Left Coast where, at 12 percent, they are no more numerous than Progressive Activists.",Lean Left,1,washington-monthly,35.78,-12.08
"In part because it was Dannehy, partisans on both sides accepted her conclusion.",Lean Left,0,washington-monthly,35.78,-12.08
"Reinstitute and expand his Muslim ban, which barely passed Supreme Court muster after it was watered down.",Lean Left,1,washington-monthly,35.78,-12.08
"When the court finally acted, it was already mired in scandals involving the sketchy finances of several justices.",Lean Left,1,washington-monthly,35.78,-12.08
The president is walking a fine line in supporting union workers in Detroit while much of the IRA and CHIPS stimulus is pouring into right-to-work red states.,Lean Left,1,washington-monthly,35.78,-12.08
But neither was a problem in New York’s Third Congressional District.,Lean Left,0,washington-monthly,35.78,-12.08
"Since October 7, universities have been embroiled in painful fights over institutional statements on terrorist attacks and war in the Middle East.",Lean Left,0,washington-monthly,35.78,-12.08
"Through this collaboration, these donor-advised funds were able to create a greater impact.",Lean Left,0,washington-monthly,35.78,-12.08
He succeeds in showing us that in the early 1940s war mobilization loomed over everything.,Lean Left,1,washington-monthly,35.78,-12.08
"The convention, through bitter compromises, papered over differences temporarily, but the fissures would recur and sometimes widen into chasms in the decades ahead.",Lean Left,1,washington-monthly,35.78,-12.08
"For Kroger, the first step down that road began in 2015 when it set up a data science unit called 84.51-the longitude of its headquarters in Cincinnati-that started selling research reports about its customer buying habits.",Lean Left,0,washington-monthly,35.78,-12.08
"Indeed, Judis and Teixeira cite a study by the Wesleyan Media Project, which found that one-quarter of Clinton’s ads were on policy and scant few on economics despite her having toiled in public policy for decades.",Lean Left,0,washington-monthly,35.78,-12.08
"But despite all this, it is impossible to ignore that this administration has already marked a sea change in economic history.",Lean Left,1,washington-monthly,35.78,-12.08
Baude and Paulsen must be taken seriously; they are both brilliant students of the Constitution who have done exhaustive research and are genuine conservatives.,Lean Left,1,washington-monthly,35.78,-12.08
"To most New Deal acolytes, the appointment of Kennedy to SEC chair was akin to putting a fox in charge of the henhouse.",Lean Left,1,washington-monthly,35.78,-12.08
"That said, we can’t lose sight of the importance of incremental regulatory changes.",Lean Left,0,washington-monthly,35.78,-12.08
He relies perhaps too heavily at times on lengthy quotations from his characters.,Lean Left,0,washington-monthly,35.78,-12.08
"The sale slightly more than doubled Kushner’s investment, giving him a calling card that validated his acumen and his patience.",Center,0,fortune,36.93,-2.44
"He officially killed the Twitter brand, along with its bird logo, and rechristened the platform as X, and he made major product changes such as eliminating headlines on tweets and offering various paid versions of the service.",Center,1,fortune,36.93,-2.44
And then my dad faced a lot of discrimination at work.,Center,0,fortune,36.93,-2.44
"As long as he can keep followers enticed by his newest shiny object, it’s doubtful anyone will even remember he pledged to in the first place.",Center,1,fortune,36.93,-2.44
"It had been just two weeks since the Hamas incursion into Israel-the brutal murder of 1,200 people and kidnapping of 240.",Center,1,fortune,36.93,-2.44
"Systrom was toiling away on a startup called Instagram with a cofounder, Mike Krieger, who was also Brazilian, so an intro to a fellow countryman seemed like a win.",Center,0,fortune,36.93,-2.44
"Surprisingly, his approach resembles that of 1980s management hero, former GE chief Jack Welch, who made a policy of terminating the lowest-performing 10% of his workforce each year (a tactic that has since been somewhat discredited).",Center,1,fortune,36.93,-2.44
"But Ek’s next bet on the company’s future will come with less wiggle room than his last one, and he’ll surely hope it doesn’t end with more layoff plans.",Center,1,fortune,36.93,-2.44
"We’re already seeing glimpses of the chaos that lies down that path, and it’s not hard to imagine the stifled innovation, hoarded benefits, and questionable oversight waiting just around the bend.",Center,1,fortune,36.93,-2.44
"The plan will certainly compound the burden of higher post-pandemic interest rates, particularly for those with lower incomes.",Center,1,fortune,36.93,-2.44
"Other target markets include office buildings, sports venues, concerts, and shopping malls.",Center,0,fortune,36.93,-2.44
Twitchy mannerisms and blurry camerawork quickly exposed both videos as fake.,Center,1,fortune,36.93,-2.44
"Taiwan accounts for 30% of the $574 billion global semiconductor industry, the backbone of modern technology.",Center,0,fortune,36.93,-2.44
"The group had a few attributes in common: They’re millennials and Gen Zers, mostly.",Center,0,fortune,36.93,-2.44
"The group has ramped up spending on research and development for new product offerings to bring in more subscribers, increasing expenses there in the first nine months of 2023 by 38% compared with the whole of 2021.",Center,0,fortune,36.93,-2.44
"They and thousands of Spotify listeners enjoyed performances from the likes of Sam Smith and Charli XCX, in addition to a prerecorded performance from Raye at a trendy venue in North London.",Center,0,fortune,36.93,-2.44
"Surprisingly, the figures in the subsequently raging Southern and Western metros, in many cases, were around the same or just modestly higher.",Center,0,fortune,36.93,-2.44
"But this year marked a changing of the guard for the upper echelons of wealth, according to UBS’s 2023 Billionaire Ambitions Report.",Center,0,fortune,36.93,-2.44
"Indeed, the Tesla Solar Roof may very well earn the distinction of being Musk’s most under-hyped product-as well as one he appears to have little interest in selling.",Center,1,fortune,36.93,-2.44
"This entirely predictable mess should serve as a cautionary tale for anyone who feels like subverting how the internet works-hope you’re watching, India and Brazil.",Center,1,fortune,36.93,-2.44
"In going heavily with vertical integration, Musk also departs from the stance of his hero Steve Jobs.",Center,1,fortune,36.93,-2.44
Some fear the ease of generative technology will let malicious users outsmart far less nimble tech companies and governments attempting to rein them in.,Center,0,fortune,36.93,-2.44
"The years Kushner spent cultivating relationships paid off in 2016, when Donald Trump, his brother’s father-in-law, was elected president.",Center,0,fortune,36.93,-2.44
"Macquarie, a financial services group, thinks it could save the company €300 million ($323 million) in costs next year, while Justin Patterson, an analyst at KeyBanc, said the company’s latest reduction in force (RIF) isn’t a sign of panic, but rather falls in line with an organizational review that began in January this year, reassuring investors.",Center,0,fortune,36.93,-2.44
Many sources for this story told me that they initially found Kushner’s over-the-top politeness baffling or even odd.,Center,1,fortune,36.93,-2.44
"However, most renters and buyers expect windows in their apartment units-and most jurisdictions actually require that all apartments have them.",Center,0,fortune,36.93,-2.44
"And along with the outrage on both warring sides, some people raised questions about whether the gruesome scenes were even real, or whether the images were so-called deepfakes that had been created with the help of artificial intelligence.",Center,0,fortune,36.93,-2.44
"Seryl is wearing a long black dress, as if mourning our interview before it even starts.",Center,1,fortune,36.93,-2.44
"The Biden Administration’s federal trade agency has been aggressive under Lina Khan, making these difficult market dynamics all the more painful to venture capitalists.",Center,1,fortune,36.93,-2.44
"His genius: Once he’s achieved an innovative design for a car or rocket, he’s expert at creating a super-low-cost, ultra-high-volume production machine.",Center,1,fortune,36.93,-2.44
"There were a few of them, of course, at the time.",Center,0,fortune,36.93,-2.44
Text-messaging app GroupMe was acquired by Skype one year after Thrive funded it; e-commerce eyeglasses darling Warby Parker would later go public at a nearly $7 billion valuation.,Center,0,fortune,36.93,-2.44
"But that’s cowardly leadership, says Richard Edelman, CEO of his namesake PR firm.",Center,1,fortune,36.93,-2.44
"In the chaos following the massacres-the deadliest in the country’s 75-year existence-Israel blocked Gaza’s supplies of water, food, and electricity and dropped thousands of bombs on what it claimed were Hamas targets in the packed coastal enclave that’s home to 2 million Palestinians.",Center,1,fortune,36.93,-2.44
"That means: 10% of effort to build machine-learning models, 20% involving high-quality data and technology implementation, and 70% focused on developing new business processes or transforming the way business functions operate.",Center,0,fortune,36.93,-2.44
"The 6-foot-3, thin-framed investor is wearing a white T-shirt beneath a navy blue cardigan: It looks like it came from Mr. Rogers’ closet, but somehow on Kushner it looks stylish.",Center,1,fortune,36.93,-2.44
"This year marks the 10th anniversary of The Information, the expensive and exclusive tech publication from Jessica Lessin.",Center,0,fortune,36.93,-2.44
"His glorious predictions that the Boring Company would dig a 10-mile tunnel under L.A. or that Tesla Energy would produce 1,000 solar panel systems per week are long forgotten, perhaps even by Musk himself.",Center,1,fortune,36.93,-2.44
It takes fewer than five minutes into an interview with Tom Siebel before the tech billionaire begins to raise the alarm about artificial intelligence’s many risks.,Center,1,fortune,36.93,-2.44
"We’ve added a lot of work around user-generated content, including the ability to upload photos.",Center,0,fortune,36.93,-2.44
"There is some irony, however, to Dimon’s strident anti-crypto position since his bank has quietly become of one Wall Street’s leading innovators when it comes to blockchain, the distributed ledger technology that undergirds Bitcoin and other cryptocurrencies.",Center,1,fortune,36.93,-2.44
"Rents have soared at the same time, and you’d think that’s jackpot time for landlords.",Center,1,fortune,36.93,-2.44
They should look in their own house before pointing the finger at us.,Center,1,fortune,36.93,-2.44
"But wading into the Israel-Hamas war, via this particular topic of sexual violence, is perhaps her boldest stance yet.",Center,1,fortune,36.93,-2.44
"His cool-kid vibe has helped him float comfortably in power circles, equally at ease among celebrities like Katy Perry and Shawn Mendes or CEOs like Iger and Kravis.",Center,1,fortune,36.93,-2.44
"If the majority is not in favor, often a deal does not happen, and even Kushner lets himself get overruled.",Center,1,fortune,36.93,-2.44
"Not all of Thrive’s bets of the 2010s were successful; Thrive invested in e-retailer Fab and the much-mocked Keurig-for-juice startup Juicero, two infamous flops.",Center,1,fortune,36.93,-2.44
And in the two-by-two matrix of men and women being warm and not warm and competent and not competent.,Center,0,fortune,36.93,-2.44
"Spotify’s many headaches Spotify has, on reflection, done incredibly well to maintain its status as the world’s biggest music platform as tech giants like Apple, Google, and Amazon tried to grab a piece of the market with their own offerings.",Center,0,fortune,36.93,-2.44
"Spotify maintains that the $1 billion-plus investment was crucial in bringing new podcast listeners to the platform, and a recent strategy shift that has seen big deals not renewed is the product of a plan to drive higher margins for each of its sponsored shows.",Center,1,fortune,36.93,-2.44
"This fall, public filings revealed that the University of Texas pension fund, an LP, had written down the value of its Thrive investment by 31%.",Center,0,fortune,36.93,-2.44
Gen Z has gained a considerably negative reputation in the workforce.,Center,1,fortune,36.93,-2.44
"Now that people are comfortable going to the cinema once more, however, the entertainment giant is moving those films from the living room to the big screen.",Center,0,fortune,36.93,-2.44
"When the gaze of any nascent technology is focused entirely on a few personalities and institutions, things are almost guaranteed to go sideways.",Center,1,fortune,36.93,-2.44
And spreading the word is difficult given that Musk is extremely skeptical of advertising.,Center,1,fortune,36.93,-2.44
"But the opportunity to schmooze powerful people and persuade them to entrust you with their money is one most twentysomethings don’t get, no matter how smart or charismatic.",Center,1,fortune,36.93,-2.44
"But Musk also has a list of two dozen coinvestors that he’d like to keep happy, a gilt-edged group that includes Prince Alwaleed bin Talal of Saudi Arabia and Marc Andreessen.",Center,1,fortune,36.93,-2.44
"He scrambled an emergency meeting that morning with Clarity’s team, to trigger an action plan.",Center,0,fortune,36.93,-2.44
"The ability to spin such exciting narratives creates a leap of faith for Tesla investors, and the funds and superrich backing his ventures from X to SpaceX.",Center,1,fortune,36.93,-2.44
"The watchdog, created in 2011 in the wake of the 2008 Financial Crisis, is facing a Supreme Court case that could determine its future.",Center,0,fortune,36.93,-2.44
"The funding, logistical support, and pep talks arrive whenever they’re needed; the ego trips and the harsh words rarely do.",Center,1,fortune,36.93,-2.44
"According to the FT report, reducing reliance on the US dollar and other G7 currencies had become essential for China due to the escalation of sanctions against Russia and tensions with the US over Taiwan.",Lean Right,0,rt,28.66,11.46
"We can always give the guys some tips on ice hockey play, where we have more experience.",Lean Right,0,rt,28.66,11.46
"Baltika already exports to more than 40 countries, but not yet South Africa, Lazarenko noted.",Lean Right,0,rt,28.66,11.46
"Warsaw has unilaterally blocked agricultural imports from Kiev, which had flooded the European market and, Polish leaders say, hurt local farmers.",Lean Right,0,rt,28.66,11.46
"Israel has killed over 70 Palestinian journalists since October 7, according to Gaza authorities.",Lean Right,0,rt,28.66,11.46
"The militant group, which has waged a guerrilla war in Manipur since the 1960s, has signed a peace agreement with New Delhi The oldest militant group operating in the valley region of Manipur state in India’s northeast has signed a peace agreement with the federal government in the backdrop of a deadly ethnic conflict that has lasted since May and displaced millions of people.",Lean Right,1,rt,28.66,11.46
"The lyrics also hint at thoughtful and nervous feelings, but the song itself is lightweight and even frivolous.",Lean Right,1,rt,28.66,11.46
"With the death of the left comes an opportunity for the right Enter a Czech lawyer named Jindrich Rajchl, who leads the emerging political party, PRO.",Lean Right,1,rt,28.66,11.46
"On the one hand, it invited Pavel Zdunov, the KHL’s top rookie in 2010/11 and Gagarin Cup winner Vladimir Malinovsky, while on the other, it had Igor Motov, a champion of Russia in cybersports.",Lean Right,0,rt,28.66,11.46
"From childhood, they are taught to be loyal to their leader and to beware of western values.",Lean Right,1,rt,28.66,11.46
"Israel will enter into a new round of national elections in November and the demarcation of maritime borders has recently been weaponized against the current Israeli leadership, causing ministers to act in order to save face.",Lean Right,1,rt,28.66,11.46
"In the last decade, very few people were ready to discuss such a model in relation to Ukraine.",Lean Right,0,rt,28.66,11.46
"Yet despite its low mobility, the container-type system is still used in the Ukrainian army.",Lean Right,0,rt,28.66,11.46
"The GIFT City, which is being built in the Gandhinagar district in eastern Gujarat, is considered New Delhi’s answer to Singapore and Mauritius as a hub of global start-ups and investments and is one of Modi's flagship projects.",Lean Right,0,rt,28.66,11.46
"The emergency stockpile is currently at its lowest level since 1983 The repeated release of crude oil from the US Strategic Petroleum Reserve (SPR) by the Biden administration has left the national stockpile at its lowest in more than 30 years, according to US Oil and Gas Association President Tim Stewart.",Lean Right,1,rt,28.66,11.46
"Russia has never rejected such an option, and it was Kiev that withdrew from the talks in spring 2022, he noted.",Lean Right,0,rt,28.66,11.46
"The sit-down then became heated, as lawmakers shifted their focus to the debate over US border policy and continued aid to Kiev.",Lean Right,0,rt,28.66,11.46
"Researchers have called for decisive actions to increase productivity by reducing the wealth gap between Britain’s cities, championing services exports and boosting public investment.",Lean Right,0,rt,28.66,11.46
"Earlier this year, the Stockholm International Peace Research Institute reported that Russia had overtaken China as the leading arms seller in sub-Saharan Africa, with its market share having risen to 26% as of 2022.",Lean Right,1,rt,28.66,11.46
"There will, of course, be new measures - not only because the current ones are ineffective but also because this is now a runaway train that cannot be stopped.",Lean Right,1,rt,28.66,11.46
"The final game was awesome, both the cyber part and the physical part.",Lean Right,1,rt,28.66,11.46
"This mode of thinking is especially relevant in the East-West geopolitical dynamic, whereby Western countries hold themselves to be inherently superior and the ultimate standard of civilization in the world.",Lean Right,1,rt,28.66,11.46
"However, it will take dozens of Patriot batteries to cover all the administrative and political centers of Ukraine, including regional cities and key energy facilities.",Lean Right,0,rt,28.66,11.46
"Republican representative Thomas Massie claims that the money being sent to Kiev ultimately ends up in the pockets of stockholders The US Congress is continuing to vote in favor of sending billions of dollars to Ukraine because a lot of that money ends up being laundered back into the US military-industrial complex, Kentucky Representative Thomas Massie has said.",Lean Right,1,rt,28.66,11.46
"It adds that the leak, which it says is likely to continue until 2050, could contaminate groundwater should the situation worsen further.",Lean Right,0,rt,28.66,11.46
"Japan, in turn, hiked tariffs on Russian seafood in April 2022, but the ban does not target wholesale imports.",Lean Right,0,rt,28.66,11.46
"In Ukraine in 2004, National Endowment for Democracy's programs radicalized local youth and funded protest movements, bussed paid demonstrators into Kiev, created opposition media outlets to agitate for upheaval, provided offshore training to activists, and paid local pollsters to publish surveys indicating significant anti-government sentiment.",Lean Right,1,rt,28.66,11.46
"Before this development, the Czech Republic boasted one of Europe’s, if not the world’s, most favorable public finance outlooks.",Lean Right,0,rt,28.66,11.46
"During the seven-day pause in hostilities, nothing shifted in Israel’s favor to make its victory possible.",Lean Right,0,rt,28.66,11.46
"As with the coronavirus, it was not long before there followed accusations of a government cover-up of the extent of the spread.",Lean Right,1,rt,28.66,11.46
"Entire major cities such as Shanghai found themselves in lockdown, and these restrictions only became more tedious as Covid variants became more transmissive.",Lean Right,1,rt,28.66,11.46
"The chair of the 2023 United Nations Climate Change Conference, now underway in Dubai, claimed that a gradual reduction in fossil fuel consumption would hold back sustainable development and drag humanity back to the Paleolithic period.",Lean Right,0,rt,28.66,11.46
"According to the report, the shortfall is partly due to traders simply ignoring the price ceiling, with Russian oil selling for roughly $70 a barrel.",Lean Right,0,rt,28.66,11.46
"However, he admitted that even a delay in the provision of American aid could pose a challenge for Kiev.",Lean Right,0,rt,28.66,11.46
Infowars provocateur Alex Jones released an arcade-style video game called New World Order Wars based on his political escapades on Thursday.,Lean Right,0,rt,28.66,11.46
