text,source_party,label,source,reliability,bias
"Some people living with the condition become apathetic, start missing work deadlines, drastically change their eating habits or make extravagant purchases.",Lean Left,0,san-diego-union-tribune,45.68,-1.76
The chasm between the haves and have-nots is about to become more profound than any time in the history of the sport.,Lean Left,1,san-diego-union-tribune,45.68,-1.76
Groundwater is being pumped faster than it can be naturally replenished.,Left,0,alternet,32.71,-14.76
"Our civilization’s collapse will be unique in size, magnified by the destructive force of our fossil fuel-driven industrial society.",Left,1,alternet,32.71,-14.76
"Amidst the violence, five whites died, but for those deaths, someone would have to be held accountable.",Left,1,alternet,32.71,-14.76
"Across generations, over half of US adults say that they’ve gone on a diet to improve their physical health.",Left,0,alternet,32.71,-14.76
"White households, on the other hand, had a median liquid asset number of $12,000.",Left,0,alternet,32.71,-14.76
"With the new release of data, hundreds of towns and millions of people will probably be learning for the first time that their water is contaminated with PFAS.",Left,0,alternet,32.71,-14.76
"Arizona and Nevada agreed to take the first cuts to help prop up Lake Mead, while California agreed to participate at lower shortage levels if the reservoir continues to drop.",Left,0,alternet,32.71,-14.76
"And while we should have no illusion that a Trump conviction will sway or de-radicalize the most hard-line elements of his following or those who have slipped into the abyss of domestic extremism, it could help stanch the pipeline of those on the cusp of transitioning into violent extremism and cut off the flow of members and sympathizers that these groups rely on to fund and swell their ranks.",Left,1,alternet,32.71,-14.76
"Following the board's decision in June, hundreds of parents and teachers in the district connected on social media and began a public pressure campaign, calling on the district to offer meals to all children without requiring proof of income.",Left,0,alternet,32.71,-14.76
Protestors gather in support of the writers strike at La Brea Tar Pits in L.A. in June.,Left,0,alternet,32.71,-14.76
But he should have known at the very beginning what it was all about.,Left,1,alternet,32.71,-14.76
Building a reliable pipeline of homegrown arms is exactly how Breslow made his name as an executive in the first place.,Lean Right,0,boston-herald,36.31,9.68
"Yet, with all these Wonder Woman-sized missions of self-fulfillment on the go, there’s still more to do.",Lean Right,1,boston-herald,36.31,9.68
"The fund is a chance for people who voted to reintroduce wolves to help pay for the consequences borne by those who voted against the reintroduction but now live with its impacts, Crooks said.",Lean Right,1,boston-herald,36.31,9.68
"Massachusetts, like urban states elsewhere in the country, is overwhelmed with illegal immigrants and is in a quandary what to do about them.",Lean Right,1,boston-herald,36.31,9.68
"During that time, he said he came to accept the wolves and changes that were coming, though other ranchers remain bitter.",Lean Right,0,boston-herald,36.31,9.68
"Sparked by another hot start, the Celtics crushed the Pacers - who were without All-Star guard Tyrese Haliburton - with a comically dominant 155-104 victory at TD Garden that was never in doubt from the opening tip.",Lean Right,1,boston-herald,36.31,9.68
"Furthermore, the dynamics in New Hampshire are much more favorable to Haley’s posture as a mainstream, pre-Trump Republican.",Lean Right,1,boston-herald,36.31,9.68
"Those who claim the system is broken regularly cite long wait times, backlogs and the lack of a path to citizenship for illegal immigrants to support their contention.",Lean Right,0,boston-herald,36.31,9.68
The only parts of our immigration system that are currently broken are the moral and political compasses of those we have chosen to oversee it.,Lean Right,1,boston-herald,36.31,9.68
"Also, a loving filmography, a minor class in underground cinema, a cast yearbook, a lionizing and some great contextual essays (including one by David Simon).",Lean Right,0,boston-herald,36.31,9.68
The EV revolution has always been primarily powered by fossil fuels.,Lean Right,1,boston-herald,36.31,9.68
They held a seven-point lead at halftime despite shooting poorly from deep because of their defense.,Lean Right,0,boston-herald,36.31,9.68
"Each of the players in that group played 27 minutes or fewer, which should have long-term benefits for the Celtics with how much they will rely on that group throughout the season, especially if they continue to pummel teams like this.",Lean Right,0,boston-herald,36.31,9.68
"Once BC stopped turning the ball over, the Eagles rallied for six straight points accentuated by a Caudell Harris (14 points) slam dunk with 14:31 on the clock.",Lean Right,0,boston-herald,36.31,9.68
Their concept is not that they can beat Israel on the battlefield.,Lean Left,1,the-guardian,40.67,-7.97
"Photograph: Jeremy Sutton-Hibbert/Getty Images 14 Fingersmith by Sarah Waters (2002) Moving from the underworld dens of Victorian London to the boudoirs of country house gothic, and hingeing on the seduction of an heiress, Waters’s third novel is a drippingly atmospheric thriller, a smart study of innocence and experience, and a sensuous lesbian love story - with a plot twist to make the reader gasp.",Lean Left,0,the-guardian,40.67,-7.97
"And, as in any lavishly produced period drama, there’s a problem with the fourth wall: even if the costumes and settings and turns of phrase were completely of their time, such authenticity would still jar with the awareness that it’s recorded with state-of-the-art, 21st-century technology.",Lean Left,0,the-guardian,40.67,-7.97
"Central London is befuddling, but there is some wonky sanity at play here.",Lean Left,0,the-guardian,40.67,-7.97
"During her SCOTUS confirmation hearings, when Senator Ted Cruz questioned her involvement with a private school in Georgetown which assigned outrageous Critical Race Theory books that, for example, demanded that babies must confess to being racists, Jackson tried to ignore his question but as a board member of this school she was fully responsible for its lunatic curriculum.",Right,1,american-greatness,18.93,22.45
"DAN PROFT COMMENTARY: Argentines found their Howard Beale last weekend in the form of their President-elect Javier Milei, only their screaming at the powers that be occurred at the ballot box.",Right,1,american-greatness,18.93,22.45
"The two young men at their table, who stare at them in a mingled embarrassment and incomprehension, would also have been familiar; a little the worse for wear, the blond, and a little boorish, his friend who does not bother to put out his cigarette or take off his cap.",Right,1,american-greatness,18.93,22.45
"So far, no one has been killed, but as unchecked aggression continues, so too does the chance for a deadly encounter-one that could spark a war.",Right,1,american-greatness,18.93,22.45
"Even today, a bachelor’s degree confers a 75% boost to lifetime earnings over a high school diploma.",Right,0,american-greatness,18.93,22.45
"Clearly, this unqualified Justice has spent much of career promoting bizarre racial conspiracy theories - like babies are racists - and she will use this propaganda to undermine our constitutional rights.",Right,1,american-greatness,18.93,22.45
Ebrard is now running for president of Mexico with the Movimiento Regeneración Nacional (MORENA) party.,Right,0,american-greatness,18.93,22.45
"Rather than taming this insane fiscal profligacy, Biden and his willing GOP allies on the Hill, like Mitch McConnell, simply pretend that the crisis-level binge can continue, and even accelerate.",Right,1,american-greatness,18.93,22.45
"First, the US needs to stop trying to sell the worn out two state illusion, to stop parroting a decades old policy that has no current basis in reality.",Right,1,townhall,24.95,19.79
"As a result, although the number and Case 1:22-cv-00986-GTS-CFH Document 78 Filed 11/07/22 Page 138 of 184.",Right,0,townhall,24.95,19.79
"No, we don’t think men can be women; we’re pro-free speech, and we believe Hamas is a terrorist organization that deserves to be annihilated by Israel.",Right,1,townhall,24.95,19.79
Hard-working Americans across the country deserve better than the failed leadership from the Biden Administration.,Right,1,townhall,24.95,19.79
"That's not easy, but it is the only way forward for Israel, is the only way forward for long-term peace.""",Right,0,townhall,24.95,19.79
"That said, by any measurable statistic, the economy under the Trump Administration was measurably better than it is today under the Biden Regime.",Right,1,townhall,24.95,19.79
"As is apparently required of any woman running for president -- e.g., Hillary Clinton and Carly Fiorina -- Haley is trying to prove she's macho enough to become commander-in-chief by being a jingoistic warmonger.",Right,1,townhall,24.95,19.79
"Its fact check declares that a composite image of Saleh Aljafarawi in various characters, such as a doctor, a war correspondent, and even a Hamas freedom fighter, is taken out of context.",Right,0,townhall,24.95,19.79
"Remember the Palestinian civilians (including the old guy with a walker) shown on CCTV coming into Israeli settlements to steal, rape and take captives?",Right,1,townhall,24.95,19.79
"Advertisement No Shortage of Ineffectiveness Lloyd Austin, Secretary of Defense, and his Afghanistan withdrawal, and Merrick Garland, Attorney General, who leads the nation’s top criminal organization, in a two-way tie with William Burns, Director of the Central Intelligence Agency, merit mention.",Right,1,townhall,24.95,19.79
"The civil rights movement was pivotal in laying the groundwork for equal, color-blind protection before the law, ensuring that black Americans not be judged by the color of their skin but rather by the content of their character.",Right,0,townhall,24.95,19.79
"Liberal Journalist Tries (and Fails) to Trap Pierre Poilievre During a Presser A liberal journalist tried to make Justin Trudeau’s rival, conservative leader Pierre Poilievre, look like a fool for calling the Rainbow Bridge explosion terrorism.",Right,1,townhall,24.95,19.79
"Advertisement Cancel culture has been full of hypocrites for years, and the aftermath of the October 7 attacks put that hypocrisy on center stage.",Right,1,townhall,24.95,19.79
Kaelan Dorr is CEO of Baldur Strategies and acting chief marketing officer for Tusk Browser.,Right,0,townhall,24.95,19.79
"Joe Scarborough came out with his own Hitler blather, stipulating that Trump will imprison whomever he chooses and then execute them.",Right,1,townhall,24.95,19.79
"It is well past time for the Administration to meaningfully engage with us.""",Right,1,townhall,24.95,19.79
"That depends on which value prevails: Are our rights only what lawmakers have written down, or are they personal attributes immune from governmental reach?",Right,0,newsmax,28.9,13.54
"The group Physicians for Human Rights Israel, which has a record of advocating for Palestinian civilians in Gaza suffering under Israel's longtime blockade of the territory, published an initial assessment in November.",Right,0,newsmax,28.9,13.54
"For all Canadian gamblers looking to expand their casino library, Maple Casino’s offerings are sure to scratch the itch.",Right,0,newsmax,28.9,13.54
"Adm. John Kirby, White House National Security Council coordinator for strategic communications, declared Israel is not committing genocide against the Palestinians in Gaza.",Right,0,newsmax,28.9,13.54
"From his position, Paul Landis had a front-row seat to the horrors of that day.",Right,0,newsmax,28.9,13.54
"So, even if brain changes are taking place, an upbeat personality might be countering the effect and allowing people to better cope, the researchers theorized.",Right,0,newsmax,28.9,13.54
"Lee is a frequent guest on Fox, Fox Business, Newsmax, and a published policy and opinion writer for numerous media publications.",Right,0,newsmax,28.9,13.54
"The single trait that distinguishes both the city of Savannah and its people is charm, and charm can soothe even the most savage of beasts.",Right,1,newsmax,28.9,13.54
However BOA has an employee nonprofit matching program that’s nearly as good as Alphabet/Google’s.,Right,1,newsmax,28.9,13.54
Chris Christie and biotech entrepreneur Vivek Ramaswamy to assert themselves as the best alternatives to Trump.,Right,0,newsmax,28.9,13.54
Vladimir Putin's new strategy in the war he launched on Ukraine in February is to conscript the coming winter of 2022-23 as an ally of his failing army.,Right,1,newsmax,28.9,13.54
"Apparently, part of the plan is to convince the American public that Joe Biden has been a great president, mostly when you weren’t looking.",Right,1,infowars,15.78,23.58
"When the war first began in February 2022, Ukrainian recruits were plentiful; people volunteered in droves to defend their land from Russian invaders, while a mass mobilization effort that forbade nearly all men between the ages of 18 and 60 from leaving the country bolstered troop numbers early-on.",Right,0,infowars,15.78,23.58
Here are four photos of Biden meeting with his deadbeat son's business associates.,Right,1,infowars,15.78,23.58
"As the New York Times scribe points out, mortgages can be prepaid with no penalty.",Right,0,infowars,15.78,23.58
That’s because voters don’t care about legislative victories; they care about their own families.,Right,1,infowars,15.78,23.58
"In a plea to Congress for more funding before Christmas, Joe Biden baselessly claimed Russian President Vladimir Putin plans to invade NATO countries once Russia has defeated Ukraine.",Right,1,infowars,15.78,23.58
"We’ll note, however, that this would be the third time since late September that Congress has failed to act on Ukraine funding, even as the situation there is clearly getting more urgent by the day.",Right,0,infowars,15.78,23.58
"Senate Majority Leader Chuck Schumer has been repeating, both in public and in private, that H.R.",Right,0,infowars,15.78,23.58
"The US Congress is continuing to vote in favor of sending billions of dollars to Ukraine because a lot of those funds end up being laundered back to the US military-industrial complex, Kentucky Representative Thomas Massie has said.",Right,1,infowars,15.78,23.58
"In fact, Srettha Thavisin, the new prime minister, has said recently that he would not support the recreational use of cannabis of any kind.",Lean Left,0,the-economist,42.4,-1.43
"The bewildering variety makes it hard for consumers to pick, so they rely more on recommendations, whether from friends or algorithms.",Lean Left,0,the-economist,42.4,-1.43
"One option is to remove the bits of the viral genome that let phages settle down to a temperate life in a bacterial genome, leaving them no option but to keep on killing.",Lean Left,0,the-economist,42.4,-1.43
After 1914 the antagonisms and ambitions of European nation-states with colonies on almost every continent twice dragged the whole world into war.,Lean Left,0,the-economist,42.4,-1.43
"It is accessible via Man in the Moon Passage, the kind of street name that evokes gas lamps and fog - a Dickensian London near-buried by high rises and co-working spaces.",Lean Left,0,the-economist,42.4,-1.43
"Someone in full Lycra and with a fast bike will inevitably huff and puff their way around London in pursuit of my record, and of an ephemeral moment of greatness.",Lean Left,0,the-economist,42.4,-1.43
"He is a sclerotic and uninterested leader; both he and his aides, some of whom are also his possible successors, are widely seen as corrupt.",Lean Left,1,the-economist,42.4,-1.43
"They nearly killed another former spook in Britain, Sergei Skripal, and his daughter Yulia with Novichok, a nerve agent, in 2018.",Lean Left,0,the-economist,42.4,-1.43
And Russian President Vladimir Putin - in contrast to the silence he often maintained in the first year of the war - trumpets at every opportunity what he calls the counteroffensive’s failure.,Lean Left,1,washington-post,38.8,-6.85
Sunday’s two-hour forum marked the first time the Latino Democrats of Prince George’s County hosted any campaign forum event - both live-streamed and translated into Spanish - signaling the growing political power and organization of a voting bloc that has often been taken for granted nationally by the Democratic establishment.,Lean Left,1,washington-post,38.8,-6.85
"The White House and Congress, she said, should force drugmakers to negotiate with states to start importation programs.",Lean Left,0,washington-post,38.8,-6.85
But the capitalist in me wonders what goodness we’re missing because two smartphone companies and three mobile service providers are happy (and rich) from America’s smartphone rut.,Lean Left,1,washington-post,38.8,-6.85
A new generation of Australian sports stars with the style has only added to the cachet.,Lean Left,0,washington-post,38.8,-6.85
"Advertisement In Munich, hundreds of flights have been canceled daily since late last week because of the snow.",Lean Left,0,washington-post,38.8,-6.85
"He didn’t know where all of his players were - or his own family, for that matter.",Lean Left,1,washington-post,38.8,-6.85
"NORCROSS: ... So any event on your campus, you would never interfere for the fear of censoring somebody.",Lean Left,1,washington-post,38.8,-6.85
"He was accused of selling military secrets to Germany, France’s hated foe, in a case marked by faked evidence and an explosion of antisemitism sparked by rage over Jews’ supposed disloyalty to France.",Lean Left,1,washington-post,38.8,-6.85
"The plan called for the 47th, and the 9th Corps, to breach the first Russian line of defense and take Robotyne.",Lean Left,0,washington-post,38.8,-6.85
"There are several theories why exercise may improve immune function, Kohut says, such as muscle-secreted proteins that influence the immune response and exercise-induced changes in the production of metabolites - chemical compounds that the body generates during metabolism.",Lean Left,0,washington-post,38.8,-6.85
Four male victims in their 20s and a 19-year-old female victim all suffered non-life-threatening injuries.,Lean Right,0,fox-business,38.81,9.11
CLICK HERE FOR MORE SPORTS COVERAGE ON FOXBUSINESS.COM Adelson said in a Las Vegas Sands filing earlier Tuesday she would sell $2 billion in stock to buy a majority stake in a sports franchise.,Lean Right,0,fox-business,38.81,9.11
"Restaurant Openings The company’s efforts to further boost unit growth will likely be a significant focus, according to analysts.",Lean Right,0,fox-business,38.81,9.11
"The FAA, however, has noted in the past that it has been working to address these issues, such as increasing mental health training for medical examiners, supporting industry-wide research and clinical studies on pilot mental health, and hiring additional mental health professionals to expand in-house expertise and to decrease wait times for return-to-fly decisions.",Lean Right,0,fox-business,38.81,9.11
"STUA VARNEY: COP28, the great climate confab, is descending into a farce, and it's not over yet.",Lean Right,1,fox-business,38.81,9.11
"STUDENT LOAN INTEREST PAYMENTS AXED UNDER NEW LEGISLATIVE BILL Now, borrowers must prove they meet three criteria in order to offload their student loan debt: lack the ability to repay the loan currently, are unable to repay the loan in the future and made a good-faith effort to repay the loan.",Lean Right,1,fox-business,38.81,9.11
"We have an opportunity now to respond, but we have to do it quickly,"" Cramer said.",Lean Right,0,fox-business,38.81,9.11
"In partnership with Fanatics, Survivor Series broke the premium live event’s all-time merchandise record.",Lean Right,0,fox-business,38.81,9.11
"Sure, the university isn't keeping everything, but the alternative could be empty pockets altogether.",Lean Right,1,fox-business,38.81,9.11
"DONALD TRUMP TAILGATES BEFORE IOWA-IOWA STATE GAME, CROWD GOES CRAZY AS HE WALKS INTO STADIUM The University of Texas at Austin, University of Minnesota and West Virginia University (WVU) have been known to sell alcohol stadium-wide for years.",Lean Right,0,fox-business,38.81,9.11
"With Treasury markets already nearing the brink, could a cyberattack push them over the edge?",Lean Right,0,fox-business,38.81,9.11
"Despite ICBC’s size, the part of the bank that handles Treasuries only has about $23 billion in total assets, just a small portion of which would’ve even been available for purchasing new Treasuries last Thursday.",Lean Right,0,fox-business,38.81,9.11
"Online transactions totaling $600 or more will not trigger tax reporting on Form 1099-K, for now.",Lean Right,0,fox-business,38.81,9.11
"The cost of servicing the debt exceeded everything else, including military spending.",Lean Right,0,fox-business,38.81,9.11
"Something is terribly, terribly wrong with this picture and we have to look at what's really going on.",Lean Right,1,fox-business,38.81,9.11
"The Ocean House was also awarded two additional Five-Star ratings for its top-tier spa and restaurant, making it one of 14 hotels in the world to be awarded this honor.",Lean Right,0,fox-business,38.81,9.11
"JOHN KERRY PLEDGES TO SLASH EMISSIONS FROM AC UNITS, REFRIGERATORS TO FIGHT CLIMATE CHANGE Meanwhile, manufacturing has been contracting for 13 straight months.",Lean Right,1,fox-business,38.81,9.11
He pointed to factors such as the business changing and the quality of some of the films.,Lean Right,0,fox-business,38.81,9.11
The Maud Foster Windmill is over 200 years old - and dominates the skyline over the Lincolnshire market town of Boston in the U.K.,Lean Right,0,fox-business,38.81,9.11
The items can be sent to either the user or someone else.,Lean Right,0,fox-business,38.81,9.11
CLICK HERE TO GET THE FOX NEWS APP Christine Rousselle of Fox News Digital contributed reporting.,Lean Right,0,fox-business,38.81,9.11
China today is looking for a similar opening and the Biden administration’s financial depletion of the U.S. will make any cyber warfare from Chinese state actors more effective.,Lean Right,1,fox-business,38.81,9.11
"While his reputation has not fully recovered, the music industry-radio, streaming, concert promoters-has re-embraced him and country-music fans have stood by him.",Lean Right,0,fox-business,38.81,9.11
SPOTIFY HAS HIGHER-PRICED SUBSCRIPTION PLAN IN THE PIPELINE: REPO Spotify announced Wednesday that users have listened to her songs more than 26.1 billion times since Jan. 1.,Lean Right,0,fox-business,38.81,9.11
"The U.S. accounts for around 15%, using its one active rare earth mine.",Lean Right,0,fox-business,38.81,9.11
GET FOX BUSINESS ON THE GO BY CLICKING HERE The poll found that 77% percent of Americans surveyed support increased military spending.,Lean Right,0,fox-business,38.81,9.11
"There’s two main things to do or look for to protect yourself online, according to officials.",Lean Left,0,global-news,44.54,-4.26
"Despite her eye-popping statistics sheet, Sinclair’s teammates describe her as unassuming and humble.",Lean Left,1,global-news,44.54,-4.26
"When we look at him, we see the redemptive nature of God and the beauty he uniquely brings into the world because of his Down syndrome.",Lean Right,1,the-christian-post,36.41,10.31
"According to the conference, 24 of the 51 churches are located in the South (Kaskaskia-Cache River) District, while 12 are in the East (Embarras-Iroquois River) District, eight are in the Central (Mississippi-Sangamon River) District, four are in the West (Spoon-LaMoine River) District and three are in the North (Vermilion-Illinois River) District.",Lean Right,0,the-christian-post,36.41,10.31
"Surrender the outcome to His all-wise and all-loving will, and faithfully obey what He tells you to do.",Lean Right,1,the-christian-post,36.41,10.31
"When we approach old age with mournful withdrawal and passivity, we allow others to try to tell the story and frame the memories that we should be passing on for ourselves.",Lean Right,1,the-christian-post,36.41,10.31
And the statement that the pastoral undershepherds are going to give an account to the Lord Jesus concerning their watch care should be sobering to all who have the privilege of being the Lord’s undershepherds here on Earth of some of the Great Shepherd’s flock.,Lean Right,1,the-christian-post,36.41,10.31
"Consequently, Christians, as the Body of Christ, have an even bigger advantage since they are organically and spiritually connected to Jesus as the mastermind of the universe (Ephesians 1:22-23).",Lean Right,1,the-christian-post,36.41,10.31
Many of them were carrying wooden sticks and they beat us with them.,Lean Right,0,the-christian-post,36.41,10.31
We wanted to tell the story of Jesus in creative and in new ways that people can hear about.,Lean Right,0,the-christian-post,36.41,10.31
Suddenly we are given the unfathomable gift of becoming a living soul.,Lean Right,0,the-christian-post,36.41,10.31
"Those books, with their emphasis on revelation and Christian martyrdom, pushed a narrative of Christ as a powerful figure of vengeance and retribution.",Left,1,vox,39.59,-10.05
"In Collins v. Mnuchin (2019), for example, Ho signed onto an opinion by Judge Don Willett that threatened to invalidate every single action taken by the Federal Housing Finance Agency (FHFA), which was created in 2008 to stabilize the US housing market during a historic recession.",Left,0,vox,39.59,-10.05
"The soldiers dehumanize the family further, searching their grocery bags to find Yasmin’s soiled pants from before and taunting them.",Left,1,vox,39.59,-10.05
