text,source_party,label,source,reliability,bias
"It's well-built, with an extremely sturdy-feeling polycarbonate shell and aluminium frame, the wheels offer a smooth ride over most surfaces and it has a hidden, removable battery pack with USB-C fast charge for giving your phone a quick boost while you idly tap away at solitaire as you wait for your gate to be announced.",Center,0,cnet,40.02,-1.39
We Drive Solar will only let its V2G cars go down to 25% or 30% of a full charge.,Center,0,cnet,40.02,-1.39
"Gemini is the next generation of Google's large language model, a sequel to the PaLM and PaLM 2 that have been the foundation of Bard so far.",Center,0,cnet,40.02,-1.39
These thought exercises help me zoom out to see the bigger picture a bit.,Center,0,cnet,40.02,-1.39
"Pros Useful organization: Uninstaller categorizes your installed apps into several tiers: Recently installed, Large programs, Infrequently used, and Windows Updates.",Center,0,cnet,40.02,-1.39
"We'll also see a bigger focus from all sides on sustainability: Apple, for instance, went to great lengths during its iPhone 15 launch event in September to flex its green credentials.",Center,0,cnet,40.02,-1.39
"Across multiple cities, AT&T, Verizon, Earthlink and CenturyLink provided inferior broadband service to lower-income, Black and Latino neighborhoods.",Center,0,cnet,40.02,-1.39
"An automated interview platform could benefit candidates battling shyness or social anxiety, but it could also easily discriminate against neurodivergent folks or non-native English speakers.",Center,0,cnet,40.02,-1.39
"Unlike United, Chelsea are showing signs of improvement after their poor start to the campaign, with Mauricio Pochettino's men coming into this fixture off the back of a feisty 3-2 victory against Brighton.",Center,0,cnet,40.02,-1.39
Either laminate the cells for a short-lived panel or encapsulate in glass.,Center,0,cnet,40.02,-1.39
"Apple told CNET that there were four causes that made an iPhone feel warmer than normal, none of which were specifically tied to Pro models, their titanium design or the iPhone 15 series specifically.",Center,0,cnet,40.02,-1.39
"New Peacock Premium subscribers can sign up for the Spectrum deal on Peacock's website, but existing Peacock customers will have to cancel their current subscriptions to sign up for this offer.",Center,0,cnet,40.02,-1.39
"Plus, it has small front and rear fenders to keep you clean.",Center,0,cnet,40.02,-1.39
One of his first projects was banding together with other militant neo-Nazis in Canada to try and form an Atomwaffen cell.,Left,1,vice,38.96,-9.39
"Once airborne, they can float for thousands of kilometers, as far as the Earth’s poles The infinitesimal size of nanoplastics is partly why scientists know little about them.",Left,0,vice,38.96,-9.39
"But one of the lesser-known aspects of this philosophy is its application to food, both in terms of cooking style and as a subjective approach towards eating.",Left,0,vice,38.96,-9.39
"Citing policy, the RCMP could not confirm if Nippak is a part of the MacDonald investigation.",Left,0,vice,38.96,-9.39
"As the overtly edgy and militant aesthetic of Atomwaffen fell out of style in the neo-Nazi scene following several high-profile law enforcement operations and some members went underground, Nippak remained, for lack of a better term, active.",Left,1,vice,38.96,-9.39
"On r/HairTransplants, there’s a good deal of anxiety about being perceived as odd, conceited, or otherwise unattractive because of your hair transplant.",Left,1,vice,38.96,-9.39
"But now, a much smaller, potentially much more nefarious, and less understood threat is drawing scientist’s attention-nanoplastics.",Left,1,vice,38.96,-9.39
"Peter Smith, a researcher and journalist for the Canadian Anti-Hate Network , has studied Active Clubs since they began to pop up in Canada.",Left,0,vice,38.96,-9.39
"The movement is a direct response to the more overtly violent groups such as Blood & Honour, Atomwaffen and even The Base that came before it.",Left,1,vice,38.96,-9.39
"Atomwaffen was an infamous neo-Nazi terrorist organization that emerged in 2016, and has been linked to five murders in the United States .",Left,0,vice,38.96,-9.39
"ABSTRACT breaks down mind-bending scientific research, future tech, new discoveries, and major breakthroughs.",Left,0,vice,38.96,-9.39
"The Hammerskins are a decades-old skinhead group, formed in the 1980s, that has been linked to criminal activity.",Left,1,vice,38.96,-9.39
"Meeting several times a month, members of the semi-autonomous cells train martial arts, put up racist posters, and recruit young, easily manipulated white men to their cause.",Left,1,vice,38.96,-9.39
"There, perfection-defined not by the gender you’re attempting to attract but by your online competition-is measured in millimeters and graphs.",Left,1,vice,38.96,-9.39
"But it was a little bit more comforting when they told me that they would pick me up directly from the airport, chauffeur me right to the hotel, and pick me up for the procedure.",Left,0,vice,38.96,-9.39
The district’s old policy allowed homeschoolers to participate in extracurricular activities.,Lean Left,0,nj.com,43.92,-2.88
So flip a coin: Soto solves so many problems for manager Aaron Boone’s anemic lineup.,Lean Left,1,nj.com,43.92,-2.88
"After finishing boot camp, Melvin returned to East Orange and joined an Air National Guard reserve unit.",Lean Left,0,nj.com,43.92,-2.88
"Last year, Municipal Court Judge, Jason Witcher out of Millville NJ literally opened up a Pandora’s box proving how these issues affect communities of color and he paid a horrible price health wise and professionally for shining light on how unchecked discrimination unfolds at even the local level.",Lean Left,1,nj.com,43.92,-2.88
"Rao’s suit, which makes other claims of impropriety, is pending in state Superior Court in Newark.",Lean Left,0,nj.com,43.92,-2.88
Please sign up for CBN Newsletters and download the CBN News app to ensure you keep receiving the latest news from a distinctly Christian perspective.,Right,1,cbn,34.17,15.24
"SCRIPTURES FOR STUDY Isaiah 59:16 Close Isaiah 59:16 He was amazed to see that no one intervened to help the oppressed.So he himself stepped in to save them with his strong arm, and his justice sustained him.",Right,0,cbn,34.17,15.24
The U.S. urges restraint and PM Netanyahu pledges to destroy Hamas.,Right,0,cbn,34.17,15.24
"The son of a Hamas founder, Mosab Hassan Yousef addressed students before voting began, saying he could not believe activists asked students to make the choice.",Right,0,cbn,34.17,15.24
This group is designed to provide a forum for discussion or comments between students and those going through the courses.,Right,0,cbn,34.17,15.24
"However, unexpected heartache began chipping away at her young faith starting at age 16.",Right,1,cbn,34.17,15.24
"If God shows you the identity of specific spiritual strongholds that are at work, take authority over these strongholds in the name of Jesus.",Right,1,cbn,34.17,15.24
"Years later he started The Wang Vision Institute, establishing a foundation to restore sight for orphans from around the world.",Right,0,cbn,34.17,15.24
The petition also called for the university to revisit its decision against forming a committee to investigate the ethics of its investments in apartheid regimes.,Right,0,cbn,34.17,15.24
She had seen her mother often fast and pray in the past.,Right,0,cbn,34.17,15.24
"This is before they pay for their car licence fee to the parasitic class, or the $0.89c per litre tax on fuel when they fill their car up.",Lean Right,1,zerohedge,20.78,16.08
"According to the Congressional Budget Office, if Trump's 2017 Tax Act provisions are extended, it would increase the deficit by $134 billion in 2026 and $346 billion in 2027.",Lean Right,0,zerohedge,20.78,16.08
"During that meeting, Heidi Hansen, the economic vitality director, who oversees the promotion of the city’s businesses, said the policy is meant to promote tourism.",Lean Right,0,zerohedge,20.78,16.08
"All three were heavy hitters, although the mention of Lott was strange since Brady didn’t play in the same era.",Center,1,heavy,43.64,-2.71
"That’s why you’re selling food in a food cart, because you’re ignorant, but you should learn English.",Center,1,heavy,43.64,-2.71
The belief there is at least 4 teams really in on Ertz.,Center,0,heavy,43.64,-2.71
"It’s still giving midlife crisis post-divorce vibes, but it’s a lot cozier in there.",Center,1,heavy,43.64,-2.71
"Harbaugh has a history in Chicago, the team that drafted him in 1987 and which he led to a 35-30 record as the QB across seven seasons between 1987-93.",Center,1,heavy,43.64,-2.71
"On Monday, at his State of the County address, Pittman noted housing is the top issue his administration hopes to tackle in the upcoming year.",Center,0,baltimore-sun,44.41,-4.13
It is held in place on the table through 3M adhesive tape.,Center,0,baltimore-sun,44.41,-4.13
Players can choose their favorite Mario characters and race them against friends in a multiplayer clash of zany action.,Center,0,baltimore-sun,44.41,-4.13
"In 1990, Citrus and Allied landed in Belcamp, in a 34,000-square-foot warehouse and manufacturing plant.",Center,0,baltimore-sun,44.41,-4.13
"While some leaders are willing to force a shutdown unless drastic cuts are made to important economic security programs, what you won’t hear is a lot of talk about cutting defense.",Center,1,baltimore-sun,44.41,-4.13
It’s a solid choice if you’re not ready to spring for the Beautyblender yet.,Center,1,baltimore-sun,44.41,-4.13
"The Remington cafe’s last day open will be Dec. 23, according to an email sent to customers Friday.",Center,0,baltimore-sun,44.41,-4.13
"Those who believe that there is, are playing with their livelihoods.",Center,1,baltimore-sun,44.41,-4.13
"Which gets us to the unfortunate corruption story, brought to us by Martin Clarke and Harry Gruber, assistant U.S.",Center,0,baltimore-sun,44.41,-4.13
"When trusted institutions mistreat adults who depend on them, most adults recognize it, and they don’t like it.",Center,0,baltimore-sun,44.41,-4.13
This started out to be another look at criminal audacity and corruption - a $20 million fraud scheme that lasted nearly a decade before federal investigators put an end to it.,Center,1,baltimore-sun,44.41,-4.13
"Unique features: This is a classic Spanish Colonial home, a style common in California, Florida and the Southwest but relatively rare in Baltimore.",Center,0,baltimore-sun,44.41,-4.13
Detroit has allowed 30.3 points per game over the past four weeks and needed to sweat out a win over a short-handed Saints team.,Center,0,baltimore-sun,44.41,-4.13
"During the Iraq and Afghanistan wars, most of my audiences would express concerns about U.S. defense spending, but few would actually get angry about it, that is, until I’d tell them about the waste.",Center,1,baltimore-sun,44.41,-4.13
"Meanwhile, Holliday, who was 18 when the Orioles selected him last July, did so in his first full professional campaign.",Center,0,baltimore-sun,44.41,-4.13
A 17-year old was shot Monday morning when a pair of suspects broke into a...,Center,0,baltimore-sun,44.41,-4.13
If only the Orioles had a kid named Jackson who checks all the boxes they could sign.,Center,1,baltimore-sun,44.41,-4.13
"Back then, she was outgoing, radiated confidence, was down to earth, and nothing ever bothered her.",Center,0,baltimore-sun,44.41,-4.13
"The replacement of aging technology is one of the highest critical-need line items, with $5.3 million allocated.",Center,0,baltimore-sun,44.41,-4.13
"He trained his sights on Haley from the get-go, using his first answer to attack her almost immediately.",Lean Left,1,politico,42.32,-5.58
"By the eve of his selection as national security advisor, Kissinger was widely regarded as a thoughtful voice on arms policy and a skeptic on the Vietnam War.",Lean Left,0,politico,42.32,-5.58
"However, the three parties in Germany's ruling coalition - the Greens, the center-left Social Democratic Party (SPD) and the fiscally conservative Free Democratic Party (FDP) - have sharply divergent political priorities.",Lean Left,0,politico,42.32,-5.58
"The lopsided spending on ads, many targeting younger users, coincides with a growing skepticism of Israel among young Americans.",Lean Left,0,politico,42.32,-5.58
"In several testy exchanges, Stefanik, a Harvard alum, pressed Gay over whether Harvard would punish students or applicants who advocate for the murder of Jews.",Lean Left,1,politico,42.32,-5.58
And he has since allegedly returned to some of his old ways.,Left,1,msnbc,34.51,-14.03
"Sadly for Chris Christie, the political lane that would lead him to the White House is so narrow that it can't be seen with the naked eye.",Left,1,msnbc,34.51,-14.03
"If this deal follows other cases of corporate concentration, it will likely be bad for workers, bad for franchise owners, bad for food suppliers and bad for your wallet.",Left,1,msnbc,34.51,-14.03
"According to the Gun Violence Archive (GVA), which tracks incidents of gun violence across the country, there have been 38 mass killings involving guns this year, defined as shootings in which four people or more are killed, not including the shooter.",Left,0,msnbc,34.51,-14.03
Cheney talks with Rachel Maddow about her reaction when she realized what was about to happen.,Left,0,msnbc,34.51,-14.03
"Most significantly, it involved no concessions from Republicans aside from passing an aid package that already has bipartisan support, even if it lacks the votes to clear a GOP filibuster.",Left,1,msnbc,34.51,-14.03
"The Senate legislation is being introduced by Elizabeth Warren and Ed Markey, both D-Mass.",Left,0,msnbc,34.51,-14.03
The mother and daughter served as election workers in Georgia in 2020 and were terrorized thanks to Donald Trump and Giuliani falsely claiming that the pair had committed election fraud.,Left,1,msnbc,34.51,-14.03
"This entire cycle - the petty vindictiveness as governor, the collapse of the tough-talking straight shooter candidate into craven sidekick, and the subsequent failure to reap any political reward for his debasement - is remarkable mainly because Christie never felt the need to act chagrined about any of it.",Left,1,msnbc,34.51,-14.03
"Get that feedback, and you know, you won’t always get the positive feedback.",Left,0,msnbc,34.51,-14.03
His absence of a filter leads to another major issue in covering Trump: his penchant for blatantly but unconvincingly lying like a child whenever he’s confronted with his past statements.,Left,1,msnbc,34.51,-14.03
"If you’re thinking about making a gift of stock you already own, like employer stock or other stock in your portfolio, Kopelman advises against transferring it to a child.",Center,0,marketwatch,40.93,-3.88
The worst part is that he was in no hurry to get another job.,Center,1,marketwatch,40.93,-3.88
"But his presence was still felt, especially on the heels of his Fox News interview with Sean Hannity the night before, where he refused to rule out abusing power or seeking retribution if he gets re-elected.",Center,1,marketwatch,40.93,-3.88
"Making homes accessible not only keeps older residents safe, it often has other benefits.",Center,0,marketwatch,40.93,-3.88
"There are several reasons: The money he has been given is now gone, so there is no point in throwing good money after bad; enabling your brother by giving him preferential treatment has only led to more requests; and it’s fair and equitable to treat these gifts as inheritance.",Center,1,marketwatch,40.93,-3.88
Hardline conservatives who control the chamber have vowed to block it unless it tacks to a broad set of forceful border and immigration policies.,Center,1,marketwatch,40.93,-3.88
The company also has a water business and there is potential for residential real estate development.,Center,0,marketwatch,40.93,-3.88
"Blaming low-wage workers The problem is that some people are freaking out when asked to tip when buying a $7 coffee or even when making a donation to a charity, and they use that experience as an excuse to stamp their feet and say they’ll never tip again.",Center,1,marketwatch,40.93,-3.88
"According to sources on the staff, Carlson shit-talked both women as well as his number one enemy within Fox News, the entrenched public relations boss Irena Briganti, whom he called a cunt.",Lean Left,1,vanity-fair,33.19,-13.87
It was just one of the funniest things that I've ever read.,Lean Left,1,vanity-fair,33.19,-13.87
Had Ertegun’s life turned into some nightmare reminiscent of What Ever Happened to Baby Jane?,Lean Left,1,vanity-fair,33.19,-13.87
Do you think you have more riz than the two of us?,Lean Left,0,vanity-fair,33.19,-13.87
"Since Diana’s 1997 death, her tradition-bucking maternal style has been revisited ad nauseam-the secret trips to McDonald’s, the naughty cards and jokes she adored, and the stunts she pulled.",Lean Left,1,vanity-fair,33.19,-13.87
"On the heels of his high-profile divorce announcement, Bezos went on a $45 million homebuying bonanza - snatching up not one, not two, but four previously unreported properties in the ultra-exclusive Hunts Point enclave.",Lean Left,1,business-insider,40.58,-4.19
"Cash-out refinance vs. rate-and-term mortgage refinance: What are they, and which one should you choose?",Lean Left,0,business-insider,40.58,-4.19
"The broker and lawyers for the AG had met in July, during a pre-trial deposition.",Lean Left,0,business-insider,40.58,-4.19
"Because cash-out refinances are riskier for lenders, companies usually set stricter eligibility requirements.",Lean Left,0,business-insider,40.58,-4.19
These are the kind of treats you're supposed to eat with your eyes first.,Lean Left,0,business-insider,40.58,-4.19
This gingerbread mix transformed into a cake that practically tasted homemade This gingerbread was so easy to make.,Lean Left,0,business-insider,40.58,-4.19
"Each region was so different, with the east coast offering a more laid-back feel and the west coast exuding a touch of luxury.",Lean Left,1,business-insider,40.58,-4.19
"But in the time it took me to get back in touch with my mortgage broker, the rates on the 20-year loan had gone back up, to 3.25%.",Lean Left,0,business-insider,40.58,-4.19
"Savanna Swain-Wilson Pistachios are elite - everything they touch turns to gold, whether it's gelato, pie, or in this case, biscotti.",Lean Left,0,business-insider,40.58,-4.19
"It seems like they are changing every day, if not multiple times per day.",Lean Left,0,business-insider,40.58,-4.19
"For anyone who is interested in applying for the scheme, but is unsure if they are eligible or their circumstances make it challenging to access, please contact brc .nhs.uk to discuss.",Center,0,nature,46.33,-1.48
"This will enable fellows protected time to concentrate on research, training and development The cost of tuition fees based on the UK (Home) rate PhD tuition fees for three years full time.",Center,0,nature,46.33,-1.48
Republican presidential candidate Chris Christie complained about getting passed over for the first 15 minutes of NewsNation’s Republican primary debate on Wednesday after everyone present appeared to forget that he was there.,Lean Left,0,mediaite,37.25,-8.64
Political activist Saira Rao was lambasted on X (formerly Twitter) after tweeting her take on Taylor Swift’s anointing as TIME’s Person of the Year.,Lean Left,0,mediaite,37.25,-8.64
"They started Race to Dinner to challenge liberal white women to accept their racism, however subconscious.",Lean Left,1,mediaite,37.25,-8.64
"After a preamble noting Trump’s gargantuan lead over the entire field, Kelly zeroed in on DeSantis with a lengthy question essentially asking if it was time to pack it in.",Lean Left,1,mediaite,37.25,-8.64
"Christie used his time to slam Trump over his numerous federal indictments, and he blasted his rival candidates for refusing to join him in his strident criticism of the former president.",Lean Left,1,mediaite,37.25,-8.64
"Her smackdowns of Vivek Ramaswamy during the first three debates have demonstrated her capacity to launch piercing, effective attacks without appearing mean-spirited.",Left,1,the-rachel-maddow-show,36.71,-17.67
Nor did he confuse the administrative energy of the undemocratic Prussian state with the end of history.,Left,1,jacobin,31.69,-21.47
"If you take the climate crisis seriously, which you should, all of this is pretty scary, and it should give Biden and the Democrats and a huge opening to draw the largest possible contrast with Trump.",Left,1,jacobin,31.69,-21.47
Most German social democrats of both parties who had initially seen the war as a defensive war against Napoleon - a position endorsed by Marx and Engels - now fell in behind Bebel and Liebknecht in opposing what had now become a war of conquest against the nascent French republic.,Left,0,jacobin,31.69,-21.47
"The freedom of citizens in the ancient Greek polis had been admirable, but their liberties had rested on the suppression of individualism and on the exploitation of slaves.",Left,1,jacobin,31.69,-21.47
"Like other members of France’s business elite, Bolloré has reaped billions in profits from neocolonial and environmentally destructive industries across Africa.",Left,1,jacobin,31.69,-21.47
One enraged conservative politician rushed the podium and attempted to drag her away.,Left,1,jacobin,31.69,-21.47
"But this is really just vapor, and it betrays a shocking misunderstanding of the very technology these business leaders and engineers are hawking.",Left,1,jacobin,31.69,-21.47
"If we look only at recent changes in the economy, what we see is a very mixed bag.",Left,0,jacobin,31.69,-21.47
Such callous attitudes toward the Palestinians led some prominent European Zionists such as Hans Kohn to break decisively with the movement in 1929.,Left,1,jacobin,31.69,-21.47
"If we care at all about gender equality, we must ditch the assumption that all men enjoy similar privilege.",Left,1,jacobin,31.69,-21.47
"Two days after the war broke out, Yoni Dimri of the Moshavim Movement, which represents most Israeli farmers, explicated the connection between the exploitation of agricultural migrants and the Zionist imperative of territorial control.",Left,1,jacobin,31.69,-21.47
And the Oversized Twisted Tassel Scarf would be perfect for another sister who she says craves coziness.,Left,0,teen-vogue,37.79,-15.5
"We have our stunt team on there, and they make us look amazing too.",Left,1,teen-vogue,37.79,-15.5
"Overall, the young woman who embodies both personalities is a slow burn.",Left,0,teen-vogue,37.79,-15.5
"However, you can also find more stylish picks to write aesthetically pleasing notes from luxury brands like Kate Spade and Swavorski.",Left,1,teen-vogue,37.79,-15.5
"Many Jeep buyers also love to outfit, upgrade and customize their vehicles.",Center,0,detroit-news,45.92,-2.2
James and Jennifer Crumbley's attorneys had previously asked for that evidence to be barred from the courtroom.,Center,0,detroit-news,45.92,-2.2
"The Spartans got off to a slow start, missed open shots from behind the arc and trailed the Badgers by 11 points at halftime.",Center,0,detroit-news,45.92,-2.2
"In my opinion, waking up at 2 a.m. just to take medicine probably does more harm than good.",Center,1,detroit-news,45.92,-2.2
"Carlos Osorio, AP Michigan State guard Tyson Walker (2) is defended by Wisconsin guard Chucky Hepburn (23) during the second half.",Center,0,detroit-news,45.92,-2.2
"Not for any particular reason, he's just there, walking by or passively hanging around in the background.",Center,0,detroit-news,45.92,-2.2
In his prepared statement Wray failed to include the dire security threats created by the Biden administration’s disastrous open border policies.,Lean Right,1,judicial-watch,23.64,23.27
"The same researchers responded to a Merck-sponsored study last year that, not surprisingly, found the vaccine is perfectly safe.",Lean Right,1,judicial-watch,23.64,23.27
"TEL AVIV, Israel-Despite still mourning Hamas’ brutal attack on October 7 and prosecuting a war against the terrorist group, Israel has cautiously rejoiced this week as a temporary pause in fighting was extended to a seventh day to allow for the return of hostages from Gaza continued.",Lean Right,0,the-dispatch,41.19,5.33
But SEC v. Jarkesy is not just a pedantic word fight.,Lean Right,0,the-dispatch,41.19,5.33
"We aim to make The Dispatch a place where thoughtful people can come for conservative, fact-based news and commentary that doesn’t come either through the filter of the mainstream media or the increasingly boosterish media on the right.",Lean Right,1,the-dispatch,41.19,5.33
"As almost always is the case when Republicans and Democrats agree, this claim is fundamentally wrong.",Lean Right,1,the-dispatch,41.19,5.33
"In advertisements, Philips declared that its CPAP machines were far quieter than those put out by its top competitor.",Lean Left,0,propublica,47.17,-6.77
"Even when Max was in elementary school, the idea of going through a cisgender girl’s puberty - getting a period and wearing a bra - felt terrifying.",Lean Left,1,propublica,47.17,-6.77
At least one lawmaker took to social media to threaten MUSC’s $188.9 million in state funds - 3.5% of its budget.,Lean Left,1,propublica,47.17,-6.77
"Small evolutions in a justice’s thinking or even select words used in an opinion can affect entire bodies of law, and shifts in Thomas’ views can be especially consequential.",Lean Left,0,propublica,47.17,-6.77
"Prosecuting it was more popular, and enabling it was considered more villainous.",Lean Left,1,propublica,47.17,-6.77
It’s not clear if a prosecutor would be able to use the recording of Mejia’s statements at trial without Mayer appearing in court to testify about it.,Lean Left,0,propublica,47.17,-6.77
