text,source_party,label,source,reliability,bias
The problem was they had never learned how to express their love in a way that was emotionally meaningful to their son.,Lean Right,0,washington-times,34.92,11.31
"By proactively embracing these strategies, we have navigated the complexities of the modern world while staying true to our cherished values.",Lean Right,1,washington-times,34.92,11.31
Kids love celebrations especially when it comes to holidays during the school year.,Lean Right,0,washington-times,34.92,11.31
"At the same time, Mr. Zuckerberg censored the Hunter Biden laptop revelations in October 2020 after the New York Post splashed the computer’s seedy contents and former Obama administration intelligence officials endorsed a lie that the hard drive was concocted by the Kremlin.",Lean Right,1,washington-times,34.92,11.31
"The key is to give heavy doses of their primary language, but also speak the other four as well.",Lean Right,0,washington-times,34.92,11.31
"We know that this record drop in child poverty reached the Black, brown, and rural children who are disproportionately likely to be poor.",Lean Right,1,washington-times,34.92,11.31
"The revolutions of 1989, while celebrated by Cold War triumphalists in the West, brought about difficult transitions.",Lean Right,0,washington-times,34.92,11.31
"Anywhere outside the cushy environmentalists’ crowd, filled with hypocrites who fly here, fly there, to tell the rest of the peons to stop flying, and al-Jaber’s CEO status of an oil company might make him a wee bit ineligible to chair a board of a company dedicated to stopping oil production.",Lean Right,1,washington-times,34.92,11.31
"Much of that money has gone directly to Ukraine’s battlefield capabilities, including a Patriot missile defense battery, more than 2,000 Stinger anti-aircraft systems, 21 air surveillance radars, more than 7,000 precision-guided 155 mm artillery rounds, more than 400,000 mortar rounds, more than 40,000 122 mm artillery rounds, hundreds of mortar systems, more than 30,000 155 mm rounds of Remote Anti-Armor Mine Systems, more than 10,000 Javelin anti-armor systems, more than 100,000 sets of body armor and helmets, nearly 200 155 mm Howitzers and a whopping 2 million 155 mm artillery rounds, 20 Avenger air defense systems, and a host of other ammunition and equipment, according to a State Department fact sheet.",Lean Right,0,washington-times,34.92,11.31
The latest Adaptation Gap Report estimates that international adaptation finance is 10-18 times below need.,Lean Left,0,the-conversation,40.75,-4.86
"They also claimed that news production cost them millions, and they hid ad revenues accrued by news programming elsewhere in their corporate budgets.",Lean Left,1,the-conversation,40.75,-4.86
Lord Summerisle patiently explains to Howie his fate has been predetermined from the outset and he is then forcibly hoisted into a giant wicker colossus (alongside a number animals) where he is to be burned alive.,Lean Left,0,the-conversation,40.75,-4.86
"Our new book, IMF Lending: Partisanship, Punishment and Protest, shows how governments lump the burden of adjustment on opposition supporters while shielding their own backers - in other words, using IMF programmes for political gain.",Lean Left,1,the-conversation,40.75,-4.86
It’s a little too dark for small children (Wonka being threatened by a corrupt policeman who submerges his head into a fountain was a particularly disturbing image for the very young).,Lean Left,1,the-conversation,40.75,-4.86
The second objection is that there have been assistance schemes in the past and they haven’t worked very well.,Lean Left,0,the-conversation,40.75,-4.86
"The Islamist insurgency in Mozambique, however, has yet to be defeated.",Lean Left,0,the-conversation,40.75,-4.86
"These dryland structures are so ubiquitous, massive and unique relative to other habitats that it’s high time for natural scientists to give them the respect they deserve.",Lean Left,1,the-conversation,40.75,-4.86
"Finally, this is all smoke and mirrors from the incoming government to walk back on election promises.",Lean Left,1,the-conversation,40.75,-4.86
"Smart phones provide a palm-size window to the world, enabling us to do almost anything at the touch of a button.",Lean Left,0,the-conversation,40.75,-4.86
The Research Brief is a short take about interesting academic work.,Lean Left,0,the-conversation,40.75,-4.86
"Imagining buildings and cities as digital platforms erodes a sense of place where one could have a palpable sense of belonging, with a legible relation to the public realm.",Lean Left,1,the-conversation,40.75,-4.86
But it was really striking that it’s something like one in six of them involve Rikers-related allegations.,Left,1,new-york-magazine,39.84,-9.95
The officers’ questions led her to believe they thought she’d harmed herself.,Left,0,new-york-magazine,39.84,-9.95
"If you buy something through our links, New York may earn an affiliate commission.",Left,0,new-york-magazine,39.84,-9.95
"It’s odd to think of argument as a form of monoculture, but for a moment on television in the 1970s, it was.",Left,0,new-york-magazine,39.84,-9.95
"The wave of legal action was triggered when the R&B singer Cassie sued the founder of Bad Boy Records on November 16, alleging sex trafficking, human trafficking, battery, and rape.",Left,0,new-york-magazine,39.84,-9.95
"Now, with Kelce, he’s giving her pictures on the ‘gram, with kisses on cheeks (cheeks).",Left,0,new-york-magazine,39.84,-9.95
"Norman Lear, the genius behind iconic sit coms including All in The Family and Good Times, has died at 101.",Left,0,new-york-magazine,39.84,-9.95
How did the foundations of our political system become so shaky?,Left,0,the-new-yorker,40.91,-12.25
"If your salary is a numerical representation of your worth, that means he’s thousands of times more important than you.",Left,1,the-new-yorker,40.91,-12.25
"They give their creations proud retro names: the Techno-Tort, the Blastoluxe.",Left,0,the-new-yorker,40.91,-12.25
"All the siblings paint basically the same picture of their father-as a deeply devout man who was indifferent to worldly matters, including making a living.",Left,0,the-new-yorker,40.91,-12.25
"At least a hundred and eighty-five prisoners have died in custody, according to the human-rights organization Cristosal.",Left,0,the-new-yorker,40.91,-12.25
"There’s an à-la-carte menu, and a shop-the-pantry conceit that harks back to the whole dinner-in-a-deli vibe of its Roman progenitor.",Left,0,the-new-yorker,40.91,-12.25
It took me six months to find two soldiers willing to talk with me.,Left,0,the-new-yorker,40.91,-12.25
"Such informal institutions were common, prior to the full nationalization of schools, as a response to the repression of Catholic education.",Left,0,the-new-yorker,40.91,-12.25
"He lives in Hyattsville, Maryland, with his wife and two daughters.",Right,0,the-american-conservative,31.63,14.44
"1972 was a pivot point in the development of America’s political economy, and not in a good way.",Right,1,the-american-conservative,31.63,14.44
"The Bulldogs have beaten just two teams in the Anderson & Hester top 25, neither of them on the road, and haven’t beaten any of the top eight teams (after which there is a big gap in the rankings).",Right,0,the-american-conservative,31.63,14.44
The forced arbitration issue has been highlighted as problematic by diverse voices from Josh Hammer to the Economic Policy Institute to Americans for Tax Reform.,Right,0,the-american-conservative,31.63,14.44
"Responding to Dr. Reno’s remarks will be Joseph Prud’homme, Burton Family Chair in Religion, Politics, and Culture at Washington College, and Shaun Rieley, Senior Director of Programs at The American Conservative.",Right,0,the-american-conservative,31.63,14.44
The likes of Chuck Schumer and Mitch McConnell would never agree to linking new federal projects to specific tax levies because the American taxpayers would surely reject them.,Right,1,the-american-conservative,31.63,14.44
"Scholz wanted to reprogram the money for his pet radical climate change projects, which have done much to begin dismantling Germany’s highly successful manufacturing economy.",Right,1,the-american-conservative,31.63,14.44
"Indeed, one way to read this wonderful memoir is as a kind of Southern murder mystery, the story of two people who, in essence, murdered themselves, who disappeared forever into the roles Southern white society demanded they play.",Lean Left,1,washington-monthly,35.78,-12.08
"Beginning on April 6, 2023, the nonprofit news organization published a series of searing investigative reports into the undisclosed financial dealings of Justice Clarence Thomas, which included lavish gifts, luxury vacations, and a favorable real estate transaction with Republican megadonor Harlan Crow and other posh treatment from wealthy friends and supporters.",Lean Left,0,washington-monthly,35.78,-12.08
Biden wasn’t the only establishment Democrat who was having doubts about the wisdom of the reigning neoliberal order.,Lean Left,0,washington-monthly,35.78,-12.08
"In Students for Fair Admissions v. Harvard and a sister case involving the University of North Carolina, the Court ruled it illegal for colleges to give minority students an advantage based on their race.",Lean Left,0,washington-monthly,35.78,-12.08
"The party of the common man had become the party of Wall Street and Silicon Valley, both culturally and economically.",Lean Left,1,washington-monthly,35.78,-12.08
"She looks Reaganite compared to her Putin-lovin’ party: Support Ukraine and Israel, build a strong defense, and don’t trust Vlad.",Lean Left,1,washington-monthly,35.78,-12.08
"So, instead of getting closer scrutiny as it exploded in size, SVB would lurch along until it failed.",Lean Left,1,washington-monthly,35.78,-12.08
"The convention, through bitter compromises, papered over differences temporarily, but the fissures would recur and sometimes widen into chasms in the decades ahead.",Lean Left,1,washington-monthly,35.78,-12.08
"Teachers know that students who may seldom raise their hands, if grouped with certain peers, will open up, speaking fluently and easily.",Lean Left,0,washington-monthly,35.78,-12.08
"At the end of the celebration, Prince remembers newly minted First Lady Rosalynn Carter pulling her aside.",Lean Left,0,time-magazine,41.12,-7.42
"He’s not waxing poetic about all-time records, like breaking the mark for most F1 titles in a career, seven, held by Hamilton and Michael Schumacher.",Lean Left,1,time-magazine,41.12,-7.42
"After her mother left him, he’d come over and bang on the door and drunkenly demand to see the kids, until the cops turned up.",Lean Left,1,time-magazine,41.12,-7.42
Canada just concluded negotiations with Taiwan on a foreign investment protection agreement-and it shows the goodwill coming from Canada to negotiate with Taiwan for better economic ties.,Lean Left,1,time-magazine,41.12,-7.42
"Even as entire business models (journalism, Hollywood, and government, among them) contorted to meet the whims and needs of platforms, they are singing a very different tune today.",Lean Left,0,time-magazine,41.12,-7.42
"Instead of answering questions about specific products, you get to use websites and apps and provide your feedback.",Lean Left,0,time-magazine,41.12,-7.42
"When the war started, the reaction from Taiwan was very strong.",Lean Left,0,time-magazine,41.12,-7.42
"Even today, as Facebook deprioritizes the posting and sharing of journalistic links, users fill the void with memes, ill-formed opinion and made-up information-in between dozens of sponsored links to Friends bloopers or sales on sequin sweaters.",Lean Left,1,time-magazine,41.12,-7.42
Residents have also been lacking essential medicines since the start of the war.,Lean Left,0,time-magazine,41.12,-7.42
He took her and her siblings to nude beaches when Ellis was 7.,Lean Left,1,time-magazine,41.12,-7.42
"For example, the company commissioned composer Tan Dun for a piece inspired by Dunhuang, a famous, and UNESCO-recognized, intersection point for major trade routes on the Silk Road.",Center,0,fortune,36.93,-2.44
"There is some irony, however, to Dimon’s strident anti-crypto position since his bank has quietly become of one Wall Street’s leading innovators when it comes to blockchain, the distributed ledger technology that undergirds Bitcoin and other cryptocurrencies.",Center,1,fortune,36.93,-2.44
"If the majority is not in favor, often a deal does not happen, and even Kushner lets himself get overruled.",Center,1,fortune,36.93,-2.44
"Most everyone has a roommate horror story, complete with all the drama of a soap opera reserved for something as mundane as washing dishes with the wrong soap or as weird as where they cut their nails.",Center,1,fortune,36.93,-2.44
"His genius: Once he’s achieved an innovative design for a car or rocket, he’s expert at creating a super-low-cost, ultra-high-volume production machine.",Center,1,fortune,36.93,-2.44
"This fall, public filings revealed that the University of Texas pension fund, an LP, had written down the value of its Thrive investment by 31%.",Center,0,fortune,36.93,-2.44
"With volumes trending in the wrong direction, Musk himself understandably had little appetite and avoided the issue entirely.",Center,0,fortune,36.93,-2.44
"This entirely predictable mess should serve as a cautionary tale for anyone who feels like subverting how the internet works-hope you’re watching, India and Brazil.",Center,1,fortune,36.93,-2.44
"Of these top 10 markets, there are only three with a large institutional presence.",Center,0,fortune,36.93,-2.44
But what is most appalling is when an injustice is ignored for decades and brings needless hardship to billions of people-even more so when the solutions are right in front of us.,Center,1,fortune,36.93,-2.44
"A measly 1% of U.S. venture capital funds went to Black founders last year, TechCrunch reported.",Center,0,fortune,36.93,-2.44
"Indeed, the Tesla Solar Roof may very well earn the distinction of being Musk’s most under-hyped product-as well as one he appears to have little interest in selling.",Center,1,fortune,36.93,-2.44
"Since then, Block has made big bets against a number of firms, including the medical supplier St. Jude and the European real estate company Corestate Capital Holding SA.",Center,0,fortune,36.93,-2.44
The vote confirmed that Caracas should reject the 1899 arbitration decision as well as the ICJ’s jurisdiction over the matter.,Lean Right,0,rt,28.66,11.46
"Israel will enter into a new round of national elections in November and the demarcation of maritime borders has recently been weaponized against the current Israeli leadership, causing ministers to act in order to save face.",Lean Right,1,rt,28.66,11.46
"The Russian defense industry’s latest models of aviation and armored vehicles, missile and artillery systems, naval-use products, multi-purpose and combat unmanned aircraft, anti-aircraft and electronic warfare weapons, small arms and ammunition are being presented at the event.",Lean Right,0,rt,28.66,11.46
"This change, aimed at enhancing security, inadvertently shrinks the recruitment base and excludes a once-accessible international talent pool.",Right,0,the-federalist,21.77,18.67
"Despite facing pressure from conservative organizations to ensure a provision nuking the policy is included in the final version of the bill., House Speaker Mike Johnson has declined to say whether he intends to do so.",Right,0,the-federalist,21.77,18.67
"Or, they’re trying to keep his name off of state ballots.",Right,1,the-federalist,21.77,18.67
The school also slow-walked its half-hearted response to a viral video showing several terrorist sympathizers on Harvard’s campus who surrounded and harassed a Jewish man with Keffiyehs - garb associated with the pro-Palestine movement’s desire to fight Israel.,Right,1,the-federalist,21.77,18.67
"In fact, instead of just ignoring heroes, Disney has taken the extra step of eviscerating established ones.",Right,1,the-federalist,21.77,18.67
"We now need to look for, and create, sustainable gains that can be fortified until our time arrives again.",Right,0,the-federalist,21.77,18.67
"So I'm coming back to what you said sometime people want to have the story taken told, but they want to be faceless.",Left,0,vogue,39.13,-10.91
"She’s the teen music star who’s pivoted into a movie starlet, having wrapped two major remakes within the last 18 months.",Left,0,vogue,39.13,-10.91
"A few months ago, Amnesty International used syntographs in place of photographs to protect Colombian protesters attending in 2019 protest, to promote a case that, for this reason, finished in the background.",Left,0,vogue,39.13,-10.91
"We’re normally anti-gift cards, but for Daisy, we’ll make an exception: Give that girl a dollar amount of your choosing and watch her go buck wild.",Left,1,vogue,39.13,-10.91
"A classic sleepwear set is another failsafe choice-Eberjey makes some of the best pajamas for women, and now men, too.",Left,0,vogue,39.13,-10.91
"It was really, for me, was a very powerful time to have this come together.",Left,0,vogue,39.13,-10.91
The first one outlines the teaching of the Church regarding the proper use of the means of social communication.,Right,0,national-catholic-register,22.39,11.81
"Those days of sippy cups and visits to the zoo and the library seem, in some ways, not so long ago - but in other ways, they seem like an eternity.",Right,0,national-catholic-register,22.39,11.81
The monks’ award-winning wines are available to purchase for $21.99 and up.,Right,0,national-catholic-register,22.39,11.81
It was so abused by women seeking abortions and their doctors that it effectively fully legalized abortion in California pre-Roe.,Right,1,national-catholic-register,22.39,11.81
"Patrick Mahoney, a Presbyterian minister and head of the Christian Defense Coalition, presented some remarks during Slattery’s funeral.",Right,0,national-catholic-register,22.39,11.81
"Echoing the cadence of Clement Moore’s A Visit From St. Nicholas and featuring large illustrations, this is an ideal Nativity read-aloud.",Right,1,national-catholic-register,22.39,11.81
"An international polling firm, no matter how well-intentioned, might not be entirely attuned to American politics (note the inclusion of Florida and North Carolina here and the omission of, say, Wisconsin).",Right,0,independent-journal-review,25.81,12.82
"After Trevor Lawrence’s injury, Trey Hendrickson got down on a knee and took a moment for Trevor.",Right,0,independent-journal-review,25.81,12.82
"Clips of the moment went viral on X (formerly Twitter): Patrick McHenry is the new acting House Speaker, slams the gavel after taking over.",Right,0,independent-journal-review,25.81,12.82
"He authored half a dozen books, exhibited his photos around the world, and was the subject of a documentary Salt of the Earth.",Right,0,independent-journal-review,25.81,12.82
But a poll released Tuesday shows former President Donald Trump sweeping six states among voters surveyed - and the biggest name among third-party candidates so far is cutting into President Joe Biden’s support.,Right,0,independent-journal-review,25.81,12.82
"Nearly all politicians, on the other hand, chase the approval of people who do not matter.",Right,1,independent-journal-review,25.81,12.82
"Riverton held a slim 24-22 lead at halftime, but pulled away with a 16-5 third-quarter advantage to seal the game.",Center,0,deseret-news,42.29,2.55
There is no need to keep chasing kids the Cougars have little chance of landing.,Center,1,deseret-news,42.29,2.55
"The league’s busts for PED use (performance-enhancing drugs) are relatively rare, the penalties are laughably light, and the NFL has refused to use independent testers, which ought to tell you something.",Center,1,deseret-news,42.29,2.55
The decision to both leave Florida State out and let Alabama in was absolutely defenseless.,Center,1,deseret-news,42.29,2.55
"Much to moderator Megyn Kelly’s chagrin, former President Donald Trump will again skip the debate, opting to host a private fundraiser in Florida instead.",Center,0,deseret-news,42.29,2.55
"It has become a national pastime every December to criticize the shortcomings of college football’s postseason selection process, and it would take an entire day to review all the times that deserving teams were robbed.",Center,1,deseret-news,42.29,2.55
"The other person is the problem, the perpetrator, the nut job causing all the chaos and disorder.",Center,1,deseret-news,42.29,2.55
"1A First Team Jake Batty, Wayne, P/3B/C, Sr. - 1.2 OPS, 38 Hits, 18 SB, 8-3 record, 2.42 ERA, 97 Ks.",Center,0,deseret-news,42.29,2.55
"Wiz has a wide range of Wi-Fi-powered smart light bulbs starting at $11, so the barrier to entry is low.",Lean Left,1,the-verge,39.43,-4.75
"But along with the Osage’s wealth comes a naked jealousy from white outsiders who see Indigenous people as undeserving simpletons, and Killers of the Flower Moon details how that very kind of thinking culminated in one of the most singularly unconscionable, nefarious murder campaigns in American history.",Lean Left,1,the-verge,39.43,-4.75
Part of / The best entertainment of 2023 No film could ever hope to fully convey the scale and gravity of the inhumane violence that white colonial settlers and their descendants have inflicted upon North America’s Indigenous people like the members of the Osage Nation for multiple centuries.,Lean Left,1,the-verge,39.43,-4.75
The iPhone 15 series - regular and Pro alike - finds a clever way around this struggle by letting you apply the Portrait mode effect after the fact.,Lean Left,0,the-verge,39.43,-4.75
"There is the view in the Valley, though, that any constraint on technology is bad.",Lean Left,1,the-verge,39.43,-4.75
"Baublebar This chic, personalized throw blanket from Baublebar is a fabulous gift that any lady would like for Christmas.",Lean Right,1,new-york-post,31.92,9.28
The Bacon and Eggs Ornament adds sizzle to your tree with its whimsical design.,Lean Right,1,new-york-post,31.92,9.28
"This makes an exciting gift for anyone with a Nespresso machine, and it also includes a limited edition coffee mug.",Lean Right,0,new-york-post,31.92,9.28
"She modeled the outfit for her 172,000 TikTok followers last week.",Lean Right,0,new-york-post,31.92,9.28
"Amazon We can’t believe this Lenox platter is just $25 on Amazon (and, with a lovely springtime option that we’re all about using year-round).",Lean Right,1,new-york-post,31.92,9.28
"The White House is so serious about pushing Israel to make nice with Gaza’s civilians that it sent, drumroll please, Vice President Kamala Harris to deliver the message.",Lean Right,1,new-york-post,31.92,9.28
"Amazon If you’re an avid golfer (or know someone who is), it’s a good idea to pick up this three-pack of golf wedges to take to the field - and channel your inner Tiger Woods at the same time.",Lean Right,0,new-york-post,31.92,9.28
It’s a hydrating lip balm that doubles as a long-lasting *juicy* color (a large contributor to its viral TikTok success).,Lean Right,1,new-york-post,31.92,9.28
The bottom line is that Jews who defend themselves will never garner the sympathy that murdered Jews do.,Left,1,new-york-daily-news,40.47,-8.12
"4 stabbed to death, including girl, 11, and boy, 12, by relative fatally shot by NYPD cops outside burning Queens home NYPD veteran Edmond Decio, suffering from a stab wound, opened fire and fatally shot the attacker, police and sources said.",Left,0,new-york-daily-news,40.47,-8.12
"For mains, select from options like a butternut squash risotto or roasted turkey breast with apple and chestnut stuffing, Yukon potato puree and a lingonberry-cranberry stuffing.",Left,0,new-york-daily-news,40.47,-8.12
"When government says no, there is no one to appeal to.",Right,1,american-thinker,13.67,24.85
"The second and more significant victory, that of what happens to Hamas, Israel has already lost.",Right,1,american-thinker,13.67,24.85
"For the Marxist globalists advancing a technocratic new world order designed to elevate a privileged few over everyone else, the ideal human is spiritually confused, helpless, ignorant, and uncurious.",Right,1,american-thinker,13.67,24.85
"Later in the day, the same teacher sent an index card to administration upon which the shooter had drawn a picture of a person holding a gun.",Right,0,american-thinker,13.67,24.85
That guilt can come to the surface and get activated quite easily.,Right,0,american-thinker,13.67,24.85
It's expensive work with highly skilled video experts and criminologists and lots of equipment.,Right,0,american-thinker,13.67,24.85
"Even after the invasion of Gaza, Hamas has stated they plan to keep on killing Jews.",Right,1,american-thinker,13.67,24.85
May this be the first of many hearings cracking open for public inspection the Ivy League's intellectual rot.,Right,1,washington-free-beacon,23.47,14.45
His actions: The moped driver did the honorable thing by stopping to make sure the little twerp wasn't seriously injured.,Right,1,washington-free-beacon,23.47,14.45
Though its plot is not dissimilar to that of Juwanna Mann-which came out in 2002 and starred Vivica A.,Right,1,washington-free-beacon,23.47,14.45
"Once Henry recognised that war could not be won, he got the best possible peace terms for the South Vietnamese, and it was only congressional recalcitrance that meant that it was not enough.",Right,1,washington-free-beacon,23.47,14.45
Hardliners shuttered the House floor in days over the spending agreement but have since said they would accept it.,Right,0,washington-free-beacon,23.47,14.45
The debate will re-air at 9 p.m PT tonight only on NewsNation.,Right,0,washington-free-beacon,23.47,14.45
