text,source_party,label,source,reliability,bias
"One question gnaws at Shayma Abu Libda, as it gnaws at parents like her across the Gaza Strip.",Center,0,christian-science-monitor,44.22,-2.47
"The poverty, harsh conditions, and limits on personal freedom under which ordinary citizens labored completely altered her views.",Center,1,christian-science-monitor,44.22,-2.47
"USA Today Network/Reuters Connect/File View caption Hide caption A special preview audience sits enthralled on Oct. 23, 1963, as Elizabeth Taylor, as a sultry Cleopatra, casts a meaningful wink at Caesar after her triumphal entry into Rome.",Center,0,christian-science-monitor,44.22,-2.47
"Following an uptick in terrorist violence along its western border, Pakistan’s caretaker government issued an ultimatum to approximately 1.7 million Afghans living in the country illegally: leave before Nov. 1 or face deportation.",Center,1,christian-science-monitor,44.22,-2.47
Thomas Peter/Reuters View caption Hide caption Ukrainian and EU flags fly in central Kyiv as the city hosts an EU-Ukraine foreign ministers meeting.,Center,0,christian-science-monitor,44.22,-2.47
The women-led protests that swept Iran last fall were brutally suppressed.,Center,1,christian-science-monitor,44.22,-2.47
And that’s where Scheck found an eager audience of people also stuck at home with nothing to do.,Center,0,christian-science-monitor,44.22,-2.47
"The TVA is interested in pruning timelines that feature versions, or variants, of Loki - who in the past has had no difficulty thinking up ways to make the universe suffer.",Center,1,christian-science-monitor,44.22,-2.47
Her remarks appear to cast blame on the caucus for McCarthy's ultimate exit.,Lean Right,1,just-the-news,33.31,10.7
Hunter Biden’s lawyer-Abbe Lowell-on Monday pushed back on new House Oversight Committee evidence showing Hunter Biden sent direct payments to his father from a business account.,Lean Right,0,just-the-news,33.31,10.7
The IRS agent supplemented his original whistleblower testimony from the summer with the documents at a closed door hearing Tuesday before the committee.,Lean Right,0,just-the-news,33.31,10.7
Ron DeSantis and tech mogul Vivek Ramaswamy on her prior calls to require digital I.D.,Lean Right,0,just-the-news,33.31,10.7
"It was the ability of the Associated Press and this opposition research firm to fabricate a narrative based on my records.""",Lean Right,1,just-the-news,33.31,10.7
"Crime has surged in D.C. in 2023, with violent crime increasing by 40% year-to-date and motor vehicle theft up 91%.",Lean Right,0,just-the-news,33.31,10.7
"They show Google chafing at pressure from then-White House official Rob Flaherty to suppress YouTube content that doesn't violate its guidelines, while worrying about the chances for its broader policy agenda if it resists.",Lean Right,0,just-the-news,33.31,10.7
"While Christie, for his part, at times offered some support to Haley, her other opponents largely zeroed in on her record, putting her in the hot seat over her time as South Carolina's governor and challenging her foreign policy expertise.",Lean Right,0,just-the-news,33.31,10.7
PFOF is the practice of routing trades through market-makers like Citadel Securities in return for a slice of the profits.,Center,0,cnbc,43.82,-1.81
Respondents were adults who moved to a new primary residence they purchased in the past two years.,Center,0,cnbc,43.82,-1.81
"We all have iPhones or iPads as our main personal devices, and my digital music has been locked up on an old iMac since 2010.",Center,0,cnbc,43.82,-1.81
"Analog Devices The higher the sentiment score, the better we like the stock going into earnings.",Center,1,cnbc,43.82,-1.81
"Sync Video to Paragraph And that's when they pick up a phone, as did Tiffany, and Harley-Davidson, and you name it.",Center,0,cnbc,43.82,-1.81
Sir Elon succinctly let advertisers know how he feels about any and all threats towards his X platform.,Center,1,cnbc,43.82,-1.81
"Be proactive about estate planning Financial advisors will tell you that just about everyone needs an estate plan, which directs the people in your life how you want financial and medical decisions handled in the case of your death or incapacitation.",Center,0,cnbc,43.82,-1.81
The chip announcement comes weeks after cloud rivals Amazon and Microsoft showed off custom silicon targeting AI.,Center,0,cnbc,43.82,-1.81
"In his epic 2013 filibuster, the Kentucky Republican spoke for 13 hours straight with minimal talking points to protest the possibility of the U.S. government using drones against American citizens.",Lean Right,0,washington-times,34.92,11.31
They are all loyal and patriotic Americans and had no idea what Ana was up to.,Lean Right,1,washington-times,34.92,11.31
The Haudenosaunee have competed as their own team at a number of international events since 1990.,Lean Right,0,washington-times,34.92,11.31
"Perhaps not coincidentally, Mr. McHenry, North Carolina Republican, recently sent a letter to the National Defense Authorization Act conferees to throw sand in the gears of their attempts to restrict American investment in companies involved with the Chinese military.",Lean Right,1,washington-times,34.92,11.31
"The family is the preeminent conveyor of virtue, truth, charity and justice.",Lean Right,1,washington-times,34.92,11.31
Police said they obtained a search warrant for a home that they believe is connected to the robbery spree.,Lean Right,0,washington-times,34.92,11.31
The principle also calls for secret political police and security forces to counter perceived enemies of socialism.,Lean Right,1,washington-times,34.92,11.31
The NFL famously uses such a test for draft prospects at the NFL Combine as part of their overall athlete evaluations.,Lean Right,0,washington-times,34.92,11.31
Nationalisation measures undertaken in 1973 and 1974 were poorly planned and implemented and went badly awry.,Lean Left,0,the-conversation,40.75,-4.86
"Once the second world war had ended and the full horror of the crimes perpetrated by the Nazi regime started to come to light, it was tempting to attribute all these excesses to the small clique of fanatical Nazis and staunch ideological followers, motivated by extreme racial hatred.",Lean Left,0,the-conversation,40.75,-4.86
It’s becoming increasingly clear that we will fail to meet our climate goals.,Lean Left,0,the-conversation,40.75,-4.86
Houses with lightweight walls such as weatherboard or brick veneer - along with a framed roof and either a concrete slab or suspended timber floor - make up nearly half of the total housing stock and are among the worst performing.,Lean Left,0,the-conversation,40.75,-4.86
Why would destroying biological-you magically elevate your mental clone to the status of the real you?,Lean Left,1,the-conversation,40.75,-4.86
"Instead of describing the characters making love, he describes the plants: As their glances penetrated into the corners of the hothouse, the darkness became filled with a more furious debauch of leaves and stalks; they could not distinguish on the terraces between the marantas, soft as velvet, the gloxinias, purple-belled, the dracoenas, like blades of old lacquer; it was a great dance of living plants pursuing one another with unsatisfied fervour.",Lean Left,0,the-conversation,40.75,-4.86
"While rap culture continues to innovate as it always has, it also continues to eat itself alive mass-media commentators make spurious allegations and urge that rap simply be banned.",Lean Left,1,the-conversation,40.75,-4.86
No one did more to advance this goal than Henry Kissinger.,Lean Left,1,the-conversation,40.75,-4.86
"In many ways, they work the same model of celebrity and media manipulation.",Left,1,new-york-magazine,39.84,-9.95
"And you have a new job now, which I’d like to talk about, so you can be hired apparently.",Left,1,new-york-magazine,39.84,-9.95
Because it lasts long enough that you have to confront it with some kind of label.,Left,1,new-york-magazine,39.84,-9.95
"Hopelessly romantic, it’s the kind of movie they don’t make that much anymore.",Left,0,new-york-magazine,39.84,-9.95
"In truth, the most plausible materialist explanation for the economy’s unpopularity might be this: People tend to attribute wage gains to their own efforts, even as they blame price increases on economic mismanagement.",Left,1,new-york-magazine,39.84,-9.95
"His character, Lee, seemed like a darker variation of Elio - artistic and sensitive, feral and sexual, kinky, a little bit of a fuckboy but also one who just needed love.",Left,1,new-york-magazine,39.84,-9.95
"There’s a bit of a Daria quality to it, a fascinating approach in the age of high affect and performative emotion.",Left,1,new-york-magazine,39.84,-9.95
"For the holiday season, there’s a limited-edition 250-milliliter size, 200 more than the traditional bottle, so it will last longer.",Left,0,new-york-magazine,39.84,-9.95
"This film tells the story of one tragic raid, from both perspectives: the soldiers conducting it and the families caught up in it, offering a glimpse into one small part of a much bigger picture-a series of traumas experienced by hundreds of families.",Left,0,the-new-yorker,40.91,-12.25
"No sooner had she grasped the inviting paw than Bogie stood up, and, in her telling, twisted her wrist and pushed her.",Left,0,the-new-yorker,40.91,-12.25
"Santos’s situation was as baroque as any of them, but it could safely be ignored by the public, and even by Santos’s colleagues in Washington.",Left,1,the-new-yorker,40.91,-12.25
"A new drug, ibrutinib, came along, which gave him a few more years.",Left,0,the-new-yorker,40.91,-12.25
"What matters isn’t so much whether the world is exactly so; more important, Wiseman, in his documentary investigations, finds what he’s looking for, or, rather, working like a fiction filmmaker, he persuasively makes his personal vision of the world seem incontrovertibly real.",Left,1,the-new-yorker,40.91,-12.25
"The guitar, all the vocals, everything else, they redo it all.",Left,0,the-new-yorker,40.91,-12.25
"Donald Trump may be the first former President to be indicted for a crime, but he is not the first to lead an insurrection and then attempt to dodge the consequences.",Left,1,the-new-yorker,40.91,-12.25
"The wine, a leaf-yellow Asprinio di Aversa, was frizzy and sharp-like the best pairings, it made everything on the table taste better, brighter, more alive.",Left,0,the-new-yorker,40.91,-12.25
"The differences between Donald Trump’s economic nationalism and Milei’s self-described anarcho-capitalism, even tempered by the guaranteed compromises of party government, are obvious.",Right,1,the-american-conservative,31.63,14.44
"The American Conservative and The Institute for Religion, Politics, and Culture at Washington College invite you to a lecture and response with R.R.",Right,0,the-american-conservative,31.63,14.44
There is no contradiction in support for Trump and celebration of Milei.,Right,0,the-american-conservative,31.63,14.44
Perhaps a bottom-up movement could begin to raise awareness: Consumers could refuse to buy from companies who include these forced arbitration clauses in their agreements.,Right,1,the-american-conservative,31.63,14.44
When in the 1990s Germany encountered the national challenge of reunification-the costly business of incorporating the defunct communist GDR-it began to run significant federal budget deficits.,Right,0,the-american-conservative,31.63,14.44
"In the May/June issue of The American Conservative, Professor Bruce Gilley argues that it is.",Right,0,the-american-conservative,31.63,14.44
"Whatever their other vices, the Germans have successfully used their constitution to restrict their wild spenders.",Right,1,the-american-conservative,31.63,14.44
"Ritz-Carlton Pentagon City As war hawks and corporate lobbyists inside the Beltway continue to erode local life, The American Conservative stands strong against unchecked power in government and business, and defends our American way of life.",Right,1,the-american-conservative,31.63,14.44
The pope’s caustic critique is more than a fashion statement; it has theological implications for a divided church in which the relative roles of priest and parishioner are increasingly contested.,Lean Left,1,washington-monthly,35.78,-12.08
The moderators of the next debate on Wednesday should try it on Haley when she waves the anti-abortion flag while hedging her bets.,Lean Left,1,washington-monthly,35.78,-12.08
"So, instead of getting closer scrutiny as it exploded in size, SVB would lurch along until it failed.",Lean Left,1,washington-monthly,35.78,-12.08
"Since October 7, universities have been embroiled in painful fights over institutional statements on terrorist attacks and war in the Middle East.",Lean Left,0,washington-monthly,35.78,-12.08
"In part because it was Dannehy, partisans on both sides accepted her conclusion.",Lean Left,0,washington-monthly,35.78,-12.08
"In the 21st century, algorithmic outlets-such as Facebook, Twitter, and YouTube-that tailor content to users create near impervious echo chambers that distort the user’s view of reality, especially the acceptance of those beliefs.",Lean Left,1,washington-monthly,35.78,-12.08
"But the golden boy was reading his press clippings and flying too close to the sun, taking expensive vacations ($90,000 in flights to Las Vegas and Florida), renovating his vacation home (adding cathedral ceilings and a hot tub), and pocketing rolls of cash from builders to whom he steered hundreds of millions of dollars in no-bid state contracts.",Lean Left,1,washington-monthly,35.78,-12.08
"Ask the constituents of Representative George Santos, the fabulist New York congressman.",Lean Left,1,washington-monthly,35.78,-12.08
This slim stick slips into your purse or pocket so you can refresh as necessary.,Lean Left,0,time-magazine,41.12,-7.42
Consider minimum amounts The minimum investment amount will depend on your choice of investment vehicle.,Lean Left,0,time-magazine,41.12,-7.42
"Why Verizon customers may be having more trouble There’s a reason that I, as a Verizon customer, may be having more problems than my colleagues who use AT&T and T-Mobile, analysts say.",Lean Left,0,time-magazine,41.12,-7.42
"He’s not waxing poetic about all-time records, like breaking the mark for most F1 titles in a career, seven, held by Hamilton and Michael Schumacher.",Lean Left,1,time-magazine,41.12,-7.42
He took her and her siblings to nude beaches when Ellis was 7.,Lean Left,1,time-magazine,41.12,-7.42
Specifications: Dimensions : 13 inches (width) x 8.5 inches (depth) x 18.5 inches (height) : 13 inches (width) x 8.5 inches (depth) x 18.5 inches (height) Material : Nylon and vegan leather : Nylon and vegan leather Weight: 1.8 pounds What we like: Plenty of pockets.,Lean Left,0,time-magazine,41.12,-7.42
Money market funds are limited to 6 withdrawals per statement cycle.,Lean Left,0,time-magazine,41.12,-7.42
"Instead of answering questions about specific products, you get to use websites and apps and provide your feedback.",Lean Left,0,time-magazine,41.12,-7.42
But the team he’s assembled may have very different-though no less dramatic-aims.,Center,1,fortune,36.93,-2.44
"Since then, Block has made big bets against a number of firms, including the medical supplier St. Jude and the European real estate company Corestate Capital Holding SA.",Center,0,fortune,36.93,-2.44
"On Wednesday, at a congressional hearing, the embattled Menendez grilled Wall Street executives about how much money the Consumer Financial Protection Bureau ordered each of their firms to pay back to consumers for allegedly violating federal laws including charging illegal junk fees and opening fake customer accounts.",Center,0,fortune,36.93,-2.44
"Between March 2020 and October 2023, they’ve rocketed up by a whopping 26%.",Center,0,fortune,36.93,-2.44
The move earned the trust of a creative workforce that dived into the challenge of remotely advising customers on how to outfit their homes for the work-from-home era.,Center,1,fortune,36.93,-2.44
"But that’s cowardly leadership, says Richard Edelman, CEO of his namesake PR firm.",Center,1,fortune,36.93,-2.44
"The sale slightly more than doubled Kushner’s investment, giving him a calling card that validated his acumen and his patience.",Center,0,fortune,36.93,-2.44
"When you buy a Pokémon card, aren’t you expecting that it will increase in value because of the marketing success of its parent company?",Center,1,fortune,36.93,-2.44
Kiev has stepped up rocket and drone attacks on Crimea in recent months.,Lean Right,0,rt,28.66,11.46
PRO and its supporters see the current Czech government as traitors who are controlled primarily from Washington and Brussels.,Lean Right,1,rt,28.66,11.46
"The threat posed by his predecessor has pushed the US president to seek a second term, he reportedly claimed at a fundraiser It is possible that US President Joe Biden would not run for office again if his predecessor, Donald Trump, were not in the race, he was quoted as telling an audience of supporters during a fundraising blitz event outside of Boston on Tuesday.",Lean Right,1,rt,28.66,11.46
"In an interview with Fox News on Sunday about the Biden administration’s approach to domestic energy policy, Stewart said the White House had sold off more than 40% of the SPR (180 million barrels) during 2022 in an effort to tame rising fuel prices.",Lean Right,0,rt,28.66,11.46
"Candidates from the CPRF, LDPR, Russian People’s Union, Civic Initiatives, Communists of Russia, Yabloko, and the Party of Growth took part.",Lean Right,0,rt,28.66,11.46
"According to the report, the bloc continues to rely on supplies to operate Russia-designed VVER reactors used by Bulgaria, the Czech Republic, Finland, Hungary, and Slovakia.",Lean Right,0,rt,28.66,11.46
"The US, Britain, India, Brazil, Canada, and France will collectively negotiate trade terms with China, Germany, Norway, Japan, the Netherlands, and Singapore.",Lean Right,0,rt,28.66,11.46
The African country’s high court on Wednesday commenced hearings into a case in which UK soldiers are accused The British Army Training Unit in Kenya (BATUK) has asked the East African country’s high court to dismiss a lawsuit involving the alleged murder of a young woman by its soldiers more than a decade ago.,Lean Right,0,rt,28.66,11.46
That kind of response is a recipe for making everything worse.,Right,1,the-federalist,21.77,18.67
"The U.S. Army’s recruitment efforts are so dismal, it is now asking soldiers it previously dismissed over the Covid vaccine requirement to come back.",Right,0,the-federalist,21.77,18.67
"Rather than examine how this managed to happen in a state that Donald Trump won by 8 points in 2020 or what role abortion has in the future of the party platform, it is important to address what comes next for Republicans and the pro-life movement in Ohio and nationwide - and most importantly, how they can redeem themselves after this tragic loss.",Right,1,the-federalist,21.77,18.67
"Until Oct. 7, no such attack had ever been attempted by Hamas, much less succeeded.",Right,0,the-federalist,21.77,18.67
"On the Democrats’ agenda are socialist policies germinated on the Left Coast like guaranteed income, carbon neutrality, and universal health care.",Right,1,the-federalist,21.77,18.67
"In determining there was enough evidence to call into question the election’s legitimacy, the judge presiding over the case overturned the election, ruling that another Democrat primary and subsequent general contest would be held if Ganim won the originally scheduled general on Nov. 7.",Right,0,the-federalist,21.77,18.67
"Since 1981, Indiana Jones, like Superman and John Wayne, has been a symbol of America and the American man.",Right,1,the-federalist,21.77,18.67
"For them, it is not about democracy but their commitment to abortion.",Right,1,the-federalist,21.77,18.67
"For the phera ceremony, the bride wore a dazzling ivory-hued lehenga embellished with zardozi, gota and nakshi work from Matsya by Utkarsh Ahuja, while the groom donned a pearl-white raw silk sherwani by Diwan Saheb featuring tonal embroidery.",Left,0,vogue,39.13,-10.91
"No matter who you have in mind, there is a perfect present for everyone.",Left,0,vogue,39.13,-10.91
"The fresh oysters are delectably smooth, paired with creamy hollandaise sauce.",Left,0,vogue,39.13,-10.91
"Okay, so we say artificial intelligence, anything that it does would be derivative because it does, you know, actually takes from everything that it's already out there.",Left,1,vogue,39.13,-10.91
"In revisiting some of these older essays, were there any that you wished you would have written differently, or could have edited for this anthology?",Left,0,vogue,39.13,-10.91
Flash-forward to today and the couple still have yet to tie the knot.,Left,0,vogue,39.13,-10.91
"His first nickname, while he was in my stomach, was Bubba.",Left,0,vogue,39.13,-10.91
"Each detail is thoughtfully curated to enhance your stay, creating an ambiance of unparalleled relaxation.",Left,1,vogue,39.13,-10.91
The Pope went on to highlight that this tendency exists not only within the framework of the Church but also is a general challenge presented by a world characterized by rapid secularization and estrangement from God.,Right,1,national-catholic-register,22.39,11.81
"It waits in hope for Jesus’ coming at Christmas, in the Eucharist, into our hearts, and at the end of time.",Right,0,national-catholic-register,22.39,11.81
This format is sure to help children make this beloved prayer their own.,Right,1,national-catholic-register,22.39,11.81
Friar Crafted Did you know Father Paschal Mary of the Franciscan Missionaries of the Eternal Word is a craftsman?,Right,0,national-catholic-register,22.39,11.81
"Soon after, Renzi went to a new parish and bumped into Libutti, someone he knew from the past.",Right,0,national-catholic-register,22.39,11.81
"In actuality, however, Newman is too catholic - and Catholic - a thinker to be deployed for such ideological purposes.",Right,1,national-catholic-register,22.39,11.81
"One would be remiss not to note, first, that it is the source for two pieces from Handel’s Messiah - one a lovely meditative air that also draws on Job 19 and the other a dramatic musical semi-joke of which Haydn himself could be proud.",Right,1,national-catholic-register,22.39,11.81
"Gaudí, who died in 1926 at the age of 73, was a modernist and naturalist architect best known for the massive Sagrada Familia Basilica that towers over the city of Barcelona.",Right,0,national-catholic-register,22.39,11.81
"When it comes to using rape as a weapon of war, that’s reprehensible.",Right,0,independent-journal-review,25.81,12.82
"All content created by the Daily Caller News Foundation, an independent and nonpartisan newswire service, is available without charge to any legitimate news publisher that can provide a large audience.",Right,0,independent-journal-review,25.81,12.82
The RFK Jr. phenomenon just might be the biggest danger to the Democratic White House in politics today.,Right,1,independent-journal-review,25.81,12.82
And a man named Robert F. Kennedy Jr. should be giving them nightmares.,Right,1,independent-journal-review,25.81,12.82
"Leaked documents showed that Emirati officials planned to use COP28-related meetings to discuss potential business dealings related to the two firms with foreign officials, and separate documents revealed how the companies viewed Special Presidential Envoy for Climate John Kerry as a key player in efforts to secure their future financial success.",Right,0,independent-journal-review,25.81,12.82
Another citizen in the streets of Scranton was also skeptical that Biden and his Bidenomics is cognizant of the plight of the average American.,Right,1,independent-journal-review,25.81,12.82
Republican Rep. Patrick McHenry of North Carolina was celebrated online by many conservatives on Tuesday when he announced his upcoming retirement.,Right,0,independent-journal-review,25.81,12.82
A legendary photojournalist and his wife replanted the forests of their home in southeastern Brazil and turned the area into a private nature reserve.,Right,0,independent-journal-review,25.81,12.82
"That prompted questions of what the Jets, who’ve lost five straight, would do at the quarterback position heading into their Week 14 game against the Houston Texans.",Center,0,deseret-news,42.29,2.55
"With this victory, their record improves to 1-2 while the Bears stand at 2-5.",Center,0,deseret-news,42.29,2.55
NFL officials also like to pretend they’re serious about catching drug cheats.,Center,1,deseret-news,42.29,2.55
"The league’s busts for PED use (performance-enhancing drugs) are relatively rare, the penalties are laughably light, and the NFL has refused to use independent testers, which ought to tell you something.",Center,1,deseret-news,42.29,2.55
"But even by those standards, this year’s miss was a doozie, an epic failure.",Center,1,deseret-news,42.29,2.55
"For one thing, I’ve seen the level of alcohol consumption in some of those long-lived European countries.",Center,1,deseret-news,42.29,2.55
"Young people are especially vulnerable and naive when it comes to gambling, which has become normalized and increasingly acceptable.",Center,1,deseret-news,42.29,2.55
Juan Diego’s Soaring Eagle (2-4) secured a 35-26 win over the Hillcrest Huskies (0-6).,Center,0,deseret-news,42.29,2.55
This is the result of an imbalance of humans being out of sync and out of balance with nature - of extracting too much.,Lean Left,1,the-verge,39.43,-4.75
"Garmin’s main advantage here is better build quality, no Google or server shenanigans, and no paywalled features.",Lean Left,1,the-verge,39.43,-4.75
This is for those of us who ring our phones multiple times a day and lose them in odd places.,Lean Left,0,the-verge,39.43,-4.75
