text,source_party,label,source,reliability,bias
Other than to carefully teach the political formula of the educated ruling class?,Right,1,american-thinker,13.67,24.85
"Unbeknownst to many, though, Wilsonian progressives broke one of those restraints in 1913, mortally wounding the American experiment.",Right,1,american-thinker,13.67,24.85
Why would British M.D.s jump out of a British frying pan into an American fire?,Right,1,american-thinker,13.67,24.85
"But the absolute gain in probability attributable to the vaccine (which may be a better measure for decision making) is just 0.002-0.001 = 0.001, or 1 in 1000.",Right,0,american-thinker,13.67,24.85
"Instead, with their foresight, they crafted the Constitution not to prevent those individuals’ rise to power but to safeguard against their destructive impulses via constitutional restraints.",Right,1,american-thinker,13.67,24.85
"While the previous debate required at least 70,000 unique donors, candidates will need to bring in a minimum of 80,000 unique donors to their principal presidential campaign committee, with at least 200 unique donors in 20 or more states or territories each.",Right,0,washington-free-beacon,23.47,14.45
"Haley defended herself ably throughout, embracing the criticism as evidence of her campaign's strength.",Right,0,washington-free-beacon,23.47,14.45
"The deals have not been widely reported outside of China, nor have the financial terms been disclosed.",Right,0,washington-free-beacon,23.47,14.45
It will definitely annoy hysterical liberals who want everyone to be miserable all the time.,Right,1,washington-free-beacon,23.47,14.45
"It is humbling to discover how many of our glib assumptions, which seem to us novel and plausible, have been tested before, not once but many times and in innumerable guises, and discovered to be, at great human cost, wholly false.""",Right,0,washington-free-beacon,23.47,14.45
"Mr. Musk, fresh off his solidarity trip to Israel, has received endless abuse from Democrats, who insist he is not just an anti-Semite, but a racist, sexist, and all the other things leftists like to call people.",Right,1,washington-free-beacon,23.47,14.45
"We wont spoil too much for you, but even within the dorm, contestants face quite a lot of psychological manipulation.",Left,0,esquire,27.41,-18.14
She began searching for answers about her father’s shadowy past His confession turned the Randele family upside down.,Lean Left,0,cnn,42.06,-6.28
"How we keep trying to make our world safe but have been unable to, and every time we try, we make it worse, not better.",Left,1,salon,32.38,-13.86
"During her days in the Legislature, O’Connor said she didn’t go drinking or fishing with her male colleagues.",Left,0,daily-kos,28.4,-17.51
"After 10 months, we were able to move back into the house in November, just in time for Thanksgiving.",Left,0,daily-kos,28.4,-17.51
"And, as per various reports, Israel may have run out (or is about to run out of) of a critical resource ~ American support.",Left,1,daily-kos,28.4,-17.51
"During that first term, court observers sensed she was uncomfortable in her new job.",Left,0,daily-kos,28.4,-17.51
S2E84 on Omny.FM (and links to all of his podcasts) ivoox also carries his podcast.,Left,0,daily-kos,28.4,-17.51
First of all there is the unconscious bias of kids like mine (not very verbal) not being intellectually intact.,Left,1,mother-jones,37.08,-15.12
But California’s legislature has been hard at work on housing since 2017.,Left,0,mother-jones,37.08,-15.12
"But a housing development does not remotely have the environmental toll of an oil refinery, power plant, or interstate highway, and no one suffers more from the lack of housing than poor people.",Left,1,mother-jones,37.08,-15.12
"It is also one that transforms fans from delusional obsessives to devoted social justice crusaders, a transformation that requires the existence of an ethical form of celebrity worship.",Left,1,mother-jones,37.08,-15.12
That’s a huge danger of cancel culture panic-this idea that words are just words and don’t have any repercussions.,Left,1,mother-jones,37.08,-15.12
"They platformed Dave Chappelle after he’s been very vocally anti-trans, and comedian Shane Gillis, who was hired on SNL alongside Bowen Yang and Chloe Fineman.",Left,1,mother-jones,37.08,-15.12
"As if separating families at the border, undercutting the refugee program, and forcing asylum seekers to wait in squalid migrant camps in dangerous Mexican border towns wasn’t bad enough the first time around, Trump and Miller have dialed up the cruelty.",Left,1,mother-jones,37.08,-15.12
Democrats were again aiming their economic appeal at the group between the poor and the rich: the vague middle.,Left,0,mother-jones,37.08,-15.12
"Hopefully, the studios can see past their bottom line and give hard-working creatives their piece of the pie.",Left,1,mother-jones,37.08,-15.12
"Many people aspire to their lifestyles, particularly when glamorized in social media posts, and their emissions are often used by those with smaller footprints to justify polluting habits.",Left,0,mother-jones,37.08,-15.12
They frequently omit important information-like the fact that they performed a sexual act because they were too afraid to fight back-out of embarrassment or shame or fear that they won’t be believed.,Left,1,mother-jones,37.08,-15.12
"These communities, Russell’s study noted, can also help people with long Covid better understand their new reality.",Left,0,mother-jones,37.08,-15.12
He was pretending he had 12 Black guys in his apartment to scare ghosts away.,Left,1,mother-jones,37.08,-15.12
Chase said he hugged her and told her that they were going to get through this hard time.,Left,0,mother-jones,37.08,-15.12
"In numerous ways, Nicole Chase is typical of the victims-turned-suspects in my analysis.",Left,1,mother-jones,37.08,-15.12
"For 15 years, the clinic, dubbed the Pink House for its Barbie-pink facade, was the only one in the state.",Left,0,mother-jones,37.08,-15.12
"In 2020, nearly 9,900 fires had burned more than 4.3 million acres of land in the state, killing dozens of people and causing billions of dollars worth of damage.",Left,0,mother-jones,37.08,-15.12
"Social Security taxes pay for Social Security benefits-not for pension fund administrators to manage complex financial portfolios, and not for Blackstone CEO Stephen Schwarzman’s $20 million birthday parties.",Left,1,current-affairs,34.3,-18.14
"Politically, the question of how to be a white rap artist is just an exaggerated version of a more familiar question: how to be a white American.",Left,1,current-affairs,34.3,-18.14
"The Senate, the Electoral College, and the judiciary are constantly thwarting public preferences.",Left,1,current-affairs,34.3,-18.14
"Limbaugh used to do that, only he would only have the last 10 to 20 minutes at the most for callers.",Left,1,current-affairs,34.3,-18.14
There is nothing except shortsightedness to prevent us from guaranteeing an annual minimum-and livable-income for every American family.,Left,1,current-affairs,34.3,-18.14
"There are some people who are just whatever-they’re peasants-but then there’s a kind of person, the genius, often referred to as the true noble or someone who has true nobility.",Left,1,current-affairs,34.3,-18.14
"The Times provided a colorful report of the Battle: About 4 p.m. [the antifascists] decided to hold an indignation meeting in the street, at which they denounced the police and the Sons of Italy and voiced their claims that since the shrine had been dedicated with funds contributed by Italian-Americans generally, they had as much right to hold services at the Garibaldi statue as the Sons of Italy.",Left,0,current-affairs,34.3,-18.14
"PE firms sell off the assets of acquired companies, load them up with debt, and do whatever they can to extract short-term profit, with little regard for the company’s long-term prospects.",Left,1,current-affairs,34.3,-18.14
"Robinson Yes, you’ve got those incredible ads that you reprint from High Times Magazine, where they’re just advertising cocaine paraphernalia pretty openly.",Left,1,current-affairs,34.3,-18.14
Can you warn us what we should be on the lookout for in terms of pseudo-solutions?,Left,0,current-affairs,34.3,-18.14
"The key difference is that they’re selling psychoactive drugs, which are heavily protected by the FDA.",Left,1,current-affairs,34.3,-18.14
Photo: Mustafa Hassona/Anadolu via Getty Images Israel has been widely condemned for its brutal response to the October 7 terrorist attacks by Hamas.,Left,1,the-intercept,37.46,-14.1
"The Indian government official provided Gupta with details about Pannun, including his address, associated phone numbers, and his daily routine, which Gupta then gave to the DEA agent working undercover as a hitman.",Left,0,the-intercept,37.46,-14.1
"A veterinary technician by training, Scott runs the Madrean Archipelago Wildlife Center, where she rehabilitates injured raptors.",Left,0,the-intercept,37.46,-14.1
"She was a widow, therefore a single mother, of two young teenagers, without any means of support.",Left,1,the-intercept,37.46,-14.1
Advertisement Unless the committee doesn’t see the Noles’ ACC as a power conference at all.,Left,1,slate,35.17,-12.93
They see each other as an annoying pest who’s always messing up his game (on the one hand) and as a big jerk who never lets him play (on the other).,Left,1,slate,35.17,-12.93
"Credit: Courtesy Adalberto Jordan Credit: Courtesy Adalberto Jordan O’Connor’s tendency to handle things incrementally, with small steps at a time, has influenced Jordan’s judicial career.",Lean Left,0,atlanta-journal-constitution,44.83,-3.84
"Homeowners who fall behind on dues or various fines can lose their home, even if they already own it outright, and critics say the state’s laws unfairly stack the deck against residents.",Lean Left,1,atlanta-journal-constitution,44.83,-3.84
That is really annoying because AJC publishes a ton of good articles about the Braves and I’m unable to even access them through the app.,Lean Left,0,atlanta-journal-constitution,44.83,-3.84
"Ortiz, who was severely beaten, died after being rushed to a hospital in Macon.",Lean Left,0,atlanta-journal-constitution,44.83,-3.84
But the energy interests that sent representatives said the fact that they account for a big part of the world's emissions is the very reason they need to be there.,Lean Left,0,atlanta-journal-constitution,44.83,-3.84
"Crews with Atlanta fire responded around 6:20 a.m. to a structure fire in the 600 block of Tazor Street, according to Battalion Chief Derek Hullender.",Lean Left,0,atlanta-journal-constitution,44.83,-3.84
A woman with a gun threatened to shoot herself or passersby in the parking lot.,Lean Left,0,atlanta-journal-constitution,44.83,-3.84
"Maintenance workers came to fix warped flooring, he said, but they merely tore out damaged pieces and left.",Lean Left,0,atlanta-journal-constitution,44.83,-3.84
"Brinkley was identified as a person of interest and Atlanta police requested help from troopers in stopping his SUV, according to the Georgia State Patrol.",Lean Left,0,atlanta-journal-constitution,44.83,-3.84
"He said the company does not routinely keep heart monitoring data, but for inmates with known heart conditions may do so for 90 days.",Lean Left,0,atlanta-journal-constitution,44.83,-3.84
"On November 8, Gwinnett Magistrate Court issued six felony warrants for Hayes’ arrest based on six of the complaints, including Wilson’s.",Lean Left,0,atlanta-journal-constitution,44.83,-3.84
A network of transfer facilities would provide new amenities such as real-time route information and bathrooms.,Lean Left,0,atlanta-journal-constitution,44.83,-3.84
Atlanta Attorney Suzy Ockleberry testified to City Council last week and said that Webster paved the way for Black female attorneys to sit on the bench.,Lean Left,0,atlanta-journal-constitution,44.83,-3.84
"It was early in the morning on April 8, 2020, and the sheet on the door indicated that Powell had looked in every 15 minutes throughout the night.",Lean Left,0,atlanta-journal-constitution,44.83,-3.84
"At least two of the units, according to the reports, were illicitly occupied by drug dealers and their customers.",Lean Left,0,atlanta-journal-constitution,44.83,-3.84
But he insisted that his problems in North Carolina had nothing to do with sex.,Lean Left,1,atlanta-journal-constitution,44.83,-3.84
Aerial spotters located a second adult pair about nine nautical miles off Sea Island.,Lean Left,0,atlanta-journal-constitution,44.83,-3.84
But people were very eager to get their names on it.,Lean Left,0,atlanta-journal-constitution,44.83,-3.84
"Alabama Crimson Tide head coach Nick Saban walks off the field after defeating the Georgia Bulldogs 27-24 in the SEC Championship football game at the Mercedes-Benz Stadium in Atlanta, on Saturday, December 2, 2023.",Lean Left,0,atlanta-journal-constitution,44.83,-3.84
"Convinced that her doctor had sexually violated her during her last visit, she believed she had to do something to expose him.",Lean Left,0,atlanta-journal-constitution,44.83,-3.84
"Similarly, if you live on some land, and it has trees, and you don’t cut down the trees, then the trees store carbon that might otherwise go into the atmosphere, and therefore they reduce global warming.",Lean Right,0,fiscal-times,43.33,-4.18
"Schumer had hoped the vote, though he knew it was likely doomed, might unstick the flailing negotiations among six senators on border policy.",Lean Right,1,fiscal-times,43.33,-4.18
"On a 12-month basis, the PCE price index rose 3.0%, the lowest level since March 2021.",Lean Right,0,fiscal-times,43.33,-4.18
"McCarthy’s sticking around for another year is just too much to ask, apparently.",Lean Right,1,fiscal-times,43.33,-4.18
"Republican and Democratic lawmakers appear to be moving further apart on a $111 billion supplemental spending package that includes billions in aid for Ukraine, Israel and Taiwan, as well as changes in immigration and border policy.",Lean Right,0,fiscal-times,43.33,-4.18
"The House currently consists of 221 Republicans, 213 Democrats and one vacancy, with Rep. George Santos (R-N.Y.) expelled Dec. 1.",Lean Right,0,fiscal-times,43.33,-4.18
"In the last three election cycles, it delivered Democratic victories based on deeply held beliefs about which party could be trusted to reform a system that had left millions without health care and millions more bankrupt with medical debt.",Lean Right,1,fiscal-times,43.33,-4.18
"Chris Murphy (D-Conn.) and Michael Bennet (D-Colo.) would not necessarily have chosen to pair the two to begin with, due to past failures on immigration and border policy talks.",Lean Right,1,fiscal-times,43.33,-4.18
"× Expand Evan Vucci/AP Photo The long-standing goal of the Republican right, in the famous words of anti-tax activist Grover Norquist, is to starve the beast of the deep state by denying it revenue.",Lean Right,1,fiscal-times,43.33,-4.18
Here’s a rundown on key details: * The bill is ‘clean’: The funding bill will maintain current spending levels and contains no amendments addressing thorny issues such as border policy and aid for Ukraine and Israel.,Lean Right,0,fiscal-times,43.33,-4.18
"Republicans have managed to trim spending a bit, given that the debt ceiling deal they negotiated with the White House in May caps discretionary spending for at least two years, resulting in about $250 billion in direct savings and potential spending reductions totaling as much as $2.1 trillion over 10 years, according to a June analysis by the Center for a Responsible Federal Budget, a nonpartisan group that advocates for deficit reduction.",Lean Right,0,fiscal-times,43.33,-4.18
"That helped the bill advance by eliminating sources of friction for various House constituencies, but it also inspired the far-right House Freedom Caucus and other ultraconservative Republicans to reject the bill.",Lean Right,1,fiscal-times,43.33,-4.18
"Sen. James Lankford of Oklahoma, who leads the negotiations for Republicans, said this weekend that he would reject any supplemental package that fails to include major changes in border policy, including more restrictive detention guidelines and new limits on the granting of asylum privileges.",Lean Right,0,fiscal-times,43.33,-4.18
"For them, keeping an open border is more important than the security of Europe or the Middle East.",Lean Right,1,fiscal-times,43.33,-4.18
"This leads to a race to the bottom of minimum accepted standards, including a lack of investment in quality systems and limited redundancy.",Lean Right,0,fiscal-times,43.33,-4.18
"But it doesn’t help either,"" The Hill’s Emily Brooks, Mike Lillis and Mychael Schnell write.",Lean Right,0,fiscal-times,43.33,-4.18
There’s a word for defining a person’s character and conscience by the color of her skin and the land of her origin.,Lean Left,1,detroit-free-press,43.46,-5.43
"The U.S. Centers for Disease Control and Prevention (CDC) reported 48,000 deaths by suicide in the U.S. in 2021, making suicide one of the leading causes of death.",Lean Left,0,detroit-free-press,43.46,-5.43
"The company expects to make the EVs profitable by spreading costs over more vehicles as sales increase, by selling more higher-cost/higher profit EVs, and with battery cost savings, Jacobson said.",Lean Left,0,detroit-free-press,43.46,-5.43
Mainstream journalists respond to such criticism by explaining that articles for the daily press are not history texts and cannot include everything.,Lean Left,0,fair,32.6,-19.36
So don't feel like you have to change out your appliances overnight.,Lean Left,0,npr,42.99,-4.27
"And so this was one thing that was really concerning the generals, that the military was not prepared for any kind of attack.",Lean Left,1,npr,42.99,-4.27
"It would have been a big political win to say the most important, powerful Arab country in the world officially recognizes Israel, for the first time ever.",Lean Left,1,npr,42.99,-4.27
"Someone can take the voice of your loved one, clone it and use it in a hoax.",Lean Left,0,npr,42.99,-4.27
"On Friday, hours after the evacuation leaflets began to land, Hussam Abu Safiya, a doctor in Kamal Adwan Hospital in northern Gaza, was still treating a stream of patients wounded by airstrikes.",Lean Left,0,npr,42.99,-4.27
My major concern was that somehow the crew would screw up.,Lean Left,0,npr,42.99,-4.27
Aggressive progressives bring conflict to boiling point All this reached a boiling point in 1910 when Cannon was in his fourth term as speaker.,Lean Left,1,npr,42.99,-4.27
"And yet, while her (mostly white) contemporaries wallow (or at the very least mope) in varying degrees of interiority, Oladokun's latest album exudes warmth, hope and sincerity, often with a killer backbeat.",Lean Left,1,npr,42.99,-4.27
"And if you aren’t a crafty ceramicist or knitter yourself, you can feel out of luck.",Lean Left,1,variety,41.29,-3.85
"Well, besides the fact that she already had 16 corkers, you can see a few areas of lyrical or thematic overlap that were probably best avoided.",Lean Left,1,variety,41.29,-3.85
"If you’re looking to kill time and be wildly distracted from your surroundings, trust the overwhelmingly positive Amazon reviews and buy yourself a little mystery.",Lean Left,0,variety,41.29,-3.85
"To the extent that some improv is encourged out of star guests, Whitford has been playing it as a mixture of vainglorious - bringing multiple Emmys out on stage with him - and righteous, working in advocacy for the current Hollywood strikes.",Lean Left,1,variety,41.29,-3.85
"Was it a huge release to be done shooting not only the film, but also be done wearing the wig?",Lean Left,0,variety,41.29,-3.85
But Rodrigo has been able to maintain the relatability of a lovable loser by apparently doing what most of the great superstar songwriters do: find a boyfriend or two who’ll make you feel less than in copious enough amounts to fuel a dozen or so tracks that balance deep insecurity with vengeful cockiness.,Lean Left,1,variety,41.29,-3.85
"Throughout the animated film, Mahito is haunted by visions of fire while futilely trying to rescue his mother.",Lean Left,0,variety,41.29,-3.85
"The Padres also missed the playoffs in 2023, finishing third in the NL West.",Lean Left,0,variety,41.29,-3.85
"Some of Mike’s writing is about the hilarity of the mundane, the hilarity of the privileged.",Lean Left,0,variety,41.29,-3.85
"One caveat-filled analysis by the Entertainment Strategy Guy, for instance, found only about 14% of first-season streaming shows released between 2021 and 2023 would qualify.",Lean Left,0,variety,41.29,-3.85
"For almost every moment in which a thesp mortifyingly screws up, there’s also one in which someone comes up with a quick fix that makes it possible at least to get to the next scene, if not actually turn disaster into success.",Lean Left,0,variety,41.29,-3.85
"And it was your little face - this beautiful, slightly baffled face.",Lean Left,0,variety,41.29,-3.85
"Instead, it is a feminist love story about female friendships, shocking betrayals and the sacrifices women have made across time to release themselves and others from the shackles of shame.",Lean Left,1,variety,41.29,-3.85
HATHAWAY: He’s a giggle of a person while also being delighted by darkness.,Lean Left,1,variety,41.29,-3.85
"That means less content flowing through the pipeline - the days of 600 scripted shows a year aren’t coming back anytime soon, and the theatrical business, already shrunk by COVID, will likely remain diminished - and therefore fewer jobs to go around in the industry.",Lean Left,0,variety,41.29,-3.85
"It’s also no surprise that there are Americans who believe that the problems with our country include the legalization of birth control, the freedom to marry another consenting adult regardless of gender, and the right to control one’s own gender identity.",Left,1,occupy-democrats,25.3,-21.06
Because he could easily end democracy in America and far too few Americans would know or even care?,Left,1,occupy-democrats,25.3,-21.06
"According to some Republican men, a woman’s role is still spreading her legs for a man as recently articulated by a Perryville, Missouri school board member - and this is in 21st Century.",Left,1,occupy-democrats,25.3,-21.06
"Donald, everyone knows you’re weaker, unsteady and confused all the time now.",Left,1,occupy-democrats,25.3,-21.06
Kevin Stitt continues to publicly support Israeli Prime Minister Benjamin Netanyahu.,Lean Left,0,washington-blade,42.71,-7.49
"Last week, Comer and Jordan accused Hunter Biden of seeking special treatment in requesting a public hearing instead of appearing for a closed-door deposition.",Lean Left,0,nbc-news,43.21,-5.79
Several more children sickened by fruit pouches tainted with lead More children were apparently sickened by apple puree pouches recently recalled due to dangerous lead contamination.,Lean Left,0,nbc-news,43.21,-5.79
"In the aftermath of the 2022 midterms, the fast-approaching 2024 Republican primary was largely seen as a two-person race, and for good reason: Trump remained a commanding presence in the party and still had a stranglehold on a large percentage of the Republican base, some of whom, it seems, would not abandon Trump under any circumstances.",Lean Left,1,nbc-news,43.21,-5.79
"The victim was not named in the court documents, but The Associated Press identified the target as Gurpatwant Singh Pannun, whom the Indian government allegedly considers a terrorist.",Lean Left,0,nbc-news,43.21,-5.79
Police said the suspects were interviewed and all three confessed to the murder.,Lean Left,0,nbc-news,43.21,-5.79
"His comments were based on a study from a recognizable organization, but his quote distorts the results.",Center,1,poynter,41.75,-7.32
The Edward R. Murrow College of Communication is recruiting for eight entry-level Journalist/News Fellows with the recently created Murrow News Fellowship Program.,Center,0,poynter,41.75,-7.32
"Trump is, essentially, an incumbent and, traditionally, incumbents getting in debates can only hurt and rarely help.",Center,1,poynter,41.75,-7.32
"But in fact, this only shrinks the scope of humanity for the rest of us and reinforces a hierarchy of suffering.",Left,1,the-nation,31.32,-19.23
"But he is, at the end of the day, a low-ranking killer for powerful forces, and ultimately, he too is human, vulnerable.",Left,1,the-nation,31.32,-19.23
Columbus Manor’s lawsuit against Allen and Jennifer mysteriously morphed as it went along.,Left,1,the-nation,31.32,-19.23
"However, although it follows that adding these elements to one’s daily vitamin intake may prevent hair discoloration, that’s not often the case.",Left,0,huffpost,37.82,-10.75
"Advertisement Last month, Israel’s police chief presented to the international news media videotaped testimony of a rape witness at the music festival.",Left,0,huffpost,37.82,-10.75
"At this point, that’s the expected stunt, yet it appears no one wants to take up that mantle.",Left,1,huffpost,37.82,-10.75
"In response to public input, the Forest Service made a few tweaks to the company’s original proposal.",Lean Left,0,montana-free-press,46.33,-3.8
"Department staff advocated for the new building to include classroom and community spaces not available in the previous office, which was leased, Christiaens said.",Lean Left,0,montana-free-press,46.33,-3.8
"In all cases, a good resume must contain measurable figures, all the personal data points that make you shine - how many projects you led, how much revenue you generated, how much growth you oversaw, how much infrastructure you built.",Center,1,cnet,40.02,-1.39
"Jeff Greenberg/Getty Images How to shop for eye drops safely Eye drops are used to treat a host of conditions, from minor irritants to chronic vision problems.",Center,0,cnet,40.02,-1.39
