text,source_party,label,source,reliability,bias
"Conversely, a minimalist mantel is only going to look strange in a maximalist home.",Left,1,new-york-daily-news,40.47,-8.12
"City Comptroller Brad Lander’s office has revoked Mayor Adams’ emergency powers to make deals with contractors for migrant services without prior approval, according to a letter from the comptroller’s office to the mayor’s office dated last Thursday.",Left,0,new-york-daily-news,40.47,-8.12
"Adding some cooked whole grains like farro or bulgur wheat also boosts the nutritional value, and adds heft.",Left,0,new-york-daily-news,40.47,-8.12
"For mains, select from options like a butternut squash risotto or roasted turkey breast with apple and chestnut stuffing, Yukon potato puree and a lingonberry-cranberry stuffing.",Left,0,new-york-daily-news,40.47,-8.12
"After nearly five decades in the acting world, Michael Douglas was honored with a star on the Hollywood Walk of Fame on Nov. 6, 2018.",Left,0,new-york-daily-news,40.47,-8.12
"The reality TV personality, who previously touted the benefits of Ozempic, recently revealed that the FDA-approved injectable landed her in the hospital with severe constipation.",Left,0,new-york-daily-news,40.47,-8.12
Those who support the state law say athletes born male have an unfair competitive advantages.,Left,0,new-york-daily-news,40.47,-8.12
"Stearns isn’t necessarily looking for more left-handed relievers, but he is looking for relievers who can pitch to lefties.",Left,0,new-york-daily-news,40.47,-8.12
"Engoron’s ruling accepted the AG’s finding that Trump’s former company controller, Jeff McConney, ignored the deed and jacked its worth up by 2,300% in Trump’s annual financial statements during the same period - noting that was still lower than Moens’ estimates.",Left,0,new-york-daily-news,40.47,-8.12
"Michael Nicholoulias, 74, was arrested Monday night as he drew a swastika on a bench in the posh seaside village, according to News 12 Long Island.",Left,0,new-york-daily-news,40.47,-8.12
"However, Bellinger’s analytics were poor in 2023, as he logged the worst hard-hit and barrel rates of his career.",Left,0,new-york-daily-news,40.47,-8.12
Microsoft has made huge inroads in the Chinese government over the last two decades.,Right,0,washington-free-beacon,23.47,14.45
"Here’s what you need to know about the debate, hosted by NewsNation.",Right,0,washington-free-beacon,23.47,14.45
"His tenure as speaker was marked by stormy relations with Republican hardliners, who forced him to endure 15 humiliating floor votes before receiving the gavel last January, and then voted him out on Oct. 3 after he backed a bipartisan spending measure that averted a government shutdown.",Right,0,washington-free-beacon,23.47,14.45
He also drew their ire earlier this year by striking a deal with President Joe Biden that averted a default on U.S. debt and set a $1.59 trillion spending limit for fiscal 2024.,Right,0,washington-free-beacon,23.47,14.45
"Haley criticized the former president for adding trillions to the national debt, while Ramaswamy raved semi-coherently about being young.",Right,1,washington-free-beacon,23.47,14.45
"Lady (Dambisa) Moyo of Knightsbridge had thrown a lunch celebrating the book at her vast townhouse just off Park Avenue and, despite being 100 years old, Henry was there.",Right,0,washington-free-beacon,23.47,14.45
"Haley defended herself ably throughout, embracing the criticism as evidence of her campaign's strength.",Right,0,washington-free-beacon,23.47,14.45
"Even with those, Henry can be seen to have followed Realpolitik rather than the right-wing ideology his traducers all too often suppose.",Right,1,washington-free-beacon,23.47,14.45
"It is humbling to discover how many of our glib assumptions, which seem to us novel and plausible, have been tested before, not once but many times and in innumerable guises, and discovered to be, at great human cost, wholly false.""",Right,0,washington-free-beacon,23.47,14.45
Biden's administration has not reimposed sanctions on Iran-backed terror groups like the Houthis-which have repeatedly fired missiles on U.S. forces in the region.,Right,0,washington-free-beacon,23.47,14.45
Claim: President Joe Biden never interacted with his son Hunter’s foreign business associates.,Right,0,washington-free-beacon,23.47,14.45
"Now that he has, the inevitable controversies have re-emerged, about Chile, Cambodia, East Timor, and so on.",Right,0,washington-free-beacon,23.47,14.45
Both the China Daily and the People’s Daily are widely considered propaganda tools for the Chinese Communist Party.,Right,1,washington-free-beacon,23.47,14.45
Republican voters will soon get to weigh in on which candidate they would like to challenge the enfeebled incumbent.,Right,1,washington-free-beacon,23.47,14.45
"He did not believe that was inevitable, however, and spent a great deal of time and trouble trying to explain both countries to each other.",Right,0,washington-free-beacon,23.47,14.45
"Ocasio-Cortez is a socialist, but only so long as it doesn’t interfere with her glamorous lifestyle.",Right,1,washington-free-beacon,23.47,14.45
"The strategy has failed miserably, with many of those same progressive organizations now openly supporting Hamas.",Right,1,washington-free-beacon,23.47,14.45
"Their conception of democracy seems to be equalization of outcomes, by intellectual elites.""",Right,1,washington-free-beacon,23.47,14.45
His move followed weeks of introspection as McCarthy considered the consequences for his California district and himself.,Right,0,washington-free-beacon,23.47,14.45
Now they want to sanction Israelis and exclude them from the United States.,Right,1,washington-free-beacon,23.47,14.45
"The programs, which were first reported by the Washington Free Beacon and described as illegal by many lawyers, are among the growing casualties of conservatives' campaign against racial preferences.",Right,1,washington-free-beacon,23.47,14.45
"Nickname: AOC Occupation: Celebrity, social media influencer, member of congress representing New York’s 14th district Gang affiliations: The Squad, Democratic Socialists of America Background: A former bartender and activist, Ocasio-Cortez was elected to Congress in 2018 at the age of 29 after defeating 10-term incumbent Rep. Joe Crowley (D., N.Y.) in the Democratic primary.",Right,1,washington-free-beacon,23.47,14.45
China censored Xiaoice after the bot generated criticisms of the Chinese Communist Party.,Right,0,washington-free-beacon,23.47,14.45
"Two other law firms, Perkins Coie and Morrison Foerster, opened their race-based fellowships to all applicants after lawsuits from Blum's group, which has also sued Fearless Fund, a venture capital firm, for a program that invests only in black-run companies.",Right,0,washington-free-beacon,23.47,14.45
"An estimate of 20,000 dead in a city with one-fifth the population of Gaza is stunning.",Right,1,washington-free-beacon,23.47,14.45
It will definitely annoy hysterical liberals who want everyone to be miserable all the time.,Right,1,washington-free-beacon,23.47,14.45
"Even if the precise casualty figures for Gaza and Ukraine were known, there is another stark difference to consider: The government in Kyiv has built bomb shelters in metro stations, underground garages, and other facilities, since it wants to minimize the number of citizens lost to Russian airstrikes.",Right,0,washington-free-beacon,23.47,14.45
"The polls also need to survey at least 8,000 registered likely Republican voters, among other requirements.",Right,0,washington-free-beacon,23.47,14.45
"But when one looks at specific facts, as Sowell does, rather than trafficking in vague generalities, as so many social justice advocates do, uncomfortable revelations emerge.",Right,1,washington-free-beacon,23.47,14.45
What were the requirements to get a spot at the fourth Republican debate?,Right,0,washington-free-beacon,23.47,14.45
The most absurd element of Gay's testimony was the conceit that we must tolerate the genocidal rantings of student radicals because Harvard values free speech and free expression oh so much.,Right,1,washington-free-beacon,23.47,14.45
"By noon on Sunday, the headline in question disappeared from the digital version of the Times’s story.",Right,0,washington-free-beacon,23.47,14.45
Microsoft loves the idea of access to the Asia market but it comes with a catch.,Right,1,washington-free-beacon,23.47,14.45
"In October, one curious journalist asked a top Hamas official, Mousa Abu Marzook, why Hamas built 500 kilometers of tunnels for its fighters, but no bomb shelters for civilians.",Right,0,washington-free-beacon,23.47,14.45
"Microsoft has roughly 9,000 employees in China and says it wants to surpass 10,000 employees by the end of the year.",Right,0,washington-free-beacon,23.47,14.45
"But Blum, who also organized the lawsuit against Harvard, says he's not done.",Right,0,washington-free-beacon,23.47,14.45
How to watch online for free The debate was live-streamed online at NewsNation.,Right,0,washington-free-beacon,23.47,14.45
"America's journalists are doing everything they can to help him solve it, but as is often the case when journalists try to help, the problem is only getting worse.",Right,1,washington-free-beacon,23.47,14.45
"More recently, Rhodes has been writing his own columns for the Times and attacking Israel for waging war on Hamas, the Iranian-funded terrorist group that murdered more than 1,200 Israelis on Oct. 7.",Right,1,washington-free-beacon,23.47,14.45
"Just 14 percent of Americans, and just 24 percent of Democrats, said they were better off financially under Biden, according to a Financial Times poll of registered voters released last month.",Right,0,washington-free-beacon,23.47,14.45
"Needless to say, the black moped driver did not commit a crime.",Right,1,washington-free-beacon,23.47,14.45
"Yet in the absence of transparency and accountability for the authors and editors responsible for such alternative facts, one should expect to see the same mistakes again and again.",Right,1,washington-free-beacon,23.47,14.45
Bottom line: Liberal nerds on bicycles (pardon the redundancy) are the worst.,Right,1,washington-free-beacon,23.47,14.45
Hunter Biden said in text messages and emails that his father was involved in his Chinese business ventures.,Right,0,washington-free-beacon,23.47,14.45
They know that Biden is unpopular and widely considered too old to serve another term.,Right,1,washington-free-beacon,23.47,14.45
"She just wants everyone else to suffer under her preferred policies, because the cruelty is the point.",Right,1,washington-free-beacon,23.47,14.45
"Lady Ballers stars Daily Wire cofounder Jeremy Boreing (who also produced and directed the film) as Rob, a boys basketball coach and divorced dad besieged by wokeness.",Right,1,washington-free-beacon,23.47,14.45
The debate will re-air at 9 p.m PT tonight only on NewsNation.,Right,0,washington-free-beacon,23.47,14.45
His actions: The moped driver did the honorable thing by stopping to make sure the little twerp wasn't seriously injured.,Right,1,washington-free-beacon,23.47,14.45
"Republican Kevin McCarthy, who won and lost the role of Speaker of the U.S. House of Representatives in a tumultuous nine months this year, said in a Wall Street Journal column on Wednesday that he will leave Congress, bringing an end to his congressional career.",Right,0,washington-free-beacon,23.47,14.45
"Jewish organizations spent millions of dollars supporting Black Lives Matter, the Women’s March, and many other faddish hotbeds of bigotry.",Right,1,washington-free-beacon,23.47,14.45
Then he sped off into the sunset like a Real American pioneer hoping to stake his claim in the Land of the Free.,Right,1,washington-free-beacon,23.47,14.45
"Use our ChannelFinder and download our app to get fact-based, unbiased news for all America.",Right,0,washington-free-beacon,23.47,14.45
Recent polls have shown former president Donald Trump beating Biden in Pennsylvania.,Right,0,washington-free-beacon,23.47,14.45
Its mere existence is a middle finger to the cultural overlords who deign to decide what topics we're allowed to joke about.,Right,1,washington-free-beacon,23.47,14.45
"Ramaswamy and Haley have sparred in prior debates, with Ramaswamy accusing the former U.N. ambassador of being bought off by the defense industry.",Right,0,washington-free-beacon,23.47,14.45
Andrew Roberts is the coauthor of Conflict: The Evolution of Warfare 1945 to Ukraine.,Right,0,washington-free-beacon,23.47,14.45
"When parents protested, they were not met with efforts at persuasion or fact-based reasoning, but with condescension.",Right,1,washington-free-beacon,23.47,14.45
"Hunter Biden worked closely with the firm, Burisma Holdings, while then-vice president Joe Biden was spearheading American policy on Ukraine.",Right,0,washington-free-beacon,23.47,14.45
"Rather, it turned to a U.N. data set that has a very high bar for reporting fatalities.",Right,0,washington-free-beacon,23.47,14.45
"While they’re at it, they should get off Elon’s case too, and take heed of what he has to say.",Right,1,washington-free-beacon,23.47,14.45
"Hours before the debate, CNN released a poll that showed the president's approval rating at an all-time low.",Right,1,washington-free-beacon,23.47,14.45
Context: There is insurmountable evidence that Joe Biden met with several of his son’s business partners.,Right,1,washington-free-beacon,23.47,14.45
"Some of these films are beloved comedy classics such as Mrs. Doubtfire, Ace Ventura: Pet Detective, and Tropic Thunder, while others are forgettable flops such as Juwanna Mann and Sorority Boys.",Right,1,washington-free-beacon,23.47,14.45
The policy is already facing pushback from Republican foreign policy aides in Congress and from former Trump administration officials who see President Joe Biden as wrongly prioritizing sanctions on Israel.,Right,1,washington-free-beacon,23.47,14.45
He’s a partisan for rigorous analysis and truth-telling about the past and the present-something we have too few of these days.,Right,0,washington-free-beacon,23.47,14.45
"He notes that the most popular brands of beer in the United States were created by people of German ancestry, and ""it so happens that Germans were producing beer back in the days of the Roman Empire.",Right,0,washington-free-beacon,23.47,14.45
"It shows you what their priorities are and who they want to target.""",Right,1,washington-free-beacon,23.47,14.45
"In the ensuing months, CEFC transferred millions of dollars to Hunter Biden to scout out potential investments for the firm.",Right,0,washington-free-beacon,23.47,14.45
"One senior Republican congressional aide, who works on foreign policy matters, in comments to the Free Beacon described the administration's policy as backwards.",Right,1,washington-free-beacon,23.47,14.45
That is the contradiction at the heart of this sordid enterprise.,Right,1,washington-free-beacon,23.47,14.45
"In a just world, he would be commended for his actions.",Right,1,washington-free-beacon,23.47,14.45
"We knew, of course, that Henry was not going to be with us for much longer, so we hung on every word, conscious that before long a giant was going to be slipping from the scene.",Right,1,washington-free-beacon,23.47,14.45
The feature-length comedy was produced by the folks at the Daily Wire and is available now on the DailyWire+ streaming service.,Right,0,washington-free-beacon,23.47,14.45
"Sowell notes not only Rousseau but also the social control proposals of Progressive Era reformer John Dewey and, more recently, John Rawls.",Right,0,washington-free-beacon,23.47,14.45
"The Biden administration has been under immense pressure from far-left voices in the Democratic Party who want it to more forcefully condemn Israel, which is waging war on Hamas following the terrorist group's Oct. 7 slaughter of more than 1,200 people.",Right,1,washington-free-beacon,23.47,14.45
"Republicans have released a trove of emails, bank records, and other business documents related to Hunter’s ventures in Ukraine, China, Romania, and elsewhere.",Right,0,washington-free-beacon,23.47,14.45
Former South Carolina governor and U.N. ambassador Nikki Haley drew fire early and often.,Right,1,washington-free-beacon,23.47,14.45
"Amenities included several pools, racquetball courts, cycling studios, massage rooms, golf simulator, climbing wall, and a rooftop dog park.",Right,0,washington-free-beacon,23.47,14.45
"Methamphetamine and cocaine played a role in just over 51 percent and 46 percent of the deaths, respectively.",Right,0,washington-free-beacon,23.47,14.45
An August 2022 poll found that 52 percent of voters in Pennsylvania were against it.,Right,0,washington-free-beacon,23.47,14.45
"A lot depended on his sense of comic timing, as in: ""Nobody will ever win the battle of the sexes.",Right,0,washington-free-beacon,23.47,14.45
"This confidence persists even though the ministry never distinguishes fighters from civilians, and even though Hamas gunmen fight in civilian clothes.",Right,1,washington-free-beacon,23.47,14.45
May this be the first of many hearings cracking open for public inspection the Ivy League's intellectual rot.,Right,1,washington-free-beacon,23.47,14.45
The Washington Free Beacon reported last year that opponents of the ban warned it would disproportionately impact black people and put them at risk of arrest for using the products.,Right,0,washington-free-beacon,23.47,14.45
"When a particular people has been doing a particular thing for more than a thousand years, is it surprising if they tend to be more successful in that particular endeavor than other who have had no such history?""",Right,0,washington-free-beacon,23.47,14.45
"This perverse approach to education isn’t illegal, according to the Journal.",Right,1,washington-free-beacon,23.47,14.45
"So, too, in the discussion of race in the United States.",Right,0,washington-free-beacon,23.47,14.45
"And in 2015, Joe and Hunter Biden attended a dinner in Washington, D.C., with Vadym Pozharskyi, a Burisma Holdings executive who was Hunter’s primary point of contact for the company.",Right,0,washington-free-beacon,23.47,14.45
"Ramaswamy, the 38-year-old former pharma executive who is polling at 4.9 percent in the race, made the comments while accusing Haley of wanting to track internet users.",Right,0,washington-free-beacon,23.47,14.45
"It’s unclear what the payment was for, or whether Owasco made any subsequent payments to the president’s checking account.",Right,0,washington-free-beacon,23.47,14.45
"With his trademark directness in describing the facts and his wry humor, Sowell is always a pleasure to read; despite the slim size of this volume, it contains a thorough debunking of the fallacies noted in the title.",Right,0,washington-free-beacon,23.47,14.45
"Hunter Biden and his father also shared office space in Washington, D.C., with executives of the Chinese energy firm, emails from his abandoned laptop show.",Right,0,washington-free-beacon,23.47,14.45
"Administrators like Luna insist, at one turn, that segregation is necessary to boost the grades and test scores of minority students, then decry those metrics as tools of white oppression at another.",Right,1,washington-free-beacon,23.47,14.45
"Mr. Musk, fresh off his solidarity trip to Israel, has received endless abuse from Democrats, who insist he is not just an anti-Semite, but a racist, sexist, and all the other things leftists like to call people.",Right,1,washington-free-beacon,23.47,14.45
Though its plot is not dissimilar to that of Juwanna Mann-which came out in 2002 and starred Vivica A.,Right,1,washington-free-beacon,23.47,14.45
"The deals have not been widely reported outside of China, nor have the financial terms been disclosed.",Right,0,washington-free-beacon,23.47,14.45
"While the previous debate required at least 70,000 unique donors, candidates will need to bring in a minimum of 80,000 unique donors to their principal presidential campaign committee, with at least 200 unique donors in 20 or more states or territories each.",Right,0,washington-free-beacon,23.47,14.45
"But many of the Jewish leaders, who have repeatedly lined up behind the most noxious progressive causes, only to stand there, mouths agape as the boomerang soared right back and crashed into our faces.",Right,1,washington-free-beacon,23.47,14.45
"Its 15, often-multi-page references would have reminded him of the centrality of his life and career to the history of the past eight decades since the Nazis tried and thankfully failed to kill him.",Right,1,washington-free-beacon,23.47,14.45
"Haley had previously suggested that social media users should be verified by name, to prevent foreign adversaries from using fake accounts to launch influence operations in the United States.",Right,0,washington-free-beacon,23.47,14.45
"Once Henry recognised that war could not be won, he got the best possible peace terms for the South Vietnamese, and it was only congressional recalcitrance that meant that it was not enough.",Right,1,washington-free-beacon,23.47,14.45
The richest man in the world is starting to sound more like Norman Podhoretz than Norman Finkelstein.,Right,1,washington-free-beacon,23.47,14.45
"Yet here is a man who in many ways fashioned the world we live in today, and who also saved us from a much worse one.",Right,0,washington-free-beacon,23.47,14.45
Hardliners shuttered the House floor in days over the spending agreement but have since said they would accept it.,Right,0,washington-free-beacon,23.47,14.45
"And on most of the Jews, alas, he is absolutely right.",Right,1,washington-free-beacon,23.47,14.45
He is currently working on a coauthored book about the conflict between Israel and Iran.,Right,0,washington-free-beacon,23.47,14.45
It is the first time in decades the United States is imposing punitive measures on Israelis living in the West Bank and signals cracks in the Biden administration's initial full-throated support for Israel as the country confronts Hamas terrorists.,Right,1,washington-free-beacon,23.47,14.45
"They did so because they believed that by standing with anyone who claimed to be oppressed, they could prove themselves to be allies and progressives in good standing.",Right,1,washington-free-beacon,23.47,14.45
"At his 100th birthday party thrown by Jacob Rothschild, he asked whether people thought that Iran could be contained over 10 or 15 years, as though he would be around to see which it would be.",Right,1,washington-free-beacon,23.47,14.45
The first was getting canceled within an inch of my life and sanity.,Center,1,az-central,42.22,-7.0
"Another of those former employees, also citing Evola, confirmed Brown’s interest in the occultist bent of the SS.",Left,1,mother-jones,37.08,-15.12
"In 2020, nearly 9,900 fires had burned more than 4.3 million acres of land in the state, killing dozens of people and causing billions of dollars worth of damage.",Left,0,mother-jones,37.08,-15.12
"In the 1990s and 2000s, they supported Democrats (Barack Obama, Hillary Clinton, congresswoman Jane Harman) and Republicans (Mitt Romney, John McCain, Mitch McConnell, and Newt Gingrich).",Left,0,mother-jones,37.08,-15.12
"But [in the special], he jokes about a fat woman hanging herself.",Left,1,mother-jones,37.08,-15.12
There was another joke that he told about how he’s scared of ghosts and monsters.,Left,0,mother-jones,37.08,-15.12
"And last week, he appeared on a podcast with Canadian psychologist and conservative provocateur Jordan Peterson, where the two expressed their mutual admiration.",Left,0,mother-jones,37.08,-15.12
"New Mexico, a state with a Democratic governor who has been unabashed in her support for abortion rights, is like another planet compared to Jackson, Mississippi, where Women’s Health Organization was originally located.",Left,1,mother-jones,37.08,-15.12
"These communities, Russell’s study noted, can also help people with long Covid better understand their new reality.",Left,0,mother-jones,37.08,-15.12
"Bumatay said that if the courts cannot keep Congress in check with a realization requirement, Congress could yet start taxing wealth and billionaires.",Left,0,mother-jones,37.08,-15.12
"Since they couldn’t process hemp in the time allotted to build, the crew had to import some.",Left,0,mother-jones,37.08,-15.12
"Moving comfortably among the sea of kids sitting crisscross-applesauce on the gym floor, she recounted that the first story she ever wrote, in kindergarten, was about a witch who ate babies, noting that its creation coincided with the birth of a new sibling-possibly not a coincidence.",Left,0,mother-jones,37.08,-15.12
"Hopefully, the studios can see past their bottom line and give hard-working creatives their piece of the pie.",Left,1,mother-jones,37.08,-15.12
"She left out the worst parts of it all-how Nodine had pushed her head down toward his exposed genitals and that out of fear, she gave him oral sex.",Left,1,mother-jones,37.08,-15.12
"When reviewing Cristobal’s records, Jin saw that the DOE had failed to assess his communication skills and autism profile properly.",Left,0,mother-jones,37.08,-15.12
That was the part of the special that hit me to my core and made me feel disgusted.,Left,1,mother-jones,37.08,-15.12
Ohio Speaker Stephens did not explain what he has in mind to subvert the overwhelming Ohio vote for abortion rights.,Left,1,mother-jones,37.08,-15.12
The big bucks and the momentum are prompting her to make a concerted effort to pick off Trump voters.,Left,1,mother-jones,37.08,-15.12
"As if separating families at the border, undercutting the refugee program, and forcing asylum seekers to wait in squalid migrant camps in dangerous Mexican border towns wasn’t bad enough the first time around, Trump and Miller have dialed up the cruelty.",Left,1,mother-jones,37.08,-15.12
