text,source_party,label,source,reliability,bias
"Advertisement Now, a Wednesday letter signed by both chairmen addresses Lowell once more, and threatens contempt of Congress proceedings if his client does not comply with appearing for a closed door deposition on December 13.",Right,0,townhall,24.95,19.79
These are the top enlisted ratings per our respective armed services.,Right,0,townhall,24.95,19.79
But America is not some college campus where the mutants who love Hamas and hate Jews get a pat on the head.,Right,1,townhall,24.95,19.79
"Since the attacks occurred Israel has declared war on Hamas, and after weeks of preparations have entered Gaza to seek out and destroy Palestinian terrorists wherever they can find them, in order to defend themselves from further aggression and violence at the hands of Hamas.",Right,0,townhall,24.95,19.79
"That’s according to numbers collected by the Wikimedia Foundation, the non-profit behind the free, publicly edited online encyclopedia.",Right,0,townhall,24.95,19.79
"DeSantis is better on the issues than Trump, but the fact is that Trump is more than good enough on policy.",Right,1,townhall,24.95,19.79
"That hasn’t changed, and now it seems Venezuela has chosen imperialism to right the ship.",Right,1,townhall,24.95,19.79
"However, if these hard chargers want to, essentially, go through basic training all over again to lead troops so be it.",Right,1,townhall,24.95,19.79
"Recently a social media post has caused controversy within the military and veteran sphere, namely that enlisted troops should not be made officers.",Right,0,townhall,24.95,19.79
The partisan January 6 Select Committee had a troubling track record of procedural abuses and due process violations.,Right,1,townhall,24.95,19.79
The verification steps will vary depending on the sensitivity of the personal information and whether you have an account with us.,Right,0,townhall,24.95,19.79
It has become so bad that none other than Chuck Schumer had to come forward and decry what he is seeing coming from inside their own house.,Right,1,townhall,24.95,19.79
Forget that you can dig underground and find ancient Jewish artifacts.,Right,1,townhall,24.95,19.79
"The growing dispute between Venezuela’s authoritarian regime and Guyana involves a vast area facing Tuschen village called Essequibo, and comes as an Exxon Mobil-led consortium has made a series of offshore oil discoveries and Guyana pushes for more hydrocarbons exploration in areas that Venezuela claims as its own.",Right,0,townhall,24.95,19.79
"With that last one, the effects are particularly nasty, as medical consolidation hits sick or hurt people when they’re already down.",Right,1,townhall,24.95,19.79
"He believes that other technologies, such as hybrid cars and cars powered with hydrogen technology, can be part of the solution.",Right,0,townhall,24.95,19.79
"Advertisement Jacobson, who blogs at Legal Insurrection as well, nails it here - but I’d add a caveat.",Right,1,townhall,24.95,19.79
Myra is also the Executive Director of SignFromGod.org and the National Shroud of Turin Exhibit.,Right,0,townhall,24.95,19.79
"As William Jacobson astutely diagnoses in his essay today for the James G. Martin Center, the Ivy League has gone all-in on attacking Western civilization in favor of what it sees as those who can dismantle it.",Right,1,townhall,24.95,19.79
"No matter the odds, or personal cost, we did the right thing.",Right,1,townhall,24.95,19.79
"Host: - please condemn the case of the slaughter of the 7th of October, and Michelle Obama did not agree to condemn it?",Right,1,townhall,24.95,19.79
Whether or not they have the fortitude to make good on their promises to address the antisemitism remains to be seen.,Right,1,townhall,24.95,19.79
Getting chargers up and running across the country is essential to reaching President Joe Biden’s goal of having half the vehicles sold in the United States be electric by the end of the decade - a key cog of his climate agenda.,Right,0,townhall,24.95,19.79
"While support for our ally in the Middle East might seem like a bipartisan issue, Democrats are increasingly finding themselves in disarray.",Right,0,townhall,24.95,19.79
"And even if flooded, one day with the rats out, there may be some terror tunnels left intact.",Right,0,townhall,24.95,19.79
"No need to jet off to Dubai, Kamala - the political climate has indeed changed - the American people are fed up with your White House’s woke and weak policies, and they will hold you and your boss accountable less than a year from now at the ballot box.",Right,1,townhall,24.95,19.79
Advertisement Leaders of nations throughout the West have decided that it will be simpler to manage the masses of migrants rather than the native populations.,Right,1,townhall,24.95,19.79
"Instead, the fanatics in the Biden administration and the billionaire donor class demand that we save the planet from carbon emissions at any cost, and if that means diminishing funds for fighting real pollution that kills people, so be it.",Right,1,townhall,24.95,19.79
The resulting war would be deadlier than the one going on now.,Right,1,townhall,24.95,19.79
"And as Trende points out, Trump has never had a consistent lead before.",Right,0,townhall,24.95,19.79
They enable each other to get away with it while doggedly pursuing you for anything.,Right,1,townhall,24.95,19.79
His recent disposal of that human hairstyle of a Cali governor reaffirmed his skills.,Right,1,townhall,24.95,19.79
"Advertisement When Bosnian Serb Gavrilo Princip assassinated Archduke Franz Ferdinand and his wife in 1914, he started a series of events that changed the world forever.",Right,1,townhall,24.95,19.79
Las Vegas Police reported shortly afterward that the shooter had been contained and was later discovered deceased.,Right,0,townhall,24.95,19.79
This is the essence of the social contract that citizens enter into with their government.,Right,0,townhall,24.95,19.79
"It is fair to say that when it comes to the Democrats, there is not a deep bench down here, but still it is amusing to most to learn who Gavin has turned to.",Right,1,townhall,24.95,19.79
"The truism before October 7 remains, if they were to lay down their weapons today, they could have peace tomorrow.",Right,0,townhall,24.95,19.79
So why did the governments allow themselves to kill so many non-combatants?,Right,1,townhall,24.95,19.79
It also makes reference to Lowell having sent them another letter earlier on Wednesday repeating such a request.,Right,0,townhall,24.95,19.79
"His fiercest opponents, the left-wing Peronists and other leftists, hold 105.",Right,1,townhall,24.95,19.79
"This story happened in Germany around Thanksgiving week, so apologies for circling back a bit, but it’s something law enforcement should consider doing here.",Right,1,townhall,24.95,19.79
"According to the RealClearPolitics average of polls, 40 percent of Americans approve of Joe Biden’s job performance while nearly 56 percent disapprove.",Right,0,townhall,24.95,19.79
"Heads will roll and some names will be remembered for generations as the ones responsible for the deaths, injuries and captives.",Right,1,townhall,24.95,19.79
"When we fail to take a side in favor of helping these vulnerable individuals, we perpetuate their suffering and the callousness of our own hearts.",Right,1,townhall,24.95,19.79
"Reporting from Fox News provides some insight of that letter from Lowell: Lowell on Wednesday sent a letter to Comer, saying Hunter Biden will only appear for testimony in a public hearing setting.",Right,0,townhall,24.95,19.79
"Glenn Youngkin posted about the cancelation on his official X account, with the story and his reaction being featured by local and national media, including reporting from Fox News.",Right,0,townhall,24.95,19.79
A research institute will not reopen train stations closed because people refuse to stop spitting on innocent Jews.,Right,1,townhall,24.95,19.79
"Just as he did not appear in the previous three RNC debates, Trump is not expected to appear at the fourth debate.",Right,0,townhall,24.95,19.79
"Without fossil fuels, there is simply no way we could maintain the standard of living that we have become accustomed to.",Right,1,townhall,24.95,19.79
Two of the egg suppliers indicated they would appeal Friday’s decision.,Right,0,townhall,24.95,19.79
"Advertisement In Kelo v. New London, nine owners of homes in that Connecticut city challenged the use of eminent domain to take their property in the name of economic development.",Right,0,townhall,24.95,19.79
The months of October and November saw the unfortunate passing of two American heroes - T.K.,Right,0,townhall,24.95,19.79
"Moral relativism has taken the place of black and white, good and evil.",Right,1,townhall,24.95,19.79
They did not form some BDS movement or demand a halt to the killing and torture.,Right,1,townhall,24.95,19.79
"What matters, we get told, is the level of technology and the measured tonnage of the ships, and, therefore, the US fleets are considered better, and, therefore...technically, we have more ships...somehow?",Right,1,townhall,24.95,19.79
"Dogs have found and neutralized some of these savages, but many are no wider than a telephone booth, leading to serious concerns about casualties.",Right,1,townhall,24.95,19.79
Elon Musk's X platform fueled far Gilded Reframe - WASHINGTON POST Is there a slide rule they use to reclassify stories when new information comes in?,Right,1,townhall,24.95,19.79
"That is what we are acting on,"" he continued, his tone and words also suggesting he was speaking down to those who would dare question his science.",Right,1,townhall,24.95,19.79
"Vivek Ramaswamy was the one who delivered the nastiest haymakers, calling the former South Carolina governor hopelessly corrupt, ignorant of foreign affairs, and a rogue neocon.",Right,1,townhall,24.95,19.79
Another possibility is that the Democrats could steal the election the old-fashioned way.,Right,1,townhall,24.95,19.79
"Consider that in 1980, when Ronald Reagan was elected president, 88% of voters were white.",Right,0,townhall,24.95,19.79
It seems typical drivers are more interested in getting to their destinations quickly than safely-whether in deer country or not.,Right,1,townhall,24.95,19.79
"If you see someone vandalizing a Jewish deli, film and report that person.",Right,0,townhall,24.95,19.79
"These talents have nothing to do with race, ethnicity or sexual orientation.",Right,0,townhall,24.95,19.79
Our business or commercial purpose for collecting or selling that personal information.,Right,0,townhall,24.95,19.79
It is intentionally meant to terrify a people who have been subjected to pogroms and hatred for centuries and were victims of mass genocide in the Holocaust.,Right,1,townhall,24.95,19.79
"Now Albany lawmakers are talking about suspending the statute of limitations for another year, or forever.",Right,0,townhall,24.95,19.79
"Without a belief in God, there is no supreme authority or natural law to which their own laws and policies must adhere to be just.",Right,1,townhall,24.95,19.79
"The following categories of personal information may be sold by us or our affiliates to business partners, advertisers, and other third parties, or as part of business or asset transfers: identifiers, personal information categories listed in California Customer Records statute, characteristics of protected classifications under California or federal law, commercial information, internet or similar network activity information, geolocation data, and inferences Your Rights and Choices The CCPA provides consumers who are California residents with specific rights regarding their personal information.",Right,0,townhall,24.95,19.79
Why did the Japanese even bomb Pearly Harbor in the first place?,Right,0,townhall,24.95,19.79
It’s only a matter of time until Americans do as well.,Right,1,townhall,24.95,19.79
"At that point, the officer believe that gunshots came from the residence, Penn said.",Right,0,townhall,24.95,19.79
"The New York Times, in July 2020, wrote: ""...about 15 million to 26 million people in the Unite States have participated in demonstrations over the death of George Floyd and others in recent weeks.",Right,0,townhall,24.95,19.79
They have formed human tunnels of the ranks of the IDF allowing civilians to pass when Hamas had been shooting them previously if they tried to leave.,Right,1,townhall,24.95,19.79
The left is content to let the suicides of people they claim to care so deeply about continue because they serve a larger purpose - those deaths enable Democrats to peacock around claiming moral superiority and a deeper sense of caring than anyone else.,Right,1,townhall,24.95,19.79
The last thing he deserves is to take his failures nationwide with a promotion to the White House.,Right,1,townhall,24.95,19.79
"Of those, one has shut down and the other two operate at sharply reduced levels.",Right,0,townhall,24.95,19.79
"Importantly, they also currently underpay their share of the costs they impose on the road system -- meaning taxpayers heavily subsidize companies who use the roads to ship goods.",Right,0,townhall,24.95,19.79
"Again, this is a priority of the Biden administration, and President Joe Biden, Vice President Kamala Harris, as well as other cabinet members have participated in and given remarks for various task force meetings.",Right,0,townhall,24.95,19.79
"Israel in less than a day lost 1,200 people, the vast majority unarmed citizens, as well as 300 soldiers and 50 policemen.",Right,1,townhall,24.95,19.79
"According to The Washington Post, she has been the harshest sentencing judge, ordering at least some jail or prison time in all cases while sometimes exceeding the cruel sentences demanded by prosecutors.",Right,0,townhall,24.95,19.79
"The Libertarian-leaning Institute for Justice is representing opponents and hopes to chip away at eminent domain, the government power to legally take private land while paying fair compensation.",Right,0,townhall,24.95,19.79
"Both women, along with MIT President Sally Kornbluth, repeatedly failed to condemn the actions of pro-Hamas elements on their campuses, much to the dismay of many prominent donors.",Right,1,townhall,24.95,19.79
"The research determined that some 29,000 vehicle collisions with deer occurred within the state of Wisconsin alone during 2022.",Right,0,townhall,24.95,19.79
Even Dr. Jaber is not above the influence of the UAE’s royal families.,Right,1,townhall,24.95,19.79
"It raises the legitimate question as to whether Israel has, or ever will have, peace partners.",Right,1,townhall,24.95,19.79
"Women filmed being brutally gang-raped and then executed, toddlers beheaded right in front of their parents, and Israelis set afire and burned alive.",Right,1,townhall,24.95,19.79
U.S. Special Envoy for Climate John Kerry and China Special Envoy for Climate Xie Zhenhua met last month in California.,Right,0,townhall,24.95,19.79
"That's not easy, but it is the only way forward for Israel, is the only way forward for long-term peace.""",Right,0,townhall,24.95,19.79
The cycle of Palestinian violence will never end if the West continues to prop it up.,Right,1,townhall,24.95,19.79
"For about the next 48 hours, until Sunday night, at 11:59 pm PT - you can get yourself the deal of the year.",Right,0,townhall,24.95,19.79
"If Trump manages to come away with just a small increase in minority voting, that could really screw over the Democrats.",Right,1,townhall,24.95,19.79
"But if you do not believe in the Zionist ideal or the religious promises in the Torah, then why move them?",Right,1,townhall,24.95,19.79
"We live in partisan times, with partisan bills and nominees being offered up.",Right,0,townhall,24.95,19.79
"CEO Jim Harden is looking to do what the DOJ will not, bring FACE charges.",Right,1,townhall,24.95,19.79
The left loves to change the rules of what is acceptable.,Right,1,townhall,24.95,19.79
"Garland offered specific examples of state laws in Alabama, Idaho, and a case out of Texas involving a particularly notable case worth watching when it comes to the accessibility of abortion-inducing drug mifepristone.",Right,0,townhall,24.95,19.79
Kilmeade said he plans to get to the library early to tour it and see what Washington saw 123 years ago.,Right,0,townhall,24.95,19.79
"Today, Kari Lake is running for the US Senate and is being criticized for reaching out to various parts of the Republican Party who she criticized and who did not support her in the past.",Right,0,townhall,24.95,19.79
This is in response to the oil and gas hub's criticism for leading climate talks at this year’s summit.,Right,0,townhall,24.95,19.79
"CEO Elon Musk showed off the angular trucks with an event at the company’s factory outside of Austin, Texas, that was broadcast on X, formerly Twitter.",Right,0,townhall,24.95,19.79
The influx of migrants accounts for an 11.7% increase in Ireland's population from 2012 to 2023 - an astounding one in nine people.,Right,0,townhall,24.95,19.79
"We need to demand more from our politicians because whether we like them or not, they impact our lives and represent us in office, even if we can’t stand what they stand for.",Right,1,townhall,24.95,19.79
"Ambush on the West Bank, September 18, 2002: Gunmen ambushed a vehicle on a road near Yahad, killing an Israeli.",Right,0,townhall,24.95,19.79
"Excluding volatile food and energy costs, increases in so-called core prices also slowed.",Right,0,townhall,24.95,19.79
But Israel does not believe in its founding principles of providing safety to the Jewish people and thus hesitates to attack where there are Gazan civilians or simply flood the tunnels and probably bring down half of the buildings in Gaza.,Right,1,townhall,24.95,19.79
God tells us to honor our father and mother; Marxists claim that family ties interfere with the proletariat's love of the state.,Right,1,townhall,24.95,19.79
"This includes all eight million that Joe Biden has already let in, four million more under Biden by November 2024, and 10 to 12 million who were here before Biden was elected president.",Right,1,townhall,24.95,19.79
"After years of insistance that he is a Nazi authoritarian, Donald has finally given them a shred of evidence!",Right,1,townhall,24.95,19.79
"Probably the biggest loser of the event after Israel is the PA. On the one hand, Hamas is hogging all of the attention and credit for an attack of a nature and at a scale never seen in 100 years of Arab violence against Jews in the Holy Land.",Right,1,townhall,24.95,19.79
Sources in Israel have revealed comments attributed to Blinken and other senior War Cabinet members.,Right,0,townhall,24.95,19.79
"Examples of these inferences include a profile reflecting your preferences, characteristics, predispositions, behavior, attitudes, abilities, and aptitudes.",Right,0,townhall,24.95,19.79
Muslim countries in the region do not wish to accept Palestinian refugees.,Right,1,townhall,24.95,19.79
"In the 18 months since the leak, however the Biden administration has also shown a one-sided aim on which said they aim to prioritize protecting.",Right,1,townhall,24.95,19.79
He is not running to be your buddy or role model.,Right,0,townhall,24.95,19.79
"And, of course, Grandpa Joe will have to decide because it could destroy the so-called ‘Gaza Metro’ that Hamas has used for years to commit acts of terrorism.",Right,1,townhall,24.95,19.79
"See, infra, note 112 of this Decision and Order (collecting citations to laws banning firearms in schools).",Right,0,townhall,24.95,19.79
"It's not rocket science, yet the Biden administration seems to act like it is - failing in some cases to track in-office vs. remote work habits of employees.",Right,1,townhall,24.95,19.79
"If Israel clobbers Hamas and maybe Hezbollah, their rule becomes more secure.",Right,1,townhall,24.95,19.79
That’s what happened in the Ron DeSantis debate - RDS challenged him with facts and figures and examples of the kind of perverted garbage Gavin thinks belongs in your kid’s classroom.,Right,1,townhall,24.95,19.79
"And when government treats people differently based on their faith, it’s religious discrimination, pure and simple.",Right,1,townhall,24.95,19.79
Something is happening as the consequences of mass immigration fuel outrage amongst the global population.,Right,1,townhall,24.95,19.79
"Discrimination used to be against the law in the United States but today, it is becoming the law.",Right,1,townhall,24.95,19.79
"We share any of the categories of information we collect, as appropriate or required, to respond to subpoenas, court orders, legal process, and other law enforcement measures, to comply with other legal obligations, to respond to an emergency, or otherwise to protect the rights, property, safety, or security of other parties, visitors to our platforms, or the public.",Right,0,townhall,24.95,19.79
That means a candidate just has to finish in the top 2 slots in the primary to make to the general election.,Right,0,townhall,24.95,19.79
Or the Biden administration could have a foreign policy triumph that breaks its Ronna-esque streak of failure from Afghanistan to Ukraine to Israel.,Right,1,townhall,24.95,19.79
"Given the high upfront costs associated with setting up a nationwide system (again, this wouldn't be an issue if we left the federal government out of it), and assured of pushback from the motoring public, state and federal legislators should start charging only large trucks and other heavy-duty commercial vehicles.",Right,1,townhall,24.95,19.79
"Away from campus, the few Mulsims who actually vote said that they will not vote for Biden if he does not force a ceasefire down Israel’s throat.",Right,1,townhall,24.95,19.79
"If Senate Republican Leader Mitch McConnell and his Republican colleagues hold firm, the Democrats’ choice will be simple - agree to border policy changes that will actually secure the border and, in exchange, earn support for the aid Israel, Ukraine, and Taiwan need; or refuse to make the necessary changes to border policy and see the aid request defeated.",Right,1,townhall,24.95,19.79
"It doesn’t dictate speech codes to college campuses, another point on which conservatives should know better than to impose.",Right,1,townhall,24.95,19.79
"If federal employees aren't coming back to work, get rid of their wasted office space.",Right,1,townhall,24.95,19.79
"Biden being Biden, he tried to pander to the Native Americans saying he wanted to play lacrosse (a sport invented by Native Americans).",Right,1,townhall,24.95,19.79
"A total of 16 properties were searched by 500 police officers in Berlin and the states of Lower Saxony, North Rhine-Westphalia and Schleswig-Holstein.",Right,0,townhall,24.95,19.79
"Chris Christie, who was nearly invisible for the first 20 minutes of the debate.",Right,1,townhall,24.95,19.79
Bold words from elected officials mean little when Jews are told they cannot safely enter an entire neighborhood in their own city.,Right,1,townhall,24.95,19.79
"Israel hasn’t made a final decision to move ahead, nor has it ruled the plan out, officials said.",Right,0,townhall,24.95,19.79
"As a result, although the number and Case 1:22-cv-00986-GTS-CFH Document 78 Filed 11/07/22 Page 138 of 184.",Right,0,townhall,24.95,19.79
Leftists often take pride in exposing the identity of right-of-center donors.,Right,1,townhall,24.95,19.79
"Additionally, he blamed American gun manufacturers for enabling the spread of fentanyl.",Right,1,townhall,24.95,19.79
"With almost no Republicans on hand to deter them, the powerful Democratic women lawyers felt free to let down their hair and say what they think about Trump.",Right,1,townhall,24.95,19.79
An early recognition of this occurred to me during the energy crises of the 1970s.,Right,0,townhall,24.95,19.79
"Israel has made it clear that the PA will not take over Gaza, and daily, Israel enters PA areas of the West Bank to arrest and kill terrorists.",Right,0,townhall,24.95,19.79
"The trade unions are extremely strong in Argentina, very political and firmly in the hands of the Peronists.",Right,1,townhall,24.95,19.79
"Yes, how dare they want to secure the border that Biden has broken wide open?",Right,1,townhall,24.95,19.79
"In December 2015, when Biden was vice president, the United Nations held the COP21 climate change conference in Paris that resulted in an international agreement.",Right,0,townhall,24.95,19.79
Useless stuttering of the same phrase that is not only impossible but meaningless does not help and will not solve a problem.,Right,1,townhall,24.95,19.79
"If retailers defy the law, they will get slapped with a $500 fine.",Right,0,townhall,24.95,19.79
Context: Gutfeld on FNC quadrupled that number with 2M at 10p.,Right,0,townhall,24.95,19.79
"Of those, 59 percent said some of the bills that led to their debt were from a simple lab fee or diagnostic test.",Right,0,townhall,24.95,19.79
"Now Democrats are back to eyeing Cheney warily, in no small part because they believe an independent run, even by someone as unpopular as Cheney, would take votes away from President Joe Biden in the general election.",Right,1,townhall,24.95,19.79
"How many fake blacks, Indians, and the like have been outed; they played their role because they understood that on the left, victimhood is the currency of the realm.",Right,1,townhall,24.95,19.79
"Take some time, observe, and learn how the most successful country on Earth operates.",Right,1,townhall,24.95,19.79
Hamas shot any of its own supporters who refused to shield Hamas gunmen.,Right,1,townhall,24.95,19.79
They want you to believe Trump and his family have been selling influence?,Right,1,townhall,24.95,19.79
"Additionally, for 44 percent of respondents, the same is said of raising children.",Right,0,townhall,24.95,19.79
