text,source_party,label,source,reliability,bias
"My brother Gregory, who’d struggled with schizophrenia and agoraphobia long before Andrew died, and with crippling grief after, took his own life.",Left,0,esquire,27.41,-18.14
"By then, Salaam was living in Stone Mountain, Georgia, trying with difficulty to put together some kind of life.",Left,0,esquire,27.41,-18.14
"Take the damn shots, especially the damn boosters, and especially the newest one.",Left,1,esquire,27.41,-18.14
"He broke Alcaraz’s serve with a ferocious forehand and seemed to be in control-or, anyway, as much as anyone can seem in control against the wild bull that is Alcaraz.",Left,0,esquire,27.41,-18.14
Rumor has it that a martini and a license to kill may be waiting for him.,Left,1,esquire,27.41,-18.14
"Sure, we had the writers' strike, the ongoing SAG-AFTRA strike, and a lot of program reshuffling to do.",Left,0,esquire,27.41,-18.14
"The force of the explosion blows the roof and several walls apart, causing the structure to collapse.",Lean Left,0,cnn,42.06,-6.28
But he has not talked about it in office - to the point that more moderate senators and activists in the party’s left flank have pushed him to do more.,Lean Left,0,cnn,42.06,-6.28
"While conflict rages in Gaza and Ukraine, many analysts fear that these waters could be the next arena for war.",Lean Left,1,cnn,42.06,-6.28
"The Ohio Democrat faces a difficult reelection run next year, but outcomes from the Buckeye State may give him a boost.",Lean Left,0,cnn,42.06,-6.28
"Ziegler admitted to having sex with the alleged victim, but said the sex was consensual and that he recorded the encounter.",Lean Left,1,cnn,42.06,-6.28
Guz explained that there has been rising pressure from labels and artists to change the way Spotify makes distinctions between functional noise and music.,Lean Left,0,cnn,42.06,-6.28
"A shift could allow home buyers and sellers to negotiate not only commission rates with brokers, but also who is responsible for paying them - the buyer or the seller.",Lean Left,0,cnn,42.06,-6.28
"Speak now, Taylor:How Swift can use her voice to help save our planet from climate change Taylor Swift sheds light on Travis Kelce dating timeline Professionally she killed it in 2023, and personally, she started dating a star football tight end Travis Kelce.",Center,1,az-central,42.22,-7.0
Now comes this 14th Amendment stunt to reinforce those beliefs in order to get President Joe Biden reelected.,Center,1,az-central,42.22,-7.0
"If anything, she finds herself now in the role of political exorcist, appealing to a higher power to help break the spell Donald Trump seems to have cast over his most bootlicking cultists.",Center,1,az-central,42.22,-7.0
"Diannie Chavez/The Republic A child watches as decorated vehicles pass by during the annual APS Electric Light Parade in Phoenix on Dec. 2, 2023.",Center,0,az-central,42.22,-7.0
"Yori's ability to remain resolutely positive in the face of a mean, drunken father and relentless teasing and worse, feels like a heroic act.",Center,1,az-central,42.22,-7.0
"Salpointe Catholic, 2013 This came the same year as Mountain Pointe's monster season at the top level.",Center,0,az-central,42.22,-7.0
This was in the midst of one of the greatest dynasties in Arizona high school football history.,Center,1,az-central,42.22,-7.0
"Once again, the American people and their leaders have been warned about the growing danger(s) and too few of them are responding with the appropriate energy and seriousness.",Left,1,salon,32.38,-13.86
But Hamilton soon clarified that this seemingly dystopian simulation never actually ran.,Left,0,salon,32.38,-13.86
"In this scene, Oliver loses whatever sympathy he's gained from the audience.",Left,1,salon,32.38,-13.86
This attitude was carried into the first World War where rationing food was both a practical need and a display of patriotism.,Left,0,salon,32.38,-13.86
"America also faces growing hostility abroad, challenged by Russia in Ukraine, by Iran and its allied militias in the Middle East and by China across the Taiwan Strait and in the South China Sea.",Left,0,salon,32.38,-13.86
Director and writer Bong Joon-ho infuses dark comedy into the story of two families: one rich and one poor.,Left,0,salon,32.38,-13.86
He's just so ... odd: Newsom probably made a few new fans among the Democrats who tuned in to watch the cage match.,Left,1,salon,32.38,-13.86
"On a deserted service road not far from the Florida turnpike, Toole strangled Adam to death with the seatbelt, then decapitated him with a machete.",Left,0,salon,32.38,-13.86
But the National Republican Congressional Campaign was gleeful after less than stellar results in less-blue states.,Left,1,daily-kos,28.4,-17.51
"Yet they, and everyone else, are missing what Musk said next.",Left,0,daily-kos,28.4,-17.51
"It's not clear who paid for the survey, but based on its findings, it could not have come from an ally of Menendez: In a hypothetical matchup against three opponents, the congressman earns just 16% of the vote.",Left,0,daily-kos,28.4,-17.51
"Such arguments will come from nominally liberal Jewish intellectuals, and supposedly neutral well-wishers as well.",Left,1,daily-kos,28.4,-17.51
"The pause we’ve seen in the Israel-Hamas war - the return of hostages, the resumption of humanitarian aid - has been encouraging, and we will learn more, soon, perhaps today, if it will continue.",Left,0,daily-kos,28.4,-17.51
"Yeah those in power will always try to minimize the efforts of progressive movements, because they want us to feel small and powerless, but we have the real power not them.",Left,1,daily-kos,28.4,-17.51
"Two low-profile Republicans have already announced bids, meaning Hovde would not have an entirely clear field.",Left,0,daily-kos,28.4,-17.51
"Obviously, those who are defenders of the Biden administration will say that this is a massive, landmark, game-changing piece of legislation, and skeptics will say that it is not.",Left,1,current-affairs,34.3,-18.14
"So, this is just almost a blank check to the fossil fuel industry to build projects that would otherwise not be commercially viable.",Left,1,current-affairs,34.3,-18.14
"It’s about where the money should flow, and how we should divert it.",Left,1,current-affairs,34.3,-18.14
"Barras is involved on some level, which kind of does undermine the idea that they were together, that he had so willingly kind of hooked her up with Napoleon.",Left,1,the-intercept,37.46,-14.1
"Page said that it wasn’t that he thought Charles had it in him to go out and kill someone, but that without structure, he had impulse control problems.",Left,0,the-intercept,37.46,-14.1
"As they neared the border, they were stopped at an ad hoc checkpoint.",Left,0,the-intercept,37.46,-14.1
"So, in addition to the large-scale killing of civilians, some at least of which must have been ordered, some of which may have been uncontrolled people who came in after the Hamas fighters and slaughtered people or took away captives.",Left,1,the-intercept,37.46,-14.1
"U.S. military outposts in Iraq and Syria are plagued by thefts of weapons and equipment, according to exclusive documents obtained by The Intercept that show militias and criminal gangs are systematically targeting U.S. forces.",Left,0,the-intercept,37.46,-14.1
"But the scope of the destruction here is so monumental that even mainstream leaders who are very inclined to entirely endorse Israel’s mass acts of violence against the Palestinians are saying things like, you need to stop killing babies.",Left,1,the-intercept,37.46,-14.1
"But when they finally did reconnect, she said he was still the same: violent with her.",Left,1,the-intercept,37.46,-14.1
But maybe we should start taking famous people who tell jokes more seriously.,Left,0,the-intercept,37.46,-14.1
Its original 1988 charter is explicitly antisemitic and calls for the obliteration of Israel.,Left,1,the-intercept,37.46,-14.1
Ron DeSantis’s suspension earlier this summer of an elected Florida district attorney over allegations that she neglected her duties.,Left,0,the-intercept,37.46,-14.1
Israel’s bombing campaign on the Gaza Strip in recent weeks rivals the concentrated bombing of Vietnam and Cambodia that Kissinger oversaw decades ago.,Left,1,the-intercept,37.46,-14.1
That’s true of the gerontocracy of billionaires who control American private universities.,Left,1,the-intercept,37.46,-14.1
"The legendary narrator Dion Graham does as stellar a job with this book as he did with its prequel, 2021’s Harlem Shuffle.",Left,0,slate,35.17,-12.93
What ESPN was asking us to do was pretend that criticizing Trump’s Muslim ban on Twitter was politics while his appearance at the annual Army-Navy game to toss the coin was just part of college football’s pageantry.,Left,1,slate,35.17,-12.93
"The laws of cultural physics require that a boom is followed by a backlash, and the higher the pedestals to which Swift ascends, the greater the potential fall to earth.",Left,1,slate,35.17,-12.93
But Adelaide comes bearing a deadly secret that can’t be kept hidden forever.,Left,0,slate,35.17,-12.93
"American roads are not race tracks, and American drivers are not professional athletes with years of experience driving at dangerous speeds.",Left,0,slate,35.17,-12.93
"Chosen Family Advertisement My first recommendation is to pursue therapy, rather than to make a decision right now about whether you should stay together.",Left,0,slate,35.17,-12.93
"If you buy something through our links, Slate may earn an affiliate commission.",Left,0,slate,35.17,-12.93
"And anyway, Harlow is notorious for lacing his rhymes with playful sexual braggadocio (e.g., on Lil Nas X’s 2021 No.",Left,0,slate,35.17,-12.93
"Advertisement Advertisement But sometimes-often!-in this franchise, things really go off the rails, as they did with Gerry.",Left,1,slate,35.17,-12.93
"She polished off a whole bottle of champagne by herself, was excessively loud during the show, and kept picking aggressive arguments during our post-show discussion.",Left,1,slate,35.17,-12.93
"Jezebel, like communist revolution and most things in life, was a mixed bag.",Left,1,slate,35.17,-12.93
"In May December, Portman plays Elizabeth Berry, a TV star who’s attempting to make the transition to serious acting by playing the lead in a movie about Gracie Atherton-Yoo (Julianne Moore), a pet shop employee who was jailed for having sex with a seventh grader.",Left,0,slate,35.17,-12.93
Morgan Wiley is an aspiring OB-GYN who is currently in his fourth year at a medical school in Kentucky.,Left,0,slate,35.17,-12.93
Its columnists declare their support for a one-state solution and even defend those who draw comparisons between Israel and the Nazis.,Left,1,slate,35.17,-12.93
When he doesn’t even have to put a face to his claims?,Left,1,slate,35.17,-12.93
"A week after the Hamas-Israel conflict ignited, a horrific hate crime happened stateside-a landlord renting rooms to a mother and her son seemed to have snapped, and allegedly went on a stabbing rampage against both of them while blaming them for not stopping the violence in the Middle East.",Left,1,slate,35.17,-12.93
"Advertisement He is part of ESPN’s future, if there is to be one.",Left,0,slate,35.17,-12.93
He also recalled O’Connor taking him and another of her clerks to a Supreme Court picnic and instructing them to fill empty spots in a softball game.,Lean Left,0,atlanta-journal-constitution,44.83,-3.84
"Crews with Atlanta fire responded around 6:20 a.m. to a structure fire in the 600 block of Tazor Street, according to Battalion Chief Derek Hullender.",Lean Left,0,atlanta-journal-constitution,44.83,-3.84
"It was early in the morning on April 8, 2020, and the sheet on the door indicated that Powell had looked in every 15 minutes throughout the night.",Lean Left,0,atlanta-journal-constitution,44.83,-3.84
"He said the company does not routinely keep heart monitoring data, but for inmates with known heart conditions may do so for 90 days.",Lean Left,0,atlanta-journal-constitution,44.83,-3.84
"That’s partly because most of the cost of a wind or solar farm is in the upfront investment, whereas a large portion of the spending in a coal- or gas-fired power plant is in fuel costs, which are spread over time.",Lean Right,0,fiscal-times,43.33,-4.18
"McCarthy’s sticking around for another year is just too much to ask, apparently.",Lean Right,1,fiscal-times,43.33,-4.18
The problem is that the generic drug system is built to be fragile.,Lean Right,0,fiscal-times,43.33,-4.18
"In the last three election cycles, it delivered Democratic victories based on deeply held beliefs about which party could be trusted to reform a system that had left millions without health care and millions more bankrupt with medical debt.",Lean Right,1,fiscal-times,43.33,-4.18
"Rep. Kevin McCarthy (R-Calif.) announced on Dec. 6 his decision not to seek reelection, and leave Congress by year’s end following his ouster as House speaker.",Lean Right,0,fiscal-times,43.33,-4.18
"The House currently consists of 221 Republicans, 213 Democrats and one vacancy, with Rep. George Santos (R-N.Y.) expelled Dec. 1.",Lean Right,0,fiscal-times,43.33,-4.18
Lawmakers will have to deal with several pressing issues over the next few weeks.,Lean Right,0,fiscal-times,43.33,-4.18
Heffner seeks to draw out lawmakers by incentivizing empathy and compromise in pursuit of a new consensus.,Lean Right,0,fiscal-times,43.33,-4.18
"But in practice, there are lots of gray areas, of which more in a moment.",Lean Right,0,fiscal-times,43.33,-4.18
He also unilaterally launched an impeachment inquiry into President Biden to appease the far-right flank ahead of the negotiations on spending that ultimately led to his ouster.,Lean Right,1,fiscal-times,43.33,-4.18
"The Senate, meanwhile, appears headed to a vote as early as tonight on the House-passed stopgap, defusing the threat of a shutdown at the end of the week.",Lean Right,0,fiscal-times,43.33,-4.18
"This panic buying can wipe out inventory, and leave hospitals with fewer resources strapped since they may get notice of a drug shortage only when it’s too late.",Lean Right,1,fiscal-times,43.33,-4.18
The Biden administration has been granting student loan forgiveness through these existing programs on a rolling basis since coming into office.,Lean Right,0,fiscal-times,43.33,-4.18
"Republicans on Wednesday blocked an emergency spending bill to fund the war in Ukraine, demanding strict new border restrictions in exchange and severely jeopardizing President Biden’s push to replenish the war chests of American allies before the end of the year.",Lean Right,0,fiscal-times,43.33,-4.18
"Powell said he and his Fed colleagues anticipate that the economy will slow over the next year, but he also warned against any premature declarations of victory in the battle against inflation and pushed back against Wall Street expectations for interest rate cuts as soon as next quarter.",Lean Right,0,fiscal-times,43.33,-4.18
"When there is the potential for a shortage, drug manufacturers are required to notify the F.D.A.",Lean Right,0,fiscal-times,43.33,-4.18
"Johnson Gets a Win on Government Funding, With a Big Help From Democrats The House on Tuesday passed a short-term funding bill that would keep the government open into early next year.",Lean Right,0,fiscal-times,43.33,-4.18
Senators in both parties reportedly have indicated that additional support for Ukraine will depend on reaching a bipartisan deal to address immigration at the southern border.,Lean Right,0,fiscal-times,43.33,-4.18
"Boyle also noted that some Republican presidential candidates, including former South Carolina Gov.",Lean Right,0,fiscal-times,43.33,-4.18
"But it doesn’t help either,"" The Hill’s Emily Brooks, Mike Lillis and Mychael Schnell write.",Lean Right,0,fiscal-times,43.33,-4.18
"6363, continuing resolution passed by the House and Senate on a bipartisan basis to avert a shutdown at midnight tonight by extending federal funding through January 19 for some parts of the government and through February 2 for other parts.",Lean Right,0,fiscal-times,43.33,-4.18
"And under Subpart F, which dates to 1962, American investors in foreign corporations must pay taxes on their share of income.",Lean Right,0,fiscal-times,43.33,-4.18
"That bill, known as a continuing resolution or CR, was passed by relying on Democratic votes.",Lean Right,0,fiscal-times,43.33,-4.18
Grossman prudently narrowed the argument to just the issue of the 2017 mandatory repatriation tax.,Lean Right,0,fiscal-times,43.33,-4.18
"Sen. James Lankford of Oklahoma, who leads the negotiations for Republicans, said this weekend that he would reject any supplemental package that fails to include major changes in border policy, including more restrictive detention guidelines and new limits on the granting of asylum privileges.",Lean Right,0,fiscal-times,43.33,-4.18
"× Expand Evan Vucci/AP Photo The long-standing goal of the Republican right, in the famous words of anti-tax activist Grover Norquist, is to starve the beast of the deep state by denying it revenue.",Lean Right,1,fiscal-times,43.33,-4.18
"While there was broad bipartisan support for Ukraine after Russia invaded in February 2022 - as well as widespread public displays of support for Ukraine - interest in the war among the American public has waned considerably, especially as it has ground to a stalemate with no clear end.",Lean Right,1,fiscal-times,43.33,-4.18
"At the same time, more moderate Republicans in the House are pushing back against conservatives’ calls for potentially divisive spending cuts.",Lean Right,0,fiscal-times,43.33,-4.18
And please encourage your friends to sign up here for their own copy of this newsletter.,Lean Right,0,fiscal-times,43.33,-4.18
"Williams said he expects the headline inflation rate to end the year at 3%, before falling to 2.25% in 2024.",Lean Right,0,fiscal-times,43.33,-4.18
"There is no winner-take-all, though any remaining delegates once the vote is split up go to whoever was the overall winner.",Lean Left,0,detroit-free-press,43.46,-5.43
But we have a responsibility to our humanity to stop it.,Lean Left,1,detroit-free-press,43.46,-5.43
"At one time - before Michigan State was a member of the Big Ten Conference, before there were color TVs to watch sports, and before there was the Super Bowl and College Football Playoff Committee - the Army-Navy game was America’s most important annual gridiron contest.",Lean Left,1,detroit-free-press,43.46,-5.43
The Roman Catholic Church is not moving forward - only backward - and they wonder why people are leaving.,Lean Left,1,detroit-free-press,43.46,-5.43
Advertisement This twist in the seemingly never-ending case comes just months after Majors’ legal team filed a cross-complaint against Jabbari where he alleged she was the aggressor in the case-an argument they’ve been insistent upon since the very beginning.,Lean Left,1,the-root,26.43,-18.51
"Right now at Target, take 30% off select Squishmallows for a cute surprise under the tree this holiday season.",Lean Left,0,the-root,26.43,-18.51
"Strap on a game-changing accessory for outdoor sports lovers - Garmin fenix 6s Pro Solar, currently available at a massive 45% discount exclusively on Amazon.",Lean Left,1,the-root,26.43,-18.51
The suit also reveals how Combs allegedly blew up Kid Cudi’s car once he discovered that Cudi briefly dated Cassie in 2012.,Lean Left,1,the-root,26.43,-18.51
Advertisement The explosive lawsuit against Diddy comes on the heels of Keke Palmer being granted a temporary restraining order against her allegedly abusive ex-boyfriend Darius Jackson.,Lean Left,0,the-root,26.43,-18.51
"Now, the department is investigating whether that cop did too damn much.",Lean Left,1,the-root,26.43,-18.51
"If even a fraction of Cassie’s accusations is true, it underlines the fact that Diddy has been showing us his megalomania for years - albeit a more muted, charismatic version.",Lean Left,1,the-root,26.43,-18.51
Sickening allegations have been made against me by individuals looking for a quick pay day.,Lean Left,1,the-root,26.43,-18.51
"Snoop, whose music catalog speaks for itself, spent the nascent stages of his career unapologetically money-minded but also in fierce opposition to the systems that keep white men rich and Black men behind bars.",Lean Left,1,the-root,26.43,-18.51
Just do your racist acts out in the open so we can all see how hateful and discriminatory you are.,Lean Left,1,the-root,26.43,-18.51
Advertisement Could it be that the two lawsuits against Diddy were motivated by the fact that he (presumably) broke an absurd chunk off for Cassie?,Lean Left,1,the-root,26.43,-18.51
As the Ottawa Citizen’s David Pugliese (9/27/23) explained: The federal government has withheld a second part of a 1986 government commission report about Nazis who settled in Canada.,Lean Left,0,fair,32.6,-19.36
"A consequence of this binary worldview is the tendency to present the deployment of increasingly horrific means, like President Joe Biden’s recent decision to arm Ukraine with US cluster munitions, as essentially just and necessary to achieve the West’s always-noble ends.",Lean Left,1,fair,32.6,-19.36
"In 2019, Congress approved a $22 billion increase in the military budget from the year before.",Lean Left,0,fair,32.6,-19.36
"Holding a politician accountable to the facts across the universe of possible topics is a herculean task for a journalist in the best of circumstances, and impossible in a town hall format that’s set up more like a campaign rally than a serious journalistic forum.",Lean Left,1,fair,32.6,-19.36
"So, instead of obsessing over climate change, they should take a look at forest management and making sure Canadian campers listen to Smokey the Bear.",Lean Left,1,fair,32.6,-19.36
"The bias in favor of US officials, and the marginalization of experts from the country being invaded-as well as civil society experts from any country-recalls US TV news coverage of another large-scale invasion in recent history: the US invasion of Iraq.",Lean Left,1,fair,32.6,-19.36
"As soon as Ronald Reagan was inaugurated in 1981, for example, both papers began promoting White House charges that the Soviets were the primary source of terrorism in the world.",Lean Left,1,fair,32.6,-19.36
"S&Ls and other financial institutions promised high returns, but overinvestment led inexorably to a crash.",Lean Left,0,fair,32.6,-19.36
"There were no mass demonstrations against terrorism, no peace vigils and no organized condemnation of the Al-Qaeda criminals.",Lean Left,1,fair,32.6,-19.36
"In the Kosovo War, Serbian victims of NATO bombing were downplayed-and sometimes their deaths even egged on-by US journalists (FAIR.org, 7/99).",Lean Left,1,fair,32.6,-19.36
This photo story documented the aftermath of the Hamas attack on an Israeli town.,Lean Left,1,npr,42.99,-4.27
He was accused of being the mastermind behind the slayings of the 25 Peruvians while the government fought the Shining Path communist rebels.,Lean Left,1,npr,42.99,-4.27
But what's the violence of not having access to adequate health care?,Lean Left,1,npr,42.99,-4.27
And listen to Pop Culture Happy Hour on Apple Podcasts and Spotify.,Lean Left,0,npr,42.99,-4.27
"And so this was one thing that was really concerning the generals, that the military was not prepared for any kind of attack.",Lean Left,1,npr,42.99,-4.27
"And so that philosophy of sharing what you have, understanding that all things in life get better when you share it, and when you do something for someone else, the benefit comes back to you as well as to them.",Lean Left,1,npr,42.99,-4.27
"But they brought these emotions, the soul baggage also and expressed it.",Lean Left,1,npr,42.99,-4.27
"The American citizen, meanwhile, is not identified in the indictment, but the document says he had been living with his wife in the village of Mylove near the southern Ukrainian city of Kherson since 2021.",Lean Left,0,npr,42.99,-4.27
"Combs then entrenched himself into Ventura's life, gaining control of all aspects of her life while plying her with drugs and alcohol, the lawsuit alleged.",Lean Left,1,npr,42.99,-4.27
"Because suddenly, storytellers must account for slavery, racism, oppression and the way in which many average white people back then simply assumed that Black people were not fully people - a decidedly non-heroic posture for 21st century audiences.",Lean Left,1,npr,42.99,-4.27
Enlarge this image Penguin Random House Penguin Random House Critics should be aware of their biases.,Lean Left,0,npr,42.99,-4.27
"When he came out, his mother was (very vocally) disapproving, so he moved to Texas and found a husband.",Lean Left,0,variety,41.29,-3.85
But Rodrigo has been able to maintain the relatability of a lovable loser by apparently doing what most of the great superstar songwriters do: find a boyfriend or two who’ll make you feel less than in copious enough amounts to fuel a dozen or so tracks that balance deep insecurity with vengeful cockiness.,Lean Left,1,variety,41.29,-3.85
"As Willy, he’s the soul of boyish sweetness, though with a hint of sadness (he misses his late mother, played in flashback by Sally Hawkins, who instilled her love of chocolate-making in him), which expresses itself in the lean and pensive dark-eyebrowed look that keeps cueing us to what he’s thinking.",Lean Left,0,variety,41.29,-3.85
"As school bully Biff Tanner, Nathanial Hackmann echoes the dumb-lug bit.",Lean Left,1,variety,41.29,-3.85
"Also like her songs, she’s self-conscious but extremely unfiltered - she began one conversation by talking about her therapist, another about weed.",Lean Left,0,variety,41.29,-3.85
If you think about miking players in Major League Baseball or in the WNBA ... we just want to give access to all of our fans in a unique and different way.,Lean Left,0,variety,41.29,-3.85
