text,source_party,label,source,reliability,bias
He’s a partisan for rigorous analysis and truth-telling about the past and the present-something we have too few of these days.,Right,0,washington-free-beacon,23.47,14.45
And now we've got continuing war happening in the Middle East and in Ukraine and nuclear threat reappears.,Left,1,esquire,27.41,-18.14
"Wimbledon may be the oldest tennis tradition, but it always delivers something new.",Left,0,esquire,27.41,-18.14
"He broke Alcaraz’s serve with a ferocious forehand and seemed to be in control-or, anyway, as much as anyone can seem in control against the wild bull that is Alcaraz.",Left,0,esquire,27.41,-18.14
Then Bauman bought out his contract and moved forty miles west to Roswell to play for the Roswell Rockets.,Left,0,esquire,27.41,-18.14
"In playing an inflated, self-aggrandized version of himself earlier this year on Jury Duty, James Marsden established one thing: That he's better than us.",Left,1,esquire,27.41,-18.14
"In October, attorneys representing the Two-Spirit nonprofit Montana Two Spirit Society along with a group of transgender, intersex and nonbinary Montana residents, filed a lawsuit in Missoula County District Court challenging the law.",Lean Left,0,cnn,42.06,-6.28
But we have done none of those things on the scale that is needed.,Lean Left,0,cnn,42.06,-6.28
It offers at least three lessons on leadership and social change.,Lean Left,0,cnn,42.06,-6.28
"The scientists used adult human cells from the trachea, or windpipe, from anonymous donors of different ages and sexes.",Lean Left,0,cnn,42.06,-6.28
"President Biden has fought against the evil of Antisemitism his entire life, including by launching the first national strategy to counter this hate in American history.",Lean Left,1,cnn,42.06,-6.28
"The truth is, though, simply selling albums almost seems quaint now as a benchmark of Swiftian achievement.",Lean Left,0,cnn,42.06,-6.28
"Agnes Chow, a former student activist and politician, broke more than two years of public silence in a social media post on her 27th birthday, announcing she had left Hong Kong for studies in Canada in September - and that she will not return to Hong Kong later this month to report to police as required.",Lean Left,0,cnn,42.06,-6.28
"CNN - Anyplace can throw up a few lights and call it a holiday celebration, but travelers who really adore Christmas want more.",Lean Left,1,cnn,42.06,-6.28
"Biden’s crumbling approval ratings are limiting his capacity to sell continued massive aid to Ukraine to a public that is becoming more skeptical amid daily struggles in the US, including over high food prices.",Lean Left,1,cnn,42.06,-6.28
The first was getting canceled within an inch of my life and sanity.,Center,1,az-central,42.22,-7.0
"The Republic’s coverage of southern Arizona is funded, in part, with a grant from Report for America.",Center,0,az-central,42.22,-7.0
"While the days bring hunger and thirst, the nights are worse.",Center,0,az-central,42.22,-7.0
"That certainly applies to her cruel father (Shea Whigham), a nasty drunk who used to be the police chief and bestirs himself from his two-bottle-a-day stupor to harangue and humiliate the devoted Eileen or, on occasion, wandering into the street and waving his pistol around.",Center,1,az-central,42.22,-7.0
Border Patrol agents watch over them but many are left to brace the elements unsheltered for days.,Center,0,az-central,42.22,-7.0
"Little was known about the years that followed, other than O’Connor was living in Arizona, the state she cherished.",Center,0,az-central,42.22,-7.0
A group of men from India had been waiting for six days while a man from Afghanistan had waited for four.,Center,0,az-central,42.22,-7.0
"McKenzie navigates the transition in a believable way - this is someone dying to break out of their cage, or maybe would die if she didn’t.",Center,1,az-central,42.22,-7.0
"However, the theory she presents in a recent LA Times interview makes sense.",Left,0,salon,32.38,-13.86
"She was consistently good on gender issues, and sometimes more-or-less okay on criminal justice matters (the above quotes notwithstanding).",Left,1,salon,32.38,-13.86
"Watch to find out why Simone Biles, Naomi Osaka and more made his best-of list this year.",Left,0,salon,32.38,-13.86
"It also pulled strong ratings in the coveted 18-49 demographic and has been killing it on streaming, as THR previously reported.",Left,1,salon,32.38,-13.86
"ET The film is a co-production of ITVS, Kartemquin Films, and American Documentary  POV and a co-presentation with the Center for Asian American Media (CAAM).",Left,0,salon,32.38,-13.86
"Once again, the American people and their leaders have been warned about the growing danger(s) and too few of them are responding with the appropriate energy and seriousness.",Left,1,salon,32.38,-13.86
The report has a whiff of cheap gossip to it and not much more.,Left,1,salon,32.38,-13.86
But Hamilton soon clarified that this seemingly dystopian simulation never actually ran.,Left,0,salon,32.38,-13.86
The election will be decided by tens of thousands of voters in just a handful of states.,Left,0,salon,32.38,-13.86
"Watch those votes when they come in, when they’re being, you know, shoved around in wheelbarrows and dumped on the floor and everyone’s saying what’s going on?....We’re like a third world nation, a third world nation.",Left,1,salon,32.38,-13.86
Kagan’s conclusion: A paralyzing psychology of appeasement has also been at work.,Left,1,salon,32.38,-13.86
"You, in particular, Ron, are on a banning binge, a cultural purge, intimidating and humiliating people you disagree with.",Left,1,daily-kos,28.4,-17.51
"So to the extent that it was a test of that, my takeaway is it was a step forward in terms of showing that abortion rights can mobilize and motivate and persuade voters, even when it's not on the ballot.",Left,1,daily-kos,28.4,-17.51
Republican weakness Republicans don’t seem to be trying very hard as we head into the December holidays.,Left,1,daily-kos,28.4,-17.51
"Yet they, and everyone else, are missing what Musk said next.",Left,0,daily-kos,28.4,-17.51
The EU should tell Orban to go back to Budapest and fuck off.,Left,1,daily-kos,28.4,-17.51
They would vote for him because people think he’s doing a good job.,Left,1,daily-kos,28.4,-17.51
They despise Donald Trump but are undeniably uninspired by President Joe Biden.,Left,1,daily-kos,28.4,-17.51
But she has stood with the conservatives to allow government funding of programs that may aid religious institutions.,Left,1,daily-kos,28.4,-17.51
"However, when Saddam reconciled with the Shah, Kissinger abandoned the Kurds, leaving them vulnerable to the mercy of the Iraqi dictator.",Left,1,daily-kos,28.4,-17.51
"As the ACLU reports, there are 492 [now 496] anti-LGBTQ+ pieces of legislation in this country.",Left,1,mother-jones,37.08,-15.12
"We were sorry, so we set you free-but then we missed you, and the feeling that unlocking your handcuffs gave us, so we went looking for you in the fame you were trapped in for so long, the same one we thought we wanted to help you escape.",Left,1,mother-jones,37.08,-15.12
"Imagine if during her tenure, all the people running the state’s agricultural department were forced to leave their jobs.",Left,0,mother-jones,37.08,-15.12
First of all there is the unconscious bias of kids like mine (not very verbal) not being intellectually intact.,Left,1,mother-jones,37.08,-15.12
"The total value of agricultural products sold in Palm Beach is $901 million, higher than any other county in Florida.",Left,0,mother-jones,37.08,-15.12
Haley and her campaign crow that at the UN she battled America’s foes and prevailed.,Left,1,mother-jones,37.08,-15.12
"If you believe we need to build more housing, this sounds great.",Left,0,mother-jones,37.08,-15.12
"And more important, they think he’s saying something that a great many people of his generation actually believe, that the true philosophers of popular music could only be the Bob Dylans, the Mick Jaggers, and The Beatles, etc., and they just don’t want to look at themselves in the mirror and say to themselves they believe that because these people are white and male.",Left,1,current-affairs,34.3,-18.14
"He’s one of these saintly figures, and yes, absolutely, he was extremely racist and sexist.",Left,1,current-affairs,34.3,-18.14
Because the Ape people love to point to these things as great proof that the apes are credible.,Left,1,current-affairs,34.3,-18.14
Sowell is presented as a brave academic dissident who had the courage to stand against the tide.,Left,1,current-affairs,34.3,-18.14
"And not only were they ruining the lives of workers, and making massive inequality alongside massive riches, but they were destructive to our country.",Left,1,current-affairs,34.3,-18.14
"But of course, they were always there: Valerie Capers, Mary Lou Williams, Geri Allen-beautiful composers and musicians who were shunted to the side because they were women.",Left,1,current-affairs,34.3,-18.14
"And unfortunately, they’ve done a good job of persuading Congress and the Biden administration that they should throw billions of our tax dollars on this rather foolish waste of capital and energy.",Left,1,current-affairs,34.3,-18.14
Ghodsee As if he doesn’t think that we’re going to be doing it as his indentured servants as well.,Left,1,current-affairs,34.3,-18.14
"And it feels to me like Josephine, the entire time, was pretty miserable, despite how good she was at the ceremonial parts of her job.",Left,1,the-intercept,37.46,-14.1
Gaza was a very prosperous part of Southern Palestine up to the 1948 war.,Left,1,the-intercept,37.46,-14.1
"For Israel, slaughtering 15,000 people in a month, conducting the most intensive bombing in the history of the Middle East - and we’re talking about the Middle East, not Scandinavia - has become perfectly normal.",Left,1,the-intercept,37.46,-14.1
"According to the indictment, Gupta was arrested in the Czech Republic in late June.",Left,0,the-intercept,37.46,-14.1
"But the scope of the destruction here is so monumental that even mainstream leaders who are very inclined to entirely endorse Israel’s mass acts of violence against the Palestinians are saying things like, you need to stop killing babies.",Left,1,the-intercept,37.46,-14.1
"Skapski had crammed each poster with thousands of silhouettes, meant to represent the people who were killed daily at the death camp.",Left,0,the-intercept,37.46,-14.1
"CBT can prove particularly useful in dealing with specific, targeted triggers that prompt automatic catastrophic thinking.",Left,0,slate,35.17,-12.93
"Then, as the chaos rolled on, companies that built their products entirely on top of OpenAI’s GPT-4 model looked for a hedge.",Left,0,slate,35.17,-12.93
Microsoft would get OpenAI’s geniuses in a manner that raised no antitrust red flags-a valuable thing to a company that just fought regulators almost to the death for a big video game deal.,Left,1,slate,35.17,-12.93
"She is taking out a modest amount in student loans to pay for campus housing and fees, and also has a part-time job on campus.",Left,0,slate,35.17,-12.93
"Advertisement Advertisement The emotional high point of the evening came at the end of the ceremony, when the Nashville Police Department was honored for the heroism responding officers showed in stopping the Covenant School shooter, who killed three young children and three adults in March.",Left,1,slate,35.17,-12.93
"At a certain point, you may have to weigh the potential pain of breaking up with someone you love dearly and don’t want to lose against the potential pain of feeling constantly deceptive.",Left,0,slate,35.17,-12.93
"A friend of mine switched over to the finance department and in turn, nearly doubled her pay.",Left,0,slate,35.17,-12.93
He was elected in New York’s 3rd Congressional District in 2022 with a largely invented life story.,Left,1,slate,35.17,-12.93
"American roads are not race tracks, and American drivers are not professional athletes with years of experience driving at dangerous speeds.",Left,0,slate,35.17,-12.93
It was an existential cry for help-it just hadn’t figured out where that cry should be directed yet.,Left,1,slate,35.17,-12.93
"Mostly because you are so stressed out about your friend and her partner and their ethical status, imagine how you’d feel if you were the one being rolled through security?",Left,1,slate,35.17,-12.93
Any organization that claims to have families’ backs has no business telling parents otherwise.,Left,1,slate,35.17,-12.93
"He and his administration were engulfed in a dramatic, hilarious scandal in which his aides were accused of creating traffic jams in a town whose mayor wouldn’t endorse him.",Left,1,slate,35.17,-12.93
"Advertisement Advertisement But sometimes-often!-in this franchise, things really go off the rails, as they did with Gerry.",Left,1,slate,35.17,-12.93
"They send the kid over early in the morning, in her swimsuit, and she starts asking if she can swim.",Left,0,slate,35.17,-12.93
"The United Arab Emirates does not have freedom of the press and its leaders are unaccustomed to probing, critical questions from independent media.",Lean Left,0,atlanta-journal-constitution,44.83,-3.84
"It was early in the morning on April 8, 2020, and the sheet on the door indicated that Powell had looked in every 15 minutes throughout the night.",Lean Left,0,atlanta-journal-constitution,44.83,-3.84
A network of transfer facilities would provide new amenities such as real-time route information and bathrooms.,Lean Left,0,atlanta-journal-constitution,44.83,-3.84
Aerial spotters located a second adult pair about nine nautical miles off Sea Island.,Lean Left,0,atlanta-journal-constitution,44.83,-3.84
"We’re three weeks away from Christmas Day and, incredibly, just six weeks away from the 2024 Iowa caucuses.",Lean Right,1,fiscal-times,43.33,-4.18
"In the last three election cycles, it delivered Democratic victories based on deeply held beliefs about which party could be trusted to reform a system that had left millions without health care and millions more bankrupt with medical debt.",Lean Right,1,fiscal-times,43.33,-4.18
The Biden administration is making another attempt to create a one-time student loan forgiveness program.,Lean Right,0,fiscal-times,43.33,-4.18
The problem is that the generic drug system is built to be fragile.,Lean Right,0,fiscal-times,43.33,-4.18
"All 49 Republicans plus independent Sen. Bernie Sanders voted against moving forward on the bill, leaving Democrats well short of the 60-vote threshold.",Lean Right,0,fiscal-times,43.33,-4.18
But we have a responsibility to our humanity to stop it.,Lean Left,1,detroit-free-press,43.46,-5.43
"His latest novel is the story of Bob Comet, a retired librarian from Portland, Oregon, whose life is made fuller by the little pleasures of everyday existence.",Lean Left,0,detroit-free-press,43.46,-5.43
"They’re an infrastructure issue, but they’re also another reason many buyers are reluctant to commit to EVs.",Lean Left,0,detroit-free-press,43.46,-5.43
"The international order we live in, and our country, may currently sanction their suffering.",Lean Left,1,detroit-free-press,43.46,-5.43
"Snagging a sale often can seem tougher when now you must download a long list of apps offered by supermarkets, warehouse clubs, big box stores and other retailers and then be sure to click on the right deal at the right time.",Lean Left,0,detroit-free-press,43.46,-5.43
"It gave businesses a new tool to use in self-defense, and got them out of a no-win situation - paying a settlement, or paying to defend themselves in court.",Lean Left,1,detroit-free-press,43.46,-5.43
The company did lose $1.7 billion in production in 2023 due to the UAW strike that began Sept. 15 and ended with a tentative deal in late October.,Lean Left,0,detroit-free-press,43.46,-5.43
"As of this week,we have been waiting six months for Corporation Counsel Conrad Mallett to honor our subpoena requests on two dozen issues, from missing persons to facial recognition.",Lean Left,1,detroit-free-press,43.46,-5.43
"This year alone the Hallmark is releasing more than 40 new movies, and there’s no shortage of sweet and silly gems in the back catalog.",Lean Left,1,detroit-free-press,43.46,-5.43
"And all of this from Greene - who was rebuked by then-Senate Majority Leader Mitch McConnell in 2022, after she addressed a gathering led by a white nationalist who participated in the 2017 Unite the Right rally in Charlottesville, and who likened former Speaker Nancy Pelosi’s House floor mask mandate to the treatment of Jewish people in Nazi Germany.",Lean Left,1,detroit-free-press,43.46,-5.43
"Thankfully, under the current leadership in Detroit government and in 36th District Court, there’s been a collaborative effort to provide legal counsel for tenants facing eviction, resulting in significant positive outcomes.",Lean Left,1,detroit-free-press,43.46,-5.43
Sickening allegations have been made against me by individuals looking for a quick pay day.,Lean Left,1,the-root,26.43,-18.51
"If even a fraction of Cassie’s accusations is true, it underlines the fact that Diddy has been showing us his megalomania for years - albeit a more muted, charismatic version.",Lean Left,1,the-root,26.43,-18.51
"Snoop, whose music catalog speaks for itself, spent the nascent stages of his career unapologetically money-minded but also in fierce opposition to the systems that keep white men rich and Black men behind bars.",Lean Left,1,the-root,26.43,-18.51
Just do your racist acts out in the open so we can all see how hateful and discriminatory you are.,Lean Left,1,the-root,26.43,-18.51
Advertisement The explosive lawsuit against Diddy comes on the heels of Keke Palmer being granted a temporary restraining order against her allegedly abusive ex-boyfriend Darius Jackson.,Lean Left,0,the-root,26.43,-18.51
"Strap on a game-changing accessory for outdoor sports lovers - Garmin fenix 6s Pro Solar, currently available at a massive 45% discount exclusively on Amazon.",Lean Left,1,the-root,26.43,-18.51
"The Original, The Remix, The Encore ® Collection Family Matching Holiday Sweatshirts Advertisement If you’re tired of wearing matching pajamas for your holiday cards, try flipping the script with these Family Matching Holiday Sweatshirts from KaAn Designs.",Lean Left,0,the-root,26.43,-18.51
Crimes on live TV Both-sidesing Lula’s FBI-backed political persecution and Bolsonaro’s guilty verdict as examples of judicial overreach is an act of bad faith.,Lean Left,1,fair,32.6,-19.36
"She could have boasted that her paper’s own Colum Lynch (now with the Washington Post) was widely credited with first breaking the story of UNSCOM’s spying in a January 6, 1999, front-page expose.",Lean Left,1,fair,32.6,-19.36
"In this instance, is the right to exclude trans people more important than the right of trans people to be included?",Lean Left,1,fair,32.6,-19.36
And Western journalists have made very clear which victims’ pain is most newsworthy to them.,Lean Left,1,fair,32.6,-19.36
"Instead, we’re listening to mythmaking and historical revision in real time.",Lean Left,1,fair,32.6,-19.36
"Fox mentioned a ceasefire roughly twice as often as either CNN or MSNBC, largely to ridicule those on the left who called for one, as with host Greg Gutfeld’s comment (10/18/23): Enough with the ceasefire talk....",Lean Left,1,fair,32.6,-19.36
"CounterSpin interview with Mark Weisbrot on Javier Milei Janine Jackson interviewed CEPR’s Mark Weisbrot about Argentine President-elect Javier Milei for the November 24, 2023, episode of CounterSpin.",Lean Left,0,fair,32.6,-19.36
"Combs then entrenched himself into Ventura's life, gaining control of all aspects of her life while plying her with drugs and alcohol, the lawsuit alleged.",Lean Left,1,npr,42.99,-4.27
"That's my concern,"" says Nova Silvy, a now-retired biologist who spent most of his career studying the Key deer from Texas A&M.",Lean Left,0,npr,42.99,-4.27
"It's a massacre,"" said Mahmoud Khuwaiter, 30, who is stranded in Gaza.",Lean Left,1,npr,42.99,-4.27
And this is happening because all sorts of workers are set to go on strike.,Lean Left,1,npr,42.99,-4.27
"Performed in a style reminiscent of R.E.M., it's a harmony-rich earworm.",Lean Left,1,npr,42.99,-4.27
"His experience - and that of the other Cameroonians detained in Louisiana and Mississippi - reveal a thorny regional system with obstacles at every turn that, more often than not, keeps asylum seekers from realizing their dreams of freedom and safety.",Lean Left,0,npr,42.99,-4.27
"Because in certain scenes he’s so duplicitous or villainous or just a massive dickhead, but that’s boring on its own, so you want him to be as likable within that framework.",Lean Left,1,variety,41.29,-3.85
"For almost every moment in which a thesp mortifyingly screws up, there’s also one in which someone comes up with a quick fix that makes it possible at least to get to the next scene, if not actually turn disaster into success.",Lean Left,0,variety,41.29,-3.85
"Yet the brilliance of the performers in this first Broadway revival since its original run, and their ability to lean into the playfulness of Davis’ comedy, present the euphoric and revelatory experiences of being Black while commenting on the absolute absurdity of racism.",Lean Left,1,variety,41.29,-3.85
"And it was your little face - this beautiful, slightly baffled face.",Lean Left,0,variety,41.29,-3.85
The typical eligibility period is between June 1 and May 31 of any given year.,Lean Left,0,variety,41.29,-3.85
This 4K TV even has Dolby Atmos support inside for high-quality audio and 3D virtual surround sound.,Lean Left,0,variety,41.29,-3.85
But Rodrigo has been able to maintain the relatability of a lovable loser by apparently doing what most of the great superstar songwriters do: find a boyfriend or two who’ll make you feel less than in copious enough amounts to fuel a dozen or so tracks that balance deep insecurity with vengeful cockiness.,Lean Left,1,variety,41.29,-3.85
"Gladstone speaks with a slight drawl and wandering eyes, in long, slow, carefully constructed circles.",Lean Left,0,variety,41.29,-3.85
And the way she speaks hints at many Sundays spent in a pew listening to ministers evangelize about heavenly rewards and earthly tribulations.,Lean Left,1,variety,41.29,-3.85
Ten years is a good amount of time to birth something into the world.,Lean Left,0,variety,41.29,-3.85
"Barrino’s art has always been her testimony, resounding with all the trials that she, I, you, and all our mamas have been through.",Lean Left,0,variety,41.29,-3.85
"This philosophy would likely get you thrown out of most Hollywood boardrooms these days, given the studios’ focus on IP-driven blockbusters.",Lean Left,1,variety,41.29,-3.85
"And if you aren’t a crafty ceramicist or knitter yourself, you can feel out of luck.",Lean Left,1,variety,41.29,-3.85
"George Santos was not facing any indictments when he was elected on the back of what we now know to be a brazenly illegal campaign by a candidate who falsified most of his resume, even down to the detail of what sports he didn’t play at the universities he didn’t attend.",Left,1,occupy-democrats,25.3,-21.06
Everyone knows that the highly partisan Kennedy would strongly support Trump if (or when) he likely wins the primary.,Left,1,occupy-democrats,25.3,-21.06
Former president who repeatedly promised - but didn’t deliver - desperately needed infrastructure funding bashes current president who actually did.,Left,1,occupy-democrats,25.3,-21.06
"Sources told CNN that the most recent version of the witness list, which was produced by prosecutors just days ago, included upward of 150 names.",Left,0,occupy-democrats,25.3,-21.06
Judge Arthur Engoron has said he’ll be firm in enforcing a gag order that forbids Donald Trump from publicly attacking his staff.,Left,0,occupy-democrats,25.3,-21.06
She merely shared the excuse she says McCarthy gave when confronted about associating with Trump after the attack on Congress.,Left,0,occupy-democrats,25.3,-21.06
"He also speculated on her sexuality, suggesting that she’s just failing to be as open and proud as him.",Left,1,occupy-democrats,25.3,-21.06
"During that short time, he managed to rack up criminal charges, ethics investigations, and, apparently, a slate of inside information he’s now turning against those who voted to expel him.",Left,1,occupy-democrats,25.3,-21.06
"We must lead, and do it in a way that keeps our young men and women off the battlefield.",Lean Left,1,washington-blade,42.71,-7.49
"But as per usual, the queer community in Florida does not even have the luxury of agonizing over just this bill here and now, because we know that the next one will be even worse.",Lean Left,1,washington-blade,42.71,-7.49
"The absurdity of its cobbled-together plots, contrasted with the histrionic over-seriousness of their presentation, is precisely what allows it to drive home its blatantly metaphoric commentary on whatever cultural or social themes it happens to be addressing.",Lean Left,1,washington-blade,42.71,-7.49
"The person most important in his life, Kuntzler said, was his domestic partner Stephen Brent Miller of 42 years who died in July 2004.",Lean Left,0,washington-blade,42.71,-7.49
"She’ll tell them that they should feel free to laugh, to let it out, not cover their mouths.",Lean Left,0,washington-blade,42.71,-7.49
"Before the events of the past few months, villages like Eid’s Umm al-Khair faced the near-constant threat of violent eviction.",Lean Left,0,truthout,34.51,-16.87
"None of that is new for the pre-Trump GOP, but it’s been off the table since he took office.",Lean Left,1,truthout,34.51,-16.87
