text,source_party,label,source,reliability,bias
"Other examples of Johnson’s fringe views abound, and have been subject to increased scrutiny following his appointment as speaker in late October.",Lean Left,1,truthout,34.51,-16.87
"He also has a flag outside of his congressional offices whose symbol has been adopted by a Christian sect called the New Apostolic Reformation, which calls for Christians to take control of all aspects of society.",Lean Left,1,truthout,34.51,-16.87
"However, the situation in the West Bank demonstrates that Israel’s genocidal policies toward Gaza are only a component of its overall settler colonial project, which now appears set on the full annexation of historic Palestine and the expulsion and oppression of Palestinians.",Lean Left,1,truthout,34.51,-16.87
"Since Hamas’s October 7 attack and Israel’s subsequent military assault on Gaza, however, Israel advocates have doubled down yet further politically on this cynical accusation.",Lean Left,1,truthout,34.51,-16.87
This overemphasis on individualistic action limits the climate movement and depoliticizes its aim by obscuring greater systemic causes.,Lean Left,1,truthout,34.51,-16.87
"Jason Storms would later participate in the Trump-inspired attack on the U.S. Capitol building on January 6, 2021.",Lean Left,1,truthout,34.51,-16.87
"This series features articles from organizers, artists, scholars and members of the clergy to provide important theological resources for imagining new worlds, demanding the impossible and resisting structures of domination.",Lean Left,1,truthout,34.51,-16.87
Can this queen’s BFA in Musical Theatre Performance raise the roof at RuPaul’s Drag Race?,Lean Left,1,nbc-news,43.21,-5.79
"In these circumstances, there is a heightened risk of atrocity crimes.",Lean Left,0,nbc-news,43.21,-5.79
He added the the entire hospital is without fuel and the Israeli troops were firing on people.,Lean Left,1,nbc-news,43.21,-5.79
"Her move galvanized Acevedo, already angry over the Valladares shooting, who was serving as the leader of Major City Chiefs, an organization of national police leaders.",Lean Left,1,nbc-news,43.21,-5.79
"In recent weeks, Haley has captured momentum among Republican donors who see her as the most viable alternative to former President Donald Trump, who is dominating the field in polls and has skipped all four presidential primary debates.",Lean Left,1,nbc-news,43.21,-5.79
"The purity/sanctity pillar, indicating wholesomeness, was among the least utilized by either campaign and media coverage.",Center,0,poynter,41.75,-7.32
"Elin Yunita, who worked on the book project, said the comic approach is the fact-checking organization’s attempt at making debunks more appealing to millennials and Gen Z.",Center,0,poynter,41.75,-7.32
But this kind of reporting from Tomlinson and Fox is deceitful and disingenuous.,Center,1,poynter,41.75,-7.32
"And another report that, while perhaps smaller in scale, was chilling to me, depicted how children had to court danger by climbing under or between trains that blocked railroad crossings for days on end, just so they could get to school.",Center,1,poynter,41.75,-7.32
But she did the worst thing a journalist could do: She made stuff up.,Center,1,poynter,41.75,-7.32
"For journalists, this is the great paradox of generative AI: At its best, the technology could automate menial tasks, identify human blind spots and otherwise make us better at our jobs.",Center,0,poynter,41.75,-7.32
"We are being bombarded with AI-generated videos like this one, as well as with synthetic images, AI-generated text and now voice-cloning.",Center,0,poynter,41.75,-7.32
"Notably, Columbia University’s Anya Schiffrin, who has made an international beat of getting Google and Meta to pay for news from publishers; Steven Waldman, prolific and ingenious advocate for government subsidies for journalism (and co-founder of Report for America); Tim Franklin, former Poynter president, whose Medill Local News Initiative produces a steady stream of coverage of important trends - last week Penny Abernathy’s latest research on news deserts.",Center,0,poynter,41.75,-7.32
"During Red vs. Blue State , showed our map of human feces all over San Francisco.",Center,1,poynter,41.75,-7.32
And so much so that we practically have become numb to it.,Center,1,poynter,41.75,-7.32
"While previous research had examined the emotions used by candidates and media coverage, there was no scholarship that had examined the use of moral language by candidates and media coverage in the months before Election Day.",Center,0,poynter,41.75,-7.32
We’ve seen some hilarious failures from publishers who did not consider their audience before trotting out AI-generated articles.,Center,1,poynter,41.75,-7.32
"A few months ago, Tofel asked some tough questions about the amount of funding, the approach and potential outcomes.",Center,0,poynter,41.75,-7.32
"As the war between Israel and Hamas rages on, U.S. national media is reporting on a wave of antisemitic and Islamophobic attacks here at home.",Center,1,poynter,41.75,-7.32
"Instead, all links shared in the newsletter center on a big premise: Amid grim news of wars, plagues and climate change, the planet - and humanity - are doing a lot better than you might believe.",Center,1,poynter,41.75,-7.32
"A recent study from the University of Florida may have identified a major cause of this agitation: The Biden campaign, the Trump campaign and media coverage all frequently used authoritarian language.",Center,1,poynter,41.75,-7.32
"It is one of the most significant investigative podcasts in the medium’s history, and the team’s relentless reporting for its second season led to a man tried six times for the same crime being freed from death row.",Center,0,poynter,41.75,-7.32
If you’re really into Minecraft - and so is your echo chamber - you’re going to see the most relevant posts to your interests: posts about Minecraft.,Center,1,poynter,41.75,-7.32
We trusted Elizabeth with a large enough investment to hire additional staffers.,Center,1,poynter,41.75,-7.32
International students are seen as an expensive headache an employer would be better off avoiding.,Center,1,poynter,41.75,-7.32
It’s not really worth going into the mechanics of what led one of the world’s richest people down the same dumb rabbit hole that caused Edgar Maddison Welch to enter Comet Ping Pong in Northwest DC with a gun almost seven years ago today.,Center,1,poynter,41.75,-7.32
"His comments were based on a study from a recognizable organization, but his quote distorts the results.",Center,1,poynter,41.75,-7.32
"Related, most newsrooms have a lot of old content still online that is causing harm.",Center,1,poynter,41.75,-7.32
The Edward R. Murrow College of Communication is recruiting for eight entry-level Journalist/News Fellows with the recently created Murrow News Fellowship Program.,Center,0,poynter,41.75,-7.32
"In short, Snopes editors are insanely ethical, non-partisan, insatiably curious wordsmiths who are not easily duped.",Center,1,poynter,41.75,-7.32
"While Trump has been known to go on unhinged rants, both in speeches and on his Truth Social, it doesn’t mean his threats can just simply be brushed off as, well, unhinged rants.",Center,1,poynter,41.75,-7.32
"Actually, she didn’t comment as much on Santos as she did the speaker of the House, Mike Johnson.",Center,0,poynter,41.75,-7.32
"Pay is a minimum of $30 per hour for an initial contract through March 15, 2024.",Center,0,poynter,41.75,-7.32
"The University has approximately 10,000 faculty and staff and 32,000 students, including 24,000 undergraduates and over 8,000 graduate and professional students.",Center,0,poynter,41.75,-7.32
"Any errant remark he made about politics or culture, any slight against Trump or the Republican Party - real or perceived - invited a torrent of criticism.",Center,1,poynter,41.75,-7.32
"We have made the decision, if we fall short of this goal, to implement involuntary layoffs in those areas where we have already identified that positions do not need to be replaced, where work can be reassigned more efficiently or where we can otherwise achieve cost savings.",Center,0,poynter,41.75,-7.32
The indy online news service Planet Detroit thought its readers should know that their region is ill-prepared for the inundations to come.,Center,0,poynter,41.75,-7.32
"And then refusing to send help when the Capitol was under attack, he’s already attempted to seize power.",Center,1,poynter,41.75,-7.32
The evidence on extremist mass shootings in America supports the assertion that the rise and prevalence of far-right shootings is American terrorism.,Center,1,poynter,41.75,-7.32
"Some fact-checkers are enthusiastic about working with TikTok, which is more aggressive than Meta in taking down fakes.",Center,1,poynter,41.75,-7.32
But the twisted logic by police unions and law enforcement agencies that used it to shield officers from public view when they took a life in the course of their job was a huge disservice to transparency and accountability.,Center,1,poynter,41.75,-7.32
"Additional responsibilities will include academic advising, student mentoring and college and university service.",Center,0,poynter,41.75,-7.32
"Is it a just pivot-to-video-style mirage, or are we truly entering the post-social media era?",Center,0,poynter,41.75,-7.32
And how the government screeched to a halt for three weeks in October after McCarthy was removed as speaker.,Center,1,poynter,41.75,-7.32
"Trump is, essentially, an incumbent and, traditionally, incumbents getting in debates can only hurt and rarely help.",Center,1,poynter,41.75,-7.32
What are the key insights from this field that fact-checkers should keep in mind?,Center,0,poynter,41.75,-7.32
Ensure our digital platforms are at the forefront of breaking news stories.,Center,0,poynter,41.75,-7.32
"Our families and communities are experiencing unprecedented trauma, and it has been kept under cover.",Center,1,poynter,41.75,-7.32
Alberta wrote about a young man named Chris Winans who succeeded his father at the church.,Center,0,poynter,41.75,-7.32
"This fact check was originally published by PolitiFact, which is part of the Poynter Institute.",Center,0,poynter,41.75,-7.32
That doesn’t happen when you check politicians or major media outlets.,Center,1,poynter,41.75,-7.32
And no matter how they communicated that - whether it was with expletives or these really heart-wrenching messages to their loved ones - everyone communicated these same emotions of just frustration and fear.,Center,0,poynter,41.75,-7.32
"It is the world’s biggest political contribution to the Radical Left Democrats who, by the way, are destroying our Country.",Center,1,poynter,41.75,-7.32
"In what was a jaw-dropping admission, Amazon Prime Video and Fox Sports anchor Charissa Thompson said on a podcast this week that when she was a TV sideline reporter on football games, she sometimes fabricated a report for the broadcast.",Center,0,poynter,41.75,-7.32
"Sarajevo, 2024 The IFCN will present the 2024 conference in partnership with Zašto ne, a Sarajevo-based civil society organization working to establish political accountability mechanisms, strengthen civic activism and safeguard new media and technologies.",Center,0,poynter,41.75,-7.32
"Fox has consistently claimed Stirewalt’s ouster there was simply because of budget cuts, and nothing to do with being a part of the team that called the state of Arizona for Biden in 2020.",Center,1,poynter,41.75,-7.32
It would not be the first time that has happened after advertisers have fled an outlet en masse.,Center,0,poynter,41.75,-7.32
"Host newsrooms may be located in rural, suburban, or urban communities.",Center,0,poynter,41.75,-7.32
"On Sept. 26, Naver had more bad news for Korea’s fact-checkers: It was ending a dedicated section on its platform, where fact checks from the 32 media outlets, including IFCN signatory NewsToF, were systematically displayed.",Center,0,poynter,41.75,-7.32
"In an absolutely brutal takedown, Rolling Stone’s Spencer Ackerman compared Kissinger to Timothy McVeigh, the Oklahoma City bomber.",Center,1,poynter,41.75,-7.32
"The Biden campaign had a heavier influence than Trump on media coverage of moral language, and the findings are bleak.",Center,1,poynter,41.75,-7.32
"These text messages have actually anthropomorphized fear, and now it’s walking around us.",Center,1,poynter,41.75,-7.32
He would use the power of government to punish media outlets who do critical reporting about him.,Center,1,poynter,41.75,-7.32
"And since we’re on the topic of the College Football Playoff, here are some smart pieces worth checking out: Debatable The Republicans have another debate this week.",Center,1,poynter,41.75,-7.32
COVID-19 lockdowns Newsom borrowed a page from former President Donald Trump’s playbook by misleadingly portraying DeSantis as a lockdown leader.,Center,1,poynter,41.75,-7.32
"NewsNation’s subscriber base is seen falling to 62.6 million next year, according to Kagan, compared to a projection of 67.5 million for 2023.",Center,0,poynter,41.75,-7.32
The latest to apparently jump off the X bandwagon is The Washington Post.,Center,1,poynter,41.75,-7.32
And the whole world will know that those advertisers killed the company.,Center,1,poynter,41.75,-7.32
"All over the country, the few journalists remaining in gutted newsrooms are scrambling just to keep up with the police blotter and city council meetings.",Center,1,poynter,41.75,-7.32
"Trump wrote: MSNBC (MSDNC) uses FREE government approved airwaves, and yet it is nothing but a 24 hour hit job on Donald J. Trump and the Republican Party for purposes of ELECTION INTERFERENCE.",Center,1,poynter,41.75,-7.32
"Such big-picture decisions won’t fall to me, however, or to most of the other as-yet human grunts toiling away in the content mines.",Center,1,poynter,41.75,-7.32
"In the blink of an eye, machine learning models feel a decade old.",Center,1,poynter,41.75,-7.32
"This one is lovely - meticulously engineered, but lovely all the same.",Center,0,poynter,41.75,-7.32
"More than an hour into the debate, Hannity invoked his own beliefs about President Joe Biden’s fitness to hold the highest office.",Center,1,poynter,41.75,-7.32
The subtle use of this language by media coverage and the Biden campaign works to maintain historic norms.,Center,1,poynter,41.75,-7.32
Aren’t those the kind of things they do in countries with dictators?,Center,1,poynter,41.75,-7.32
There’s nothing to suggest that Trump not participating has hurt his chances one bit.,Center,0,poynter,41.75,-7.32
"So, the silver lining here is that journalists may be subconsciously more mindful of moral language than campaign staffers.",Center,1,poynter,41.75,-7.32
"For instance, your survey earlier this year showed there’s a real desire for research on audiences for fact-checking and on different formats, two areas that haven’t been studied much.",Center,0,poynter,41.75,-7.32
"There’s no reason now that sort of high-status individual can’t go direct to their audience via social media or their own newsletter, their own website.",Center,0,poynter,41.75,-7.32
"It’s a made-up story, but one that drives home a point.",Center,1,poynter,41.75,-7.32
Newsrooms appear to be elevating the voices of oft-ignored data journalists/engineers/programmers to address the issue.,Center,1,poynter,41.75,-7.32
We are deeply concerned by the court’s decision to extend his detention for an additional two months.,Center,1,poynter,41.75,-7.32
"With his hands on the wheel and driving toward revenge and chaos - all to raise his personal profile and stir up small, online donations - Gaetz crashed the House of Representatives in a ditch on a low road.",Center,1,poynter,41.75,-7.32
This makes it essential for each member of our community to feel secure and welcomed and to thoroughly understand and believe that their ideas are respected by all.,Center,1,poynter,41.75,-7.32
"If our standards and trust editor back reads your line-edited copy and deems it publishable, you're gold.",Center,0,poynter,41.75,-7.32
Stirewalt is the former Fox News political editor who was infamously fired not long after the 2020 presidential election - one where he helped with Fox’s controversial decision to call the state of Arizona for Joe Biden.,Center,1,poynter,41.75,-7.32
"Fourth is the authority/respect pillar, which emphasizes the status quo of the United States and pushes for the maintenance of current social hierarchies while emphasizing obedience, respect, and the importance of everyone’s role.",Center,1,poynter,41.75,-7.32
"But if you’d like to learn more, follow us at on YouTube, TikTok and Twitter.",Center,0,poynter,41.75,-7.32
How is it ethical to portray ... Hamas as a strictly terrorist organization?,Center,1,poynter,41.75,-7.32
The IFCN does not publish fact checks and is therefore not eligible to be a signatory of its own code of principles.,Center,0,poynter,41.75,-7.32
NOTE TO TEACHERS: Here is the full Is This Legit video created by Ian Fox.,Center,0,poynter,41.75,-7.32
"Now that we’ve established Reboot’s credibility, let’s get back to the claim from Ramaswamy that 60% of Gen Z said they’d give up the right to vote rather than lose TikTok.",Center,1,poynter,41.75,-7.32
"Major advertisers are starting to flee X, formerly known as Twitter, as Musk seemingly leans into antisemitism and conspiracy theories such as Pizzagate.",Center,1,poynter,41.75,-7.32
The fake audio discussed how to rig the election and mimicked the voices of the liberal Progressive Slovakia party’s leader and a journalist.,Center,0,poynter,41.75,-7.32
These councils are usually full of untrained community members with the best intentions.,Center,1,poynter,41.75,-7.32
Caro: What do you think of the Associated Press guidelines for dealing with AI?,Center,0,poynter,41.75,-7.32
Victims-survivors-deserve that chance to cope with it and try to take some action.,Left,1,the-nation,31.32,-19.23
They hate Trump but hadn’t really worried that he could be reelected-until they read Kagan’s piece.,Left,1,the-nation,31.32,-19.23
"Stories like these galvanized reproductive health advocates in the state, including doctors.",Left,0,the-nation,31.32,-19.23
"With every anti-Jewish attack stoked by Trump, from Charlottesville to Pittsburgh, Netanyahu steps in to thank Trump and say that this is proof that Jews need their own ethno-state for protection.",Left,1,the-nation,31.32,-19.23
"She’s one of the most openly hawkish GOP candidates, opposing the US withdrawal from Afghanistan and favoring tougher moves against Iran; AFP backs neither.",Left,0,the-nation,31.32,-19.23
"Before we even get to the law of it all, we should talk as adults about the realpolitik of what these Section Three lawsuits, brought in state after state in order to get him kicked off as many ballots as possible, are asking the courts to do.",Left,1,the-nation,31.32,-19.23
"Diversity, equity, and inclusion divisions were rapidly namechecked, as were course offerings that mentioned settler colonialism in the context of the Middle East.",Left,1,the-nation,31.32,-19.23
"That notion of history provides a driving impetus to this novel and its end-of-world moments-colonialism, the Partition, the Union Carbide disaster, and the slow-motion, fascism-fueled wreckage that is India’s present and near future.",Left,1,the-nation,31.32,-19.23
They carry US or European passports and perform humane professions or have disabilities.,Left,1,the-nation,31.32,-19.23
"AFP and Haley brought this nightmare on themselves, and on the rest of us.",Left,1,the-nation,31.32,-19.23
"On a podcast that he hosts with his brother, fellow NFL star Jason Kelce, they come across as two bros you wouldn’t mind having an IPA with ― even if they’re discussing their pregame bathroom rituals between rounds.",Left,1,huffpost,37.82,-10.75
And none of them really tried because they refused to take him on.,Left,1,huffpost,37.82,-10.75
"Not at all, although you might want to splurge on small bites you love.",Left,0,huffpost,37.82,-10.75
Advertisement But Pattie Gonia frolics in fields in elaborate dresses made of camping tents while educating her followers about the nuances and importance of recycling.,Left,1,huffpost,37.82,-10.75
This is a guy who just said last week that he wants to use the Department of Justice to go after his enemies when he gets in there.,Left,1,huffpost,37.82,-10.75
"It’s also evident throughout CHAI’s self-titled fourth album, released last month, which exudes this unmistakably neo-kawaii philosophy.",Left,1,huffpost,37.82,-10.75
She has made a YouTube video about quiet quitting in the tech industry.,Left,0,huffpost,37.82,-10.75
"At this point, that’s the expected stunt, yet it appears no one wants to take up that mantle.",Left,1,huffpost,37.82,-10.75
"Advertisement The filing, which is part of an ongoing civil lawsuit seeking more than $30,000 in damages for emotional distress, was amended following depositions with the Laundries and their attorney, Steve Bertolino, in October, a lawyer for the Petito family told HuffPost on Tuesday.",Left,0,huffpost,37.82,-10.75
Advertisement The case for having a boyfriend who’s not unlike a sweet dog was arguably best made by comedian-actor Jenny Slate while describing her ex-boyfriend Chris Evans ― a GRB if there ever was one.,Left,1,huffpost,37.82,-10.75
Russell’s lived experience as a Black woman is not the focal point of her videos; she aims to focus mostly on the subjects and sources involved.,Left,0,huffpost,37.82,-10.75
A decision from the Office of Surface Mining and Reclamation regarding HB 576 compliance with federal law is expected in January.,Lean Left,0,montana-free-press,46.33,-3.8
"There is little flinching in the writing, which depicts the blood and bile and grit of human survival in the face of violence, colonialism and rape.",Lean Left,1,montana-free-press,46.33,-3.8
Sacajewea’s fictive journals describe the brutality she endured and her mental rebellions.,Lean Left,1,montana-free-press,46.33,-3.8
"With Wednesday’s action, Montana will no longer require the directors of libraries serving more than 25,000 people to hold a master’s degree in library science in order for those libraries to receive state funding.",Lean Left,0,montana-free-press,46.33,-3.8
"Department staff advocated for the new building to include classroom and community spaces not available in the previous office, which was leased, Christiaens said.",Lean Left,0,montana-free-press,46.33,-3.8
"After the county submitted its letter of withdrawal, the governor has six months to sign a proclamation releasing the county of its duties.",Lean Left,0,montana-free-press,46.33,-3.8
"In response to public input, the Forest Service made a few tweaks to the company’s original proposal.",Lean Left,0,montana-free-press,46.33,-3.8
An analysis prepared by the agency estimates the mine would require a $36 million capital outlay for additional buildings and infrastructure to switch to a filtered tailings system.,Lean Left,0,montana-free-press,46.33,-3.8
People seeking public aid have historically encountered long call-center wait times and limited options for in-person help.,Lean Left,0,montana-free-press,46.33,-3.8
The biggest new addition is the USB-C charging port located where the Lightning connector used to be.,Center,0,cnet,40.02,-1.39
We're still seeing amazing discounts on some of our favorite mattresses.,Center,0,cnet,40.02,-1.39
"With excellent performance and 272 miles of range for the base model (the most of any EV on this list), the Tesla Model 3 is a formidable option for EV enthusiasts on a budget.",Center,1,cnet,40.02,-1.39
See at Carvana Genesis 2023 Genesis Electrified G80 282 miles The Genesis Electrified G80 is a surprisingly luxurious sedan packing a potent 365 hp dual-motor electric powertrain.,Center,0,cnet,40.02,-1.39
"Google, a pioneer in computational photography, now boasts how its Pixel 8 Pro Magic Editor software lets you zap unwanted people out of a photo's background or how its Best Take feature lets you pluck the most flattering faces from a burst of shots to create a group photo where nobody looks like a dork.",Center,1,cnet,40.02,-1.39
"Trim and sleek, yet rigid and ready to withstand the abuses of business travel, it is every bit a premium C-suite business laptop.",Center,1,cnet,40.02,-1.39
The infinitesimal size of nanoplastics is partly why scientists know little about them.,Left,0,vice,38.96,-9.39
One of his first projects was banding together with other militant neo-Nazis in Canada to try and form an Atomwaffen cell.,Left,1,vice,38.96,-9.39
"ABSTRACT breaks down mind-bending scientific research, future tech, new discoveries, and major breakthroughs.",Left,0,vice,38.96,-9.39
"As the overtly edgy and militant aesthetic of Atomwaffen fell out of style in the neo-Nazi scene following several high-profile law enforcement operations and some members went underground, Nippak remained, for lack of a better term, active.",Left,1,vice,38.96,-9.39
"Meeting several times a month, members of the semi-autonomous cells train martial arts, put up racist posters, and recruit young, easily manipulated white men to their cause.",Left,1,vice,38.96,-9.39
"The movement is a direct response to the more overtly violent groups such as Blood & Honour, Atomwaffen and even The Base that came before it.",Left,1,vice,38.96,-9.39
"Peter Smith, a researcher and journalist for the Canadian Anti-Hate Network , has studied Active Clubs since they began to pop up in Canada.",Left,0,vice,38.96,-9.39
"It’s also possible that the Yankees flip Verdugo in a package for Soto, giving the Padres an immediate replacement in their outfield.",Lean Left,0,nj.com,43.92,-2.88
The town’s animal control officer is working closely with Princeton University to capture the raccoon.,Lean Left,0,nj.com,43.92,-2.88
