text,source_party,label,source,reliability,bias
But her proposal is fully in sync with Trump’s narrative that demonizes elites and government.,Left,1,mother-jones,37.08,-15.12
"They purchased the adjacent property as a guest residence and office for their house manager, overseer of gardens, private chef, and housekeepers.",Left,0,mother-jones,37.08,-15.12
"Earlier that day, a visibly inebriated Nodine told one of his trademark dirty jokes, this time going so far as to grope Chase’s butt as Archer watched.",Left,1,mother-jones,37.08,-15.12
"A large young man greeted me and took me over to Nikhil Kunapuli, who told me that he was Praxis’ head of research.",Left,0,mother-jones,37.08,-15.12
The complaint also addressed the absence of an interpreter at IEP meetings.,Left,0,mother-jones,37.08,-15.12
She was sentenced to a year behind bars and three more on probation.,Left,0,mother-jones,37.08,-15.12
"In May, a hearing officer decided on the complaint in their favor and ordered the DOE to cover the private school tuition and home-based ABA for the next three school years.",Left,0,mother-jones,37.08,-15.12
But California’s legislature has been hard at work on housing since 2017.,Left,0,mother-jones,37.08,-15.12
"Planned Parenthood, too, opened a clinic in Las Cruces last spring and has reportedly expanded its services.",Left,0,mother-jones,37.08,-15.12
The simple explanation is that lawyers have way too much heft within environmental organizations.,Left,1,mother-jones,37.08,-15.12
"AC: On an episode of Wild ’N Out, he said the quiet part out loud.",Left,1,mother-jones,37.08,-15.12
"But, some experts say, relying primarily on once-a-year COP meetings to get there may no longer be the best approach.",Left,0,mother-jones,37.08,-15.12
Sen. Mike Lee (R-Utah) depicted it as an attempt to undermine a grant of clemency.,Left,0,mother-jones,37.08,-15.12
"New Orleans’ one-for-one net metering scheme allows the church to offset its excess clean energy against the utility’s dirty energy, and this should become a net zero facility within 12 months.",Left,0,mother-jones,37.08,-15.12
"Petersen is aware of the complaints about Nancy’s Nook, but she doesn’t put much stock in them.",Left,0,mother-jones,37.08,-15.12
"One former employee said he saw Brown reading Last War of the World-Island, a geopolitical text by the contemporary Russian fascist Alexander Dugin, at the office; another saw it on a shelf there.",Left,0,mother-jones,37.08,-15.12
"In most cases, educators or caregivers must independently seek out these technologies and fight to incorporate them in curriculums, navigating complex bureaucracies or grant applications to secure funding.",Left,0,mother-jones,37.08,-15.12
"Rahimi comes from the U.S. Court of Appeals for the Fifth Circuit in New Orleans, which has birthed several conservative, high-profile Supreme Court cases.",Left,1,mother-jones,37.08,-15.12
Whether it’s because of Kennedy’s war on vaccination or his potential to discomfort Biden and the Democratic Party-or perhaps both-the Chernicks and other GOP donors have fueled the long-shot campaign of a candidate with the most hallowed name in Democratic politics.,Left,1,mother-jones,37.08,-15.12
"Long before he was even elected to the Louisiana legislature, he spent years as an attorney and spokesperson for the Alliance Defending Freedom (ADF), a powerful conservative organization that carries out much of the Christian right’s legal agenda.",Left,1,mother-jones,37.08,-15.12
"The total value of agricultural products sold in Palm Beach is $901 million, higher than any other county in Florida.",Left,0,mother-jones,37.08,-15.12
"Bridget Ziegler, who admitted that she had been involved in a sexual encounter with her husband and the alleged victim, has been widely criticized for her outspoken opposition to LGBTQ-inclusive curriculum and books-while also being involved in a bisexual relationship.",Left,0,mother-jones,37.08,-15.12
"It’s because they are searching for something, and it’s just unfortunate that they’re met with this false sense of community that’s really just centered around misogyny.",Left,1,mother-jones,37.08,-15.12
"They platformed Dave Chappelle after he’s been very vocally anti-trans, and comedian Shane Gillis, who was hired on SNL alongside Bowen Yang and Chloe Fineman.",Left,1,mother-jones,37.08,-15.12
"One concern that researchers have with projects that repurpose food is that they require additional resources, like transportation and electricity.",Left,0,mother-jones,37.08,-15.12
"New York City’s Department of Education, which oversees Zachary’s elementary school education, does not use social robots in their curriculums (they declined to explain why)-something Cheryl and Gary have tried to change by encouraging Zachary’s teachers and school administrators to learn about the technology.",Left,0,mother-jones,37.08,-15.12
"These clips (along with Rife’s chiseled jawline) earned him a large following among women, despite the fact that much of his material is tinged with chauvinism.",Left,1,mother-jones,37.08,-15.12
His writing that the antichrist is a half-Jewish homosexual and his promotion of anti-Semitic theories about Jewish bankers controlling the Federal Reserve haven’t gone over well either.,Left,1,mother-jones,37.08,-15.12
Democrats were again aiming their economic appeal at the group between the poor and the rich: the vague middle.,Left,0,mother-jones,37.08,-15.12
"Last year, in response to a complaint by AdvocacyDenver, a nonprofit civil rights organization that advocates for children with disabilities to be educated in the least restrictive environment, the department conducted a sweeping investigation of affective needs centers in Denver.",Left,0,mother-jones,37.08,-15.12
Trump says he wouldn’t be a dictator ‘except for Day One’,Lean Right,0,fiscal-times,43.33,-4.18
"Williams said he expects the headline inflation rate to end the year at 3%, before falling to 2.25% in 2024.",Lean Right,0,fiscal-times,43.33,-4.18
"His ouster marked the first time in history that the House voted to remove its leader, a move that threw the chamber into a period of instability.",Lean Right,1,fiscal-times,43.33,-4.18
"But it doesn’t help either,"" The Hill’s Emily Brooks, Mike Lillis and Mychael Schnell write.",Lean Right,0,fiscal-times,43.33,-4.18
"The failed vote highlighted waning support in the United States for continuing to fund Ukraine’s war effort at a perilous time in the conflict, with Kyiv’s counteroffensive failing to meet its objectives and Russia’s forces on the offensive.",Lean Right,0,fiscal-times,43.33,-4.18
"It would also prevent a tax on a billionaire’s wealth from ever being enacted, because taxing net wealth would involve unrealized income from investments.",Lean Right,1,fiscal-times,43.33,-4.18
"We’re three weeks away from Christmas Day and, incredibly, just six weeks away from the 2024 Iowa caucuses.",Lean Right,1,fiscal-times,43.33,-4.18
"Journalist Alexander Heffner journeys from Maine to New Mexico, sitting down for meals and candid conversations with powerful political figures on both sides of the aisle.",Lean Right,0,fiscal-times,43.33,-4.18
"While there was broad bipartisan support for Ukraine after Russia invaded in February 2022 - as well as widespread public displays of support for Ukraine - interest in the war among the American public has waned considerably, especially as it has ground to a stalemate with no clear end.",Lean Right,1,fiscal-times,43.33,-4.18
"McCarthy’s sticking around for another year is just too much to ask, apparently.",Lean Right,1,fiscal-times,43.33,-4.18
New York Fed President John Williams said Thursday morning that the central bank will probably hold off on any further interest rate increases.,Lean Right,0,fiscal-times,43.33,-4.18
"Senate Democrats aren’t closing the door but continue to argue the GOP needs to move toward a compromise rather than sticking with pursuing tough asylum, parole and detention policies while.",Lean Right,1,fiscal-times,43.33,-4.18
"And under Subpart F, which dates to 1962, American investors in foreign corporations must pay taxes on their share of income.",Lean Right,0,fiscal-times,43.33,-4.18
"When there is the potential for a shortage, drug manufacturers are required to notify the F.D.A.",Lean Right,0,fiscal-times,43.33,-4.18
"Any time Trump or DeSantis want to vent about Obamacare, they sharpen the contrast between the party that delivered health care for millions of people and the party that would take it away under the false illusion that they’ve got a secret plan to make it better.",Lean Right,1,fiscal-times,43.33,-4.18
The Pentagon has aligned with the Biden administration messaging that ties security assistance to Ukraine with a boost to domestic production and jobs - a potent talking point heading into an election year and an incentive for GOP lawmakers to drop their opposition to the bill.,Lean Right,1,fiscal-times,43.33,-4.18
"All 49 Republicans plus independent Sen. Bernie Sanders voted against moving forward on the bill, leaving Democrats well short of the 60-vote threshold.",Lean Right,0,fiscal-times,43.33,-4.18
And doctors are not the only health professionals who are unionizing or protesting in greater numbers.,Lean Right,0,fiscal-times,43.33,-4.18
"After all, one of Biden’s top priorities rests on this deal with Republicans.",Lean Right,1,fiscal-times,43.33,-4.18
"Listen 3 min Share Comment on this story Comment Add to your saved stories Save No doubt it stinks to be a former speaker, forced to work alongside colleagues who voted to remove you from your dream job.",Lean Right,1,fiscal-times,43.33,-4.18
The closing of this loophole was estimated to bring in about $338 billion over ten years.,Lean Right,0,fiscal-times,43.33,-4.18
"That’s partly because most of the cost of a wind or solar farm is in the upfront investment, whereas a large portion of the spending in a coal- or gas-fired power plant is in fuel costs, which are spread over time.",Lean Right,0,fiscal-times,43.33,-4.18
And please encourage your friends to sign up here for their own copy of this newsletter.,Lean Right,0,fiscal-times,43.33,-4.18
"Republicans on Wednesday blocked an emergency spending bill to fund the war in Ukraine, demanding strict new border restrictions in exchange and severely jeopardizing President Biden’s push to replenish the war chests of American allies before the end of the year.",Lean Right,0,fiscal-times,43.33,-4.18
The Ukraine aid issue is a continued point of contention in the current Congress.,Lean Right,0,fiscal-times,43.33,-4.18
"Johnson noted that the House has already passed a bill, H.R.",Lean Right,0,fiscal-times,43.33,-4.18
"In addition, the must-pass NDAA might be used as a vehicle for all kinds of amendments that lawmakers have been unable to graft onto other bills.",Lean Right,0,fiscal-times,43.33,-4.18
Republicans think they can get everything they want without any bipartisan compromise.,Lean Right,1,fiscal-times,43.33,-4.18
"Those borrowers who are eligible for relief under Wednesday’s announcement qualify in one of two ways: either under the Public Service Loan Forgiveness program, which wipes away remaining student loan debt after qualifying public-sector workers make 10 years’ worth of monthly payments; or because they have made at least 20 years of qualifying payments in an income-driven repayment program but didn’t previously get credit for all of their student loan payments.",Lean Right,0,fiscal-times,43.33,-4.18
"The House currently consists of 221 Republicans, 213 Democrats and one vacancy, with Rep. George Santos (R-N.Y.) expelled Dec. 1.",Lean Right,0,fiscal-times,43.33,-4.18
"Sen. James Lankford of Oklahoma, who leads the negotiations for Republicans, said this weekend that he would reject any supplemental package that fails to include major changes in border policy, including more restrictive detention guidelines and new limits on the granting of asylum privileges.",Lean Right,0,fiscal-times,43.33,-4.18
"But in practice, there are lots of gray areas, of which more in a moment.",Lean Right,0,fiscal-times,43.33,-4.18
"The fact Democrats are airing their problems publicly isn’t a great sign for those talks, however.",Lean Right,1,fiscal-times,43.33,-4.18
"Divisions may be growing: While conservatives in the House gave Johnson leeway to successfully negotiate a bipartisan deal that avoided a government shutdown, they again revolted after seeing the result.",Lean Right,1,fiscal-times,43.33,-4.18
There is little penalty for over-ordering because unused drugs can often be returned.,Lean Right,0,fiscal-times,43.33,-4.18
"Senate negotiators are discussing a single bill that responds to the request, but talks have hit a rough patch over demands that the Biden administration make significant changes in its border policy as part of the overall aid package.",Lean Right,0,fiscal-times,43.33,-4.18
Lawmakers will have to deal with several pressing issues over the next few weeks.,Lean Right,0,fiscal-times,43.33,-4.18
Here’s a rundown on key details: * The bill is ‘clean’: The funding bill will maintain current spending levels and contains no amendments addressing thorny issues such as border policy and aid for Ukraine and Israel.,Lean Right,0,fiscal-times,43.33,-4.18
"But Congress has passed the NDAA for 62 years in a row, and a bill pushed through with bipartisan backing may still be the likely outcome.",Lean Right,0,fiscal-times,43.33,-4.18
"Washington CNN - The Department of Education said Wednesday that it has approved the cancellation of nearly $5 billion more in federal student loan debt, bringing the total amount of student debt relief provided under the Biden administration to $132 billion for more than 3.6 million borrowers.",Lean Right,0,fiscal-times,43.33,-4.18
Heffner seeks to draw out lawmakers by incentivizing empathy and compromise in pursuit of a new consensus.,Lean Right,0,fiscal-times,43.33,-4.18
The one-time account adjustment effort was first announced by the Biden administration in April 2022 and the cancellations did not begin until this year.,Lean Right,0,fiscal-times,43.33,-4.18
"Based on California law, that vote is unlikely to be held until summer.",Lean Right,0,fiscal-times,43.33,-4.18
"This narrowing could spare government the worst-case scenario, in which taxation of all such ambiguous categories of income would be found to be unconstitutional.",Lean Right,0,fiscal-times,43.33,-4.18
"Health care workers, many of them nurses, held eight major work stoppages last year - the most in a decade - and are on pace to match or exceed that number this year.",Lean Right,0,fiscal-times,43.33,-4.18
"Similarly, if you live on some land, and it has trees, and you don’t cut down the trees, then the trees store carbon that might otherwise go into the atmosphere, and therefore they reduce global warming.",Lean Right,0,fiscal-times,43.33,-4.18
The problem is that the generic drug system is built to be fragile.,Lean Right,0,fiscal-times,43.33,-4.18
"On a 12-month basis, the PCE price index rose 3.0%, the lowest level since March 2021.",Lean Right,0,fiscal-times,43.33,-4.18
"Schumer had hoped the vote, though he knew it was likely doomed, might unstick the flailing negotiations among six senators on border policy.",Lean Right,1,fiscal-times,43.33,-4.18
"Republican and Democratic lawmakers appear to be moving further apart on a $111 billion supplemental spending package that includes billions in aid for Ukraine, Israel and Taiwan, as well as changes in immigration and border policy.",Lean Right,0,fiscal-times,43.33,-4.18
Democratic Rep. Scott Peters of California argued that Congress is clearly not capable of addressing the problem through regular order - and that a plan from a bipartisan commission would be a smart way to erode the leverage of Republicans seeking to slash safety net programs and avoid the threat of automatic cuts in the future.,Lean Right,0,fiscal-times,43.33,-4.18
"Republicans have managed to trim spending a bit, given that the debt ceiling deal they negotiated with the White House in May caps discretionary spending for at least two years, resulting in about $250 billion in direct savings and potential spending reductions totaling as much as $2.1 trillion over 10 years, according to a June analysis by the Center for a Responsible Federal Budget, a nonpartisan group that advocates for deficit reduction.",Lean Right,0,fiscal-times,43.33,-4.18
"Payments resumed in October Borrowers were required to restart making their federal student loan payments in October for the first time in three-plus years after the pandemic-related pause, which essentially froze borrowers’ accounts, came to an end.",Lean Right,0,fiscal-times,43.33,-4.18
Keep in mind that Johnson has vowed that he’s now done with short-term spending bills and that the House and Senate will still need to hash out differences between their respective versions of the full-year spending bills.,Lean Right,0,fiscal-times,43.33,-4.18
"× Expand Evan Vucci/AP Photo The long-standing goal of the Republican right, in the famous words of anti-tax activist Grover Norquist, is to starve the beast of the deep state by denying it revenue.",Lean Right,1,fiscal-times,43.33,-4.18
"Unlike previous Republican speakers, McCarthy learned to embrace the House Freedom Caucus, allowing the hard-right flank a seat at the table when he became the GOP minority leader in 2019 because their support was crucial to his goal of becoming speaker whenever Republicans regained the majority.",Lean Right,1,fiscal-times,43.33,-4.18
"At the same time, more moderate Republicans in the House are pushing back against conservatives’ calls for potentially divisive spending cuts.",Lean Right,0,fiscal-times,43.33,-4.18
He also unilaterally launched an impeachment inquiry into President Biden to appease the far-right flank ahead of the negotiations on spending that ultimately led to his ouster.,Lean Right,1,fiscal-times,43.33,-4.18
"For them, keeping an open border is more important than the security of Europe or the Middle East.",Lean Right,1,fiscal-times,43.33,-4.18
"The Senate, meanwhile, appears headed to a vote as early as tonight on the House-passed stopgap, defusing the threat of a shutdown at the end of the week.",Lean Right,0,fiscal-times,43.33,-4.18
"His lack of close ties has contributed to some Republicans going rogue on votes - particularly vulnerable incumbents, who had fealty to McCarthy for bringing them into the majority and would often take tough votes for the sake of projecting party unity.",Lean Right,1,fiscal-times,43.33,-4.18
"Powell said he and his Fed colleagues anticipate that the economy will slow over the next year, but he also warned against any premature declarations of victory in the battle against inflation and pushed back against Wall Street expectations for interest rate cuts as soon as next quarter.",Lean Right,0,fiscal-times,43.33,-4.18
"This leads to a race to the bottom of minimum accepted standards, including a lack of investment in quality systems and limited redundancy.",Lean Right,0,fiscal-times,43.33,-4.18
"Instead of leaving Congress alongside the other two, McCarthy stretched his time in Congress by transforming himself to appeal to the party’s most conservative elements, and by largely remaining loyal to Trump.",Lean Right,1,fiscal-times,43.33,-4.18
"Helping them to stay ahead is in the interests of the countries but also in our interests, everybody’s interests.",Lean Right,0,fiscal-times,43.33,-4.18
But House Republicans have struggled to overcome intraparty divisions on a handful or those funding bills.,Lean Right,0,fiscal-times,43.33,-4.18
"But some Senate Republicans have threatened to delay the vote on Ukraine funding, saying they want to include changes in border and immigration policy in any aid bill.",Lean Right,0,fiscal-times,43.33,-4.18
Things went more smoothly on the floor of the House as lawmakers passed a bill that is expected to head off a government shutdown at the end of the week.,Lean Right,0,fiscal-times,43.33,-4.18
Democrats are insisting they will not adopt all the elements of a border bill passed earlier this year by House Republicans.,Lean Right,1,fiscal-times,43.33,-4.18
"As of this week,we have been waiting six months for Corporation Counsel Conrad Mallett to honor our subpoena requests on two dozen issues, from missing persons to facial recognition.",Lean Left,1,detroit-free-press,43.46,-5.43
"This initiative is led by the CSforDetroit Steering Committee, a dedicated collective of leaders in Detroit public schools, local and national nonprofit organizations, higher education, and tech that have lent their ideas and knowledge to this endeavor for the past year.",Lean Left,0,detroit-free-press,43.46,-5.43
"The targeted strike against Ford, General Motors and Stellantis began Sept. 15 and ended in late October.",Lean Left,0,detroit-free-press,43.46,-5.43
"Through the years, Washington Jr. also has enjoyed watching Detroit talent shine in nationally televised college basketball games, particularly games announced by the legendary Dick Vitale, who called the first major NCAA basketball game broadcasted by ESPN on Dec. 5, 1979.",Lean Left,0,detroit-free-press,43.46,-5.43
"After witnessing the notorious Battle of the Overpass, where Bennett’s goons beat strikers bloody, Clara told her husband that if he didn’t put an end to these bloody tactics, she would leave him.",Lean Left,1,detroit-free-press,43.46,-5.43
"Let’s raise a white flag and absolve them from crimes they didn’t commit, and give them the special protection they require.",Lean Left,1,detroit-free-press,43.46,-5.43
"There is no winner-take-all, though any remaining delegates once the vote is split up go to whoever was the overall winner.",Lean Left,0,detroit-free-press,43.46,-5.43
"That’s the bottom line from Consumer Reports’ eagerly anticipated annual reliability survey, which sounds like an ‘80s tribute act: the top tier, brands credited with excellent or very good reliability, is dominated by Japanese automakers, with a smattering of Europeans and a South Korean.",Lean Left,1,detroit-free-press,43.46,-5.43
"While American conservatism is indisputably rooted in Judeo-Christian social teaching, these concepts are transferable into a broad coalition of people who want to minimize the tyranny of the state.",Lean Left,1,detroit-free-press,43.46,-5.43
"And, we knew tension would be high last week with the Thanksgiving game against the Packers and the college game, Saturday, where Michigan faced Ohio State.",Lean Left,0,detroit-free-press,43.46,-5.43
Two large boxes were positioned on the sidewalk to manage the coils.,Lean Left,0,detroit-free-press,43.46,-5.43
This is the prime minister’s responsibility and moral and ethical duty.,Lean Left,1,detroit-free-press,43.46,-5.43
"Genre: Horror Christmas movies, Funny Christmas movies Horror Christmas movies, Funny Christmas movies Notable Cast: Zach Galligan, Phoebe Cates, Hoyt Axton, Corey Feldman Zach Galligan, Phoebe Cates, Hoyt Axton, Corey Feldman Recommended for: Parents who have been counting down the days until they can introduce the kids to horror.",Lean Left,0,detroit-free-press,43.46,-5.43
"And actually, Clara’s threat was so potent that Henry wound up giving his workers a better deal than either GM or Chrysler.",Lean Left,1,detroit-free-press,43.46,-5.43
"Packed with many never-before-seen photos and other ephemera from the life of artist, this massive collection will knock your socks off.",Lean Left,0,detroit-free-press,43.46,-5.43
"Place chicken breast on top and sprinkle with fresh basil leaves, if desired.",Lean Left,0,detroit-free-press,43.46,-5.43
"In his place is Oregon transfer Kel’el Ware - who, by the way, had an 18-block triple-double for his Arkansas high school - averaging 17.7 points and 9.6 rebounds a game.",Lean Left,0,detroit-free-press,43.46,-5.43
Jackpocket is the official digital lottery courier of the USA TODAY Network.,Lean Left,0,detroit-free-press,43.46,-5.43
"Congress acknowledged that, due to time and resource limitations, not every patent the USPTO grants is high-quality, and that poor-quality patents were being leveraged by patent trolls in wasteful lawsuits.",Lean Left,0,detroit-free-press,43.46,-5.43
"One-and-done style patent review would create a harmful imbalance in which patent trolls would be able to file serial lawsuits, but their targets would only get one chance to defend themselves through patent office review.",Lean Left,1,detroit-free-press,43.46,-5.43
"She portrays Lady Day, alongside Kimmie Horne (as Sarah Vaughan), Thornetta Davis (as Bessie Smith), LadyLove (as Carmen McRae), Denise Edwards (as Lena Horne), Veronique Musique (as Nancy Wilson), Nina Simone Neal (as Dinah Washington), Tosha Owens (as Etta James) and the can’t-believe-she’s-real lightning bolt of Faye Bradford doing an absolutely uncanny performance as Nina Simone.",Lean Left,0,detroit-free-press,43.46,-5.43
"The original location was constructed in 1974 and last updated in 1985, according to a news release.",Lean Left,0,detroit-free-press,43.46,-5.43
"We’d generally prefer not to elevate this sort of absurdity by responding to it, but Greene is playing a dangerous political game, and our communities may be collateral damage.",Lean Left,1,detroit-free-press,43.46,-5.43
"Patent trolls are litigious and prolific Troublingly, patent trolls are responsible for more than half of all U.S. patent litigation.",Lean Left,1,detroit-free-press,43.46,-5.43
"Both groups have ample reason to fear; for each, the threat of racially and religiously motivated violence is all too familiar.",Lean Left,1,detroit-free-press,43.46,-5.43
"The drumline soon begins a processional, winding its way among fans on the concourses, to the tunnel and onto the field, where a pregame performance awaits.",Lean Left,0,detroit-free-press,43.46,-5.43
