text,source_party,label,source,reliability,bias
"Well, when your entire world view is broken down into victim or victimizer, and the crimes of the so-called victims are always excusable, then of course you wouldn't think a little thing like rape by Hamas terrorists is any big deal,"" Gutfeld continued.",Right,1,townhall,24.95,19.79
"There’s a real problem that blue state Dem leaders face when they do what Gavin Newsom wishes in retrospect that he did not do, and it’s the fact that their coddling and caressing of the Regime Media means that they are utterly unprepared for an argument with a competent conservative when there is no Candy Crowley to help the pinko.",Right,1,townhall,24.95,19.79
Such efforts are not new and the roots of this Biden administration practice can be traced to Karl Marx.,Right,1,townhall,24.95,19.79
"Hamas unleashed forces well beyond the borders of Gaza and Israel, and how those forces will shape the future of the Middle East and the West will be seen in the coming years and decades.",Right,1,townhall,24.95,19.79
"Simultaneously, alarms started sounding on the hypocrisy of selecting a nation dependent upon the exportation of massive amounts of fossil fuel to maintain the wealth of the royal families.",Right,1,townhall,24.95,19.79
We’ve seen too many posts showing vile antisemitism and mayhem being committed by these roving legions of neo-Jihadists who are taking over our college campuses and cities.,Right,1,townhall,24.95,19.79
"Because when Syrian civilians were being slaughtered by the Assad government or Uyghurs were being abused by Chinese authorities, they said nothing.",Right,1,townhall,24.95,19.79
"And if the other side is not so evil, then the good guys will not receive a national mandate to fight to win.",Right,1,townhall,24.95,19.79
No wonder there is no mass popular movement for these changes.,Right,1,townhall,24.95,19.79
"Nikki Haley and twice the amount that Trump has, according to a DeSantis campaign official.",Right,0,townhall,24.95,19.79
They have seemingly made the deliberate decision that woke job placement must come before actual talent.,Right,1,townhall,24.95,19.79
"Kristen Walker is a policy analyst for the American Consumer Institute, a nonprofit education and research organization.",Right,0,townhall,24.95,19.79
Apparently Israel is guilty just for being the victims of atrocities inflicted on them by Palestinian terrorists.,Right,1,townhall,24.95,19.79
"While it pains me to say it, this looks more than anything else like a simple case of sour grapes.",Right,1,townhall,24.95,19.79
"With the world distracted by the war in Gaza between Hamas and Israel, Venezuela is opting to set forth its imperialist agenda by annexing a part of neighboring Guyana.",Right,1,townhall,24.95,19.79
"For far too long, American conservatives have been too willing to give a fair hearing to points of view and ideas that are contrary to core American beliefs.",Right,1,townhall,24.95,19.79
"Within the Arab world, innocent Palestinian Arabs: see the United Arab Emirates playing the most negative role (96%), see Saudi Arabia playing the second most negative role (95.5%), see Egypt playing the third most negative role (84.6%) see Jordan playing the fourth negative role (75.6%).",Right,1,townhall,24.95,19.79
"The same can be said of the laws God gave to the Israelites -- most notably, the Ten Commandments, which have provided the foundation for Western society.",Right,1,townhall,24.95,19.79
"It's a sentiment that suggests an evasion of responsibility, an attempt to retreat to the comfort of neutrality and a refusal to acknowledge the stark realities of history.",Right,1,townhall,24.95,19.79
"Ironically, those calling for the wholesale elimination of fossil fuels tend to be the very elites whose carbon footprints dwarf the rest of us.",Right,1,townhall,24.95,19.79
"Two delegations from the U.S. Defense Department are expected to visit Georgetown, Guyana’s capital, in the coming days, he said.",Right,0,townhall,24.95,19.79
"In other words, as color-blind principles became enshrined in law, the thinking went, history’s movement was believed to be on the side of conservatism.",Right,1,townhall,24.95,19.79
"Their ideology denies everything our Founders upheld-fixed, eternal, immutable principles to guide humanity.",Right,1,townhall,24.95,19.79
School officials have become dependent on that stream of money to keep their extensive operations afloat.,Right,1,townhall,24.95,19.79
Perhaps most noteworthy of all is that Kerry appears to have passed gas while participating in a COP28 panel discussion.,Right,1,townhall,24.95,19.79
"Israel, which so greatly values human life that it once infamously bartered over (SET ITAL) 1,000 (END ITAL) terrorists in exchange for captured soldier Gilad Shalit, is all but forced to go along.",Right,1,townhall,24.95,19.79
"In this case, Trump must choose a vice president to help him unravel the destructive policies Biden has ensued on the country.",Right,1,townhall,24.95,19.79
And does any sentient person believe that Hamas or the Islamic Jihad or Muslim Brotherhood proper wouldn't end up rerunning a Palestinian state?,Right,1,townhall,24.95,19.79
"Examples of this type of information include your name, signature, Social Security number, address, telephone number, driver’s license or state identification card number, credit card number or any other financial information, medical information, or health insurance information.",Right,0,townhall,24.95,19.79
"That’s when Congress voted to withhold highway funding from states that did not aggressively enforce a 55-mile per hour speed limit, and similar practices have been happening long before and since the American gas crisis of 50 years ago.",Right,0,townhall,24.95,19.79
"It serially lied about its casualties, expropriating intended relief food and fuel for its underground tunnel city of killers.",Right,1,townhall,24.95,19.79
"But, economists on the eurozone business cycle dating committee use a broader set of data, including employment figures.",Right,0,townhall,24.95,19.79
"Outsourcing, illegal immigration, crime - to the extent the left knew that its own coalition was interested in these issues it dismissed that as the result of ignorance and racism.",Right,1,townhall,24.95,19.79
"Back in the 60s as California’s governor - oh, how far my state has fallen!",Right,1,townhall,24.95,19.79
"Advertisement After facing criticism of their own, however, the pro-Palestinian protestors have learned the importance of anonymous speech when speaking to the media.",Right,1,townhall,24.95,19.79
"Gaffes, fibs, and failure to focus on the security of America.",Right,1,townhall,24.95,19.79
"But the implications of their attack and the numerous videos chronicling the bloodlust and killing orgy may usher in a new Republican president, destroy the university as the hotbed of progressive poison, turn Europe fully against Muslim immigrants, and let Israel deal with its enemies as she has failed to do in decades.",Right,1,townhall,24.95,19.79
They also admitted that a handful had died and returned their bodies.,Right,0,townhall,24.95,19.79
"Fox actually invites leading Democrats on, and MSNBC stopped trying for Republicans, finding it more appealing to their audience to talk about them, not to them.",Right,1,townhall,24.95,19.79
"His work has appeared in National Review, the Wall Street Journal, Washington Post, Reason, New York Post and numerous other publications.",Right,0,townhall,24.95,19.79
"Did anyone complain about that when Hamas was building its tunnels, they did so at the expense of proper sewage, making Gaza a teeming environmental and health disaster?",Right,1,townhall,24.95,19.79
Puller allowed the punishment to go through but also made the Second Lieutenant return every salute.,Right,0,townhall,24.95,19.79
A similar situation is unfolding in Chicago where hundreds of demonstrators gathered last month to protest the city’s extravagant spending on housing for illegal aliens.,Right,1,townhall,24.95,19.79
"The same climate policies crippling Europe are infiltrating our state and federal rule books, proving that they are just as destructive here as abroad.",Right,1,townhall,24.95,19.79
They also declared that Brazil will join the bloc in January.,Right,0,townhall,24.95,19.79
"Advertisement Conservatives should promote, encourage, believe in, and be willing to go the distance for a color-blind America.",Right,1,townhall,24.95,19.79
The thing about chasing power for its own sake is there is finish line.,Right,1,townhall,24.95,19.79
"The truly nefarious aspect of this profiteering is, those who engage in it know the truth.",Right,1,townhall,24.95,19.79
Advertisement Hedge funds buying up housing is creating a nation of 21st century serfs.,Right,1,townhall,24.95,19.79
"Remains were discovered, but police are confident the body is that of Mr. Yoo, who had a string of bizarre social media posts.",Right,0,townhall,24.95,19.79
The Congressional Budget Office now projects average growth over the next 30 years at 1.6% per year.,Right,0,townhall,24.95,19.79
"Advertisement What really sticks out about Kerry's remarks is how much of a hypocrite he is, and that really came through with the particularly memorable moments he had.",Right,1,townhall,24.95,19.79
"Suicide Bombing in Israel, March 27, 2002: A suicide bombing in a noted restaurant in Netanya, Israel, killed 22 persons and wounded 140.",Right,0,townhall,24.95,19.79
"Conservatives are regularly smeared as racist or homophobic, criticized on social media for old and benign activities that became offensive overnight, and targeted by aggressive mobs that wish to destroy their personal and professional lives in any way they can.",Right,1,townhall,24.95,19.79
"But every night for the past six weeks we have been treated to some news host, or even Kamala Harris, demanding that Israel be more careful and invent bullets and bombs that can only kill card-carrying Hamas members.",Right,1,townhall,24.95,19.79
More troubling though is that regulators within the Biden administration are pursuing policies that would slow supply chains and increase the cost of goods.,Right,1,townhall,24.95,19.79
"It won’t be enough, but Spicer added that this was probably Christie’s best debate.",Right,1,townhall,24.95,19.79
"We walked through downtown Jerusalem-Jaffa Street, turning onto King George Street.",Right,0,townhall,24.95,19.79
"And so, the carnage on the highways continues to his day.",Right,1,townhall,24.95,19.79
The hysteria seen in the media reactions to this have been nothing short of hilarious.,Right,1,townhall,24.95,19.79
"Voters who aren’t high on Biden are just too dumb, according to her.",Right,1,townhall,24.95,19.79
"Joe Scarborough came out with his own Hitler blather, stipulating that Trump will imprison whomever he chooses and then execute them.",Right,1,townhall,24.95,19.79
Some people came and said that they would take care of him.,Right,0,townhall,24.95,19.79
"Gavin Newsom claims to have no interest in running for president, but you’d never guess that by his actions.",Right,1,townhall,24.95,19.79
"The quotable Munger would let Buffet be the face of Berkshire Hathaway and the voice, but behind the scenes was known to talk at length, mentor many and grow wealth.",Right,0,townhall,24.95,19.79
Anything less than an unmitigated Israeli victory in Gaza would be catastrophic.,Right,1,townhall,24.95,19.79
"Unless permitted by the CCPA, we will not: Deny you goods or services.",Right,0,townhall,24.95,19.79
"It was not intentional, but Ramaswamy and Ron DeSantis’ attacks on Haley and her subsequent responses led to Mr. Christie being left out.",Right,0,townhall,24.95,19.79
"Not a peep then, and it should stay that way now.",Right,1,townhall,24.95,19.79
"Prior to this, Dorr was Chief Marketing Officer for 45th President Donald J. Trump’s re-election campaign.",Right,0,townhall,24.95,19.79
"If we sold or disclosed your personal information for a business purpose, two separate lists disclosing: sales, identifying the personal information categories that each category of recipient purchased; and disclosures for a business purpose, identifying the personal information categories that each category of recipient obtained.",Right,0,townhall,24.95,19.79
KTNV Las Vegas has more: We are responding to preliminary reports of an on the campus of UNLV near BEAM Hall.,Right,0,townhall,24.95,19.79
Here’s What Happened When the Oakland City Council Tried Passing a Resolution Calling for a Ceasefire The Oakland City Council in California attempted to pass a resolution calling for a ceasefire between Israel and Hamas.,Right,0,townhall,24.95,19.79
"The US gives nearly $20 billion a year to the UN, perpetuating its anti-American agenda.",Right,1,townhall,24.95,19.79
"And there are many single parents who are doing their best, and doing well, to raise children of virtue and honor.",Right,0,townhall,24.95,19.79
"However, in the resolution was a line condemning Hamas, which dozens of residents deemed unacceptable.",Right,0,townhall,24.95,19.79
Bump is here to inform you that the city should not be covered in all brown like it is because the markers are actually larger than the size of the crap itself!,Right,1,townhall,24.95,19.79
Biden set the tone in his first month in office by buckling to pressure from humanitarian groups to reverse President Trump's designation of the Houthis as a foreign terrorist organization.,Right,1,townhall,24.95,19.79
And it is a lesson for Republicans of every stripe across the country.,Right,0,townhall,24.95,19.79
Yet a recent study shows freight shipping is significantly more competitive today than in the past.,Right,0,townhall,24.95,19.79
Carlos Machado was 15 years old in 1963 when the bullets from the firing squad shattered his body.,Right,0,townhall,24.95,19.79
"Of course, one can look at the news, see the corruption and the internal decay in some of our institutions and reasonably understand why individual Americans may not have much interest in serving a higher purpose.",Right,1,townhall,24.95,19.79
"Re-regulatory policies under consideration would allow for stricter control over what services rail freight providers must offer, the prices for those services, and how freight rail equipment is deployed to serve their contracts.",Right,0,townhall,24.95,19.79
The nihilistic abolish cult isn’t interested in the hard work required to regain some semblance of a democratic republic.,Right,1,townhall,24.95,19.79
"Non-Stop Mayhem Direct from the U.S State Department: an exceedingly tiny sample of attacks from the years when today’s college juniors, seniors, and grad students were born: Suicide Bombing in Israel, March 4, 2001: A suicide bomb attack in Netanya killed three persons and wounded 65.",Right,1,townhall,24.95,19.79
"Hamas claimed responsibility Suicide Bombing in Afula, May 19, 2003: A suicide bomb attack by a female Palestinian student killed three persons and wounded 52 at a shopping mall.",Right,0,townhall,24.95,19.79
How many future Yahya Sinwars have already been freed this go-around?,Right,1,townhall,24.95,19.79
"Again, Trump was rarely, if ever, ahead in many of those races not just in 2020 but in 2016 as well.",Right,1,townhall,24.95,19.79
But Marxists are only interested in using believers until they come to power -- after which their religious allies are disposable.,Right,1,townhall,24.95,19.79
"Rules for Fools Today, in continuing to appease our enemies, Antony Blinken is pushing for a two-state solution between Israel and Palestine - an old and questionable approach.",Right,1,townhall,24.95,19.79
Why Is Everyone Acting Shocked by This Moment From Fox News' Trump Town Hall?,Right,1,townhall,24.95,19.79
The categories of third parties with whom we share that personal information.,Right,0,townhall,24.95,19.79
"When the Israeli Defense Forces struck back, the killers dispersed to the safety of their multibillion-dollar subterranean cities.",Right,1,townhall,24.95,19.79
"And, as destructive forces seek to incessantly deconstruct our culture and to marginalize the exceptional aspects and feats of our nation, it’s easy to lose morale and hope.",Right,1,townhall,24.95,19.79
"That is precisely the opposite of their job, particularly when it comes to national security: Foreign policy ought to be the preserve of cold-eyed men and women capable of making hard but correct decisions.",Right,1,townhall,24.95,19.79
"Three years earlier, in a July 2020 article in The Guardian called ""Why do Muslim States Stay Silent Over China's Abuse of the Uighurs?",Right,1,townhall,24.95,19.79
"As House Oversight Committee Chairman James Comer (R-KY) quickly reminded the first son, though, he is expected to appear for a closed-door testimony, per a subpoena he received on November 8.",Right,1,townhall,24.95,19.79
"Any move Israel makes that could cripple Hamas or deliver a knockout blow is met with condemnation from the international community, many of which remain silent or willfully ignorant of Hamas’ war crimes and atrocities carried out on October 7.",Right,1,townhall,24.95,19.79
But this flight instinct seems not to apply to the sounds of approaching cars or trucks.,Right,0,townhall,24.95,19.79
"We need more of these DeSantis/Newsom debates, and we need Trump and Biden to have the courage to show up to primary debates, if only so they can’t use it as part of an argument against debating each other should they end up being the nominees.",Right,1,townhall,24.95,19.79
"Sorry, while we do not wish for human suffering, the Palestinians have brought upon themselves everything they are currently suffering.",Right,1,townhall,24.95,19.79
"Instead of wasting money fighting useless wars around the world and worrying about nonsense such as climate change, it needs to be protecting the freedoms of its own people from barbarians, and trying to build a virtuous citizenship.",Right,1,townhall,24.95,19.79
"This is the claim of simpleton Thomas Friedman, august foreign policy columnist for the execrable New York Times, who has never met an Israeli concession he didn't like.",Right,1,townhall,24.95,19.79
"The private sector, and not the regulator, is better situated to judge their own capacity, capabilities, and needs of their customers seeking products and services.",Right,0,townhall,24.95,19.79
"Norman Lear, the critically acclaimed creator of some of Americans' favorite TV shows, died Tuesday evening at the age of 101 at his home in Los Angeles, according to a statement from his family.",Right,0,townhall,24.95,19.79
"Despite how close we are to the primary season and the general election, the report highlights how Cheney is still thinking about a run: Given her appeal to independents, former Republicans and some Democrats, many Trump critics in both parties have noted that a presidential run by Cheney could undercut her stated goal of defeating Trump, because it could draw some votes away from President Biden.",Right,0,townhall,24.95,19.79
Or for compromising civilian structures by building these tunnels underneath them and making their inhabitants human shields?,Right,1,townhall,24.95,19.79
Advertisement Ms. Crockett went on a tirade about how elected representatives from Florida and Texas keep derailing the country with their toxic ideas about being pro-liberty.,Right,1,townhall,24.95,19.79
"In their refusal to discriminate among potential victims, the Castroites were well ahead of the Taliban.",Right,1,townhall,24.95,19.79
"It will also force new and streamlined administrations to focus on the disciplines clearly needed in society: STEM certainly, medicine, the law, and other specialties.",Right,1,townhall,24.95,19.79
Several Arab states have made peace with Israel since his tenure.,Right,0,townhall,24.95,19.79
Riley Gaines’ Fiery Exchange With Democrat Rep Who Claimed She’s ‘Transphobic’,Right,1,townhall,24.95,19.79
"Before arrival of the Europeans settlers, who eradicated the gray wolf, deer numbers were held in check by natural predation.",Right,0,townhall,24.95,19.79
"Instead of withdrawing and taking time to recover, as the Democrat clearly wasn't healthy enough to represent the people of Pennsylvania, he stayed in the race.",Right,1,townhall,24.95,19.79
What protestors are furious about is that Israel is more effective at being disproportionate in retaliation than Hamas and its Iranian supporters were in their preemptive mass murdering.,Right,1,townhall,24.95,19.79
Please avoid the area and we will have more information soon.,Right,0,townhall,24.95,19.79
"Yet now, prodded by a radical Left-wing legacy media and young, daft staffers, he seems to be wavering.",Right,1,townhall,24.95,19.79
"For data portability requests, we will select a format to provide your personal information that is readily useable and should allow you to transmit the information from one entity to another entity without hindrance.",Right,0,townhall,24.95,19.79
Newsweek’s Headline About Trump’s Reception at a Football Game Isn’t Quite Right Newsweek was way too excited to report on Trump’s supposedly cold reception at a South Carolina football game.,Right,1,townhall,24.95,19.79
The Cornell study reviewed other methods to discourage deer from entering roadways-each proved of very limited utility.,Right,0,townhall,24.95,19.79
"Choosing the most confused, incompetent, and foolish among Joe Biden's cabinet secretaries is difficult.",Right,1,townhall,24.95,19.79
"Instead, the Pope should be focused on saving the souls of the faithful, growing Church attendance and donations for worldwide missions, dealing with the damaging pedophilia scandal, and recruiting devout people to join the clergy and laity to ensure the future survival of the Catholic Church.",Right,1,townhall,24.95,19.79
The 45th president holds more than half of the voter's support; there is a 50-point gap between Trump and DeSantis.,Right,0,townhall,24.95,19.79
There are currently various independent branches of the party in the country’s individual regions.,Right,0,townhall,24.95,19.79
"Sinema has other 100 percent records, as well: with the NEA, Planned Parenthood, and the ACLU.",Right,0,townhall,24.95,19.79
And making little girls compete with boys who then physically dominate them and injure them is abusive and evil.,Right,1,townhall,24.95,19.79
"My plan is that it be loaded on barges, and dumped into Gaza’s Mediterranean coast, to build an island, that can be used for new housing, business, and more, adding waterfront space, and opportunities for prosperity: literally building a new Gaza on the rubble of the old Gaza.",Right,1,townhall,24.95,19.79
"Maybe they’ll eventually be invited to leave, but not without a gold parachute and another job - high-paying board seats or other no-show jobs rich leftists invented to fund each other.",Right,1,townhall,24.95,19.79
"An Israeli medic said: ""There was a liquid on her back that looked like semen.",Right,0,townhall,24.95,19.79
Consumers know that the same cannot be said for charging EVs.,Right,0,townhall,24.95,19.79
"We take for granted the fact that fossil fuels have revolutionized how we travel, making it far more affordable and safer to traverse vast distances in short periods.",Right,0,townhall,24.95,19.79
"In a statement about the legislation, Newsom attacked states like Florida, where parental rights are protected.",Right,1,townhall,24.95,19.79
"Please David, tell us more about the disrespect and classlessness of a former 1st Lady wearing a grey coat over a black dress to the funeral of another 1st Lady.",Right,1,townhall,24.95,19.79
"Out of this mess, Adam Schiff rises to the top in the race for the open Senate seat.",Right,1,townhall,24.95,19.79
"Being a slave to lust and licentiousness, or any vice, is not freedom.",Right,1,townhall,24.95,19.79
It was the object balanced on the knee of the girl behind Thunberg.,Right,0,townhall,24.95,19.79
"That's hundreds of articles a day from your favorite conservative authors, plus a treasure trove of VIP members-only articles, podcasts, and more.",Right,1,townhall,24.95,19.79
There are many conflicting reports related to details of the attack.,Right,0,townhall,24.95,19.79
For the record-and demonstrating the ignorance of the Secretaries (and the administration for which they work)-Israel has had civilian protection plans in place.,Right,1,townhall,24.95,19.79
"If Israel follows through with its promise to wipe out Hamas and its leaders worldwide, the event may be a turning point for Israel in destroying its non-state enemies who have attacked her from well before the founding of the country in 1948.",Right,1,townhall,24.95,19.79
But it’s bad news for the OPEC+ coalition countries whose oil income props up their economies.,Right,1,townhall,24.95,19.79
"He deeply loved our country and spent a lifetime helping to preserve its founding ideals of justice and equality for all,"" Lear's family emphasized.",Right,0,townhall,24.95,19.79
"The results must be a wake-up call for Israel, the broader world (even the antisemites for whom these facts are an inconvenient truth), and anyone in the international community who truly seeks peace in the Middle East.",Right,1,townhall,24.95,19.79
But there can be no common cause between those who believe in God and those who hate Him.,Right,1,townhall,24.95,19.79
"The civil rights movement was pivotal in laying the groundwork for equal, color-blind protection before the law, ensuring that black Americans not be judged by the color of their skin but rather by the content of their character.",Right,0,townhall,24.95,19.79
"He looks like South Park’s Mr. Mackey come to life, only more earnest in his BS.",Right,1,townhall,24.95,19.79
"Yeah, he’s had some fails, like his COVID nonsense, but an actual conservative should be thrilled to have another Trump presidency compared with another term of the pinko freaknik that is the Biden show.",Right,1,townhall,24.95,19.79
