text,source_party,label,source,reliability,bias
In lieu of the canned soup is a homemade white sauce that takes 10 minutes to prepare.,Lean Left,0,san-diego-union-tribune,45.68,-1.76
"And his fashion shows were triumphant, bursting the bubble of industry navel-gazing to say something about the world we live in: a snowstorm in a globe in March 2022 at the outset of Russia’s invasion of Ukraine, a red carpet that functioned as the show in the fall of 2021, underscoring fashion’s engulfment into entertainment years before other designers started bemoaning the world’s emphasis on celebrity.",Lean Left,1,washington-post,38.8,-6.85
"Whatever the argument, many people in higher education say U.S. News forces schools to share its arbitrary values or suffer the reputational consequences.",Lean Left,1,washington-post,38.8,-6.85
"By one count, you’re more likely to die falling into a hole at the beach, in a riptide or in an alligator attack than you are from a shark bite, The Washington Post’s Teddy Amenabar reported.",Lean Left,0,washington-post,38.8,-6.85
"He was accused of selling military secrets to Germany, France’s hated foe, in a case marked by faked evidence and an explosion of antisemitism sparked by rage over Jews’ supposed disloyalty to France.",Lean Left,1,washington-post,38.8,-6.85
Then a pair of advertisements led many to accuse the brand of the exploitation of children and even the celebration of child pornography.,Lean Left,1,washington-post,38.8,-6.85
"Advertisement In Munich, hundreds of flights have been canceled daily since late last week because of the snow.",Lean Left,0,washington-post,38.8,-6.85
"STEFANIK: And you understand that the use of the term intifada in the context of the Israeli-Arab conflict is indeed a call for violent armed resistance against the state of Israel, including violence against civilians and the genocide of Jews.",Lean Left,1,washington-post,38.8,-6.85
"GAY: I’ve heard that thoughtless, reckless and hateful language on our campus.",Lean Left,1,washington-post,38.8,-6.85
"The disgraced ex-congressman debuted Monday on Cameo, the video-sharing platform where users can commission a personalized message from actors, athletes and varying grades of celebrities.",Lean Left,0,washington-post,38.8,-6.85
"Additionally, many autistic folks consider autism to be a part of their identity; that’s something your child should be able to embrace for themself.",Lean Left,1,washington-post,38.8,-6.85
"Share this article Share MAGILL: If it is directed and severe, pervasive, it is harassment.",Lean Left,1,washington-post,38.8,-6.85
"He noted that Trump, who continues to falsely deny that he lost the 2020 election, did not attend Biden’s inauguration, saying Trump was the first president to skip the inauguration of his successor.",Lean Left,1,washington-post,38.8,-6.85
"That worked with his Triple S sneakers, but the amplification of the shoes here looks like gratuitous desperation.",Lean Left,1,washington-post,38.8,-6.85
But other parts of Biden’s track record on prices are not exactly great.,Lean Left,1,washington-post,38.8,-6.85
THE FUSE ON AMERICA'S DEBT BOMB JUST GOT SHORTER More - and better - victories are possible.,Lean Right,1,fox-business,38.81,9.11
"CLICK HERE TO READ MORE ON FOX BUSINESS At the end of the press conference, an international reporter asked Kelce about his relationship with Swift.",Lean Right,0,fox-business,38.81,9.11
"Billions of dollars of shareholder value have been razed, and it's all due to the decisions made by the top leaders of the company,"" Frericks criticized.",Lean Right,1,fox-business,38.81,9.11
"It also cannot be used for someone other than the Prime Student member, StudentUniverse said.",Lean Right,0,fox-business,38.81,9.11
"Whole Foods, founded more than four decades ago, has belonged to Amazon since 2017, when the tech company spent about $13.7 billion to acquire it.",Lean Right,0,fox-business,38.81,9.11
"To have this administration slap us in the face by providing China and Russia with $1.6 billion while we're suffering right here at home... last week alone, we were in Oklahoma trying to save a family farmer there.",Lean Right,1,fox-business,38.81,9.11
Communities of color would also be disproportionately impacted by the new reporting requirement.,Lean Right,1,fox-business,38.81,9.11
"Freddie Mac reported that rates on the popular 30-year fixed mortgage are hovering around 7.09%, well above the 5.13% rate recorded one year ago and the pre-pandemic average of 3.9%.",Lean Right,0,fox-business,38.81,9.11
CLICK HERE TO READ MORE ON FOX BUSINESS Vergara previously listed the Beverly Hills home in June 2023 for $18 million.,Lean Right,0,fox-business,38.81,9.11
"Davis has been coaching college football since 2017 and, as a former D1 athlete, has had many an opportunity to witness a booze-induced scuffle.",Lean Right,0,fox-business,38.81,9.11
"And as the nation grapples with stubborn inflation and recession woes , many Americans say they can't rely on Social Security any longer.",Lean Right,1,fox-business,38.81,9.11
"A solid job market and big wage increases have helped to buoy consumer spending in recent months, despite high inflation.",Lean Right,0,fox-business,38.81,9.11
Saudi Arabia first began scaling back output in July and has extended the production cut three times so far.,Lean Right,0,fox-business,38.81,9.11
"Currently, 98.8% of market participants expect policymakers to keep rates as is, according to the CME’s FedWatch Tool.",Lean Right,0,fox-business,38.81,9.11
CLICK HERE TO SIGN UP FOR OUR LIFESTYLE NEWSLETTER Fox News Digital reached out to Burn Boot Camp for further comment.,Lean Right,0,fox-business,38.81,9.11
"The Cottage House, made up of three bedrooms and two-and-a-half baths, is a whimsical build that arguably looks as though it came out of a movie.",Lean Right,0,fox-business,38.81,9.11
"It now takes over a fifth of all government revenues just to pay the interest, and the problem is quickly spiraling out of control.",Lean Right,1,fox-business,38.81,9.11
It would be Exxon’s largest deal since its $75 billion merger with Mobil in the late 1990s.,Lean Right,0,fox-business,38.81,9.11
"RCH is not, and will not be, deterred by baseless threats, and emphatically rejects Ms. Vergara’s conjured-up, belated and convenient accusations.",Lean Right,1,fox-business,38.81,9.11
"Employers don't value college degrees as much as originally thought, recent survey data shows, and the disdain is behind a restored appreciation for blue-collar job-seekers that bring skill and experience over education.",Lean Right,1,fox-business,38.81,9.11
"That will load the energy system a lot, and there will be a collapse.",Lean Right,1,fox-business,38.81,9.11
Varney Latest Clips Stuart Varney takes over the critical market-open coverage with Varney & Co. (9-12PM/ET).,Lean Right,0,fox-business,38.81,9.11
"2023 HOUSING MARKET PROJECTED TO HAVE FEWEST SALES SINCE 2008 AS MORTGAGE RATES RISE Joy McVicker, who is moving to Denver from Washington state, said it has been a very different shopping experience from when she bought her first home in 2020.",Lean Right,0,fox-business,38.81,9.11
"However, the alert comes after the Biden administration released updated guidance last week aimed at helping automakers and consumers determine which electric vehicles (EV) are eligible for tax credits under the 2022 Inflation Reduction Act (IRA).",Lean Right,0,fox-business,38.81,9.11
"Their first cruise ship, Margaritaville at Sea Paradise, currently sails from Port of Palm Beach in South Florida, and takes guests on a three-night sail to the Bahamas.",Lean Right,0,fox-business,38.81,9.11
Ultralow mortgage-interest rates and a need for more space to work from home have driven robust home-buying demand in the past year and a half.,Lean Right,0,fox-business,38.81,9.11
"Instead, the Biden administration and its big-spender allies in Congress have institutionalized multitrillion-dollar deficits, embedding the problem firmly into the fabric of federal finance.",Lean Right,1,fox-business,38.81,9.11
The debt has exploded past $33.7 trillion with interest on the debt exceeding $1 trillion annually - and rising fast.,Lean Right,1,fox-business,38.81,9.11
"And while the former president flipped burgers for, and tossed around footballs with, Hawkeyes and Cyclones fans in early September at the annual Cy-Hawk Iowa-Iowa State rivalry game, many tailgaters are used to a much more rowdy time.",Lean Right,1,fox-business,38.81,9.11
"The MCT index peaked at 5.44% in June 2022, and the October reading closely matched the six-month trend of the personal consumption expenditures index - the Fed’s preferred inflation gauge - which stood at a 2.5% rise in October.",Lean Right,0,fox-business,38.81,9.11
"At a press conference in Frankfurt, Germany, Friday, Kelce wouldn't confirm whether Swift would attend his international game Sunday against the Miami Dolphins.",Lean Right,0,fox-business,38.81,9.11
"The property is conveniently located within an hour of the coast - with access to several southern waterways in states like Florida, Louisiana and Mississippi.",Lean Right,0,fox-business,38.81,9.11
The items can be sent to either the user or someone else.,Lean Right,0,fox-business,38.81,9.11
"A separate law enforcement investigation in 2022, conducted by Detective Scott Schaefer, found that Siegle used little to no funds from Weinberg's down payment to work on restoring his vehicle, but instead paid off credit card debts and made deposits to personal accounts.",Lean Right,0,fox-business,38.81,9.11
"There is no transaction minimum, so a person could be one used treadmill away from new red tape and tax headaches.",Lean Right,1,fox-business,38.81,9.11
While dominance in hockey and basketball have allowed Boston to claim the No.,Lean Right,0,fox-business,38.81,9.11
The stamp that sold on Wednesday is from Position 49 on the sheet and Siegel auctioneers said the stamp is the finest Inverted Jenny in existence.,Lean Right,0,fox-business,38.81,9.11
"The purchase comes after Kelce signed a four-year, $57 million extension with the Chiefs prior to the 2020 season.",Lean Right,0,fox-business,38.81,9.11
"This Small Business Saturday, please shop at every Main Street store you can.",Lean Right,0,fox-business,38.81,9.11
"The burden is disproportionately borne by low-income Americans, whose already-stretched paychecks are heavily affected by price fluctuations.",Lean Right,1,fox-business,38.81,9.11
Gadot called on women and allies of women to speak up as Hamas still has women held hostage.,Lean Right,1,fox-business,38.81,9.11
"The election is less than a year away, and the president's advisers know Joe Biden is likely to lose.",Lean Right,1,fox-business,38.81,9.11
"We have an opportunity now to respond, but we have to do it quickly,"" Cramer said.",Lean Right,0,fox-business,38.81,9.11
The A.I.provides in-cab audible coaching to a driver by analyzing the cab-facing and road-facing cameras in real-time and sends instant alerts to the company's headquarters.,Lean Right,0,fox-business,38.81,9.11
China today is looking for a similar opening and the Biden administration’s financial depletion of the U.S. will make any cyber warfare from Chinese state actors more effective.,Lean Right,1,fox-business,38.81,9.11
Internal DeLorean documentation indicates the car was first delivered to early DeLorean investor and comedian Johnny Carson.,Lean Right,0,fox-business,38.81,9.11
Mayor Eric Adams has cut police and school funding to pay for the migrant surge.,Lean Right,1,fox-business,38.81,9.11
"Joseph Emerson, who was charged with attempted murder, also told investigators he had become depressed six months prior to the October incident, which reignited a crucial conversation regarding mental health in the industry.",Lean Right,0,fox-business,38.81,9.11
"Her appointment came after the firing of CEO Mark Tritton, following a sales slump and an unsuccessful move into private-label products.",Lean Right,0,fox-business,38.81,9.11
"Weinberg hired an expert, Pierre Hedary, who found significant rust and evidence that the car had been in an accident and several other major problems.",Lean Right,0,fox-business,38.81,9.11
"In fact, late Boomers’ retirement savings seemed to be on track prior to the recession.",Lean Right,0,fox-business,38.81,9.11
"Double-tap to switch tools and wireless pairing and charging aren’t built into it, either.",Lean Right,0,fox-business,38.81,9.11
"Yankees officials counter that all they were doing was codifying guarantees in the earlier agreement, and in the term sheet, albeit at a lower number of spaces.",Lean Right,0,fox-business,38.81,9.11
"There's your fiscal and monetary inflation, which unfortunately has washed out much of the productivity and wage gains of the Trump Tax and Jobs Act of 2017.",Lean Right,1,fox-business,38.81,9.11
GET FOX BUSINESS ON THE GO BY CLICKING HERE The poll found that 77% percent of Americans surveyed support increased military spending.,Lean Right,0,fox-business,38.81,9.11
We’re capable of running a very responsible mining program and a very safe mining program.,Lean Right,0,fox-business,38.81,9.11
Luskin argued the economy has already felt the effects of the rate hike campaign and claimed signs point to coming deflation.,Lean Right,1,fox-business,38.81,9.11
"Mark Cuban, the billionaire owner of the NBA’s Dallas Mavericks, will reportedly sell a majority stake in the team to billionaire Miriam Adelson, widow of late businessman Sheldon Adelson, according to multiple reports.",Lean Right,0,fox-business,38.81,9.11
Taylor Swift might not be the only musically gifted artist in her relationship with Travis Kelce.,Lean Right,0,fox-business,38.81,9.11
THE FED IS LIKELY DONE WITH INTEREST RATE HIKES: M.B.A. FORECAST Confidence among builders in the U.S. housing market plunged for the third straight month in October as a spike in mortgage rates continued to weigh on consumer demand for new homes.,Lean Right,1,fox-business,38.81,9.11
Check your credit report: Look at your credit report to ensure there are no errors on it.,Lean Right,0,fox-business,38.81,9.11
That resulted in a combined adjusted Ebitda loss of $169 million across all of Zillow.,Lean Right,0,fox-business,38.81,9.11
"But Republicans could also go even further, increasing the age range for work requirements while including more able-bodied adults, including those who are more able to work because they don’t have young kids.",Lean Right,1,fox-business,38.81,9.11
"Despite ICBC’s size, the part of the bank that handles Treasuries only has about $23 billion in total assets, just a small portion of which would’ve even been available for purchasing new Treasuries last Thursday.",Lean Right,0,fox-business,38.81,9.11
"Instead, it features coconut oil powder and fava bean protein, according to reports.",Lean Right,0,fox-business,38.81,9.11
"DONALD TRUMP TAILGATES BEFORE IOWA-IOWA STATE GAME, CROWD GOES CRAZY AS HE WALKS INTO STADIUM The University of Texas at Austin, University of Minnesota and West Virginia University (WVU) have been known to sell alcohol stadium-wide for years.",Lean Right,0,fox-business,38.81,9.11
"In the past, teams featured would wear a World Series patch, but both teams are missing it on their players' sleeves this season.",Lean Right,0,fox-business,38.81,9.11
"ON THIS DAY IN HISTORY, NOV. 21, 1864, ABRAHAM LINCOLN ‘PENS’ LETTER TO MRS. BIXBY RR Auction executive vice president Bobby Livingston told Fox News Digital that these tickets are an important time stamp in history.",Lean Right,0,fox-business,38.81,9.11
The dictator Maduro promised to reinstate opposition candidates in time for elections next year.,Lean Right,1,fox-business,38.81,9.11
"190), the Blocking the Adverse and Dramatic Increased Reliance on Surveillance (BAD IRS) Activities Act (S. 123), the Stop the Nosy Obsession with Online Payments (SNOOP) Act of 2023 (H.R.",Lean Right,0,fox-business,38.81,9.11
"Fannie Mae expects mortgage rates to decline gradually over the next two years, reaching 6.9% for the 30-year mortgage by 2025.",Lean Right,0,fox-business,38.81,9.11
"Taxpayers will be on the hook for trillions of additional dollars, regardless of the collection method.",Lean Right,1,fox-business,38.81,9.11
"The underlying inflation pressures hitting U.S. consumers eased in October compared to September, according to a new report released by the Federal Reserve Bank of New York on Monday.",Lean Right,0,fox-business,38.81,9.11
"So, I'm just going to keep that to myself,"" he told reporters in a video shared by Entertainment Tonight on X, formerly Twitter.",Lean Right,0,fox-business,38.81,9.11
"The rideshare company on Tuesday announced its exclusive holiday offerings, which are available for booking through December via the Uber and Uber Eats apps.",Lean Right,0,fox-business,38.81,9.11
The Powerball jackpot came to its current level - an estimated $435 million - after its most recent drawing on Monday evening brought no grand prize winner.,Lean Right,0,fox-business,38.81,9.11
"Taking on student loan debt can run on average $35,000 annually or $140,000 over four years for an undergraduate degree, so socking money away tax-free in a 529 plan can be a good option.",Lean Right,1,fox-business,38.81,9.11
Fire marshals in New York City have arrested a Brooklyn man who allegedly set a house on fire with a family of tenants inside - after they reportedly stopped paying rent and refused to move out.,Lean Right,0,fox-business,38.81,9.11
Uber One members can also enjoy free package returns through the first week of January.,Lean Right,0,fox-business,38.81,9.11
They bore the brunt of many COVID closure mandates and did not receive nearly enough compensation through the flawed PPP program and other efforts to compensate for the damage inflicted upon them.,Lean Right,1,fox-business,38.81,9.11
"GEORGIA FOOTBALL FANS SHARE THEIR FAVORITES Let’s say 60,000 fans attend a home WVU football game.",Lean Right,0,fox-business,38.81,9.11
"US farmer tears into Biden administration over China, Russia payment claims: ‘A real slap in the face’",Lean Right,1,fox-business,38.81,9.11
"CLICK HERE TO GET THE FOX NEWS APP Vacancy rates are only going up in the DMV and this means that tenant-landlord conversations are no longer like an annual review or doctor check-up, where the payer winces in anticipation at the bad news and uncomfortable experience.",Lean Right,1,fox-business,38.81,9.11
"The Fed has raised interest rates sharply over the past year, approving 11 rate increases in the hopes of crushing inflation and cooling the economy.",Lean Right,1,fox-business,38.81,9.11
"Then a big chunk of the rest of his time is spent talking one-on-one, either on the telephone or personally, with highly gifted people whom he trusts and who trust him.",Lean Right,0,fox-business,38.81,9.11
"A nearly 20,000-square-foot castle-like mansion in Texas, complete with 12 turrets and hidden rooms, hit the market this week for $5 million.",Lean Right,0,fox-business,38.81,9.11
"Criminals are tricking victims into thinking they’re talking to a relative who may need money for reasons like paying for damages from a car accident, or paying ransom for a kidnapping.",Lean Right,1,fox-business,38.81,9.11
Can Republicans finally find a strategy to cut spending and kickstart the economy?,Lean Right,0,fox-business,38.81,9.11
"Image 1 of 5 PMG is joined by S2 Development, a South Florida developer, Greybrook, a Canadian private equity firm,, Mohari Hospitality, a global investment platform in the luxury lifestyle sector, and Waldorf Astoria’s parent company, Hilton Worldwide.",Lean Right,0,fox-business,38.81,9.11
"That’s significantly more than the debt ceiling deal, which set much more generous limits on spending for a mere two years.",Lean Right,1,fox-business,38.81,9.11
The Maud Foster Windmill is over 200 years old - and dominates the skyline over the Lincolnshire market town of Boston in the U.K.,Lean Right,0,fox-business,38.81,9.11
"Federal Reserve Chair Jerome Powell on Friday kept the possibility of another interest rate hike in play this year, despite cooling inflation.",Lean Right,0,fox-business,38.81,9.11
"Raising interest rates tends to slow economic activity and dampen the labor market, although both have avoided significant declines despite the rate hikes to date.",Lean Right,0,fox-business,38.81,9.11
Four male victims in their 20s and a 19-year-old female victim all suffered non-life-threatening injuries.,Lean Right,0,fox-business,38.81,9.11
"Because lenders use different methods to evaluate borrowers, it’s a good idea to request personal loan rates from multiple lenders so you can compare your options.",Lean Right,0,fox-business,38.81,9.11
Bob Iger recently talked candidly about some of Disney’s lackluster box office performances and the entertainment giant’s output.,Lean Right,0,fox-business,38.81,9.11
"It is the first casino to open in Las Vegas since Resorts World, a $4.3 billion project that opened on the strip in 2021.",Lean Right,0,fox-business,38.81,9.11
The agencies annually investigate about 2% to 3% of the deals that are large enough to require reporting to the government.,Lean Right,0,fox-business,38.81,9.11
"Its chief financial officer, Gustavo Arnal, jumped to his death from a Tribeca skyscraper this month.",Lean Right,0,fox-business,38.81,9.11
"With student loan payments set to resume in October after President Joe Biden’s pandemic pause, roughly 30 million Americans will have less discretionary income, perhaps as much as $300 less per month, according to estimates.",Lean Right,0,fox-business,38.81,9.11
An online marketplace like Credible can help you compare your options.,Lean Right,0,fox-business,38.81,9.11
He's now insisting that his dangerously high-interest rates are not transitory.,Lean Right,1,fox-business,38.81,9.11
"These may include elevator fees, service fees for paying your rent and other such charges and add-ons.",Lean Right,0,fox-business,38.81,9.11
"They're the ones that are sometimes having some issues with some of the safety features.""",Lean Right,1,fox-business,38.81,9.11
"Under Speaker Johnson’s leadership, Republicans should instead unite around the commonsense conservative reforms they already support - and Americans need.",Lean Right,1,fox-business,38.81,9.11
"The report also indicated that layoffs were largely unchanged last month, hovering around 1.55 million.",Lean Right,0,fox-business,38.81,9.11
"Other famous pizzerias that could be affected include Lombardi’s in Little Italy, Arturo’s in Soho, John’s of Bleecker Street in Greenwich Village, Patsy’s in Turtle Bay and the Upper West Side, and Grimaldi’s near the Brooklyn Bridge.",Lean Right,0,fox-business,38.81,9.11
"The record-setting streams earned her about $97 million in recorded music royalties, according to Billboard.",Lean Right,0,fox-business,38.81,9.11
"It later combined it with Bell Sports in 2004 and merged it with Easton Sports in 2006 in a transaction valued at about $400 million, renaming it Easton-Bell.",Lean Right,0,fox-business,38.81,9.11
"Bob Vila, famous for his expertise in home improvement, and his wife Diana Barrett’s Florida house is reportedly up for sale for tens of millions of dollars.",Lean Right,0,fox-business,38.81,9.11
"With rates sitting at their highest levels in over two decades, a growing number of buyers are sitting on the sidelines and questioning whether 2023 is the right time to move.",Lean Right,0,fox-business,38.81,9.11
SPOTIFY HAS HIGHER-PRICED SUBSCRIPTION PLAN IN THE PIPELINE: REPO Spotify announced Wednesday that users have listened to her songs more than 26.1 billion times since Jan. 1.,Lean Right,0,fox-business,38.81,9.11
"The new stylus, slated for an early November debut, will mark the latest Apple product to incorporate the charging format.",Lean Right,0,fox-business,38.81,9.11
"John Kerry is watching his life's work go down the tubes, but claims victory in the war on coal.",Lean Right,1,fox-business,38.81,9.11
"The Wedbush senior analyst also suggested Tesla could manufacture 10,000 in a quarter for the first time in the initial six months of the year.",Lean Right,0,fox-business,38.81,9.11
"The average cost of a gallon of regular gasoline was about $3.24 on Thursday, according to AAA.",Lean Right,0,fox-business,38.81,9.11
"U.S. GDP is expected to slow to 1.2% in the fourth quarter as tracked by the Federal Reserve Bank of Atlanta’s GDP Now, which was updated on Dec. 1, citing a slowdown in construction spending and manufacturing.",Lean Right,0,fox-business,38.81,9.11
"In 2021, congressional Democrats lowered the reporting threshold for online transactions to an unreasonably low level of $600 or more - and Congress had until Dec. 31 to fix this error.",Lean Right,1,fox-business,38.81,9.11
"Compare rates from different lenders Before applying for a personal loan, it’s a good idea to shop around and compare offers from several different lenders to get the lowest rates.",Lean Right,0,fox-business,38.81,9.11
"YELLEN AND REST OF BIDENOMICS TEAM IGNORE MIDDLE-CLASS MISERY THEIR POLICIES CREATE Even if the deficit were to vanish overnight, the interest expense would still increase because the Treasury doesn’t really pay off debt when it comes due - it rolls the debt over.",Lean Right,1,fox-business,38.81,9.11
CLICK HERE TO READ MORE ON FOX BUSINESS He was famous for switching his artistic techniques and styles throughout his life.,Lean Right,0,fox-business,38.81,9.11
The two are very into each other and are enjoying their time together but are also planning for the future.,Lean Right,0,fox-business,38.81,9.11
One U.S. market expert is echoing similar concerns as some of the nation’s top real estate industry leaders about the short-term future of the industry.,Lean Right,0,fox-business,38.81,9.11
