text,source_party,label,source,reliability,bias
Two were a young couple coming out of an ultrasound appointment; she died pregnant with twins.,Right,0,townhall,24.95,19.79
"They were merely hidden, waiting for an opportunity for old prejudices to be unmasked.",Right,1,townhall,24.95,19.79
"History has shown us the consequences of such indifference, and we must learn from those lessons.",Right,0,townhall,24.95,19.79
"Could there be some hiccups and unforeseen happenings before the early political events in Iowa, New Hampshire, and South Carolina?",Right,0,townhall,24.95,19.79
"We do not charge a fee to process or respond to your verifiable consumer request unless it is excessive, repetitive, or manifestly unfounded.",Right,0,townhall,24.95,19.79
"It’s a nasty little place occupied by vying personalities, homunculi desperately hoping for their short time under the klieg lights.",Right,1,townhall,24.95,19.79
Their activities range from expressions of sympathy and propaganda activities to financing and fundraising activities to strengthen the organization abroad.,Right,0,townhall,24.95,19.79
We all certainly hope and pray that this will not occur.,Right,0,townhall,24.95,19.79
"It is a lie, and worse, anyone who has ever contemplated the topic for more than a second knows it.",Right,1,townhall,24.95,19.79
"Hunter Biden seems to have done exactly this on behalf of Burisma Holdings Limited, a Ukrainian energy company organized under Cypriot law (among other foreign principals).",Right,1,townhall,24.95,19.79
This confidence was not lost due to the leaked documents exposed by the BBC.,Right,0,townhall,24.95,19.79
"This laughable approach was easily swatted away by the IDF official, and rather abruptly the news host could not run away fast enough.",Right,1,townhall,24.95,19.79
"For now, the man is widely entertaining while shooting inside the ship, and he's one of the few Democrats who are openly pro-Israel.",Right,0,townhall,24.95,19.79
What’s the Most Popular Boy Name in Galway? Residents Were Shocked by the Answer.,Right,0,townhall,24.95,19.79
John Kerry lets loose an audible fart during his talk at the recent COP28 climate conference in Dubai.,Right,0,townhall,24.95,19.79
"We know how that turned out, including a forced famine under Joseph Stalin.",Right,1,townhall,24.95,19.79
"We may also use any or all of this information to comply with the law, detect or prevent fraud, and to defend our legal rights.",Right,0,townhall,24.95,19.79
"Against the standards set by the UN in hosting this event, the UAE is totally focused on using COP 28 to serve its self-interests.",Right,1,townhall,24.95,19.79
Wilders campaigned on closing the Netherlands’ borders and pausing migration into the country.,Right,0,townhall,24.95,19.79
"Take Hiroshima or take Nagasaki and that was many, many decades ago and multiply that times 500, that's what a big bomb would be today,"" Trump said.",Right,0,townhall,24.95,19.79
The temptation to exceed posted speed limits or to drive at speeds unjustifiable under adverse weather conditions or after dark accounts for much of the road-kill involving deer and also in the recent rise in highway fatalities in general.,Right,0,townhall,24.95,19.79
Advertisement Biden added that he would be watching the Senate vote on Wednesday afternoon.,Right,0,townhall,24.95,19.79
"The Gaza Strip has been wrecked and will need to be rebuilt regardless, but no successful reconstruction can ever be declared if Hamas remains part of the social fabric.",Right,1,townhall,24.95,19.79
And add to her list of failures the total collapse of RNC fundraising - there’s a vote o’ confidence!.,Right,1,townhall,24.95,19.79
"Shouldn’t we put on our own oxygen mask first, before we concern ourselves with helping others?",Right,0,townhall,24.95,19.79
"Advertisement Another question is just how loyal supporters of Maurico Macri, with whom Milei has formed an alliance to win the run-off election, will prove to be in the longer run?",Right,0,townhall,24.95,19.79
"Riley fires back: ""If my testimony makes me transphobic, then you are a misogynist.",Right,0,townhall,24.95,19.79
"We will provide updates on our holiday plans and family-friendly festivities at a future date,"" the update read.",Right,0,townhall,24.95,19.79
"Stalemates and losses in Korea, Vietnam, Iraq, Afghanistan, Syria, and for Israel with Gaza, the West Bank, south Lebanon and Iran are symptoms of people who have the firepower but do not have the will to use it.",Right,1,townhall,24.95,19.79
Remember their wild reception in Gaza of Hamas barbarians and the raped women they brought back in their trucks?,Right,1,townhall,24.95,19.79
"Actually, it was written by Thomas Jefferson about 200 years ago.",Right,0,townhall,24.95,19.79
"It’s a law enforcement action that we should do here, as the terror group has operated in the United States for years.",Right,1,townhall,24.95,19.79
"Of course, very little is heard of Joe Biden’s threats to free speech, constant calls from the press (such as Oliver Darcy of CNN) to cancel other outlets, or Media Matters targeting Elon Musk and Twitter with advertiser boycotts.",Right,1,townhall,24.95,19.79
"While federal officials have authorized more than $2 billion of the funds to be sent to states, fewer than half of states have even started to take bids from contractors to build the chargers - let alone begin construction.",Right,0,townhall,24.95,19.79
"That distortion will have negative consequences for industries, taxpayers, and the environment, as more trucks are needed to replace rail transportation.",Right,0,townhall,24.95,19.79
"Such a design aligns with the fundamental principle of user fees, linking payments directly to a person or entity's actual usage and providing a fair and equitable funding structure.",Right,0,townhall,24.95,19.79
Newsom and his family recording part of the ceremony inside the rotunda of the capitol on Monday night.,Right,0,townhall,24.95,19.79
"Deletion Request Rights You have the right to request that we delete any of your personal information that we collected from you and retained, subject to certain exceptions.",Right,0,townhall,24.95,19.79
While we are a year out from the election the tidal shift is no less significant.,Right,0,townhall,24.95,19.79
"In the Senate, only a third of members were newly elected.",Right,0,townhall,24.95,19.79
"Neighbors also said that Yoo covered his windows with aluminum foil (via Fox News): Although his LinkedIn profile appears to have been disabled, Yoo preserved some of his posts on a YouTube page along with silent videos showing court filings from some of his failed lawsuits.",Right,0,townhall,24.95,19.79
"The converted White House operative was speaking with ABC News fixture Jonathan Karl, who has a new non-partisan anti-Trump book for sale.",Right,1,townhall,24.95,19.79
"The DOJ refuses to indict, so we brought FACE charges,"" he said.",Right,0,townhall,24.95,19.79
"During his service in the military, Lear flew 52 combat missions aboard Boeing B-17 Flying Fortresses in the Mediterranean as well as bombing runs over Nazi Germany - earning him an Air Medal with four oak leaf clusters.",Right,0,townhall,24.95,19.79
"Additionally, consumers have seen reports that the range of EVs can drop by as much as 25% when carrying heavy loads, raising concerns over the lack of charging stations.",Right,0,townhall,24.95,19.79
"We all knew this deal would break down, and it did on December 1.",Right,1,townhall,24.95,19.79
"Considering some of his predecessors, such as Dean Rusk, Cyrus Vance, George Schultz, and heck, even Madeline Albright, Blinken pales by comparison.",Right,1,townhall,24.95,19.79
"Advertisement There was little or no reporting on the ancillary results -- undetected cancers, postponed surgeries, increased depression, and alcohol and drug abuse.",Right,1,townhall,24.95,19.79
"By siphoning off even a few anti-Trump votes, Cheney would probably help the former president.",Right,1,townhall,24.95,19.79
"However, we have to be balanced about bringing in the outrages against Palestinians.""",Right,1,townhall,24.95,19.79
"That said, by any measurable statistic, the economy under the Trump Administration was measurably better than it is today under the Biden Regime.",Right,1,townhall,24.95,19.79
"And then when you're thinking positive, and you have a goal, those things gave him the strength to knock on the doors blindly, introduce himself as a guy who runs the school you never heard of, and ask for donations.""",Right,0,townhall,24.95,19.79
Have these two women taken the time to reflect on the inadequacies of their leadership abilities?,Right,1,townhall,24.95,19.79
"While former and potentially future President Donald Trump remains in the lead for Iowa, Florida Gov.",Right,0,townhall,24.95,19.79
"It only solicited evidence from a select set of relevant individuals, ignored exculpatory evidence, and did not pursue witnesses with evidence that would not advance its partisan narrative.It fabricated and publicly released doctored evidence.",Right,1,townhall,24.95,19.79
"That serves no one and, like pretty much every policy idea Democrats advance, it helps no one either.",Right,1,townhall,24.95,19.79
"Mass consolidation creates monopolies, which Republicans like Teddy Roosevelt and Ronald Reagan always knew were a threat to free markets rather than an intrinsic feature.",Right,1,townhall,24.95,19.79
"Completed in November 1898, the Carnegie library is the third oldest in continuous operation in its original building, which includes the 1,000-seat music hall, where Kilmeade will discuss the book on Dec. 15.",Right,0,townhall,24.95,19.79
"Remember, the insidious effects of Diversity, Equity, and Inclusion (DEI) are now endemic in the federal structure - that includes the U.S.",Right,1,townhall,24.95,19.79
"URGENT: From Sheriff Kevin McMahill: ""No more threat to the community.",Right,0,townhall,24.95,19.79
It is also dealing with a terrorist group hiding in a heavily urban area.,Right,0,townhall,24.95,19.79
"Sometimes, when the host is like that CNN boob or a conspiracy theorist incapable of intellectual honesty like Rachel Maddow, it’s not worth talking to the media.",Right,1,townhall,24.95,19.79
Ron DeSantis prohibited kindergarten teachers from sharing anal sex cartoons with their students.,Right,1,townhall,24.95,19.79
Such prevention while the rest of the world consumes them in mass quantities reeks of hypocrisy.,Right,1,townhall,24.95,19.79
"Perhaps Blinken doesn’t want to be accused of dual loyalty, especially in an America that is has become more dangerous and unwelcoming for Jews than ever before.",Right,1,townhall,24.95,19.79
"Meanwhile, a Fox News poll shows that Trump hit 62 percent in the GOP primary.",Right,0,townhall,24.95,19.79
The President’s son doesn’t get to dictate the terms of a lawful subpoena.,Right,0,townhall,24.95,19.79
He rejected the KGB-inspired nuclear freeze nonsense that many of the hacks crying about ex-KGB Colonel Putin today fully supported then.,Right,1,townhall,24.95,19.79
It somehow became acceptable for politicians and those who aspired to be to preach only to the choir.,Right,1,townhall,24.95,19.79
"TWO - A certain someone at a prior first lady's passing wore a grey coat over a black dress, and no media meltdown occurred.",Right,1,townhall,24.95,19.79
"It is not through any type of true authoritarian action, but he used that one word, so they are running with it while shaking a hand over their heads.",Right,1,townhall,24.95,19.79
"They also murder single men because they think they’re sad to be alone, draw whatever conclusion you like from that.",Right,1,townhall,24.95,19.79
This looks to me like an unsubtle message from the former Speaker.,Right,1,townhall,24.95,19.79
"Therefore, as she says China has more ships, and the count states China has more ships, and it is asserted they will be building even more ships, it is inaccurate for her to say China has more ships.",Right,1,townhall,24.95,19.79
"Millions of people are fleeing their homes due to conflicts, persecution and economic hardship.",Right,0,townhall,24.95,19.79
Is he (not so subtly) threatening the removal of United States support for Israel's essential war to eradicate Hamas?,Right,1,townhall,24.95,19.79
Advertisement Stay tuned for the self-flagellation sure to come from MIT's Sally Kornbluth.,Right,1,townhall,24.95,19.79
States and the charger industry blame the delays mostly on the labyrinth of new contracting and performance requirements they have to navigate to receive federal funds.,Right,0,townhall,24.95,19.79
Reports in several states in recent months have shown that crimes committed by juveniles are continuing to escalate.,Right,0,townhall,24.95,19.79
Progressives have claimed the right to tell us what words and phrases mean-no matter a person’s intent when using those words.,Right,1,townhall,24.95,19.79
"Haley rolled with the punches, though she was thoroughly gutted tonight.",Right,0,townhall,24.95,19.79
"Yet the new measures also lack the teeth that more meaningful and politically challenging actions would have, such as removing barriers to trade - like tariffs or the outright ban of imports like baby formula - or eliminating long-harmful measures like the Jones Act, which prohibits foreign carriers and crews from using domestic water routes.",Right,1,townhall,24.95,19.79
"Extending this partnership to infrastructure allows for the implementation of cost-effective technologies, ultimately making our roads safer and more efficient.",Right,0,townhall,24.95,19.79
"Liberal Journalist Tries (and Fails) to Trap Pierre Poilievre During a Presser A liberal journalist tried to make Justin Trudeau’s rival, conservative leader Pierre Poilievre, look like a fool for calling the Rainbow Bridge explosion terrorism.",Right,1,townhall,24.95,19.79
"Trende points out the Trump is ahead in several battleground states, including ones he lost pretty decisively in 2020.",Right,0,townhall,24.95,19.79
"These aren’t small gatherings either, and these people are the pool from which terror groups will recruit to carry out attacks.",Right,1,townhall,24.95,19.79
"There’s a theme this week, one that can be encapsulated with a popular emoji.",Right,0,townhall,24.95,19.79
No Democrat could ever accept such a record in a candidate for national office.,Right,1,townhall,24.95,19.79
Just for context keep in mind that Hamas was said to have taken captive 240 hostages.,Right,1,townhall,24.95,19.79
"Normal Americans despise these scumbags, and the Democrats may have their affinity for these semi-human fungi hung around their necks like millstones.",Right,1,townhall,24.95,19.79
Newsom knew where Sean Hannity was coming from; he went anyway.,Right,1,townhall,24.95,19.79
"If we determine that the request warrants a fee, we will tell you why we made that decision and provide you with a cost estimate before completing your request.",Right,0,townhall,24.95,19.79
2: that Israel is morally equivalent in some way to Hamas.,Right,1,townhall,24.95,19.79
"William D. Balgord, heads Environmental & Resources Technology, Inc.in Middleton, Wisc.",Right,0,townhall,24.95,19.79
Our gross domestic product is greater than 144 nations in the United Nations.,Right,0,townhall,24.95,19.79
"Advertisement Schumer, Harris, and the liberal mainstream media could hardly have been more ecstatic.",Right,1,townhall,24.95,19.79
Neither have any of the other numerous predictions from various climate change apostles come true.,Right,1,townhall,24.95,19.79
"But the lesson was taught much longer ago in antique prose by James Monroe, who crossed the Delaware with George Washington in 1776 and retired from the presidency in 1825.",Right,0,townhall,24.95,19.79
And yet now they downplay sexual atrocitiy with mountains of gruesome proof.,Right,1,townhall,24.95,19.79
The UN wants it to align with the 2015 Paris Climate Accords.,Right,0,townhall,24.95,19.79
"California is a superficial state - completely beautiful, as long as you don’t look too closely.",Right,1,townhall,24.95,19.79
"The culprit then amid the COVID haze is well understood now, as goods purchased outpaced the services that have come to dominate U.S. GDP, leaving transportation systems and warehouses unable to meet consumer demand.",Right,0,townhall,24.95,19.79
"When drivers of traditional cars need gas, they know that it can be found almost anywhere.",Right,0,townhall,24.95,19.79
The Washington Post will slash jobs if it does not reach its buyout goal.,Right,0,townhall,24.95,19.79
"Are they opportunists who feel mouthing anti-Western shibboleths gains them career traction in leftist-run media, academia, and popular culture?",Right,1,townhall,24.95,19.79
"When considering a mode of transportation in the context of the supply chain that continues to captivate policymakers, one must remember that the private sector, including railroad companies, does not have unlimited resources.",Right,0,townhall,24.95,19.79
"The Israelis see those risks, such as giving up control of the West Bank to armed Palestinian terrorists, as essentially an invitation to suicide.",Right,1,townhall,24.95,19.79
"Israel's open negotiation with a terrorist organization, even if conducted via American and Qatari intermediaries, necessarily incentivizes more future hostage-taking and exacerbates the peril for IDF soldiers in Gaza.",Right,1,townhall,24.95,19.79
"My solution to the whole mess is to get the federal government out of infrastructure spending and financing in the first place and put the responsibility where it belongs: with states, municipalities and the private sector.",Right,1,townhall,24.95,19.79
"If you can stomach it, watch the interrogations of the Hamas barbarians from 10/7.",Right,1,townhall,24.95,19.79
"However, their current record, given their total dedication to abortion, child mutilation, and coercion of their political enemies, isn’t encouraging.",Right,1,townhall,24.95,19.79
"Advertisement Instead of showing the audience something different from what we have become accustomed to, it was a verbal slugfest and insult festival.",Right,1,townhall,24.95,19.79
"Chesty Puller, the most decorated Marine in history with five Navy Crosses and a Distinguished Service Cross from the Army (both the second highest awards for valor America has), started off as enlisted, went to the NCO Academy, then OCS before being reverted to enlisted status after the end of World War I. Chesty served five years in is second go around as an enlisted man before again commissioning in 1924.",Right,0,townhall,24.95,19.79
They were handed hot-houses that generated millions annually in bug-free organic greens; they tore them apart within days of the Jews being pulled out of Gaza.,Right,1,townhall,24.95,19.79
"The Reagan principle has not been abided by moderate Republicans, either-and more and more Democrats get elected, further implanting liberal-left policies in every area of life and policy from social to economic issues.",Right,1,townhall,24.95,19.79
It’s my hope that Israel ignores the minor league amateur act the Biden administration is putting forward.,Right,1,townhall,24.95,19.79
Deer hunting seasons are now open in a majority of our states.,Right,0,townhall,24.95,19.79
"Atheism produced the French Revolution, the guillotine, communism, and countless deaths.",Right,1,townhall,24.95,19.79
"It took close to two months after the attack for the UN Women's X account to put out a pinned post calling attention to the matter, though that had its own issues.",Right,0,townhall,24.95,19.79
"It raises the question as Israel continues its combat to eradicate Hamas, whether all the innocent Palestinian Arabs are really so innocent after all.",Right,1,townhall,24.95,19.79
"Everyone who joins the Pittsburgh Steelers does so to win and both submits to, and adopt, the team vision.",Right,1,townhall,24.95,19.79
"Add Colin Powell, Condoleezza Rice, and Mike Pompeo, and it's doubtful that Blinken could even aid them.",Right,1,townhall,24.95,19.79
"How long it will take to convalesce from another collapse of Western Civilization and the cardinal principles of limited, virtuous government is inconceivable.",Right,1,townhall,24.95,19.79
"Let me be clear: Calls for violence or genocide against the Jewish community, or any religious or ethnic group are vile, they have no place at Harvard, and those who threaten our Jewish students will be held to account.",Right,0,townhall,24.95,19.79
Two of the videos showing his recent LinkedIn posts appeared to have been removed Tuesday morning.,Right,0,townhall,24.95,19.79
"Hopefully, the world is watching, and we can all agree to stop playing the left’s stupid games.",Right,1,townhall,24.95,19.79
Among the sources for drinking water in Gaza are purification plants that have been recently disabled.,Right,0,townhall,24.95,19.79
"Not a single thing will change, except that we will finally kick the financial struts out from underneath a persistent parasite that has finally come close to achieving its goal of killing its host.",Right,1,townhall,24.95,19.79
"Remember the Palestinian civilians (including the old guy with a walker) shown on CCTV coming into Israeli settlements to steal, rape and take captives?",Right,1,townhall,24.95,19.79
This proposal stems from the July 2023 COP28 Food Systems and Agriculture Agenda.,Right,0,townhall,24.95,19.79
If we were to lay down our weapons (or be unprepared or live in a naïve false reality) they would slaughter us.,Right,1,townhall,24.95,19.79
Garion Frankel is a Ph.D. student in PK-12 educational leadership at Texas A&M University.,Right,0,townhall,24.95,19.79
"It is intended to make white people aware of their unconscious racism towards people of color and lead them to accept that structural racism against blacks, specifically, is what accounts for the social disparities that afflict these communities.",Right,1,townhall,24.95,19.79
"But as Israel has not played by Hamas’ playbook and has taken Gaza apart, the victory in the end may be pyrrhic.",Right,1,townhall,24.95,19.79
"That includes our print + online news stories, podcasts, videos, games and recipes.",Right,0,townhall,24.95,19.79
"The ‘refrigerator bomber,’ who killed 15 Israelis with planted explosives, is hailed as a Palestinian symbol.",Right,1,townhall,24.95,19.79
"Every day they delay their assault, their job is becoming more difficult.",Right,1,townhall,24.95,19.79
"In a year of wars, media layoffs, Elon Musk drama and Bud Light controversies, Time Magazine announced its Person Of The Year.",Right,0,townhall,24.95,19.79
That agreement was the prelude to the slaughter of the Quraish tribe of Mecca a few years after Mohammed signed a false peace agreement.,Right,1,townhall,24.95,19.79
"He was referring to Missouri v. Biden, a lawsuit by Republican attorneys general into how the federal government pressured Big Tech to suppress so-called misinformation that might prevent a full accounting of COVID origins or Biden family shenanigans in China and Ukraine.",Right,1,townhall,24.95,19.79
She's raised speculation even before she lost her primary to now Rep. Harriet Hageman in August of last year by close to 40 points.,Right,0,townhall,24.95,19.79
"Sen. Chuck Schumer (D-NY) didn’t want to answer this question about Sen. Bob Menendez (D-NJ), probably because it ties into the legal fiasco engulfing the New Jersey Democrat.",Right,1,townhall,24.95,19.79
"The fact is, more people left California for the Sunshine State.",Right,0,townhall,24.95,19.79
"Ray, who ran the Bureau of Information at Carnegie Steel, on Murtland Street in Homestead.",Right,0,townhall,24.95,19.79
Advertisement Additional security funds and multi-level civil rights investigations should only be the start of things.,Right,0,townhall,24.95,19.79
"Morally bankrupt antisemite Briahna Joy Gray is actively competing to be the literal dumbest person on X.  Oh, she knows.",Right,1,townhall,24.95,19.79
It's outrageous but not surprising that Israel has already borne international condemnation just for the idea of flooding the tunnels .,Right,1,townhall,24.95,19.79
"It was fight club on stage, and Donald Trump was the only person left sitting atop the mountain.",Right,1,townhall,24.95,19.79
"She replies, ""These companies have a whole business model of selling that data.",Right,0,townhall,24.95,19.79
"But as we noted, those sports don't run in the same season.",Right,0,townhall,24.95,19.79
The Quest for Power Why does the Left want to replace native populations with migrants from around the world?,Right,1,townhall,24.95,19.79
"Still, those who are deemed inclusive are willing to let their spaces be taken over by said biological males.",Right,1,townhall,24.95,19.79
That surpassed the previous record of 2.88 million set on June 30.,Right,0,townhall,24.95,19.79
He’s been a reliable voice for the GOP from a very blue state (though in a solidly red district) and he made many significant contributions over his more than fifteen years in the House.,Right,0,townhall,24.95,19.79
"One involves securing Brazilian government assistance and endorsement of Adnoc’s acquisition of Braskern, the largest oil and gas processing company in Latin America.",Right,0,townhall,24.95,19.79
"It’s evil, but it’s also a skill most people don’t possess.",Right,1,townhall,24.95,19.79
It was brutal the way that Ron DeSantis utterly dismantled the human hairstyle masquerading as my governor the other day.,Right,1,townhall,24.95,19.79
The country is surrounded by a majority of Earth’s 2.1 billion Muslims.,Right,0,townhall,24.95,19.79
We cannot respond to your request or provide you with personal information if we cannot verify your identity or authority to make the request and confirm the personal information relates to you.,Right,0,townhall,24.95,19.79
Four GOP presidential candidates to square off in fourth debate Four candidates have qualified for the fourth Republican presidential debate.,Right,0,townhall,24.95,19.79
