text,source_party,label,source,reliability,bias
"An appeals court, the infamous Fifth Circuit, had struck down the law because they said they couldn’t find evidence of the Founding Fathers talking about that sort of thing.",Lean Left,1,fair,32.6,-19.36
"With regard to some of these threats, shall we say, to civil liberties and civil rights, one of the most alarming ones is this notion of a registry of American Muslims.",Lean Left,1,fair,32.6,-19.36
"The bias toward white and male sources-and the decrease in white sources in 2023-can be explained partly by the New York Times‘ bias toward government and law enforcement sources, both of which are disproportionately white, male fields.",Lean Left,1,fair,32.6,-19.36
"Almost 50 years after the end of the US government’s war of aggression against Laos, unexploded cluster bombs continue to kill and maim innocent people-frequently children.",Lean Left,1,fair,32.6,-19.36
"Revivalism at its maximalist best, this is an album that feels as liberated as it is detail-oriented, with layered background vocals, velvety horns and orchestral flourishes fleshing out a nightlife fantasy.",Lean Left,0,npr,42.99,-4.27
"Diplomacy, too, is fickle: Star Trek: Infinite contains dozens of minor factions along with the core four, each with competing demands and various levels of hostility.",Lean Left,0,npr,42.99,-4.27
"But the ultrasound tech said she would have to wait to talk to the doctor, who was actually Mathisen's aunt.",Lean Left,0,npr,42.99,-4.27
Phasing down would leave a longer future for planet-heating energy sources.,Lean Left,1,npr,42.99,-4.27
"Former President Donald Trump has not been to any of these debates, and he skipped this one too.",Lean Left,0,npr,42.99,-4.27
"Under public pressure, Facebook, Twitter and other social media sites created policies prohibiting false election claims and set up teams devoted to monitoring abuse, from cracking down on posts telling people the wrong day to vote to disrupting coordinated influence operations backed by foreign governments.",Lean Left,0,npr,42.99,-4.27
"Thousands of climate scientists, mayors, activists, corporate executives and representatives of major oil companies will also fly to the petroleum-dependent host country to attend hundreds of side events.",Lean Left,0,npr,42.99,-4.27
Both have a sharp way of exceeding audience expectations without subverting or copping out on the jokes the titles imply.,Lean Left,0,npr,42.99,-4.27
"Variety’s Hitmaker of the Year doesn’t play an instrument - those gloriously supple melodies and intense lyrics just burst out of her and into a microphone, usually the one on her phone.",Lean Left,0,variety,41.29,-3.85
"In this album’s spunkiest or scream-iest moments, you get the satisfying rush of what it might feel like if Taylor Swift decided to not just befriend but be Paramore for a day.",Lean Left,1,variety,41.29,-3.85
"My goal in this study isn’t to suggest venture capital, private equity or real estate should become less attractive areas to investors but rather to make the case for media lending to become a new consideration as an alternative for a high-yielding asset class that can help diversify their portfolios.",Lean Left,0,variety,41.29,-3.85
"And one of the pieces of advice he gave Kobe was when you’re around someone you admire, don’t be a fan.",Lean Left,1,variety,41.29,-3.85
"From the inescapable presence of podcast platforms to new voices utilizing everything that social media apps have to offer, the business of audio content remains as relevant as ever.",Lean Left,0,variety,41.29,-3.85
"But he moved into comedy writing after partnering with Ed Simmons, his cousin’s husband.",Lean Left,0,variety,41.29,-3.85
"And it was your little face - this beautiful, slightly baffled face.",Lean Left,0,variety,41.29,-3.85
"COX: Well, that’s because anger is always very close to me.",Lean Left,1,variety,41.29,-3.85
President Biden has been instrumental in helping Israeli hostages who have been kidnapped by Hamas come home.,Left,1,occupy-democrats,25.3,-21.06
This column is based on original reporting by Olivia Rinaldi of CBS News.,Left,0,occupy-democrats,25.3,-21.06
"For everyone else, it raises the important question: why is the House Speaker working so hard to protect the identities of individuals involved in a violent assault on Democracy?",Left,1,occupy-democrats,25.3,-21.06
Cheney says that her party now accepts threats of violence as a means to political ends.,Left,1,occupy-democrats,25.3,-21.06
"Fournier doesn’t seem to be making any public statement in response to the allegations against him though, despite how influential his organization has been.",Left,1,occupy-democrats,25.3,-21.06
"Donald, everyone knows you’re weaker, unsteady and confused all the time now.",Left,1,occupy-democrats,25.3,-21.06
"George Santos was not facing any indictments when he was elected on the back of what we now know to be a brazenly illegal campaign by a candidate who falsified most of his resume, even down to the detail of what sports he didn’t play at the universities he didn’t attend.",Left,1,occupy-democrats,25.3,-21.06
Trump has also reacted to clips of his water-sipping struggles before.,Left,0,occupy-democrats,25.3,-21.06
Roman said Gat called him at around 7:30 a.m. on Oct. 8 and told him what had happened the previous day.,Lean Left,0,washington-blade,42.71,-7.49
We deserve leadership reflective of the American people and that’s not Mike Johnson or the GOP’s anti-LGBTQ agenda.,Lean Left,1,washington-blade,42.71,-7.49
The Republican Party and Mike Johnson have demonstrated over and over again that protecting and uplifting LGBTQ+ people is not a priority.,Lean Left,1,washington-blade,42.71,-7.49
Some of these fans have paid hundreds of dollars for meet-and-greet tickets after the show.,Lean Left,0,washington-blade,42.71,-7.49
"Rarely a paragraph goes by without a dishy mention of celebs and politicos she’s friends with, slept with, argued with, been mistreated by, or worked with: from her BFFs Bill and Hillary Clinton to Warren Beatty to Stephen Sondheim to Larry Kramer to Sydney Chaplin.",Lean Left,1,washington-blade,42.71,-7.49
"Babatunde Tribe, a nonbinary Nigerian stylist, freelance model and artist, shares these sentiments.",Lean Left,1,washington-blade,42.71,-7.49
Within the walls of our homes lie spaces of relaxation and repose.,Lean Left,0,washington-blade,42.71,-7.49
"But as a gay Black man, it is impossible for me to feel that Johnson - and the Republican Party he answers to - can ever represent us when they work so actively against us.",Lean Left,1,washington-blade,42.71,-7.49
That demonstration ended with a man in attendance stabbing a gay counterprotester.,Lean Left,1,truthout,34.51,-16.87
"These organizations - with long histories of murder, pogroms, land confiscation and burning Palestinian families alive in their homes - have been let loose and given license for a full scale assault on Palestinians.",Lean Left,1,truthout,34.51,-16.87
"However, the situation in the West Bank demonstrates that Israel’s genocidal policies toward Gaza are only a component of its overall settler colonial project, which now appears set on the full annexation of historic Palestine and the expulsion and oppression of Palestinians.",Lean Left,1,truthout,34.51,-16.87
"Small wonder that when cheaper and seemingly more-extensive Medicare coverage is offered, people grab it.",Lean Left,1,truthout,34.51,-16.87
"Otherwise, so-called progressive leaders who cannot get themselves to endorse a simple ceasefire.",Lean Left,1,truthout,34.51,-16.87
This overemphasis on individualistic action limits the climate movement and depoliticizes its aim by obscuring greater systemic causes.,Lean Left,1,truthout,34.51,-16.87
Our societies lack the infrastructure and political will to enable people to live dignified and sustainable lives.,Lean Left,1,truthout,34.51,-16.87
"Torture is commonplace, including the blasting of music like popular Israeli children’s songs.",Lean Left,1,truthout,34.51,-16.87
"Share this - Copied It’s wild how much this Israel section sounds identical to the part of the NBC News debate on Israel, both in terms of line of questioning and answers.",Lean Left,1,nbc-news,43.21,-5.79
"In the aftermath of the 2022 midterms, the fast-approaching 2024 Republican primary was largely seen as a two-person race, and for good reason: Trump remained a commanding presence in the party and still had a stranglehold on a large percentage of the Republican base, some of whom, it seems, would not abandon Trump under any circumstances.",Lean Left,1,nbc-news,43.21,-5.79
Christie and Ramaswamy are long shots for the nomination - they trail former President Donald Trump by even more in the early states and nationally than Haley and former Florida Gov.,Lean Left,1,nbc-news,43.21,-5.79
"Vincent, wearing a prisoner’s beige shirt and pants, pleaded guilty at a hearing before federal Judge José E. Martínez that lasted 20 minutes.",Lean Left,0,nbc-news,43.21,-5.79
"Her daughter eventually called and, through tears, said she was in a dorm, but a bit later she was moved to a different room with all of the lights off, the mom told NBC News.",Lean Left,0,nbc-news,43.21,-5.79
"In recent weeks, Haley has captured momentum among Republican donors who see her as the most viable alternative to former President Donald Trump, who is dominating the field in polls and has skipped all four presidential primary debates.",Lean Left,1,nbc-news,43.21,-5.79
Share this - Copied Christie comes out swinging at Trump in his first question.,Lean Left,1,nbc-news,43.21,-5.79
"According to police, Miller threw the woman’s laptop on the couch and stomped on it.",Lean Left,0,nbc-news,43.21,-5.79
The IFCN does not publish fact checks and is therefore not eligible to be a signatory of its own code of principles.,Center,0,poynter,41.75,-7.32
"After we published the story behind the front page, many people shared their reaction and commented on the editorial decisions made by these student journalists.",Center,0,poynter,41.75,-7.32
"This one is lovely - meticulously engineered, but lovely all the same.",Center,0,poynter,41.75,-7.32
"As the war between Israel and Hamas rages on, U.S. national media is reporting on a wave of antisemitic and Islamophobic attacks here at home.",Center,1,poynter,41.75,-7.32
"His comments were based on a study from a recognizable organization, but his quote distorts the results.",Center,1,poynter,41.75,-7.32
"We covered private equity, climate change, immigration, crime, affirmative action, and the list goes on.",Center,1,poynter,41.75,-7.32
"More than an hour into the debate, Hannity invoked his own beliefs about President Joe Biden’s fitness to hold the highest office.",Center,1,poynter,41.75,-7.32
Careless comments Saturday was the big college football game between undefeated powerhouses Michigan and Ohio State.,Center,1,poynter,41.75,-7.32
It was clear that Ohioans were ready to vote on abortion in 2023.,Left,0,the-nation,31.32,-19.23
"The Age of Revolution was also the age of republicanism, capitalism, secularism, nationalism, and total war.",Left,0,the-nation,31.32,-19.23
Many critics have quite reasonably interpreted this position as the timidity of an endlessly postponed political program.,Left,1,the-nation,31.32,-19.23
"Diversity, equity, and inclusion divisions were rapidly namechecked, as were course offerings that mentioned settler colonialism in the context of the Middle East.",Left,1,the-nation,31.32,-19.23
"She is, to use the nomenclature of the American bureaucracy, an alien.",Left,1,the-nation,31.32,-19.23
"Unfortunately, Trump’s attempt to defend himself from charges brought by special counsel Jack Smith in relation to his efforts to nullify the results of the 2020 election has taken a surreal turn.",Left,1,the-nation,31.32,-19.23
"For Cruger-Zaken, being an Israeli outside Israel offers the chance to see a different path.",Left,0,the-nation,31.32,-19.23
"Before we even get to the law of it all, we should talk as adults about the realpolitik of what these Section Three lawsuits, brought in state after state in order to get him kicked off as many ballots as possible, are asking the courts to do.",Left,1,the-nation,31.32,-19.23
Concepts like the significance of bonding between a baby and its mother during the first year of life were not as widely recognized or prioritized.,Left,0,huffpost,37.82,-10.75
"Christie did not answer directly, choosing instead to hector his rivals for failing to discuss Trump sooner.",Left,1,huffpost,37.82,-10.75
And what was the point if the other candidates refused to even discuss the actual reasons why Trump shouldn’t be their party’s nominee and they should?,Left,1,huffpost,37.82,-10.75
"Even the most open-minded person might ask, how does a drag queen, a person typically endemic to big coastal cities, find themself in the mountains of Colorado?",Left,1,huffpost,37.82,-10.75
"Advertisement Last month, Israel’s police chief presented to the international news media videotaped testimony of a rape witness at the music festival.",Left,0,huffpost,37.82,-10.75
What would happen over the next few years would be a full-on war between the West and East coasts in which Tupac Shakur and the Notorious B.I.G.,Left,1,huffpost,37.82,-10.75
"Personal stories can change the way we see the world, understand each other, and know ourselves.",Left,0,huffpost,37.82,-10.75
"Comedian Marlon Wayans has given parents a master class in not being transphobic, unlike some of his counterparts.",Left,1,huffpost,37.82,-10.75
"In response to public input, the Forest Service made a few tweaks to the company’s original proposal.",Lean Left,0,montana-free-press,46.33,-3.8
"There is little flinching in the writing, which depicts the blood and bile and grit of human survival in the face of violence, colonialism and rape.",Lean Left,1,montana-free-press,46.33,-3.8
"Department staff advocated for the new building to include classroom and community spaces not available in the previous office, which was leased, Christiaens said.",Lean Left,0,montana-free-press,46.33,-3.8
"Because the brittle will be molten in the saucepan, this is not a task well suited for a child’s help.",Lean Left,1,montana-free-press,46.33,-3.8
"Most states rely on the same workers and computer systems to sort eligibility for Medicaid and SNAP, according to the Center on Budget and Policy Priorities, a left-leaning think tank in Washington, D.C.",Lean Left,1,montana-free-press,46.33,-3.8
An analysis prepared by the agency estimates the mine would require a $36 million capital outlay for additional buildings and infrastructure to switch to a filtered tailings system.,Lean Left,0,montana-free-press,46.33,-3.8
"With Wednesday’s action, Montana will no longer require the directors of libraries serving more than 25,000 people to hold a master’s degree in library science in order for those libraries to receive state funding.",Lean Left,0,montana-free-press,46.33,-3.8
People seeking public aid have historically encountered long call-center wait times and limited options for in-person help.,Lean Left,0,montana-free-press,46.33,-3.8
"Redstone acts a bit like an electrical circuit, letting you power items on and off to build surprisingly sophisticated devices.",Center,0,cnet,40.02,-1.39
Many of the highly rated Wi-Fi-enabled baby monitors don't have the standout feature of the Nanit Pro; its split screen lets you monitor two cameras in two different rooms on any device that has Wi-Fi.,Center,0,cnet,40.02,-1.39
"And apparently, autocorrect will learn and let you use curse words.",Center,0,cnet,40.02,-1.39
ISPs and affiliated trade associations are adamant that net neutrality regulation is unnecessary -- and say it could actually harm us.,Center,1,cnet,40.02,-1.39
They're marketing toward smokers as a safer option because they leave out some of the toxic ingredients of cigarettes.,Center,0,cnet,40.02,-1.39
With both a lease and PPA you sign a contract with a provider that will take on the financial and logistical burden of putting solar panels on your property.,Center,0,cnet,40.02,-1.39
"Plus, it has small front and rear fenders to keep you clean.",Center,0,cnet,40.02,-1.39
"In short, mice make terrible roommates for the average homeowner or apartment dweller.",Center,1,cnet,40.02,-1.39
"Once airborne, they can float for thousands of kilometers, as far as the Earth’s poles The infinitesimal size of nanoplastics is partly why scientists know little about them.",Left,0,vice,38.96,-9.39
"ABSTRACT breaks down mind-bending scientific research, future tech, new discoveries, and major breakthroughs.",Left,0,vice,38.96,-9.39
The infinitesimal size of nanoplastics is partly why scientists know little about them.,Left,0,vice,38.96,-9.39
"But one of the lesser-known aspects of this philosophy is its application to food, both in terms of cooking style and as a subjective approach towards eating.",Left,0,vice,38.96,-9.39
"But it was a little bit more comforting when they told me that they would pick me up directly from the airport, chauffeur me right to the hotel, and pick me up for the procedure.",Left,0,vice,38.96,-9.39
"But now, a much smaller, potentially much more nefarious, and less understood threat is drawing scientist’s attention-nanoplastics.",Left,1,vice,38.96,-9.39
"Meeting several times a month, members of the semi-autonomous cells train martial arts, put up racist posters, and recruit young, easily manipulated white men to their cause.",Left,1,vice,38.96,-9.39
"Atomwaffen was an infamous neo-Nazi terrorist organization that emerged in 2016, and has been linked to five murders in the United States .",Left,0,vice,38.96,-9.39
"While it may be a daunting task to get the perfect gifts for your Gen Z sister, niece, daughter or friend, we are here to help you feel a bit more at ease.",Lean Left,0,nj.com,43.92,-2.88
"He played a strong right field with the Red Sox in 2023, flashing elite arm strength.",Lean Left,0,nj.com,43.92,-2.88
"BUY GIANTS TICKETS: STUBHUB, VIVID SEATS, TICKETMASTER On top of his celebrity status, DeVito’s recent performances have sparked a lifeless Giants team.",Lean Left,1,nj.com,43.92,-2.88
"After finishing boot camp, Melvin returned to East Orange and joined an Air National Guard reserve unit.",Lean Left,0,nj.com,43.92,-2.88
That shot against Freehold Township gave Rutgers Prep the juice to upset the No.,Lean Left,0,nj.com,43.92,-2.88
23 N.J. towns rank in top 150 hottest real estate markets in the nation. See latest list.,Lean Left,0,nj.com,43.92,-2.88
"Neptune has been dreaming in retrograde since June 30, and now the great visionary opens his eyes to a lucid and forward-thinking consciousness.",Lean Left,1,nj.com,43.92,-2.88
"Two thoughts about that rumor: First, the Yankees aren’t alone believing they’ve got Yamamoto’s attention.",Lean Left,0,nj.com,43.92,-2.88
"BATTLING FOR YOUR NATION Throughout the Bible, God searched for those willing to fight the spiritual battle for their land.",Right,1,cbn,34.17,15.24
One aspect of genocide is the forcible transferrence of children from one group to another.,Right,0,cbn,34.17,15.24
Trillions of trillions of cells has to line up perfectly for visual signal capturing and interpretation.,Right,0,cbn,34.17,15.24
"The son of a Hamas founder, Mosab Hassan Yousef addressed students before voting began, saying he could not believe activists asked students to make the choice.",Right,0,cbn,34.17,15.24
"Great American Family has consistently been the fastest-growing channel on cable, and Abbott recently took over as head of Great American Pure Flix, the streaming platform formerly known as Pure Flix, following a highly publicized merger.",Right,0,cbn,34.17,15.24
"That's the best feeling to know that you are right standing with God, to know that you can have a right relationship with the Lord, and that you can love Him so much, that you be faithful to Him.",Right,1,cbn,34.17,15.24
Intercession involves taking hold of God's will and refusing to let go until His will comes to pass.,Right,0,cbn,34.17,15.24
Her breaking point came about a year after her mother’s death.,Right,0,cbn,34.17,15.24
"According to Morning Consult, the former president has the support of 64 percent of potential Republican primary voters, which is far higher than the second-place candidate, Florida Governor Ron DeSantis, who has only 14 percent support.",Lean Right,0,zerohedge,20.78,16.08
"Meanwhile, to make matters worse from the West's perspective and its apparently failed and blunted sanctions on Moscow... Moscow’s monthly income from oil exports is greater now than before the invasion of Ukraine.",Lean Right,1,zerohedge,20.78,16.08
"Managed retreat is confiscation of land, and it won’t be without full compensation.",Lean Right,1,zerohedge,20.78,16.08
"She said that before the Russia-Ukraine war, Xi had wanted to invade the island within two or three years.",Lean Right,0,zerohedge,20.78,16.08
"Now, they may pose the next great toxin threat, fueling a wave of neurodegenerative disease.",Lean Right,1,zerohedge,20.78,16.08
"The plastic-protein accumulation was seen in test tubes, cultured neurons, and mouse models.",Lean Right,0,zerohedge,20.78,16.08
"On matters of national security, we've got to be eyes wide open about the threat.",Lean Right,0,zerohedge,20.78,16.08
"And it unfairly implicates many of my orthodox former constituents in Brooklyn, many of whose families rose from the ashes of the Holocaust,"" he said.",Lean Right,1,zerohedge,20.78,16.08
"With Darnell Mooney heading into free agency next season, current Arizona Cardinals wide receiver Marquise Brown is becoming a name to watch for the Chicago Bears.",Center,0,heavy,43.64,-2.71
"Naturally, the reasoning from Teryl Austin involves former NBA superstar Shaquille O’Neal and his infamous woes at the free-throw line.",Center,1,heavy,43.64,-2.71
"Prior to Leonard’s decision, ESPN’s Jeremy Fowler reported that belief around the league was that the Cowboys were the best fit.",Center,0,heavy,43.64,-2.71
ABC6 News reported that it had also obtained the above statement from the school district.,Center,0,heavy,43.64,-2.71
The Utah Jazz is the only team Buha named that resides in the Western Conference.,Center,0,heavy,43.64,-2.71
"That’s why you’re selling food in a food cart, because you’re ignorant, but you should learn English.",Center,1,heavy,43.64,-2.71
"For so long, they have resisted including him in star trade talks.",Center,1,heavy,43.64,-2.71
He would make more sense than Jordan Poole whose gunning ways might not mesh well with LeBron James.,Center,1,heavy,43.64,-2.71
"In 1990, Citrus and Allied landed in Belcamp, in a 34,000-square-foot warehouse and manufacturing plant.",Center,0,baltimore-sun,44.41,-4.13
Sanders and the Democratic senators involved say they are firm in their stand that Israel’s military must adopt substantive measures to lessen civilian deaths in Gaza as part of receiving the supplemental’s $14.3 billion in U.S. aid for Israel’s war.,Center,0,baltimore-sun,44.41,-4.13
"Well, maybe Elias can have his cake and eat it, too.",Center,1,baltimore-sun,44.41,-4.13
"Young people often respond to sexual abuse by forgetting, distorting or simply not comprehending what’s happened.",Center,1,baltimore-sun,44.41,-4.13
"Those who believe that there is, are playing with their livelihoods.",Center,1,baltimore-sun,44.41,-4.13
"When prosecutors put up good-faith legal cases against Donald Trump and the ex-president still vilifies the judiciary, members of his Republican Party and his own lawyers should be rising to object.",Center,1,baltimore-sun,44.41,-4.13
The NFL should stop its love affair with quarterbacks and present Miami Dolphins wide receiver Tyreek Hill with the Most Valuable Player Award.,Center,1,baltimore-sun,44.41,-4.13
"In this year’s message to the district, found by clicking here, Alonso said there could be more city principals facing the same sanction, publicly acknowledged that he had testified in recent weeks in favor of stripping a principal of their teaching license just last week.",Center,1,baltimore-sun,44.41,-4.13
"Previous peacemakers such as former German Chancellor Angela Merkel or other Orbán-whisperers from the so-called Visegrád Four - Slovakia, Poland, Hungary and the Czech Republic - are no longer there.",Lean Left,1,politico,42.32,-5.58
"European Council President Charles Michel, meanwhile, will never be rizz after sofagate.",Lean Left,1,politico,42.32,-5.58
"Nixon he treated with craven flattery in his presence but scorn, even pity, behind his back.",Lean Left,1,politico,42.32,-5.58
"The Russian military has continued to fight and commit atrocities in Syria for eight years, with no sign of slowing.",Lean Left,1,politico,42.32,-5.58
"Simply put, a legal system diminishes liberty by the sheer fact of being unpredictably open to the whims of particular officials.",Lean Left,1,politico,42.32,-5.58
Johnson was given his first chance to respond publicly to a series of (already revealed) fruity WhatsApps from Dominic Cummings and other officials slagging him and his ministers - he argued that it was all helpful and that officials in Margaret Thatcher’s government probably swore too.,Lean Left,1,politico,42.32,-5.58
That was the main thing that the Cubans wanted to know: are we going to be invaded?,Lean Left,0,politico,42.32,-5.58
It will try to outwait both Ukraine and those aiding it.,Lean Left,1,politico,42.32,-5.58
"After all of her achievements and a decade of partnership, Nike was penalizing her for choosing to become a mother.",Lean Left,1,pbs-newshour,43.07,-9.07
So those were the three things we were willing to do.,Lean Left,0,pbs-newshour,43.07,-9.07
