text,source_party,label,source,reliability,bias
"Jingle Belle Cruise: One-hour family-friendly cruise Dec. 21-25 with carolers strolling throughout the ship, meet and greet and photos with Santa Claus, and interactive activities for the family, including cookie decorating, a balloon artist and face painter.",Lean Left,0,san-diego-union-tribune,45.68,-1.76
"The sleigh was originally built around 1840 in Albany, New York, and was sold and used by other families in Pennsylvania and Indiana until Richard Rovsek, chairman of Spirit of Liberty Foundation, sourced and purchased it.",Lean Left,0,san-diego-union-tribune,45.68,-1.76
This is the way mixologist Alicia Perry creates the holiday cocktail she has served her family for the past several years.,Lean Left,0,san-diego-union-tribune,45.68,-1.76
"He was like, ‘You don’t understand English, do you?’ My name on the cast list went from A to C cast, only because my English skills was not there.",Lean Left,1,san-diego-union-tribune,45.68,-1.76
This year’s grants represent the highest amount of grants ever issued by the state agency.,Lean Left,0,san-diego-union-tribune,45.68,-1.76
Public comments on the notice of preparation for a draft environmental impact report for East Harbor Island redevelopment and the Topgolf project are due by Dec. 18.,Lean Left,0,san-diego-union-tribune,45.68,-1.76
The chasm between the haves and have-nots is about to become more profound than any time in the history of the sport.,Lean Left,1,san-diego-union-tribune,45.68,-1.76
"Yaacov was bitterly aware that in one cruel way, she was lucky.",Lean Left,1,san-diego-union-tribune,45.68,-1.76
"Lewis had his play-calling duties ripped away by Sanders late in the season, but it’s impossible to know how much Deion’s son playing quarterback entered into a complicated relationship.",Lean Left,1,san-diego-union-tribune,45.68,-1.76
"Q: This is the time of year when a lot of people are focused on the story of Thanksgiving - a myth, really, that imagines a largely benign interaction between the Wampanoag people and the early English settlers in 1621.",Lean Left,1,san-diego-union-tribune,45.68,-1.76
Israel says it makes every effort to spare civilians and accuses Hamas of using them as human shields.,Lean Left,0,san-diego-union-tribune,45.68,-1.76
"21 Limitation of Liability; Disclaimers Except with respect to indemnification and confidentiality obligations, in no event will Client, on the one hand, and Publisher, any Service Provider, any Vendor and any of their respective affiliates, on the other hand, be liable to the other or any third party for any consequential, incidental, indirect, exemplary, special or punitive damages whatsoever (including damages for loss of use, revenue or profit, business interruption and loss of information or data), whether arising out of breach of contract, tort (including negligence) or otherwise, regardless of whether such damage was foreseeable and whether or not such party has been advised of the possibility of such damages.",Lean Left,0,san-diego-union-tribune,45.68,-1.76
"Grand Canyon has a tough team, crazy fans and a massive homecourt advantage. So why is SDSU playing there?",Lean Left,0,san-diego-union-tribune,45.68,-1.76
Client is responsible for the accuracy and truthfulness of all Client Material.,Lean Left,0,san-diego-union-tribune,45.68,-1.76
Conservative Prime Minister Richard Bedford Bennett first created the single-desk Canadian Wheat Board in 1935 as a last-ditch effort to appease the socialists of the country.,Left,1,alternet,32.71,-14.76
"Share this - Copied Vermont flooding compared to Tropical Storm Irene Vermont’s governor said last night that some parts of the state had seen flooding worse than in 2011 during Tropical Storm Irene, a historic storm that destroyed bridges, homes and roads.",Left,1,alternet,32.71,-14.76
About three-in-ten (28%) point to their religious views and about two-in-ten (22%) say knowing someone who is transgender has influenced their views at least a fair amount.,Left,0,alternet,32.71,-14.76
"He’s a learned giant - his father requires him to read 10 hours a day - but he’s also electrified by screens, parroting lines from his favorite reality-TV shows.",Left,1,alternet,32.71,-14.76
Karen Bass: The California congresswoman and head of the Congressional Black Caucus might be the most outspoken Trump critic on this list in recent weeks - perhaps suggesting she’s angling for the job.,Left,1,alternet,32.71,-14.76
"Flemming, in an article published on October 9 , explains, ""So far, a judge has ruled that, under the city's rent stabilization ordinance, he has no legal reason to evict her.",Left,0,alternet,32.71,-14.76
Then there is the sheer number of cities and farms that are sucking down water.,Left,0,alternet,32.71,-14.76
"Rep. Mike Johnson, R-La., speaks after he was chosen as the Republicans latest nominee for House speaker at a Republican caucus meeting at the Capitol in Washington, Tuesday, Oct. 24, 2023.",Left,0,alternet,32.71,-14.76
"All too many of us now have the urge to use name-calling, violent social-media posts, threats, baseball bats , and guns to do what we once did with persuasion and voting.",Left,1,alternet,32.71,-14.76
"Dietl, who was booted as a Fox contributor in 2016, offered up an olive branch tweet to new Fox boss Lachlan Murdoch.",Left,0,alternet,32.71,-14.76
A common thread in Wednesday’s statements was the trauma and post-traumatic stress disorder many still battle as a result of the shooting.,Left,0,alternet,32.71,-14.76
Fauci says a lot of the confusion of the pandemic had to do with the surprising nature of the SARS-CoV-2 virus itself.,Left,0,alternet,32.71,-14.76
"Over the last three years, Trump, his allies and other Republican figures have offered a wide-ranging and inconsistent set of interpretations of what transpired on Jan. 6.",Left,0,alternet,32.71,-14.76
John Kerry continues to insult every American who works hard to put food on the table.,Lean Right,1,boston-herald,36.31,9.68
Sal Giarratani East Boston Energy independence The OPEC oil ministers and allied producers including Russia have decided to cut the production of oil by 2 million barrels per day.,Lean Right,0,boston-herald,36.31,9.68
"One proposal would charge the lowest-income users a fixed $15 a month (Edison and PG&E) or $24 (SDG&E), while the highest-income users would pay $85 a month (Edison), $92 (PG&E) or $128 (SDG&E).",Lean Right,0,boston-herald,36.31,9.68
"When it came to Israeli women raped on Oct. 7, feminist leaders and organizations have either mumbled meaningless platitudes about how sexual violence is never favored, or stayed silent.",Lean Right,1,boston-herald,36.31,9.68
It has an electric battery - and a 27-gallon gas tank.,Lean Right,0,boston-herald,36.31,9.68
Even worse than lax application of U.S. immigration laws are consistent efforts to reward immigration law breakers.,Lean Right,1,boston-herald,36.31,9.68
A Utility Tax does not fix that underlying problem because it just rearranges who pays what - harming millions of working-class people in the process.,Lean Right,1,boston-herald,36.31,9.68
"In a statement shared by the Essex DA, Kenney’s family said they are focused on his wife and children as they process his sudden loss.",Lean Right,0,boston-herald,36.31,9.68
"Then, if they also lost out on Yamamoto, they may find themselves empty-handed and suddenly facing a heavily depleted pitching market.",Lean Right,0,boston-herald,36.31,9.68
"Garth Fry prepares gallery lights for the Paul McCartney Photographs 1963-64: Eyes of the Storm exhibit at the Chrysler Museum on Dec. 1, 2023 in Norfolk, Virginia.",Lean Right,0,boston-herald,36.31,9.68
"In a playoff-like atmosphere, the C’s couldn’t get the job done on Monday night in Indiana.",Lean Right,0,boston-herald,36.31,9.68
"At 24, no stranger to heartache and trauma, she is still an adolescent.",Lean Left,1,the-guardian,40.67,-7.97
"He tells us how the food scene is developing in St Leonards, with a clutch of cocktail bars, cafés and restaurants popping up since the end of the pandemic.",Lean Left,1,the-guardian,40.67,-7.97
"That treasure-hunt mentality is still alive on the internet: finding 360p bootleg videos on YouTube, exchanging secret links.",Lean Left,1,the-guardian,40.67,-7.97
"No intellectual work is required to appreciate this critique of the means of art-world production, and indeed very little appears to have gone into it in the first place.",Lean Left,1,the-guardian,40.67,-7.97
"We often know what we are doing and why - and if we’re not that happy with the why of it all, we keep doing it anyway, allergic as we are to saying no.",Lean Left,1,the-guardian,40.67,-7.97
"Reducing our carbon emissions will also reduce our impact on nature, so we also intend to incorporate biodiversity into our emissions reduction plan.",Lean Left,0,the-guardian,40.67,-7.97
"Photograph: Alamy A rich and capacious combination of 19th-century letters, poems, fables and journals, all contained within the apparently orthodox setting of a modern literary detective novel, it was the book in which her exhilarating genius at last came into its own.",Lean Left,1,the-guardian,40.67,-7.97
"Given the lack of power and connectivity, even the most assiduous would struggle to keep up with complex and fast-changing instructions - and this is a hungry, exhausted, grieving and traumatised population, many of whom have already moved multiple times.",Lean Left,1,the-guardian,40.67,-7.97
It is rarely the case that writers who are at ease in what has been described as the big baggy novel are also adept in this very different and extremely demanding form.,Lean Left,0,the-guardian,40.67,-7.97
Ancient Greece was everywhere in the curriculum and we were encouraged to feel great pride in having originated from the cradle of European civilisation.,Lean Left,1,the-guardian,40.67,-7.97
"Today, we are most apt to encounter the phrase in a political context: who is looking after the politicians who are supposed to be looking after us?",Right,1,american-greatness,18.93,22.45
"Aside from pervasive pro-terror attitudes, the actual track record of violence among Palestinian refugees should also serve as a dire warning.",Right,1,american-greatness,18.93,22.45
Why shouldn’t Trump be leading Biden given the historic failures of the Biden administration?,Right,1,american-greatness,18.93,22.45
"In this stressed economic environment of widespread financial angst, the last thing America needs is a torrent of migrants, whether at our Southern border or via some globalist operation to airlift Palestinians to Main Street, USA.",Right,1,american-greatness,18.93,22.45
Theirs is an America of anger against the nation’s entire past and even against nature itself.,Right,1,american-greatness,18.93,22.45
"All told, 45.3 million Americans hold outstanding student loans as of fiscal year 2022.",Right,0,american-greatness,18.93,22.45
"But aside from her racist and Marxist agenda, she has been named by a government ethics group as one of the most corrupt members of Congress.",Right,1,american-greatness,18.93,22.45
"In the book, Levin outlines in great detail the Democrat Party’s history of anti-black racism, and anti-semitism, which has now morphed into anti-white racism, more anti-semitism (at least they’re consistent), a war against Catholics, its destruction of the nuclear family, its Orwellian control of language and thought, and its war against the Constitution.",Right,1,american-greatness,18.93,22.45
But Biden thinks he can strongarm us into doing exactly that.,Right,1,american-greatness,18.93,22.45
"In fact, comparing present prices to levels before the virus panic, St. Louis Fed numbers show a median priced U.S. home rose from $313,000 in the beginning of 2019 to $416,000 today.",Right,0,american-greatness,18.93,22.45
He is not running to be your buddy or role model.,Right,0,townhall,24.95,19.79
Dr. Jaber now determines the direction and focus of all events.,Right,1,townhall,24.95,19.79
"For example, if a white person goes to college, gets a degree and a job, and then buys a home in an up-and-coming, affordable neighborhood, he is unwittingly contributing to systemic racism by pushing out people of color who rent in the neighborhood.",Right,1,townhall,24.95,19.79
"On October 14, 1980, President Jimmy Carter signed the Staggers Act that partially deregulated the rail industry and brought life back into an ailing industry, boosted productivity, and led to billions of dollars of consumer benefits, as well as lower prices for shippers.",Right,0,townhall,24.95,19.79
"It is no coincidence that this wind farm in Norfolk is partially owned by Masdar, and in turn the UAE.",Right,0,townhall,24.95,19.79
Anything less than an unmitigated Israeli victory in Gaza would be catastrophic.,Right,1,townhall,24.95,19.79
"If you see someone vandalizing a Jewish deli, film and report that person.",Right,0,townhall,24.95,19.79
"American and other world leaders need to come up with a plan that might work, not one based on wishful thinking.",Right,1,townhall,24.95,19.79
And how strong an influence do right-wing nationalists exert within the ranks of Milei's libertarian party?,Right,1,townhall,24.95,19.79
"Inside one, not only do you not see the issues people care about outside of your Chardonnay-soaked affinity group, but when someone does bring up these forbidden thoughts and ideas, you have no way to effectively argue for your own side because you have never had to before.",Right,1,townhall,24.95,19.79
"The last child born has just died at age 18, and a disillusioned bureaucrat (Clive Owen) is the unlikely champion in the fight for the survival of mankind.",Right,0,newsmax,28.9,13.54
"The Colorado case was filed by a liberal group, Citizens for Ethics and Responsibility in Washington, with significant legal resources.",Right,1,newsmax,28.9,13.54
"Some of their brightest minds continue to leave the country, seeking better opportunities abroad.",Right,0,newsmax,28.9,13.54
"Also, unlike some of the Gulf and southern Atlantic states, there is little chance of natural disaster to interrupt operations.",Right,0,newsmax,28.9,13.54
At the same time they’re confronted with other problems of adolescence.,Right,0,newsmax,28.9,13.54
But many leftists and Christmas-haters defended the city's decision to be tolerant and inclusive.,Right,1,newsmax,28.9,13.54
"Take a leisurely stroll down Aviles Street, the oldest street in America’s oldest city, and take in the many museums and old structures.",Right,0,newsmax,28.9,13.54
We also think they have an amazing live dealer casino and mobile online casino.,Right,0,newsmax,28.9,13.54
Some exchanges will even help you buy Bitcoin and several other cryptocurrencies right after your account is ready.,Right,0,newsmax,28.9,13.54
His effort culminated in a March 10 meeting between the Russian and Ukrainian foreign ministers in Turkey.,Right,0,infowars,15.78,23.58
"But, according to several sources who were present at the talks, the US blocked those talks too.",Right,0,infowars,15.78,23.58
"Ukraine’s allies fear the move could create a pretext for a new, dangerous stage in the war.",Right,0,infowars,15.78,23.58
The attrition of the Ukrainian forces has created a vulnerability that Russia now seems to be exploiting to launch their own version of a counteroffensive.,Right,0,infowars,15.78,23.58
"The three-decade fixed rate loan is, of course, a creation of the government and adds constant fuel to the US housing market.",Right,1,infowars,15.78,23.58
There are thus three specific points of contention that need to be resolved.,Right,0,infowars,15.78,23.58
It wasn't impressive or insightful in any way other than what you might see in the news.,Right,1,infowars,15.78,23.58
"He mentions the central bank only once in his piece, how it is controlling inflation by raising interest rates.",Right,0,infowars,15.78,23.58
"A total siege imposed by Israel on its border crossings to Gaza, and the anaemic flow of aid across Gaza’s border with Egypt, have left Gazans desperately short of food and water.",Lean Left,0,the-economist,42.4,-1.43
In the 2000s it grew to be Hong Kong’s most influential pro-democracy publication.,Lean Left,1,the-economist,42.4,-1.43
In the next 12 months a stumble by either candidate could determine the race-and thus upend the world.,Lean Left,1,the-economist,42.4,-1.43
"As in early modern Europe, women in developing countries have often been especially affected by Protestantism.",Lean Left,0,the-economist,42.4,-1.43
"That is until you consider the fact the country is experiencing a wave of corporate defaults, which includes half of the 50 largest property developers in 2020.",Lean Left,0,the-economist,42.4,-1.43
"Events fell into a pattern: Fatah’s leaders tried to get somewhere with negotiations, the Israeli government would build more settlements in the occupied territories (the number of settlers in the West Bank has quadrupled since Oslo), Hamas would send its suicide-bombers into Israel, and ordinary people on both sides would lose faith in the peace process.",Lean Left,1,the-economist,42.4,-1.43
"Look at public spending, though, and you would not know that a battle against inflation is raging.",Lean Left,1,the-economist,42.4,-1.43
The great advantage of passive aggression is not only that it allows us simultaneously to exercise and to deny our aggression but that it weaponises our vulnerability How might we cultivate forms of confrontation that allow us to express strong and difficult feelings without descending into aggression?,Lean Left,1,the-economist,42.4,-1.43
"Gender fluidity must be eradicated from public life entirely and, besides, Atrazine is turning frogs and boys gay!",Lean Right,1,reason,36.26,4.84
It feels like there's nothing they can do to change their situation.,Lean Right,0,reason,36.26,4.84
Many private equity funds were unhedged against floating rate risk and witnessed the liability agreements made during times of low rates rise significantly in the past year.,Lean Right,0,reason,36.26,4.84
So what is the role of trolling for Cody Wilson in achieving his political objectives?,Lean Right,1,reason,36.26,4.84
"And the whole idea of express toll lanes is to use variably priced tolls to keep the amount of traffic in those lanes free-flowing and below the level that will lead to unstable, stop-and-go congestion.",Lean Right,0,reason,36.26,4.84
Abbott now seems to be following Reynolds' footsteps in order to emulate her success in ousting school choice opponents from the legislature in order to pass measures giving all children the same options kids from wealthier families have in selecting education that works for them.,Lean Right,1,reason,36.26,4.84
COVID-19 Resilience Both the Port of Wilmington and the Port of Morehead City have continued to grow even through COVID-19’s peak and look to continue growing.,Lean Right,0,reason,36.26,4.84
The siren song of the Sunshine State is the promise of freedom tinged with the idea of escape-most perfectly channeled by the late Jimmy Buffett.,Lean Right,0,reason,36.26,4.84
He also wants Israel to commit to talks toward a two-state solution once the war ends.,Lean Left,0,washington-post,38.8,-6.85
"As the economy exited the pandemic, Trump policies slowing down immigration processing worsened labor shortages, which probably contributed to inflation.",Lean Left,1,washington-post,38.8,-6.85
"Naughty is an encounter with an especially fearsome Krampus, who has a hunchback, antlers and a mouth that resembles the Predator.",Lean Left,1,washington-post,38.8,-6.85
"But after 2021′s event, a local business owner complained on social media about their presence, and in later comments, connected it to Satanism.",Lean Left,1,washington-post,38.8,-6.85
But Cohen joined other public health experts in describing the situation as the usual fluctuations of any respiratory virus season.,Lean Left,0,washington-post,38.8,-6.85
Share this article Share This is why most principled conservatives have wanted to minimize the federal role in education instead of expanding it.,Lean Left,1,washington-post,38.8,-6.85
"According to archived versions of his profile, Santos started with a $75-per-video fee and quickly upped it before landing on a rate of $350 at the time of publication.",Lean Left,0,washington-post,38.8,-6.85
"Share this article Share When Blue’s upheld fist emerged, the crowd was ecstatic.",Lean Left,0,washington-post,38.8,-6.85
"Instead, the Biden administration and its big-spender allies in Congress have institutionalized multitrillion-dollar deficits, embedding the problem firmly into the fabric of federal finance.",Lean Right,1,fox-business,38.81,9.11
Millions of unwitting Americans were set to receive one (or multiple) 1099-K forms from the various platforms they used and expected to report that income to the IRS.,Lean Right,0,fox-business,38.81,9.11
Borrowers may have to agree to more stringent terms like high interest rates as banks try to reduce the financial risk on their end.,Lean Right,0,fox-business,38.81,9.11
While dominance in hockey and basketball have allowed Boston to claim the No.,Lean Right,0,fox-business,38.81,9.11
"Other famous pizzerias that could be affected include Lombardi’s in Little Italy, Arturo’s in Soho, John’s of Bleecker Street in Greenwich Village, Patsy’s in Turtle Bay and the Upper West Side, and Grimaldi’s near the Brooklyn Bridge.",Lean Right,0,fox-business,38.81,9.11
Reselling used items at a loss or sending money to family and friends is not taxable under the law.,Lean Right,0,fox-business,38.81,9.11
"The 34-year-old Kansas City Chiefs player, who has been romantically linked to the 33-year-old pop star since September, splurged on a lavish 17,000-square-foot estate in the suburb of Leawood, Kansas, reportedly closing on the deal last month.",Lean Right,1,fox-business,38.81,9.11
"Her appointment came after the firing of CEO Mark Tritton, following a sales slump and an unsuccessful move into private-label products.",Lean Right,0,fox-business,38.81,9.11
"Granted, this interactive baby teether is really for parents and grandparents to giggle over.",Lean Left,1,global-news,44.54,-4.26
The 2017 Canadian Survey on Disability found more than six million Canadians age 15 and over - 22 per cent of the population - identify as having a disability.,Lean Left,0,global-news,44.54,-4.26
"Pat Bell / Global News In fact, The New Reality heard from Iranian Canadians, legal experts, and security and intelligence sources who say Canada has an especially big problem with hundreds, maybe thousands, of potentially dangerous regime-connected officials here on Canadian soil.",Lean Left,0,global-news,44.54,-4.26
"Despite her eye-popping statistics sheet, Sinclair’s teammates describe her as unassuming and humble.",Lean Left,1,global-news,44.54,-4.26
"There’s two main things to do or look for to protect yourself online, according to officials.",Lean Left,0,global-news,44.54,-4.26
"In one video she claims the Patek Philippe Nautilus 5711 on her wrist costs 100,000 pounds, or about CAD$170,000 - more than double the average Canadian’s yearly income.",Lean Left,1,global-news,44.54,-4.26
"Story continues below advertisement City council played with the idea of adjusting the property tax ratio in Saskatoon during deliberations, with Coun.",Lean Left,0,global-news,44.54,-4.26
"Cold winter weather has rolled in, and so has dull, flaky skin-but it doesn’t have to stick around.",Lean Left,0,global-news,44.54,-4.26
"Especially in a culture that leans towards story and away from fact, even more so for our generation.",Lean Right,1,the-christian-post,36.41,10.31
"Household names like Bud Light, Target, Ben & Jerry's, and other woke corporations have aligned themselves with the vocal trans-minority movement.",Lean Right,1,the-christian-post,36.41,10.31
"Home Church & Ministries Max Lucado on returning to the true meaning of Christmas, pastoral burnout and a health update (exclusive) As the world grapples with unprecedented challenges, pastor and bestselling author Max Lucado is calling for a return to the foundational truths of the Christmas season, urging believers and the broader community to rediscover the peace and resilience found in the story of Jesus Christ's birth.",Lean Right,0,the-christian-post,36.41,10.31
"Home Living Travel: Postcard from Quebec City With Christmas rapidly approaching, now is the time to visit Quebec City.",Lean Right,0,the-christian-post,36.41,10.31
"We must continually give our testimonies, not only of our salvation but of His daily blessings to us.",Lean Right,1,the-christian-post,36.41,10.31
"As such, Christians should rightly understand surrogacy as fundamentally immoral, unethical, and sinful.",Lean Right,1,the-christian-post,36.41,10.31
"For the purposes of this article, let’s look at the question the disciples asked Jesus about this man.",Lean Right,0,the-christian-post,36.41,10.31
"Genesis 1:3-4, ESV But the astonishing realities we are talking about get even more puzzling.",Lean Right,1,the-christian-post,36.41,10.31
"Once the Wolbachia-positive mosquitos are self-sustaining in the wild, then rates of dengue, yellow fever, Zika, and more decrease.",Left,0,vox,39.59,-10.05
"Part of that is due to how small the sample sizes of college-educated voters of color are; the overwhelming majority of these voters do not have college degrees, so he classifies them as working-class voters.",Left,0,vox,39.59,-10.05
But now your good behavior has nothing at all to do with it.,Left,1,vox,39.59,-10.05
Pfizer said in September that it expected about one in four Americans to get the latest shot.,Left,0,vox,39.59,-10.05
Scientists soon announced they were exploring Ozempic’s potential for slowing down dementia and treating substance abuse disorder.,Left,0,vox,39.59,-10.05
