text,source,label,reliability,bias
"Hundreds of unarmed Washington, D.C., National Guard troops are on standby to assist law enforcement personnel with protecting monuments, after protesters tried to tear down a statue of former President Andrew Jackson in a park near the White House on Monday.",reuters,0,45.18,-1.17
"Those fighting for Black racial equality in Britain need to put realistic reform over dreams of revolution, said Imarn Ayton, an activist who has had a prominent role in protests that swept London in recent weeks.",reuters,1,45.18,-1.17
Gay and bisexual men in Scotland prosecuted for consensual same-sex activity will receive an automatic pardon under a law which came into effect on Tuesday aiming to correct a “historic wrong” but stopped short of offering compensation.,reuters,0,45.18,-1.17
"Thousands marched through U.S. cities on Friday in Juneteenth observances marking the abolition of slavery more than a century and a half ago, an occasion freighted with special resonance this year amid America’s reckoning with its legacy of racism.",reuters,0,45.18,-1.17
"deadline for the U.S. Internal Revenue Service to turn President Donald Trump’s tax returns over to a congressional tax oversight committee expired on Tuesday without lawmakers receiving the documents, a committee aide said.",reuters,0,45.18,-1.17
NBA teams bowed their heads and knelt during the playing of the U.S. national anthem while wearing Black Lives Matter T-shirts on Thursday as the league returned for the first time since the coronavirus halted play in March with two thrilling games.,reuters,0,45.18,-1.17
Police in Milwaukee on Thursday identified the five brewery employees shot and killed by a co-worker who later took his own life in the latest spasm of gun violence plaguing U.S. workplaces and schools.,reuters,1,45.18,-1.17
"Trump, who has faced criticism over his handling of the pandemic, said China must be “held accountable” for failing to contain the disease.",reuters,0,45.18,-1.17
"After regaining control of the House of Representatives in the 2018 midterm elections, some Democratic lawmakers have been calling for higher taxes on the wealthy.",reuters,0,45.18,-1.17
"Trump, whose first rally of the coronavirus pandemic on Saturday in Tulsa, Oklahoma, drew fewer supporters than expected and was seen as exposing weaknesses in his campaign, pushed a law-and-order theme in Phoenix before a cheering audience of several-thousand young people.",reuters,0,45.18,-1.17
"A Multnomah County, Oregon, court had charged Reinoehl with the murder of Aaron Danielson on Saturday, and Portland police issued a warrant for his arrest, asking U.S. marshals to locate him.",reuters,0,45.18,-1.17
"Russia trying to steal COVID-19 vaccine data, say UK, U.S. and Canada",reuters,0,45.18,-1.17
"Floyd died after a white police officer, Derek Chauvin, knelt on his neck for nearly nine minutes while detaining him on May 25.",reuters,0,45.18,-1.17
"Protests, including in Portland, have at times erupted into arson and violence, and federal officers sent into the Northwestern city have repeatedly clashed with crowds targeting the federal courthouse there.",reuters,0,45.18,-1.17
"Last week, black transgender woman Iyanna Dior was beaten by a mob at a gas station in Minneapolis, and video of the attack has gone viral online with millions of viewers.",reuters,0,45.18,-1.17
"Northam, who is leading the push for stronger gun laws in his state, said he wants to avoid a repeat of violence that erupted at a 2017 white supremacist rally in Charlottesville, when a march by white nationalists erupted and led to the death of a counterprotester.",reuters,1,45.18,-1.17
Durkan is among Democratic mayors who have called for an end to violence at protests against racism and police brutality after Republican President Donald Trump used images of the destruction for his re-election campaign.,reuters,0,45.18,-1.17
"U.S. President Donald Trump sought to turn nationwide protests to his political advantage in a campaign appearance in the election swing state of Arizona on Tuesday, vowing to prevent “the left-wing mob” from pushing the United States into chaos.",reuters,0,45.18,-1.17
Harvey Weinstein’s rape trial took a dramatic turn on Tuesday as the judge threatened to revoke his bail and jail the former film producer after catching him using his cellphone just as jury selection got underway.,reuters,0,45.18,-1.17
"The outline, which puts numbers to several policy proposals for the first time, would implement a new minimum fee on companies that report a profit on their books but manage to pay far less than the official tax rate, which could affect companies such as e-commerce giant Amazon.com Inc.",reuters,0,45.18,-1.17
"Mexico said on Monday it would reject a U.S. idea to take in all Central American asylum seekers if it is raised at talks this week with the Trump administration, which has threatened to impose tariffs if Mexico does not crack down on illegal immigration.",reuters,0,45.18,-1.17
"Janet Yellen, the first woman to lead the Fed, said she ramped up efforts once she was appointed chair in 2014.",reuters,0,45.18,-1.17
"In a written statement, the White House said Harris’ suggestion that politics is influencing vaccine approvals “is not only false but is a danger to the American public.”",reuters,0,45.18,-1.17
"Floyd’s death has added to the disquiet among Black residents in Tulsa, which saw its own demonstrations in 2017 after a white police officer was acquitted of manslaughter for shooting a Black man during a routine traffic stop.",reuters,0,45.18,-1.17
"Starting in 2020, Medicare Advantage plans will also be able to offer supplemental non-health related benefits to chronically ill enrollees that address their social needs, CMS Administrator Seema Verma said. ",reuters,0,45.18,-1.17
"The intersection of big data capabilities and prevalence of social media has transformed the business of jury research in the United States, which once meant gleaning information about potential jurors from car bumper stickers or the appearance of a home.",reuters,0,45.18,-1.17
"Democrats are pursuing Trump’s returns under a legal authority that aims to prevent interference from the White House on the Treasury’s decision whether to release the tax returns, in what the White House chief of staff has called a “political stunt.”",reuters,0,45.18,-1.17
Apple and luxury labels such as Gucci have lowered their prices in China after a cut in its value-added tax (VAT) rate came into effect from April 1.,reuters,0,45.18,-1.17
"The death in Minneapolis on Monday of George Floyd, the black man captured on video pleading for his life as a white police officer kneeled on his neck, has prompted three nights of protests, at times giving rise to violence, arson and looting.",reuters,0,45.18,-1.17
"A team of scientists in Australia said on Wednesday they have successfully developed a lab-grown version of the new coronavirus, the first to be recreated outside of China, in a breakthrough that could help quicken the creation of a vaccine.",reuters,0,45.18,-1.17
"In California, where personal income taxes account for about 70% of the state’s general fund revenue, a year-over-year increase of 35.2% last month made up for lagging revenue from the tax in December and January, according to H.D. Palmer, a spokesman for the state’s finance department.",reuters,0,45.18,-1.17
"Guns caused the life expectancy of black Americans to drop by more than four years from 2000 to 2016, twice as much as the decline in life expectancy of white Americans during the same period, according to an academic study published on Tuesday.",reuters,0,45.18,-1.17
"During the fifth debate in the Democratic race to pick a challenger to Trump in the November 2020 election, the 10 candidates aired differences on healthcare and taxing the wealthy, but kept the exchanges largely polite and instead heaped heavy criticism on Trump.",reuters,0,45.18,-1.17
"In addition to flash-bang devices, police also used “pepper balls deployed into the ground and a burst of pepper spray” against the protesters, the department statement said, adding that no arrests were made.",reuters,0,45.18,-1.17
"Defense Secretary Mark Esper has issued a policy ushering in a de facto ban on displaying the Confederate flag at U.S. military installations around the world by authorizing only certain flags that promote unity, according to a copy of his memo, seen by Reuters on Friday.",reuters,0,45.18,-1.17
Harris suggested to CNN that Trump might seize on a vaccine - no matter how untested - to burnish his image.,reuters,0,45.18,-1.17
Trump made no mention at either campaign stop of the furor in Washington over his refusal on Wednesday to commit to a peaceful transfer of power if he loses the election.,reuters,0,45.18,-1.17
Republican Donald Trump is touting tax cuts and economic gains during his presidency as a reason why he should get re-elected in November 2020.,reuters,0,45.18,-1.17
"Democratic U.S. presidential candidate Joe Biden, who wears the nickname “working class Joe” with pride and courts a multi-racial voter base, faces a stern test of his ability to win nationally in Nevada’s mining towns and unionized gambling parlors.",reuters,0,45.18,-1.17
"The U.S. protests over racial injustice should address the violence and discrimination faced by black transgender women, rights groups said on Monday, with at least a dozen trans people murdered this year in the United States.",reuters,0,45.18,-1.17
"For the first time the annual risk report, compiled by the World Economic Forum (WEF), found the top five concerns were all environmental, from extreme weather to biodiversity loss and events like oil spills and radioactive contamination.",reuters,0,45.18,-1.17
"Amid pressure from Washington, Mexico is backpedaling on promises of better treatment for Central American migrants, leaving hundreds stranded in unsanitary camps near its southern border and allegations of irregular detentions.",reuters,0,45.18,-1.17
Gun-control activists have reported a growing number of online death threats as lawmakers have passed gun control legislation ahead of the rally.,reuters,0,45.18,-1.17
"Retailers, pharmacies, liquor stores and other merchants across the United States are gobbling up insurance that protects buildings from damage caused by societal unrest, worried about possible street violence after the U.S. presidential election, insurers and brokers told Reuters.",reuters,1,45.18,-1.17
A group of artists climbed ladders up one of the many blast walls snaking through the Afghan capital Kabul this week to paint a mural of George Floyd in solidarity with the anti-racism protests kindled by his death in police custody.,reuters,0,45.18,-1.17
U.S. gun makers American Outdoor and Strum Ruger & Company Inc RGR.N have been under pressure as retailers take steps to limit firearms sales following mass shootings in the country that has sparked a nationwide debate on gun control laws.,reuters,0,45.18,-1.17
"Democrats, who won control of the House in the November 2018 U.S. elections, say Trump’s personal returns would reveal whether he has complied with U.S. tax laws and any IRS audits, as well as his effective tax rate, business and investment income and charitable contributions.",reuters,0,45.18,-1.17
A U.S. advocacy group calling for tougher gun regulations said on Wednesday it will spend $8 million this year to support the campaigns of Texas politicians who back stronger restrictions on owning firearms.,reuters,0,45.18,-1.17
"In one 2018 study, researchers with Brandeis University in Massachusetts found that respite programmes could save several thousands of dollars per hospital patient by cutting down on expensive readmissions.",reuters,0,45.18,-1.17
"Novartis AG on Wednesday won highly anticipated U.S. approval for the first of a new type of potent gene-modifying immunotherapy for leukemia, a $475,000 treatment that marks the start of a potential new treatment paradigm for some cancers.",reuters,0,45.18,-1.17
"Shares of firearms sellers tumbled on Monday as promising data from a COVID-19 vaccine trial knocked stay-at-home stocks, and as civil unrest failed to materialize after Democrat Joe Biden emerged as the winner of last week’s presidential election.",reuters,0,45.18,-1.17
"Stephanie Robinson, 23, a rookie Black police officer on Detroit’s West Side, has been challenged by Black residents about her loyalty while on patrol since the death of George Floyd under the knee of a white police officer.",reuters,0,45.18,-1.17
The Trump administration is working on a plan to let the Social Security Administration (SSA) check up on claimants on Facebook and Twitter in order to root out fraud and abuse in the disability program.,reuters,0,45.18,-1.17
"As streets fill with protesters calling for an end to racial injustice, police brutality and the mass incarceration of black men, one group of activists is raising the question: why not abolish prisons altogether?",reuters,0,45.18,-1.17
Many Democratic congressional candidates in 2018 attacked Republican opponents for bowing to the gun lobby.,reuters,1,45.18,-1.17
"President Donald Trump has slammed the idea of police defunding, tweeting that the “Radical Left Democrats have gone Crazy!,” and many Democrats including presumptive presidential nominee Joe Biden have called for more measured reform.",reuters,1,45.18,-1.17
"Marianne Williamson, the self-help guru who warned of the “dark psychic force” unleashed by Republican President Donald Trump, suspended her quixotic outsider campaign for the 2020 Democratic presidential nomination on Friday.",reuters,1,45.18,-1.17
"Following his arrest on July 6, 2019, financier Jeffrey Epstein pleaded not guilty to sex trafficking charges involving dozens of underage girls at his mansions on Manhattan’s Upper East Side and in Palm Beach, Florida. ",reuters,0,45.18,-1.17
"President Donald Trump, addressing a less-than-full arena for his first political rally in months, blasted anti-racism protests and defended his handling of the coronavirus on Saturday in a bid to reinvigorate his re-election campaign.",reuters,0,45.18,-1.17
"In a bid to stop the spread of the virus, Malaysia’s religious affairs minister has issued guidelines for holding Friday prayers at mosques, including shortening sermons and for the wudhu, or ablution rites, to be carried out at home if possible.",reuters,0,45.18,-1.17
"Gervais, the no-holds-barred British comedian, returns for a fifth time and is already promising to let the barbs fly.",reuters,0,45.18,-1.17
"Trump sought to use the event to bring momentum back to his campaign after coming under fire for his responses to the coronavirus and to the death of George Floyd, a Black man who died in the custody of Minneapolis police.",reuters,0,45.18,-1.17
"The Chinese city of Wuhan, epicenter of a new coronavirus outbreak, will build a dedicated hospital to treat patients, which it aims to complete in six days, state media outlet Beijing News reported on Thursday, citing an unnamed source at the construction company that will build it.",reuters,0,45.18,-1.17
George Soros does not “own” ANTIFA or Black Lives Matter.,reuters,0,45.18,-1.17
"U.S. Senator Elizabeth Warren, who has emerged as a top contender to challenge Republican President Donald Trump, has faced criticism from moderate rivals including former Vice President Joe Biden over her Medicare for All proposal, which would eventually eliminate most private insurance in favor of a government-run plan.",reuters,0,45.18,-1.17
"According to the poll, 52% of American adults say they are sympathetic to those who are still gathering to protest the police treatment of minorities, especially African Americans, about 12 percentage points lower than a similar poll that ran in mid-June.",reuters,0,45.18,-1.17
"The No. 1 vaccine refusal hotspot is in New York, a new report from the Blue Cross Blue Shield Association finds.",msnbc,0,34.51,-14.03
"The note, which was full of anti-Semitic language and lauded white supremacy, named the Christchurch shooter and the man accused of fatally shooting 11 people.",msnbc,1,34.51,-14.03
"At the dawn of the year 2010, few Americans could predict that the coming decade would revolutionize the legal and cultural landscape for lesbian, gay, bisexual, transgender and queer people.",msnbc,0,34.51,-14.03
The Trump administration has continued to deny climate change findings and make scientific reports inaccessible to the public.,msnbc,0,34.51,-14.03
Senator Kamala Harris (D-CA) tells Lawrence O'Donnell that Donald Trump fuming about a Black Lives Matter sign in front of Trump Tower is why the attention should be focused on passing the George Floyd Justice and Policing Act.,msnbc,1,34.51,-14.03
The Republican president assumed he was helping the industry at the expense of the environment – a trade-off Trump was happy to make since he rejects climate science anyway. ,msnbc,1,34.51,-14.03
"Almost all of this is gibberish; Trump still can’t speak coherently about California’s wildfires; and no officials in the Golden State ever conceded that he was “right” about the subject, because he wasn’t.",msnbc,1,34.51,-14.03
We finally know what it takes to get the House to examine gun violence: it’s not a mass shooting; it’s an election.,msnbc,0,34.51,-14.03
"With more than 80,000 reported cases of the disease, the viral outbreak continues to create uncertainty about future competitions, from track and field and Formula 1 to the ultimate global event, the 2020 Tokyo Olympics.",msnbc,0,34.51,-14.03
"Ohio's Down syndrome abortion ban and similar proposals around the country have triggered emotional debate over women’s rights, parental love, and the trust between doctor and patient.",msnbc,0,34.51,-14.03
"A federal judge on Wednesday temporarily blocked a Trump administration order that allowed state and local governments to refuse the resettling of refugees, finding the policy likely “unlawful.”",msnbc,0,34.51,-14.03
"Pompeo also spoke with the Wichita Eagle in November, and that interview turned messy, too.",msnbc,1,34.51,-14.03
"Indeed, that original NYT report suggested that the management at Trump’s club in New Jersey was well aware of the fact that it employed undocumented immigrants, and it deliberately took steps to obscure the fact that it broke the law – repeatedly, over the course of several years.",msnbc,1,34.51,-14.03
"Before the shooting death of women's rights activist and artist Isabel Cabanillas de la Torre in Ciudad Juarez, Mexico, human rights attorneys and others already had noted several years of rising femicides in the border city.",msnbc,0,34.51,-14.03
"Sen. Bernie Sanders, I-Vt., went after Pete Buttigieg Friday for the former South Bend mayor's support from big-money donors at the final New Hampshire Institute of Politics' “Politics & Eggs” event of the cycle.",msnbc,0,34.51,-14.03
"America's atrociously inadequate welfare state makes it by far the most vulnerable rich country to a viral pandemic, and the vicious, right-wing ideology of the Republican Party has wrecked the government's ability to manage crises of any kind.",msnbc,1,34.51,-14.03
A Guatemalan mom who says she sustained severe chemical burns and was sexually assaulted in front of her young daughter during a kidnapping in Mexico is asking the U.S. government to let her into the country while her asylum case plays out.,msnbc,0,34.51,-14.03
"It’s only a matter of time, the argument goes, before the Roe v. Wade precedent is struck down at the hands of five conservative justices, two of whom are on the high court thanks to Trump.",msnbc,1,34.51,-14.03
"Trump again drew a misleading comparison between the coronavirus and the seasonal flu, telling his supporters that ""35,000 on average each year die from the flu, that's a lot of people.""",msnbc,1,34.51,-14.03
"Biden and Bernie Sanders delivered pointed, somber speeches on the crisis as markets continued to dive and the administration's response came under criticism.",msnbc,0,34.51,-14.03
"House Democrats introduced a sweeping policing reform measure on Thursday named for George Floyd, in an effort to take action after his death and the resulting worldwide protests over racism and police brutality.",msnbc,0,34.51,-14.03
"Republicans argued that children need a parent's permission to go on a school field trip and can't go to an R-rated movie without a parent or guardian, so it makes no sense to make a life-altering decision about abortion on their own.",msnbc,0,34.51,-14.03
"Research shows combining vaccine misinformation with alternative medicine, homeopathy and diet content this way is one of the most pervasive and persuasive techniques used by anti-vaccination advocates to forward their agenda.",msnbc,0,34.51,-14.03
The Roman Catholic Church allows only men to be ordained as priests and women have traditionally been consigned to the shadows of its administration.,msnbc,0,34.51,-14.03
"When the nation's highest civilian honor went to a right-wing media personality, it served as an oddly appropriate capstone to Trump's broader goals.",msnbc,1,34.51,-14.03
The sharp reductions documented in carbon emissions and air pollution caused by coronavirus-related lockdowns have offered a sort of preview of the kind of improvements that can be made when drastic action is taken.,msnbc,0,34.51,-14.03
"In an era in which domestic terrorism is an increasingly deadly societal scourge, it’s dangerous when a sitting American president lies to rabid followers with tales of infants being executed in medical facilities.",msnbc,1,34.51,-14.03
"President Donald Trump said Monday that he is looking at a possible payroll tax cut, along with other measures, to help American workers and boost the economy, which has been hit hard by the coronavirus outbreak.",msnbc,0,34.51,-14.03
Germany tries to stop Trump from luring away firm working on coronavirus vaccine.,msnbc,0,34.51,-14.03
"In practical terms, Trump wants to make the transition from dramatically curtailing refugee admissions to effectively ending refugee admissions.",msnbc,1,34.51,-14.03
"Opposition to immunizations was once largely limited to online bullying, but now opponents are increasingly taking their harassment tactics into the real world: aggressively following legislators and doctors and, in some cases, using physical violence.",msnbc,1,34.51,-14.03
"Spencer speculated that the media may be ""soulless golem,"" a reference to magically animated beings from Jewish folklore.",msnbc,1,34.51,-14.03
"For the first time in its nearly century-and-a-half history, Wimbledon was canceled for a reason other than war, scrapped in 2020 on Wednesday because of the coronavirus pandemic.",msnbc,0,34.51,-14.03
"After days of mounting pressure, the top soccer clubs in Britain said Friday they would ask their players to take a 30 percent pay cut as the sport grapples with the damaging fallout from the coronavirus crisis.",msnbc,0,34.51,-14.03
"Donald Trump, who was pro-choice in the not-too-distant past and never fit the mold of a far-right culture-war crusader, has taken a keen interest in abortion rights lately.",msnbc,1,34.51,-14.03
"In a September executive order, President Donald Trump gave states and local governments the right to reject refugees, but instead of saying no, most state and local officials have blindsided the administration by opting in, according to two former officials familiar with the matter.",msnbc,1,34.51,-14.03
"Senators voted to shelve the bill for the year and ask the state crime commission to study the issue, an outcome that drew cheers from a committee room packed with gun advocates.",msnbc,0,34.51,-14.03
"This unholy, unscientific alliance of right-wingers, COVID-19 truthers and anti-vaxxers became very clear recently following the viral spread of an anti-COVID-19 propaganda movie called “Plandemic,” featuring disgraced scientist-turned-anti-vaxxer ...",msnbc,1,34.51,-14.03
"Miller is the architect of President Donald Trump's hardline immigration policies that have separated children from parents, forced people seeking asylum in the U.S. to wait in Mexico under squalid conditions, instituted the Muslim ban and poured money from the military into border wall construction.",msnbc,1,34.51,-14.03
"There was a point a few years ago at which some GOP officials, fearing a backlash in response to the “war on women,” pretended to be pro-choice and used highly deceptive rhetoric about contraception as a way to improve their electoral prospects.",msnbc,1,34.51,-14.03
"The result was a mess: car manufacturers, which had already begun taking steps to comply with the Obama-era tough fuel-efficiency standards for the auto industry, faced the prospect of having to make different vehicles to sell in different parts of the country.",msnbc,0,34.51,-14.03
"As the former vice president criticizes President Donald Trump's cuts to programs for the poor, he is likely to face questions about his own record.",msnbc,0,34.51,-14.03
"Pope Francis named the first woman to hold a high-ranking post in the Secretariat of State, the male-dominated Vatican's diplomatic and administrative nerve center.",msnbc,0,34.51,-14.03
"The Republican president entered the initial round of talks with the North Korean dictator in Singapore with minimal preparation – Trump went so far as to mock the very idea of doing pre-summit homework – and soon after, he made a series of concessions to Kim Jong-un in exchange for effectively nothing.",msnbc,1,34.51,-14.03
Many Democratic voters have said they believe that sexism does makes it harder for women to win than for men.,msnbc,0,34.51,-14.03
"With the Olympic Games postponed until 2021 and cinemas closed across the country, whole segments of the advertising market have evaporated.",msnbc,0,34.51,-14.03
