text,source,label,reliability,bias
"After Donald Trump won the presidency in 2016 and the left-wing terrorists in Antifa took to the streets, everything changed again.",breitbart,1,31.15,13.7
"The remarks, by the BBC’s head of drama Piers Wenger, will confirm what many viewers have long suspected: that the BBC isn’t interested in making quality programming any more – only in enforcing the politically correct obsessions (equality, diversity, etc) of the narrow, metropolitan liberal elite.",breitbart,1,31.15,13.7
"During the segment, Colbert also bemoaned the fact that Barack Obama is no longer president.",breitbart,0,31.15,13.7
"Greek leftists in the city of Thessaloniki set fire to an American flag in front of a United States consulate, claiming to be doing so in solidarity with “U.S. insurgents”.",breitbart,1,31.15,13.7
"And now, some children from anti-vaccination families are seeking help as they confront fears that they will become infected.",breitbart,0,31.15,13.7
"Cancellation of a two-week United Nations meeting on gender equality, female empowerment and “women’s issues” due to the coronavirus outbreak sparked an outcry from 12,000 disappointed delegates, diplomats and non-government organizations scheduled to fly into New York for the event and work towards ending “default male thinking” across the globalist organization.",breitbart,1,31.15,13.7
"What this means is that in these particular countries, local law enforcement agree to not enforce anti-gun laws, especially dangerous radical ones like confiscation, bans, mandatory registration, and limiting the size of magazines.",breitbart,1,31.15,13.7
"Tokyo Games is even more of a dream fulfilled for the small baseball community in Israel, comprised mostly of American immigrants, and which has languished for decades in the country’s sporting wilderness.",breitbart,0,31.15,13.7
"And as discussed below, the idea that there is a real personal trait called “gender” that challenges or invalidates the identity significance of biological sex is equally fallacious.",breitbart,1,31.15,13.7
"Anyone who has seen the Sky series Chernobyl will recognise the kind of stolid, bureaucratic mindset captured in this damning paragraph from the report.",breitbart,1,31.15,13.7
"However, this is not the senator’s first time criticizing Bannon based off of misleading reports in the media.",breitbart,0,31.15,13.7
The Europeans have set up a complicated barter-type system to skirt direct financial transactions with Iran and so evade possible U.S. sanctions.,breitbart,1,31.15,13.7
"In response to Hawley’s criticisms, Sargent went to his blog Monday night to accuse Hawley of racialist dog-whistles.",breitbart,1,31.15,13.7
But Buttigieg’s liberal elite background has not stopped him from claiming the mantle of a Democrat political figure in a Republican “red state.”,breitbart,1,31.15,13.7
"Everything in the progressive agenda is aimed at dismantling nationhood, hence the creation of strains of victimhood according to gender and ethnicity.",breitbart,1,31.15,13.7
Democrat presidential hopeful Pete Buttigieg apparently felt the sting of Rush Limbaugh’s recent comments about his masculinity and lashed out at the radio icon and Trump supporters in an interview with Ellen DeGeneres.,breitbart,1,31.15,13.7
"he Centers for Medicare and Medicaid Services (CMS) announced on Monday that the average premium for the benchmark ACA plan, or the second-lowest costing silver plan, fell by two percent for the 2021 coverage year. ",breitbart,0,31.15,13.7
"Japanese public broadcaster NHK issued an apology on Tuesday after deleting an animated video from its Twitter account that was meant to explain the anti-police protests rocking America, but instead caused outrage over its callous depiction of black people.",breitbart,0,31.15,13.7
"There was no immediate confirmation from US officials about the alleged plan to slash US troop numbers in Germany and cap them at 25,000 in future. But Trump’s lukewarm support of longstanding cooperation agreements with European allies has long caused alarm on the continent.",breitbart,1,31.15,13.7
"A narrow plurality of Democrats favor allowing men who say they are transgender to enter women’s sports, but the change is opposed two-to-one by adults, independents, parents, and middle-class voters, says a poll by Rasmussen Reports.",breitbart,0,31.15,13.7
Sen. Amy Klobuchar (D-MN) boasted that she worked on the nuclear deal and similarly applauded it.,breitbart,1,31.15,13.7
"In so doing, Hawley, populist firebrand that he is, showed that he was willing to overturn the stale orthodoxies that have mildewed our economy and undermined our security.",breitbart,1,31.15,13.7
"Issuing a defiant call to arms to grassroots Republicans, former White House chief strategist Steve Bannon railed Friday against dangerous “global elites” and the Silicon Valley “lords of technology” whom he said are robbing U.S. citizens of jobs, wealth and opportunity.",breitbart,1,31.15,13.7
"On how the woke-left police the new orthodoxy of thought, Farage said “Fear is what dominating absolutely everything”, pointing out political activists would vilify dissenters online, in the street, and agitate against businesses to deprive funding.",breitbart,1,31.15,13.7
"On Thursday, West also agreed to make a $2 million donation in support of George Floyd and Ahmaud Abrery’s family members as well as black-owned businesses in Chicago and other cities.",breitbart,0,31.15,13.7
"President Donald Trump in an interview on Wednesday ripped former Vice President Joe Biden for failing on race relations, after 43 years in public office.",breitbart,1,31.15,13.7
Nationwide riots have wreaked havoc and destruction across America over the past week in response to the death of Minneapolis man George Floyd in police custody. ,breitbart,1,31.15,13.7
"On Sunday, the Observatory said pro-Ankara fighters executed three civilians who were hiding in an industrial part of Ras al-Ain.",breitbart,0,31.15,13.7
Rap superstar Kanye West has hinted at postponing his bid for the U.S. presidency after questioning whether all black people should be voting for Democratic nominee Joe Biden.,breitbart,0,31.15,13.7
"According to politician Ralph Brinkhaus, a member of Chancellor Angela Merkel’s Christian Democratic Union (CDU), a Muslim German Chancellor could be a reality as early as 2030.",breitbart,0,31.15,13.7
Lawmakers specifically said they want to protect women from facing unfair competition from men who claim to be transgender women.,breitbart,1,31.15,13.7
The corporate media are now describing the burning and looting of cities as “political speech.”,breitbart,1,31.15,13.7
The federal government under President Trump’s leadership has done a great deal to effectively respond to the crisis and support struggling Americans and their businesses.,breitbart,0,31.15,13.7
"FNC’s Carlson Slams Cowering, Dithering American Leaders for Riot Response — ‘This Is How Nations Collapse’",breitbart,1,31.15,13.7
Sanders says his $1.5 trillion housing for all plan and $1.5 trillion universal child care/pre-K plan will be paid for with “a wealth tax on the top one-tenth of one percent – those who have a net worth of at least $32 million.”,breitbart,0,31.15,13.7
A total of 61 Democrats have signed onto a House Resolution demanding President Trump import five times the number of foreign refugees that have arrived this Fiscal Year.,breitbart,0,31.15,13.7
"As part of Pelosi’s coronavirus plan, House Democrats slipped in multiple measures from their H.R. 1 legislation that would implement nationwide ballot harvesting for federal elections — effectively allowing political operatives to collect and deliver an endless number of absentee ballots from voters.",breitbart,1,31.15,13.7
"While the piece fairly analyzes the fracturing of the white nationalist movement, it makes the bizarre claim that ideas that are widely popular amongst mainstream conservatives, such as ending affirmative action, are actually white nationalist in origin.",breitbart,1,31.15,13.7
Tuesday’s fundraiser was hardly the first time that Biden has made false accusations that Trump is sympathetic toward antisemitism.,breitbart,1,31.15,13.7
"The Conservatives may have surrendered every last joint of ideological backbone to the forces of Social Justice, identity politics and weaponised resentment.",breitbart,1,31.15,13.7
Wikipedia’s coverage of other contentious political topics such as abortion were also criticized with Sanger singling out Wikipedia claiming abortion is “one of the safest procedures in medicine.”,breitbart,1,31.15,13.7
"In fact, New York City Mayor Bill de Blasio announced in late June that he plans to cut the police budget by one billion dollars in the next city budget.",breitbart,0,31.15,13.7
"Kailee Scales, managing director for Black Lives Matter Network Action Fund and Black Lives Matter Global Network, Inc., has been universally panned for her performance in an online Q&A where she dodged simple questions about where donations to the movement actually go.",breitbart,1,31.15,13.7
"In practice, the U.S. quietly provides health care to at least ten million illegal migrants who are in the United States, while also erecting tough physical and legal barriers to the arrival of yet more illegal aliens.",breitbart,0,31.15,13.7
"A three-year-old girl in China’s Jiangsu province died after receiving a rabies vaccination last month, an ominous development in light of persistent scandals over low-quality and improperly-handled vaccines.",breitbart,1,31.15,13.7
A report compiled by members of the French Senate has detailed the spread of political Islam across France and listed 44 proposals to combat radical Islamist ideology.,breitbart,0,31.15,13.7
"The huge political decision follows a sustained lobbying campaign by gay and transgender groups, wealthy transgender activists, law school professors, and other elite groups.",breitbart,1,31.15,13.7
AP Confirms: Democrats Are Lying to the Public About Coronavirus Readiness...,breitbart,0,31.15,13.7
"But Trump’s pro-American policies are frustrating judges who were appointed by former President Barack Obama, prompting some to leave and open new slots for Trump-appointed judges.",breitbart,1,31.15,13.7
Disney’s executives stopped advertising on Tucker Carlson’s television show as he repeatedly urged President Donald Trump to shut down their pipeline of H-1B visa workers into the white collar jobs that would otherwise go to Americans.,breitbart,0,31.15,13.7
Perhaps they refused because Scalise emerged from the shooting understanding that people must be armed to defend themselves when under fire.,breitbart,0,31.15,13.7
"Model and left-wing activist Emily Ratajkowski celebrated Easter Sunday, the most important day in the Christian calendar, by posting racy photos of herself in a thong.",breitbart,1,31.15,13.7
"Security measures are in place as there are concerns radical groups could face off in Richmond, but Democrat office holders and their surrogates in the gun control movement, as well as establishment media reporters, are working hard to paint the entire gun rally as a meeting of extremists and racists.",breitbart,1,31.15,13.7
The desperate liars at NBC News are comparing President Trump to Democrat-segregationist George Wallace because he wants to protect America’s suburbs.,breitbart,1,31.15,13.7
"Whitmer takes on Trump for claiming the economy is booming, asking “for whom?” … She details local pieces of legislation Dem. Governors are working on before claiming Democrats are the ones who actually fight for hardworking Americans.",breitbart,1,31.15,13.7
Biden’s shift radically leftward reflects that of his party.,breitbart,1,31.15,13.7
He misses the fact that the bank shooting highlighted the failure of gun control–particularly Florida’s red flag law and waiting periods–rather than the need for it.,breitbart,0,31.15,13.7
"If you had a choice between, say, indulging Boris Johnson’s self-aggrandising predilection for grands projets — such as HS2 or his lunatic proposed tunnel to Ireland — or having more of your own money to spend on things you actually wanted, which would you choose?",breitbart,1,31.15,13.7
Migrants in the United States sent about $103 billion in mostly untaxed remittances to six foreign countries last year — including about $19 billion to China.,breitbart,0,31.15,13.7
"Michael Mann, arguably the world’s no. 1 climate alarmist, does not explain how it was possible for him to witness climate change “first hand,” which would be difficult to do, since by definition climate change — unlike weather — takes place over long periods of time.",breitbart,0,31.15,13.7
"Sen. Kamala Harris (D-CA), the Democratic Party nominee for vice president, told 60 Minutes on Sunday evening that she believed that President Trump is a racist.",breitbart,0,31.15,13.7
"Middle-class exodus: From 2007 to 2016, California lost a net million residents — some 2.5% of its population (which still grows due to births and immigration). ",breitbart,1,31.15,13.7
A recent study found that college students from high-income households are borrowing more money for school than students from households with lower incomes. The report added that students from wealthier families are responsible for some of the more drastic borrowing increases in recent years.,breitbart,0,31.15,13.7
Harry Potter creator J.K. Rowling released a lengthy essay in response to the mounting attacks she’s received from transgender activists forcing an effort to erase womanhood and targeting the Harry Potter author for refusing accept their logic that a man can “become” a woman merely by asserting that he has done so.,breitbart,1,31.15,13.7
Pelosi made similar comments claiming that President Trump’s possible re-election threatens the world as House Democrats readied two articles of impeachment against the president.,breitbart,1,31.15,13.7
Factual analyses have dismantled this false narrative put forth by some in the mainstream media.,breitbart,0,31.15,13.7
"A young, slender woman with a sign reading “End All Violence” stood at the doors and pleaded with the looters to stop. ",breitbart,1,31.15,13.7
"So we flee far from the controlling  grasp of the left — either to Rural America and to the suburbs, and Joe Biden intends to destroy all of that, starting with the suburbs.",breitbart,1,31.15,13.7
The Vegan Society has said that vegans should be given their own shelf in refrigerators at work and employers should protect them from offensive jokes about their dietary choices.,breitbart,0,31.15,13.7
Bernie whacks Trump on pre-existing conditions,breitbart,1,31.15,13.7
"In October, Breitbart London reported that French police are allegedly actively assisting migrants to avoid detection by UK Border Force, telling them when and when not to attempt to cross the channel, according to a people smuggler.",breitbart,0,31.15,13.7
"As Black Lives Matter rioters coursed through the city, Lightfoot attempted to lock the protesters out of the Loop area by raising the bridges over the Chicago River and blockading highway exits feeding into downtown.",breitbart,1,31.15,13.7
Rowe then dismantled each of Atkins’ unsubstantiated points. He lambasted celebrities for constantly broadcasting their political opinions as though their views have any impact on most Americans.,breitbart,1,31.15,13.7
Gates added that raising taxes on the wealthy would narrow the wealth gap between the richest and poorest of Americans.,breitbart,0,31.15,13.7
"Regardless of the chatter and ongoing analysis from political pundits, commentators, and officials, Harris has a well-documented record of embracing radical progressive ideas, touting them herself on numerous occasions.",breitbart,0,31.15,13.7
"Prior to the outbreak, it was legal for pro-life advocates to gather at a certain distance outside of abortion clinics to offer women alternatives to ending the life of their unborn child.",breitbart,1,31.15,13.7
"That is because much of what Newsom and the Democrats value in California has to do with good intentions, rather than real-world results.",breitbart,1,31.15,13.7
Here — keep a sick bag handy as you watch — are some Hollywood celebrities putting their special actor voices on to tell us how ashamed they are of being white.,breitbart,1,31.15,13.7
The protests in London come days after Black Lives Matter and Antifa flooded the streets of the British capital over the weekend — with little to no regard for the government-mandated social distancing — calling “to burn this shit down” and hailing the chaos and riots in America as a sign that the “West is Falling”.,breitbart,1,31.15,13.7
"With radical feminists and extremist trans activists seeking to have her publishers and film associates ban her from earning a living, she understands how the radical left seeks not to merely disagree with their opponents, but to destroy them utterly as human beings.",breitbart,1,31.15,13.7
"His $16.3 trillion Green New Deal plan, perhaps one of his most prolific proposals, will be paid for, he claims, through a variety of methods including slashes in military spending and lawsuits against the fossil fuel industry.",breitbart,1,31.15,13.7
"Bohai Harvest RST (BHR), a private equity firm bankrolled by the Chinese government that is tied to Hunter Biden, invested in an alleged African “blood mine”.",breitbart,0,31.15,13.7
"Washington Redskins head coach Ron Rivera says that he will support his players if they protest during the playing of the national anthem, according to a report.",breitbart,0,31.15,13.7
"In a desperate attempt to gin up some free publicity, the makers of Faith Based, a movie that mocks Christians and Christianity, felt they had to target Breitbart News readers.",breitbart,1,31.15,13.7
"Now today, the San Francisco mindset is still, shall we say, peculiar. It’s a city, after all, where old-money trust-fund types, addled with guilt, have joined with nouveaux riche tech tycoons to create a bizarre overclass ideology that’s a part Karl Marx, one part MSNBC, one part Michel Foucault, and maybe even a little bit of Ayn Rand.",breitbart,1,31.15,13.7
"Child rights agency UNICEF on Wednesday called for the Nigerian government to “urgently review the case” of a 13-year-old boy sentenced to ten years in prison for blasphemy last month in majority Muslim Kano State, which practices sharia, the Islamic law.",breitbart,0,31.15,13.7
"To the thinking person, the claim doesn’t make sense. How could this be a new phenomenon adopted from the small white nationalist movement when mainstream conservatives have been fighting to end affirmative action for decades?",breitbart,1,31.15,13.7
Warren’s speech included leftist talking points — from corporations’ alleged mistreatment of American workers and unions to the dangers of “cutthroat capitalism” and the pitfalls of free trade.,breitbart,1,31.15,13.7
China appears to be feeding off similar complaints from the left in the United States. Complaints about partisan “gridlock” are perennial and grow especially loud when Democrats and their highly sympathetic media are the ones complaining about Republicans getting in their way.,breitbart,1,31.15,13.7
"Even prior to Trump formally announcing Barrett as his nominee, leftists launched a string of attacks, targeting her faith, family, and conservative positions.",breitbart,1,31.15,13.7
"On Saturday, several thousand protesters were seen marching in the French capital — defying the country’s China virus lockdown measures — as a part of the ‘March of Solidarity’ for migrants “without papers” — a left-wing euphemism for illegal aliens.",breitbart,1,31.15,13.7
"The wealthy are quite reasonably reluctant to give away more of their money than they have to and would simply move to more tax friendly jurisdictions, thus meaning the governments in high tax jurisdictions would have less to spend on worthy projects.",breitbart,0,31.15,13.7
"Using the same alarmist language he has employed to describe illegal immigration, Trump painted Democrat-led cities as out of control and lashed out at the “radical left,” which he blamed for rising violence in some cities, even though criminal justice experts say it defies easy explanation.",breitbart,1,31.15,13.7
"He warned protestors not to use Floyd’s death to “tear up the Alamo or tear up a restaurant,” or use it as an excuse to burn or steal.",breitbart,0,31.15,13.7
"In stark contrast to the arrests of peaceful anti-lockdown protesters in Hyde Park the day before, the Metropolitan Police took no actions to stop the left-wing demonstration that lasted well into the evening and spanned several miles of the city.",breitbart,1,31.15,13.7
"So the goal is to keep people poor, keep ’em scared, keep their schools crappy (no school choice, no charter schools), tell them there’s no hope because America is evil and racist — in other words, keep ’em voting for Democrats.",breitbart,1,31.15,13.7
Democrats Push Pork for Planned Parenthood in Coronavirus Package,breitbart,1,31.15,13.7
"The new law forces radical sexual ideology and its indoctrination into the minds and hearts of our children again, without parental recourse.",breitbart,1,31.15,13.7
"Transgender ideology says each persons’ preferences are — and should be — unconnected from their bodies. It says that men and women are interchangeable, and can switch their sex by switching their own sense of “gender identity” so that men who say they are women really do become biological women, complete with female penises.",breitbart,1,31.15,13.7
Swedish police are hunting for members of an anti-Islam group from Denmark who are alleged to have burned a copy of the Qur’an in Stockholm’s no-go Rinkeby suburb.,breitbart,0,31.15,13.7
"The demonstrators stopped in the center of town and took a knee to honor George Floyd, who was killed in the custody of police in Minneapolis, Minnesota, on Memorial Day.",breitbart,0,31.15,13.7
"Sanders also claims his Green New Deal plan will create 20 million jobs, which will effectively create a new tax base and eliminate the need for $1.31 trillion in “federal and state safety net spending due to the creation of millions of good-paying, unionized jobs.”",breitbart,0,31.15,13.7
"The whole anti-vaxx (as it became known) thing was nuts, a way for fading celebrities to pretend to be the vanguard of a Great Cause that Saved The Children from a sinister government conspiracy.",breitbart,1,31.15,13.7
Bezos is merely the scam’s latest and most outrageously profligate useful idiot.,breitbart,1,31.15,13.7
"In a viral video posted on Thursday, Candace Owens rejected the widely assumed notion that black deaths at the hands of the police is systemic and widespread.",breitbart,0,31.15,13.7
"Long-simmering tensions between Japan and South Korea exploded at the beginning of July, when Japan imposed restrictions on the export of chemicals crucial to electronics manufacturing to South Korea. ",breitbart,1,31.15,13.7
"Many conservatives came to Hawley’s defense, slamming Tapper’s attack on the Missouri senator.",breitbart,1,31.15,13.7
CBS Late Show host Stephen Colbert claimed on Tuesday that President Donald Trump’s describing himself as a “nationalist” serves as an indication of his hidden sympathy for white nationalist movements such as Ku Klux Klan.,breitbart,1,31.15,13.7
"The Turkmen government also published photos of contact sporting events such as wrestling and martial arts, which most of the world has canceled to prevent the spread of the deadly pathogen originating in central Wuhan, China.",breitbart,1,31.15,13.7
"The New York Times described Sunday’s nationwide riots as a wave of police violence against “protesters and bystanders,” even as law enforcement abandoned large urban areas to rioters and looters who ran amok for hours.",breitbart,0,31.15,13.7
"To begin with, the left’s organized and oppressive violence has no effect on us, and that’s primarily because the left-wing terrorists in Antifa and Black Lives Matter know not to come out here.",breitbart,1,31.15,13.7
"President Donald Trump proposed eliminating federal payroll taxes altogether for the rest of the year, according to a report from CNBC Tuesday.",breitbart,0,31.15,13.7
"Remittances from the three Central Americans countries are being spiked by the growing inflow of asylum-seeking migrants into blue-collar jobs throughout the U.S. economy, via the border’s catch-and-release laws.",breitbart,0,31.15,13.7
"The Woke Taliban have declared the anti-racism of colorblindness racism, but we hicks don’t subscribe to that nonsense — and never will.",breitbart,1,31.15,13.7
Winston Churchill was a ‘racist’. Or so the Black Lives Matter graffiti says on the plinth of his statue in London’s Parliament Square which is bound to be pulled down by hard-left activists sooner or later because the police don’t seem to have that much of an appetite to save it.,breitbart,1,31.15,13.7
"You need to keep a close eye on what your school is teaching because the left only wants to teach your kids to engage in loveless sex, the sanctity of abortion, why America is evil, that men are women and women are men, and that Global Warming is real. (It’s not.)",breitbart,1,31.15,13.7
"The Democratic Party’s presumptive nominee, former Vice President Joe Biden, has made the protection and expansion of Obamacare one of the signature issues of his campaign.",breitbart,0,31.15,13.7
This comes in response to Biden and members of his so-called coronavirus task force suggesting another shutdown may be necessary as COVID-19 cases are spiking in some areas of the United States.,breitbart,1,31.15,13.7
