text,source,label,reliability,bias
"Despite fears that neo-Nazis or other extremists would piggyback on the Richmond rally to stoke unrest like the violence at a 2017 demonstration by white nationalists in Charlottesville that killed a counter-protester, the Capitol Police reported just one arrest, a 21-year-old woman taken into custody for wearing a bandana over her face after twice being warned that masks were not allowed.",reuters,0,45.18,-1.17
The July 27-28 poll also showed a largely partisan reaction to Trump’s decision to deploy federal agents to quell demonstrators in some cities against the wishes of local authorities. ,reuters,0,45.18,-1.17
"Russia and China are working to develop a coronavirus vaccine and Beijing has handed over the genome of the virus to Moscow, a Russian diplomatic mission in China said on Wednesday.",reuters,0,45.18,-1.17
"One example of a Medicaid waiver involves work rules, which require able-bodied adults to work a minimum number of hours each month or participate in an equivalent activity as a condition for continued Medicaid eligibility. ",reuters,1,45.18,-1.17
"Under current immigration policies, it’s possible that immigration arrests could lead to poor mental health by increasing deportation fears among undocumented individuals and their families and neighbors, the study authors write.",reuters,0,45.18,-1.17
"China has ample capability to make COVID-19 vaccine and will prioritise supplies to developing countries when they are ready, the foreign ministry added.",reuters,0,45.18,-1.17
may,reuters,0,45.18,-1.17
"In general, people with mental or physical disabilities were 13 percent more likely to be arrested as juveniles or young adults than people free of disability, according to the report in the American Journal of Public Health.",reuters,0,45.18,-1.17
It marked the second incident in as many days of a vehicle driving at people protesting Floyd’s death after a New York City Police car was captured on video on Saturday driving into a crowd of protesters who were pelting it with objects.,reuters,1,45.18,-1.17
Egyptian lawmakers have called for stricter surveillance of women on video sharing apps after the arrests of a popular social media influencer and a well-known belly dancer on charges of debauchery and inciting immorality.,reuters,0,45.18,-1.17
"Thursday’s announcement was the latest move by the Trump administration to undercut the 2010 Affordable Care Act, former Democratic President Barack Obama’s signature domestic policy achievement.",reuters,0,45.18,-1.17
"n the U.S. justice system, prosecutors can present findings to a grand jury to decide if there is sufficient evidence to bring charges against a suspect.",reuters,0,45.18,-1.17
"U.S. lawmakers will try this week to revive efforts to enact police reform legislation in Congress, a Republican senator said on Sunday, after moves to address police misconduct following the death of George Floyd deteriorated into partisan bickering.",reuters,0,45.18,-1.17
"President Donald Trump on Saturday hailed a court decision against Obamacare as “a great ruling for our country,” while a U.S. government official said the decision by a Texas judge would have no immediate impact on health coverage.",reuters,0,45.18,-1.17
"Gay sex remains banned under a British colonial-era law, while dressing as the opposite sex is illegal.",reuters,0,45.18,-1.17
"Just before breakfast on a Sunday morning, Ugandan security forces stormed an LGBT+ shelter outside the capital Kampala, accusing more than 20 gay, bisexual and transgender people of spreading the new coronavirus.",reuters,0,45.18,-1.17
"In the United States, the outbreak of the new coronavirus and efforts to prepare for its possible spread have become political in a presidential election year.",reuters,0,45.18,-1.17
Manchester City manager Pep Guardiola said white people should apologise for the treatment of black people on a night when Premier League players wore the slogan “Black Lives Matter” on their shirts.,reuters,0,45.18,-1.17
"In addition to temporarily sending in state police troopers and officers from neighboring jurisdictions, the FBI and federal prosecutors will add resources to prosecute criminal offenses stemming from protests, Brown said.",reuters,0,45.18,-1.17
"A Joe Biden presidency could reset ties with top U.S. trade partner Mexico that have suffered since Donald Trump made his first White House bid, tarring Mexican migrants as rapists and gun-runners and vowing to keep them out with a border wall.",reuters,1,45.18,-1.17
"The outbreak, which began in the central Chinese city of Wuhan, also worried financial markets as investors recalled China’s Severe Acute Respiratory Syndrome (SARS) epidemic in 2002-2003, a coronavirus outbreak that killed nearly 800 people.",reuters,0,45.18,-1.17
The city of Cape Town has partnered with the Department of Water and Sanitation to distribute 41 million liters of water into informal settlements to aid handwashing to stem the virus spread.,reuters,0,45.18,-1.17
The Affordable Care Act’s (ACA) “risk adjustment” program is intended to incentivize health insurers to cover individuals with pre-existing and chronic conditions by collecting money from insurers with relatively healthy enrollees to offset the costs of other insurers with sicker ones.,reuters,0,45.18,-1.17
"Novartis AG on Wednesday won highly anticipated U.S. approval for the first of a new type of potent gene-modifying immunotherapy for leukemia, a $475,000 treatment that marks the start of a potential new treatment paradigm for some cancers.",reuters,0,45.18,-1.17
"Rowling has come under fire for speaking out on trans issues, including raising concerns that trans rights are eroding women’s rights to single-sex spaces and suggesting young women are being rushed into medical transition.",reuters,0,45.18,-1.17
U.S. gun makers American Outdoor and Strum Ruger & Company Inc RGR.N have been under pressure as retailers take steps to limit firearms sales following mass shootings in the country that has sparked a nationwide debate on gun control laws.,reuters,0,45.18,-1.17
"Those comments appeared part of a broader Chinese strategy to suggest the virus emerged outside China, as well as to denigrate the West’s own domestic response.",reuters,0,45.18,-1.17
"Author J.K. Rowling has joined 150 high-profile figures on an open letter warning that free speech is under threat due an “intolerance of opposing views”, after coming under attack for her comments about transgender issues.",reuters,0,45.18,-1.17
"Some taxpayers accelerated their tax payments into December 2017 to head off the cap, inflating states’ calendar year-end tax collections.",reuters,0,45.18,-1.17
"Police broke up scuffles between supporters of President Donald Trump and Black Lives Matter activists and arrested two people in Salem, Oregon, on Monday as protests in the region turn increasingly violent.",reuters,0,45.18,-1.17
"London police will crackdown on illegal street parties after officers came under attack for the second night running as they tried to disperse an unauthorised gathering, the capital’s police chief said on Friday.",reuters,0,45.18,-1.17
The EU has secured up to 400 million doses of AstraZeneca’s experimental vaccine.,reuters,0,45.18,-1.17
"Some 300 Thais and foreigners in Thailand and elsewhere joined an online protest against racism on Sunday, adding their voices to global calls for justice for black American George Floyd who died in U.S. police custody in Minneapolis last month.",reuters,0,45.18,-1.17
"Members of the House of Representatives tax committee also pointed to other segments of Cohen’s testimony as topics likely to draw further scrutiny, including claims that Trump deflated the value of his properties to lower his tax bill and called the government “stupid” for giving him a $10 million tax refund in 2008.",reuters,1,45.18,-1.17
"The tweet comes on the heels of Trump’s hostile response to protests against racial injustice engulfing the United States following the death of Floyd, an unarmed Black man who died after a white police officer knelt on his neck for almost nine minutes in Minneapolis.",reuters,1,45.18,-1.17
U.S. Treasury Secretary Steven Mnuchin said on Tuesday that Treasury Department lawyers had held “informational” discussions with the White House about an expected request from House Democrats for President Donald Trump’s tax returns.,reuters,0,45.18,-1.17
Harvey Weinstein’s rape trial took a dramatic turn on Tuesday as the judge threatened to revoke his bail and jail the former film producer after catching him using his cellphone just as jury selection got underway.,reuters,0,45.18,-1.17
"The U.S. government has begun preparing to distribute the vaccines, including talking to private companies about developing technology to track their deployment and monitor who has received them.",reuters,0,45.18,-1.17
"U.S. health insurer Anthem Inc is pulling back from 16 of 19 pricing regions in California where it offered Obamacare options this year, state officials said on Tuesday.",reuters,0,45.18,-1.17
"Barr also defended his decision to forcefully push peaceful protesters back from the White House on Monday evening, saying rioting had gotten out of control over the weekend.",reuters,0,45.18,-1.17
"In one Senate committee, a bipartisan effort was under way on Tuesday to repair Obamacare without repealing it, led by the Republican health committee chairman, Lamar Alexander, and the panel’s top Democrat, Patty Murray.",reuters,0,45.18,-1.17
"The Virginia Senate late on Thursday passed bills to require background checks on all firearms sales, limit handgun purchases to one a month, and restore local governments’ right to ban weapons from public buildings and other venues.",reuters,0,45.18,-1.17
"When a newly organized vaccine research group at the U.S. National Institutes of Health (NIH) met for the first time this week, its members had expected to be able to ease into their work. But their mandate is to conduct human trials for emerging health threats - and their first assignment came at shocking speed.",reuters,0,45.18,-1.17
"China’s second-quarter economic growth slowed to its weakest pace in at least 27 years, in line with expectations, as demand at home and abroad cooled in the face of a bruising trade war with the United States.",reuters,0,45.18,-1.17
"Group of 20 finance ministers agreed on Sunday to compile common rules to close loopholes used by global tech giants such as Facebook to reduce their corporate taxes, a final communique issued by the bloc showed on Sunday.",reuters,0,45.18,-1.17
"If an FBI background check takes longer than three business days, a gun dealer can sell the firearm to a buyer, under current regulations.",reuters,0,45.18,-1.17
"As streets fill with protesters calling for an end to racial injustice, police brutality and the mass incarceration of black men, one group of activists is raising the question: why not abolish prisons altogether?",reuters,0,45.18,-1.17
Trump pledged to ban the devices soon after a gunman used them to shoot and kill 58 people at a country music festival in Las Vegas in October 2017.,reuters,0,45.18,-1.17
"A surge in people buying guns since the coronavirus pandemic began has flooded the FBI’s background check system, causing a spike in the number of delayed checks and allowing gun sales to proceed without them, FBI data disclosed on Tuesday showed.",reuters,0,45.18,-1.17
"Russia trying to steal COVID-19 vaccine data, say UK, U.S. and Canada",reuters,0,45.18,-1.17
"Before they decide whether to let this stand, congressional Republicans should probably have an uncomfortable conversation.",msnbc,1,34.51,-14.03
He lied about matters large and small. He refused to shake House Speaker Nancy Pelosi's outstretched hand. He talked up a divisive culture war.,msnbc,1,34.51,-14.03
"The SPLC last year released hundreds of emails of Stephen Miller,the architect of Trump’s immigration policies such as the child-parent separations at the border and the Muslim ban, in which he cited and promoted ""explicitly white nationalist websites.""",msnbc,0,34.51,-14.03
"America's atrociously inadequate welfare state makes it by far the most vulnerable rich country to a viral pandemic, and the vicious, right-wing ideology of the Republican Party has wrecked the government's ability to manage crises of any kind.",msnbc,1,34.51,-14.03
"Some of the local governments choosing to accept refugees voted heavily in favor of Trump in 2016, after an election campaign in which he vowed to clamp down on immigration and the flow of refugees — particularly Muslim refugees.",msnbc,1,34.51,-14.03
"Threre are some concerns about whether some of the goals set by the Green New Deal are realistic, but to argue that the blueprint is genocidal is hopelessly bonkers.",msnbc,1,34.51,-14.03
It wasn't long after Donald Trump and his team took office that they looked for ways to make things easier for polluters.,msnbc,1,34.51,-14.03
Obama’s joke about moat with alligators came to mind while reading a newly published report from the New York Times on Donald Trump’s zealotry on border policy.,msnbc,1,34.51,-14.03
"Donald Trump appeared to make some important news via Twitter last night, announcing a dramatic new plan to use Immigration and Customs Enforcement (ICE) agents to remove “millions” of people from American soil.",msnbc,1,34.51,-14.03
"Mulvaney apparently didn’t see this line of inquiry coming, so he was left in an awkward spot: Democrats are trying to embarrass Trump, but his chief of staff has no idea why Trump would be embarrassed by his own tax materials.",msnbc,1,34.51,-14.03
"This group is small but vocal, and represents a predictable if threatening merging of forces.",msnbc,1,34.51,-14.03
Drowned out by the algorithm: Vaccination advocates struggle to be heard online,msnbc,1,34.51,-14.03
"The nation's chief diplomat didn't seem to agree, however. He complained about the line of inquiry and complained about the Obama administration for a while.",msnbc,1,34.51,-14.03
"The note, which was full of anti-Semitic language and lauded white supremacy, named the Christchurch shooter and the man accused of fatally shooting 11 people.",msnbc,1,34.51,-14.03
Critics of the Trump administration’s immigration policies have said such policies violate migrants’ rights and further endanger them by making them wait in dangerous border towns or in one of the most violent countries in the world lacking robust asylum systems.,msnbc,0,34.51,-14.03
"Last summer, the Republican White House announced plans to roll back the tougher standards, making it easier for the automotive industry to sell less efficient vehicles that pollute more.",msnbc,0,34.51,-14.03
"The antifa movement — a network of loosely organized radical groups who use direct action to fight the far-right and fascism — has been targeted by President Donald Trump as the force behind some of the violence and property destruction seen at some protests, though little evidence has been provided for such claims.",msnbc,0,34.51,-14.03
Lebanese citizens from across sectarian divides came together in a rare display in unity late last year after proposed tax hikes enraged an already struggling populace.,msnbc,1,34.51,-14.03
"In a September executive order, President Donald Trump gave states and local governments the right to reject refugees, but instead of saying no, most state and local officials have blindsided the administration by opting in, according to two former officials familiar with the matter.",msnbc,1,34.51,-14.03
"Track and field athletes don’t typically earn the lucrative salaries seen in the NBA, NFL, tennis or international soccer.",msnbc,0,34.51,-14.03
The votes come as a new conservative majority on the nation’s highest court has made abortion rights supporters nervous. ,msnbc,0,34.51,-14.03
"We could also point out how many of us said Trump and his party, unable to pay for their massive tax breaks for the wealthy, would invariably go after Medicare and Medicaid to help finance the tax giveaways – just as Republicans are doing now.",msnbc,0,34.51,-14.03
"We could turn our attention to the fact that Republicans spent much of the last decade falsely accusing Democrats of supporting Medicare cuts through the Affordable Care Act, only to have a GOP White House actually propose taking an ax to the social-insurance program.",msnbc,0,34.51,-14.03
Part of the reason billionaires can swoop in and position themselves as the saviors on so many different issues — climate change being the latest — is that government has failed to take bold action.,msnbc,0,34.51,-14.03
"In fact, the scenario of killing babies after they're born that Trump depicted was ridiculously false.",msnbc,1,34.51,-14.03
"In Australia, record high temperatures and drought exacerbated by the climate crisis have ignited blazes that have killed more than two dozen people and destroyed 2,000 homes since September.",msnbc,0,34.51,-14.03
"Procter and Gamble, a major sponsor of the US Women’s National Soccer team, has backed the players in their fight for equal pay, with a public donation of $529,000.",msnbc,0,34.51,-14.03
"Tedros and his agency have been on the defensive after President Donald Trump of the United States — the WHO’s biggest single donor — last week ordered a halt to U.S. funding for the agency, alleging that it botched the early response to the outbreak.",msnbc,1,34.51,-14.03
"But decades of study have shown no link at all, and scientists are becoming increasingly impatient with the refusal to accept their findings.",msnbc,0,34.51,-14.03
"In a series of early morning tweets on July 26, 2017, that reportedly took the Department of Defense by surprise, President Donald Trump announced that he was reinstating the repealed ban on transgender military service.",msnbc,0,34.51,-14.03
"Violence against women has plagued Mexico for years and the many killings of women drew international attention when they spiked in the 1990s, about the time of the signing of the North American Free Trade Agreement and of an increase in Juarez of manufacturing plants known as maquiladoras.",msnbc,1,34.51,-14.03
"Currently, women make up only about a quarter of workers in STEM careers, and they earn considerably less than men.",msnbc,0,34.51,-14.03
"Backlash against marginalized communities doesn’t surprise University of Southern California Professor Chris Freeman, whose work primarily focuses on 20th century gay and lesbian studies.",msnbc,0,34.51,-14.03
"By any sensible measure, the Trump administration is among the worst ever seen for respecting, valuing, and following science.",msnbc,1,34.51,-14.03
Democratic lawmakers and environmental groups say the changes will exempt polluters from public scrutiny of their projects.,msnbc,0,34.51,-14.03
Coronavirus: E.U. blasts Trump's travel ban as it unleashes chaos and confusion.,msnbc,1,34.51,-14.03
The Roman Catholic Church allows only men to be ordained as priests and women have traditionally been consigned to the shadows of its administration.,msnbc,0,34.51,-14.03
"Warren would forgive up to $50,000 for each individual earning less than $100,000, which would dramatically impact Americans with undergraduate degrees, but likely only make a small dent for Americans with graduate degrees.",usa-today,0,40.78,-4.12
It’s a new decade and women now hold more jobs than men but they also still hold onto the majority of household duties.,usa-today,0,40.78,-4.12
"While NYC has largely tamed the lethal and highly contagious coronavirus, another epidemic is starting to rear its ugly head in the city once again — violent crimes.",breitbart,1,31.15,13.7
French sporting goods retailer Decathlon has confirmed they will not be stocking a sports hijab after public backlash and threats of a mass boycott.,breitbart,0,31.15,13.7
"Banks lamented that China has now become a partisan issue simply because Trump has blamed China for trying to hide the discovery of the coronavirus in Wuhan, China, and allowing it to spread to the rest of the world.",breitbart,1,31.15,13.7
"The Law and Justice (PiS) party politician promised to “protect the interests of the family” from dangers such as pornography and to “defend the institution of marriage”, stressing that the nuclear family is rooted in Polish tradition and is the institution on which society is built.",breitbart,1,31.15,13.7
President of Belarus refuses to cancel sports and scoffs at ‘Psychosis’ of coronavirus measures.,breitbart,1,31.15,13.7
"The movement known as NeverTrump — self-identified conservatives who vowed never to vote for Donald Trump, even at the price of a Hillary Clinton presidency and liberal dominance of the Supreme Court for generations — did not take long to recover from the shock of Trump’s victory in November.",breitbart,1,31.15,13.7
"Yes, the rich are rich and want to stay that way, and yet at the same time, fat cats now lean left, even far left, on cultural issues–and they want you to do as you’re told. ",breitbart,1,31.15,13.7
The protestors reportedly are demanding that  Gov. Andrew Cuomo hike taxes on the state’s billionaires to make up for the revenue shortfall created by the Chinese coronavirus pandemic. ,breitbart,0,31.15,13.7
Chicago Police Superintendent David Brown described the 20-year-old as an armed male who allegedly pointed a gun at officers and “shot at officers first.”,breitbart,0,31.15,13.7
Leonhardt’s column in the New York Times provides more evidence that elite Americans are so enamored of immigration and diversity that they would throw the college graduate class under the bus rather than give up their visions of ruling over a chaotic and fractured “diverse” society.,breitbart,1,31.15,13.7
Joe Biden appeared to suffer trouble with his teleprompter on Friday and said George Floyd was to blame for his delayed jobs plan.,breitbart,0,31.15,13.7
"The Redskins tweeted the hashtag, but Ocasio-Cortez couldn’t let that happen without taking a shot at the Redskins name.",breitbart,1,31.15,13.7
Many critics point to the most obvious flaw in MMT: that it would simply push the federal deficit and the national debt — already skyrocketing — to further and further extremes.,breitbart,0,31.15,13.7
Some 25 mosques in London and dozens more throughout the country began to use public address systems to connect with Muslims last month as they were unable to attend religious services during the coronavirus crisis.,breitbart,0,31.15,13.7
"Already, American taxpayers are forced to annually subsidize about $18.5 billion in medical costs for illegal aliens, according to estimates by Chris Conover, formerly of the Center for Health Policy and Inequalities Research at Duke University.",breitbart,1,31.15,13.7
"But to Democrats, the tactic of demonizing Republicans as racists was nothing new",breitbart,1,31.15,13.7
"Rather than reducing federal subsidies to universities and placing the leftist institutions at the mercy of the free market, Obama wants to increase the amount students can borrow with interest from the government.",breitbart,1,31.15,13.7
"Author and Trump hater Stephen King is feeling the heat from fellow liberals following his tweets about the Academy Award nominations, in which he said that quality is more important than diversity when it comes to creating works of art.",breitbart,1,31.15,13.7
"Khamenei did not offer any “evidence” that the Wuhan virus is a biological attack on Iran and China, nor have any other Iranian officials making the case.",breitbart,1,31.15,13.7
"The Guardian, insisting that the climate emergency is “the defining issue of our times,” has amped up its climate agitation by suggesting that Australian wildfires is the new normal.
",breitbart,0,31.15,13.7
"As Breitbart News most recently reported, blue-collar Americans in landscaping, conservation work, the meatpacking industry, construction industry, and fishing jobs have had their wages dragged down by foreign workers imported through the H-2B visa program.",breitbart,1,31.15,13.7
"Good grief, what better example of the Democrat tyranny do you need than these anti-science lockdowns?",breitbart,1,31.15,13.7
Secretary of State Mike Pompeo urged Afghans not to squander an opportunity for lasting peace in remarks to the summit between Afghan government and Taliban leaders here that represents the beginning of peace negotiations.,breitbart,0,31.15,13.7
"Until recently, there seemed to be no broader plan behind NeverTrump’s early, and vigorous, opposition to Trump and his administration. But the contours of a plan have begun to emerge, particularly on social media, where the movement’s criticism of Trump alternates with praise for some of his opponents in the 2016 Republican primary.",breitbart,1,31.15,13.7
"According to The Guardian, many people are fearful of getting tested because of the possible anti-LGBT backlash they might receive.",breitbart,0,31.15,13.7
"And now we’re living through the 1619 Riots, and now the mask has been completely removed from the Democrat Party and media as we see vandalism, the desecration of our history, occupation, violent assaults against police and citizens, and the end of the rule of law encouraged, championed, and normalized.",breitbart,1,31.15,13.7
"Senator Jacqueline Eustache-Brinio, a member of the centre-right Republicans, said that nearly all of France is affected by radical Islam.",breitbart,1,31.15,13.7
"Doubling down, Rapaport — a raging left-wing Trump hater — tweeted “Singing slave owners.”",breitbart,1,31.15,13.7
The House Democrats’ coronavirus recovery bill allows several hundred thousand foreign workers to get college jobs or blue-collar jobs while millions of Americans lose their careers.,breitbart,0,31.15,13.7
