text,source,label,reliability,bias
"The bloc has also indicated that it wants to exercise some control over the extent to which Britain can cut its taxes in the name of a so-called “level playing field” — fearing that a less bureaucratic, lower tax Britain would be too competitive compared to a European Union notorious for red tape and inflexibility.",breitbart,1,31.15,13.7
"Portraying the president and his PiS allies as aggressors in a culture war, Reuters featured a quote from far-left presidential candidate Robert Biedron –who is himself gay — likening the Family Charter to policies favoured by former German Chancellor Adolf Hitler.",breitbart,1,31.15,13.7
"The head of the Communist Party’s special panel to address the coronavirus crisis, Zhong Nanshan, was quoted in state propaganda outlet Xinhua saying that the government believed the outbreak would peak within 7-10 days, then start subsiding.",breitbart,1,31.15,13.7
A total of 61 Democrats have signed onto a House Resolution demanding President Trump import five times the number of foreign refugees that have arrived this Fiscal Year.,breitbart,0,31.15,13.7
"On Sunday, the Observatory said pro-Ankara fighters executed three civilians who were hiding in an industrial part of Ras al-Ain.",breitbart,0,31.15,13.7
"Sure, they’re pretending to be righteously upset about the death of George Floyd – but this is a pretty pathetic excuse, given that obviously the British government is not remotely responsible for the actions of the Minneapolis police department. ",breitbart,1,31.15,13.7
"Drew Brees is now on his third 1984-ish public confession, a full-blown grovel tour, for the sin of expressing respect for the American flag.",breitbart,1,31.15,13.7
"As health officials around the globe work to stop the spread of the coronavirus, drug and diagnosis companies are working on ways to combat the virus that has killed 362 people in China, where it originated.",breitbart,0,31.15,13.7
"This would not be the first time Biden has been criticized for his ideas on combatting climate change, which – in the past – have paled in comparison to the ideas offered by ultra-progressive Sanders, who rolled out a massive $16 trillion Green New Deal plan this week.",breitbart,0,31.15,13.7
"The Trump administration and Republicans in Congress have stepped up their efforts to hold China accountable for intellectual property theft, unfair trade practices, and aggression towards U.S. allies in East Asia, as it seeks to replace the U.S. as the world’s superpower by 2049.",breitbart,0,31.15,13.7
The declaration that a man’s penis becomes a female penis once a man declares himself to be transgender is built on the transgender claim that men who say they are women are actually women. ,breitbart,1,31.15,13.7
Trump’s latest anti-China barb came as new figures showed 30 million Americans have lost their jobs during lockdown.,breitbart,1,31.15,13.7
"Khamenei did not offer any “evidence” that the Wuhan virus is a biological attack on Iran and China, nor have any other Iranian officials making the case.",breitbart,1,31.15,13.7
A woman who was the victim of a brutal gang rape attack in 2007 has spoken out about her ordeal and her attacker not being deported thanks to passengers aboard his flight.,breitbart,0,31.15,13.7
"The demonstrators stopped in the center of town and took a knee to honor George Floyd, who was killed in the custody of police in Minneapolis, Minnesota, on Memorial Day.",breitbart,0,31.15,13.7
"Author and Trump hater Stephen King is feeling the heat from fellow liberals following his tweets about the Academy Award nominations, in which he said that quality is more important than diversity when it comes to creating works of art.",breitbart,1,31.15,13.7
"The facts are these: with the protection of the Democrat Party and media, the marauders have been loosened. ",breitbart,1,31.15,13.7
"Whitmer takes on Trump for claiming the economy is booming, asking “for whom?” … She details local pieces of legislation Dem. Governors are working on before claiming Democrats are the ones who actually fight for hardworking Americans.",breitbart,1,31.15,13.7
"House Speaker Nancy Pelosi (D-CA) on Monday waxed hyperbolic about the 2020 presidential election, telling an audience that “civilization as we know it is at stake.”",breitbart,1,31.15,13.7
"In Chicago, Democratic Mayor Lori Lightfoot, who had initially blasted the news, said the U.S. attorney’s office will supervise the additional agents joining existing federal law enforcement offices.",breitbart,1,31.15,13.7
The desperate liars at NBC News are comparing President Trump to Democrat-segregationist George Wallace because he wants to protect America’s suburbs.,breitbart,1,31.15,13.7
Rowling refuses to buy into this anti-science trans nonsense that demands we all be gaslighted into believing a man can magically transform into a woman simply by saying he’s a woman followed by a chorus of “I Feel Pretty.”,breitbart,1,31.15,13.7
Climate Wunderkind Greta Thunberg has garnered gushing praise from celebrities during her environmental crusade.,breitbart,1,31.15,13.7
"Reducing the upper tax rate can often, counterintuitively, increase total government tax revenue — because the rich, instead of engaging in complicated (but legal) tax avoidance schemes, are happy to pay what they consider a fair rate.",breitbart,0,31.15,13.7
"Congress has not set an annual limit on the number of visa workers who can be sponsored for green cards, so the resident population of permanent “temporary workers” is growing fast — and is helping to suppress wages for American graduates.",breitbart,0,31.15,13.7
"Former Republican presidential nominee Mitt Romney took to Twitter on Monday morning to attack President Donald Trump, using the Martin Luther King Jr. holiday to suggest that Trump is a racist.",breitbart,1,31.15,13.7
"The new law forces radical sexual ideology and its indoctrination into the minds and hearts of our children again, without parental recourse.",breitbart,1,31.15,13.7
"In fact, there is every indication that the Obama administration, with the ideological support of the Hillary Clinton campaign team, along with their allies in the politically powerful refugee resettlement industry, continue to aggressively increase both the number of refugees they are bringing in to the United States and the number of locations where those refugees are being resettled.",breitbart,1,31.15,13.7
President Trump credited the travel ban in October for preventing Islamic State (ISIS) terrorists from entering the country.,breitbart,0,31.15,13.7
"On the heels of winning the female Ballon d’Or award on Monday, Rapinoe demanded that male soccer stars speak up on her political causes.",breitbart,0,31.15,13.7
Harris is also pushing legislation that would dramatically expand the legal and financial incentives for hundreds of thousands of Indian low-wage college graduates to take U.S.-based jobs from U.S. college graduates.,breitbart,1,31.15,13.7
"Female genital mutilation is illegal in Germany, leading many families to travel to their country of origin to have the gruesome ritual performed on their daughters.",breitbart,1,31.15,13.7
"In the Spectator, Matt Ridley provides further evidence that the leftist ideologues who infest Britain’s bloated, self-serving, inefficient healthcare bureaucracy are peevishly rejecting numerous offers from the private sector for political reasons",breitbart,1,31.15,13.7
"Biden made the apocalyptic pronouncement while discussing climate change before a crowd of supporters in Peterborough, New Hampshire.",breitbart,1,31.15,13.7
"The Wikimedia Foundation, which owns Wikipedia, last Wednesday joined the chorus of companies and organizations supporting the Black Lives Matter movement following the police-involved death of George Floyd.",breitbart,0,31.15,13.7
"Larry Sanger, the co-founder of Wikipedia, published a blog post this month declaring that the online encyclopedia’s “neutral point of view” policy is “dead” due to the rampant left-wing bias of the site.",breitbart,0,31.15,13.7
"During May, the abortion industry and its allies celebrated #SexEdForAll month, with proponents of comprehensive sex education (CSE) urging children be taught about sexual “pleasure” as part of the language of “medically accurate” sex ed.",breitbart,1,31.15,13.7
"Pop superstar Taylor Swift added to her growing list of social justice grievances, telling millions of fans in an LGBTQ pride video message that the two “gender” options on her census form — male and female — “was so upsetting to me, the erasure of transgender and nonbinary people.”",breitbart,0,31.15,13.7
Trump relishing in his dream job as Pundit-in-Chief.,breitbart,1,31.15,13.7
"So you have the New York Times, the Tax Policy Center and — AND — the godless liars at PolitiFact admitting “Biden’s plan would mean higher taxes on average for all income groups,” and the ad is rated still “mostly false.”",breitbart,1,31.15,13.7
"But how is Francis going to maintain that particular comedy persona now that we know that underneath he is a cowardly, politically correct, blubbing cry-baby who in fact really does care what a bunch of race-baiting, commie thugs think, and is so scared of losing his very well-paid job on mainstream TV that he’s prepared to grovel and humiliate himself in order to keep it?",breitbart,1,31.15,13.7
Bernie Sanders Claims Medicare for All Will Save Americans ‘Substantial Sums’,breitbart,1,31.15,13.7
"But to Democrats, the tactic of demonizing Republicans as racists was nothing new",breitbart,1,31.15,13.7
"So we flee far from the controlling  grasp of the left — either to Rural America and to the suburbs, and Joe Biden intends to destroy all of that, starting with the suburbs.",breitbart,1,31.15,13.7
"During the segment, Colbert also bemoaned the fact that Barack Obama is no longer president.",breitbart,0,31.15,13.7
Six Republican Senators have failed to develop a coalition for their plan that exchanges a fifth of border wall funding for an amnesty for illegal aliens and increased immigration.,breitbart,1,31.15,13.7
"Chinese state media outlets have been bursting with criticism for President Donald Trump during the current round of riots, but the Chinese Communist Party (CCP) also tossed a few bricks at former President Barack Obama and his Democrat Party, needling them for doing little about racial issues and touting China’s efforts to care for its poor and disenfranchised as vastly superior to the Democrats’ half-hearted socialism.",breitbart,1,31.15,13.7
Joe Biden appeared to suffer trouble with his teleprompter on Friday and said George Floyd was to blame for his delayed jobs plan.,breitbart,0,31.15,13.7
"The George Floyd protests have devolved into riots that have included looting, buildings being set on fire, businesses destroyed, the White House going on lockdown, and people being beaten and killed.",breitbart,1,31.15,13.7
The corporate media are now describing the burning and looting of cities as “political speech.”,breitbart,1,31.15,13.7
The American president’s threat to reverse that decision and impose the metals tariffs is the latest example of his mercurial approach to trade policy.,breitbart,1,31.15,13.7
"NBC cited Center for Countering Digital Hate, a group claiming to fight “hate and misinformation” online.",breitbart,1,31.15,13.7
This is far from the first time Klobuchar has dismissed Trump’s tax cuts.,breitbart,0,31.15,13.7
An internationally known virologist with a military background explained to Breitbart News the United States is vulnerable to potential pandemics due to production of vaccines overseas and a lack of interest in making significant changes to the National Pandemic Plan.,breitbart,1,31.15,13.7
"High unemployment numbers among foreign-born nationals have been an issue that has plagued Sweden for years, with reports often showing the migrant unemployment rate as being several times higher than that of native Swedes.",breitbart,0,31.15,13.7
"Model and left-wing activist Emily Ratajkowski celebrated Easter Sunday, the most important day in the Christian calendar, by posting racy photos of herself in a thong.",breitbart,1,31.15,13.7
Catholic League president Bill Donohue slammed New York mayor Bill de Blasio Friday for his irrational coronavirus lockdown rules and anti-religious animus.,breitbart,1,31.15,13.7
"He then went on to endorse proposals by Omar, Sen. Bernie Sanders (I-VT), and other far-left legislators looking to make college tuition-free.",breitbart,0,31.15,13.7
The transgender effort to suppress any recognition that men and women are different and complementary would not matter except for the movement’s political alliance with wealthy progressives and radical feminists who wish to destroy the political power of the male-and-female family.,breitbart,1,31.15,13.7
The measures include a ban on Islamic headscarves for girls until they reach the age of 14 and a provision for putting potentially dangerous individuals in “protective custody” to prevent them from committing violent actions.,breitbart,0,31.15,13.7
"In practice, the U.S. quietly provides health care to at least ten million illegal migrants who are in the United States, while also erecting tough physical and legal barriers to the arrival of yet more illegal aliens.",breitbart,0,31.15,13.7
"Sanders also claims his Green New Deal plan will create 20 million jobs, which will effectively create a new tax base and eliminate the need for $1.31 trillion in “federal and state safety net spending due to the creation of millions of good-paying, unionized jobs.”",breitbart,0,31.15,13.7
"During a town hall on CNN on Thursday, 2020 Democratic presidential candidate Sen. Elizabeth Warren (D-MA) stated that nothing will be as effective in combatting sexist media coverage “as electing a woman president of the United States.”",breitbart,0,31.15,13.7
"Not surprisingly, Bernie Sanders has been among the most vocal, lamenting the lack of centralized control in the American healthcare system.",breitbart,0,31.15,13.7
"The Muslim population of England is now estimated at over three million, according to official estimates — exceeding the total populations recorded for Wales or Northern Ireland in the 2011 census.",breitbart,0,31.15,13.7
Elite Pete Buttigieg Claims He Was 'Shaped by the American Heartland'.,breitbart,1,31.15,13.7
Wikipedia’s own articles on the Floyd protests similarly reflect the Foundation’s abandonment of neutrality by being unduly skewed towards smearing President Donald Trump while downplaying protestor violence and the violent Antifa group’s involvement.,breitbart,1,31.15,13.7
It amazes me that even intelligent people – including one or two politicians and commentators on the right who really should know better – are taking these disgusting Black Lives Matter/Antifa protests at face value.,breitbart,1,31.15,13.7
"While Democrat presidential hopefuls aim to weaponize the tax cuts, Elaine Parker, chief communications officer of Job Creators Network (JCN), told Breitbart News in an exclusive interview in January that it is precisely what will assist Trump in making his case to the American people.",breitbart,0,31.15,13.7
"Long-simmering tensions between Japan and South Korea exploded at the beginning of July, when Japan imposed restrictions on the export of chemicals crucial to electronics manufacturing to South Korea. ",breitbart,1,31.15,13.7
Wikipedia’s coverage of other contentious political topics such as abortion were also criticized with Sanger singling out Wikipedia claiming abortion is “one of the safest procedures in medicine.”,breitbart,1,31.15,13.7
"Though Trump has successfully increased wages by four percent over the last 12 months for America’s blue collar and working class by decreasing foreign competition through a crackdown on illegal immigration, experts have warned that those wage hikes will not continue heading into the 2020 election should current illegal immigration levels keep rising at record levels.",breitbart,0,31.15,13.7
Democrat presidential hopeful Sen. Amy Klobuchar (D-MN) attempted to slam Democrat challenger former New York City Mayor Michael Bloomberg after he said it takes him a “long time” to get materials together to release his tax returns and claimed he “can’t go to TurboTax.”,breitbart,1,31.15,13.7
This comes in response to Biden and members of his so-called coronavirus task force suggesting another shutdown may be necessary as COVID-19 cases are spiking in some areas of the United States.,breitbart,1,31.15,13.7
"Also, Biden told a New Hampshire audience in February that PLCAA gave gun makers “a loophole that does not allow them to be sued for the carnage they are creating,” Breitbart News reported.",breitbart,0,31.15,13.7
"The number of abortions performed in 2017-2018 was 11,373 more than the abortions performed the year before that, a trend that shows that while Planned Parenthood officials once said abortion should be “safe, legal, and rare,” today they omit the word “rare” in their mantra as they perform more abortions each year.",breitbart,0,31.15,13.7
"Home Secretary Priti Patel said that in response to the surge of illegal migrants, the government will look into how to speed up the deportation process, possibly to be modelled on Australia’s uncompromising system which saw a steep decline in illegal migration under the Commonwealth’s “stop the boats” policy.",breitbart,0,31.15,13.7
The LGBT lobby group Accountable for Equality has launched an attack on Christian pastor Franklin Graham for recruiting Christian volunteers for coronavirus relief work in New York.,breitbart,1,31.15,13.7
President Donald Trump touted how his reversal of Obama-era regulations on the fossil fuel industry has led to the United States being the largest producer of oil and natural gas in the world during his State of the Union address on Tuesday at the U.S. Capitol.,breitbart,0,31.15,13.7
"The Boeing Company is set to lay off more than 12,000 Americans in the midst of the Chinese coronavirus crisis while planning an expansion in India.",breitbart,1,31.15,13.7
"The text implies Biden, if elected president, would fully enforce the transgender ideology on 325 million Americans, whether in sports, the military, K-12 schools, and healthcare.",breitbart,1,31.15,13.7
"Earlier in the event, Biden vowed as president to hold energy giants liable for global warming and made a pledge to even jail executives.",breitbart,0,31.15,13.7
What will stop the hyper sexualization of our children by the counterfeit sexual freedom culture?,breitbart,1,31.15,13.7
"The mayor of Minneapolis called Wednesday for criminal charges against the white police officer seen on video kneeling against the neck of a handcuffed Floyd, the black man who complained that he could not breathe and died in police custody.",breitbart,0,31.15,13.7
"For Democrats, this wave or new regulation, censorship, and civic pressure will free the less-than-one-percent of people who say they are transgender from the oppressive, outdated rules of male-dominated supremacy.",breitbart,1,31.15,13.7
Joe Biden’s ‘Unity’ Platform with Bernie Sanders Gives Free Health Care to DACA Illegal Aliens,breitbart,1,31.15,13.7
"AOC Ignores 130% Murder Increase in NYC, Claims Unemployment Leads People to ‘Shoplift’ Bread",breitbart,1,31.15,13.7
"That is what we are doing every day, exposing the deep state, their allies and the corrupt liberal media that enables them. ",breitbart,0,31.15,13.7
"Larry Kudlow, one of President Donald Trump’s main economic advisers, told the Republican National Convention (RNC) on Tuesday night that Joe Biden’s plan to raise taxes as the economy emerged from the coronavirus pandemic was “crazy.”",breitbart,0,31.15,13.7
"As anarchists tear down statues and deface monuments to America’s Founders and those of President Abraham Lincoln and even slavery abolitionist Frederick Douglass, Lin-Manuel Miranda has been silent on this violence on America’s history.",breitbart,0,31.15,13.7
"This prohibition is but the first portion of the implementation of I-1639, the gun control initiative pushed by millionaires and billionaires and passed by voters on November 6, 2018.",breitbart,0,31.15,13.7
President Donald Trump ridiculed former Secretary of State Colin Powell on Sunday for endorsing former Vice President Joe Biden for president.,breitbart,1,31.15,13.7
Quite how ‘woke’ is synonymous with ‘quality’ Wenger could not explain: probably because the two concepts are antithetical.,breitbart,1,31.15,13.7
"But of course, Joe Biden and the leftist cabal who will control him will never allow that, and the sheep’s clothing Democrats and fake media outlets like NBC News are using to push AFFH and demonize its critics, like Trump, is race and racism.",breitbart,1,31.15,13.7
The group claims “systemic racism” has made it difficult for black individuals to obtain birth control and enjoy “reproductive freedom.”,breitbart,1,31.15,13.7
President Donald Trump on Friday announced that he has waived interest payments on all federal student loans to help alleviate financial strain as the United States combats the spread of the coronavirus.,breitbart,0,31.15,13.7
"But few people who describe themselves as transgender wish to live as members of the opposite sex, and even fewer wish to undergo cosmetic surgery.",breitbart,0,31.15,13.7
"NYPD Commissioner Dermot Shea on Monday expressed support for diverting funds away from the police department and to other areas, like youth programs.",breitbart,0,31.15,13.7
Ingraham began the exchange by noting American graduates’ salaries have been suppressed by the flood of foreign graduates.,breitbart,1,31.15,13.7
"In February, Breitbart News’s John Binder reported that Trump’s travel ban halted almost all legal immigration from countries designated as sponsors of terrorism.",breitbart,1,31.15,13.7
"In so doing, Hawley, populist firebrand that he is, showed that he was willing to overturn the stale orthodoxies that have mildewed our economy and undermined our security.",breitbart,1,31.15,13.7
"They back more gun control laws, deflecting blame and hoping that somehow making some 300 million guns disappear nationwide will prove to be easier than keeping children in their own cities away from stray bullets.",breitbart,1,31.15,13.7
"Democrat leaders have distanced themselves from the push to “defund the police,” which has become a battle cry for many Floyd protesters.",breitbart,0,31.15,13.7
The protests in London come days after Black Lives Matter and Antifa flooded the streets of the British capital over the weekend — with little to no regard for the government-mandated social distancing — calling “to burn this shit down” and hailing the chaos and riots in America as a sign that the “West is Falling”.,breitbart,1,31.15,13.7
A report compiled by members of the French Senate has detailed the spread of political Islam across France and listed 44 proposals to combat radical Islamist ideology.,breitbart,0,31.15,13.7
"Regardless of the chatter and ongoing analysis from political pundits, commentators, and officials, Harris has a well-documented record of embracing radical progressive ideas, touting them herself on numerous occasions.",breitbart,0,31.15,13.7
"Joe Biden can count among his many celebrity activists, Cardi B, who has told New York police “fuck you,” said Minnesota rioters had “no choice but to loot and steal after George Floyd’s death, and has revealed herself as a gun control advocate.",breitbart,1,31.15,13.7
"The open letter — Millionaires Against Pitchforks — has been released to coincide with the orgy of virtue-signalling by the globalist elite at the World Economic Forum in Davos, Switzerland.",breitbart,1,31.15,13.7
"As Breitbart News reported, Bloomberg and the left are embracing the transgender ideology despite scientific facts.",breitbart,1,31.15,13.7
The Grammy-winner condemned those smearing every police officer and called out those making Floyd’s death about race.,breitbart,0,31.15,13.7
"In a bizarre and unexpected twist, pop super star Lana Del Rey is being smeared as “racist” over an Instagram post in which she slammed modern-day feminism.",breitbart,1,31.15,13.7
"A three-year-old girl in China’s Jiangsu province died after receiving a rabies vaccination last month, an ominous development in light of persistent scandals over low-quality and improperly-handled vaccines.",breitbart,1,31.15,13.7
"Celebrities have already pledged to donate more than $115 million to Black Lives Matter and various social justices causes, while various mega-corporations have pledged to donate more than $454 Million.",breitbart,0,31.15,13.7
The New Way Forward Act is the single most radical piece of legislation we have ever seen proposed in this country — ever.,breitbart,1,31.15,13.7
"As Breitbart News most recently reported, blue-collar Americans in landscaping, conservation work, the meatpacking industry, construction industry, and fishing jobs have had their wages dragged down by foreign workers imported through the H-2B visa program.",breitbart,1,31.15,13.7
China appears to be feeding off similar complaints from the left in the United States. Complaints about partisan “gridlock” are perennial and grow especially loud when Democrats and their highly sympathetic media are the ones complaining about Republicans getting in their way.,breitbart,1,31.15,13.7
"Carlson warned if Trump was unsuccessful in efforts to restore order, he could lose the 2020 presidential election.",breitbart,0,31.15,13.7
