text,source,label,reliability,bias
"Backlash against marginalized communities doesn’t surprise University of Southern California Professor Chris Freeman, whose work primarily focuses on 20th century gay and lesbian studies.",msnbc,0,34.51,-14.03
But opponents argued that asking minors to negotiate the legal system when they are already scared and ashamed could drive them to illegal abortions.,msnbc,0,34.51,-14.03
"George Floyd would be pleased with the strong U.S. jobs data released Friday, President Donald Trump said, invoking the memory of the black man who died in police custody and looking past African American unemployment at the highest in more than a decade.",msnbc,0,34.51,-14.03
"The New York Times recently published a fairly detailed fact-check of these Trump World arguments that democrats don’t mind executing babies after birth, and not surprisingly, the rhetoric is irresponsibly wrong.",msnbc,1,34.51,-14.03
The votes come as a new conservative majority on the nation’s highest court has made abortion rights supporters nervous. ,msnbc,0,34.51,-14.03
"Indeed, just this week, Donald Trump, who once said the climate crisis was a hoax concocted by the Chinese, marveled at cold temperatures throughout the Midwest, convinced that the frigid weather is evidence of … something.",msnbc,1,34.51,-14.03
"This is all great news. It now looks like we have a safe, highly effective vaccine that has the potential to significantly reduce many forms of cancer. So why is it also becoming a key target of many anti-vaxxers?",msnbc,1,34.51,-14.03
"While a number of transgender advocates and LGBTQ health experts applauded P&G’s decision to redesign the Always packaging by removing the female signs, the company’s announcement sparked criticism online, including a bounty of transphobic commentary.",msnbc,1,34.51,-14.03
"Democratic Rep. Gwen Moore of Wisconsin, a member of the Congressional Black Caucus, says the GOP is risking Americans’ health and safety for “the economic outcomes Trump desires.”",msnbc,0,34.51,-14.03
Experts warn that the extreme weather conditions that caused wildfireares in Australia are a mark of climate change.,msnbc,0,34.51,-14.03
"While Pence and the president have tried to paint a rosier picture of the virus and project a return to normalcy, some members of the task force are eager to resume appearances from White House grounds",msnbc,1,34.51,-14.03
"White supremacist violent extremists can generally be characterized by hatred for immigrants and ethnic minorities, often combining these prejudices with virulent anti-Semitism or anti-Muslim views, the DHS report states.",msnbc,1,34.51,-14.03
"In the spring, the Trump administration’s Department of Health and Human Services unveiled a new policy designed to silence taxpayer-funded family planning clinics, preventing them from letting patients know about their abortion rights.",msnbc,0,34.51,-14.03
"By any sensible measure, the Trump administration is among the worst ever seen for respecting, valuing, and following science.",msnbc,1,34.51,-14.03
"Last summer, the Republican White House announced plans to roll back the tougher standards, making it easier for the automotive industry to sell less efficient vehicles that pollute more.",msnbc,0,34.51,-14.03
"Before they decide whether to let this stand, congressional Republicans should probably have an uncomfortable conversation.",msnbc,1,34.51,-14.03
"Separated from his wife and two children in metro Detroit, the 40-year-old father feels isolated, struggling to find work and make connections in a land he hasn't lived in for 30 years. ",usa-today,0,40.78,-4.12
"Though his mother, Di-Anne, already had $40,000 in student loans from her own graduate school education, she has taken out $42,000 in Parent PLUS Loans for Aaron – and she had kept him in the dark about the cost.",usa-today,0,40.78,-4.12
Harris had also planned to take time during her Iowa visit to talk about her new policy proposal aimed at closing the gender pay gap.,usa-today,0,40.78,-4.12
"Trump made his predecessor's posture toward Iran a centerpiece of his 2016 campaign, suggesting that a nuclear agreement worked out by President Barack Obama on behalf of the USA and five other nations was too soft on the country.",usa-today,0,40.78,-4.12
"The volatility that Gorsuch and Kavanaugh bring to the court was on display Monday in the court's 6-3 decision giving gay, lesbian and transgender workers protection under a 1964 federal law banning employment discrimination.",usa-today,0,40.78,-4.12
"In Santa Fe, New Mexico, officials took down a statue of Diego de Vargas, a Spanish conquistador who brutalized Native Americans.",usa-today,0,40.78,-4.12
Joe Biden said Monday he would overturn on his first day in office President Donald Trump’s travel ban that initially targeted Muslim-majority countries.,usa-today,0,40.78,-4.12
"Parent borrowing is a sacrifice many black parents make to pay for their children’s college education, and it is especially prevalent among families whose children attend historically black colleges and universities.",usa-today,1,40.78,-4.12
"President Donald Trump abruptly turned and walked away from the lectern at a White House news briefing Monday after telling a reporter to ""ask China"" in response to a question about U.S. coronavirus testing capacity. ",usa-today,1,40.78,-4.12
"The current travel ban, which the administration re-worked during a series of court challenges, indefinitely suspends the issuance of immigrant and non-immigrant visas to applicants from Libya, Iran, Somalia, Syria, Yemen, North Korea and Venezuela.",usa-today,0,40.78,-4.12
Oregon first graders could attend gun safety classes at their schools under legislation pushed this year and expected to return next session. ,usa-today,0,40.78,-4.12
"In 2016, Donald Trump fueled his improbable presidential victory with an arsenal of catch phrases designed to incite and excite the Fox News and Breitbart audience who live in fear of America’s diversity and inevitable demographic changes.",usa-today,1,40.78,-4.12
The death of Iranian Major General Qasem Soleimani near Baghdad International Airport triggered vows of reprisal from Iran and threatened to reshape a presidency that has rested on a promise to withdraw from overseas conflicts rather than pursue them.,usa-today,0,40.78,-4.12
Federal prosecutors charged a 26-year-old U.S. Army veteran who they say expressed support for the Islamic State with plotting to bomb a local white nationalists rally.,usa-today,0,40.78,-4.12
"A firefighter was killed by a falling tree while battling the Australian wildfire crisis overnight, and the prime minister on Sunday said his government was adapting and building resilience to the fire danger posed by climate change.",usa-today,0,40.78,-4.12
"Retailers are ramping up hiring for positions ranging from the warehouse to the checkout counter, as delivery and service workers increasingly become indispensable to Americans largely confined to their homes because of concerns about the coronavirus.",usa-today,0,40.78,-4.12
"Background checks required to buy firearms have spiked to record numbers in the past month, fueled by a run on guns from Americans worried about their safety during the coronavirus crisis.",usa-today,0,40.78,-4.12
"Investigators also found evidence to suggest that Koinis did not vaccinate children at parents' requests, the sheriff's office said in a statement.",usa-today,0,40.78,-4.12
A review of his posts in online message boards revealed he wanted to plant neo-Nazi propaganda inside Nevada middle and high schools.,usa-today,1,40.78,-4.12
"In a part of the country where the rules about who can access abortion care vary dramatically from state to state, the COVID-19 pandemic has sewn another layer of confusion.",usa-today,1,40.78,-4.12
"Oxford chose ""climate emergency"" as the word of the year from a short list of words that were all related to the environment, such as climate crisis, eco-anxiety, ecocide, global heating and climate action.",usa-today,0,40.78,-4.12
"After threatening Iran in a series of tweets hours earlier, Trump seemed eager to lower tensions.",usa-today,0,40.78,-4.12
"The fish are still flying at the Pike Place Market, and, though workers say things seem a little slower than usual, this famous tourist hot spot remains in full operation despite government warnings about the coronavirus. 
",usa-today,0,40.78,-4.12
"Though the indictment of a woman for her own pregnancy loss is unusual in Alabama, it is not unusual for prosecutors to charge people with murder even if they never killed anyone. ",usa-today,1,40.78,-4.12
"Warren laid out that she was going to pay for the plan to cancel student debt, which would cost $1.25 trillion over the next decade, by an “Ultra-Millionaire Tax,"" which is a 2% annual levy that she wants to impose of 75,000 American families with $50 million or more in wealth.",usa-today,0,40.78,-4.12
"President Donald Trump's top health advisers – Anthony Fauci and Deborah Birx – showed up at a White House event Friday with protective masks, though the president himself continued to spurn any kind of face covering.",usa-today,1,40.78,-4.12
But there may be a more innocuous place for white supremacist propaganda to spread: Amazon currently sells multiple books that espouse racist and white supremacist ideologies on its platform.,usa-today,1,40.78,-4.12
"Trump's decision to remove the troops near the Turkish border has allowed Turkey to lodge an attack on U.S. Kurdish allies who helped in the fight against the Islamic State terrorist group, also known as ISIS.",usa-today,1,40.78,-4.12
Five of eight gun control bills endorsed by Democratic Gov. Ralph Northam have been approved in both houses of the General Assembly and will head to Northam for signature. ,usa-today,0,40.78,-4.12
Thousands of fetal remains that were found at an abortion doctor's suburban Chicago garage last year were buried Wednesday at an Indiana cemetery. ,usa-today,0,40.78,-4.12
James Steckelberg of the Mayo Clinic said people 65 and over should be administered high-dose flu vaccines to stimulate their immune system. ,usa-today,0,40.78,-4.12
"Victorina Morales, an undocumented immigrant from Guatemala, told reporters in a conference call on Tuesday that she was allowed to work at the resort after she submitted a fraudulent Social Security number and green card, which she alleges her supervisors knew were phony.",usa-today,0,40.78,-4.12
"Democrats and other critics blasted Trump's plan to reduce the scope of the task force Tuesday, given the threat that death tolls would rise as states reopen businesses and other parts of their economies.",usa-today,1,40.78,-4.12
"In New Delhi's Shaheen Bagh neighborhood, beside open sewers and electric wires dangling dangerously, a group of Muslim women in colorful headscarves sit in resistance to a new citizenship law that has unleashed protests across the country.",usa-today,0,40.78,-4.12
"The Trump administration announced the expansion of its controversial travel ban late last month, saying it would add immigration restrictions on citizens from Nigeria, Myanmar, Eritrea and Kyrgyzstan who want to live or work in the U.S. permanently.",usa-today,0,40.78,-4.12
Rep. Alexandria Ocasio-Cortez claimed her seat in the House of Representatives after challenging a long-time incumbent with a message of shaking up the status quo.,usa-today,0,40.78,-4.12
Vice President Mike Pence denied that systemic racism is an issue in the USA.,usa-today,0,40.78,-4.12
"An Iranian student traveling to East Lansing, Michigan, to start his first week at Michigan State University was forced by federal agents to return to his home country.",usa-today,0,40.78,-4.12
"Microsoft has announced an ambitious effort to make voting secure, verifiable and subject to reliable audits by registering ballots in encrypted form so they can be accurately and independently tracked long after they are cast.",usa-today,0,40.78,-4.12
"France's latest terrorism attack, in Nice, fell on the birthday of the Prophet Muhammad.",usa-today,0,40.78,-4.12
"President Donald Trump took another step Thursday to crack down on legal immigration, instructing agencies to enforce a 23-year-old law that requires sponsors of green card holders to reimburse the government for welfare benefits.",usa-today,0,40.78,-4.12
"The Utah Republican Sen. Mike Lee honed his inner troll while using everything from posters showing Aquaman and Star Wars characters to quotes from Austin Powers to paint the Green New Deal bill as ""ridiculous"" and something that would never pass in Congress and never work. ",usa-today,1,40.78,-4.12
"The Pro Football Hall of Fame's Centennial class of 2020 is set, and among the 15 honorees selected was former NFL commissioner Paul Tagliabue, who helped lead the league to new heights during his tenure from 1989-2006.",usa-today,0,40.78,-4.12
"Instagram will start blocking any hashtags spreading misinformation about vaccines, becoming the latest internet platform to crack down on bad health information.",usa-today,0,40.78,-4.12
United Airlines said Tuesday it would suspend 24 flights between the U.S. and China the first week of February amid growing concern about the spread of the coronavirus that originated in the Asian nation.,usa-today,0,40.78,-4.12
"People who choose not to vaccinate has emerged into a global health threat in 2019, said the World Health Organization.",usa-today,0,40.78,-4.12
"A Minnesota Catholic leader on Wednesday rejected remarks made by a priest who called Islam the ""greatest threat in the world"" to the United States and Christianity.",usa-today,0,40.78,-4.12
YouTube is making clear there will be no “birtherism” on its platform during this year’s U.S. presidential election – a belated response to a type of conspiracy theory more prevalent in the 2012 race.,usa-today,1,40.78,-4.12
"The Trump administration said under the new agreement, the U.S. would also work with Sudan to help ease its debt burden and become a part of the broader international community. ",usa-today,0,40.78,-4.12
There is no evidence to support the allegation Pelosi was trying to include abortion funding in the coronavirus emergency bill as the Facebook post claims.,usa-today,0,40.78,-4.12
"In the wake of the El Paso shooting, in which 22 were killed and 24 injured, the discovery of a racist manifesto that may be linked to the shooter has pushed white supremacist ideologies into prominence.",usa-today,1,40.78,-4.12
Senate Majority Leader Mitch McConnell shredded a House Democratic anti-corruption proposal on Wednesday over a provision that would make going to the polls a national holiday.,usa-today,1,40.78,-4.12
"Amid the pandemic, the Trump campaign said religion is essential for providing critical fellowship among communities.",usa-today,0,40.78,-4.12
Many people have sought to fetishise Britain’s health bureaucracy as the nation’s saviour during this crisis.,breitbart,1,31.15,13.7
Soleimani was rumored to have been injured in battle in Syria in 2015 and made a public appearance in Aleppo in 2016.,breitbart,0,31.15,13.7
He misses the fact that the bank shooting highlighted the failure of gun control–particularly Florida’s red flag law and waiting periods–rather than the need for it.,breitbart,0,31.15,13.7
"Black Lives Matter activists in Chicago held a rally Monday evening to stand in solidarity with the dozens of individuals who were arrested after a night of mass looting and criminal activity, with one organizer brazenly defending looting as a form of reparations.",breitbart,1,31.15,13.7
"Until recently, there seemed to be no broader plan behind NeverTrump’s early, and vigorous, opposition to Trump and his administration. But the contours of a plan have begun to emerge, particularly on social media, where the movement’s criticism of Trump alternates with praise for some of his opponents in the 2016 Republican primary.",breitbart,1,31.15,13.7
"The Guardian, insisting that the climate emergency is “the defining issue of our times,” has amped up its climate agitation by suggesting that Australian wildfires is the new normal.
",breitbart,0,31.15,13.7
"Whitmer takes on Trump for claiming the economy is booming, asking “for whom?” … She details local pieces of legislation Dem. Governors are working on before claiming Democrats are the ones who actually fight for hardworking Americans.",breitbart,1,31.15,13.7
"The whole anti-vaxx (as it became known) thing was nuts, a way for fading celebrities to pretend to be the vanguard of a Great Cause that Saved The Children from a sinister government conspiracy.",breitbart,1,31.15,13.7
Many Democrats are exploiting the coronavirus pandemic to launch a full-bore push for socialism—making the socialist rhetoric of the early Democratic presidential debates look tepid by comparison.,breitbart,1,31.15,13.7
"President Donald Trump announced he will send federal agents to Chicago and Albuquerque, New Mexico, to help combat rising crime, expanding the administration’s intervention into local enforcement as he runs for reelection under a “law and order” mantle.",breitbart,0,31.15,13.7
"Another BLM activist — apparently unaware of the illegality of mass gatherings during the Chinese coronavirus pandemic — questioned: “If you want to shout and scream at me that every life matters, why are you not in the streets showing me that my black life matters?”",breitbart,1,31.15,13.7
"Populist Interior Minister Matteo Salvini has slammed Saudi Arabia, the host of the Italian football Super Cup, for not allowing single women to attend the match without a man accompanying them.",breitbart,1,31.15,13.7
Since the Democrat Congress and the Obama administration orchestrated the government takeover of student loans in 2010 the total amount of student loan debt has exploded.,breitbart,1,31.15,13.7
"Though the author reserved much of his political bile for Democrats, he also attacked Republicans and espoused some left-wing views, claiming that “our lifestyle is destroying the environment of our country.”",breitbart,1,31.15,13.7
"In the Spectator, Matt Ridley provides further evidence that the leftist ideologues who infest Britain’s bloated, self-serving, inefficient healthcare bureaucracy are peevishly rejecting numerous offers from the private sector for political reasons",breitbart,1,31.15,13.7
"Though Trump has successfully increased wages by four percent over the last 12 months for America’s blue collar and working class by decreasing foreign competition through a crackdown on illegal immigration, experts have warned that those wage hikes will not continue heading into the 2020 election should current illegal immigration levels keep rising at record levels.",breitbart,0,31.15,13.7
"He then went on to endorse proposals by Omar, Sen. Bernie Sanders (I-VT), and other far-left legislators looking to make college tuition-free.",breitbart,0,31.15,13.7
"Future generations will pay for it, which is justice because it’s dumb young people who demand all this insane social welfare spending.",breitbart,1,31.15,13.7
"Good grief, what better example of the Democrat tyranny do you need than these anti-science lockdowns?",breitbart,1,31.15,13.7
"The foul-mouthed 38-year-old has seen his popularity wane with some of his movies flopping in recent years, perhaps partly as a result of audiences turning against his woke humor.",breitbart,1,31.15,13.7
"And yet lately, higher officials in the Democratic Party have started to express at least some sympathy for the devils — these destroyers of public peace.  ",breitbart,1,31.15,13.7
"Male and female are the two sexes — but transgender advocates now claim more than 50 “genders” — including agender, bigender, gender fluid, gender non-conforming, genderqueer, intersex, two-spirit, etc, plus “cis-gender” for the 99+ percent of people who are normal, non-transgender people.",breitbart,1,31.15,13.7
"The idea behind the conspiracy is that these miracle vaccines — and they are medical miracles — can cause autism, when there is no data to back that up.",breitbart,1,31.15,13.7
Rowling refuses to buy into this anti-science trans nonsense that demands we all be gaslighted into believing a man can magically transform into a woman simply by saying he’s a woman followed by a chorus of “I Feel Pretty.”,breitbart,1,31.15,13.7
"The Citibank and Bank of America examples are just the tip of the iceberg, and do not even begin to reveal the larger financial shenanigans against gun makers via Operation Choke Point.",breitbart,1,31.15,13.7
"The DACA amnesty-for-wall funding plan is despised by Trump’s most loyal supporters who have warned the administration against caving to the big business lobby and billionaire donor class, both of which have pushed for an amnesty for illegal aliens for the last two years.",breitbart,1,31.15,13.7
"Author and Trump hater Stephen King is feeling the heat from fellow liberals following his tweets about the Academy Award nominations, in which he said that quality is more important than diversity when it comes to creating works of art.",breitbart,1,31.15,13.7
"Cartwright, who represents Pennsylvania’s eighth congressional district, launched a campaign ad recently, claiming that Bognet would eliminate health insurance coverage for millions of Americans.",breitbart,1,31.15,13.7
"The New York Times described Sunday’s nationwide riots as a wave of police violence against “protesters and bystanders,” even as law enforcement abandoned large urban areas to rioters and looters who ran amok for hours.",breitbart,0,31.15,13.7
"The Lancet joined China in condemning Trump’s “reckless decision” to withdraw from the World Health Organization (W.H.O.), claiming the move is “unlawful” and will have “dire consequences.”",breitbart,0,31.15,13.7
A recent study found that college students from high-income households are borrowing more money for school than students from households with lower incomes. The report added that students from wealthier families are responsible for some of the more drastic borrowing increases in recent years.,breitbart,0,31.15,13.7
"As Breitbart News also reported in January, if elected, Warren has also vowed to fill at least half of her Cabinet with women and “non-binary” individuals – or those who claim they are neither male nor female.",breitbart,1,31.15,13.7
"A Muslim father in Birmingham, England, is being prosecuted for removing his son from LGBT lessons, which he claims risk the safety of his child.",breitbart,0,31.15,13.7
The protestors reportedly are demanding that  Gov. Andrew Cuomo hike taxes on the state’s billionaires to make up for the revenue shortfall created by the Chinese coronavirus pandemic. ,breitbart,0,31.15,13.7
"Interestingly, in addition to his leftward missions of social engineering, Bloomberg has taken on a rightward mission of economic self-interest for himself and his fat-cat friends: stopping a wealth tax.",breitbart,1,31.15,13.7
"They gobble down internet conspiracy theories like QAnon, which creates engagement with right-wing politics for those who aren't religious conservatives or business elites. ",alternet,1,32.71,-14.76
"Trump’s crude but mind-bogglingly effective myth-making is forcing people like me, who considered the society of the late 1960s frightening and maniacally riven enough, to reckon more darkly now with what destroys or regenerates a republic. ",alternet,1,32.71,-14.76
"They've gone from echoing Trump's pooh-poohing of the coronavirus to cheerleading for their ""wartime president.""",alternet,1,32.71,-14.76
"The rollback of National Environmental Policy Act (NEPA), called an “international treasure” by one former EPA official, will allow the fossil fuel industry to quickly get approval for new projects that could send climate-warming, pollution-causing emissions into surrounding communities, as well as harm wildlife habitats and federally protected lands, with scant oversight.",alternet,0,32.71,-14.76
State of emergency: Tensions rise in Virginia as right-wing gun fanatics descend,alternet,1,32.71,-14.76
"India’s Prime Minister Narendra Modi is often compared to Donald Trump, especially when it comes to his anti-Muslim policies.",alternet,1,32.71,-14.76
Trump has also repeatedly lied about important details regarding the COVID-19 outbreak.,alternet,1,32.71,-14.76
"But Christian right leaders are also not about to let medical science supersede their authority, much less get in the way of their quest for power and cold, hard cash.",alternet,1,32.71,-14.76
"Trump and his attorneys have been aggressively fighting the office of Manhattan DA Cyrus Vance, claiming that because the president enjoys “absolute immunity,” he is under no obligation to share his financial records with Vance and other prosecutors.",alternet,1,32.71,-14.76
A Trump-loving white security guard with a racist past shot and killed an unarmed Black man during an unprovoked hotel parking lot attack.,alternet,1,32.71,-14.76
"President Donald Trump is losing support from his evangelical base as he lurches from one crisis into another. Numerous polls show that religious Americans, like most other Americans, disapprove of the president’s performance, and that could imperil his re-election chances.",alternet,1,32.71,-14.76
"Long before becoming president, Donald Trump was already acting as if he were the head of a lynch mob.",alternet,1,32.71,-14.76
"Court made clear what was otherwise evident then: Rubio and his fellow Republicans didn’t kill Obamacare, they only made it a bigger mess.",alternet,1,32.71,-14.76
"Today, the cumulative stress of Donald Trump’s escalating trade war is leading to if not an irreparable breach between America and China, then certainly a significant fraying.",alternet,1,32.71,-14.76
