text,source,label,reliability,bias
"Riot police appeared to make some progress in driving back activists after this, but the situation remains tense, with the police horses unnerved by individuals who hurled flares towards them.",breitbart,1,31.15,13.7
"The House Democrats’ 1,400-page coronavirus recovery bill threatens the livelihood of millions of American graduates and their families by expanding work visas for many of the roughly 1.5 million foreign college graduate contract workers who hold jobs in the United States.",breitbart,1,31.15,13.7
"Floyd, 46, was killed in police custody in Minneapolis, Minnesota, on Memorial Day, setting off nationwide protests and riots and reinvigorating the Black Lives Matter movement.",breitbart,1,31.15,13.7
Biden’s shift radically leftward reflects that of his party.,breitbart,1,31.15,13.7
"While the mayor has severely curtailed religious practice in the city, he has defended the rights of citizens to form huge gatherings to protest, even violently, and obviously without social distancing or masks (except perhaps antifa masks).",breitbart,1,31.15,13.7
U.S. Education Secretary Betsy DeVos is withdrawing protections put in place by former President Barack Obama for students who have mismanaged or are defaulting on their college loans.,breitbart,0,31.15,13.7
"Pelosi’s coronavirus plan uses the pandemic to cram provisions of the House Democrats’ H.R. 1 legislation into federal law. That legislation went even further in its efforts to create loopholes for voter fraud, allowing convicted felons to vote in federal elections.",breitbart,1,31.15,13.7
"The idea behind the conspiracy is that these miracle vaccines — and they are medical miracles — can cause autism, when there is no data to back that up.",breitbart,1,31.15,13.7
This violence has nothing to do with George Floyd; everything to do with the hard left’s relentless war on Western Civilisation.,breitbart,1,31.15,13.7
"On Monday, the Grammy-winning crooner and left-wing agitator tweeted to her 81 million followers a graphic of the coalition with a caption demanding, “Change in the music industry begins now.”",breitbart,1,31.15,13.7
"Yet the gender ideology is rapidly gaining power, aided by huge donations from wealthy individuals and medical companies.",breitbart,1,31.15,13.7
"Now today, the San Francisco mindset is still, shall we say, peculiar. It’s a city, after all, where old-money trust-fund types, addled with guilt, have joined with nouveaux riche tech tycoons to create a bizarre overclass ideology that’s a part Karl Marx, one part MSNBC, one part Michel Foucault, and maybe even a little bit of Ayn Rand.",breitbart,1,31.15,13.7
"In stark contrast to the arrests of peaceful anti-lockdown protesters in Hyde Park the day before, the Metropolitan Police took no actions to stop the left-wing demonstration that lasted well into the evening and spanned several miles of the city.",breitbart,1,31.15,13.7
Tuesday’s fundraiser was hardly the first time that Biden has made false accusations that Trump is sympathetic toward antisemitism.,breitbart,1,31.15,13.7
"President Trump warned us “when the looting starts the shooting starts,” and, tragically, that is exactly what has happened.",breitbart,1,31.15,13.7
"Last summer, Romney criticized President Trump’s response to violence in Charlottesville, accusing him of moral equivalence between neo-Nazis and those opposing “racism and bigotry” — but without noting that the latter had disrupted a lawful, permitted protest.",breitbart,0,31.15,13.7
"On July 15, New York City cops were bloodied in broad daylight by assailants who know that Mayor Bill De Blasio shares their dislike for the police.",breitbart,1,31.15,13.7
"And rather than falter or die of old age, the expansion has continued through Trump’s first three years in office, giving him a trump card in the campaign to win a second term in November.",breitbart,1,31.15,13.7
"Dozens of protesters took part in the protest on Tuesday, marching along the main streets of Thessaloniki after gathering at a statue of Eleftherios Kyriakou Venizelos, a former prime minister of Greece who was a prominent leader in the Greek national liberation movement.",breitbart,0,31.15,13.7
"As Congress begins debating the Equality Act, the Heritage Foundation warns that if the bill becomes law it will prove the death knell for women’s sports.",breitbart,1,31.15,13.7
"In the latest horrifying killing in gun-free Britain, a man was slashed to death with a machete on the streets of Wolverhampton, England on Monday.",breitbart,1,31.15,13.7
Rowling added that the current regime of trans extremists are far more misogynistic than any old time sexists have ever been.,breitbart,1,31.15,13.7
Many people have sought to fetishise Britain’s health bureaucracy as the nation’s saviour during this crisis.,breitbart,1,31.15,13.7
There are some voices in the Democratic Party that freely admit how dangerously secular the Party has grown,breitbart,1,31.15,13.7
Bastille Day – the Beginning of Liberal Madness,breitbart,1,31.15,13.7
"A poll released Tuesday finds 75 percent of Americans want substantial restrictions on abortion, including 60 percent of Democrats and 61 percent of those who identify as “pro-choice.”",breitbart,0,31.15,13.7
"Nevertheless, The Jesus Is King crooner launched his presidential campaign on Sunday in South Carolina where he railed against progressive policies such as abortion and gun control.",breitbart,1,31.15,13.7
Migrants in the United States sent about $103 billion in mostly untaxed remittances to six foreign countries last year — including about $19 billion to China.,breitbart,0,31.15,13.7
Rowe then dismantled each of Atkins’ unsubstantiated points. He lambasted celebrities for constantly broadcasting their political opinions as though their views have any impact on most Americans.,breitbart,1,31.15,13.7
"During a rare public address last week, the former president appeared to challenge Trumpism while urging U.S. voters to resist detractors of American democracy",breitbart,1,31.15,13.7
"Celebrity activist Alyssa Milano declared at a rally in Washington, D.C. Tuesday that because she has a vagina, she doesn’t have “equality and justice” in America.",breitbart,0,31.15,13.7
"By supporting Medicare for All, ACP is supporting dramatic pay cuts for its members.",breitbart,1,31.15,13.7
"Transgender ideology says each persons’ preferences are — and should be — unconnected from their bodies. It says that men and women are interchangeable, and can switch their sex by switching their own sense of “gender identity” so that men who say they are women really do become biological women, complete with female penises.",breitbart,1,31.15,13.7
"For several years, climate change doomsayers have turned their attention to cattle, as a series of reports demonstrated that “livestock emissions” are more dangerous for the environment than automobiles.",breitbart,1,31.15,13.7
"Specifically, Republicans–as they have demonstrated for three consecutive legislative days–intend to push for a floor vote against Democrat Speaker Nancy Pelosi’s wishes on a piece of legislation from Rep. Ann Wagner (R-MO) that would ensure babies who are born alive following an abortion attempt are given the same medical treatment and care any other newborn baby would receive.",breitbart,0,31.15,13.7
House Republicans are gearing up for a sustained push to expose leftist Democrats in the House Democrat majority on their increasingly extreme views on abortion.,breitbart,1,31.15,13.7
Lightfoot stressed her belief that the election of Joe Biden to the White House is key to securing these and other controls for Chicago and the rest of the country.,breitbart,0,31.15,13.7
"They all swing radical left, they all pay homage to the identity politics pieties of the Social Justice movement, they all brutally enforced conformity on #MeToo, and now they’re doing the same with Black Lives Matter.",breitbart,1,31.15,13.7
"According to the Guardian, a survey of 15 British female Olympians found that most feel that allowing transgenders to compete alongside natural-born female athletes is likely unfair to the women and they want more research before new rules are made.",breitbart,0,31.15,13.7
"For example, business leaders say the nation’s enormous population of immigrants has expanded the nation’s workforce, increased consumption, and driven up housing prices but that inflow has also shrunk the wages of less-educated Americans, the report said.",breitbart,0,31.15,13.7
"Bannon, who previously served as Executive Chairman of Breitbart News, has denied the false claims spewed against him mostly by those on the left.",breitbart,1,31.15,13.7
"While these many similarities between Green New Deal and the constitution ushered in by Venezuelan leftist dictator Hugo Chavez in 1999 may be just happenstance, the important thing to remember is that Venezuela under its new constitution has become a disaster zone.",breitbart,1,31.15,13.7
"As for Joe Biden, he’s made some truly bizarre comments about guns over his long political career, driven more by a desire to appease both gun-control advocates and gun-owning Democrat constituencies than any coherent philosophy.",breitbart,1,31.15,13.7
"On immigration, Klobuchar now supports a “path to citizenship” for illegal aliens — though she once took a harder line.",breitbart,1,31.15,13.7
"Last week, the Woke Taliban, who work at the publishing house handling Rowling’s upcoming children’s book, The Ickabog,  threatened a strike unless the book was blacklisted and canceled.",breitbart,1,31.15,13.7
The Supreme Court has redefined the 1964 workplace sex discrimination law to cover “transgender” people who claim to have changed their sex.,breitbart,1,31.15,13.7
"In August, Planned Parenthood made the decision to opt out of the federal family planning grant program, portraying itself as a victim of the Trump administration.",breitbart,1,31.15,13.7
"Even prior to Trump formally announcing Barrett as his nominee, leftists launched a string of attacks, targeting her faith, family, and conservative positions.",breitbart,1,31.15,13.7
"Though the author reserved much of his political bile for Democrats, he also attacked Republicans and espoused some left-wing views, claiming that “our lifestyle is destroying the environment of our country.”",breitbart,1,31.15,13.7
The measure would prevent U.S. graduates from getting hundreds of thousands of college-grade jobs as the foreign workers’ visas expire — despite the colossal job losses being caused by China’s Wuhan virus.,breitbart,1,31.15,13.7
"The Democratic Party’s presumptive nominee, former Vice President Joe Biden, has made the protection and expansion of Obamacare one of the signature issues of his campaign.",breitbart,0,31.15,13.7
Sanders says his $1.5 trillion housing for all plan and $1.5 trillion universal child care/pre-K plan will be paid for with “a wealth tax on the top one-tenth of one percent – those who have a net worth of at least $32 million.”,breitbart,0,31.15,13.7
"While Snapchat is happy to blame President Trump — who is working to restore order — for the ongoing violence, it has not said anything about support for the domestic terrorist Antifa movement on its platform.",breitbart,1,31.15,13.7
"Democrats recently provided more funding for the state’s roads — through an unpopular, regressive gas tax hike rather than spending cuts on less urgent priorities.",breitbart,1,31.15,13.7
Bouchard commented on his efforts to secure state preemption of the myriad gun-free zones in the state.,breitbart,0,31.15,13.7
"The mainstreaming of transgender ideology has had a “corrosive impact” on British society and has had a negative influence on the wellbeing of children, a study from think tank Civitas has found.",breitbart,1,31.15,13.7
"Populist Interior Minister Matteo Salvini has slammed Saudi Arabia, the host of the Italian football Super Cup, for not allowing single women to attend the match without a man accompanying them.",breitbart,1,31.15,13.7
"Patients would face the same type of rationing, wait times, and bureaucratic inertia that currently plagues the government-run Medicaid and Veteran’s Administration health programs.",breitbart,0,31.15,13.7
"During the campaign, it was clear that much of the momentum behind NeverTrump was driven by narcissism, as well as by self-interest. NeverTrump gambled on a Hillary Clinton victory, preparing to blame Trump supporters and hoping to take revenge.",breitbart,1,31.15,13.7
"Secondly, the Democrat field is so awful, there aren’t any acceptable alternatives.",breitbart,1,31.15,13.7
"The mandate was inserted into Obamacare administratively by Obama’s first HHS secretary, abortion rights champion Kathleen Sebelius, who declared birth control and abortion-related services to be women’s “preventive” health care.",breitbart,0,31.15,13.7
"Turner, a black woman herself, criticized Biden and argued that Sanders is a better choice for black voters across the country.",breitbart,0,31.15,13.7
The mother of a one-year-old killed in a Cuban clinic after receiving a routine vaccination launched an awareness campaign Tuesday urging social media users to share a photo of her in the hope that the communist regime gives her answers.,breitbart,0,31.15,13.7
"The DACA amnesty-for-wall funding plan is despised by Trump’s most loyal supporters who have warned the administration against caving to the big business lobby and billionaire donor class, both of which have pushed for an amnesty for illegal aliens for the last two years.",breitbart,1,31.15,13.7
Even a member of French President Emmanuel Macron’s La République en Marche! (LREM/Republic on the Move) slammed the sports hijab.,breitbart,1,31.15,13.7
"When a supporter told Warren public schools need to teach more about LGBTQ history and sex education, the Massachusetts senator replied her education secretary would have to be interviewed by a transgender child.",breitbart,0,31.15,13.7
"The former vice president, who spent a majority of his nearly 40-year political career in the United States Senate, made the remarks on Monday in an interview with several prominent media outlets.",breitbart,0,31.15,13.7
"Bad news for wealthy New York elites looking to avoid protestors by fleeing to The Hamptons. The pitchfork-wielding mob has found you, and they’re not backing down.",breitbart,1,31.15,13.7
"The night before the rant, the Jesus Is King rapper continued his crusade against abortion, gun control, and pornography.",breitbart,1,31.15,13.7
"This isn’t because they’re racist — very few people are in these multicultural times — but because they recognise that BLM is a divisive, aggressive, hard-left activist group whose ultimate goal is not to bring about peace but to foment chaos and Marxist revolution.",breitbart,1,31.15,13.7
"Former ESPN personality Jemele Hill attacked the NFL for its lack of black coaches, and blasted the Rooney Rule as an insufficient solution to the problem.",breitbart,1,31.15,13.7
Winston Churchill was a ‘racist’. Or so the Black Lives Matter graffiti says on the plinth of his statue in London’s Parliament Square which is bound to be pulled down by hard-left activists sooner or later because the police don’t seem to have that much of an appetite to save it.,breitbart,1,31.15,13.7
"That’s because the Bengal famine is one of the radical left’s favourite historical talking points: apparently — so all good leftists and Islamists are taught — it shows Winston Churchill to have been an uncaring racist who, in 1943-44, deliberately allowed 1.5 million Bengalis to starve in an act of ‘genocide’.",breitbart,1,31.15,13.7
Breitbart News reported last week on a viral video in which a father confronted presidential candidate Elizabeth Warren over her proposal to erase student loan debt.,breitbart,0,31.15,13.7
"While the announcement identifies cases of alleged police misconduct, it does not mention violence accompanying the protests over Floyd’s death that the Foundation is now backing.",breitbart,1,31.15,13.7
"Yes, he might be a demented Stalinist eager to flood America with illegal aliens and take away our guns and health insurance, but he sure gave those venal Never Trumpers a sweet face job Saturday night in Nevada, and now I can’t tell if my tears come from joy or laughter.",breitbart,1,31.15,13.7
The Vegan Society has said that vegans should be given their own shelf in refrigerators at work and employers should protect them from offensive jokes about their dietary choices.,breitbart,0,31.15,13.7
"This is what Breitbart News has reported, based on publicly available data ignored by the anti-tariff crowd for over a year. ",breitbart,1,31.15,13.7
What the hell do you think is going to happen when you vote for the same political party that coddles and encourages these terrorists?,breitbart,1,31.15,13.7
"The whole anti-vaxx (as it became known) thing was nuts, a way for fading celebrities to pretend to be the vanguard of a Great Cause that Saved The Children from a sinister government conspiracy.",breitbart,1,31.15,13.7
The net percent of owners expecting higher real sales volumes increased 7 points to 23 percent with owners a bit more certain of future sales growth prospects.,breitbart,0,31.15,13.7
"All but seven House Democrats voted Friday for a bill which ends legal and civic rights for women by allowing men who say they are transgender to freely use women’s legal rights, sports leagues, institutions, and private spaces.",breitbart,0,31.15,13.7
"Healthcare “experts” are telling us the coronavirus is lethal if you want to go to work, school, or your grandmother’s funeral, but not so lethal if you are out en masse to support “approved” causes.",breitbart,1,31.15,13.7
"Male and female are the two sexes — but transgender advocates now claim more than 50 “genders” — including agender, bigender, gender fluid, gender non-conforming, genderqueer, intersex, two-spirit, etc, plus “cis-gender” for the 99+ percent of people who are normal, non-transgender people.",breitbart,1,31.15,13.7
It is far from the first time that Trump has offered to intervene in a seemingly intractable international dispute.,breitbart,1,31.15,13.7
"And now we’re living through the 1619 Riots, and now the mask has been completely removed from the Democrat Party and media as we see vandalism, the desecration of our history, occupation, violent assaults against police and citizens, and the end of the rule of law encouraged, championed, and normalized.",breitbart,1,31.15,13.7
"A young, slender woman with a sign reading “End All Violence” stood at the doors and pleaded with the looters to stop. ",breitbart,1,31.15,13.7
"Black Lives Matter activists in Chicago held a rally Monday evening to stand in solidarity with the dozens of individuals who were arrested after a night of mass looting and criminal activity, with one organizer brazenly defending looting as a form of reparations.",breitbart,1,31.15,13.7
"After Donald Trump won the presidency in 2016 and the left-wing terrorists in Antifa took to the streets, everything changed again.",breitbart,1,31.15,13.7
"The petition argues that Jefferson’s role in writing the Declaration of Independence makes him worthy of admiration, despite his slave ownership.",breitbart,0,31.15,13.7
"Another BLM activist — apparently unaware of the illegality of mass gatherings during the Chinese coronavirus pandemic — questioned: “If you want to shout and scream at me that every life matters, why are you not in the streets showing me that my black life matters?”",breitbart,1,31.15,13.7
"He mourned the dead, touted his gun control and education proposals, and that was it.",breitbart,1,31.15,13.7
"Donald Trump claimed he has seen evidence the new coronavirus originated in a Chinese lab, as he threatened tariffs on Beijing over its role in the global pandemic.",breitbart,1,31.15,13.7
"An individual can change his hormone levels and undergo surgery to better imitate the opposite sex, but a male on the day of his conception will remain a male on the day of his death.",breitbart,1,31.15,13.7
"Democrat megadonor and healthcare executive Judy Faulkner has tried to block a Trump healthcare rule that would cut healthcare costs, grant patients more control over their healthcare data, and preserve her company’s dominant status in the electronic healthcare record market.",breitbart,1,31.15,13.7
"Victoria’s Secret spring campaign featuring transgender and plus-sized models marks a dramatic shift toward progressive feminism for Victoria’s Secret, which has been roiled by management changes in the past year.",breitbart,1,31.15,13.7
"Kendrick, who, like many Planned Parenthood supporters, blames men for pro-life legislation while she ignores mention of the life of unborn babies, also drafted a “testicular bill of rights.",breitbart,1,31.15,13.7
It reminds us that a once-great university has fallen to the forces of wokist ignorance and that you’d really be better off trying to study for your degree elsewhere.,breitbart,1,31.15,13.7
"In an apparent attempt to blame sexism for the blowback the Rashida Tlaib received for her ""Impeach the Motherf*cker"" remark, Pelosi wondered aloud what the response would have been if a man made the same comment. ",breitbart,1,31.15,13.7
"Numerous #BlackLivesMatter protests have overwhelmed cities across the country, with many turning violent and resulting in extensive property damage and even deaths, including David Dorn, a retired captain for the St. Louis Police, who was black.",breitbart,0,31.15,13.7
"he Centers for Medicare and Medicaid Services (CMS) announced on Monday that the average premium for the benchmark ACA plan, or the second-lowest costing silver plan, fell by two percent for the 2021 coverage year. ",breitbart,0,31.15,13.7
A recent study found that college students from high-income households are borrowing more money for school than students from households with lower incomes. The report added that students from wealthier families are responsible for some of the more drastic borrowing increases in recent years.,breitbart,0,31.15,13.7
"Those activists will, of course, all be on the left — watermelons, essentially: green on the outside, red on the inside — and will continue to promote environmentalism by whatever means possible in order advance the controlling agenda of global eco-fascism.",breitbart,1,31.15,13.7
"Due to the pandemic, polio and measles vaccination campaigns have been heavily impacted, with the former having been halted in 27 countries.",breitbart,0,31.15,13.7
"The remarks, by the BBC’s head of drama Piers Wenger, will confirm what many viewers have long suspected: that the BBC isn’t interested in making quality programming any more – only in enforcing the politically correct obsessions (equality, diversity, etc) of the narrow, metropolitan liberal elite.",breitbart,1,31.15,13.7
"A Muslim father in Birmingham, England, is being prosecuted for removing his son from LGBT lessons, which he claims risk the safety of his child.",breitbart,0,31.15,13.7
"While NYC has largely tamed the lethal and highly contagious coronavirus, another epidemic is starting to rear its ugly head in the city once again — violent crimes.",breitbart,1,31.15,13.7
"Let’s be clear what is happening here. Under the pretext of protesting the killing of a black man by a white police officer in Minneapolis, hard-left terror cells across the West are taking to the streets and fomenting chaos and violence with a view to overthrowing Western civilisation.",breitbart,1,31.15,13.7
Democrat presidential hopeful Pete Buttigieg apparently felt the sting of Rush Limbaugh’s recent comments about his masculinity and lashed out at the radio icon and Trump supporters in an interview with Ellen DeGeneres.,breitbart,1,31.15,13.7
Successive centrist administrations have failed to stand up to an increasingly feral activist media and a worryingly censorious academic establishment.,breitbart,1,31.15,13.7
Many critics point to the most obvious flaw in MMT: that it would simply push the federal deficit and the national debt — already skyrocketing — to further and further extremes.,breitbart,0,31.15,13.7
But Buttigieg’s liberal elite background has not stopped him from claiming the mantle of a Democrat political figure in a Republican “red state.”,breitbart,1,31.15,13.7
"Interestingly, in addition to his leftward missions of social engineering, Bloomberg has taken on a rightward mission of economic self-interest for himself and his fat-cat friends: stopping a wealth tax.",breitbart,1,31.15,13.7
While Democrats were diverting the attention and energy of the entire country into a pointless trial that could not possibly have ended in anything other than President Donald Trump’s acquittal...,breitbart,1,31.15,13.7
"Using the same alarmist language he has employed to describe illegal immigration, Trump painted Democrat-led cities as out of control and lashed out at the “radical left,” which he blamed for rising violence in some cities, even though criminal justice experts say it defies easy explanation.",breitbart,1,31.15,13.7
"Police cars redecorated in the colours of unicorn vomit (in solidarity with LGBTQetc), policemen being encouraged to wear high heels and paint their fingernails in solidarity with something or other, policemen obsessed with hurty tweets but not with preventing burglary or grooming gangs.",breitbart,1,31.15,13.7
