text,source,label,reliability,bias
"A shocking new study says that the ice in the Arctic Ocean will disappear by 2050, which could have ""substantial"" implications on the ecosystem and the climate in the region.",fox-news,0,35.44,11.06
"U.S. Senator Amy Klobuchar on Monday will become the third 2020 Democratic presidential candidate in as many days to leave the race, her campaign confirmed, and she and fellow moderate Pete Buttigieg plan to endorse former Vice President Joe Biden.",fox-news,0,35.44,11.06
"These numbers also help illuminate Democrats’ thinking: Since Trump has no wiggle room with his base, they are content to watch consequences pile up, driving Trump’s overall numbers further into the ditch.",fox-news,1,35.44,11.06
"Jose Acosta, 33-year-old Honduran immigrant, snuck into the U.S. eight months ago in Eagle Pass, Texas, but was apprehended weeks later in Houston on his way to a job in North Carolina.",fox-news,1,35.44,11.06
"Top Democrats running for president in 2020 have jumped on and endorsed Democratic Socialist Alexandria Ocasio-Cortez’s radical Green New Deal that aims, among other things, to eliminate air travel.",fox-news,1,35.44,11.06
"Protesters across the country are demanding racial equality, but there is also a push to make Juneteenth a national holiday.",fox-news,0,35.44,11.06
"Ocasio-Cortez, who advocates for democratic socialism, is not the only Democrat in Washington, D.C., honing in on billionaires these days.",fox-news,0,35.44,11.06
But Islam is the mother load of bad ideas.,fox-news,1,35.44,11.06
Yet it's merely the tip of the iceberg of war criminals lurking -- and working -- on U.S. turf.,fox-news,1,35.44,11.06
"Alphabet Inc.’s Google, the world’s largest online advertising platform, blocked advertising from finance blog ZeroHedge.com last week because of what it deemed hateful comments from users posted to the website’s articles.",fox-news,0,35.44,11.06
"An Austrian BASE jumper was rescued in southern Thailand on Monday after his parachute became snagged on the rocky side of a near-vertical cliff, leaving the thrill-seeker dangling almost 600 feet above the ground for several hours.",fox-news,0,35.44,11.06
"In a Biden administration, the Loony Left will be in charge of policy -- people who want to defund the police.",fox-news,1,35.44,11.06
Some colleges are choosing to invite only a portion of students back to campus amid a resurgence in COVID-19 cases nationwide,fox-news,0,35.44,11.06
"Shortly before President Trump signed phase one of the historic trade deal with China, a Chinese pastor described the fear and intimidation believers are enduring under the Communist government.",fox-news,0,35.44,11.06
"Ivanka Trump, President Trump’s daughter and a White House senior adviser, lauded her father’s economy and said the majority of Americans ideologically believe differently than Rep. Alexandria Ocasio-Cortez, D-N.Y., in an interview with Fox News host Steve Hilton.",fox-news,0,35.44,11.06
"Harvard University officials said Monday that school will invite only 40 percent of undergraduates, including all first-year students, to campus for the fall semester as the number of coronavirus cases continues to increase in most states.",fox-news,0,35.44,11.06
Marriage is a sacred institution between a man and a woman.,fox-news,0,35.44,11.06
"Also during his speech, Trump said his administration defends Christians and Jews from the radical left Democrats and condemns the socialism that he claims has ravaged Venezuela.",fox-news,1,35.44,11.06
"Those filings are expected to show that Sen. Sanders, the so-called democratic socialist, made millions from book sales.",fox-news,1,35.44,11.06
"A 10-hour hearing broadcast on the court’s website showed Sun, China's greatest ever swimmer, and one of its biggest sports stars, to be evasive at times under questioning that was hampered by severe translation issues between Chinese and English.",fox-news,0,35.44,11.06
The new year brought continued tensions along the U.S.-Mexico border as U.S. authorities fired tear gas at migrants from the Central American caravan that has gathered there.,fox-news,0,35.44,11.06
"A Minnesota man in his 60s who attended the Sturgis Motorcycle Rally in South Dakota last month has died from COVID-19, health officials said Wednesday.",fox-news,0,35.44,11.06
Maynor’s story underscores a harsh reality: Youth sports is a multi-billion dollar industry in the U.S. and not every kid has the chance to participate.,fox-news,0,35.44,11.06
"In the wake of the great Bronx injury epidemic of 2019, the Yankees continue to overhaul their people and processes for their training and conditioning.",fox-news,0,35.44,11.06
Most are fleeing endemic poverty and increasing rates of gang violence.,fox-news,0,35.44,11.06
"The slogan of “defund the police” has arisen in the wake of rioting and looting that hit cities around the country following the killing of George Floyd, an unarmed and handcuffed black man, at the hands of Minneapolis police on Memorial Day.",fox-news,0,35.44,11.06
"Fortunately, President Trump and his administration have rejected Obama’s foolish positions on this issue and clearly named the enemy: radical Islam.",fox-news,1,35.44,11.06
"If the Massachusetts Democrat’s proposal were to become law, it would almost certainly face a court challenge – thanks to the fact that it’s a tax on wealth, as opposed to a tax on income.",fox-news,1,35.44,11.06
"On every equality issue is the same picture with today's Democrats, signaling their virtue with social justice slogans, while pushing policies that would hurt African-Americans instead of helping them.",fox-news,1,35.44,11.06
"Aside from the $40 million in new funding, Nike has stepped up efforts to improve workplace diversity throughout the last year, according to the company.",fox-news,0,35.44,11.06
"The protesters also chanted the name of George Floyd, an unarmed black man in Minneapolis who was allegedly killed by police after an officer kneeled on Floyd’s neck for almost nine minutes.",fox-news,0,35.44,11.06
Primate research in the country was already pricey and controversial — but the coronavirus pandemic has been particularly bad for the monkey business.,fox-news,0,35.44,11.06
Hundreds of mourners said their last goodbyes to George Floyd on Tuesday in a packed memorial service in Houston.,fox-news,0,35.44,11.06
Two Muslim men say they were booted off an Alaska Airlines flight in February because of text messages they sent in Arabic.,fox-news,1,35.44,11.06
"However, the 45-year-old actor Joaquin Phoenix used his time on stage to call for his celebrity cohorts to put their money where their mouths are when it comes to climate change.",fox-news,1,35.44,11.06
Joe Biden's Fourth of July message focused on America's long history of racial injustice -- from slavery to George Floyd's death -- as he called for Americans to strive to achieve the country's founding ideal of equality.,fox-news,0,35.44,11.06
Florida student says high school rejected pro-life club for 'controversial' views.,fox-news,1,35.44,11.06
The San Francisco 49ers will fly a “Black Lives Matter” flag at Levi’s Stadium as the franchise continues its support of the fight against racial inequality.,fox-news,0,35.44,11.06
"As leading 2020 Dems advocate spending big on the Green New Deal, it turns out most Americans are worried about other issues.",fox-news,0,35.44,11.06
"But even if a vaccine is declared safe and effective by year’s end, as some expect, there won’t be enough for everyone who wants it right away.",fox-news,0,35.44,11.06
Trump has also threatened to impose an additional 25 percent tariffs on $325 billion worth of imports from China.,fox-news,1,35.44,11.06
"Sen. Elizabeth Warren is aggressively pushing a new wealth tax – which she’s dubbed the “UltraMillionaireTax” – ahead of this weekend’s formal presidential campaign launch, but keeps running into the same question from critics: Is it even constitutional?",fox-news,1,35.44,11.06
"They came to the United States from all corners of the globe -- Somalia, Rwanda, El Salvador, the Balkans, Germany, Iraq -- claiming to have been persecuted but, in reality, they were the persecutors.",fox-news,1,35.44,11.06
"After months of the president claiming that voting by mail will lead to fraud and a rigged election, the poll finds that 83% of Republicans say they are at least somewhat concerned that mail-in voting will lead to voter fraud.",fox-news,0,35.44,11.06
"Trump went out of his way to underscore his support for police in his comments Tuesday, quoting statistics about the number of arrests made by local law enforcement for severe crimes like rape and murder.",fox-news,0,35.44,11.06
Black Lives Matter Philadelphia organizer proposes five-year plan to abolish police,fox-news,0,35.44,11.06
"A funeral for a Bangladeshi religious leader drew around 100,000 people in defiance of nationwide coronavirus lockdown.",fox-news,0,35.44,11.06
Is Islam a destructive force in the world?,fox-news,1,35.44,11.06
Floyd's funeral service took place at the Fountain of Praise Church in Houston.,fox-news,0,35.44,11.06
An upcoming CNN town hall on the coronavirus pandemic will feature 17-year-old Greta Thunberg alongside a panel of medical experts.,fox-news,0,35.44,11.06
"Last Wednesday the Times ran an op-ed from Senator Tom Cotton, R-Ark., suggesting American soldiers should be used to quell protests and violence related to the killing of George Floyd.",fox-news,0,35.44,11.06
Conservatives are rallying behind Vox journalist Matthew Yglesias after he was publically shamed by one of his colleagues for signing an open letter combatting cancel culture.,fox-news,0,35.44,11.06
Newly empowered Democrats in Washington and statehouses across the country are flexing their legislative muscle with a host of tax proposals that would affect billionaires and blue collar alike.,fox-news,1,35.44,11.06
"Davis, who is a leader on social justice causes off and on the field, told Sports Illustrated’s Jets Country over the weekend that he welcomes “Lift Every Voice and Sing” but knows there’s still more to be done when it comes to racial equality in the U.S.",fox-news,0,35.44,11.06
"Protests sparked by the George Floyd demonstrations in the U.S. have taken root on three continents as people from Paris to Seoul demand justice for Floyd, police reforms and an end to racism in America as well as their own homelands.",fox-news,0,35.44,11.06
"The rally is Mr. Trump's first since the coronavirus closed the country in early March, upending a hot economy he had hoped would carry him to a second term.",fox-news,0,35.44,11.06
"Rapid antigen tests could play a pivotal role in curbing the spread of the coronavirus, according to some of the country’s top medical professionals.",fox-news,0,35.44,11.06
The U.S. moved aggressively over the past year to reduce the number of asylum seekers arriving at its southwest border through a series of measures aimed at making it a less attractive option.,fox-news,0,35.44,11.06
The United Nations chief urged faith leaders Tuesday to challenge misinformation about the coronavirus pandemic by promoting the World Health Organization and complying with its recommendations.,fox-news,0,35.44,11.06
"In addition to calling for severe funding cuts to Seattle police, CHAZ protests have been oozing with socialist slogans, propaganda and demands.",fox-news,1,35.44,11.06
"A California rock known for being a canvas for local artists, became the site of a neighborhood battle after ""Black Lives Matter"" artwork was painted over multiple times this past week, according to a report on Monday.",fox-news,0,35.44,11.06
Juneteenth represents the day that black slaves in Texas learned that they were free.,fox-news,0,35.44,11.06
"Saudi Arabia already shut down access to one of the holiest sites in Islam, the Kaaba, the cubic building at the Grand Mosque in the Muslim holy city of Mecca, over coronavirus fears.",fox-news,0,35.44,11.06
"French President Emmanuel Macron on Sunday declared his full support for the fight against racism, but refused to let his country take down statues of controversial, colonial-era figures.",fox-news,0,35.44,11.06
"The University of Southern California (USC) has fired two employees who allegedly accepted enormous bribes in exchange for facilitating the acceptance of dozens of students, the school has said in an official statement.",fox-news,0,35.44,11.06
Trump has publicly taken aim at Germany – even threatening last year to impose tariffs on foreign cars sold in the U.S. – over trade deficits.,fox-news,0,35.44,11.06
"If activist judges insist on redefining marriage by court order, the only alternative will be the constitutional process. We must do what is legally necessary to defend the sanctity of marriage.",fox-news,1,35.44,11.06
Confederate symbols have become a flashpoint in the protests that have sometimes turned violent and destructive.,fox-news,0,35.44,11.06
Democratic presidential candidate Sen. Bernie Sanders says he wants to spend a whopping $2.5 trillion over a decade to guarantee all Americans – regardless of income – safe and affordable housing.,fox-news,0,35.44,11.06
"Democrats this week approved legislation to require background checks for essentially all sales and transfers of firearms -- but rejected GOP-led efforts to amend the legislation to alert law enforcement authorities when gun buyers, including illegals, fail those background checks.",fox-news,0,35.44,11.06
Chinese officials demanded a public apology from a Danish newspaper on Tuesday for publishing a cartoon replacing the five stars on the national flag of the People's Republic of China with drawings of five microscopic particles of the coronavirus.,fox-news,0,35.44,11.06
"A Biden victory would ensure government-imposed thought-police courses that are anti-history, anti-free thought, anti-White, and anti-male.",fox-news,1,35.44,11.06
Democrats took the first step to repeal President Trump’s expanding travel bans Wednesday at a House Judiciary Committee session that devolved into a debate on whether the restrictions amount to a Muslim ban and whether it’s OK to call Trump “occasionally honest”.,fox-news,0,35.44,11.06
Soccer players who defy Olympic rules by making protest gestures at the 2020 Tokyo Games will be supported by their global union.,fox-news,0,35.44,11.06
"Former Arkansas Gov. Mike Huckabee said Tuesday that defunding or disbanding U.S. police departments is not the answer to nationwide protests against police brutality, arguing for the ouster of Democrats who run cities with the most problems.",fox-news,0,35.44,11.06
Social media users were quick to point out the interactions and slammed McGuire for appearing to undermine Coyne Schofield’s hockey skills.,fox-news,1,35.44,11.06
Amazon turns to Chinese firm on US blacklist to meet thermal camera needs,fox-news,0,35.44,11.06
"President Trump's two-day visit to India turned to substance Tuesday after opening with a heavy dose of pomp and pageantry, but few concrete accomplishments were expected from the whirlwind trip.",fox-news,1,35.44,11.06
But there’s another equally damaging consequence of student loan debt that’s talked about less often: its impact on borrowers’ mental health. That’s certainly not something that’s discussed with 18-year-olds as they prepare to sign the dotted line on a 10-year loan.,huffpost,0,37.82,-10.75
"After winning his 15th major championship, the legendary golfer Tiger Woods got a chance to laugh at all who doubted him.",huffpost,0,37.82,-10.75
"President Donald Trump offered an unusual warning to Virginia farmers on Tuesday, suggesting that gun control will leave their potatoes defenseless. ",huffpost,0,37.82,-10.75
"Powell and others in the George W. Bush administration lied extensively while making the case for war in Iraq in the early 2000s, fabricating “evidence” of the existence of weapons of mass destruction within the country.",huffpost,1,37.82,-10.75
"The president has failed miserably at handling the first serious challenges of his presidency: COVID-19 and the racial justice protests, Conway charged. They have not only revealed the incompetence of the “failing, flailing” president, but his inhumanity as well, Conway argued.",huffpost,1,37.82,-10.75
Dem Senators Say Mismanaged Student Loan Program Screwed Thousands,huffpost,1,37.82,-10.75
"Trump has also in his years in the White House frequently praised the use of violence. He told police officers in 2017 that they shouldn’t worry about hitting suspects’ heads as they place them in patrol cars. And on a conference call with governors on Monday, he berated them for not “dominating” the streets of their cities.",huffpost,1,37.82,-10.75
"Minhaj, who used to appear on “The Daily Show” before getting his own Netflix series, “Patriot Act,” last year, aired an episode in February in which he broke down the often confusing but debilitating problem of crushing student loan debt in the United States.",huffpost,1,37.82,-10.75
"Ever since Democratic presidential candidate Sen. Elizabeth Warren (D-Mass.) revealed her plan to forgive student debt and make public universities free on Monday morning, the internet has been a carnival of bad faith, magical thinking and misinformation about the nature of college costs in the United States.",huffpost,1,37.82,-10.75
"This is how Warren has pushed the boundaries of progressive policy since coming to Washington. Instead of relying on the traditional D.C. think tank world, she made her office into her very own think tank.",huffpost,0,37.82,-10.75
Trump has shown at best a hazy grasp of his actual powers during his presidency and instead has made broad statements about his authority under the Constitution.,huffpost,1,37.82,-10.75
"Taken together, these trends leave many young Americans feeling trapped. If they don’t go to college, they have little chance of getting a steady, well-paying job. If they do go to college they’ll be on the hook for tens of thousands of dollars in student loans.  ",huffpost,0,37.82,-10.75
A report in The New York Times claims that the UFC star Conor McGregor sexually assaulted a woman in Ireland.,huffpost,1,37.82,-10.75
"That meant anyone walking into a branch with a certain level of assets instantly became a target for multiple offers. Customers with lower incomes were less of a priority, increasingly treated as little more than a source of fee harvesting.",huffpost,1,37.82,-10.75
"Canada expects to make a financial contribution to the international vaccine coalition known as COVAX, the federal government says, aiming to equitably distribute an eventual COVID-19 vaccine to poorer countries that couldn’t afford it.",huffpost,0,37.82,-10.75
A Republican group opposed to President Donald Trump is urging voters to end his “American carnage” by voting him out of office in November. And it’s using one of Trump’s favorite TV shows to spread the message.,huffpost,0,37.82,-10.75
"President Donald Trump sparked ire on Tuesday after he spread yet another conspiracy theory, this time about wind farms.",huffpost,1,37.82,-10.75
"Trans sportswomen hit back at Martina Navratilova, after the tennis champion said “its insane and it’s cheating” for transgender women to be allowed to compete in women’s sport.",huffpost,0,37.82,-10.75
"U.S. unemployment dropped sharply in August from 10.2% to a still-high 8.4%, with about half the 22 million jobs lost to the coronavirus outbreak recovered so far, the government said Friday in one of the last major economic reports before Election Day.",huffpost,0,37.82,-10.75
"So, imagine the gall it would take to knock Winfrey for not being charitable enough. That’s what happened when a salty Instagram user slid into the comments under a photo Winfrey posted celebrating the graduates of Colorado College",huffpost,1,37.82,-10.75
The White House says it does not want to be constrained by multilateral groups like the World Health Organization.,huffpost,0,37.82,-10.75
Extreme gun advocacy group called Rocky Mountain Gun Owners cares more about fear-based fundraising and the money it generates than the policies they claim that money supports.,huffpost,1,37.82,-10.75
"The startling, aggressive attacks on peaceful protesters by the National Guard occurred after a “pointed threat” from the Pentagon that if the Guard couldn’t handle the situation, active-duty military units would be sent to deal with civilians, the Times reported.",huffpost,1,37.82,-10.75
"Rather, it’s because of the sheer fact that she was a woman, and in her country and beyond, women’s soccer still suffers from a lack of investment, a lack of attention and a lack of care.  ",huffpost,0,37.82,-10.75
"The right-wing media personality, who claimed the 2012 Sandy Hook massacre was a hoax, was sued by the parent of a young boy slain in the attack.",huffpost,1,37.82,-10.75
"The odds of giving birth prematurely was also higher in pregnant and recently pregnant women with COVID-19, compared to those without the disease.",huffpost,0,37.82,-10.75
"The decision upends a determination by Republican Secretary of State Tre Hargett’s office that fear of catching or unwittingly spreading the virus at the polls wouldn’t qualify someone to vote by mail, The state argued such an expansion wouldn’t be feasible for the 2020 elections, claiming lack of money, personnel and equipment for increased voting by mail, among other concerns.",huffpost,0,37.82,-10.75
"In 2018, Trump spoke wistfully about Chinese President Xi Jinping’s ability to change the constitution and scrap limits on the number of terms he could serve. And today he is trying to get Russia reinstated into the Group of 7, the organization of large democratic economies, even as Putin seeks to extend his presidential term until 2036 and still retains control of a portion of Ukraine, the reason Russia was expelled from what had been the G8 in the first place.",huffpost,1,37.82,-10.75
Oprah Schools Instagram Hater With Receipts After Student Loan Diss,huffpost,0,37.82,-10.75
"Though banks have fled many low-income communities, there’s a post office for almost every ZIP code in the country. ",huffpost,0,37.82,-10.75
Debates about the viability of school voucher programs have focused in recent months on programs with lackluster or spotty academic records. But there’s another issue raised by the potential expansion of public financing for private schools: an exacerbation of segregation.,huffpost,1,37.82,-10.75
Nine drugmakers racing to develop a COVID-19 vaccine in the U.S. and Europe have signed a pledge to put safety first and adhere to scientific guidelines amid growing public skepticism and pressure from the White House to release a vaccine by the end of the year.,huffpost,0,37.82,-10.75
"While each sport has its own rules with regards to religious headwear, Muslim women who compete while wearing a hijab have faced a litany of obstacles.",huffpost,0,37.82,-10.75
"Former GOP strategist Steve Schmidt on Monday rebuked President Donald Trump’s fumbling response to the coronavirus pandemic, suggesting the United States would not be facing “catastrophe” if former President Barack Obama were still in office",huffpost,1,37.82,-10.75
Racist Rep. Steve King (R-Iowa) said generations of people would not be here without rape and incest while making the case for anti-abortion legislation without exceptions for victims of those crimes.,huffpost,1,37.82,-10.75
Medically unnecessary laws regulating abortion have been exposed as dishonest attempts to close clinics.,huffpost,1,37.82,-10.75
"President Donald Trump bragged on Sunday that the Republican Party has never been stronger or more united than it is now, even as his impeachment trial is set to begin in the Senate this week. ",huffpost,1,37.82,-10.75
"When the men’s basketball Final Four tips off Saturday in Minneapolis, the NCAA’s biggest and most lucrative event will proceed as it normally does: the athletes on the floor for Virginia and Auburn, Michigan State and Texas Tech, will play games that generate hundreds of millions of dollars in total revenue for their schools, the NCAA and broadcast companies, the coaches and athletic directors, TV executives and NCAA suits will share in the riches but athletes themselves still won’t receive their fair share ― and thanks to a recent federal court decision, that won’t change in the immediate future. ",huffpost,0,37.82,-10.75
"It’s no surprise that her focus on policy has catapulted Warren back into serious contention. Digging into policy solutions for overlooked problems and explaining it in digestible soundbites is what she has done since the publication of her first book, “As We Forgive Our Debtors,” an empirical study of bankruptcy that completely changed how academics viewed the issue.",huffpost,0,37.82,-10.75
"Before President Donald Trump threatened to violently suppress demonstrations in memory of Floyd, before the spread of recording equipment let the world witness how U.S. police brutalize non-white bodies and before “I can’t breathe” became a global rallying cry challenging American cruelty and injustice, America tried to explain its racism to the world.",huffpost,1,37.82,-10.75
"Wimbledon champion Navratilova, who has campaigned for gay rights and suffered abuse when she came out in the 1980s, argued trans women have unfair physical advantages.",huffpost,0,37.82,-10.75
"If Donald Trump was willing to have Americans gassed and beaten so he could stage a photo opportunity, what will he be willing to do to retain the presidency come election time?",huffpost,1,37.82,-10.75
