text,source,label,reliability,bias
"Liberal economist and New York Times opinion writer Paul Krugman, in a scathing column this week, warns that extreme events like the wildfires that have been devastating Australia are a preview of things to come — and he stresses that right-wing politicians who deny the reality of climate change are as great a threat as the events themselves.",alternet,1,32.71,-14.76
The Christian right's perverse hostility to science is definitely going to get people killed,alternet,1,32.71,-14.76
"Using the coronavirus as his excuse, Donald Trump is working to give the highest-paid American workers a valuable tax break, while tossing crumbs to the middle class and the working poor.",alternet,1,32.71,-14.76
"Of course, social distancing will be inconceivable for football players and the results all too predictable in a world in which Covid-19 is likely to hang around for a long, long time. ",alternet,0,32.71,-14.76
"As a result, income inequality now rivals that of the robber baron days of the early 1900s, when labor unions were virtually outlawed while corporate monopolies thrived.",alternet,0,32.71,-14.76
"Jerry Falwell Jr., the shamelessly greedy president of Liberty University, has spent weeks downplaying the coronavirus threat, accusing the media of wildly exaggerating it to ""destroy the American economy"" and of course to damage Donald Trump.",alternet,1,32.71,-14.76
Lots of politicians and critics across the board have attacked the Green New Deal proposed last week by freshman Democrats Rep. Alexandria Ocasio-Cortez of New York and Sen. Ed Markey of Massachusetts.,alternet,1,32.71,-14.76
"Since taking office in 2017, Trump has worked with his Republican allies in Congress to make the U.S. tax system even friendlier to the wealthy and large corporations while leaving working- and middle-class families in the dust.",alternet,1,32.71,-14.76
"Like other autocrats and de facto crime bosses, Trump rewards his servants' loyalty to further cement his control over them.",alternet,1,32.71,-14.76
"Kenny Overstreet scrounges every penny—and even sells the eggs his chickens lay—to make ends meet after Packaging Corporation of America (PCA) furloughed him and hundreds of other workers at its Jackson, Alabama, site.",alternet,0,32.71,-14.76
"It is no secret that women are underrepresented in science, technology, engineering, and mathematics (STEM) careers. ",alternet,0,32.71,-14.76
"Now the pandemic has hit, and we’ve never been less prepared, thanks to Trump’s actions and inactions.",alternet,1,32.71,-14.76
But Trump and his cabal and cult members are never to be questioned about their vile behavior.,alternet,1,32.71,-14.76
"He is asking President Trump, a fellow climate change disbeliever and another white nationalist, for help with dousing the fires.",alternet,1,32.71,-14.76
"If sports don’t trump religion as the opiate of the masses, they have, until recently, been at least the background music of most of our lives.",alternet,0,32.71,-14.76
"Throughout his presidency, Trump has shown a penchant for quick fixes and slapdash policies aimed at satisfying the short-term appetites of his base, no matter how much it hurts the country’s long-term welfare.",alternet,1,32.71,-14.76
"Radical Virginia Citizens Defense League has organized a rally in Richmond for January 20, and the event is already attracting out-of-state pro-gun folks, including a potential horde of white nationalists.",alternet,1,32.71,-14.76
"The second thing to note is that it's nonetheless a terrifying development that will almost certainly lead to more violence, especially in light of what promises to be a chaotic but close election, where violent tactics and intimidation could affect the outcome.",alternet,1,32.71,-14.76
Hospitals across the country are laying off thousands of medical workers despite facing severe staff shortages as they treat an influx of patients infected with the coronavirus.,alternet,0,32.71,-14.76
Trump White House unleashes a dangerous virus of misinformation,alternet,1,32.71,-14.76
But the self-righteous red-state politicians should stop yapping about bailouts and remember what the blue states have done for them these past many years. ,alternet,1,32.71,-14.76
"Vice President Mike Pence repeatedly made false claims about the Trump administration's coronavirus response as he dodged, interrupted and obfuscated through the vice presidential debate on Wednesday.",alternet,1,32.71,-14.76
"Trump has kept it up ever since, instructing federal police to tear-gas peaceful protesters outside the White House on Monday evening to clear the area for his ludicrous photo-op holding a Bible in front of St. John’s Episcopal Church in Lafayette Square, a stunt that outraged the bishop who oversees that church.",alternet,1,32.71,-14.76
"Donald Trump’s reelection strategy has been clear for some weeks—destroy America’s great cities, including deliberately refusing to provide the systems needed to fight COVID-19—then point to the damage he’s done and blame “Democrat mayors.” ",alternet,1,32.71,-14.76
How a Yale professor trolls the liberals on Trump’s reelection by writing propaganda disguised as academic analysis,alternet,1,32.71,-14.76
"This kind of over-the-top misogyny is, not surprisingly, being accompanied by an absolute barrage of violent fantasies from the gun lovers who plan to descend on Richmond on Monday.",alternet,1,32.71,-14.76
How the coronavirus pandemic shows that Christian white nationalism is a much greater threat to the US than radical Islam,alternet,1,32.71,-14.76
"In addition, there is his use of Twitter to spew out verbal grenades that explode in an array of racial hatred and panics aimed at his critics and those groups who do not fit into his white nationalist view of citizenship and who should inhabit the public sphere.",alternet,1,32.71,-14.76
"If you didn’t know, Donald Trump is golfing and hanging out with rich people in New Jersey this weekend, so of course, high on flattery, he’s holding media events.",alternet,1,32.71,-14.76
Gwyneth Paltrow’s anti-vaxxer ally comes under fire for ‘discredited pseudo-scientific claims’ about coronavirus,alternet,0,32.71,-14.76
The true elegance of ranked choice voting is that it encourages candidates to campaign and to govern in an inclusive manner that leads to better representation for everyone. It incentivizes candidates to look beyond their base and seek out second-choice support.,alternet,0,32.71,-14.76
That’s why a new proposal from a bevy of progressive lawmakers comes as a welcome and innovative addition to the policy arsenal: increasing the corporate tax rate in accordance with the gap between CEO pay and median worker pay.,alternet,1,32.71,-14.76
"We have to hope that the GOP evolves into a better version of itself because, as Arthur Schlesinger Jr. observed in an article in the New York Times in 1950, this country needs two intelligent parties.",alternet,1,32.71,-14.76
"Trump had been responding to a question about his health care policy. Since he knows almost nothing about health care policy and cares even less, he launched into a meaningless and obfuscatory rant about how his administration will supposedly protect pre-existing conditions.",alternet,1,32.71,-14.76
"In an age when media stardom apparently confers some kind of universal expertise, it’s probably not a complete surprise that Republican House leaders keep trotting out pundit/provocateur Candace Owens to testify in congressional hearings on what should be a matter requiring the utmost seriousness and gravity: white nationalist terrorism and its toll on the American social fabric.",alternet,1,32.71,-14.76
"A bold statement Wednesday from former Secretary of Defense Gen. James Mattis eviscerating Donald Trump has landed like a bomb in the Senate Republican caucus, sending members fleeing in all different directions.",alternet,1,32.71,-14.76
"Amplifying fresh critiques of wealthy inequality that have mounted throughout the coronavirus pandemic, Amazon founder Jeff Bezos—the world’s richest man—has added nearly $24 billion to his already massive fortune in 2020 as virus-related lockdowns across the globe have forced people to stay inside and fueled increased e-commerce demand.",alternet,0,32.71,-14.76
"At any other time, the U.S. would have led efforts and coordinated global fights against epidemics, but the science-averse Trump administration had already axed the CDC expert in China.",alternet,1,32.71,-14.76
"Now, the data shows there is an aftershock in the form of the looming tsunami of student debt defaults that will hit communities of color the hardest, according to data compiled by the National Center for Education Statistics and Demos, a progressive think tank.",alternet,1,32.71,-14.76
"Now that most of America has begun opening back up without the predicted spikes in coronavirus and Joe Biden has left his basement bunker, Americans are remembering that there’s an election going on. As normalcy quickly returns some places, so to has the battle for 1600 Pennsylvania Avenue.",the-federalist,1,21.77,18.67
"Even while claiming to reopen in New York, Cuomo is slapping on unnecessary restrictions such as mandating customers order food with alcohol at bars and restaurants, because forcing people to eat has everything to do with coronavirus.",the-federalist,1,21.77,18.67
"Now Democrats have upped the ante, threatening an even greater disruption to federal checks and balances by knocking down some of the last few remaining constitutional barriers to their permanent governance.",the-federalist,1,21.77,18.67
"Religion will also prove more attractive in a practical way. One of the underreported stories of the 2007-2008 financial crisis was the critical role various churches played in helping people cope with the abrupt collapse of home values, the big drop in retirement savings due to falling stock prices, and the subsequent tsunami of pink slips and salary cuts.",the-federalist,1,21.77,18.67
"President Trump’s new coronavirus adviser, Dr. Scott Atlas, said this massive number of tests will be deployed in a variety of ways, including to in-home care and senior centers.",fox-news,0,35.44,11.06
"Protests sparked by the George Floyd demonstrations in the U.S. have taken root on three continents as people from Paris to Seoul demand justice for Floyd, police reforms and an end to racism in America as well as their own homelands.",fox-news,0,35.44,11.06
"Merril Hoge, one of the most outspoken critics against the alarm surrounding CTE studies, also underscored that, from his lens, demonizing sports like football does more harm to American children than good.",fox-news,0,35.44,11.06
Primate research in the country was already pricey and controversial — but the coronavirus pandemic has been particularly bad for the monkey business.,fox-news,0,35.44,11.06
Some colleges are choosing to invite only a portion of students back to campus amid a resurgence in COVID-19 cases nationwide,fox-news,0,35.44,11.06
"Like the costly and controversial Green New Deal, which Booker co-sponsored in the form of a Senate resolution, Booker’s plan aims to address both climate change and economic inequality.",fox-news,1,35.44,11.06
"Trump went out of his way to underscore his support for police in his comments Tuesday, quoting statistics about the number of arrests made by local law enforcement for severe crimes like rape and murder.",fox-news,0,35.44,11.06
Trump has publicly taken aim at Germany – even threatening last year to impose tariffs on foreign cars sold in the U.S. – over trade deficits.,fox-news,0,35.44,11.06
Chinese officials demanded a public apology from a Danish newspaper on Tuesday for publishing a cartoon replacing the five stars on the national flag of the People's Republic of China with drawings of five microscopic particles of the coronavirus.,fox-news,0,35.44,11.06
Juneteenth represents the day that black slaves in Texas learned that they were free.,fox-news,0,35.44,11.06
A Biden victory would be a victory for violence in the streets reinforced by an anti-police and pro-criminal bias.,fox-news,1,35.44,11.06
An initiative to build bridges between the Greek and Turkish speaking communities of ethnically split Cyprus faltered after the leader of the breakaway Turkish Cypriots skipped a soccer match over a dispute of the game's location.,fox-news,0,35.44,11.06
"A California rock known for being a canvas for local artists, became the site of a neighborhood battle after ""Black Lives Matter"" artwork was painted over multiple times this past week, according to a report on Monday.",fox-news,0,35.44,11.06
"Nation of Islam leader Louis Farrakhan discouraged viewers from getting the coronavirus vaccine, implying that it was part of a government conspiracy meant to lower the Black population.",fox-news,0,35.44,11.06
"Biden, who based his successful bid for the Democratic nomination on the importance of defeating Trump and returning to normalcy, had long resisted calls to eliminate student debt.",huffpost,0,37.82,-10.75
"After winning his 15th major championship, the legendary golfer Tiger Woods got a chance to laugh at all who doubted him.",huffpost,0,37.82,-10.75
"Taken together, these trends leave many young Americans feeling trapped. If they don’t go to college, they have little chance of getting a steady, well-paying job. If they do go to college they’ll be on the hook for tens of thousands of dollars in student loans.  ",huffpost,0,37.82,-10.75
"Trans sportswomen hit back at Martina Navratilova, after the tennis champion said “its insane and it’s cheating” for transgender women to be allowed to compete in women’s sport.",huffpost,0,37.82,-10.75
"Bernie Sanders, meanwhile, sees early voting as a way to boost turnout among core constituencies like young, minority and working-class voters. Early voting opens new opportunities for people with strict work schedules or other barriers to voting to find time to cast ballots beyond the typical Election Day, spokeswoman Sarah Ford said.",huffpost,0,37.82,-10.75
"Rather, it’s because of the sheer fact that she was a woman, and in her country and beyond, women’s soccer still suffers from a lack of investment, a lack of attention and a lack of care.  ",huffpost,0,37.82,-10.75
"Nevertheless, Trump and other Republicans have tarred the protests as havens for terrorists intent on destroying property. ",huffpost,1,37.82,-10.75
The Never Trumper Republicans of The Lincoln Project have mobilized former Defense Secretary Jim Mattis’s scathing broadside against the president in their latest attack on Donald Trump.,huffpost,1,37.82,-10.75
"Some nations have worked directly to secure supplies of vaccine, but others are pooling efforts to ensure success against a disease that has no geographical boundaries.",huffpost,0,37.82,-10.75
"Conservative commentator Ben Shapiro wants you to know that he’s so pro-life, he wouldn’t even consider aborting baby Hitler.",huffpost,1,37.82,-10.75
"The Republican-led Legislature and GOP Gov. Bill Lee have dismissed the idea of offering absentee ballots to all voters, with lawmakers voting against Democratic expansion proposals more than once this week as they meet during pandemic times.",huffpost,0,37.82,-10.75
"People were tear-gassed, manhandled, shoved, battered with clubs and slammed with shields on Monday to clear the way for Trump to cross the street from the White House for a photo op at St. John’s Episcopal Church. The onslaught against the protesters began 25 minutes before a 7 p.m. curfew. ",huffpost,1,37.82,-10.75
"New York Attorney General Letitia James said in her complaint, filed in Manhattan federal court earlier this month, that “PHEAA’s abuses have not only denied these dedicated public servants the benefits they have earned, but have undermined the goals of the loan forgiveness program.”",huffpost,0,37.82,-10.75
"President Donald Trump sparked ire on Tuesday after he spread yet another conspiracy theory, this time about wind farms.",huffpost,1,37.82,-10.75
"Biden’s plan also includes major investments in historically black colleges and universities, tribal colleges and universities, and other minority-serving institutions, including $18 billion in grants and $20 billion for infrastructure. ",huffpost,0,37.82,-10.75
"President Donald Trump offered an unusual warning to Virginia farmers on Tuesday, suggesting that gun control will leave their potatoes defenseless. ",huffpost,0,37.82,-10.75
"In the seven years since, Warren has become the most active politician in America when it comes to investigating, transforming and eliminating student debt.",huffpost,0,37.82,-10.75
"Since Roe v. Wade, when the Supreme Court recognized the constitutional right to an abortion, state lawmakers have devised novel ways to cut off access to the procedure without banning it outright. One strategy is to require clinics and doctors to comply with an ever-expanding list of regulations, with the goal of essentially red-taping providers out of business.",huffpost,0,37.82,-10.75
The White House says it does not want to be constrained by multilateral groups like the World Health Organization.,huffpost,0,37.82,-10.75
"When the men’s basketball Final Four tips off Saturday in Minneapolis, the NCAA’s biggest and most lucrative event will proceed as it normally does: the athletes on the floor for Virginia and Auburn, Michigan State and Texas Tech, will play games that generate hundreds of millions of dollars in total revenue for their schools, the NCAA and broadcast companies, the coaches and athletic directors, TV executives and NCAA suits will share in the riches but athletes themselves still won’t receive their fair share ― and thanks to a recent federal court decision, that won’t change in the immediate future. ",huffpost,0,37.82,-10.75
Her proposal brings into sharp focus conservatives’ crusade to legislate control of women’s bodies through restrictive abortion bills and other measures that undermine reproductive rights.,huffpost,1,37.82,-10.75
"The Sandy Hook tragedy rocked the United States when a 20-year-old man shot and killed his mother at home and then went on a rampage at the school, also killing himself.",huffpost,0,37.82,-10.75
Dem Senators Say Mismanaged Student Loan Program Screwed Thousands,huffpost,1,37.82,-10.75
"There are no more major cases against the NCAA proceeding currently, but Wilken has slowly eroded some of the NCAA’s favorite arguments and restrictions.",huffpost,0,37.82,-10.75
The harshest attack on Trump and military action against civilians was issued in The Atlantic on Wednesday by former Defense Secretary and retired Marine Corps general Jim Mattis. He hailed peaceful protesters for working for a better future.,huffpost,1,37.82,-10.75
Australian Rugby Player Israel Folau and his anti-gay sentiments appear to have gone too far this time.,huffpost,1,37.82,-10.75
The good news is that the measures we are taking to prevent COVID-19 also help protect against the flu because both viruses are contagious respiratory infections spread through droplets.,huffpost,0,37.82,-10.75
"Trump also threatened to invoke the Insurrection Act, an 1807 law that would allow the president to send U.S. armed forces into states for the purpose of domestic law enforcement, if mayors and governors didn’t do more to curb the unrest.",huffpost,1,37.82,-10.75
"Democrats and Republicans have long conflated “policing” with “public safety,” in part because large shares of voters have, too. But local and national polling had shown that the public’s views of policing and criminal justice had begun to shift even before the protests, thanks to the work of Black Lives Matter and organizers and activists.",huffpost,0,37.82,-10.75
"The right-wing media personality, who claimed the 2012 Sandy Hook massacre was a hoax, was sued by the parent of a young boy slain in the attack.",huffpost,1,37.82,-10.75
Nine drugmakers racing to develop a COVID-19 vaccine in the U.S. and Europe have signed a pledge to put safety first and adhere to scientific guidelines amid growing public skepticism and pressure from the White House to release a vaccine by the end of the year.,huffpost,0,37.82,-10.75
Trump has shown at best a hazy grasp of his actual powers during his presidency and instead has made broad statements about his authority under the Constitution.,huffpost,1,37.82,-10.75
Medically unnecessary laws regulating abortion have been exposed as dishonest attempts to close clinics.,huffpost,1,37.82,-10.75
"As the senators’ letter pointed out this week, government watchdogs have repeatedly called out the PHEAA’s mismanagement of the program over the years.",huffpost,1,37.82,-10.75
"While each sport has its own rules with regards to religious headwear, Muslim women who compete while wearing a hijab have faced a litany of obstacles.",huffpost,0,37.82,-10.75
"Since the coronavirus pandemic began, emboldened pro-life groups have used the public health crisis to try to disrupt access to abortion.",huffpost,1,37.82,-10.75
The disqualification was emblematic of what many women who wear hijabs go through while participating in sports.,huffpost,0,37.82,-10.75
"As banks leave low-income communities and jack up the cost of basic financial services such as checking accounts, many Americans instead have to rely on expensive and often predatory “fringe banking” institutions, such as check-cashing businesses, payday lenders and pawnshops.",huffpost,1,37.82,-10.75
"In recent months, Trump has begun aggressively attacking mail voting, a process that is standard in some states now and which many others are expanding because of concerns that in-person voting could spread the coronavirus. Trump has repeatedly claimed that expanding voting by mail will let Democrats cheat, even though he, his press secretary and a top adviser have all voted by mail in recent elections.",huffpost,1,37.82,-10.75
"Powell and others in the George W. Bush administration lied extensively while making the case for war in Iraq in the early 2000s, fabricating “evidence” of the existence of weapons of mass destruction within the country.",huffpost,1,37.82,-10.75
"Polling throughout the Democratic primary showed Sanders triumphing with young voters by massive margins, and early polling in the general election has shown Biden running weaker with younger voters than past Democratic nominees.",huffpost,0,37.82,-10.75
"But last Wednesday, when the Heritage Clinic for Women in Grand Rapids, Michigan, opened in the morning, the staff were startled to find 25 to 30 protesters assembling, many of them holding single red roses. Ignoring the no-trespassing signs, they began swarming the clinic’s parking lot, rushing patients as they got out of their cars.",huffpost,0,37.82,-10.75
The report is an in-depth analysis of the Parkland shooting and offers a searing critique of the school and sheriff department’s ability to stymie the bloodshed.,huffpost,0,37.82,-10.75
"The Black Lives Matter movement, sparked by police murdering Black people, predates Trump’s presidency by several years, but the president personifies the kind of systemic racism the movement has always decried.",huffpost,1,37.82,-10.75
"As a political calculation, it shows Biden’s campaign is confident about their standing with many suburban moderates who were swing voters in the past but have moved solidly into the Democratic Party during Trump’s presidency, offended by his bullying demeanor and chaotic style.",huffpost,1,37.82,-10.75
"Summer’s nearly over, and unfortunately, we are still very much in the throes of a pandemic.",huffpost,0,37.82,-10.75
"Canada expects to make a financial contribution to the international vaccine coalition known as COVAX, the federal government says, aiming to equitably distribute an eventual COVID-19 vaccine to poorer countries that couldn’t afford it.",huffpost,0,37.82,-10.75
"If Donald Trump was willing to have Americans gassed and beaten so he could stage a photo opportunity, what will he be willing to do to retain the presidency come election time?",huffpost,1,37.82,-10.75
The number of April background checks to purchase a firearm showed Americans flocking to gun stores in high numbers for the second month in a row amid worries about the coronavirus pandemic.,huffpost,1,37.82,-10.75
Millions of Americans are counting on a COVID-19 vaccine to curb the global pandemic and return life to normal.,huffpost,0,37.82,-10.75
"Authoritarianism experts who worried about Trump’s tendencies during his campaign and his first years in office are now sounding fresh alarms following the clearing of a park adjacent to the White House on Monday using gas, flash-bang grenades, pepper pellets and other aggressive tactics ― all so he could stand in front of a church he does not attend and be photographed holding a Bible.",huffpost,0,37.82,-10.75
"Some 81% of Americans say they favor requiring background checks for gun buyers as part of an effort to stop mass shootings. Just 8% are opposed. A 59% majority say they favor banning “assault weapons,” with only about 23% opposed.",huffpost,0,37.82,-10.75
President Donald Trump is getting called out on social media after posing in front of a church with a Bible ― a photo-op possible only after police fired tear gas and rubber bullets at peaceful protesters to clear the area. ,huffpost,0,37.82,-10.75
A Republican group opposed to President Donald Trump is urging voters to end his “American carnage” by voting him out of office in November. And it’s using one of Trump’s favorite TV shows to spread the message.,huffpost,0,37.82,-10.75
