text,source_party,label,source,reliability,bias
"Israel will enter into a new round of national elections in November and the demarcation of maritime borders has recently been weaponized against the current Israeli leadership, causing ministers to act in order to save face.",Lean Right,1,rt,28.66,11.46
"They also cooperate as part of the OPEC+ oil group, he added.",Lean Right,0,rt,28.66,11.46
"With the death of the left comes an opportunity for the right Enter a Czech lawyer named Jindrich Rajchl, who leads the emerging political party, PRO.",Lean Right,1,rt,28.66,11.46
"On Monday, the Economic Times reported that at least three Russian entities have applied for different licenses with GIFT City authorities.",Lean Right,0,rt,28.66,11.46
"According to the report, the shortfall is partly due to traders simply ignoring the price ceiling, with Russian oil selling for roughly $70 a barrel.",Lean Right,0,rt,28.66,11.46
"Napoleon did not shoot cannons at the Pyramids, nor did his invasion of Russia fail entirely because of hubris, nor were the tactics of Waterloo so badly managed.",Right,0,the-federalist,21.77,18.67
"In Janus v. American Federation of State, County and Municipal Employees, the justices overturned an Illinois law that compelled public employees to subsidize unions regardless of their personal objections to the unions’ activism.",Right,0,the-federalist,21.77,18.67
"Biden’s Build Back Better Plan/Inflation Reduction Act reads like a Left Coast wish list: implementing the Green New Deal, raising the minimum wage to $15, and expanding family paid leave.",Right,1,the-federalist,21.77,18.67
"Coated in a gold alternative, each piece is waterproof and backed by a lifetime color warranty.",Right,0,the-federalist,21.77,18.67
"But when you join the people who openly say they want to gay and trans your kids, the good Americans draw the line.",Right,1,the-federalist,21.77,18.67
Fighting against confusing ballot language is one of the first steps red states’ must take in fortifying themselves against outside activists and their radical abortion agenda.,Right,1,the-federalist,21.77,18.67
"In 2022, for instance, Disney brought in close to $83 billion - which is double the GDP of whole European and South American countries.",Right,0,the-federalist,21.77,18.67
Other recent investigations have also found government counterterrorism resources and tactics being used to shape American public opinion and policy.,Right,0,the-federalist,21.77,18.67
"We now need to look for, and create, sustainable gains that can be fortified until our time arrives again.",Right,0,the-federalist,21.77,18.67
"Founded by the Bentley family and named for their two children, Parker Clay employs at-risk women in Ethiopia to construct durable leather products, backed by a lifetime guarantee.",Right,0,the-federalist,21.77,18.67
"Disney’s purchase of Lucasfilm, so brilliant in 2012, has become yet another headache for the company, with a despised sequel trilogy that made no sense and a wheelbarrow of Disney-Plus shows that cannot draw an audience to save their lives.",Right,1,the-federalist,21.77,18.67
"On the first contention, Napoleon was famous for his ability to work well on almost no sleep.",Right,0,the-federalist,21.77,18.67
And so you have to check the impact on the communities.,Left,0,vogue,39.13,-10.91
Ho Tzu Nyen: Time & the Tiger runs from 24 November 2023 to 3 March 2024.,Left,0,vogue,39.13,-10.91
Years after the creation of Google Images-owing to Jennifer Lopez’s iconic Versace jungle print dress-fashion searches continue to stand testament to an outfit’s acclaim with Carrie Bradshaw‘s look in the And Just Like That... finale.,Left,0,vogue,39.13,-10.91
"Peter Heller’s sixth novel, The Last Ranger (Knopf), is a lovingly written mystery populated by wildlife and militiamen and starring a mid-30s loner who can’t help but fall for an expert wolf researcher named Hilly.",Left,0,vogue,39.13,-10.91
"So I'm coming back to what you said sometime people want to have the story taken told, but they want to be faceless.",Left,0,vogue,39.13,-10.91
"So, with this 5-piece set, expect brighter, firmer, youthful-looking skin upon completing the regimen.",Left,1,vogue,39.13,-10.91
"We have the strawberry cake mix, vanilla jello, some sour cream, eggs, and vegetable oil.",Left,0,vogue,39.13,-10.91
The rain gods played hide and seek all day long but graciously hit pause on the downpour during crucial moments.,Left,0,vogue,39.13,-10.91
"Yeah, and then you got an output, which is an image in this case.",Left,0,vogue,39.13,-10.91
The surgery can be especially daunting when you take into account that the alteration is permanent but that beauty trends are not.,Left,1,vogue,39.13,-10.91
"Virginia Smith, global head of fashion network To Give: This holiday season, I’m giving the World Central Kitchen cookbook to support their emergency response efforts.",Left,0,vogue,39.13,-10.91
Being unembarrassed in the face of passion is rizz like no other.,Left,0,vogue,39.13,-10.91
"Through our small and simple efforts, we can create a home that is a place for growth, healing and grace, where love and laughter and beauty are present amid life’s troubles and setbacks.",Right,1,national-catholic-register,22.39,11.81
"There are fewer than 40 of them, including such lights as Athanasius, Ambrose, Augustine, Anselm, Albert and Aquinas.",Right,0,national-catholic-register,22.39,11.81
"But whatever the real reason, the relics can still be venerated today in the Basilica of St. Nicholas in Bari.",Right,0,national-catholic-register,22.39,11.81
"Most people know that Nicholas’ feast day is celebrated on Dec. 6, the day he died in the year 343, but for East Slavs, as well as the people of Bari, Italy, May 9 is also an important day of celebration.",Right,1,national-catholic-register,22.39,11.81
"A Priest’s Influence on Film Born in Chicago in 1888, Daniel Lord grew up in a golden age of theater.",Right,0,national-catholic-register,22.39,11.81
Both ultimately were shocked at the unintended consequences of the law.,Right,0,national-catholic-register,22.39,11.81
"The Corinthians to whom St. Paul writes, certainly, would have been familiar with this theme of one god supplanting or consuming another - a mythological preview, if you will, of Hegel’s thesis-antithesis-synthesis.",Right,1,national-catholic-register,22.39,11.81
"Father Lord was dismayed by the new content, and he also thought many of these films were of poor quality.",Right,0,national-catholic-register,22.39,11.81
The latter document is much less known than the former one.,Right,0,national-catholic-register,22.39,11.81
Here’s a guide to some of CNA staff members’ favorite gifts to give and receive.,Right,0,national-catholic-register,22.39,11.81
"Here’s what happened: On June 18, 1981, 66-year-old Justice Potter Stewart announced that he was retiring after 23 years on the bench.",Right,0,national-catholic-register,22.39,11.81
What makes this book all the more inviting is the pairing of each phrase with beautiful sacred art on the opposite page.,Right,0,national-catholic-register,22.39,11.81
"State Department spokesman Matthew Miller suggested that Hamas was refusing to release the remaining female hostages held in Gaza because the terrorist group doesn’t want them to speak about what they endured while held as hostages, according to Axios.",Right,0,independent-journal-review,25.81,12.82
Riley told that an official told her to hold the sixth place trophy.,Right,0,independent-journal-review,25.81,12.82
But the race to fill retiring Sen. Pat Toomey’s (R-Pa.) seat has given Republicans more than a little heartburn.,Right,1,independent-journal-review,25.81,12.82
"Hanukkah celebrates the rededication of the Second Temple in Jerusalem, along with the miracle of one day’s oil lasting for eight days.",Right,0,independent-journal-review,25.81,12.82
"That has all seemingly gone away in the blink of an eye, but really over many years of deliberate planning by the Democrats, global elites, and cooperative entities.",Right,1,independent-journal-review,25.81,12.82
"Practical remedies for that lunacy include daily saunas, spending time with his dogs and getting outside every day.",Right,0,independent-journal-review,25.81,12.82
"Now, you may have noticed that was a bit of a walkback from his initial statement.",Right,1,independent-journal-review,25.81,12.82
"Tucker Carlson spoke to an audience, not a congregation, but you would never know it from the advice he gave.",Right,1,independent-journal-review,25.81,12.82
Not even in the town he claims are his old stomping grounds.,Right,1,independent-journal-review,25.81,12.82
"We are committed to letting our readers know when a story has been corrected or updated with additional information, from syndicated content to original breaking news stories.",Right,0,independent-journal-review,25.81,12.82
"And, keep in mind, this isn’t the only problem Germany has faced on the migrant front; data from 2018 show that terrorism accusations and other violent crime was positively correlated with asylum-seekers in the country, many from Syria.",Right,1,independent-journal-review,25.81,12.82
"Curb  Word Entertainment singer, songwriter and pop artist Sarah Reeves obviously has.",Right,0,independent-journal-review,25.81,12.82
"The latest flash of life is this report from The Dispatch, suggesting that Haley donors are trying to convince Christie’s to come onboard.",Center,1,deseret-news,42.29,2.55
"The Buffaloes were unable to keep pace with the rampaging Cowboys, with their record now falling to 0-3.",Center,0,deseret-news,42.29,2.55
"2:17.63 - Emme Brewer, Lone Peak, Sr. Note: State record is 2:03.41 by Brighton’s Rachel Butler in 2019.",Center,0,deseret-news,42.29,2.55
"Naia Tanuvasa paced the Knights with an incredible 24 points, including four 3-pointers.",Center,0,deseret-news,42.29,2.55
Only 38.4 percent say parents should be allowed to sue and claim damages against social media companies on behalf of children claiming they were harmed.,Center,0,deseret-news,42.29,2.55
"Even then, Ford hit one final 3 at the buzzer to make it a two-point Utes win.",Center,0,deseret-news,42.29,2.55
"For example, support for marriage as a path to stable, committed relationships is falling among those on the left, where Democrats see as top challenges parental stress and the cost of raising a family.",Center,1,deseret-news,42.29,2.55
The Grizzlies rallied back in the third quarter after a meager second quarter performance but couldn’t bridge the gap.,Center,0,deseret-news,42.29,2.55
"That prompted questions of what the Jets, who’ve lost five straight, would do at the quarterback position heading into their Week 14 game against the Houston Texans.",Center,0,deseret-news,42.29,2.55
"The Orem Tigers clawed their way to a 62-57 victory against the Olympus Titans, despite trailing by 17 points at halftime.",Center,0,deseret-news,42.29,2.55
"Top Ramaswamy Aide Resigns to Start Working for the Trump Campaign (Anjali Huynh, The New York Times) Have a question for next week’s mailbag?",Center,0,deseret-news,42.29,2.55
He provided big plays with his arm and with his legs but his ability to control the tempo of the game and lead our offensive unit makes him more valuable than just his big plays.,Center,0,deseret-news,42.29,2.55
"Apple is in court because of something called the Information Services Agreement, or ISA: a deal that makes Google’s search engine the default on Apple’s products.",Lean Left,0,the-verge,39.43,-4.75
See the tech in action on all of your women’s fashion and wedding-related searches.,Lean Left,1,the-verge,39.43,-4.75
"The more people search, the more the company behind the engine can learn what they’re looking for.",Lean Left,0,the-verge,39.43,-4.75
"For the past 25 years, the internet as we know it has been almost entirely defined and controlled by Google.",Lean Left,1,the-verge,39.43,-4.75
But not nearly enough to meet the goals of the Paris accord and stave off even more extreme events like what’s recently struck Brazil.,Lean Left,1,the-verge,39.43,-4.75
We should have different rules for public figures than we do for private citizens.,Lean Left,1,the-verge,39.43,-4.75
This thought process is why he teases his four-year-old that there’s a person inside their Alexa; he wants his daughter to treat the technology with empathy so that she develops manners she can practice with actual people.,Lean Left,0,the-verge,39.43,-4.75
"A fact sheet from the agency says it decided not to update rules for new coal plants since it doesn’t anticipate new coal facilities to come online, which are more expensive and polluting than gas plants.",Lean Left,0,the-verge,39.43,-4.75
Many of the questions she faced drilled down to one thing: what exactly did the $210 million power station actually do after Ida?,Lean Left,0,the-verge,39.43,-4.75
"The second thing is, essentially, they’re looking for a payback here.",Lean Left,1,the-verge,39.43,-4.75
"E-readers from Boox have offered appealing hardware, but keep letting me down with inferior software.",Lean Left,0,the-verge,39.43,-4.75
"But all said and done, I’m glad Meta didn’t bother attempting a smart display.",Lean Left,1,the-verge,39.43,-4.75
"She modeled the outfit for her 172,000 TikTok followers last week in a 54-second clip that mustered 627,000 views.",Lean Right,0,new-york-post,31.92,9.28
"With a glare-reducing screen to read like a natural page-turner, $140 will be a worthwhile investment.",Lean Right,0,new-york-post,31.92,9.28
"Of course, it’s not all about raging at the 425-room property.",Lean Right,0,new-york-post,31.92,9.28
"Amazon Available in any color you can think of, Amazon Basics’ Exercise Yoga Mat is one of the most you-should-own-it items in this edit.",Lean Right,0,new-york-post,31.92,9.28
"6 Taylor Swift kisses boyfriend Travis Kelce alongside pals Mecole Hardman, Jr. and Chariah Gordon.",Lean Right,0,new-york-post,31.92,9.28
The store will also host art talks with experts in the coming months.,Lean Right,0,new-york-post,31.92,9.28
"Going Yard Speaking of good times, lukewarm Hudson Yards just newly added cool private club ZZ’s.",Lean Right,0,new-york-post,31.92,9.28
"It doesn’t come with the whiskey, but you get mixers to play with each night leading up to Christmas.",Lean Right,0,new-york-post,31.92,9.28
"Whelan and Gershkovich have been charged in Russia with spying, which they deny.",Lean Right,0,new-york-post,31.92,9.28
West Elm There’s nothing like a luxe bath caddy to allow your wife to sit back and relax - literally.,Lean Right,1,new-york-post,31.92,9.28
"10 A Palestinian child injured in an Israeli airstrike receives treatment at Nasser Medical Hospital on Dec. 6, 2023 in Khan Yunis, Gaza.",Lean Right,0,new-york-post,31.92,9.28
"Just shy of $25, it’s a grab your wife will adore.",Lean Right,1,new-york-post,31.92,9.28
Both are also capable of playing second if the Yankees trade Torres.,Left,0,new-york-daily-news,40.47,-8.12
Transit officials say the tolls should go into effect in May.,Left,0,new-york-daily-news,40.47,-8.12
"Michael Nicholoulias, 74, was arrested Monday night as he drew a swastika on a bench in the posh seaside village, according to News 12 Long Island.",Left,0,new-york-daily-news,40.47,-8.12
"Start your meal off with some red borscht in a short rib and bacon broth, or take the more traditional route with a squash soup topped with maple creme fraiche and pumpkin seed oil.",Left,0,new-york-daily-news,40.47,-8.12
"They argued, and Majors said they shouldn’t cause a scene in public, so they both got back in the car, where her phone and bag were.",Left,0,new-york-daily-news,40.47,-8.12
"Cops will confiscate any alcohol and issue summons to violators, the chief said.",Left,0,new-york-daily-news,40.47,-8.12
The T.J. Holmes/ Amy Robach fiasco just got another plot twist.,Left,1,new-york-daily-news,40.47,-8.12
"However, the 27-year-old only played right in 2023 and hasn’t played center since 2021.",Left,0,new-york-daily-news,40.47,-8.12
"The move comes nearly three months after Lander’s office retroactively rejected the city’s $432 million, no-bid contract with DocGo, a for-profit medical services firm that was said to have mistreated migrants.",Left,0,new-york-daily-news,40.47,-8.12
To say the quarterback situation for the Jets is a mess would be an understatement.,Left,1,new-york-daily-news,40.47,-8.12
These antisemitic groups are funded by the U.S. government and tax-deductible charitable contributions.,Left,1,new-york-daily-news,40.47,-8.12
"An asteroid may have done in the dinosaurs, but 65 million years later it’s catastrophic flooding that threatens Riverside Park’s beloved Dinosaur Playground.",Left,1,new-york-daily-news,40.47,-8.12
Thursday’s raucous debate is giving way to bitter disappointment with and outright hostility toward Fox News and its host from the California Democrat’s camp.,Right,1,american-thinker,13.67,24.85
"What it will not countenance, however, is limited government, individual liberty, and long-term peace.",Right,1,american-thinker,13.67,24.85
Freeman claims the book will forever change his readers’ view of money.,Right,0,american-thinker,13.67,24.85
"Even so, the progressives appear unaware of--or are obtuse about--the historical failures and present frailties of their touted ‘isms’--even socialism, following communism, is in predictable self-destruction or precariousness, globally.",Right,1,american-thinker,13.67,24.85
The Dems are begging Biden to withdraw from the 2024 race because they know he is -- wait for it -- a loser!,Right,1,american-thinker,13.67,24.85
"If this is the case, then what is the intent and purpose of this grandfathered exemption?",Right,0,american-thinker,13.67,24.85
"On the topic of corruption, you’d better believe that St. Barack of Chi-town, our first half-black president, had absolutely no scandals during his eight years in office.",Right,1,american-thinker,13.67,24.85
"If they came together in Germany, it’s a German hair dryer.",Right,0,american-thinker,13.67,24.85
"It was revealed that President Clinton did in fact have an affair with Lewinsky, meaning, narcissistic loony toon or not, her claims were credible.",Right,1,american-thinker,13.67,24.85
His being black hurt his odds of being chosen as a J6 poster boy.,Right,1,american-thinker,13.67,24.85
"He may as well have told us that giving Hamas water pipes was a peaceful way to support the Palestinian people, when in fact Hamas turns water pipes into missiles.",Right,1,american-thinker,13.67,24.85
No other reasons are given by black leadership for the failures of blacks to thrive except for... racism.,Right,1,american-thinker,13.67,24.85
"Once Henry recognised that war could not be won, he got the best possible peace terms for the South Vietnamese, and it was only congressional recalcitrance that meant that it was not enough.",Right,1,washington-free-beacon,23.47,14.45
"It is on pace to see more than 800 deaths in 2023, topping the deadliest year on record of 2020, which saw 720 such deaths, the Guardian reported Wednesday.",Right,0,washington-free-beacon,23.47,14.45
"Some of these films are beloved comedy classics such as Mrs. Doubtfire, Ace Ventura: Pet Detective, and Tropic Thunder, while others are forgettable flops such as Juwanna Mann and Sorority Boys.",Right,1,washington-free-beacon,23.47,14.45
"Nikki Haley, biotech entrepreneur Vivek Ramaswamy and former New Jersey Gov.",Right,0,washington-free-beacon,23.47,14.45
"Use our ChannelFinder and download our app to get fact-based, unbiased news for all America.",Right,0,washington-free-beacon,23.47,14.45
"Its 15, often-multi-page references would have reminded him of the centrality of his life and career to the history of the past eight decades since the Nazis tried and thankfully failed to kill him.",Right,1,washington-free-beacon,23.47,14.45
"While they’re at it, they should get off Elon’s case too, and take heed of what he has to say.",Right,1,washington-free-beacon,23.47,14.45
"When parents protested, they were not met with efforts at persuasion or fact-based reasoning, but with condescension.",Right,1,washington-free-beacon,23.47,14.45
Claim: President Joe Biden never interacted with his son Hunter’s foreign business associates.,Right,0,washington-free-beacon,23.47,14.45
"Hunter Biden and his father also shared office space in Washington, D.C., with executives of the Chinese energy firm, emails from his abandoned laptop show.",Right,0,washington-free-beacon,23.47,14.45
"Amenities included several pools, racquetball courts, cycling studios, massage rooms, golf simulator, climbing wall, and a rooftop dog park.",Right,0,washington-free-beacon,23.47,14.45
The policy is already facing pushback from Republican foreign policy aides in Congress and from former Trump administration officials who see President Joe Biden as wrongly prioritizing sanctions on Israel.,Right,1,washington-free-beacon,23.47,14.45
The team at Foul Witch dares to imagine what would happen if you conjured Italian cooking anew in a stoned brainstorming session.,Left,1,esquire,27.41,-18.14
"The United States doesn’t have it, outside of DeAndre Yedlin, who came on as a substitute against Belgium in 2014 before Kevin De Bruyne and Romelu Lukaku scored to knock the Americans out in extra time.",Left,0,esquire,27.41,-18.14
"He’s a full-on Communist, and you went on to be a serious prizefighter and a big-time promoter as well.",Left,1,esquire,27.41,-18.14
The crush grew even greater when Sammy the Bull was sworn in.,Left,1,esquire,27.41,-18.14
"He wasn’t mocked and dismissed like Minnie Miñoso, neglected like Larry Doby, or improbably underrated as Frank Robinson.",Left,1,esquire,27.41,-18.14
"It also stands in stone as a reminder that even in a time defined by our seeming inability to acknowledge error, extend grace, apologize to each other, and correct course, lost truths can still be found and long-delayed justice is not always justice denied.",Left,1,esquire,27.41,-18.14
"The most-watched regular season game of all time is 2021's Giants-Cowboys Thanksgiving Day game, at 42 million viewers-and you really should know better than to doubt the power of the Taylor Swift Machine by now.",Left,1,esquire,27.41,-18.14
"If you live anywhere within the tentacular reach of Amazon’s advertising, chances are you’ve seen Córdova emblazoned on buses and billboards, costumed in pointy elven ears.",Left,0,esquire,27.41,-18.14
"He then went and picked a fight with Liz Cheney, accusing her and the rest of the January 6 special committee of having selectively edited the January 6 footage that the committee used to prove that there was an insurrection that day.",Left,0,esquire,27.41,-18.14
"From left, on Weah: Jacket, trousers, shirt, and shoes by Prada.",Left,0,esquire,27.41,-18.14
"Day or night, you can count on one being lit in my bedroom; sometimes, I’ll put an extra out in the living room, too.",Left,0,esquire,27.41,-18.14
It's the horological equivalent of a double espresso shot with a twist of mountain pine.,Left,0,esquire,27.41,-18.14
"Some Mayday fans said they were disappointed, while others defended the band, including by posting snippets of their live performances where Ashin could be heard clearly singing out of tune.",Lean Left,0,cnn,42.06,-6.28
Trump’s efforts to target Obamacare are not about providing Americans better health care.,Lean Left,1,cnn,42.06,-6.28
"Where good rail links exist, long-distance travel between major cities is booming again after the Covid-19 pandemic, and for longer journeys overnight trains can offer a compelling alternative to the unpleasant experience of early morning flights.",Lean Left,0,cnn,42.06,-6.28
"The force of the explosion blows the roof and several walls apart, causing the structure to collapse.",Lean Left,0,cnn,42.06,-6.28
"There were reports of loud splashes, large dark shapes moving below the lake’s surface, even laughed-off claims of a tall dorsal fin knifing through the water.",Lean Left,0,cnn,42.06,-6.28
"At the end of the day, he went into the vault, quietly stuffed $215,000 into a paper bag and walked away from his old life.",Lean Left,1,cnn,42.06,-6.28
"The three surface combatants line up with Peralta leading and Ottawa trailing for a chance to test their big guns, five-inch weapons on the bigger Peralta and Brisbane and a 57mm-gun on Ottawa.",Lean Left,0,cnn,42.06,-6.28
"Israeli attacks in Gaza have killed about 15,200 Palestinians, including 6,000 children, since October 7, according to the Palestinian Ministry of Health in Ramallah, which draws its figures from the Hamas-controlled Ministry of Health in Gaza.",Lean Left,0,cnn,42.06,-6.28
"And that, no matter how you slice it, is good news for Democrats as the parties plot their strategies ahead of the 2024 elections.",Lean Left,1,cnn,42.06,-6.28
"President Biden has fought against the evil of Antisemitism his entire life, including by launching the first national strategy to counter this hate in American history.",Lean Left,1,cnn,42.06,-6.28
"But being in a couple, splitting rent and bills between you, can make it slightly easier.",Lean Left,1,cnn,42.06,-6.28
"The Blob generally regards Kissinger as a foreign policy guru who got the big ideas right, such as his establishing relations between the US and communist China after decades of mutual hostility.",Lean Left,0,cnn,42.06,-6.28
The academically and physically rigorous program remains competitive with a decent waitlist.,Center,0,az-central,42.22,-7.0
"Little was known about the years that followed, other than O’Connor was living in Arizona, the state she cherished.",Center,0,az-central,42.22,-7.0
"They beat a good Valor Christian in Colorado, a season after Christian McCaffrey had finished his incredible high school career.",Center,1,az-central,42.22,-7.0
