text,source_party,label,source,reliability,bias
"Others say the Jets are getting exactly what they deserve after scapegoating Wilson (again), and Wilson is right to be reluctant.",Lean Left,1,nj.com,43.92,-2.88
"BUY GIANTS TICKETS: STUBHUB, VIVID SEATS, TICKETMASTER On top of his celebrity status, DeVito’s recent performances have sparked a lifeless Giants team.",Lean Left,1,nj.com,43.92,-2.88
The Eagles gave up 314 yards and four touchdowns to 49ers quarterback Brock Purdy in their 42-19 loss on Sunday at Lincoln Financial Field.,Lean Left,0,nj.com,43.92,-2.88
"He played a strong right field with the Red Sox in 2023, flashing elite arm strength.",Lean Left,0,nj.com,43.92,-2.88
"The home has 12-inch wide plank pine floors, solid pine wood doors and a double-sided Rumford fireplace, known for having a shallow box which distributes heat more efficiently.",Lean Left,0,nj.com,43.92,-2.88
"Neptune has been dreaming in retrograde since June 30, and now the great visionary opens his eyes to a lucid and forward-thinking consciousness.",Lean Left,1,nj.com,43.92,-2.88
That shot against Freehold Township gave Rutgers Prep the juice to upset the No.,Lean Left,0,nj.com,43.92,-2.88
"After finishing boot camp, Melvin returned to East Orange and joined an Air National Guard reserve unit.",Lean Left,0,nj.com,43.92,-2.88
"In addition to tithing at church, the Tans joined the 700 Club, pledging $40 a month.",Right,0,cbn,34.17,15.24
"Great American Family has consistently been the fastest-growing channel on cable, and Abbott recently took over as head of Great American Pure Flix, the streaming platform formerly known as Pure Flix, following a highly publicized merger.",Right,0,cbn,34.17,15.24
"Harvard University has issued a statement on Wednesday in a furious attempt at damage control, after President Claudine Gay refused to condemn students calling for the genocide of Jews.",Lean Right,1,zerohedge,20.78,16.08
"Authored by Zachary Stieber via The Epoch Times (emphasis ours), A powerful Democrat is refusing to commit to issuing a subpoena for more transparent versions of Jeffrey Epstein's flight logs.",Lean Right,1,zerohedge,20.78,16.08
"She said that before the Russia-Ukraine war, Xi had wanted to invade the island within two or three years.",Lean Right,0,zerohedge,20.78,16.08
"Consider the sad tale of Maria Stengart as outlined in Stengart v. Loving Care: Before Maria Stengart resigned and sued Loving Care, her employer, she e-mailed her lawyer through her personal web-based account from her company-issued computer with Loving Care’s Internet access.",Lean Right,0,zerohedge,20.78,16.08
"A major shakeup might hit the golf world as early as next week, with reports suggesting that Tiger Woods' nearly 30-year sponsorship deal with Nike may end following the PNC Championship in Orlando, Florida.",Lean Right,0,zerohedge,20.78,16.08
"According to the Congressional Budget Office, if Trump's 2017 Tax Act provisions are extended, it would increase the deficit by $134 billion in 2026 and $346 billion in 2027.",Lean Right,0,zerohedge,20.78,16.08
"In a Tuesday court filing, New Mexico’s Attorney General’s (NMAG) Office revealed that it had conducted an undercover investigation, creating fake accounts of minors which were then used to fish for offending content, according to a press release reported by the Daily Caller.",Lean Right,0,zerohedge,20.78,16.08
"As a result, Knicks coach Tom Thibodeau has shortened his leash, reducing him to a token starter.",Center,1,heavy,43.64,-2.71
"Though T.J. Watt has 14 sacks in 12 appearances for the Pittsburgh Steelers during the 2023 NFL season, his defensive coordinator is still diving into the land of conspiracy theories-or creative explanations, depending on how you look at it-as he searches for reasons why his hyper-productive star player hasn’t been even more impactful.",Center,1,heavy,43.64,-2.71
Eric Bieniemy Has Better Shot to Land With Bears Than Jim Harbaugh Another splashy name floating around the Bears potential head coaching opening is that of Michigan’s Jim Harbaugh.,Center,0,heavy,43.64,-2.71
The belief there is at least 4 teams really in on Ertz.,Center,0,heavy,43.64,-2.71
"But on the other side of the ball, he was non-existent.",Center,1,heavy,43.64,-2.71
"Steelers supporters, for example, may remember James Harrison having similar troubles with uncalled holds on his rip-through moves.",Center,0,heavy,43.64,-2.71
He would make more sense than Jordan Poole whose gunning ways might not mesh well with LeBron James.,Center,1,heavy,43.64,-2.71
ABC6 News reported that it had also obtained the above statement from the school district.,Center,0,heavy,43.64,-2.71
"It’s still giving midlife crisis post-divorce vibes, but it’s a lot cozier in there.",Center,1,heavy,43.64,-2.71
"Naturally, the reasoning from Teryl Austin involves former NBA superstar Shaquille O’Neal and his infamous woes at the free-throw line.",Center,1,heavy,43.64,-2.71
The Houston Texans (7-5) are right on their heels in the No.,Center,0,heavy,43.64,-2.71
READ NEXT: Neighbor Accused of Burying Missing Indiana Teen in Homemade Box in Backyard.,Center,1,heavy,43.64,-2.71
Here’s what you need to know: Tom Bergeron Paid Tribute to Norman Lear on Instagram Bergeron paid tribute to Lear on Instagram with two photos of them posing together.,Center,0,heavy,43.64,-2.71
"With Darnell Mooney heading into free agency next season, current Arizona Cardinals wide receiver Marquise Brown is becoming a name to watch for the Chicago Bears.",Center,0,heavy,43.64,-2.71
"Prior to Leonard’s decision, ESPN’s Jeremy Fowler reported that belief around the league was that the Cowboys were the best fit.",Center,0,heavy,43.64,-2.71
"What do you think of that, people who use the Koran as a toilet?",Center,1,heavy,43.64,-2.71
"For so long, they have resisted including him in star trade talks.",Center,1,heavy,43.64,-2.71
"Harbaugh has a history in Chicago, the team that drafted him in 1987 and which he led to a 35-30 record as the QB across seven seasons between 1987-93.",Center,1,heavy,43.64,-2.71
The 29-year-old Stanley has faced the wrath of fans this season for what they perceive to be a lack of quickness and inability to block for Jackson.,Center,1,heavy,43.64,-2.71
"Jalen Brunson’s Response After their 146-122 blowout loss to the Bucks, Grimes ranted over his lack of touches playing in the Knicks’ starting unit with three ball-dominant players in Randle, Brunson and RJ Barrett.",Center,1,heavy,43.64,-2.71
National security adviser Jake Sullivan and other White House officials huddled with the Senate Democrats over the warning.,Center,0,baltimore-sun,44.41,-4.13
"It’s even more vital in the AL East - the sport’s best division that boasts a mega market in New York, two large markets in Boston and Toronto and a small-market juggernaut in Tampa Bay.",Center,1,baltimore-sun,44.41,-4.13
"If the Ravens have a substantial lead going into the second half and want to control the time of possession, the opposing team might see more of the 238-pound Edwards.",Center,0,baltimore-sun,44.41,-4.13
The Federal Aviation Administration can then investigate the incident and levy operators with fines and suspended pilot certifications.,Center,0,baltimore-sun,44.41,-4.13
Players can choose their favorite Mario characters and race them against friends in a multiplayer clash of zany action.,Center,0,baltimore-sun,44.41,-4.13
This air fryer is loaded with several premium smart features and is a chef’s dream come true.,Center,1,baltimore-sun,44.41,-4.13
A 17-year old was shot Monday morning when a pair of suspects broke into a...,Center,0,baltimore-sun,44.41,-4.13
"As a member of the Sayeret Matkal elite commando unit, he participated in the Entebbe raid, serving under Yoni Netanyahu, the current PM’s elder brother, who was killed on the mission.",Lean Left,0,politico,42.32,-5.58
"Like many others in the defense establishment, he frets that Israeli leaders thought they could stick Gaza in a bottle, and turn their backs on serious negotiations with the PLO-led Palestinian Authority to achieve a political resolution.",Lean Left,1,politico,42.32,-5.58
"By the eve of his selection as national security advisor, Kissinger was widely regarded as a thoughtful voice on arms policy and a skeptic on the Vietnam War.",Lean Left,0,politico,42.32,-5.58
"And everyone thought we were crazy, and we ended up crushing it.",Lean Left,1,pbs-newshour,43.07,-9.07
"Basically got his whole life taken away from him, and it was very difficult.",Lean Left,1,pbs-newshour,43.07,-9.07
"Completely... [ Indistinct conversation ] This next one's gonna be completely... -Here, guys.",Lean Left,0,pbs-newshour,43.07,-9.07
"Because -- Yes, because they were used to that kind of mind-set.",Lean Left,1,pbs-newshour,43.07,-9.07
"She said to me that first day, ""Not only do you have the power, I'm going to be right by your side.",Lean Left,0,pbs-newshour,43.07,-9.07
"And the Koch thing was interesting, that they would endorse, because -- or that he's pledged to support her, because her foreign policy is not their foreign policy.",Lean Left,1,pbs-newshour,43.07,-9.07
"Mainstream television was one of the last things to jump, and the first person to force it over that hill was Norman.",Lean Left,1,pbs-newshour,43.07,-9.07
"Britt has never been a Trump critic, but she’s also not a Trump acolyte, and she hails more from the old-guard Republican establishment.",Lean Left,0,pbs-newshour,43.07,-9.07
"So it was the start of us saying to U.S. Soccer, uh-uh, that's not good enough.",Lean Left,1,pbs-newshour,43.07,-9.07
"Every time you see a black man on the tube, he is dirt poor, wears...clothes, can't afford nothing.",Lean Left,1,pbs-newshour,43.07,-9.07
"Singapore, long seen as an education powerhouse, had the highest scores by far in every subject.",Lean Left,0,pbs-newshour,43.07,-9.07
"One Last Call Despite the excruciating wait, now more than 50 minutes from the time the shooter had fired the initial volley of shots, the children continued to follow their training.",Lean Left,0,pbs-newshour,43.07,-9.07
So those were the three things we were willing to do.,Lean Left,0,pbs-newshour,43.07,-9.07
"And she doesn't just make it, make it, she side nets it.",Lean Left,1,pbs-newshour,43.07,-9.07
"At that point, we just secured the scene and just kept him contained into what we thought at that point was that one classroom.",Lean Left,0,pbs-newshour,43.07,-9.07
"The gunman died after being confronted by officers, but the circumstances were unclear.",Lean Left,0,pbs-newshour,43.07,-9.07
Did you ever think that possibly your father just might be wrong?,Lean Left,1,pbs-newshour,43.07,-9.07
Israel has never explained how it expects that the small area would accommodate such large numbers of displaced people.,Lean Left,0,pbs-newshour,43.07,-9.07
None of us ever thought any of the situation would ever happen here.,Lean Left,0,pbs-newshour,43.07,-9.07
"And, like, especially with the team, we were all just sitting there panicking.",Lean Left,1,pbs-newshour,43.07,-9.07
"Now I'm gonna try to find a team nearby my town.""",Lean Left,0,pbs-newshour,43.07,-9.07
"And even though, like, fourth place, fifth place, we got all these different color ribbons.",Lean Left,0,pbs-newshour,43.07,-9.07
"Your father is the first guy to throw a baseball to you... and take you for walks in the park, holding you by the hand.",Lean Left,0,pbs-newshour,43.07,-9.07
"This guy has been watching FOX News regularly for years now, and he just got tired of having Democrats be on the back foot, when they have got policies, when they have got accomplishments that they should be fighting for.",Lean Left,1,pbs-newshour,43.07,-9.07
Can you imagine how many people saw this behavior from the control room and laughed it off and said nothing?,Lean Left,1,pbs-newshour,43.07,-9.07
"Or are you sad because you're married to my sister, you have a baby with Lois, oh, and you think you can keep it secret, but everybody knows?",Lean Left,1,pbs-newshour,43.07,-9.07
"In contrast, only Texas and Michigan have laws requiring training for all officers after they graduate from police academies.",Lean Left,0,pbs-newshour,43.07,-9.07
"It has been a slow, arduous... you gotta be in it for the long game.",Lean Left,0,pbs-newshour,43.07,-9.07
"And Robert Kagan gets at it in this fantastic op-ed, essay he does for The Washington Post, where he's saying that Trump dictatorship, the headline says, is inevitable.",Lean Left,1,pbs-newshour,43.07,-9.07
"Well, the one person who knows why is lying in South Manchester Cemetery, I'm afraid.",Lean Left,1,pbs-newshour,43.07,-9.07
"Motivated by this rejection, Bernice Sandler researched her rights and found what she needed -- a 1967 executive order signed by President Lyndon Johnson that barred organizations with federal contracts from discriminating on the basis of sex.",Lean Left,0,pbs-newshour,43.07,-9.07
"With them were two state troopers who were suddenly forced to act as medics, although they lacked qualifications.",Lean Left,0,pbs-newshour,43.07,-9.07
"And so, from everything from Machiavelli to Stalin to artificial intelligence, he was just insightful.",Lean Left,0,pbs-newshour,43.07,-9.07
It would be great if she could knock out Donald Trump.,Lean Left,1,pbs-newshour,43.07,-9.07
And the program practice department simply didn't want to deal with abortion.,Lean Left,1,pbs-newshour,43.07,-9.07
"Like, give us a plank-- -Then it wouldn't be as fun.",Lean Left,0,pbs-newshour,43.07,-9.07
"Its adherents include far-right extremists, some of whom have committed violent acts.",Lean Left,1,pbs-newshour,43.07,-9.07
That is the most ridiculous thing I've ever heard in my life.,Lean Left,1,pbs-newshour,43.07,-9.07
"There is something that has seemingly made the task of honestly covering Trump less daunting this time around: Trump, his campaign and his operatives have been more than willing to plainly state his plans for a second term.",Left,1,msnbc,34.51,-14.03
Cheney talks with Rachel Maddow about her reaction when she realized what was about to happen.,Left,0,msnbc,34.51,-14.03
"If this deal follows other cases of corporate concentration, it will likely be bad for workers, bad for franchise owners, bad for food suppliers and bad for your wallet.",Left,1,msnbc,34.51,-14.03
Ron DeSantis has shown he is dead-set on inflicting harm on the state’s Black and LGBTQ+ communities.,Left,1,msnbc,34.51,-14.03
And he has since allegedly returned to some of his old ways.,Left,1,msnbc,34.51,-14.03
Do you really expect to get paid when he doesn't have ten bucks to his name?,Left,1,the-young-turks,25.16,-24.96
"Koch Industries is also a corporate backer of the American Legislative Exchange Council (ALEC), which fights gun control by drafting and disseminating to friendly lawmakers legislative language for loosening gun laws.",Left,1,the-young-turks,25.16,-24.96
"And the protest that prompted the expulsion came in the wake of yet another mass shooting, as well as years of Tennessee Republicans loosening gun laws.",Left,1,the-young-turks,25.16,-24.96
"Ron DeSantis (R., Fla.) and entrepreneur Vivek Ramaswamy hurled insults at former South Carolina Gov.",Center,1,marketwatch,40.93,-3.88
"If you’re thinking about making a gift of stock you already own, like employer stock or other stock in your portfolio, Kopelman advises against transferring it to a child.",Center,0,marketwatch,40.93,-3.88
"Beyond Swift, Americans just kept spending this year, despite early predictions of doom and gloom for the economy as interest rates surged and despite warnings by experts that the U.S. would tip into a recession by the summer.",Center,1,marketwatch,40.93,-3.88
"Still, in search of a healthier diet that will prolong your life, you will be bombarded by a bevy of diet programs and highly promoted plans.",Center,0,marketwatch,40.93,-3.88
"Not that Lee’s royalty earnings this year may be anything to sneeze at - certainly, $250,000 is not a bad payday.",Center,1,marketwatch,40.93,-3.88
"He is a master manipulator, whether or not he recognizes it in himself and whether or not he has malicious intent, so your mother needs to see her assets in their entirety and an illustration of what percentage has been given and now spent.",Center,1,marketwatch,40.93,-3.88
Going off on a toot about defined-benefit plans is simply a diversion.,Center,1,marketwatch,40.93,-3.88
"There are several reasons: The money he has been given is now gone, so there is no point in throwing good money after bad; enabling your brother by giving him preferential treatment has only led to more requests; and it’s fair and equitable to treat these gifts as inheritance.",Center,1,marketwatch,40.93,-3.88
Others develop the assets and they take a cut of the sales.,Center,0,marketwatch,40.93,-3.88
The royal claims that he has been unfairly treated and was unaware at the time that the royal household was also involved in making the decision.,Lean Left,1,vanity-fair,33.19,-13.87
But not quite yet; the first half of this year is already spoken for.,Lean Left,0,vanity-fair,33.19,-13.87
"We all walked away and we felt like, okay, he's definitely a juror.",Lean Left,0,vanity-fair,33.19,-13.87
My tongue is being pushed to the bottom of my mouth.,Lean Left,0,vanity-fair,33.19,-13.87
"The admiral, he's sitting there in an easy chair in front of a bay window, somehow directing the fight.",Lean Left,1,vanity-fair,33.19,-13.87
"On one occasion he flew to meet her in Montreal, where he arranged a suite for her at the Ritz-Carlton.",Lean Left,0,vanity-fair,33.19,-13.87
"Her beauty is quiet and versatile; sitting in a corner, wearing no discernible makeup and clad in a caramel-colored pashmina and old olive-green jeans that match her eyes, she is quite inconspicuous.",Lean Left,1,vanity-fair,33.19,-13.87
"And then halfway through the day, we brought in Emma who plays Enid.",Lean Left,0,vanity-fair,33.19,-13.87
"Sure, there’s the occasional red carpet event (for example, the London premiere of Renaissance: A Film By Beyoncé), as well as whatever role she plays in the war between her publicist and anonymous Instagram account Deuxmoi over Swift’s past relationships, but how much time does stuff like that kill?",Lean Left,0,vanity-fair,33.19,-13.87
"Though these sorts of movies aren’t currently clogging theaters, they were a full-blown film fad about a decade ago: The year 2012 brought the first of four successful Hunger Games films led by Jennifer Lawrence, which ushered in three less profitable Divergent movies starring Shailene Woodley.",Lean Left,1,vanity-fair,33.19,-13.87
"The Gohars like to throw impromptu dinner parties on city sidewalks, highlighting everyday foods like beans or tomatoes; Palm Heights takes it to the sand, lobster pasta under an orange sky.",Lean Left,0,vanity-fair,33.19,-13.87
"But also because we're in Atlanta, you know, we had to sort of fake locations.",Lean Left,0,vanity-fair,33.19,-13.87
Was there ever a video message from us that you pretended not to get?,Lean Left,0,vanity-fair,33.19,-13.87
"Hi, my name is Barrie Gower, and I'm gonna break down how we designed and created the infected for The Last of Us.",Lean Left,0,vanity-fair,33.19,-13.87
"Dan Laustsen, my cinematographer, brilliant, brilliant, brilliant shaper of light, especially with color.",Lean Left,1,vanity-fair,33.19,-13.87
"Pat, our DP, does this brilliant job of actually getting that real sense of directional light come in.",Lean Left,0,vanity-fair,33.19,-13.87
Just like very intense and then go home and all hang out together.,Lean Left,0,vanity-fair,33.19,-13.87
Do you think you have more riz than the two of us?,Lean Left,0,vanity-fair,33.19,-13.87
"We believe that the people of this charming ecosystem, so lovingly crafted, would respond exactly that way.",Lean Left,1,vanity-fair,33.19,-13.87
"It could be easy to make her not an addict and all these different things to clean it all up and homogenize it, but I'm not really interested in that.",Lean Left,1,vanity-fair,33.19,-13.87
"How come nobody on the American team, not one, speaks a word of Russian?",Lean Left,1,vanity-fair,33.19,-13.87
And a big thing with John Wick is we always call it neon noir.,Lean Left,0,vanity-fair,33.19,-13.87
"Because cash-out refinances are riskier for lenders, companies usually set stricter eligibility requirements.",Lean Left,0,business-insider,40.58,-4.19
"For anyone who is interested in applying for the scheme, but is unsure if they are eligible or their circumstances make it challenging to access, please contact brc .nhs.uk to discuss.",Center,0,nature,46.33,-1.48
"This will enable fellows protected time to concentrate on research, training and development The cost of tuition fees based on the UK (Home) rate PhD tuition fees for three years full time.",Center,0,nature,46.33,-1.48
She should be more careful what she says about someone so powerful.,Lean Left,1,mediaite,37.25,-8.64
"After a preamble noting Trump’s gargantuan lead over the entire field, Kelly zeroed in on DeSantis with a lengthy question essentially asking if it was time to pack it in.",Lean Left,1,mediaite,37.25,-8.64
"They started Race to Dinner to challenge liberal white women to accept their racism, however subconscious.",Lean Left,1,mediaite,37.25,-8.64
Why couldn’t the president of Harvard say this on camera in front of Congress yesterday?,Lean Left,1,mediaite,37.25,-8.64
‘HELL NO!’ Marjorie Taylor Greene Explodes at Speaker Mike Johnson for Cutting Deal to Fund ‘Abortion Vacations’,Lean Left,1,mediaite,37.25,-8.64
Tarlov spoke after Watters tore into Biden and accused him of lying about not being involved in shady business deals with his son Hunter.,Lean Left,1,mediaite,37.25,-8.64
"White nonsense, white violence, white love of Black and brown genocide.",Lean Left,1,mediaite,37.25,-8.64
We have committed ourselves to public service while he’s been off stealing from seniors to make his fortune.,Lean Left,1,mediaite,37.25,-8.64
"As Mr. Delancey was walking up the stairs to the rooftop deck, Wells aggressively grabbed Mr. Delancey from behind, catching Mr. Delancey off guard.",Lean Left,0,mediaite,37.25,-8.64
Ron DeSantis (R-FL) with an absolutely brutal opening question about how he’s spent a ton of money but is still getting clobbered by ex-President Donald Trump.,Lean Left,1,mediaite,37.25,-8.64
"The only person more fascist than the Biden regime now is Nikki Haley, who thinks the government should identify every one of those individuals with an ID.",Lean Left,1,mediaite,37.25,-8.64
The one place that didn’t crash and burn was in the state of Florida.,Lean Left,1,mediaite,37.25,-8.64
"He’s talked to six teams... What is this, the atomic bomb?",Lean Left,1,mediaite,37.25,-8.64
"Ramaswamy took a hard beating at Christie’s hands, but tried his best to dish out the insults to Haley - a tactic that backfired.",Lean Left,1,mediaite,37.25,-8.64
The two proceeded to talk over each other while the moderators scolded them and tried to get the conversation back under control.,Lean Left,0,mediaite,37.25,-8.64
Anti-Racism Activist Saira Rao Gets Swift Takedown After Attacking TIME’s ‘White Nonsense’,Lean Left,0,mediaite,37.25,-8.64
It’s all symbolic of a winner-take-all system that exists in the real world.,Left,1,the-rachel-maddow-show,36.71,-17.67
Time will tell if Haley is truly willing to do what it takes to defeat an opponent who knows no boundaries and will do whatever it takes to win.,Left,1,the-rachel-maddow-show,36.71,-17.67
"Netflix If anything, this show is unwittingly making a commentary on the brutalization of society, or the theory that legitimized violence begets more violence.",Left,1,the-rachel-maddow-show,36.71,-17.67
"Placing it in the real world, however, only seems to normalize, encourage and even celebrate the worst facets of our economic and political systems.",Left,1,the-rachel-maddow-show,36.71,-17.67
"But as the former House speaker prepares to walk away from Capitol Hill altogether, it’s also worth appreciating just how badly the last year has gone for the longtime Republican congressman.",Left,1,the-rachel-maddow-show,36.71,-17.67
"In this case, as contestants longingly look up at a real-life version of the piggy bank and connive to get one another eliminated, we are immersed in the sad reality of the dehumanizing system we’ve created.",Left,1,the-rachel-maddow-show,36.71,-17.67
"While both authors make clear their own feminist principles, they refuse to ignore the ways that cultural and economic trends are converging to create a crisis for working-class men, which they posit is everyone’s problem.",Left,0,jacobin,31.69,-21.47
"Last Wednesday, the union went public with a campaign to organize workers at thirteen automakers: BMW, Honda, Hyundai, Lucid, Mazda, Mercedes, Nissan, Rivian, Subaru, Tesla, Toyota, Volkswagen, and Volvo.",Left,0,jacobin,31.69,-21.47
"She is the It girl, the queen of self-affirmations and manifesting, a bastion of aplomb.",Left,1,teen-vogue,37.79,-15.5
"Wear-everywhere shoes No matter where they're headed, comfy footwear is a must for frequent travelers.",Left,0,teen-vogue,37.79,-15.5
And how do you determine if someone is your moon phase soulmate?,Left,0,teen-vogue,37.79,-15.5
"Five years ago, Kylie Jenner and Jordyn Woods went through what has been probably the most public friendship breakup celebrity-dom has witnessed in decades.",Left,1,teen-vogue,37.79,-15.5
"Hale proved phenomenally good at her job, and through Godey’s, she dominated the American periodical landscape during the 19th century.",Left,0,teen-vogue,37.79,-15.5
"It's as light as a phone, but super powerful, spinning off into the sky in a matter of seconds to snap photos with its 720P HD Wi-Fi camera.",Left,0,teen-vogue,37.79,-15.5
