text,source_party,label,source,reliability,bias
The infinitesimal size of nanoplastics is partly why scientists know little about them.,Left,0,vice,38.96,-9.39
"Peter Smith, a researcher and journalist for the Canadian Anti-Hate Network , has studied Active Clubs since they began to pop up in Canada.",Left,0,vice,38.96,-9.39
"Once airborne, they can float for thousands of kilometers, as far as the Earth’s poles The infinitesimal size of nanoplastics is partly why scientists know little about them.",Left,0,vice,38.96,-9.39
"ABSTRACT breaks down mind-bending scientific research, future tech, new discoveries, and major breakthroughs.",Left,0,vice,38.96,-9.39
"But now, a much smaller, potentially much more nefarious, and less understood threat is drawing scientist’s attention-nanoplastics.",Left,1,vice,38.96,-9.39
The town’s animal control officer is working closely with Princeton University to capture the raccoon.,Lean Left,0,nj.com,43.92,-2.88
"It’s also possible that the Yankees flip Verdugo in a package for Soto, giving the Padres an immediate replacement in their outfield.",Lean Left,0,nj.com,43.92,-2.88
The Eagles gave up 314 yards and four touchdowns to 49ers quarterback Brock Purdy in their 42-19 loss on Sunday at Lincoln Financial Field.,Lean Left,0,nj.com,43.92,-2.88
"The usual problem-solving techniques won’t work, which is a blessing and an invitation.",Lean Left,0,nj.com,43.92,-2.88
So flip a coin: Soto solves so many problems for manager Aaron Boone’s anemic lineup.,Lean Left,1,nj.com,43.92,-2.88
"Neptune has been dreaming in retrograde since June 30, and now the great visionary opens his eyes to a lucid and forward-thinking consciousness.",Lean Left,1,nj.com,43.92,-2.88
"And while Brick Memorial showcased some new faces in this match, others could take over down the line.",Lean Left,0,nj.com,43.92,-2.88
The Pirates (5-3) have now lost 3-of-4 since a 4-0 start.,Lean Left,0,nj.com,43.92,-2.88
"BUY GIANTS TICKETS: STUBHUB, VIVID SEATS, TICKETMASTER On top of his celebrity status, DeVito’s recent performances have sparked a lifeless Giants team.",Lean Left,1,nj.com,43.92,-2.88
"Maple Shade in Burlington County, where Councilman Nelson Wiest received coverage worth more than $28,000 this year, though he was seated in 2013.",Lean Left,0,nj.com,43.92,-2.88
"Others say the Jets are getting exactly what they deserve after scapegoating Wilson (again), and Wilson is right to be reluctant.",Lean Left,1,nj.com,43.92,-2.88
"She earned her associate degree from Thomas Edison, a bachelor’s degree from Rutgers School of Management and Labor Relations and started law school at Washington University School in St. Louis.",Lean Left,0,nj.com,43.92,-2.88
"Once you are in God's presence, you can now discover His battle plan for the situation you are facing.",Right,1,cbn,34.17,15.24
"No one-for Christ Jesus died for us and was raised to life for us, and he is sitting in the place of honor at God's right hand, pleading for us.",Right,1,cbn,34.17,15.24
"But Jerusalem, this tiny little city, in this tiny sliver of land, will play a key role in the events of the last days.",Right,1,cbn,34.17,15.24
"Yet, the shift to helping patients with mental health problems was attractive to him.",Right,0,cbn,34.17,15.24
We want to pray that they arrive at some kind of peace.,Right,0,cbn,34.17,15.24
"And having called them, he gave them right standing with himself.",Right,0,cbn,34.17,15.24
We will continue the war until we achieve all its goals and it's impossible to achieve those goals without the ground operation.,Right,1,cbn,34.17,15.24
"Israel came up with a solution, publishing an online map to facilitate evacuations where Hamas is illegally operating in civilian areas.",Right,1,cbn,34.17,15.24
Because prayer alone is not enough -- you need a target for your prayers!,Right,1,cbn,34.17,15.24
"Share your food with the hungry, and give shelter to the homeless.Give clothes to those who need them, and do not hide from relatives who need your help.",Right,0,cbn,34.17,15.24
She became a chain smoker as she realized that the nicotine calmed her down more than her medication.,Right,0,cbn,34.17,15.24
"The series has been a worldwide phenomenon, and this week the cast made their way to the Capitol to help mark the start of the Christmas season.",Right,0,cbn,34.17,15.24
"In a Tuesday court filing, New Mexico’s Attorney General’s (NMAG) Office revealed that it had conducted an undercover investigation, creating fake accounts of minors which were then used to fish for offending content, according to a press release reported by the Daily Caller.",Lean Right,0,zerohedge,20.78,16.08
"But the reality is that Ukrainian forces were already losing the war, given top US officials have long acknowledged the counteroffensive has stalled and failed, even with all the weapons the US has already poured in.",Lean Right,1,zerohedge,20.78,16.08
We should get real answers on what happened to Jeffrey Epstein and any of the high-level political people that he was involved with.,Lean Right,1,zerohedge,20.78,16.08
"She's fed up with semiconductor firms whining: ""newsflash: democracy is good for your business.",Lean Right,1,zerohedge,20.78,16.08
The entire thing (besides being written to target the intellectual level of a 10-year-old) reads as activist Marxist action points.,Lean Right,1,zerohedge,20.78,16.08
"During a recent city council meeting, a deputy city attorney said city leaders are reviewing advertising policies.",Lean Right,0,zerohedge,20.78,16.08
"By Ye Xie, Bloomberg Markets Live reporter and strategist While stocks in India make new all-time highs, investors in Chinese stocks are staring down a dismal year of losses.",Lean Right,1,zerohedge,20.78,16.08
"Trump is currently smoking the entire GOP lineup, and has recently overtaken President Biden in hypothetical match-ups.",Lean Right,1,zerohedge,20.78,16.08
The submission process is merely designed to give a facade of plausibility to the decisions already made.,Lean Right,1,zerohedge,20.78,16.08
"This is before they pay for their car licence fee to the parasitic class, or the $0.89c per litre tax on fuel when they fill their car up.",Lean Right,1,zerohedge,20.78,16.08
He was not told which part of the 10-second spot violated the policy.,Lean Right,0,zerohedge,20.78,16.08
To be clear a war between two nuclear powers is guaranteed to end with nuclear war.,Lean Right,1,zerohedge,20.78,16.08
The Gamble of Signing Evans Did Not Pay Off The team had been pretty quiet when it came to the topic of Evans’ practice reps.,Center,0,heavy,43.64,-2.71
"Naturally, the reasoning from Teryl Austin involves former NBA superstar Shaquille O’Neal and his infamous woes at the free-throw line.",Center,1,heavy,43.64,-2.71
"Jalen Brunson’s Response After their 146-122 blowout loss to the Bucks, Grimes ranted over his lack of touches playing in the Knicks’ starting unit with three ball-dominant players in Randle, Brunson and RJ Barrett.",Center,1,heavy,43.64,-2.71
The Houston Texans (7-5) are right on their heels in the No.,Center,0,heavy,43.64,-2.71
"It was a blunt take from Brady, especially since some felt he may have benefited from protection at times during his illustrious career.",Center,1,heavy,43.64,-2.71
"That’s why you’re selling food in a food cart, because you’re ignorant, but you should learn English.",Center,1,heavy,43.64,-2.71
"All three were heavy hitters, although the mention of Lott was strange since Brady didn’t play in the same era.",Center,1,heavy,43.64,-2.71
"It’s still giving midlife crisis post-divorce vibes, but it’s a lot cozier in there.",Center,1,heavy,43.64,-2.71
"Steelers supporters, for example, may remember James Harrison having similar troubles with uncalled holds on his rip-through moves.",Center,0,heavy,43.64,-2.71
The 29-year-old Stanley has faced the wrath of fans this season for what they perceive to be a lack of quickness and inability to block for Jackson.,Center,1,heavy,43.64,-2.71
The belief there is at least 4 teams really in on Ertz.,Center,0,heavy,43.64,-2.71
"Though T.J. Watt has 14 sacks in 12 appearances for the Pittsburgh Steelers during the 2023 NFL season, his defensive coordinator is still diving into the land of conspiracy theories-or creative explanations, depending on how you look at it-as he searches for reasons why his hyper-productive star player hasn’t been even more impactful.",Center,1,heavy,43.64,-2.71
"They also stand out for providing long burn times, as some models can provide more than 150 hours of luscious scents.",Center,0,baltimore-sun,44.41,-4.13
It probably helped that the name didn’t include an apostrophe (i.e.,Center,1,baltimore-sun,44.41,-4.13
"Meanwhile, Holliday, who was 18 when the Orioles selected him last July, did so in his first full professional campaign.",Center,0,baltimore-sun,44.41,-4.13
"Sapraicone, who is also the founder of a private security company, said he has been interviewed by county Republicans who will select the nominee, with the panel quizzing him on his political stances, his ability to fundraise and quickly launch a campaign.",Center,0,baltimore-sun,44.41,-4.13
"Until recently, we had no legal recourse to hold Key School accountable for its complicit violation, compounding our sexual abuse and institutional betrayal with judicial betrayal.",Center,1,baltimore-sun,44.41,-4.13
But just the fact that Democratic lawmakers are making that link signals the fractures in Congress amid the daily scenes of suffering among besieged Palestinian civilians.,Center,1,baltimore-sun,44.41,-4.13
It is held in place on the table through 3M adhesive tape.,Center,0,baltimore-sun,44.41,-4.13
"On Monday, at his State of the County address, Pittman noted housing is the top issue his administration hopes to tackle in the upcoming year.",Center,0,baltimore-sun,44.41,-4.13
"The Ravens have outplayed their rival by a healthy margin, but they blundered their way to an ugly loss in Pittsburgh, and the Steelers, despite losing to the lowly Cardinals on Sunday, will benefit from a far easier schedule over the next month.",Center,1,baltimore-sun,44.41,-4.13
"Many of its 2.3 million people are crammed into the south after Israel ordered civilians to leave the north in the early days of the war, which was sparked by the Oct. 7 Hamas-led attack in Israel that killed about 1,200 people, mostly civilians.",Center,0,baltimore-sun,44.41,-4.13
"Associated Press reporters contributing to this report were: Ben Finley, from Norfolk, Va., Michael Kunzelman, from Silver Spring, Md., and Darlene Superville, from Air Force One.",Center,0,baltimore-sun,44.41,-4.13
Players can choose their favorite Mario characters and race them against friends in a multiplayer clash of zany action.,Center,0,baltimore-sun,44.41,-4.13
"Compounding matters, in 2020 President Trump and many of his allies actually campaigned against voting by the new mail-in balloting - casting doubt on the integrity of the process.",Lean Left,1,politico,42.32,-5.58
The College Board also prods teachers and students to spend a week discussing some of today’s most hotly-debated topics.,Lean Left,0,politico,42.32,-5.58
And Trump - who refused to participate in the process - is still running far ahead.,Lean Left,1,politico,42.32,-5.58
Johnson was given his first chance to respond publicly to a series of (already revealed) fruity WhatsApps from Dominic Cummings and other officials slagging him and his ministers - he argued that it was all helpful and that officials in Margaret Thatcher’s government probably swore too.,Lean Left,1,politico,42.32,-5.58
"If congressional leaders shelve Ukraine aid until January, a new aid package could become wrapped up in a government funding fight that is set to kick off in the new year.",Lean Left,0,politico,42.32,-5.58
The country has rifled through public relations firms to burnish its image for a Western audience.,Lean Left,1,politico,42.32,-5.58
But there’s also the darker side of Kissinger’s years in power.,Lean Left,1,politico,42.32,-5.58
And the weaponization of death tolls only exposes and deepens existing divisions rather than change minds or help resolve conflicts.,Lean Left,1,politico,42.32,-5.58
"Ironically, his critics tended to let him off the hook for what was obviously his worst crime: his involvement in Watergate.",Lean Left,1,politico,42.32,-5.58
"According to May’s successor Boris Johnson, net zero was good for the planet, good for voters, good for the economy.",Lean Left,0,politico,42.32,-5.58
"Still, the strategy is proving uncomfortable for some of Kerry’s allies in the climate movement - even those who say they understand the logic.",Lean Left,1,politico,42.32,-5.58
"He worked all over Central and South America, all places that the Cubans care a lot about, like Mexico City.",Lean Left,1,politico,42.32,-5.58
"Motivated by this rejection, Bernice Sandler researched her rights and found what she needed -- a 1967 executive order signed by President Lyndon Johnson that barred organizations with federal contracts from discriminating on the basis of sex.",Lean Left,0,pbs-newshour,43.07,-9.07
"And it takes more than 10 or 11 times to get that good at something like this that is going to be incredibly difficult to do when you know that, ‘I’m about to die, but I’m going to do this anyway.’ Who thinks like that?",Lean Left,1,pbs-newshour,43.07,-9.07
"One Last Call Despite the excruciating wait, now more than 50 minutes from the time the shooter had fired the initial volley of shots, the children continued to follow their training.",Lean Left,0,pbs-newshour,43.07,-9.07
"Completely... [ Indistinct conversation ] This next one's gonna be completely... -Here, guys.",Lean Left,0,pbs-newshour,43.07,-9.07
He became the first purely American response to an un-American strain of bigotry.,Lean Left,1,pbs-newshour,43.07,-9.07
"This guy has been watching FOX News regularly for years now, and he just got tired of having Democrats be on the back foot, when they have got policies, when they have got accomplishments that they should be fighting for.",Lean Left,1,pbs-newshour,43.07,-9.07
"Like, give us a plank-- -Then it wouldn't be as fun.",Lean Left,0,pbs-newshour,43.07,-9.07
"And, like, especially with the team, we were all just sitting there panicking.",Lean Left,1,pbs-newshour,43.07,-9.07
Israel has never explained how it expects that the small area would accommodate such large numbers of displaced people.,Lean Left,0,pbs-newshour,43.07,-9.07
"And Robert Kagan gets at it in this fantastic op-ed, essay he does for The Washington Post, where he's saying that Trump dictatorship, the headline says, is inevitable.",Lean Left,1,pbs-newshour,43.07,-9.07
"Basically got his whole life taken away from him, and it was very difficult.",Lean Left,1,pbs-newshour,43.07,-9.07
"We've gone from straight comedy into something else, and that other thing is satire.",Lean Left,1,pbs-newshour,43.07,-9.07
Corporate America and their cheerleaders aren’t happy about all these efforts.,Left,1,msnbc,34.51,-14.03
Democratic-aligned senators introduced legislation Tuesday that would largely ban the use of solitary confinement in federal institutions and give states and local jurisdictions incentives to do the same.,Left,0,msnbc,34.51,-14.03
He’s prone to blurting out whatever the thrust of his machinations is at any given moment and letting it get lost in the firehose of words that are constantly flowing out of his mouth.,Left,1,msnbc,34.51,-14.03
"It’s hard not to wonder whether President Joe Biden is a little jealous: He was vice president for eight years, and in that time, he didn’t break any ties at all.",Left,1,msnbc,34.51,-14.03
"The Senate legislation is being introduced by Elizabeth Warren and Ed Markey, both D-Mass.",Left,0,msnbc,34.51,-14.03
"They’re trying to help us through the worst news that we’ve ever received, and she can’t say anything.",Left,1,msnbc,34.51,-14.03
His absence of a filter leads to another major issue in covering Trump: his penchant for blatantly but unconvincingly lying like a child whenever he’s confronted with his past statements.,Left,1,msnbc,34.51,-14.03
"The teenager was arrested and charged as an adult with armed carjacking with a gun in the robbery on Nov. 29, police said Tuesday.",Left,0,msnbc,34.51,-14.03
And he has since allegedly returned to some of his old ways.,Left,1,msnbc,34.51,-14.03
"Of course, there are still blind spots that media organizations need to address.",Left,0,msnbc,34.51,-14.03
"This entire cycle - the petty vindictiveness as governor, the collapse of the tough-talking straight shooter candidate into craven sidekick, and the subsequent failure to reap any political reward for his debasement - is remarkable mainly because Christie never felt the need to act chagrined about any of it.",Left,1,msnbc,34.51,-14.03
Finding a good work-life mix can be particularly challenging for ambitious and accomplished people in the workforce - and those who shame co-workers for using Paid Time Off (PTO) don’t make it any easier!,Left,1,msnbc,34.51,-14.03
"In addition to its history bolstering anti-LGBTQ+ networks in Africa, The Family used the National Prayer Breakfast to build right-wing networks in Ukraine and Guatemala, TYT has reported.",Left,1,the-young-turks,25.16,-24.96
Its filibustering was quickly followed by a decision to launch on YouTube.,Left,0,the-young-turks,25.16,-24.96
"DNC Delegate Jeri Shepherd told TYT that on Thursday, the deadline, she submitted a resolution against dark money for consideration during the committee’s bi-annual meeting next month.",Left,0,the-young-turks,25.16,-24.96
Singer Susan Boyle is set to perform Wednesday at an annual prayer breakfast that is run almost entirely by opponents of LGBTQ+ and reproductive rights.,Left,1,the-young-turks,25.16,-24.96
The party’s leadership is increasingly seen as disconnected from the rank and file.,Left,1,the-young-turks,25.16,-24.96
"In 2014, after The Family first started supplying American politicians for Espina to showcase at his prayer breakfast spinoff, Torres was one of the earliest Guatemalan elites to start attending.",Left,0,the-young-turks,25.16,-24.96
"And the protest that prompted the expulsion came in the wake of yet another mass shooting, as well as years of Tennessee Republicans loosening gun laws.",Left,1,the-young-turks,25.16,-24.96
Fox Odoi-Oywelowo... because he said that the police sometimes arrest people because of appearance.,Left,1,the-young-turks,25.16,-24.96
"While the changes in the proposed amendment, if adopted in the future, wouldn’t take effect until 2028, there’s speculation that Swecker may be trying to implement rules changes before a successor steps in, which could be as soon as 2026 when the SCC reorganizes.",Left,0,the-young-turks,25.16,-24.96
Odoi-Oywelowo also draws a distinction between Museveni and the first lady.,Left,0,the-young-turks,25.16,-24.96
"Although the amendment would reduce the number of people voting for DNC members, Raman argued that it will remedy what he described as inequitable representation during the state convention.",Left,0,the-young-turks,25.16,-24.96
"Not shy of self-promotion, Uygur, a fixture on TV in the US, says: ""We are a rare online show that is profitable and expanding.",Left,1,the-young-turks,25.16,-24.96
"Whether he can keep the lid on Pandora’s Box or not depends on many factors, but he and the company he leads are clearly driving a new tech movement that affects us all, whether we like it or not.",Center,1,marketwatch,40.93,-3.88
"But his presence was still felt, especially on the heels of his Fox News interview with Sean Hannity the night before, where he refused to rule out abusing power or seeking retribution if he gets re-elected.",Center,1,marketwatch,40.93,-3.88
"According to advocates and lawsuits, borrowers struggled to access this relief in part because servicers steered struggling borrowers towards forbearance, a status where student-loan payments are paused, but where borrowers don’t build credit towards debt cancellation.",Center,0,marketwatch,40.93,-3.88
Altman is at the center of it and leading the charge.,Center,0,marketwatch,40.93,-3.88
"There are several reasons: The money he has been given is now gone, so there is no point in throwing good money after bad; enabling your brother by giving him preferential treatment has only led to more requests; and it’s fair and equitable to treat these gifts as inheritance.",Center,1,marketwatch,40.93,-3.88
"In the meantime, he has taken advantage of our mother’s sympathy and financial resources.",Center,1,marketwatch,40.93,-3.88
The money illusion Hunter’s thinking connects back to economic theory first posed in the early 20th century that states that most people don’t take into account the effects of inflation when evaluating their own wealth.,Center,0,marketwatch,40.93,-3.88
"The board seemingly wanted more guardrails and precautions, and feared that rushed development could irrevocably doom mankind.",Center,1,marketwatch,40.93,-3.88
"GameStop shares, which have enjoyed a recent meme-like rally, are down 19.6% in 2023, compared with the S&P 500 index’s SPX gain of 18.5%.",Center,0,marketwatch,40.93,-3.88
"Whatever you decide, now would be a good time to boost those other assets.",Center,1,marketwatch,40.93,-3.88
"The measure was approved 221-197 and now goes to the Senate, where it is unlikely to advance.",Center,0,marketwatch,40.93,-3.88
A separate 2024 housing forecast by Realtor.com predicted that mortgage rates will drop to 6.5% by the end of 2024.,Center,0,marketwatch,40.93,-3.88
"Because it starts off with a, on a bad note, an English guy is coming and insulting them, humiliating them.",Lean Left,1,vanity-fair,33.19,-13.87
"And, you know, and again, you know, my whole kind of ethos of let's be sadistic with the camera and get it right in there.",Lean Left,1,vanity-fair,33.19,-13.87
"She’s an orphan, a woman with no family who’s comfortable only in an institutionalized environment.",Lean Left,1,vanity-fair,33.19,-13.87
"The orchard walls are high and hard to climb, and the place death, considering who thou art, if any of my kinsmen find thee here.",Lean Left,0,vanity-fair,33.19,-13.87
"And, like, what Donald does in just doing that with Teddy is so startling, uncomfortable, feels important, feels like a certain kind of reclaiming, but also not in a way that's empowering and, like, seeing someone who was so in the limelight and clearly that started to create harm to him, and how race is a part of that, but maybe not really talked about.",Lean Left,1,vanity-fair,33.19,-13.87
"Though these sorts of movies aren’t currently clogging theaters, they were a full-blown film fad about a decade ago: The year 2012 brought the first of four successful Hunger Games films led by Jennifer Lawrence, which ushered in three less profitable Divergent movies starring Shailene Woodley.",Lean Left,1,vanity-fair,33.19,-13.87
"For his part, Travis appears to be winning Scott Swift over in kind: According to Travis, he’s working on luring Scott into Chiefs fandom after a lifelong devotion to the Eagles, to Jason Kelce’s horror.",Lean Left,1,vanity-fair,33.19,-13.87
"And so with all these forces that were at play during the Cold War, it was great for me to have held this position of kind of a righteous indignation with what all these liberal geniuses were up to.",Lean Left,1,vanity-fair,33.19,-13.87
Our friend Kris Navako was on stage with us and he was puking the whole time.,Lean Left,0,vanity-fair,33.19,-13.87
"The cast-Justice Smith,Briana Middleton,Sebastian Stan, and a fabulously shifty Julianne Moore-perfectly balance the sexy and the sinister, tearing into a clever script with panache.",Lean Left,1,vanity-fair,33.19,-13.87
"A brutal candy consortium led by Arthur Slugworth (Paterson Joseph) sees Wonka’s wondrous confections-they make you float, they regrow the hair of bald men-as an existential threat.",Lean Left,1,vanity-fair,33.19,-13.87
"Like most of these films, Ender’s Game managed to wrangle some top-tier talent-in this instance, Harrison Ford, Viola Davis, and Ben Kingsley-but then, like too many of these films, subsequently puts them to waste.",Lean Left,1,vanity-fair,33.19,-13.87
"LLMs basically regurgitate what worked before - something the low performers can learn a lot from, but stuff the high performers already know.",Lean Left,1,business-insider,40.58,-4.19
Much of that decision depends on your own unique personal and financial situation.,Lean Left,0,business-insider,40.58,-4.19
"The broker and lawyers for the AG had met in July, during a pre-trial deposition.",Lean Left,0,business-insider,40.58,-4.19
They're pretty enough to put on display at a holiday party and scrumptious enough to have come from an upscale confectionery shop.,Lean Left,0,business-insider,40.58,-4.19
"On the heels of his high-profile divorce announcement, Bezos went on a $45 million homebuying bonanza - snatching up not one, not two, but four previously unreported properties in the ultra-exclusive Hunts Point enclave.",Lean Left,1,business-insider,40.58,-4.19
"Because cash-out refinances are riskier for lenders, companies usually set stricter eligibility requirements.",Lean Left,0,business-insider,40.58,-4.19
"Your credit score, income, and other debt are all part of the formula used to determine your mortgage interest rate.",Lean Left,0,business-insider,40.58,-4.19
The author and her husband used their hotel room's private plunge pool when their daughter slept.,Lean Left,0,business-insider,40.58,-4.19
The billionaire founder contributed $10 billion in 2020 to his Bezos Earth Fund to tackle climate change.,Lean Left,0,business-insider,40.58,-4.19
Fudd was overwhelmed by the generousness and professionalism with which she and the fellow invitees were treated.,Lean Left,0,business-insider,40.58,-4.19
