text,source_party,label,source,reliability,bias
"What Timesian means or doesn’t mean often depends on who’s defining it, but it’s typically in the same general neighborhood as authoritative, or maybe stuffy.",Center,1,wired,36.77,-7.24
To live in London in 2023 is to be perpetually engulfed in a cloud of cloyingly sweet vapor.,Center,1,wired,36.77,-7.24
"For the baby scratch, My fader stays open and my hand stays on the platter.",Center,0,wired,36.77,-7.24
Like why does Apple or Google or anyone else bother alphabetizing your contacts?,Center,0,wired,36.77,-7.24
"If Mrs. Maisel is anything to go by, the answer is to head to a dingy watering hole in your nightgown, do a little standup comedy, and get hauled away by the police after flashing the entire audience.",Center,1,wired,36.77,-7.24
Our eyes need to be lubricated for us to see clearly through.,Center,0,wired,36.77,-7.24
"These vitamins that are recommended are really important in the metabolic pathway of the cells that are in your retina, which is that vision sensory organ of the inside of the eye.",Center,0,wired,36.77,-7.24
"Lengthy commitment periods, like the three or more years specified in the contracts reviewed by Quartz and Type Investigations, undermine the free movement of labor and deny workers one of their strongest bargaining chips: the ability to quit their jobs if the conditions of employment don’t suit them.",Center,1,quartz,43.87,-4.77
"On the WhatsApp group, they send us threats and blackmail and then quickly delete those messages.",Center,1,quartz,43.87,-4.77
"Millions of lives were lost, especially in Africa and Asia, because western manufacturers didn’t allow countries like India or South Africa, which had the capacity to do so, to manufacture generic versions of the otherwise very expensive drugs they had developed.",Center,1,quartz,43.87,-4.77
"And whatever the laws and ethics might be, nothing would happen if no one enforced them.",Center,1,quartz,43.87,-4.77
"Air pollution is associated with over 100,000 premature deaths in the United States every year.""",Lean Right,0,washington-examiner,34.07,11.3
"To add insult to injury, the bureaucrats are banning gas furnaces in a roundabout way that allows the politicians to claim nobody is banning anything - and you can count on media allies and fact-checkers to scold you if you point out that their ban is a ban.",Lean Right,1,washington-examiner,34.07,11.3
"The whole process, which she said was at times very tiring, took between seven and eight months.",Lean Right,0,washington-examiner,34.07,11.3
"But if it’s the only alternative to a state-run system that is capable of malevolence to this degree, it may just be the best we’ve got for now.",Lean Right,0,washington-examiner,34.07,11.3
"Similarly, it seems deeply unfair that wealth plays a determinative factor in both quality of life and life expectancy.",Lean Right,1,washington-examiner,34.07,11.3
"The Stillaguamish River also flooded several homes in neighborhoods that flank the river, including the town of Granite Falls.",Right,0,fox-news,35.44,11.06
"For 10-year fixed private student loans, interest rates fell by nearly a quarter of a percentage point, while rates for 5-year variable student loans edged up by just over half a percentage point.",Right,0,fox-news,35.44,11.06
"When all that is good falls apart, what can good people do?",Right,0,fox-news,35.44,11.06
"Authorities say McMahan boasted on social media about being at the riot, writing: ""For those that think we went in because of Trump is uninformed.",Right,0,fox-news,35.44,11.06
How can home-goers ensure their holidays aren’t bogged down by family stress?,Right,0,fox-news,35.44,11.06
"More rain is in the forecast for the end of the week, but will be more showery and lighter in intensity and not expected to have any impact on local rivers.",Right,0,fox-news,35.44,11.06
"Beathard, will be tasked with keeping the Jaguars on a trajectory toward the playoffs.",Right,0,fox-news,35.44,11.06
They were also able to rescue a man who was stranded on the top of his truck that became stuck in floodwaters.,Right,0,fox-news,35.44,11.06
"Both Lankford and Tillis are supposedly lead negotiators for the Republican position, but instead of negotiating with Democrats, they are negotiating with themselves, fighting those Republicans who say they’re not going to support foreign spending until at least one major, deadly domestic issue is tackled.",Right,1,fox-news,35.44,11.06
HOW MUCH FLOOD WATER DOES IT TAKE TO DAMAGE A CAR?,Right,0,fox-news,35.44,11.06
"The suspect opened fire on the officer in the backyard of the residence, striking the officer multiple times.",Right,0,fox-news,35.44,11.06
"All this week, the FOX News Rundown: Evening Edition teams up with FOX Business to look at the companies and innovators leading the charge on A.I.. We’ll also explore what is being done to protect American jobs and create guardrails to curb the cutting-edge technology.",Right,0,fox-news,35.44,11.06
Doherty married photographer Kurt Iswarienko in 2011 and filed for divorce in April of this year.,Right,0,fox-news,35.44,11.06
The Nevada was the only battleship to set sail that morning.,Right,0,fox-news,35.44,11.06
Fans will soon be able to buy residential homes-with a sprinkle of Disney pixie dust-in picturesque North Carolina designed by the company’s theme park designers.,Right,0,fox-news,35.44,11.06
"However, Truppner's DNA was eventually linked to Lucious Boyd, a suspected serial killer.",Right,0,fox-news,35.44,11.06
"PITTSBURGH PUBLIC SCHOOLS STRUGGLE WITH A THIRD OF STUDENTS CHRONICALLY ABSENT: REPO Absence rates in the district are currently at 5% on average, with some students missing at least 10% of school days.",Right,0,fox-news,35.44,11.06
"Every time you say good morning, a hug and a kiss.""",Right,0,fox-news,35.44,11.06
"We are committed to helping our friends at UNLV and the greater Las Vegas community heal and are grateful for the efforts of our first responders.""",Right,0,fox-news,35.44,11.06
Buliding the political will for long-term strategic competition requires public awareness of the threat we face - and our preparedness to meet it.,Right,0,fox-news,35.44,11.06
"The conventional medical system typically approaches disease and illness retroactively, often by prescribing drugs for conditions defined by an active barometer - such as medication for diabetes , statins for problematic cholesterol and chemotherapy for late-stage cancer, Avalon agreed.",Right,0,fox-news,35.44,11.06
"People have converted - and all because they've fallen in love with the richness, the depth and the tradition of the Catholic Church.",Right,1,fox-news,35.44,11.06
"ANTISEMITISM HAS BILLIONAIRES BAILING ON IVY LEAGUE DONATIONS The presence of Jewish students at these universities is the most potent statement against antisemitism and anti-Israel bias, demonstrating resilience and commitment to defending their beliefs.",Right,1,fox-news,35.44,11.06
"For political leaders, we weighed gross domestic products and populations; for corporate chiefs, revenues, valuations and employee counts were critical.",Right,0,fox-news,35.44,11.06
"According to the United Bodegas of America and the Bodega and Small Business Group, hundreds of these grocers have applied for gun licenses and sought out resources to obtain permits to carry.",Right,0,fox-news,35.44,11.06
They are what will ultimately uphold the enduring values of our great nation.,Right,1,fox-news,35.44,11.06
"As you pay down your loan, you can also build home equity, which you can use for other things like debt consolidation or home improvement projects.",Right,0,fox-news,35.44,11.06
"Humans then review and vet the data to identify trends in online antisemitism, Montemayor told Fox News.",Right,0,fox-news,35.44,11.06
"When we edit our photos with AI, we might alter our memories as well.",Right,0,fox-news,35.44,11.06
"Number two, ... we have also urged them to think about how to do this in a way that keeps those civilians safe.",Right,0,wnd,13.06,21.0
"But its campaign against the truth convinced media outlets to suppress that information, depriving American voters of key information about one candidate.",Right,1,wnd,13.06,21.0
She was uncomfortable about the prospect of sharing a bed with a male student.,Right,0,wnd,13.06,21.0
The Sheriff's department noted that the investigation is still ongoing and asked anyone with information to contact Det.,Right,0,wnd,13.06,21.0
"House Oversight Committee chief Rep. James Comer, R-Ky., earlier confirmed the existence of the email alias schemes by Biden.",Right,0,wnd,13.06,21.0
"Roy told Kristen Clarke, another assistant AG, ""Even under your watch, it’s at least 35 to one or two.",Right,0,wnd,13.06,21.0
"Fatih Birol, Executive Director of the International Energy Agency, maintained his composure, nodding and shifting his gaze as if deeply contemplating Kerry’s words.",Right,0,wnd,13.06,21.0
"Glenique Frank’s participation in the London Marathon in April, where the biological male finished ahead of over 14,000 women, and the retirement of cyclocross champion Hannah Arensmen also focused attention on the issue.",Right,1,wnd,13.06,21.0
"The whole unbelievable story - including the underlying reasons, almost entirely unreported elsewhere, for what amounts to the most massive child sexual abuse campaign in American history - is explored as never before in this special Whistleblower edition.",Right,1,wnd,13.06,21.0
"These bones had been burnt on an open flame, and many had butcher marks, implying that at least parts of them had been eaten.",Right,0,wnd,13.06,21.0
"Holden is of Native American descent and belongs to the Chumash tribe, with his grandfather serving on the Tribe board in Santa Ynez.",Right,0,wnd,13.06,21.0
New York lawmakers should restore the statute of limitations and limit it to five years.,Right,1,wnd,13.06,21.0
It's amazingly good news when you learn that you can live forever and not die.,Right,1,wnd,13.06,21.0
"And thus are radical terroristic Muslims and smug, entitled, narcissistic, perpetually enraged and thoroughly brainwashed leftists, the kind that populate America’s elite university campuses, of one mind with regard to the current war on Israel and hatred of Jews.",Right,1,wnd,13.06,21.0
What television shows do you have to watch to find out it's been the most popular movie in the United States - and the most endearing and disturbing?,Right,1,wnd,13.06,21.0
Members of the royal family have also not publicly commented on Scobie's book.,Lean Left,0,abc-news,45.25,-2.91
"Pro-Palestinian activists call for an Israeli ceasefire in Gaza during a protest outside Union Station in Washington, D.C., on Nov. 17, 2023.",Lean Left,0,abc-news,45.25,-2.91
"To compare this to Biden’s odds against a more popular Republican, the only reason we know Haley fares well on a national stage is because ... she is running for president and is faring decently on a national stage.",Lean Left,1,abc-news,45.25,-2.91
But almost everything she's told them about herself is a lie.,Lean Left,1,abc-news,45.25,-2.91
But don't expect him to suit up Sunday against the Texans.,Lean Left,0,abc-news,45.25,-2.91
"For all that, it's more than conceivable that Walker wins his race against Democratic Sen. Raphael Warnock.",Lean Left,0,abc-news,45.25,-2.91
"Backup Tate Rodemaker suffered a concussion late in the Seminoles' regular-season finale victory at Florida, leading to true freshman Brock Glenn, the third-stringer, starting in the ACC title game -- a victory against Louisville.",Lean Left,0,abc-news,45.25,-2.91
"In one of the most notable jabs of the night, Newsom invoked DeSantis' struggling campaign.",Lean Left,1,abc-news,45.25,-2.91
"The kibbutz of Nir Oz is perhaps the best place to understand Hamas’ hostage strategy, an operation that was unprecedented both in scope and execution.",Lean Left,1,abc-news,45.25,-2.91
Every trip the octogenarian president has taken of late has been nothing short of disastrous.,Lean Right,1,hotair,24.77,12.78
Shame on Israel for not seriously investigating claims of rape and collecting rape kits.,Lean Right,1,hotair,24.77,12.78
The self-described devout Catholic pledged to stay the course on abortion.,Lean Right,1,hotair,24.77,12.78
She used numbers coming from Hamas propaganda so take her words with a big grain of salt.,Lean Right,1,hotair,24.77,12.78
The State Department spokesman let the cat out of the bag.,Lean Right,0,hotair,24.77,12.78
"Neither is particularly helpful or useful right now, and double downing on the stupid isn’t going to make things any better.",Lean Right,1,hotair,24.77,12.78
Trump's Visit to the Texas Border - Will Governor Abbott Endorse Him?,Lean Right,0,hotair,24.77,12.78
Those outside the pro-Hamas bubble do not call for ceasefire and do not support the existence of Hamas.,Lean Right,1,hotair,24.77,12.78
"While images of anti-Semitic chants at rallies and protests continue to sweep the country, and not just on college campuses anymore, but lining the streets of American cities with unabashed Jew hatred, it’s been stunning to see to what lengths the Sunday shows will go to avoid the problem the left has with a frightening chunk of their base.",Lean Right,1,hotair,24.77,12.78
"Moulton blames Israel for the attacks, blaming the victims for the crime.",Lean Right,1,hotair,24.77,12.78
It’s difficult to model the electoral effect of the lawfare campaigns being waged against Donald Trump or the influence peddling (i.e.,Right,1,the-american-spectator,17.46,22.97
The event lasted from 10 p.m. on Friday night and ended at 5 a.m. on Saturday morning.,Right,0,the-american-spectator,17.46,22.97
The program’s $17.3 billion may be a rounding error in the Capitol - and is only a fraction of the $220 billion in gear the Pentagon seems to have lost - but sometimes it’s easier to understand the federal government’s insanity best by focusing on the little stuff.,Right,1,the-american-spectator,17.46,22.97
Because the Ls pile up very quietly in Dirty Joe’s America.,Right,1,the-american-spectator,17.46,22.97
"And in all of those cities and on all of those college campuses where enemy agitators demonstrate and riot on behalf of Iran and their proxies, scaring the dickens out of the Democrats’ politicos who don’t think they can win next year without the pro-Hamas fringe turning out for them, it’s unmistakable too.",Right,1,the-american-spectator,17.46,22.97
"America’s indispensable working class existed as property beyond the realm of politics, leaving white Americans free to trumpet their love of freedom and democratic values.",Left,1,the-atlantic,37.96,-9.01
"Rosin: Always in these situations, there seems to be just this gap between the rhetoric and what happens on the ground.",Left,0,the-atlantic,37.96,-9.01
"He missed our neighbor’s dog, a dachshund who always slunk right up to him, licking his open palm.",Left,0,the-atlantic,37.96,-9.01
"Neumann used nonunion laborers for construction, and many of WeWork’s employees put in long, poorly compensated hours.",Left,1,the-atlantic,37.96,-9.01
"Whether because of fear or inertia, Russian society hardly stirred itself during the massacres in Bucha, Irpin, Borodyanka, and Mariupol.",Left,1,the-atlantic,37.96,-9.01
But then maybe they also kind of break their spike protein a little bit.,Left,0,the-atlantic,37.96,-9.01
They tried to push their way through their initial symptoms and just couldn’t understand why they kept on getting worse.,Left,0,the-atlantic,37.96,-9.01
"But in the American evangelical tradition, and at a church like Cornerstone, the whiff of liberalism made him suspect.",Left,1,the-atlantic,37.96,-9.01
"Elected Davao City mayor in 1988, he allegedly created the Davao Death Squad, which gunned down drug dealers, drug users, petty thieves, and, eventually, political rivals.",Left,1,the-atlantic,37.96,-9.01
It is an acknowledgment and maybe even a tribute to the ways in which our screens have become extensions of ourselves and the way that documentation via these screens has become its own form of consumption and participation.,Left,0,the-atlantic,37.96,-9.01
"Is it to be a matter of regret that incidentally you should, to some small extent, remunerate these people?",Left,1,the-atlantic,37.96,-9.01
"Colleges are already required to report race, ethnicity, gender, and other attributes through the DoE’s Integrated Postsecondary Education Data System, so adding income would be straightforward.",Left,0,the-atlantic,37.96,-9.01
"New York City, Albany, Syracuse, Rochester and Buffalo hold the fate of every NYS community in their hands.",Right,0,the-gateway-pundit,14.91,23.64
"Today ETHS made unannounced, unexplained language changes to their course descriptions.",Right,0,the-gateway-pundit,14.91,23.64
Nearly two-thirds of Americans say they disapprove of his job performance.,Right,0,the-gateway-pundit,14.91,23.64
She will receive all the medical attention she requires and thanks you for your support.,Right,0,the-gateway-pundit,14.91,23.64
"In order to truly enforce such a dystopian society, they will crash the dollar and the rest of the global fiat currencies, replace them with digital and programmable CBDCs (Central Bank Digital Currencies), and require biometric digital IDs of all people, with your digital ID tied to your bank account.",Right,1,the-gateway-pundit,14.91,23.64
"During our stay at the Cabańas Rio Mayo Hotel, we were the only non-Chinese visitors.",Right,0,the-gateway-pundit,14.91,23.64
"The hotel in Pasto, Colombia, was packed with Chinese nationals heading to America and eager to cross Joe Biden’s open border.",Right,1,the-gateway-pundit,14.91,23.64
Ardsley Motel Status It has been previously reported that migrants have been bussed to various locations in Westchester and Rockland County.,Right,0,the-gateway-pundit,14.91,23.64
"On October 7, 2023, Hamas slaughtered 1,400 Israelis and foreigners in a surprise attack on civilians in southern Israel.",Right,1,the-gateway-pundit,14.91,23.64
"She claims to have authored the bill, and she stood smiling behind DeSantis at the signing.",Left,0,daily-beast,33.54,-10.51
Russian talking heads proudly assert that Moscow is not interested in any deals and pontificate about invading other countries to continue the expansion of the Russian empire.,Left,1,daily-beast,33.54,-10.51
"Should she show up, she is likely to get a well deserved taste of the condemnation she allowed others to suffer unjustly.",Left,1,daily-beast,33.54,-10.51
She is on the Saratoga County School Board and served as its chair until her term expired last week.,Left,0,daily-beast,33.54,-10.51
Russia’s self-imposed turmoil is so unrelenting that Putin’s mouthpieces are having to resort to increasingly ridiculous suggestions and predictions-but even they find it challenging to obscure the grim reality with a cheerful demeanor.,Left,1,daily-beast,33.54,-10.51
"In the Account Info section, there’s a field for your password.",Left,0,daily-beast,33.54,-10.51
She is also on the board of the Central Florida Tourism Oversight District that Gov.,Left,0,daily-beast,33.54,-10.51
"While our early release is live, additional features will be added throughout the year, which will include more content and accessibility.",Left,0,daily-beast,33.54,-10.51
These kinds of comments on a public forum could seriously damage a woman’s mental health.,Lean Left,1,the-independent,38.37,-6.99
It’s a good time to check out some deals so you can get the copy that’s right for you at a reasonable price.,Lean Left,0,the-independent,38.37,-6.99
"The perfect one-stop-shop to get your head, and mouth, around LA’s staggering culinary diversity.",Lean Left,1,the-independent,38.37,-6.99
"The formal dress code, doormen in top hats and the stage (literally) of Palm Court sets the scene - this is posh London in all its theatre.",Lean Left,1,the-independent,38.37,-6.99
"While president he equivocated over whether he would back Article V, which states that an attack on any one of the defence pact’s 31 members constituted an attack on all of them.",Lean Left,1,the-independent,38.37,-6.99
"That’s really a shame, for Carlos it could have been dangerous.",Lean Left,1,the-independent,38.37,-6.99
"In the same way, the best hotels in this round-up may not be the most obvious ones - this is a city bursting with small, period properties.",Lean Left,1,the-independent,38.37,-6.99
This was the sort of lifestyle she and Mr. Vieira were craving.,Center,0,christian-science-monitor,44.22,-2.47
"He touted the American dream, with a nod to his journey as a firefighter’s son who became a golden boy of GOP politics.",Center,0,christian-science-monitor,44.22,-2.47
The IRS agent supplemented his original whistleblower testimony from the summer with the documents at a closed door hearing Tuesday before the committee.,Lean Right,0,just-the-news,33.31,10.7
Tonight's featured guest will be former New York Congressman Lee Zeldin.,Lean Right,0,just-the-news,33.31,10.7
Rumble didn’t immediately respond to a request for comment on Monday.,Lean Right,0,just-the-news,33.31,10.7
And they think they can bully the Oversight Committee and set the rules.,Lean Right,1,just-the-news,33.31,10.7
The Sept. 29 letter has no other signatures as of Oct. 10.,Lean Right,0,just-the-news,33.31,10.7
"The best-case scenario for one of the most common COVID-19 interventions may be that it has no measurable effect on infection, recent studies suggest.",Lean Right,0,just-the-news,33.31,10.7
"The group, spun off in late 2021 from a shuttered for-profit consultancy that itself lasted less than three years, is best known for naming and shaming brands whose advertisements appear on disfavored conservative websites and TV programs.",Lean Right,1,just-the-news,33.31,10.7
"Each candidate received three additional votes in the recount, still resulting in Whitehorn's one-vote victory.",Lean Right,0,just-the-news,33.31,10.7
"Unprecedented government funding Blackmon said that Biden’s energy policies include a lot of funding for politically connected companies, and so he expects more boondoggles to come down the pipeline.",Lean Right,1,just-the-news,33.31,10.7
"The group, the Check My Ads Institute, is attempting the shutter the platform by getting its certification by an ad industry group yanked.",Lean Right,1,just-the-news,33.31,10.7
"By the fall of 2018, Hunter Biden was receiving his last payments from the Ye Jianming-connected business venture.",Lean Right,0,just-the-news,33.31,10.7
Filmmaker Jason Killian Meath is back with not one but two new documentaries sure to set tongues wagging in the culture wars.,Lean Right,1,just-the-news,33.31,10.7
The suspect fled the scene in a vehicle and officers checked the home where the gunfire exchange occurred and found two more deceased.,Lean Right,0,just-the-news,33.31,10.7
"Reps. Tim Walberg, R-Mich., and Andrew Clyde, R-Ga., along with more than a dozen House Republicans, introduced the Choice in Automobile Retail Sales Act, which would prohibit regulations that mandate the use of any specific type of technology or limit availability of new vehicles based on engine type.",Lean Right,0,just-the-news,33.31,10.7
"When Jayapal said it is unclear as for who is to blame for the situation, Bash pressed the congresswoman.",Lean Right,0,just-the-news,33.31,10.7
"Regardless of whether China plans to directly invade Taiwan, Beijing has been pushing the boundaries of Taiwan by performing near-daily military drills around the island.",Lean Right,0,just-the-news,33.31,10.7
"Like their strategist brethren, they are an optimistic lot on the whole, forecasting earnings of $246.30 for the S & P 500 2024, a jump of about 12% from 2023 and a new record for earnings, according to FactSet.",Center,0,cnbc,43.82,-1.81
Short interest increased 6% during the period to more than 27 million shares.,Center,0,cnbc,43.82,-1.81
"Anger among families of hostages Israel says it must remove Hamas from power to prevent a repeat of the Oct. 7 attack, when Hamas and other militants killed about 1,200 people, mostly civilians, and took captive some 240 men, women and children after bursting through Israel's vaunted defenses.",Center,1,cnbc,43.82,-1.81
"U.S. President Joe Biden gestures as he delivers remarks on aid to Ukraine from the White House in Washington, U.S., December 6, 2023.",Center,0,cnbc,43.82,-1.81
"U.S. consumer prices were unchanged in October from the previous month, lifting hopes that the Fed's aggressive rate-hiking cycle was starting to bring down inflation.",Center,0,cnbc,43.82,-1.81
"Ukrainian soldiers in a tank in the direction of Avdiivka in Donetsk Oblast, Ukraine, on Dec. 1, 2023.",Center,0,cnbc,43.82,-1.81
"The problem with this crop of August-ending quarters is that interest rates started creeping up again in September, which was one reason for the lousy performance of the S & P 500 .",Center,1,cnbc,43.82,-1.81
"He was a brilliant and self-made man, with enormous charm and integrity.",Center,0,cnbc,43.82,-1.81
"They don't need to reverse and lead, but deeper weakness would be tough to overlook as a macro tell.",Center,0,cnbc,43.82,-1.81
But its stock changed course after the company announced its recently approved weight loss treatment Zepound is now available at pharmacies.,Center,0,cnbc,43.82,-1.81
"Those who can't usually end up either bitter pessimists or bankrupt optimists.""",Center,1,cnbc,43.82,-1.81
"But Mr. X is a walking minefield of wonderful legal business.""",Center,1,cnbc,43.82,-1.81
"With all this frothy commentary, it's worthwhile looking seeking out the opinions of the lonely minority who predict stocks will not do so well in 2024.",Center,1,cnbc,43.82,-1.81
"The modern American empire-builders surely think that they can kill any foe, real or imagined.",Lean Right,1,washington-times,34.92,11.31
