text,source_party,label,source,reliability,bias
"The event features boutique shopping, silent auction, luncheon and fashion show.",Lean Left,0,san-diego-union-tribune,45.68,-1.76
"Once sugar is completely melted, immediately stir in the butter until melted and combined.",Lean Left,0,san-diego-union-tribune,45.68,-1.76
"Something less invasive than a Myers Briggs assessment, but better than being trapped at a dinner, only to find shortly after the waiter brings the water that you already hate him/her.",Lean Left,0,san-diego-union-tribune,45.68,-1.76
"Yaacov was bitterly aware that in one cruel way, she was lucky.",Lean Left,1,san-diego-union-tribune,45.68,-1.76
"Client’s failure to timely provide material that Union-Tribune requires to move forward with a project, such as a Client login, an image that only Client is able to provide, or any other element essential to project completion, shall cause such campaign or project to be deemed inactive and cause Union-Tribune to stop work.",Lean Left,0,san-diego-union-tribune,45.68,-1.76
"Some people living with the condition become apathetic, start missing work deadlines, drastically change their eating habits or make extravagant purchases.",Lean Left,0,san-diego-union-tribune,45.68,-1.76
"Lewis had his play-calling duties ripped away by Sanders late in the season, but it’s impossible to know how much Deion’s son playing quarterback entered into a complicated relationship.",Lean Left,1,san-diego-union-tribune,45.68,-1.76
"Even though researchers may not have all of the answers, they’re working to find them.",Lean Left,0,san-diego-union-tribune,45.68,-1.76
Client is responsible for the accuracy and truthfulness of all Client Material.,Lean Left,0,san-diego-union-tribune,45.68,-1.76
"Toy bins will be set up throughout the city for folks to drop off new, unwrapped toys.",Lean Left,0,san-diego-union-tribune,45.68,-1.76
"Highlights include choristers Christmas carols, St. Nicholas, All Souls’ Christmas Mouse (a long time tradition) and crafts, cookies and spiced tea along with gift shopping.",Lean Left,0,san-diego-union-tribune,45.68,-1.76
New coach Sean Lewis has signed up to solve a Rubik’s Cube on steroids.,Lean Left,1,san-diego-union-tribune,45.68,-1.76
"Free family event with entertainment, performers and vendors from different cultures.",Lean Left,0,san-diego-union-tribune,45.68,-1.76
"Enjoy a game truck, bounce house, arts and crafts, rock climbing and live music.",Lean Left,0,san-diego-union-tribune,45.68,-1.76
"Doctors and other medical professionals who generally work on inpatient units came to him for specialty consults, blood work, medical imaging and other services.",Lean Left,0,san-diego-union-tribune,45.68,-1.76
"If Client rejects a deliverable and explains to Union-Tribune how it does not meet the specifications, Union-Tribune will revise it and redeliver.",Lean Left,0,san-diego-union-tribune,45.68,-1.76
"The price range last season was $250 to $1,500 in those same areas.",Lean Left,0,san-diego-union-tribune,45.68,-1.76
"Strained tomatoes, such as from Pomi, are a similar, excellent option.",Lean Left,0,san-diego-union-tribune,45.68,-1.76
He brought up her divorce several times over the course of a few days and repeatedly asked to speak with her on the phone.,Lean Left,0,san-diego-union-tribune,45.68,-1.76
"Years later, family members participating in genetic testing found they had a genetic mutation that increases the family’s risk of frontotemporal dementia.",Lean Left,0,san-diego-union-tribune,45.68,-1.76
This is the International Year for the Elimination of Child Labor as declared by the United Nation's International Labor Organization .,Left,0,alternet,32.71,-14.76
They estimate that students who participate in a prison education program are 28 to 32 percent less likely to recidivate when compared with their counterparts who did not participate in education programs.,Left,0,alternet,32.71,-14.76
Conservative Prime Minister Richard Bedford Bennett first created the single-desk Canadian Wheat Board in 1935 as a last-ditch effort to appease the socialists of the country.,Left,1,alternet,32.71,-14.76
"The latest right-wing media poster-victim, Cliven Bundy, is just the latest in a long line of desert dwellers who thinks he or she should not have to follow the law and has a god-given right to unlimited use of public resources, in this case, rangeland.",Left,1,alternet,32.71,-14.76
But night one of Watters’ tenure as Fox’s headliner was notable only for how utterly ordinary it was.,Left,1,alternet,32.71,-14.76
"It’s important to note, however, that the vast majority of marijuana-related ER visits are related to panic or anxiety reactions and end with the patient eventually calming down and going home.",Left,0,alternet,32.71,-14.76
"The state media’s persuasion playbook usually consists of stoking discontent in other countries, presenting Moscow as a paragon of religious propriety and freedom, and hoping that disgruntled foreigners will flow into Russia’s welcoming arms.",Left,1,alternet,32.71,-14.76
Successfully reversing the growing gap in black homeownership will yield essential strategies for closing the broader minority homeownership gap.,Left,0,alternet,32.71,-14.76
"By February 2014, the eurozone was still close to record unemployment of 12 percent (as compared with 6.7 percent in the US); and GDP had fallen in both 2012 and 2013.",Left,0,alternet,32.71,-14.76
"So he settled on a vast, 35,000-sq.-ft. building that had been abandoned by a national supermarket chain about 15 years ago.",Left,0,alternet,32.71,-14.76
AOA: A Recipe for Disaster You can see this problem in regard to the AOA sensors in the Boeing 737 aircraft.,Left,1,alternet,32.71,-14.76
"Of these, an unbelievable 46 million are killed to be eaten on just one day-Thanksgiving.",Left,1,alternet,32.71,-14.76
The challenge that remains for search and rescue teams is to use sonobuoys to triangulate the noises potentially being made by the Titan's crew.,Left,0,alternet,32.71,-14.76
Trump is obviously hoping to terrify suburbanites into voting for him.,Left,1,alternet,32.71,-14.76
Two-thirds of Americans (66%) view one party favorably while expressing an unfavorable opinion of the other party.,Left,0,alternet,32.71,-14.76
"Meanwhile, President Joe Biden, who campaigned on a commitment to renewable energy, is receiving an enormous amount of flak for issuing permits for expanding exploration and drilling on public lands to mitigate historically high gas prices, which are linked to price gouging by oil producers.",Left,1,alternet,32.71,-14.76
"If the world is to keep global temperatures from rising above that 1.5 degrees Celsius threshold, every major economy should soon be on a downward-trending trajectory in terms of both fossil-fuel consumption and CO2 emissions (along with a compensating increase in renewable energy output).",Left,0,alternet,32.71,-14.76
"Since its implementation, expulsions of children have now skyrocketed from the hundreds into the thousands.",Left,1,alternet,32.71,-14.76
"But DeSantis’s blueprint contains a bunch of warmed-over ideas - mass deportations, draconian efforts to limit asylum-seeking and legal immigration, even an end to birthright citizenship - that Trump already tried to execute, yet could not.",Left,1,alternet,32.71,-14.76
These donations were being tracked as diverted from the landfill but were actually being ultimately thrown away.,Left,0,alternet,32.71,-14.76
But there is no debating they are the NFL’s most boring.,Lean Right,1,boston-herald,36.31,9.68
"The 250 images in the show, taken between November 1963 and February 1964, were rediscovered in McCartney’s personal archive in 2020 while a team at his production company worked on a project about his late wife, Linda McCartney.",Lean Right,0,boston-herald,36.31,9.68
"Hardly had the Meloni/Rama deal been announced than six EU countries-the Czech Republic, Hungary, Poland, Slovakia Austria and Germany- agreed to tighten their border security. .",Lean Right,0,boston-herald,36.31,9.68
"Burns countered with a jumper on the baseline, but Zackery answered with a drive to make it 68-68 with 1:02 remaining.",Lean Right,0,boston-herald,36.31,9.68
The Celtics led by 21 at halftime after another blistering hot offensive first half and kept their foot on the gas pedal.,Lean Right,1,boston-herald,36.31,9.68
He was bleeding from his ear when police officers arrived at the One Brigham Circle mall on Friday morning.,Lean Right,0,boston-herald,36.31,9.68
Remember the dour faces of Michelle Obama and Hillary Clinton on inauguration day?,Lean Right,1,boston-herald,36.31,9.68
But this excellent new survey of Chicago sculptor Simone Leigh feels both very overdue and right on time.,Lean Right,1,boston-herald,36.31,9.68
Mortenson said he took his second shot at the buck in the range of 75 to 80 yards.,Lean Right,0,boston-herald,36.31,9.68
"DUBAI, United Arab Emirates - The United States committed to the idea of phasing out coal power plants, joining 56 other nations in kicking the coal habit that’s a huge factor in global warming.",Lean Right,0,boston-herald,36.31,9.68
"The C’s were so dominant that they barely needed Porzingis, who scored just seven points in the first half.",Lean Right,0,boston-herald,36.31,9.68
That or they understood early on that books were easier to tailor than silk dresses.,Lean Right,1,boston-herald,36.31,9.68
The warm-hearted islanders processed them so fast that they were whisked off the island in 36 hours.,Lean Right,1,boston-herald,36.31,9.68
"Even the pauper of the bunch, Southern California Edison’s president and CEO, made $2.8 million in total pay and perks last year.",Lean Right,1,boston-herald,36.31,9.68
It’s time to put an end to secret and unsavory practices.,Lean Right,1,boston-herald,36.31,9.68
"Preeminent among them is the profession that when progressives condemned murder, rape and kidnapping of innocents, it was a condemnation that would apply as well to the murder, rape and kidnapping of Jews.",Lean Right,1,boston-herald,36.31,9.68
"Once BC stopped turning the ball over, the Eagles rallied for six straight points accentuated by a Caudell Harris (14 points) slam dunk with 14:31 on the clock.",Lean Right,0,boston-herald,36.31,9.68
"For the posterity minded If you’re thinking lovingly-inscribed keepsake, it’s hard to beat Library of America or the U.K.-based Folio Society.",Lean Right,1,boston-herald,36.31,9.68
"Elections tend to be referendums on the performance of the president and if people at the gas pump and supermarket are seeing significant rises in costs, it makes it that much more difficult for the incumbent to win.",Lean Right,1,boston-herald,36.31,9.68
Lawmakers barred Healey from using the entire $250 million until her administration finds and opens the overflow site by Dec. 31.,Lean Right,0,boston-herald,36.31,9.68
"For Greece, repatriating the sculptures, which have been housed in the British Museum since 1817, is a matter of national identity.",Lean Left,1,the-guardian,40.67,-7.97
He got in the car and drove to a remote countryside cottage to escape from being at home with two small children.,Lean Left,0,the-guardian,40.67,-7.97
This must have been a monumental sadness and humiliation for him.,Lean Left,1,the-guardian,40.67,-7.97
"They’ve devised a menu that is part bargain-priced Bentley’s or Scott’s, part kiss-me-quick-and-kiss-me-again.",Lean Left,1,the-guardian,40.67,-7.97
"From swimmers to sewage workers, boatbuilders to bailiffs, salmon fishers to ferryman, the voices are varied and vividly brought to life.",Lean Left,0,the-guardian,40.67,-7.97
"Foster’s interpretation never settles and, unfortunately, ends up diminishing the power of its real-life characters.",Lean Left,1,the-guardian,40.67,-7.97
"The ever-unlikable Pierpoint graduates might have finally got their feet under the table, but that just means bigger risks, worse decisions and wilder benders.",Lean Left,1,the-guardian,40.67,-7.97
"Dushane, Sully, Jamie, Jaq: they’re all ruthless, reprehensible bastards, who you desperately want the best for.",Lean Left,1,the-guardian,40.67,-7.97
The microbes in mothers’ guts while the baby is growing not only influence immune development but also brain development So why are ultra-processed foods impairing our brains?,Lean Left,0,the-guardian,40.67,-7.97
"Very little is what it seems in The Man Who Fell to Earth (1976), an adventurous interpretation of a sci-fi novel by Walter Tevis, whose other filmed books include The Hustler, The Color of Money and The Queen’s Gambit.",Lean Left,0,the-guardian,40.67,-7.97
"As he says, there were only a handful of people who knew where they were going and, once they’d collected Brogan (Ben Peel), all of them were in that car, but she does a good job of deflecting and saying it was definitely Brogan while being tortured.",Lean Left,1,the-guardian,40.67,-7.97
"The entire cultural history of the 1980s is basically Midge Ure walking through the Vienna mist in a leather overcoat surrounded by decaying grandeur and laughing Nazi-yuppies, waiting for megadeath to fall from the skies.",Lean Left,1,the-guardian,40.67,-7.97
"He has cancelled some TV subscriptions and keeps clothing such as coats and socks much longer, darning holes instead of replacing them.",Lean Left,0,the-guardian,40.67,-7.97
"The flaring auroras, the full moon, a swing and a slide on an empty beach all take on doomy significance.",Lean Left,0,the-guardian,40.67,-7.97
But the strange side-effect is that we’ve also empowered the climate.,Lean Left,0,the-guardian,40.67,-7.97
It was thrilling to behold Miley displaying a 30-year-old’s nous yet playing with the fearless freedom of a child and Howe’s pride was reinforced by the knowledge that such exceptional talent is leavened by healthy humility and rare emotional maturity.,Lean Left,1,the-guardian,40.67,-7.97
"In one particularly horrifying incident in 2009, a chimpanzee called Travis who had been raised by humans from birth mauled his owner’s friend, biting and tearing her face, ripping out her eyes, removing one of her hands and most of the other.",Lean Left,1,the-guardian,40.67,-7.97
"The contest was truly global in nature: political, ideological, military, nuclear, geographical and cultural.",Lean Left,0,the-guardian,40.67,-7.97
"While not perfect, Florida’s SB 256 is certainly a step in the right direction, and other locals in the Sunshine State are nervously following the battle in Miami.",Right,1,american-greatness,18.93,22.45
"Without a high paying job, most college- educated Americans cannot afford to pay the mountain of debt that comes along with access to middle class life in modern America.",Right,1,american-greatness,18.93,22.45
"There are clues to what’s gone wrong in our past, but a slavish attachment to the ideas and policies of the past is not a way to advance or conserve our principles.",Right,1,american-greatness,18.93,22.45
Or maybe its PR team did a very poor job of handling a crisis and the company quickly lost the trust of its customers.,Right,1,american-greatness,18.93,22.45
"Colleges and universities are heavily subsidized by taxpayers not only with the federal student loan program but, in the case of public universities, with state legislative appropriations.",Right,0,american-greatness,18.93,22.45
"Some, such as the odd but benign shaman, have suffered greatly in solitary confinement.",Right,0,american-greatness,18.93,22.45
"If Shokin was not in fact soft on Burisma and Joe Biden did not press for his ouster to better fight corruption, it would seem to leave just one possible reason for his ham-fisted demand: to protect Burisma for the sake of his son - and the millions he was hauling in.",Right,1,american-greatness,18.93,22.45
They are just as ruthless about dispatching allies who outlive their use.,Right,1,american-greatness,18.93,22.45
"As they are calmly escorted out of the building, there is no sign that these people have any notion that they have been part of an insurrection.",Right,1,american-greatness,18.93,22.45
Precivilizational greens in California prefer blowing up dams to building them.,Right,1,american-greatness,18.93,22.45
"Just two weeks ago, President Biden again likened Russian President Vladimir Putin to Hamas.",Right,0,american-greatness,18.93,22.45
"Indeed, many law schools today publicly denounce the constitution because it fundamentally conflicts with Marxism which opposes basic human rights such as freedom of speech, freedom of assembly, freedom of religion and so forth.",Right,1,american-greatness,18.93,22.45
Lots of hard-working and productive people found themselves out of work because of massive disruptions to capital markets and the banking sector.,Right,0,american-greatness,18.93,22.45
"In addition to stepping aside and endorsing the frontrunner, he could be using his executive power and bully pulpit as governor to mount a public pressure campaign to end the witch-hunt against President Trump, particularly the federal investigation occurring in his own backyard.",Right,1,american-greatness,18.93,22.45
"Indeed, the U.S. Communist Party has a long history to attempting to use blacks to foment revolution.",Right,1,american-greatness,18.93,22.45
"Our country and our movement, therefore, need to get serious immediately about fiscal sanity.",Right,1,american-greatness,18.93,22.45
Each visitor is granted passes to assault one police officer and one conservative civilian per day.,Right,1,american-greatness,18.93,22.45
Queueing Intersectionality hierarchies are the primary component of the Park’s queuing protocol.,Right,1,american-greatness,18.93,22.45
"Such a design aligns with the fundamental principle of user fees, linking payments directly to a person or entity's actual usage and providing a fair and equitable funding structure.",Right,0,townhall,24.95,19.79
"The ‘refrigerator bomber,’ who killed 15 Israelis with planted explosives, is hailed as a Palestinian symbol.",Right,1,townhall,24.95,19.79
"Liberal Journalist Tries (and Fails) to Trap Pierre Poilievre During a Presser A liberal journalist tried to make Justin Trudeau’s rival, conservative leader Pierre Poilievre, look like a fool for calling the Rainbow Bridge explosion terrorism.",Right,1,townhall,24.95,19.79
To see what the press is desperately doing here we first need to show the subversion.,Right,1,townhall,24.95,19.79
"Advertisement Conservatives should promote, encourage, believe in, and be willing to go the distance for a color-blind America.",Right,1,townhall,24.95,19.79
It was considered fair game to look back at activities that were decades old and retrospectively condemn someone.,Right,1,townhall,24.95,19.79
"Palestinians should have thought about that before they elected terrorists to govern them, who potentially could then set them up for any past Israeli military responses, and for the current Israeli response to the October 7th Palestinian terrorist attacks.",Right,1,townhall,24.95,19.79
It will start doing so gradually so that it can control any side effects and so Hamas can remove hostages from there in time before they collapse.,Right,0,townhall,24.95,19.79
"Trump got the liberal media’s attention when he said he’s not going to be a dictator, other than on his first day.",Right,1,townhall,24.95,19.79
"For data portability requests, we will select a format to provide your personal information that is readily useable and should allow you to transmit the information from one entity to another entity without hindrance.",Right,0,townhall,24.95,19.79
If we were to lay down our weapons (or be unprepared or live in a naïve false reality) they would slaughter us.,Right,1,townhall,24.95,19.79
"Remember the Palestinian civilians (including the old guy with a walker) shown on CCTV coming into Israeli settlements to steal, rape and take captives?",Right,1,townhall,24.95,19.79
Whether or not they have the fortitude to make good on their promises to address the antisemitism remains to be seen.,Right,1,townhall,24.95,19.79
"Kerry isn't only a hypocrite because he flew to Dubai for the conference, and because in the first 18 months serving in the Biden administration the Kerry family jet had emitted over 300 metric tons of carbon dioxide, though he certainly is a hypocrite for that.",Right,1,townhall,24.95,19.79
"Please David, tell us more about the disrespect and classlessness of a former 1st Lady wearing a grey coat over a black dress to the funeral of another 1st Lady.",Right,1,townhall,24.95,19.79
"Advertisement On that fall October day in Israel countless barbaric and inhuman atrocities were committed by these Palestinian terrorists against innocent men, women, children, and elderly Israelis, as the Palestinian terrorists spread carnage through Israeli settlements adjacent to the border with Gaza.",Right,1,townhall,24.95,19.79
"To compensate, let’s double-deck the halls with boughs of holly and buy every Chinese-made dripping icicle light package so aliens will see your home from space.",Right,1,townhall,24.95,19.79
"A statement issued at the time said the restrictions would cover exports of industrial machinery, tools and technology and it would also try to limit Russian revenues from trade in metals and diamonds.",Right,0,newsmax,28.9,13.54
That is not a position that the American people have ever embraced.,Right,1,newsmax,28.9,13.54
"These levels are a reliable measure of a person’s dietary intake of oily fish, and more trustworthy than people’s self-reported diet data, Leander said.",Right,0,newsmax,28.9,13.54
"Although President Biden squandered that opportunity when he entered the White House, we’re capable of doing it again.",Right,1,newsmax,28.9,13.54
"If you're looking for another way to get in touch with them and would prefer not to call, you can either email them at Support .unibet.com or launch the responsive live chat feature, which is available 24 hours per day, seven days per week when logged in to your Unibet Casino account.",Right,0,newsmax,28.9,13.54
"And that's when he told me that his name was Ted Conrad,"" she said.",Right,0,newsmax,28.9,13.54
"Suspected unapproved engine parts have wound up at Ireland’s Ryanair, TAP Air Portugal, Virgin Australia and several U.S. carriers including American, United, Delta and Southwest, according to published reports.",Right,0,newsmax,28.9,13.54
"Take a leisurely stroll down Aviles Street, the oldest street in America’s oldest city, and take in the many museums and old structures.",Right,0,newsmax,28.9,13.54
"Also, unlike some of the Gulf and southern Atlantic states, there is little chance of natural disaster to interrupt operations.",Right,0,newsmax,28.9,13.54
"We are working with the private travel organization to learn more and we anticipate a more detailed response by December 18 as ADF requests.""",Right,0,newsmax,28.9,13.54
Enjoy the films as you enjoy the excitement of the Triple Crown!,Right,0,newsmax,28.9,13.54
"Major foundations have provided millions of dollars in funding to Islamic terrorist-linked charities during the past decade, a report by the Philadelphia-based Middle East Forum has revealed.",Right,1,newsmax,28.9,13.54
"The Biden administration seems to be doing its level best to help Republicans on its mission beginning with a disastrous Afghanistan withdrawal, followed up by staggering inflation, escalating crime, a ludicrous energy policy and an unsecured border.",Right,1,newsmax,28.9,13.54
"When he left the room she casually poked her fingers in the flower pots, checking to see if the plants had been watered.",Right,0,newsmax,28.9,13.54
A large plurality of the electorate remains loyal even with everything falling apart.,Right,1,newsmax,28.9,13.54
He pushed back on arguments from House Republicans - and some Senate Republicans - that Russian aggression in Ukraine is not an issue for the US.,Right,0,infowars,15.78,23.58
But they have since lost more territory than they have gained.,Right,0,infowars,15.78,23.58
"With global media attention focussed away from the war in Ukraine, several key events happened that the world didn’t enough notice.",Right,1,infowars,15.78,23.58
"In a plea to Congress for more funding before Christmas, Joe Biden baselessly claimed Russian President Vladimir Putin plans to invade NATO countries once Russia has defeated Ukraine.",Right,1,infowars,15.78,23.58
Little land has been won at the enormous cost of life and limb.,Right,1,infowars,15.78,23.58
And now even senior Ukrainian military officials admit there is no military path out.,Right,1,infowars,15.78,23.58
"Western policymakers have denounced the killings in the town of Bucha as a war crime, and Ukrainian officials say a mass grave by a church there contain between 150 and 300 bodies.",Right,0,infowars,15.78,23.58
Almost any big push against dug-in Russian defenders protected by minefields would result in huge numbers of losses.,Right,0,infowars,15.78,23.58
But wiping Ukraine off the face of the map has not.,Right,1,infowars,15.78,23.58
It was not clear to the United States who gave the order for the killings and unclear what the motivation was for the killings.,Right,0,infowars,15.78,23.58
"Their infrastructure and economy are destroyed, their population is dispersed, their relatives are dead or injured and their land is lost.",Right,1,infowars,15.78,23.58
"Later that day, infantry and armored divisions rolled in from Russia, Belarus, and Crimea while paratroopers dropped in around the capital city of Kyiv.",Right,0,infowars,15.78,23.58
"In 2014, he did not annex the Donbas because he remained committed to solving the problems of the region by negotiating its autonomy within Ukraine through the Minsk Accords.",Right,0,infowars,15.78,23.58
"On Tuesday, Customs and Border Protection personnel logged more than 12,000 ‘migrant encounters,’ according to Fox News correspondent Bill Melugin.",Right,0,infowars,15.78,23.58
