text,source_party,label,source,reliability,bias
A new breed of media moguls is bringing order-and profits-to the digital world.,Center,0,wired,36.77,-7.24
"And so have you taken general relativity, or you taken that now, or?",Center,1,wired,36.77,-7.24
"But what might sound like a played-out trope has taken on new dimensions of humor, darkness, humanity, and plain old weirdness, with its recently concluded final season serving as a brilliant crescendo of all of that dark weirdness mixed in with a little time jump.",Center,1,wired,36.77,-7.24
"Obviously, the show Elizabeth puts on ends up being about a lot more than just having dinner on the table at 6 pm, but we suggest you watch to find out just how revolutionary it is.",Center,1,wired,36.77,-7.24
"Israel says it is targeting Hamas operatives and blames civilian casualties on the militants, accusing them of operating in residential neighborhoods.",Lean Left,0,cbs-news,41.76,-2.84
"And, minutes later, he was struck by the way Nick asked about Heidi.",Lean Left,0,cbs-news,41.76,-2.84
Twenty young people from around the world are now utilizing the first round of funding to embark on diverse projects ranging from eliminating carbon emissions from the atmosphere to mitigating the spread of wildfires.,Lean Left,0,cbs-news,41.76,-2.84
"Highlights from the 2023 Kennedy Center Honors The 2023 Kennedy Center Honors were held Sunday, recognizing Billy Crystal, Renee Fleming, Barry Gibb, Queen Latifah and Dionne Warwick.",Lean Left,0,cbs-news,41.76,-2.84
"Mourners reciting prayers over the bodies of victims killed in an Israeli bombing in Deir el-Balah, in the central Gaza Strip, on December 4, 2023.",Lean Left,0,cbs-news,41.76,-2.84
"CBS News Practiced for centuries in many parts of Latin America, Day of the Dead is a fusion of Roman Catholic and Indigenous rituals.",Lean Left,0,cbs-news,41.76,-2.84
"Customer service: Sometimes, part of the hassle of sticking to a dairy-free diet is the ordering process itself.",Lean Left,0,cbs-news,41.76,-2.84
"Tanner Mosher: He was in the car, the SUV, with the door open, and his boots were h-- were hanging, but they weren't touching the ground.",Lean Left,0,cbs-news,41.76,-2.84
"Michael DeWitt: If that ... rambunctious yellow lab hadn't been ... doing what ... labs like to do, chase birds ... we might not have solved this case and we might not have gotten a conviction.",Lean Left,1,cbs-news,41.76,-2.84
"Presented by TBD Media Group Historically great leaders and great entrepreneurs have disrupted industries by operating out of their own brilliance and ingenuity but who are these people and how did they get to the point where they are able to manage vast groups of people, vast resources all pointing towards a common objective.",Lean Left,0,cbs-news,41.76,-2.84
Heidi died from a single shotgun blast to her back that her husband said she suffered as he wrestled with an intruder.,Lean Left,0,cbs-news,41.76,-2.84
Nikki Battiste: Do you think Alex Murdaugh still thinks he can try to play the system - Ronnie Richter: A hundred percent.,Lean Left,1,cbs-news,41.76,-2.84
"But demand for foreign nurses skyrocketed as the pandemic caused nurses to burn out and leave the profession, creating a staffing crisis in the UK.",Center,0,quartz,43.87,-4.77
"A representative from Tallahassee Memorial was also at the event, ready to meet any nurses who were interested in relocating.",Center,0,quartz,43.87,-4.77
"Airlines then use the money made from selling those certificates to buy a certain amount of SAF instead of traditional jet fuel, reducing their emissions.",Center,0,quartz,43.87,-4.77
"Given all their blunders and idiosyncrasies, it doesn’t seem the AIs are ready to replace any real assistant jobs just yet.",Center,1,quartz,43.87,-4.77
"If only he knew who he was scared of, she said, her fuzzy slippers kicked off at the foot of the sofa.",Center,0,quartz,43.87,-4.77
"It’s a tale of bureaucratic obstruction, technical obstacles, and oil companies fighting to protect their profit margins.",Center,1,quartz,43.87,-4.77
"Others, set up hurriedly over the past year and a half or so, have dubious credentials or opaque identities.",Center,1,quartz,43.87,-4.77
"Advertisement 2001-2003: The US wars in Afghanistan and Iraq begin-arguably an unexpected megatrend, with vast implications for human life in those countries, energy security, defense spending, and domestic politics in many nations.",Center,0,quartz,43.87,-4.77
"Offering a new route to white-collar work, like with an apprentice program, doesn’t just help companies hire more easily-but also more inclusively.",Center,1,quartz,43.87,-4.77
A trial run of over-the-counter sales of the morning-after pill started in Japan yesterday (Nov. 28).,Center,0,quartz,43.87,-4.77
"JetBlue has given no indication that intends to do so, however.",Center,0,quartz,43.87,-4.77
Advertisement But scholars have criticized the megatrend bandwagon for at least as long as it has been gathering speed.,Center,0,quartz,43.87,-4.77
"Rep. Jamaal Bowman (D-NY) speaks outside the White House on Wednesday, Nov. 29, 2023.",Lean Right,0,washington-examiner,34.07,11.3
Lawmakers need to proactively work to make sure America is ready for whatever comes next.,Lean Right,0,washington-examiner,34.07,11.3
Biden is trying to deny low-income students options and stifle their aspirations.,Lean Right,1,washington-examiner,34.07,11.3
It isn’t a good solution by any stretch to the problem of providing care for the masses.,Lean Right,1,washington-examiner,34.07,11.3
It was his speech that convinced the members to hereafter have a guest speaker at the final dinner.,Lean Right,0,washington-examiner,34.07,11.3
"To me, it is the ultimate experience of democracy in excess.",Lean Right,1,washington-examiner,34.07,11.3
Washington Examiner : Opinion: Hamas is just one part of the threat to Israel and the West Washington Post : Israel has vowed to destroy Hamas.,Lean Right,0,washington-examiner,34.07,11.3
"Both Georgia and Pennsylvania’s courts, specifically the Pennsylvania Supreme Court and the Philadelphia Court of Common Pleas, shared the No.",Lean Right,0,washington-examiner,34.07,11.3
"That is, he held out for many, many months, hurt our national security, caused discombobulation to so many military families who have been so dedicated to our country, and didn't get anything he wanted.",Lean Right,1,washington-examiner,34.07,11.3
"CLICK HERE TO READ MORE FROM THE WASHINGTON EXAMINER Despite how much the two candidates lambast each other, Trump is still steamrolling his opponents and is not only skipping the fourth GOP debate; he won't even be holding a counterevent to distract attention.",Lean Right,1,washington-examiner,34.07,11.3
That the Biden administration is reticent to improve security at the southern border is strange for reasons of counterterrorism but also politics.,Lean Right,1,washington-examiner,34.07,11.3
Jacquelyn Martin/AP Tuberville had been blocking the nominations since early March in protest of the Defense Department's new abortion policy and has delayed more than 300 top military nominees.,Lean Right,0,washington-examiner,34.07,11.3
"When Fidel's serious health problems in 2006 led to street celebrations in Little Havana, she took no joy.",Right,0,fox-news,35.44,11.06
"That was my experience as a little child, watching an impact that people could have with each other.",Right,0,fox-news,35.44,11.06
"Look, it's time for all of us, conservatives, liberals, independents, to band together and use all legal challenges possible to take back these institutions from the incompetent administrators and the woke radical fringe holding them all hostage.",Right,1,fox-news,35.44,11.06
It also requires the installation of EV charging infrastructure in high-density areas.,Right,0,fox-news,35.44,11.06
"Every time you say good morning, a hug and a kiss.""",Right,0,fox-news,35.44,11.06
"Take, for instance, this man, Siaka Massaquoi, nearly three years after the fact, the feds just picked him up, charged with misdemeanors, including trespassing, disorderly conduct and parading in a Capitol building, parading.",Right,1,fox-news,35.44,11.06
The amount of coal burned in the United States last year was less than half what it was in 2008.,Right,0,fox-news,35.44,11.06
"GET MORE OF MY SECURITY ALERTS, QUICK TIPS & EASY VIDEO TUTORIALS WITH THE FREE CYBERGUY NEWSLETTER - CLICK HERE Kurt's key takeaways HEAP is an impressive example of how robots can use their sensors, intelligence, and skills to accomplish tasks that would be difficult or impossible for humans.",Right,0,fox-news,35.44,11.06
HOW MUCH FLOOD WATER DOES IT TAKE TO DAMAGE A CAR?,Right,0,fox-news,35.44,11.06
We also need to balance our desire for perfection and creativity with our respect for reality and authenticity.,Right,0,fox-news,35.44,11.06
"With the season of Advent 2023 already underway, many people are using Advent calendars to count down the number of days until Christmas.",Right,0,fox-news,35.44,11.06
"Mike Parson in May after Kim Gardner's sudden resignation, announced Wednesday that he is running for a full term in 2024.",Right,0,fox-news,35.44,11.06
"The order incentivized the production of solar energy equipment, transformers, grid components, heat pumps, insulation, electrolyzers, fuel cells and platinum-group metals to achieve carbon emission goals while also seeking to reduce the need for foreign energy sources, particularly from adversarial countries.",Right,0,wnd,13.06,21.0
Is Venezuela an outlaw nation?,Right,0,wnd,13.06,21.0
The committee released bank records that showed at least $20 million went from foreign individual and entities to shell companies owned by Biden family members.,Right,0,wnd,13.06,21.0
"However, Lee was attempting to use this against a witness who was defending herself against her own personal attack.",Right,0,wnd,13.06,21.0
"So, she went into the hall and again told her mother she was not comfortable sharing a bed with a male student.",Right,0,wnd,13.06,21.0
"He boldly makes a case for returning to the American System of domestic tariffs on imports to once again make trade FAIR for the United States.""",Right,1,wnd,13.06,21.0
TRENDING: American ships put in bull's-eye in Mideast The minimum wage in Beijing (the highest in China) is $3.70 per hour.,Right,1,wnd,13.06,21.0
That actually prompted many jurisdictions to ban the use of such outside money in that manner.,Right,0,wnd,13.06,21.0
"To disrupt an individual squad often is to disrupt a network, he said.",Right,0,wnd,13.06,21.0
"This type of power generation is a brilliant idea, which is why countries around the world use this technology.",Right,1,wnd,13.06,21.0
"The Washington Times reported Jordan told Willis, in a letter, ""Recently, the committee became aware of cooperation between your office and the partisan January 6 Select Committee.",Right,0,wnd,13.06,21.0
His scheme would have banned the production and sale of 205 variations of weapons.,Right,1,wnd,13.06,21.0
"GLASSER: Donald Trump is seeking perhaps to taunt these judges to, you know, not only have a gag order, but to seek some enforcement against himself.",Lean Left,1,abc-news,45.25,-2.91
"Biden, who continues to face strikingly poor poll numbers, has shown up at multiple such ceremonies, including in Kentucky.",Lean Left,1,abc-news,45.25,-2.91
"And they're definitely not naked dresses, which make some kind of sense on a red carpet or runway for a sheer, sexy vibe.",Lean Left,1,abc-news,45.25,-2.91
But don't expect him to suit up Sunday against the Texans.,Lean Left,0,abc-news,45.25,-2.91
Knead the dough in the bowl 3 or 4 times to make a smooth dough.,Lean Left,0,abc-news,45.25,-2.91
"Among Asian Americans and Pacific Islanders, Biden's approval rating started in the high 70s but steadily declined through his first year in office and into 2022.",Lean Left,1,abc-news,45.25,-2.91
Associated Press climate and environmental coverage receives support from several private foundations.,Lean Left,0,abc-news,45.25,-2.91
"Authorities blamed the Santa Rosa de Lima cartel, which for years has fought a bloody turf war with the Jalisco cartel for control of Guanajuato.",Lean Left,0,abc-news,45.25,-2.91
"Gemma Chan Gemma Chan attends the 3rd Annual Academy Museum Gala at Academy Museum of Motion Pictures on December 03, 2023 in Los Angeles.",Lean Left,0,abc-news,45.25,-2.91
"CPR was administered but the injuries to the right side of her body were too severe, police said.",Lean Left,0,abc-news,45.25,-2.91
Impala Platinum said that the worker died Sunday from injuries sustained when the elevator plummeted around 200 meters (650 feet) down the shaft of a platinum mine while carrying workers to the surface after their shift on Nov. 27.,Lean Left,0,abc-news,45.25,-2.91
"Prostate cancer screening is notoriously rife with uncertainty, and the previous 2012 guidelines advised against PSA testing.",Lean Left,0,abc-news,45.25,-2.91
"The resurgence of public protests in support of Hamas has revealed a disturbing truth: the left-wing rioting following George Floyd’s death in 2020 was not an anomaly, but a tactic that activists can repurpose for any cause.",Lean Right,1,hotair,24.77,12.78
This simply reflects a reality that people of most income brackets feel insecure financially-with reason.,Lean Right,0,hotair,24.77,12.78
"There’s lots more in there, and Duane is always fun to talk to.",Lean Right,0,hotair,24.77,12.78
"The Texas House is majority Republican and the bill passed there along party lines, 83-61.",Lean Right,0,hotair,24.77,12.78
Elite colleges are quietly slashing the level of donations which can secure admission as mega-donors close their checkbooks to the Ivy League over antisemitism on campus.,Lean Right,1,hotair,24.77,12.78
The State Department spokesman let the cat out of the bag.,Lean Right,0,hotair,24.77,12.78
"It was long rumored in the waning days of the Trump administration that Saudi Arabia was on the brink of signing a deal with Israel, but the COVID pandemic and the resulting change of leadership in the United States in 2020, which reversed course in the Middle East and began to renew relations with Shia-controlled Iran, scuttled all of that.",Lean Right,1,hotair,24.77,12.78
"The administration doesn’t want to secure the southern border and doesn’t want Texas to do it, either.",Lean Right,1,hotair,24.77,12.78
They also note that too many parents don’t ask enough questions when looking at their children’s grades or seek out their teachers for guidance.,Lean Right,0,hotair,24.77,12.78
Will Columbia have the brass cojones to do that and stand up for something worthwhile?,Lean Right,1,hotair,24.77,12.78
"It’s astonishing to watch Holocaust denial form in real time, but we’re watching it happen with regard to Hamas.",Lean Right,1,hotair,24.77,12.78
It’s all fodder for the interminable post-parade when we’re still two months from the starting gate.,Lean Right,0,hotair,24.77,12.78
"Dr. Martin Luther King, Jr. celebrates by ordering his supporters to launch missiles from black neighborhoods into white communities.",Right,1,the-american-spectator,17.46,22.97
"It’s increasingly difficult not to conclude that journalists, particularly the political obsessives, are quantitatively feeble-minded.",Right,1,the-american-spectator,17.46,22.97
Steven Greenhut is Western region director for the R Street Institute.,Right,0,the-american-spectator,17.46,22.97
"To find out more about Veronique de Rugy and read features by other Creators Syndicate writers and cartoonists, visit the Creators Syndicate webpage at www.creators.com.",Right,0,the-american-spectator,17.46,22.97
"When you want to explain to kids why the policy is bullshit, remind them of Dolly’s story.",Right,1,the-american-spectator,17.46,22.97
"That was in 1938, at a time when nearly 90 percent of U.S. farms lacked electricity.",Right,0,the-american-spectator,17.46,22.97
"Preorder Scott’s book Racism, Revenge and Ruin: It’s All Obama here.",Right,1,the-american-spectator,17.46,22.97
Plenty of people discount the Bermuda Triangle as a sailors’ myth but - as with most things of this nature - perhaps that’s simply because they don’t understand it.,Right,1,the-american-spectator,17.46,22.97
They think you’re gullible enough to believe them when they say these things.,Right,1,the-american-spectator,17.46,22.97
The number of respondents who said a Trump conviction would cause them to change their votes would easily erase the swing state leads listed in the first paragraph.,Right,1,the-american-spectator,17.46,22.97
"Then came October, when the Dodgers struck out big time against the D-backs.",Right,0,the-american-spectator,17.46,22.97
"But if not, it is fair to say that America peaked at the beaches of Normandy and Iwo Jima.",Right,1,the-american-spectator,17.46,22.97
Somehow convince voters that he is a viable alternative to Trump and turn around his campaign?,Left,0,the-atlantic,37.96,-9.01
Anderson loves Belle enormously and doesn’t regret her choice to clone.,Left,0,the-atlantic,37.96,-9.01
Her dancers zip and twirl in ways that break with phalanxlike choreo clichés.,Left,0,the-atlantic,37.96,-9.01
"So, baseline: People with long COVID and ME/CFS experience a fatigue that is much more severe.",Left,1,the-atlantic,37.96,-9.01
"A second Trump administration would likely revive the crackdown on environmental science that characterized the first, and it is now hard to imagine Trump lending weight to vaccination or support to the CDC.",Left,1,the-atlantic,37.96,-9.01
"We don’t have a playbook for this, and we don’t have enough time in the 185-day school year to cram in all of the material that was taught pre-pandemic.",Left,0,the-atlantic,37.96,-9.01
"It isn’t easy, now, to reconcile that law-abiding suburban dad, his growing business supported by a federal loan, with the man he has become.",Left,1,the-atlantic,37.96,-9.01
"Frank Zappa was an unruly figure of 1960s rock, a free-speech advocate and devout parodist defined by his opposition to authority.",Left,1,the-atlantic,37.96,-9.01
"Alan Abramowitz, an Emory University political scientist, said the principal reason presidents now appear more capable of surviving discontent about their performance is the rise of negative partisanship.",Left,1,the-atlantic,37.96,-9.01
He told me about times he traveled to Europe to learn more about water management.,Left,0,the-atlantic,37.96,-9.01
"This experience, and his disgust with the hippies and the drug culture and the war protesters, turned Dad into a law-and-order conservative.",Left,1,the-atlantic,37.96,-9.01
That is the amazing American invention that we have all forgotten.,Left,1,the-atlantic,37.96,-9.01
"According to data from US Customs and Border Protection, there has been a drastic increase in illegal activity being committed by illegal aliens since 2021.",Right,1,the-gateway-pundit,14.91,23.64
"Breaking News: Mark Lamb (R) Pinal County AZ Sherriff says that every illegal crossing the border receives a $5,000 gift card.",Right,1,the-gateway-pundit,14.91,23.64
When you’re in the military and you refuse an order like the one reported above you are in a state of rebellion.,Right,1,the-gateway-pundit,14.91,23.64
"UPDATE on UNLV SHOOTING There are at least three victims of the shooting, police said, adding the suspect is dead.",Right,0,the-gateway-pundit,14.91,23.64
Last year the US spent approximately $451 billion to take care of Joe Biden’s illegal invaders.,Right,1,the-gateway-pundit,14.91,23.64
"WATCH: BREAKING NEWS: Dwayne The Rock Johnson is currently meeting with some of the military cadre at the Pentagon, this is just days after The Rock’s interview where he confirmed that ‘the parties’ wanted him to run for president.",Right,0,the-gateway-pundit,14.91,23.64
"It will provide a wonderful new excuse to reach into our pockets and rob us of your hard-earned money, then using that stolen money to hire more bureaucrats whose sole purpose will be to disrupt the middle-class lifestyle while creating new barriers for poor people seeking to rise up into the middle class.",Right,1,the-gateway-pundit,14.91,23.64
"Millions of Americans watched in horror this week as the presidents of Harvard, MIT and Penn testified before Congress about the vile anti-Semitism we have seen on their campuses in recent weeks.",Right,1,the-gateway-pundit,14.91,23.64
"If you see an issue in your communities and want to hold your government officials accountable, what is stopping you from asking questions about it?",Right,0,the-gateway-pundit,14.91,23.64
She will be missed by all those who knew and loved her.,Right,0,the-gateway-pundit,14.91,23.64
"According to the committee, the so-called asylum seekers who enter the US illegally are costing the government $451 billion a year.",Right,1,the-gateway-pundit,14.91,23.64
"We trust the American people to decide what is right - it is not the job of the media to tell people what they should believe, it is the job of the media to inform.",Right,0,the-gateway-pundit,14.91,23.64
"Should she show up, she is likely to get a well deserved taste of the condemnation she allowed others to suffer unjustly.",Left,1,daily-beast,33.54,-10.51
"Businessman Jaime del Burgo, a Spanish/British entrepreneur who dated Letizia before she married Felipe in 2004 and who then married Letizia’s sister in 2012, claimed on X over the weekend that he and Letizia had romantic assignations after she married the now King Felipe.",Left,1,daily-beast,33.54,-10.51
"In the Account Info section, there’s a field for your password.",Left,0,daily-beast,33.54,-10.51
"Just like his obsession with denying he lost the 2020 election, Trump is putting his own selfish interests ahead of the Republican Party’s interests.",Left,1,daily-beast,33.54,-10.51
"Modified on: Fri, 7 May, 2021 at 6:41 PM Yes, you can.",Left,0,daily-beast,33.54,-10.51
She is also on the board of the Central Florida Tourism Oversight District that Gov.,Left,0,daily-beast,33.54,-10.51
"While our early release is live, additional features will be added throughout the year, which will include more content and accessibility.",Left,0,daily-beast,33.54,-10.51
Speaker Johnson must at least feign that he is pushing this impeachment threat as far as he can.,Left,1,daily-beast,33.54,-10.51
"Arriving on a ship from the African wilds where he was raised by his beloved late mother (Sally Hawkins), the twentysomething impresario lands in an unidentified city whose elaborately designed and embroidered architecture and décor recall Babe: Pig in the City by way of Amélie, Big Fish, Harry Potter, Peter Pan, and even Mr. Magorium's Wonder Emporium, the last of which is particularly galling given that it’s a second-rate Dahl knock-off.",Left,1,daily-beast,33.54,-10.51
"If this sounds crazy and counterintuitive, it’s only because we live in crazy times.",Left,1,daily-beast,33.54,-10.51
"However, he remains, relatively speaking, more interesting than all of Chalamet’s wan eccentricity, Lane’s cherubic blandness, and the cavalcade of computer-generated giraffes, flamingos, and cocoa geysers that dominate the proceedings.",Left,1,daily-beast,33.54,-10.51
"If you only need to update the expiration date on your current credit card, click here for those steps.",Left,0,daily-beast,33.54,-10.51
"Healers, as you might have guessed, can equip players with buffs while also replenishing their health.",Lean Left,0,the-independent,38.37,-6.99
"The police are a whole scandal in themselves, failing to bother with vast numbers of crimes, and even committing crimes themselves, without compunction.",Lean Left,1,the-independent,38.37,-6.99
"What little information we have suggests that Musk’s vaunted premium service, formerly known as Twitter Blue, has not been widely adopted and is nowhere close to making up for the loss of ad revenue.",Lean Left,0,the-independent,38.37,-6.99
"Meanwhile, Gazzetta adds that Ferrari talks are ongoing with Carlos Sainz, whose deal also runs out at the end of 2024.",Lean Left,0,the-independent,38.37,-6.99
"They’re rugged and ambitious, in genuinely wild and craggy-feeling settings, but all a short train, plane or ferry from the UK.",Lean Left,0,the-independent,38.37,-6.99
"Doddie Weir has passed away since Sinfield’s last challenge (PA) Weir brought hope to Burrow after his diagnosis, and represented the MND community with charm and character, and through his own inspirational fundraising efforts.",Lean Left,0,the-independent,38.37,-6.99
"Best for romantic couples retreats: Gilpin Hotel & Lake House Location: Cumbria Gilpin Hotel Spa Lodge (Gilpin Hotel & Lake House) This country house has been modernised and extended to offer extra luxury, privacy and a spa, which suits couples looking for a boujie escape.",Lean Left,1,the-independent,38.37,-6.99
"The extended free trial can be stacked with any existing free time you’ve already got, so if you’re currently on a three month trial (which comes free with most new Apple devices) you could potentially extend your Apple TV+ trial up to nine months.",Lean Left,0,the-independent,38.37,-6.99
Voucher codes If you’re looking for discounts on technology or videogames then try one of these codes: Looking to get your hands on the latest Nintendo console?,Lean Left,0,the-independent,38.37,-6.99
Or are there other chocolate bars out there you’d rather see get the chop?,Lean Left,1,the-independent,38.37,-6.99
They lost key players such as Sander Berge and Iliman Ndiaye ahead of their return to top-flight football.,Lean Left,0,the-independent,38.37,-6.99
"The building’s importance can be seen in the four separate sections of the house built around squares, one for the sheikh, one for his family, one for guests and another for servants.",Lean Left,0,the-independent,38.37,-6.99
"The narrative, shot in black-and-white until it switches to color halfway through, is often choppy and vertiginous.",Center,0,christian-science-monitor,44.22,-2.47
