text,source_party,label,source,reliability,bias
"Chinstrap Penguins walk on the stone beach of Half Moon Island, a minor subantarctic island, lying about 120 kilometers (75 miles) north of the Antarctic Peninsula.",Lean Right,0,new-york-post,31.92,9.28
Me locking myself away in my house for a lot of years-I’ll never get that time back.,Lean Right,1,new-york-post,31.92,9.28
"Chef and restaurateur Eileen Andrade spent the last three years transforming her small Cuban diner, Amelia’s, into the atmospheric, decidedly retro Amelia’s 1931.",Lean Right,0,new-york-post,31.92,9.28
"Unlike Trump, she is Republican born and bred and always been in the party.",Left,1,new-york-daily-news,40.47,-8.12
"With all Democrats expected to oppose impeachment, Johnson can lose no more than three of his 221 Republican lawmakers to pass the inquiry.",Left,0,new-york-daily-news,40.47,-8.12
He allegedly ordered Benitez not to contact the monitor or answer questions from Deputy Monitor Anna Friedberg.,Left,0,new-york-daily-news,40.47,-8.12
"Benitez’ allegations, reported Tuesday by the Daily News, are contained in a notice of claim filed with the city Comptroller’s office.",Left,0,new-york-daily-news,40.47,-8.12
"The reality TV personality, who previously touted the benefits of Ozempic, recently revealed that the FDA-approved injectable landed her in the hospital with severe constipation.",Left,0,new-york-daily-news,40.47,-8.12
"Jeff Zarrinnam, from left, Kathy Najimy, Gary Marsh, Kenny Ortega, Jennifer Grey and Rana Ghadban pose with during a ceremony honoring Kenny Ortega with a star at the Hollywood Walk of Fame on Wednesday, July 24, 2019, in Los Angeles.",Left,0,new-york-daily-news,40.47,-8.12
The T.J. Holmes/ Amy Robach fiasco just got another plot twist.,Left,1,new-york-daily-news,40.47,-8.12
"Stearns isn’t necessarily looking for more left-handed relievers, but he is looking for relievers who can pitch to lefties.",Left,0,new-york-daily-news,40.47,-8.12
Homemade croutons crisped up in the oven with olive oil are another good addition.,Left,0,new-york-daily-news,40.47,-8.12
And it has now been learned that hostages have been hidden by UN employees to prevent their rescue by Israel.,Left,1,new-york-daily-news,40.47,-8.12
"If Israel can be truncated, it can be brought to heel, for it will be unable to protect itself.",Right,1,american-thinker,13.67,24.85
"It calls to mind the statement of the Carter Center, which, in the wake of Venezuela's fraud-filled 2004 referendum that it was the official observer on (appointed by George W. Bush), which in its final report declared something to the effect that with the exception of what went on in the totalization room, all was free and fair, blissfully unaware of how naive that sounded.",Right,1,american-thinker,13.67,24.85
"As a consequence, the 1994 midterm put the Republicans back in control of Congress for the first time in 40 years.",Right,0,american-thinker,13.67,24.85
Such a parallel monetary ecosystem might prove the only effective way of preserving the American idea of individual freedom.,Right,0,american-thinker,13.67,24.85
Donald Trump wasn’t on the ballot in either of the last two elections.,Right,0,american-thinker,13.67,24.85
The Russian-Iranian partnership offers mutual support for aggression both in Europe and the Middle East.,Right,1,american-thinker,13.67,24.85
"Every day, we hear of Christians who are attacked and/or arrested for practicing their faith in one of the many Muslim countries where they are a small minority.",Right,1,american-thinker,13.67,24.85
"Israel’s gun-control policies are much stricter than those of other countries typically known to be anti-gun, including Australia and England, says Stern.He believes that recent media narratives paint an all-too-forgiving picture of the willingness of Israeli leaders to arm and protect their citizens.",Right,1,american-thinker,13.67,24.85
"Opinion polls are just a snapshot in time, and a year before the election, much can change.",Right,0,american-thinker,13.67,24.85
"Nikki Haley, biotech entrepreneur Vivek Ramaswamy and former New Jersey Gov.",Right,0,washington-free-beacon,23.47,14.45
That is the contradiction at the heart of this sordid enterprise.,Right,1,washington-free-beacon,23.47,14.45
"It shows you what their priorities are and who they want to target.""",Right,1,washington-free-beacon,23.47,14.45
"Haley had previously suggested that social media users should be verified by name, to prevent foreign adversaries from using fake accounts to launch influence operations in the United States.",Right,0,washington-free-beacon,23.47,14.45
"Since the 1990s, Microsoft has entered into dozens of partnerships or cooperative agreements with various Chinese government entities, records show.",Right,0,washington-free-beacon,23.47,14.45
"With his trademark directness in describing the facts and his wry humor, Sowell is always a pleasure to read; despite the slim size of this volume, it contains a thorough debunking of the fallacies noted in the title.",Right,0,washington-free-beacon,23.47,14.45
Your attempt date is April 16-and your birthday is April 20.,Left,0,esquire,27.41,-18.14
"But even with reactionary forces on the march across the United States and Britain’s added economic troubles, we all know the answers.",Left,1,esquire,27.41,-18.14
"For all your luxury and designer needs, turn to Mr. Porter.",Left,1,esquire,27.41,-18.14
"CNN - The news last week of money laundering charges against crypto exchange Binance and its CEO, Changpeng Zhao, sent shockwaves through both financial markets and crypto consumers alike.",Lean Left,0,cnn,42.06,-6.28
"Besides that, electric vehicles tend to be higher priced models with more sophisticated technology features, from additional safety sensors to more gadgets and doo-dads.",Lean Left,0,cnn,42.06,-6.28
"Fossil fuel employees and representatives received more passes to COP28 than all the delegates from the 10 most climate-vulnerable countries combined, according to the research.",Lean Left,0,cnn,42.06,-6.28
Trump’s efforts to target Obamacare are not about providing Americans better health care.,Lean Left,1,cnn,42.06,-6.28
The sordid Santos saga may have tarred the GOP brand in the district.,Lean Left,1,cnn,42.06,-6.28
"The truth is, though, simply selling albums almost seems quaint now as a benchmark of Swiftian achievement.",Lean Left,0,cnn,42.06,-6.28
"Putin, with his high tolerance for enormous Russian casualties, looks ready to fight a war of attrition to bleed his enemy dry and to await political change in the US and Europe that will slowly strangle Ukraine’s military.",Lean Left,1,cnn,42.06,-6.28
"But even before the Lawrence injury rocked the entire atmosphere at EverBank Stadium, Jacksonville found itself tied with the Bengals late in the fourth quarter with backup-turned-starter Jake Browning playing the game of his life.",Lean Left,0,cnn,42.06,-6.28
"There, marchers joined an ongoing candlelight vigil and protest in front of a controversial housing project.",Lean Left,0,cnn,42.06,-6.28
Drop a couple of actors doing top-notch work into this dreary world and you’ve got a film that may sound like a drag but isn’t.,Center,0,az-central,42.22,-7.0
While ASU now finds itself going head-to-head with a regional No.,Center,1,az-central,42.22,-7.0
"While the days bring hunger and thirst, the nights are worse.",Center,0,az-central,42.22,-7.0
Now comes this 14th Amendment stunt to reinforce those beliefs in order to get President Joe Biden reelected.,Center,1,az-central,42.22,-7.0
"Salpointe Catholic, 2013 This came the same year as Mountain Pointe's monster season at the top level.",Center,0,az-central,42.22,-7.0
"According to its data, so far this year, the Arizona Humane Society's records state they have opened nearly 10,000 animal abuse investigations and received over 15,000 calls for service.",Center,0,az-central,42.22,-7.0
Ring in the new year with this Sequin Faux Wrap Mini Dress from Maurices that rests above the knee and elongates the legs for a sleek and sultry look.,Center,1,az-central,42.22,-7.0
The academically and physically rigorous program remains competitive with a decent waitlist.,Center,0,az-central,42.22,-7.0
The election will be decided by tens of thousands of voters in just a handful of states.,Left,0,salon,32.38,-13.86
"Her hair isn’t done up specially, it’s pulled back and off her face.",Left,0,salon,32.38,-13.86
"This can also be served on its own volition or with your favorite, go-to holiday potatoes , carbs or starch.",Left,0,salon,32.38,-13.86
When used by non-Black people these cultural words can become bastardized versions of themselves.,Left,1,salon,32.38,-13.86
"Amy describes Alexander as brilliant and intense, a skateboarder and a young entrepreneur who ran his own eBay shop selling his old toys.",Left,0,salon,32.38,-13.86
"Four years after her 1981 appointment, O'Connor issued a ten-page dissent in Tennessee v. Garner .",Left,0,salon,32.38,-13.86
Enjoy these creme-filled cookies on their own or alongside a hot cup of coffee (or tea!).,Left,0,salon,32.38,-13.86
So anyone who is trying to give anyone ... 7 Recs Why Does it Take Liz Cheney to Say What Biden and All Democrats Should Be Saying?,Left,1,daily-kos,28.4,-17.51
"And even if he does, that may not be enough to save him.",Left,1,daily-kos,28.4,-17.51
Petersen emphasizes that she and her fellow moderators receive no compensation.,Left,0,mother-jones,37.08,-15.12
This kind of can go back to a general trend in the media of both-sidesism.,Left,1,mother-jones,37.08,-15.12
"Decades ago, scientists identified genetic variations that enhance resistance to the virus that causes Marek’s disease, a common and highly contagious illness that produces paralysis and tumors.",Left,0,mother-jones,37.08,-15.12
"Chase fell for the ruse, though, and just like that, her frenetic energy shifted to despair.",Left,0,mother-jones,37.08,-15.12
This type of conversation-an adult treating her like an adult-was new to Edwards.,Left,0,mother-jones,37.08,-15.12
"Bridget Ziegler, who admitted that she had been involved in a sexual encounter with her husband and the alleged victim, has been widely criticized for her outspoken opposition to LGBTQ-inclusive curriculum and books-while also being involved in a bisexual relationship.",Left,0,mother-jones,37.08,-15.12
"As options in Mexico became increasingly constrained, the US Supreme Court in 1973 established the constitutional right to an abortion in its Roe vs. Wade decision.",Left,0,mother-jones,37.08,-15.12
We asked our readers for stories about their experiences with Individualized Education Programs (IEPs): My son is dyslexic.,Left,0,mother-jones,37.08,-15.12
"Today, Mexicans are helping Americans procure abortion services, but in the past, the roles have been reversed-a consequence of the influence of money, politics, and religion in each country.",Left,1,mother-jones,37.08,-15.12
"On Twitter and in her newsletter, she speaks out against policies that she considers hateful-abortion bans, for instance, and rules that seek to limit gender-affirming medical care.",Left,0,mother-jones,37.08,-15.12
"Nodine denied ever having sexually assaulted or harassed Chase and was never criminally charged, but he agreed to settle for an undisclosed amount.",Left,0,mother-jones,37.08,-15.12
"Their collaborative approach mirrored the collective creativity of samba,as well as the leftist orientation toward collectivism and solidarity over individualism and competition.",Left,1,current-affairs,34.3,-18.14
This becomes clear when you discover who is paying to put all those billboards up-and what other causes he pours money into which aren’t so inspiring.,Left,1,current-affairs,34.3,-18.14
"If the language of capitalism is designed to obscure the relationship between consumers and the workers on whom they depend, then progress requires that we develop a language that re-establishes this connection.",Left,1,current-affairs,34.3,-18.14
"Even on that very slight acquaintance-and this is something that immediately stands out about him-Adolph Reed is so damn funny, often in the context of elegantly slamming whatever person or faction has most recently earned his scorn.",Left,1,current-affairs,34.3,-18.14
"The Times provided a colorful report of the Battle: About 4 p.m. [the antifascists] decided to hold an indignation meeting in the street, at which they denounced the police and the Sons of Italy and voiced their claims that since the shrine had been dedicated with funds contributed by Italian-Americans generally, they had as much right to hold services at the Garibaldi statue as the Sons of Italy.",Left,0,current-affairs,34.3,-18.14
"To combat this campaign against our collective understanding of how the economy actually works, we must begin acknowledging the human workers who often go uncredited in our consumerist discourse.",Left,1,current-affairs,34.3,-18.14
But a lot of the history you lay out in The Hundred Years’ War on Palestine is very much still buried.,Left,0,current-affairs,34.3,-18.14
"And more important, they think he’s saying something that a great many people of his generation actually believe, that the true philosophers of popular music could only be the Bob Dylans, the Mick Jaggers, and The Beatles, etc., and they just don’t want to look at themselves in the mirror and say to themselves they believe that because these people are white and male.",Left,1,current-affairs,34.3,-18.14
Then the discussion is about workers beginning to dream and bringing their serious expertise from 10 or 20 years on the job.,Left,0,current-affairs,34.3,-18.14
This is good: we need public spokespeople for labor who demonstrate what it looks like to be an ordinary working class person fighting to improve their station.,Left,1,current-affairs,34.3,-18.14
"So, if you take all of these issues together, my sense is that if you were to summarize Hamas’ strategic objective in one phrase, it would be to irrevocably shatter the status quo.",Left,1,the-intercept,37.46,-14.1
"But after decades of lobbying, spin, and deceit, some now question whether the fossil fuel industry can ever be an ally in the fight against the climate crisis.",Left,1,the-intercept,37.46,-14.1
"Kissinger, while Jewish, was happy to work for Nixon, perhaps the most volubly antisemitic president in U.S. history, which is saying something.",Left,1,the-intercept,37.46,-14.1
But the viral story of bigotry from Bernie supporters had done immense damage.,Left,1,the-intercept,37.46,-14.1
"But to pretend that the context of this violence is irrelevant is as absurd as it is unjust, given the appalling conditions Palestinians have lived under for decades.",Left,1,the-intercept,37.46,-14.1
The report noted that the contractors paid by the government had failed to provide upkeep on critical military equipment that could have just as easily been used by the U.S. military.,Left,0,the-intercept,37.46,-14.1
"Google, in its email, wrote that a court order had previously prohibited the company from notifying her about the request.",Left,0,the-intercept,37.46,-14.1
"So, if one percent of the population has been killed within a month, and we’re nowhere close to the end of this, how far is this going to go?",Left,1,the-intercept,37.46,-14.1
"According to her lawsuit, the experience left her with post-traumatic stress disorder, suicidal ideations, and medical bills for in-patient counseling she sought for her PTSD.",Left,0,the-intercept,37.46,-14.1
"Prior reporting found that, rather than request phone location data through a search warrant, CBP simply purchased such data from unregulated brokers - a practice that critics say allows the government to sidestep Fourth Amendment protections against police searches.",Left,1,the-intercept,37.46,-14.1
"According to the indictment, Gupta was arrested in the Czech Republic in late June.",Left,0,the-intercept,37.46,-14.1
And these are the two sorts of narratives that have started to bleed out in the Israeli media.,Left,1,the-intercept,37.46,-14.1
"Years after she left Texas, Karianne caught wind that Charles was fighting his conviction, claiming he was innocent.",Left,0,the-intercept,37.46,-14.1
"He brought on heavyweight Democratic campaigner Jim Margolis and his strategic communications firm GMMB, which had just helped Barack Obama take the White House.",Left,0,the-intercept,37.46,-14.1
Jordan Smith: You might recall that Franklin had bad arthritis and that she couldn’t get around the house without her shoes on.,Left,0,the-intercept,37.46,-14.1
"Nina is desperate to land the lead in a production of Swan Lake, but there’s a catch: Thomas wants the same person to dance the part of the virginal White Swan and her dark and earthy double, the Black Swan.",Left,0,slate,35.17,-12.93
"The work advanced slowly thanks to the master’s insistence on using hand-drawn 2D animation for every frame (working with a team of about 60 co-illustrators), and was later delayed by the COVID-19 pandemic.",Left,0,slate,35.17,-12.93
"Ten fingers, 10 toes, steady breathing, good tone, strong cry, no defects, two small café au lait spots on her thigh-just beauty marks.",Left,0,slate,35.17,-12.93
"ESPN’s bleak forecast came to mind during a recent Aaron Rodgers appearance on The Pat McAfee Show, the irreverent eponymous program of the former NFL punter turned ESPN’s answer to Barstool Sports.",Left,1,slate,35.17,-12.93
Microsoft would get OpenAI’s geniuses in a manner that raised no antitrust red flags-a valuable thing to a company that just fought regulators almost to the death for a big video game deal.,Left,1,slate,35.17,-12.93
"The water seems to give him some sort of man mojo, and a sudden, unexplained flair for dominance and sadism.",Left,1,slate,35.17,-12.93
"Taking a closer look at these 790 movies, it’s true that 25 of them were entries in the 007 franchise.",Left,0,slate,35.17,-12.93
"The ragtag group of failed intelligence agents falls under the exhausted eye of one Jackson Lamb-played by an excellent, funny Gary Oldman-a former Cold War agent too over it and traumatized from his years in the service to be of much use to anyone who needs something from him.",Left,0,slate,35.17,-12.93
"Several justices love scrapping with Prelogar, but Gorsuch takes the practice to new heights; the often cranky justice sounds delighted, even charmed, when rebutted by the solicitor general.",Left,1,slate,35.17,-12.93
"American roads are not race tracks, and American drivers are not professional athletes with years of experience driving at dangerous speeds.",Left,0,slate,35.17,-12.93
"She seems to think that feeling bad about the exes is out of bounds, so her resentment is coming out in other ways-such as feeling like her partner needs to put in the same level of emotional acrobatics to keep things fair.",Left,1,slate,35.17,-12.93
When he doesn’t even have to put a face to his claims?,Left,1,slate,35.17,-12.93
"But we are just dealing with one big argument constrained to one belligerent person, and a bunch of relatives some of whom you actually like, and some who are in a gray area.",Left,1,slate,35.17,-12.93
Knowing that they are under constant surveillance changes how people behave.,Left,0,slate,35.17,-12.93
Or maybe women are simply designed to handle incredible bodily insults around childbirth.,Left,1,slate,35.17,-12.93
"For Wiley, that meant spending more time in radiology and looking at imaging-experience that, as he points out, is applicable to every field, not just procedural subspecialties.",Left,0,slate,35.17,-12.93
"And he’s now the preeminent loudmouth at the center of College Gameday, one of ESPN’s most venerable and celebrated productions.",Left,1,slate,35.17,-12.93
"Irish actress Nicola Coughlan parlayed her role in that show into work on Bridgerton-she will be the lead of an upcoming season-as well as a spot in one of 2023’s most enviable ensembles, Greta Gerwig’s Barbie.",Left,0,slate,35.17,-12.93
"No one puts much stock in the so-called Slow Horses, which is perhaps why they’re always exceeding expectations.",Left,0,slate,35.17,-12.93
"He and his administration were engulfed in a dramatic, hilarious scandal in which his aides were accused of creating traffic jams in a town whose mayor wouldn’t endorse him.",Left,1,slate,35.17,-12.93
"And like ... he is a bit of a shower, sure!",Left,1,slate,35.17,-12.93
"On November 8, Gwinnett Magistrate Court issued six felony warrants for Hayes’ arrest based on six of the complaints, including Wilson’s.",Lean Left,0,atlanta-journal-constitution,44.83,-3.84
Baugh had been recruited to crochet a quilt that would be mounted on the back of the main piece to make it double-sided.,Lean Left,0,atlanta-journal-constitution,44.83,-3.84
"He said the company does not routinely keep heart monitoring data, but for inmates with known heart conditions may do so for 90 days.",Lean Left,0,atlanta-journal-constitution,44.83,-3.84
"Without complaints or registration, it is difficult for authorities to even know there is bad behavior to monitor.",Lean Left,0,atlanta-journal-constitution,44.83,-3.84
"Led by CCPS Foundation Executive Director Nina Packer and CCPS Foundation Board Chair Hayelom Tadesse the Foundation presented the $25,000 in the JHS band room.",Lean Left,0,atlanta-journal-constitution,44.83,-3.84
But the energy interests that sent representatives said the fact that they account for a big part of the world's emissions is the very reason they need to be there.,Lean Left,0,atlanta-journal-constitution,44.83,-3.84
"Crews with Atlanta fire responded around 6:20 a.m. to a structure fire in the 600 block of Tazor Street, according to Battalion Chief Derek Hullender.",Lean Left,0,atlanta-journal-constitution,44.83,-3.84
Majority Leader Charles E. Schumer (D-N.Y.) changed his yes vote to no to bring the resolution forward again.,Lean Right,0,fiscal-times,43.33,-4.18
"His lack of close ties has contributed to some Republicans going rogue on votes - particularly vulnerable incumbents, who had fealty to McCarthy for bringing them into the majority and would often take tough votes for the sake of projecting party unity.",Lean Right,1,fiscal-times,43.33,-4.18
"He ultimately recruited more diverse candidates to run in districts with high minority populations and pulled the levers against far-right MAGA candidates in primaries in hopes of not just building a large majority, but one focused on governing.",Lean Right,1,fiscal-times,43.33,-4.18
"The House currently consists of 221 Republicans, 213 Democrats and one vacancy, with Rep. George Santos (R-N.Y.) expelled Dec. 1.",Lean Right,0,fiscal-times,43.33,-4.18
"Boyle also noted that some Republican presidential candidates, including former South Carolina Gov.",Lean Right,0,fiscal-times,43.33,-4.18
New York Fed President John Williams said Thursday morning that the central bank will probably hold off on any further interest rate increases.,Lean Right,0,fiscal-times,43.33,-4.18
"When there is the potential for a shortage, drug manufacturers are required to notify the F.D.A.",Lean Right,0,fiscal-times,43.33,-4.18
"Johnson Gets a Win on Government Funding, With a Big Help From Democrats The House on Tuesday passed a short-term funding bill that would keep the government open into early next year.",Lean Right,0,fiscal-times,43.33,-4.18
"The combination of quality issues and panic buying is precisely what has produced shortages of two major chemotherapy drugs, carboplatin and cisplatin.",Lean Right,0,fiscal-times,43.33,-4.18
"To end the stalemate, McCarthy made the fateful decision to lower the threshold needed to call for the ouster of a speaker to one lawmaker and made myriad promises on spending to appease enough members of the far-right flank.",Lean Right,1,fiscal-times,43.33,-4.18
"Payments resumed in October Borrowers were required to restart making their federal student loan payments in October for the first time in three-plus years after the pandemic-related pause, which essentially froze borrowers’ accounts, came to an end.",Lean Right,0,fiscal-times,43.33,-4.18
"Senate Democrats aren’t closing the door but continue to argue the GOP needs to move toward a compromise rather than sticking with pursuing tough asylum, parole and detention policies while.",Lean Right,1,fiscal-times,43.33,-4.18
"While there was broad bipartisan support for Ukraine after Russia invaded in February 2022 - as well as widespread public displays of support for Ukraine - interest in the war among the American public has waned considerably, especially as it has ground to a stalemate with no clear end.",Lean Right,1,fiscal-times,43.33,-4.18
"The failed vote highlighted waning support in the United States for continuing to fund Ukraine’s war effort at a perilous time in the conflict, with Kyiv’s counteroffensive failing to meet its objectives and Russia’s forces on the offensive.",Lean Right,0,fiscal-times,43.33,-4.18
"This narrowing could spare government the worst-case scenario, in which taxation of all such ambiguous categories of income would be found to be unconstitutional.",Lean Right,0,fiscal-times,43.33,-4.18
"If Michigan is serious about boosting our economy and population, we cannot afford to roll the dice with this policy change.",Lean Left,1,detroit-free-press,43.46,-5.43
"And this year, each team is wearing special uniforms: The Army will honor the hard-fighting, dog-faced soldiers of the 3rd Infantry Division, and the Navy will recognize the Silent Service, the stealthy and lethal submarine force.",Lean Left,0,detroit-free-press,43.46,-5.43
Houston's defense that allows almost nothing to opposing teams will be what forces this game Under 140.5 total points.,Lean Left,0,detroit-free-press,43.46,-5.43
