text,source_party,source_name,label,sentence_id,source,reliability,bias
"The money was then used to win passage of the tainted energy bill, House Bill 6, and to conduct what authorities have said was a $38 million dirty-tricks campaign to prevent a repeal referendum from reaching the ballot.",Lean Left,abc-news,1,8c30191f-976e-49c2-8eb2-ef1cfa2c0742,abc-news,45.25,-2.91
Alicia Zheng and Kaz Fantone produce the Dear Life Kit video series for Instagram.,Lean Left,npr,0,8bc0888f-45ac-4110-ac48-34271ac90c2c,npr,42.99,-4.27
The 30-year-old bludgeoned seven sixes and four boundaries in his unbeaten innings of 109 to steer his side over the line with seven balls to spare.,Lean Left,the-independent,0,17b88289-c97a-4e2d-950d-c19fa227a1d8,the-independent,38.37,-6.99
"Plus, there were supposed to be two repositories, so that one state wouldn’t be stuck with an entire nation’s nuclear waste.",Lean Left,the-verge,0,848c72cf-e352-4f55-af7d-df41c6ea0a3b,the-verge,39.43,-4.75
"Please try again later {{ /verifyErrors }} House prices have fallen in every local property market in South and East England this year, as higher mortgage rates have weakened demand for new homes, figures have shown.",Lean Left,the-independent,0,f31616bd-0a00-4848-94e0-d59ea5b8d9c1,the-independent,38.37,-6.99
"Jennifer Lopez in a scene from ‘Hustlers’ (AP) Justin Timberlake - Inside Llewyn Davis (2013) Justin Timberlake may be a good singer, but he is, all too often, a truly atrocious actor.",Lean Left,the-independent,1,96bb76f2-3cac-4688-9edd-e156cc5d5884,the-independent,38.37,-6.99
This is Apple Apple-ing - introducing an arbitrary way to differentiate the upgrade models (and upsell you in the process).,Lean Left,the-verge,1,dd1402bc-2252-4474-98dd-66692d8e090e,the-verge,39.43,-4.75
"Should an attempt be made to push Palestinians out of Gaza, these refugees would, in effect, be enduring a secondary ethnic cleansing.",Lean Left,the-conversation,1,a0c11af1-997d-425f-812c-374331db7e33,the-conversation,40.75,-4.86
"It took until Monaco for them to, finally, ditch the unique and ineffective no-sidepod philosophy.",Lean Left,the-independent,1,5036ac15-ca0f-490d-908b-78ae6820e901,the-independent,38.37,-6.99
"The lopsided spending on ads, many targeting younger users, coincides with a growing skepticism of Israel among young Americans.",Lean Left,politico,0,3a0f31c4-2a1d-4982-98e5-172ab48912a8,politico,42.32,-5.58
"Miss Manners: Yes, my children do have the same father, but by the way ... it’s none of your business!",Lean Left,nj,0,f6d6bd62-3a0c-4904-8efe-30e0a5b8df81,nj,43.92,-2.88
"How much to give is a tricky question, and hardliners argue that sticks are anyway preferable to carrots.",Lean Left,the-economist,0,c470fee5-1d94-4af6-9662-643c7afef5cf,the-economist,42.4,-1.43
"They explored the backgrounds of these conflicts, and analysed the reasons behind the challenges encountered in reaching solutions for them.",Lean Left,al-jazeera,0,12091297-b6c7-47b8-bb29-6341678eb94c,al-jazeera,41.34,-7.05
"Strained tomatoes, such as from Pomi, are a similar, excellent option.",Lean Left,san-diego-uniontribune,0,3eab3eb3-11e8-44be-a0f4-45749b1b0c86,san-diego-uniontribune,45.68,-1.76
"And the Yankees will likely have a Soto-sized hole in the lineup by next year, simply because he’s a free agent.",Lean Left,usa-today,0,b990bd3b-699a-4a5a-91ab-7d8e17870203,usa-today,40.78,-4.12
Win McNamee/Getty Images ‘Some of his most celebrated ideas ... look a bit nutty and more than a bit reckless in retrospect.’ BY RAJAN MENON Rajan Menon is the director of the Grand Strategy Program at Defense Priorities.,Lean Left,politico,1,443f6aed-4d1d-43bc-82b9-0dfc1a8d76f6,politico,42.32,-5.58
The chasm between the haves and have-nots is about to become more profound than any time in the history of the sport.,Lean Left,san-diego-uniontribune,1,2e88e5dd-cb93-4d6f-a938-e71c175017c0,san-diego-uniontribune,45.68,-1.76
"There were marked differences between the four UK nations, with England coming out on top, having achieved a mean Pisa maths score of 492 compared with the OECD average of 472, taking England from 17th in the Pisa rankings for maths in 2018 to 11th in 2022.",Lean Left,the-guardian,0,c9ff0524-dae3-49dd-a250-c23916ebb907,the-guardian,40.67,-7.97
"Whatever discomfort is caused by the life she has chosen, she figures it’s probably a good thing that her profession counterbalances her natural tendency toward stasis.",Lean Left,vanity-fair,1,1fec90ed-64fe-4ed4-8a10-056bb5bf64a5,vanity-fair,33.19,-13.87
"Moderates-politically engaged centrists-are most consequential in El Norte where, at 18 percent of the population, they are the largest single Tribe after the Politically Disengaged; they are the least present in Left Coast where, at 12 percent, they are no more numerous than Progressive Activists.",Lean Left,washington-monthly,1,ac96602d-c8fe-4460-aceb-9bf41a9e6a49,washington-monthly,35.78,-12.08
"Meanwhile, even Costco is getting into the gold business, selling 1-ounce bars to its members that often sell out within hours.",Lean Left,cbs-news,0,78f03d91-bf69-4ffd-9c58-54320d00dc05,cbs-news,41.76,-2.84
Spindler also tried to get her daughter English lessons and put her in adult education programs.,Lean Left,usa-today,0,9bcb449d-dd03-4310-bbd6-33fb60dd1776,usa-today,40.78,-4.12
LEVY: I'm afraid that the Biden administration is continuing to encourage Israel to do its worst.,Lean Left,npr,1,b1a7337d-d178-4c42-a66f-324c5a75c9ee,npr,42.99,-4.27
"Now they drove pickups, carried more powerful weapons and fired rockets.",Lean Left,the-economist,1,5caab8b6-c2e4-49c6-b517-7debc115ad23,the-economist,42.4,-1.43
"The hostages are two elderly women who are both Israeli nationals, the center said.",Lean Left,abc-news,0,0c52b7b4-d978-432d-8572-349fa1359d82,abc-news,45.25,-2.91
The sold-out show is taking place at New York City's Madison Square Garden.,Lean Left,cbs-news,0,85f69eda-29eb-4fa1-9979-5f0d8ed14221,cbs-news,41.76,-2.84
"From England to the Philippines, these 15 places around the world traditionally offer up some of the best holiday atmosphere for a Christmas-drenched vacation: Rovaniemi, Lapland, Finland While popular lore would have us believe the North Pole is the official home of Santa Claus and his jolly missus, the Finns would have us believe otherwise.",Lean Left,cnn,0,085a7bee-2fc8-4924-8df6-415763e21b84,cnn,42.06,-6.28
"Because the brittle will be molten in the saucepan, this is not a task well suited for a child’s help.",Lean Left,montana-free-press,1,010ca0b0-994b-4c49-9c6f-93353deb6837,montana-free-press,46.33,-3.8
"Prostate cancer screening is notoriously rife with uncertainty, and the previous 2012 guidelines advised against PSA testing.",Lean Left,abc-news,0,20d109c3-ba01-445d-8338-9cbea2c7de10,abc-news,45.25,-2.91
"And so with all these forces that were at play during the Cold War, it was great for me to have held this position of kind of a righteous indignation with what all these liberal geniuses were up to.",Lean Left,vanity-fair,1,7b471b0d-89a5-431a-a40f-bfff03f3027c,vanity-fair,33.19,-13.87
"Although Hungary only represents 2 percent of the EU population, Orbán can hold the bloc hostage as it is supposed to act unanimously on big strategic decisions - and they hardly come bigger than initiating accession talks with Ukraine.",Lean Left,politico,1,3882e815-e076-45ce-92df-4698fa7e5b8b,politico,42.32,-5.58
These are radical alternatives to the solution most commonly pursued by governments - applying ever-higher surcharges on the incomes from work and a policy of borrowing that has become hugely expensive in the post-Covid era.,Lean Left,the-guardian,1,d21f5ba2-2765-43c2-8376-a2c901c8896c,the-guardian,40.67,-7.97
"Israelis will feel unsafe, so their government will strike Gaza pre-emptively every time Hamas threatens.",Lean Left,the-economist,1,282aef9f-20e4-415c-8df2-3dc82b0da6c9,the-economist,42.4,-1.43
"And while Verstappen’s loyal fans show up decked out in orange wherever he goes, over the past two seasons he’s won with such relative ease, it’s drained some drama from the races.",Lean Left,time-magazine,1,8646926b-3dfe-4da4-b11e-a6123831bb81,time-magazine,41.12,-7.42
He seems petty enough to not want a loser on his ticket.,Lean Left,abc-news,1,983560af-0c1c-46a3-8edc-95fb8c2c6efe,abc-news,45.25,-2.91
What ensues is a perfectly written and performed ode to gay-straight male friendship.,Lean Left,the-guardian,1,684d0b25-3208-4f19-b9fd-412a2e8d522d,the-guardian,40.67,-7.97
But he also said the country and its police should respect the faith of millions of Ukrainians who want to go on worshipping as they did before the full-scale invasion.,Lean Left,npr,0,460b9ed4-c7a7-4472-b784-8a398f9142e7,npr,42.99,-4.27
"What we would have meant by that is he seems gawky, bungling, eager but hopeless, fatally lacking in charisma, wit and social graces.",Lean Left,the-independent,1,ecef6413-0b5c-46aa-9116-0a37695cf70a,the-independent,38.37,-6.99
Members of the far-right coalition have been calling for Israel to re-occupy Gaza and rebuild the settlements that Israel dismantled there in 2005.,Lean Left,the-economist,0,f654fd6f-7704-4c18-a66b-7864a73d5ac4,the-economist,42.4,-1.43
"Making it about himself, but instantly being ashamed that he's made it about himself and instantly switching it back to his younger siblings.",Lean Left,vanity-fair,1,c21c4823-65bc-4931-be16-4152b85cc6e4,vanity-fair,33.19,-13.87
Another result has been what some view as a catastrophic mispricing of assets.,Lean Left,the-economist,0,e3b8adc1-76b3-4024-a5d2-9678a924e29e,the-economist,42.4,-1.43
The reason resistance training has these effects is probably due to a cumulative increase in collagen synthesis.,Lean Left,the-conversation,0,6724b798-58a2-4f7f-a8fa-ff197ffd5bdd,the-conversation,40.75,-4.86
"Along the road leading out of Cizhong, past the dormitories housing the construction workers for the Wunonglong dam, He Zhenghai, a friend of Mr Guo, points to a denuded spot where a village used to be.",Lean Left,the-economist,0,9e42c156-65d4-4d23-bd72-78fb146d7394,the-economist,42.4,-1.43
Photograph: Courtesy: Venice Film festival 44 The Future Tense Semi-dramatised essay film by Joe Lawlor and Christine Molloy explores complicated national loyalties alongside those of an extraordinary rebel.,Lean Left,the-guardian,0,357de8a8-f226-411f-b39f-c45e6447ac87,the-guardian,40.67,-7.97
"On Tuesday, the state’s planning department accidentally revealed the government planned to rezone land around train stations across Sydney to boost density.",Lean Left,the-guardian,0,e4eeaed4-f396-4eff-b402-2540f53db07a,the-guardian,40.67,-7.97
"But since he has been accused of sexual assault and then paid to silence witnesses, there is no reason to suppose he isn’t.",Lean Left,the-guardian,1,78cae89a-a925-4d4d-b849-ae5a7ccc94b1,the-guardian,40.67,-7.97
"They are now bidding more regularly on projects around the world, notes Miguel Stilwell d’Andrade, chief executive of EDP .",Lean Left,the-economist,0,5cbd8f89-4485-41d9-af0d-5df269298422,the-economist,42.4,-1.43
"Baltimore oncologist Thomas Unguru says this is a huge problem for cancer drugs for kids, and those are in particularly short supply.",Lean Left,npr,0,3013cb81-db76-4b76-8af8-e1dc3084489f,npr,42.99,-4.27
Do you think you have more riz than the two of us?,Lean Left,vanity-fair,0,ee2c9980-dbec-4d2d-a9bb-b40c70146200,vanity-fair,33.19,-13.87
An expert explains Article 4 and 5 commitments following missile blast Polish authorities are investigating what they initially believed to be a Russian-made missile blast close to the border with Ukraine.,Lean Left,the-conversation,0,1980e1cb-3750-49ed-8244-178ff3741484,the-conversation,40.75,-4.86
"Wynns’ post went recently viral on X, formerly known as Twitter, in early December after it was reshared by End Wokeness, a provocative, right-wing account that has 1.9m followers.",Lean Left,the-independent,1,43a1d87b-7eeb-4c70-8919-04cfb8c27556,the-independent,38.37,-6.99
"And in the final episode, the track appears one last time, as lawyers who have sued the county are driving around, searching, futilely, for potential plaintiffs who stand to be compensated, if only they can be found.",Lean Left,propublica,1,cd5ce303-1153-408a-84c8-30eb2ac432a4,propublica,47.17,-6.77
Most of the babies in incubators there are connected to mechanical ventilation.,Lean Left,al-jazeera,0,72e4d472-ac2e-454f-890d-c2b9f5c66ce3,al-jazeera,41.34,-7.05
"In rich democracies, especially, divisions over climate are aggravated by populist politicians, who take real problems (such as cost and disruption) and exaggerate them, while claiming that the elite who impose green policies don’t care about ordinary motorists because they cycle to work.",Lean Left,the-economist,1,d63c9aab-791f-4a64-8711-1b0ccdcbd542,the-economist,42.4,-1.43
"Maybe the motion stuff is just failure of imagination on our part, but we’re a lot more excited about biometrics as an input method.",Lean Left,the-verge,1,5029c607-75bb-4049-972b-e29af3ffc87a,the-verge,39.43,-4.75
"Last week, Comer and Jordan accused Hunter Biden of seeking special treatment in requesting a public hearing instead of appearing for a closed-door deposition.",Lean Left,nbc-news,0,920e6ed3-ce1b-40fd-a414-e992108f7d53,nbc-news,43.21,-5.79
So do we all.’ He didn’t seem to realize he’d already gone ahead and contributed his chunk.,Lean Left,vanity-fair,1,373111ed-3e02-48fd-98e5-4adfbc8b1fbb,vanity-fair,33.19,-13.87
"Unfortunately, President Biden and congressional leaders refuse even to discuss these key drivers.",Lean Left,fair,1,dfe81ff2-ae64-44df-a56d-4207f36e6a10,fair,32.6,-19.36
"The 70- to 85-petaled blooms are produced in large clusters on long stems and have a strong, fruity fragrance.",Lean Left,san-diego-uniontribune,0,350585e5-40d6-45ff-a205-945cd22d55ee,san-diego-uniontribune,45.68,-1.76
"Those who think of themselves as being superior to everyone else in this way will inevitably suffer and come to a bad end, and people who have become so precious that they go out of their way to try and be sensitive in the most unpromising situations, trying to capture every moment of interest, however slight, are bound to look ridiculous and superficial.",Lean Left,the-conversation,1,9041f862-1f62-4d76-a1f4-38e22976f7b2,the-conversation,40.75,-4.86
"After witnessing the notorious Battle of the Overpass, where Bennett’s goons beat strikers bloody, Clara told her husband that if he didn’t put an end to these bloody tactics, she would leave him.",Lean Left,detroit-free-press,1,8cec2780-7552-4ecf-a6ea-d74cbc2d3350,detroit-free-press,43.46,-5.43
"The recent events, however, cast a shadow on this narrative, and could prompt the U.S. to reevaluate the partnership.",Lean Left,the-conversation,0,db7a5c69-2b1b-45f9-a09b-b1745f07e341,the-conversation,40.75,-4.86
"There weren’t any complaints of smells upon opening it, which is a good sign: Aeroflow Sleep’s Sleep Science Advisor, Dr. Carleara Weiss, Ph.D., MS, RN, points to such odors as a red flag for chemical compounds.",Lean Left,time-magazine,0,4aed9e5b-b82f-4a28-ad4b-0c1f094b880a,time-magazine,41.12,-7.42
"G ermany mAY pride itself on its fiscal prudence, but over the past fortnight it has been in the grip of a bizarre fiscal panic.",Lean Left,the-economist,1,4c0d11fd-c95e-418a-84f1-dd71c06b6727,the-economist,42.4,-1.43
"That includes a cordless drill, safety goggles and a laser level.",Lean Left,npr,0,18f7e9d5-5396-4b72-a168-bf89189bd01b,npr,42.99,-4.27
"Either way, I’m guessing Google quickly abandoned the idea when it found out Epic CEO Tim Sweeney is also the controlling shareholder.",Lean Left,the-verge,1,8c185a1a-774a-4af5-9ce5-8764268a979d,the-verge,39.43,-4.75
"And that, in a nutshell, is what AimHire works to prevent.",Lean Left,washington-post,1,5af94d3e-b09b-4546-98d8-a9f7d03ef869,washington-post,38.8,-6.85
"On flights from Delhi, India, the economy weight limit is 7kg.",Lean Left,the-independent,0,7a947124-c228-4b51-9b97-38c389f6582d,the-independent,38.37,-6.99
Is this the sign that Israel's ground offensive is about to start?,Lean Left,npr,0,d235dbdb-bde6-4d0c-b8cb-4d912ce8958d,npr,42.99,-4.27
Part of / The best entertainment of 2023 No film could ever hope to fully convey the scale and gravity of the inhumane violence that white colonial settlers and their descendants have inflicted upon North America’s Indigenous people like the members of the Osage Nation for multiple centuries.,Lean Left,the-verge,1,20da4d3d-a798-44e8-913b-148b286e316e,the-verge,39.43,-4.75
Mr Milei was elected on a pledge to take a chainsaw to Argentina’s gargantuan state.,Lean Left,the-economist,1,3e02b6f6-5455-4bd8-a1f5-49c174a71901,the-economist,42.4,-1.43
"He had found it challenging, he went on, to divest himself of fake trappings for Fincher on the set of Mank.",Lean Left,the-guardian,0,e2053db0-8a56-43ee-9356-412b9b571ed1,the-guardian,40.67,-7.97
"Asked to comment on the death threat against Wiener, Bernhuber said he condemned such actions in the strongest possible terms.",Lean Left,politico,0,5e6d335f-66d6-4d3b-84dd-651dc42c58c6,politico,42.32,-5.58
Mr Khan is not eligible to run for parliament due to his conviction in an earlier corruption case that includes a five-year ban on him contesting elections.,Lean Left,the-independent,0,b8eafb91-c19c-42ef-b2c6-19678bd29470,the-independent,38.37,-6.99
"But the single also serves as a hype song for going out in any city, at any place.",Lean Left,washington-blade,0,453b5fae-173e-4913-86b8-9532eed2eceb,washington-blade,42.71,-7.49
"And why, given he was one of the first senior figures to recognise the potential of the world’s sport in politics, would he not be turning them in football?",Lean Left,the-guardian,1,cbf8b7d4-e687-415b-b3eb-4e39ea0f566e,the-guardian,40.67,-7.97
"Unfortunately, the last-gen versions of the game on PS4 and Xbox One have been cancelled.",Lean Left,the-independent,0,3536f5b1-1303-4111-aa8b-88b5c8fdefc7,the-independent,38.37,-6.99
"It plays more like a branded interlude, a quick five minute job while you’re wandering around looking for something less boring to do instead.",Lean Left,the-guardian,1,8d6320a0-19ca-4776-88ba-ce40e96b09c2,the-guardian,40.67,-7.97
A growing number of state lawmakers see these technologies as part of the plan to build trust with unions and offer workers an off ramp from fossil fuel jobs.,Lean Left,politico,0,243ad27a-ed82-4621-83be-e4e71db93352,politico,42.32,-5.58
"He was barely getting by in a one-bedroom apartment in L.A.'s Crenshaw neighborhood, making ends meet on his income from Social Security and odd jobs.",Lean Left,npr,0,2a1f772a-b677-4cb3-9cbf-d51686329a03,npr,42.99,-4.27
Regardless of whether Pugh was the intended target-who knows how good the coward who threw the object’s aim was?-the incident looks scary.,Lean Left,vanity-fair,1,26efd66b-82f2-45bd-b2dc-934c1c27fcae,vanity-fair,33.19,-13.87
"My parents proudly tuned in, but the scene after mine involved periods and blowjobs.",Lean Left,the-guardian,1,7856c931-d10a-42ef-8830-1d1f19587107,the-guardian,40.67,-7.97
"And if you aren’t a crafty ceramicist or knitter yourself, you can feel out of luck.",Lean Left,variety,1,c257c51f-3c4a-4a96-b309-ab3f4c8e6af0,variety,41.29,-3.85
"For Kroger, the first step down that road began in 2015 when it set up a data science unit called 84.51-the longitude of its headquarters in Cincinnati-that started selling research reports about its customer buying habits.",Lean Left,washington-monthly,0,41bfaef4-cc86-407b-a762-83c15f09fa62,washington-monthly,35.78,-12.08
"It had star billing when the Potters came to celebrate a 60th birthday, with the birthday girl in a gold sash and the spaniels behaving for once; when the Courage family gathered for Christmas, all in their wellingtons, shouting in triumph; when Lee proposed to Hayley and Brendan proposed to Sinead, kneeling awkwardly among the rocks and roots, and when miscellaneous walkers and rain-refugees brought out their pork pies and Kit-Kats.",Lean Left,the-economist,0,f9565790-87b2-4136-9d7e-a40bfe23647f,the-economist,42.4,-1.43
This close attention is aimed at preventing possible confrontation between Rwanda and the DRC.,Lean Left,the-conversation,0,25c2f293-9c9d-4066-be33-c0bc8a24c883,the-conversation,40.75,-4.86
Journalists in Gaza are making unparalleled sacrifices to reveal the true cost of the Israeli onslaught.,Lean Left,al-jazeera,1,c1b052e1-176a-42ea-a7c4-55d6219f4ba4,al-jazeera,41.34,-7.05
"José Cruz A construction worker from Yonkers, New York What action do you want Biden to take on climate change?",Lean Left,the-verge,0,e0ec512b-4028-4e9e-8e18-c5acb79d1e7b,the-verge,39.43,-4.75
"It also cost a great deal for the initial capture and development, and editing was slow and tedious.",Lean Left,the-economist,0,2f0870a3-d753-4f47-8179-aca7a4a503b7,the-economist,42.4,-1.43
This audit will help you grasp the extent of the trash you're creating and identify the manageable ways you can start to reduce it.,Lean Left,npr,0,08966838-cd84-498a-8188-3b7127f6e3fb,npr,42.99,-4.27
"In the 1990s many countries aspired to a self-reinforcing cycle of freedom, market economics and rules-based globalisation.",Lean Left,the-economist,0,2e18a2eb-3fa4-449d-8256-256ddf078d2c,the-economist,42.4,-1.43
Trump’s efforts to target Obamacare are not about providing Americans better health care.,Lean Left,cnn,1,cd13c524-55e0-447e-8ea6-cd0ca2806bd4,cnn,42.06,-6.28
"Perhaps Indian governments might have misinterpreted Gandhi, but that is not his fault.",Lean Left,the-economist,1,d6ea2c03-102c-4ae6-a330-07fe332cafd3,the-economist,42.4,-1.43
"Beccy can speak about engaging with nature, no matter where you are.",Lean Left,the-conversation,0,54c3d8c9-8848-49f1-896c-5351b4e46d4a,the-conversation,40.75,-4.86
"These poems, and their English translation by Stefan Tobler, are a rare achievement.",Lean Left,the-guardian,0,99aec99d-69b4-4090-92eb-2341d05dc314,the-guardian,40.67,-7.97
People may simultaneously recognise that something is not alive and treat it as if it were.,Lean Left,the-economist,0,339b90c2-56ea-4bb5-b843-6ca9bb6795f1,the-economist,42.4,-1.43
"The temptation to splurge ahead of the presidential vote next year will fan tensions, forcing the central bank either to crank up rates to debilitating levels or to give up the fight, leading to spiralling inflation.",Lean Left,the-economist,1,dd1e5e51-0c54-40b7-a079-058b9fdd7d4f,the-economist,42.4,-1.43
"What is happening in our country is deeply alarming because, although hate is never gone for long, it has rarely gained this much traction this fast.",Lean Left,usa-today,1,a3efefa9-f14c-4df8-8941-abfc3be4c99f,usa-today,40.78,-4.12
"It is not just disgusting but self-defeating for vocal segments of the left to disavow...universal ideas about human rights, declaring instead that to those who are oppressed, even the most extreme violence is permitted.",Lean Left,fair,1,58461c70-fc79-4396-9fec-f563c64fdc15,fair,32.6,-19.36
"For many students, purchasing big items such as plane tickets can feel like a stretch to their budgets, especially when it comes to inflated holiday pricing.",Lean Left,usa-today,0,c25a4145-c6c5-4204-b6cb-7a6928c30953,usa-today,40.78,-4.12
Google’s response that it’s merely giving more people access to tools that already exist feels unsatisfactory.,Lean Left,the-verge,1,357dd0a9-81e7-4659-bae1-b566960494fe,the-verge,39.43,-4.75
Some of the things Republicans claim Biden did to juice inflation are bogus.,Lean Left,washington-post,1,a99e097f-cb6c-4ebf-a566-af2666e288a5,washington-post,38.8,-6.85
"On top of that, he had seemingly lost the dressing room, having cancelled a training session in October in order to unearth a mole after stories of disunity were leaked to the press.",Lean Left,the-guardian,1,9eac94a9-54f5-42d1-b9e1-b23d8782177c,the-guardian,40.67,-7.97
"In the best of all worlds, policymakers would be seizing this moment not only to patch up lost learning but to drive through reforms that might alter the less-than-impressive trajectories many school systems were tracing even before the pandemic hit.",Lean Left,the-economist,0,17703fab-375b-4e82-be54-24d9ece57434,the-economist,42.4,-1.43
"Other penguin species do something similar, although they tend to nap for much longer periods.",Lean Left,the-economist,0,9c40d582-7a95-418d-95c8-b862e258edfc,the-economist,42.4,-1.43
But you don’t have to go pixel-peeping to see that the iPhone produces a darker image overall.,Lean Left,the-verge,1,feb061bb-5664-4735-bee3-27b49d9fea10,the-verge,39.43,-4.75
"While Japan has placed its dirty energy projects in various Asian countries, communities did not ask for the environmental impact of these projects to be dumped onto them.",Lean Left,the-verge,1,3d0bf5ef-3056-4ca2-88fb-df618fd9e820,the-verge,39.43,-4.75
Bleacher Report has noticed a trend in younger viewers not watching full games so brought out a line of quick-resolving bets that have seen upticks in engagement and wagering with their sportsbook partners.,Lean Left,variety,0,9bd398c4-5b4b-4b60-b3c2-20d9dac21272,variety,41.29,-3.85
"Google seems to see coding in particular as a killer app for Gemini; it uses a new code-generating system called AlphaCode 2 that it says performs better than 85 percent of coding competition participants, up from 50 percent for the original AlphaCode.",Lean Left,the-verge,0,439da415-45aa-468e-825a-b9531ff7329b,the-verge,39.43,-4.75
Israel’s forces have penetrated far farther into Gaza than in the ground campaigns of 2009 and 2014.,Lean Left,the-economist,0,f58a6043-f5a0-43ef-a6fe-2ff43f580e15,the-economist,42.4,-1.43
But the design language of the Lisa is the design language of modern computers.,Lean Left,the-verge,0,d159d4e6-7215-42df-8df6-1ee19ca9cacd,the-verge,39.43,-4.75
