text,source_party,source_name,label,sentence_id,source,reliability,bias
"Freezing temperatures, resulting in a cold snap across the country, has seen demand soar, while outputs from windfarms have plunged.",Lean Right,hotair,0,2076ebee-0e26-4b71-8d51-e4b7911f3f39,hotair,24.77,12.78
Me locking myself away in my house for a lot of years-I’ll never get that time back.,Lean Right,new-york-post,1,ec83a39d-d2ae-4d2a-b236-012723e75607,new-york-post,31.92,9.28
But perhaps Biden’s desperation will cause him to fall prey to these lies.,Lean Right,hotair,1,83b65a1b-3865-4a57-b8e2-eea800f950e8,hotair,24.77,12.78
"An engaging and clever storyteller, Mr. Reid ably guides us from events in Leopoldville and Stanleyville to deliberations in New York, Washington and Brussels.",Lean Right,washington-times,0,2dda464e-d691-4e32-a7f6-2640adc969ac,washington-times,34.92,11.31
"Jayapal claimed she has spoken out against Hamas' atrocities, specifically against women, and quickly turned the conversation back to Israel.",Lean Right,fox-business,1,c2036c45-50fb-4680-88a8-2c5e05399648,fox-business,38.81,9.11
Both are extremely popular governors and Reynold said earlier in the primary that she didn’t plan to endorse anyone.,Lean Right,hotair,0,be494d75-b7e7-42ea-ae17-fffe3ff02ca9,hotair,24.77,12.78
How much like the breakaway Alligator’s editors are Students for Justice in Palestine?,Lean Right,hotair,1,f5a75363-d378-4039-9ccf-ad568d9756ee,hotair,24.77,12.78
"Whether there was peace or not-whether he was loosed from something-was, in the end, a matter of debate.",Lean Right,christianity-today,0,9bd6236e-646b-4cf5-af5a-a621b84b43c7,christianity-today,41.75,5.39
"Essential to this mission is fostering a diverse, equitable, and inclusive campus experience,"" the website states.",Lean Right,the-christian-post,0,6e48ced2-6aa7-4a5e-bbc6-b6bfff3be3c7,the-christian-post,36.41,10.31
"If you don’t have a super smart TV, this gift is perfect.",Lean Right,new-york-post,0,3c3f33ce-1b9a-4361-8599-2e51c03e66d0,new-york-post,31.92,9.28
"He defected in September 1945, informing Western governments that Stalin’s spies had stolen atomic secrets from the Manhattan Project.",Lean Right,washington-times,0,1b5e8560-9a91-4d60-b8f4-956e8e31b0ce,washington-times,34.92,11.31
"The following is a list of interesting tech deals which you can surely look forward to purchasing this July 12, 2016.",Lean Right,the-christian-post,1,567b561a-efbd-4ae8-8d34-a8352d5147c7,the-christian-post,36.41,10.31
"The conflict, he added, has ""demonstrated the hollowness of the Russian military.",Lean Right,just-the-news,1,38635026-233e-4d23-a2b8-2f9e96eb2641,just-the-news,33.31,10.7
"No, Randi: Well into 2021, long after it was obvious that school reopenings were safe, you worked your connections to keep them shut.",Lean Right,new-york-post,1,9d43b095-a86a-432d-a7a2-81d296909f2d,new-york-post,31.92,9.28
"With this colorful store opening, Valentino has redefined painting the town red.",Lean Right,new-york-post,1,e877aae5-5e07-4832-98f5-533be2cca32b,new-york-post,31.92,9.28
"Even with some disappointment, the athlete said he will continue surrendering his life and career to God, as he always has.",Lean Right,the-christian-post,0,8a7ad116-2d54-4426-b015-740a44d3c996,the-christian-post,36.41,10.31
"There is one other political issue that is becoming more apparent which occurs anytime the U.S is at war, particularly when it is closely involved in supporting two allies: Ukraine and Israel.",Lean Right,boston-herald,1,59e40cc9-97bf-4691-b090-81dc9d2a0230,boston-herald,36.31,9.68
"The vote, if it happens, follows a raucous closed-door meeting in which at least a dozen Republicans walked out of a classified briefing from administration officials pushing for the Ukraine funding and Ukrainian President Volodymyr Zelensky, who was supposed to address the groups via secure video link, was a no-show.",Lean Right,washington-examiner,0,472aa5ae-bad0-4048-846d-9dc8fdc139b7,washington-examiner,34.07,11.3
"But suffering is not God’s proper work, which is always to love and save.",Lean Right,christianity-today,1,c7530b02-dfd3-4a4d-bea4-684cd7096155,christianity-today,41.75,5.39
"In February, the unnamed witness said that he and 222 others, most of them political prisoners, members of human rights organizations and priests imprisoned for defending human rights, were exiled from Nicaragua.",Lean Right,the-christian-post,1,86ed8d94-1b5b-45cf-b889-207ba6197961,the-christian-post,36.41,10.31
"Karl Vaters: Yeah, definitely more in Canada than the U.S., although California is probably more post-Christian than a lot of parts of the U.S. are.",Lean Right,christianity-today,1,d09ace56-84e6-4cd7-8808-ce01b9de0fbe,christianity-today,41.75,5.39
"She said that before the Russia-Ukraine war, Xi had wanted to invade the island within two or three years.",Lean Right,zerohedge,0,3d801233-ae41-4b7b-bf03-998da1de5234,zerohedge,20.78,16.08
"So what are some thoughts that you might have for the pastors who are listening in, who are thinking they are being driven to keep their church a constant beehive of busyness, which in fact is contributing to this overstimulation, and how do we back off from that and offer them an alternative to that?",Lean Right,christianity-today,1,fe8a184b-7aea-4ae8-81bc-8e68536e960a,christianity-today,41.75,5.39
This article has been updated to clarify Mr. Abbott’s departure from the Hallmark Channel.,Lean Right,washington-times,0,908ed841-9fdf-41ba-acdf-f8b678ba1a51,washington-times,34.92,11.31
"Sadly, this approach often drives children away from a legalistic, rules-based religion.",Lean Right,washington-times,1,e93c90c7-1da0-4c27-86e5-9b041e8c0973,washington-times,34.92,11.31
"CHINA EXPE WARNS US IS ‘FUELING’ THEIR MILITARY BUILDUP ‘CONFIGURED TO KILL AMERICANS’ ""Like, somehow the corporate elite of this country thinks when it's time to make money, you stand up.",Lean Right,fox-business,1,e73de471-6b9e-40b0-b839-dc4499795490,fox-business,38.81,9.11
Famously his great example is that the evening news is a morality play.,Lean Right,christianity-today,0,484c2c34-85c3-4cb7-a0e2-86d75d43b9f6,christianity-today,41.75,5.39
We also got into the TikTok/Osama bid Laden fiasco-which of course is just another arm of the cultural crisis octopus-and how it (not so coincidentally) coincides with Xi Jinping’s visit to San Francisco.,Lean Right,hotair,1,439e967b-6f2d-4968-80ac-698a3f1557a1,hotair,24.77,12.78
"Japan’s ‘lucky 7%’ GDP growth rate forces BoJ to abandon yield curve control Japan is expected to experience a surprising economic surge, leading to a significant policy shift by the Bank of Japan.",Lean Right,rt,1,a08c2835-dafd-4c4f-946a-715c0b20c187,rt,28.66,11.46
"When one is in the spotlight so much, finding themselves at so many historical junctures, it is almost impossible to not be a polarizing figure.",Lean Right,rt,1,9f5b35d9-93ad-4149-8da3-4a7908cd793c,rt,28.66,11.46
The fact that she’s backpedaling now suggests she’s hearing from people who weren’t impressed.,Lean Right,hotair,1,69a86b9b-60aa-4643-af32-71ea402d18a2,hotair,24.77,12.78
"All Americans, in good faith, want a college education to be uplifting for students to achieve the American dream, not destructive, insane indoctrination.",Lean Right,washington-times,1,15bc279d-108b-4ae2-b495-748888db1713,washington-times,34.92,11.31
"And they got this guy some stuff he needed and a drink of coffee, and got him some new shoes or something like that from the soup kitchen, and then were able to find him some resources.",Lean Right,christianity-today,0,9d26012c-4a02-42cc-ac90-5ce62e41d896,christianity-today,41.75,5.39
"With gracefully short and profound chapters, The Blessed Life illustrates the ongoing relevance of Jesus’ teachings and miracles for building and sustaining faith in today’s world.",Lean Right,christianity-today,1,849a16c9-91aa-4ace-bc24-b58a3cf1db1f,christianity-today,41.75,5.39
"Facts appearing in the movant's papers which the opposing party does not controvert, may be deemed to be admitted.",Lean Right,reason,0,10c32b3b-2d5f-4514-8f61-d2b8d5bab0bf,reason,36.26,4.84
"This is the message we have heard from him and proclaim to you, that God is light, and in him is no darkness at all.",Lean Right,the-christian-post,0,748b4edf-cca3-44f0-8ce1-543afb27cb45,the-christian-post,36.41,10.31
"Amazon To manicure your lawn to be as neat and green as can be, Greenworks’ Electric Lawn Mower is one of our readers’ favorites they shopped ASAP to help manicure their grass to perfection.",Lean Right,new-york-post,0,0de459df-2cf0-40ca-94c9-ee7701e97084,new-york-post,31.92,9.28
X marks the spot Xavier McKinney is in a much better place coming out of this bye week than he was last year.,Lean Right,new-york-post,0,2a04f8b7-5e22-4d17-a022-125e5f5297b9,new-york-post,31.92,9.28
"As one would expect, the operations of these middlemen take place out of sight.",Lean Right,boston-herald,0,5d8decdb-2536-410d-839f-c7a62f3eea16,boston-herald,36.31,9.68
"We don't want to make that too much more than it is, but we are the Jesus that people will meet.",Lean Right,christianity-today,0,37607cad-c077-4679-9ded-5f156a463455,christianity-today,41.75,5.39
There is still too much silence on the use of rape as a weapon of war by barbarians like Hamas.,Lean Right,hotair,1,6092de9b-6aa3-4a3f-afb4-9001a9c45c7e,hotair,24.77,12.78
It included the same amount in cuts to the IRS after the tax agency was boosted with $80 billion in Democrats’ Inflation Reduction Act.,Lean Right,washington-times,1,67e5edbe-5a42-402c-babf-bd80b35d6e01,washington-times,34.92,11.31
He told them the victim did not want to go to police and didn’t mention that Sengstock was actually wavering on that point.,Lean Right,christianity-today,1,ad0a37b6-b8d8-4aff-81b2-c76d1b4fa91e,christianity-today,41.75,5.39
"Atlantic Coast Conference Commissioner Jim Phillips said Baker needs now to gather support from various constituencies, from university presidents to athletic directors to coaches.",Lean Right,washington-times,0,cdcac2f2-20fc-4632-999c-63dcd246300e,washington-times,34.92,11.31
It is widely recognized that the WHO failed miserably to deal with the COVID-19 outbreak.,Lean Right,washington-times,1,44414923-307c-45f8-b4d6-1df88dac19e7,washington-times,34.92,11.31
"We understand the political playbook instructs that while in Massachusetts, don’t bother to be bold because Democrats rule the roost.",Lean Right,boston-herald,1,38515d94-562c-4619-bb92-101835cf9e51,boston-herald,36.31,9.68
"Wind gusts of more than 30 mph hit the D.C. area Tuesday, and the tree fell over around 1 p.m.",Lean Right,just-the-news,0,7d0d7397-65e1-4ef4-94dd-4db7cf33199c,just-the-news,33.31,10.7
"In October, David Grutman’s Groot Hospitality and Tao Group Hospitality took over a space in Miami’s historic Woman’s Club in Edgewater.",Lean Right,new-york-post,0,cdccbb5c-5bea-453d-9d91-4bd039a1dc25,new-york-post,31.92,9.28
"This is before they pay for their car licence fee to the parasitic class, or the $0.89c per litre tax on fuel when they fill their car up.",Lean Right,zerohedge,1,6ee1cdb2-9d50-4134-8b65-9fdd166724bc,zerohedge,20.78,16.08
"What they talk about is the debt, inflation, what are we going to do to balance our budget and get things back on track?",Lean Right,fox-business,0,5dd57eaf-3b0a-46c5-a837-32f07b20e116,fox-business,38.81,9.11
"When a coup attempt fails, everyone who took part in the coup ends up paying a heavy price.",Lean Right,the-christian-post,0,e30d5d5f-1502-41f2-84c2-c16504b6601f,the-christian-post,36.41,10.31
"But a fair amount of that starboard momentum can be attributed to DeSantis himself, the combined result of his mission-based administrative prowess, his right-for-the-times political philosophy, and - not unimportantly - his commitment to growing the base.",Lean Right,hotair,1,a64c16c5-1450-4ef2-b590-5417fa73a838,hotair,24.77,12.78
"The gaze, the collective energy of the room, shifted toward the door.",Lean Right,christianity-today,0,9672719d-7f2f-4026-ac1a-ffce8bf7f1a9,christianity-today,41.75,5.39
"As Sarvanan was not in a condition to speak to Christian Today, Vimala Johnson spoke on his behalf and recounted the shocking and brutal incident to Christian Today.",Lean Right,the-christian-post,0,2da4d8ea-7be0-423b-94a8-b5bdee551f13,the-christian-post,36.41,10.31
That was exploiting the fact that they were small and rural.,Lean Right,christianity-today,1,4e2c498c-4e23-41e7-b7be-254593772b98,christianity-today,41.75,5.39
"One way or another, the tunnels have to be made impassable in order to destroy Hamas, and Israel knows this.",Lean Right,hotair,1,270b3a12-10e3-45fc-88ea-df90807b6933,hotair,24.77,12.78
"Although the report noted a 13.8% overall increase in programming expenses last year, slightly more than twice the rate of inflation, council members said they would maintain or increase their programming.",Lean Right,washington-times,0,ede5d8ac-c8a3-424b-a4c4-ad8fe84e15a0,washington-times,34.92,11.31
"Among domestic aircraft under development are the single-aisle MC-21 airliner, which is currently undergoing trials, and the Sukhoi Superjet New, a version of the Superjet 100 regional jet made entirely from Russian-produced components.",Lean Right,rt,0,b13e3972-a8bb-43ca-b2fe-5b281539fc46,rt,28.66,11.46
"Emphasis added, because American politics right now is moving into a land of both shadow and substance otherwise known as ... (involuntary shuddering) ... the 2024 presidential campaign.",Lean Right,reason,1,803b99d2-1de5-4e16-a942-8a827787714e,reason,36.26,4.84
And Kendi would be brought in to explain how this proves that everybody is a racist White supremacist.,Lean Right,hotair,1,48d5f616-e790-4bef-9cb7-368f9680fad8,hotair,24.77,12.78
He famously removed a photograph of Baruch Goldstein - an Israeli-American who gunned down 29 Palestinians in a mosque in 1994 - from his living room wall before entering politics.,Lean Right,new-york-post,0,ab35194b-13bb-4edf-99bf-0856ef7db447,new-york-post,31.92,9.28
"Now that Republicans control the House, only the Senate is holding a hearing this year.",Lean Right,washington-times,0,a56e6d16-8dd8-482d-a154-d20ca34947c0,washington-times,34.92,11.31
"It’s like a person who gets a bunch of credit cards with low-interest teaser rates and maxes out the cards, anticipating he can just transfer any balances to new cards when the introductory rate expires, only to find no such offers exist anymore.",Lean Right,fox-business,0,3b5b9670-b922-40a8-b19b-1deff647f58f,fox-business,38.81,9.11
WORKERS NOW DEMANDING NEARLY $80K TO STA NEW JOB The Federal Reserve closely watches these figures as it tries to gauge labor market tightness and wrestle inflation under control.,Lean Right,fox-business,1,caef47aa-52d6-4f38-9b44-2a2354926e5f,fox-business,38.81,9.11
He added that Western nations have failed to crack down on sanctions loopholes.,Lean Right,rt,0,7014a607-a8d6-44a0-ac11-d3030938ccd2,rt,28.66,11.46
"For nearly a decade, Joe Biden used multiple email aliases to send hundreds of messages to his son Hunter’s former business partner, a Republican-led House committee leading the impeachment inquiry into the president revealed Tuesday.",Lean Right,new-york-post,1,53ccef86-ec15-49bd-935d-c328f375f199,new-york-post,31.92,9.28
"The Defendant seeks compensation for this loss in the amount of $1,500 as punitive damages.",Lean Right,reason,0,ccab24c6-7e42-4306-ab6f-758729ef9677,reason,36.26,4.84
For more than 70 years the tensions between Arabs and Jews over Jerusalem have been a continual pain in the neck for all people.,Lean Right,the-christian-post,1,615d622f-a702-43be-8095-c5d4a7909277,the-christian-post,36.41,10.31
"The Mark Hotel 7 Meghan Markle famously had a star-studded, $500,000 baby shower at The Mark Hotel.",Lean Right,new-york-post,0,4628d550-ea67-4bf0-bebf-b3053c241be5,new-york-post,31.92,9.28
The Ohio Department of Public Safety reports only one traffic fatality in Peninsula since 2020 and only about three collisions per month.,Lean Right,reason,0,1b60e002-ae2b-4678-b726-684fc2b7bada,reason,36.26,4.84
"Even though metro Detroit’s population has declined since 2000, it has issued permits at a rate comparable to San Francisco.",Lean Right,washington-examiner,0,1d94a9bf-c88f-48d1-baf6-eddf8a99709b,washington-examiner,34.07,11.3
This year isn’t the only year that has had four elections overturned by courts.,Lean Right,just-the-news,0,21599a77-e3be-479d-9b67-3fd32bd5000b,just-the-news,33.31,10.7
"Her appointment came after the firing of CEO Mark Tritton, following a sales slump and an unsuccessful move into private-label products.",Lean Right,fox-business,0,3908d7b5-3d53-4853-a2d0-a22466100630,fox-business,38.81,9.11
"All too often the focus of the seventh house is romantic relationships and the contract of marriage, but in truth, the seventh house is the house of others, where minds meet, resources pool and the potential of human collaboration is planted.",Lean Right,new-york-post,0,1af13f77-6877-4142-9202-beeb1d3b7e02,new-york-post,31.92,9.28
One participant joked he would attempt to count the stars and report back his findings.,Lean Right,christianity-today,0,74935c8e-a68b-4590-b189-c0fc6f33e802,christianity-today,41.75,5.39
"All of that may be true, but it’s hardly the full story.",Lean Right,hotair,0,c0097ef7-7bb8-45ec-a9e1-6578abc78e49,hotair,24.77,12.78
"Mr. Santos bamboozled those voters, they said, and it was up to Congress to rectify matters.",Lean Right,washington-times,1,121292c8-4a41-4070-9a5d-dff2ca6ca96d,washington-times,34.92,11.31
"If you project onto God that God is basically just like Mark Zuckerberg or is just like your boss, and demands from you incessant activity, that doesn't sound like my yolk is easy and my burden is light.",Lean Right,christianity-today,1,075b843f-d41f-45f8-9451-f17f664bd3e0,christianity-today,41.75,5.39
"Furthermore, with the House Oversight Committee led by Representative James Comer sending subpoenas to members of the Biden family, there is the potential issue of the perception of alleged corruption.",Lean Right,boston-herald,1,981881be-b4bf-45c2-a456-a3a29483764b,boston-herald,36.31,9.68
The authors aim to place it in a historical context by demonstrating where Moscow failed to learn the lessons of modern warfare and how it now finds itself in a World War I-style slog.,Lean Right,washington-times,0,fd9a3ad8-e2ad-4da7-a6b0-c155260184e5,washington-times,34.92,11.31
Why does Biden so needlessly lie about such easily discoverable things?,Lean Right,the-christian-post,1,956267a5-00bb-4cc5-9fb1-152db13976b7,the-christian-post,36.41,10.31
"The SPLC is known for identifying conservative, pro-life and parental rights organizations as hate groups.",Lean Right,washington-times,1,1d7b0e9e-5a95-44bc-932e-4328ad76d6c2,washington-times,34.92,11.31
"It also didn't help when President Joe Biden faced his own investigation for the mishandling of classified documents, one of the legal headaches Trump is still dealing with but is not expected to face charges.",Lean Right,washington-examiner,1,1504b473-e26c-4bab-b77c-5b5b48ad775e,washington-examiner,34.07,11.3
"For the person who adores everything breakfast-related, this Mini Scone Pan from Stonewall Kitchen offers a fresh taste to your next gathering.",Lean Right,new-york-post,1,cec1e40b-ab9e-446d-8c64-8ae514471ab2,new-york-post,31.92,9.28
"He plays with so much passion and energy, playing on a back-to-back and with a little bit of fatigue ... I’m so happy for him.",Lean Right,boston-herald,0,6f49090d-66e0-4dac-83bc-d0168995ea15,boston-herald,36.31,9.68
"By the time Mr. Biden became president, he was faced with that deadline and the realization that the Taliban former prisoners, in a number that exceeded the number of American troops there, had been freed and were now armed.",Lean Right,washington-times,0,bc18f6aa-ddb4-4c85-b564-a84a2efc433f,washington-times,34.92,11.31
"When asked about whether she would sign a federal bill banning abortion after six weeks gestation, Haley said she would.",Lean Right,christianity-today,0,6089eee0-911c-4060-ab15-9c9d9ce02df7,christianity-today,41.75,5.39
"Without strong families raising tomorrow’s confident and capable leaders, a nation will suffer internally and become increasingly vulnerable to outside threats.",Lean Right,washington-times,1,ee88d77a-4460-41bc-82e7-acd1f30ef16f,washington-times,34.92,11.31
"6 Taylor Swift opens up about her career, tour and Travis Kelce in the profile.",Lean Right,new-york-post,0,2bb0ea20-6bd4-4071-9a6a-389a22b9f88b,new-york-post,31.92,9.28
Heffner seeks to draw out lawmakers by incentivizing empathy and compromise in pursuit of a new consensus.,Lean Right,fiscal-times,0,3512743b-6cd7-41ae-8900-f7587b36aaa7,fiscal-times,43.33,-4.18
"According to the report, the shortfall is partly due to traders simply ignoring the price ceiling, with Russian oil selling for roughly $70 a barrel.",Lean Right,rt,0,af030d9d-fc1e-4bdb-83a9-610f5671a9ba,rt,28.66,11.46
"As is the trend among many restaurant patrons nowadays, she decided to snap a picture of her meal for social media.",Lean Right,new-york-post,0,04206bd8-5fb3-4509-8603-bedfa7a60539,new-york-post,31.92,9.28
"The firebombing involved two Molotov cocktails thrown through a window, setting a bookcase on fire.",Lean Right,the-christian-post,0,ed490f74-2da7-46c8-baeb-bcd2d619bab4,the-christian-post,36.41,10.31
Hamas actually wants the Palestinians on the surface to suffer because they know the media will dutifully do their public relations work for them.,Lean Right,hotair,1,d8b5fea0-ed18-4933-898e-1b0824521a45,hotair,24.77,12.78
"Over the last 50 years, technology, treaties, and trade have raised countless millions out of poverty and created vast wealth for nations -- and their elites.",Lean Right,washington-times,1,2ba3ccee-874d-4b67-9470-9338a9cd918b,washington-times,34.92,11.31
The letter was signed by 11 Senate Republicans and 19 House Republicans.,Lean Right,washington-times,0,d905912f-ba14-4f0b-85d3-352677763973,washington-times,34.92,11.31
But SEC v. Jarkesy is not just a pedantic word fight.,Lean Right,the-dispatch,0,87d005c4-b517-4177-81cd-4a1e87d1b2ca,the-dispatch,41.19,5.33
"What’s more, its best-selling duo adds much flavor to any meal.",Lean Right,new-york-post,1,e8341169-514b-4fc2-8078-62443a3d6277,new-york-post,31.92,9.28
"In addition, officials warned residents not to leave their homes, considering the large amount of volcanic ash that could have an impact on health.",Lean Right,new-york-post,0,ddf0ed93-4b1d-49db-be0d-f8a797ffb797,new-york-post,31.92,9.28
"As he highlights significant themes and trajectories, he illustrates why the Gospel of John should play a larger role in this research.",Lean Right,christianity-today,0,8846ded0-04dd-4c3a-a5e7-db913a63d89d,christianity-today,41.75,5.39
"Grieving Without Shame First, grieving well means grieving honestly, authentically, without embarrassment or shame-regardless of how uncomfortable that makes others feel.",Lean Right,washington-times,0,ac26e240-eac7-4a23-b93e-6f2171d10863,washington-times,34.92,11.31
"It will require an open mind and an open heart toward your Savior, as well as toward the Holy Spirit who is always working to transform believers to become more like Jesus.",Lean Right,the-christian-post,1,c01b958e-b0d0-44a3-888d-90d8108feea4,the-christian-post,36.41,10.31
They want/need to see your commitment to their needs and wants on par or greater than they see it shown to others.,Lean Right,the-christian-post,1,fd5a0cfd-84d0-4414-8427-2d48be02e631,the-christian-post,36.41,10.31
"Colleges and universities nationwide now are slashing their humanities programs, with some liberal arts schools shutting down entirely.",Lean Right,washington-times,0,7deaaf8c-4a37-474b-a083-d19979a5cd30,washington-times,34.92,11.31
THE FED IS LIKELY DONE WITH INTEREST RATE HIKES: M.B.A. FORECAST Confidence among builders in the U.S. housing market plunged for the third straight month in October as a spike in mortgage rates continued to weigh on consumer demand for new homes.,Lean Right,fox-business,1,d3562ed8-ea87-49e3-9145-001a773bbc0b,fox-business,38.81,9.11
"Are you the kind of person that has to manuscript it, what you're gonna say?",Lean Right,christianity-today,0,205566e4-fd37-4c31-b6c6-f8b16c9518a5,christianity-today,41.75,5.39
"One-third of the attacks included threats with firearms, including shootings, and in nearly half of the attacks the settlers were accompanied or actively supported by Israeli forces.",Lean Right,washington-times,0,c7b78a53-4db4-43c8-9891-730c3844d47f,washington-times,34.92,11.31
The reason is because the whole religion is incarnational and I'm not.,Lean Right,christianity-today,1,6602cafe-9b5d-43b9-a445-fbd8b0447e5a,christianity-today,41.75,5.39
"Rather than simply appearing correlated, interest rates are determined by what stage in economic cycles the Federal Reserve perceives the economy is in.",Lean Right,reason,0,06a58d29-a9d7-4d22-8487-725d8495f52f,reason,36.26,4.84
The group is known for its advocacy for a separate Khalistan state to be carved out of Punjab in northwestern India.,Lean Right,rt,0,d7163a7c-d7dd-4817-bbad-5becfc127319,rt,28.66,11.46
"Much of this intra-party divide is a direct by-product of the ‘cultural Marxism’ that has invaded US academia, which disproportionately sees the Palestinian people as the victim.",Lean Right,rt,1,febbef07-84f2-42ca-8055-f91543dd79c6,rt,28.66,11.46
"Meanwhile, unlike the equivocating Biden administration, voters know where DeSantis is willing to invest his political capital, and can judge from there his suitability as president.",Lean Right,hotair,1,16b40520-a986-4461-954c-059d06d3b2d3,hotair,24.77,12.78
Most Jews are secretly pleased that many of the beautiful Christmas carols were composed by one of our tribal brethren.,Lean Right,hotair,1,288ed58f-3cac-4b10-965f-843456097ff8,hotair,24.77,12.78
