text,source_party,source_name,label,sentence_id,source,reliability,bias
"The ADAF believes British people are more at risk from the drug’s side effects, but this has not been confirmed by independent scientific study.",Lean Left,the-guardian,0,9881537e-b8ad-431c-90f1-64b8fff0f127,the-guardian,40.67,-7.97
"If you’re looking to kill time and be wildly distracted from your surroundings, trust the overwhelmingly positive Amazon reviews and buy yourself a little mystery.",Lean Left,variety,0,ca17a138-9e85-468e-8b9b-ff0951cc6d9a,variety,41.29,-3.85
"To compare this to Biden’s odds against a more popular Republican, the only reason we know Haley fares well on a national stage is because ... she is running for president and is faring decently on a national stage.",Lean Left,abc-news,1,09bb20b0-f480-4812-ae0c-cc89f16272e7,abc-news,45.25,-2.91
"Some didn’t know they had been in another state, according to court transcripts.",Lean Left,usa-today,0,9cc8b6e7-94de-41f6-9bd5-e84582abf609,usa-today,40.78,-4.12
"Since 2011, al-Assad has relied on eerily similar strategies to justify nearly identical military sieges and attacks on civilian infrastructure in rebel-held territories.",Lean Left,al-jazeera,1,0cfc54cf-a95f-4d04-8f62-c9bc67298ca9,al-jazeera,41.34,-7.05
How do you communicate in so many different voices - not just people but personalities who are in different eras?,Lean Left,npr,0,5da859f2-426f-49c0-9f10-beb0b72e547e,npr,42.99,-4.27
Add to all that the newest Mideast war that began with Hamas’ attack on Israel on Oct. 7.,Lean Left,politico,1,57ca6813-b3de-4da4-b196-545a2d5e451d,politico,42.32,-5.58
Former Microsoft executive Panos Panay was named his successor in September.,Lean Left,the-verge,0,c7d697e2-cf7d-4f9a-a5f9-e5552a5c51c0,the-verge,39.43,-4.75
On the coast Kotzebue is bracing for autumn storms-harsher now that the sea ice stands farther from the shore.,Lean Left,the-economist,0,7c219647-28e4-4f68-b305-7bf73cf4f939,the-economist,42.4,-1.43
Some speculate that he died long ago and is nothing more than a mythical figurehead cultivated for propaganda purposes.,Lean Left,the-economist,1,2b0affe4-b7bc-451b-a118-68584abc4527,the-economist,42.4,-1.43
Articles in the app are also limited to those published in the last few days.,Lean Left,atlanta-journalconstitution,0,755001f9-bf83-430b-940c-55bcd07510bc,atlanta-journalconstitution,44.83,-3.84
His hairstyle horrified some friends back in France but hardly raised an eyebrow in Australia.,Lean Left,washington-post,0,7bd8fb6a-8ac6-4698-bf90-5f11540fdac0,washington-post,38.8,-6.85
Lord Summerisle patiently explains to Howie his fate has been predetermined from the outset and he is then forcibly hoisted into a giant wicker colossus (alongside a number animals) where he is to be burned alive.,Lean Left,the-conversation,0,e8f31544-5cc8-43bc-9c93-bd957a90abbb,the-conversation,40.75,-4.86
"H enry Kissinger has long been held as an icon of realpolitik, a fancier word than realism to connote an approach to foreign affairs that is dictated by doing whatever the moment demands to maximize advantage rather than looking to grand philosophy and morality.",Lean Left,politico,1,539b7075-a082-4d37-a695-82b169e70ba7,politico,42.32,-5.58
"To him, it was merely a gesture of affection, but to me at that moment, it felt like an unspoken request for sex.",Lean Left,the-independent,1,1adab9a8-9370-4faa-88ec-a882c94b326a,the-independent,38.37,-6.99
"And if Fain had asked for 25% to start off the negotiations, they would have called that crazy, too.",Lean Left,detroit-free-press,1,cb8295fd-443f-4c3b-abfe-a5d1120fbc6e,detroit-free-press,43.46,-5.43
"The country’s civilian infrastructure and services, including healthcare and education, have been devastated.",Lean Left,al-jazeera,1,53da477f-dc5e-45ee-8de6-753ae72ecb44,al-jazeera,41.34,-7.05
And the weaponization of death tolls only exposes and deepens existing divisions rather than change minds or help resolve conflicts.,Lean Left,politico,1,ce50d6a2-2c82-4acc-8590-15168612986e,politico,42.32,-5.58
"A former pro wrestler who relished playing a burly, bombastic villain in 1980s battles with some of the sport’s biggest stars and later became a popular Twitter personality.",Lean Left,abc-news,0,cb048408-6592-4011-8c3b-cbd868828bb2,abc-news,45.25,-2.91
"The survey also found health workers who reported being harassed also had increased odds of reporting anxiety, depression and burnout compared to those who weren't harassed.",Lean Left,cbs-news,0,6e58b599-bd68-49c1-9706-8094eff178c3,cbs-news,41.76,-2.84
But the west is very much not guiltless in supporting the corrupt systems that have bedevilled both Russia and Ukraine (anger at which drove Kyiv’s 2014 revolution).,Lean Left,the-guardian,1,5842a384-82cf-4ded-b693-e3aad889ee2b,the-guardian,40.67,-7.97
"Packed with many never-before-seen photos and other ephemera from the life of artist, this massive collection will knock your socks off.",Lean Left,detroit-free-press,0,451d03cb-9b60-4a6c-93c8-a02c07ae827a,detroit-free-press,43.46,-5.43
"At first, Aaron writes the new guest off as a weirdo.",Lean Left,the-guardian,0,73be743c-0c48-4dae-b6cf-c4549c7de4de,the-guardian,40.67,-7.97
The new insecurities are not confined to the member states of the European Union.,Lean Left,the-guardian,0,edfe75a8-420f-4c4d-8261-b305d4e8070c,the-guardian,40.67,-7.97
"Getty Images October 19, 2023 NZ’s always-on culture has stretched the 8-hour workday - should the law contain a right to disconnect?",Lean Left,the-conversation,0,50ad5968-892c-421e-93fc-bd67b2cc2508,the-conversation,40.75,-4.86
"Without that experience and sensitivity, another loud voice just adds to a problem.",Lean Left,usa-today,1,4d4ad0aa-0c1a-4723-a7ba-509e4cf4cdb9,usa-today,40.78,-4.12
NatGeo is still in the top 10 US magazines people get on purpose.,Lean Left,the-verge,1,4f2e357c-b88c-4758-924f-2c53c64a7751,the-verge,39.43,-4.75
"Should the ruling coalition be forced to rely on a temporary budget, the government would continue to function, with social benefits and pensions continuing to be paid out.",Lean Left,politico,0,657b15ed-656d-47cb-ad6a-c3a8a82a3bae,politico,42.32,-5.58
They seem to stop them taking up paid work at all.,Lean Left,the-conversation,0,87d20b8f-ca82-4830-aadf-6a618093240f,the-conversation,40.75,-4.86
It was a bit dog-eat-dog; you’d see the same people at viewings when you were queueing up outside.,Lean Left,the-guardian,0,8c0b3c53-6789-437b-920e-ef2e65f02bd0,the-guardian,40.67,-7.97
"The OTW system is used in 107 jurisdictions in seven states, including 48 counties in Georgia.",Lean Left,atlanta-journalconstitution,0,45e9abe4-9ce6-4cd7-b86d-74e732b5b46b,atlanta-journalconstitution,44.83,-3.84
But he has not talked about it in office - to the point that more moderate senators and activists in the party’s left flank have pushed him to do more.,Lean Left,cnn,0,a3b71cd5-1570-4f57-93ab-a2c020d4a40a,cnn,42.06,-6.28
"And when Christmas actually rolls around, the G-Men will be back in an exclusive late-afternoon window to get steamrolled by Philadelphia.",Lean Left,usa-today,1,fdb835cd-0678-4efe-bd2d-6336ecb4d981,usa-today,40.78,-4.12
Valencia’s paella hints at the centuries of Moorish rule that introduced rice to southern Spain.,Lean Left,the-guardian,0,abb803a5-983f-474c-a5e3-704ce8ced99e,the-guardian,40.67,-7.97
"Apple released details about iOS 16 today at its Worldwide Developers Conference, including which phones will be eligible for the update - and which didn’t make the cut.",Lean Left,the-verge,0,b35760ad-c853-4405-95f1-33d6b421ee84,the-verge,39.43,-4.75
"Nothing is terribly earwormy, but the music is nimble and quaintly melodic-and Chalamet sings it as gamely as any former theater kid might.",Lean Left,vanity-fair,0,70bb66ad-4ce1-497a-a03a-64da1c3d0674,vanity-fair,33.19,-13.87
"He had fought the Middle East’s most powerful army for 50 days, and at the end of it he still controlled Gaza.",Lean Left,the-economist,0,2e365309-f978-4eb8-ab88-2a7e98e2f2ee,the-economist,42.4,-1.43
Our preliminary estimate shows net emissions from land-use change were 4.1 billion tonnes of CO₂ in 2023.,Lean Left,the-conversation,0,90f7922a-5857-4826-8f25-72b84cd27f75,the-conversation,40.75,-4.86
"So, instead of getting closer scrutiny as it exploded in size, SVB would lurch along until it failed.",Lean Left,washington-monthly,1,5e5d420c-6cb3-4eeb-9b0f-4660f7b592fe,washington-monthly,35.78,-12.08
"Across GUTS, Rodrigo is defiant and snarky about romance and heartbreak, cartwheeling through cursed hallmarks of young womanhood - vampiric older exes, questionable hookups, skin-crawling insecurities - over a palette of scuzzy, '90s indie rock-evoking sounds, landing feet-first with flying colors.",Lean Left,npr,1,3daaaa05-3991-4339-87b8-313024ba2fff,npr,42.99,-4.27
Most were made in far-off countries whose citizens might be proud to display them in public.,Lean Left,the-guardian,1,f685cf8c-608e-4784-9606-2d8a6bb0da48,the-guardian,40.67,-7.97
"Veidlinger started her investigation in January by interviewing Tracy and six people she had identified as witnesses, including three of Tucker’s assistants who had been involved in coordinating and canceling her campus visits.",Lean Left,usa-today,0,20b44c77-69ac-46df-b3b5-c09bea6e7281,usa-today,40.78,-4.12
"Rob Douglas, current president and chief operating officer, who has been with ResMed since 2001, will retire in the new year and transition to advising the CEO until the end of 2024.",Lean Left,san-diego-uniontribune,0,923ec240-b96b-4e2a-95f1-1542db99009e,san-diego-uniontribune,45.68,-1.76
"Carol is a gorgeous edition to any Christmas movie rotation, but especially for viewers craving a grounded queer romance.",Lean Left,detroit-free-press,1,d1952df9-4b15-4a4e-810a-e1bd223a1dd4,detroit-free-press,43.46,-5.43
"Karachi Bachao Tehreek - Karachi, Pakistan Pakistan’s largest urban centre, Karachi, was ravaged by floods in August 2020.",Lean Left,al-jazeera,0,22f9f958-9d0d-459b-8ffd-c039c872005d,al-jazeera,41.34,-7.05
"Improvements or updates to artwork, content, and source-code may be purchased at an additional fee.",Lean Left,san-diego-uniontribune,0,d531773f-9602-4c08-b141-e3d11532dffc,san-diego-uniontribune,45.68,-1.76
Richardson recommends hanging clothes off a drying rack in a shower or bathtub to catch any dripping water.,Lean Left,npr,0,931ec683-78f7-4522-9905-ac2493625f12,npr,42.99,-4.27
"HSV are also possession-focused, though they have been less consistent at imposing themselves on opponents.",Lean Left,the-guardian,0,20406fd1-3d91-4285-9a3f-d74d2c9ba6d7,the-guardian,40.67,-7.97
My major concern was that somehow the crew would screw up.,Lean Left,npr,0,bb2cda44-570c-494d-88c8-c53f6b97de5d,npr,42.99,-4.27
But not nearly enough to meet the goals of the Paris accord and stave off even more extreme events like what’s recently struck Brazil.,Lean Left,the-verge,1,c9bd700b-8a9d-498a-904e-867057e29cf5,the-verge,39.43,-4.75
"Rather than obfuscate, Roberts stood tall for candor and tossed a big bowl of word salad on the floor and said, you’re doggone right, we did meet with Ohtani.",Lean Left,usa-today,1,dcb77310-d0eb-4b66-a2fa-34eddd5b12e8,usa-today,40.78,-4.12
To get the laws on the statute books European parliamentary approval is also required.,Lean Left,the-guardian,0,a4f9ed4d-26c5-4717-b93b-8a1e9da54fb1,the-guardian,40.67,-7.97
They are large white spheres attached to a wooden pole and decorated with bright colors and a banner announcing the name of the town where festivities will be held.,Lean Left,san-diego-uniontribune,0,16a9525a-08e5-4b5e-9af3-aa1a3b820e54,san-diego-uniontribune,45.68,-1.76
"The same 37 actions can reduce Africa’s contribution to climate change by 20% by 2030, and by 60% by 2063.",Lean Left,the-conversation,0,507b6b26-01ba-43e8-ae1c-e10865592286,the-conversation,40.75,-4.86
"True, to dismiss the risk of escalation because it would not serve the alleged interests of Hizbullah or Iran could be just another example of the mirror-imaging and wishful thinking that plague policymakers of all stripes-and which contributed to the Israeli blunders that opened the door to Hamas on October 7th.",Lean Left,the-economist,0,0bedc43d-ae1c-4eda-a45e-02ab8b881128,the-economist,42.4,-1.43
"About 6.5 million people will struggle to heat their homes sufficiently this festive season, while 2.7 million will have to choose between buying food or presents, highlighting the drastic impact the cost of living crisis continues to have on household budgets.",Lean Left,the-guardian,1,600415b7-2059-49c4-8404-bb148698f6d2,the-guardian,40.67,-7.97
"A day before nominations end for Bangladesh’s January 7 parliamentary election, the country’s leading opposition party has confirmed that it will not participate in the vote, citing irregularities by Prime Minister Sheikh Hasina’s government.",Lean Left,al-jazeera,0,d9b1bc8b-ca3e-4182-9f02-9082d45b3ff6,al-jazeera,41.34,-7.05
His path through the mountains was officially named the Route Napoléon in 1932.,Lean Left,the-guardian,0,130e2dea-7bba-45fb-95f2-1a2af88f6146,the-guardian,40.67,-7.97
Our expert reporters are bringing their stellar journalism to another hub of European politics.,Lean Left,politico,0,bdc2f4d0-0139-43ae-9e79-80b4b4506a3b,politico,42.32,-5.58
"But, you know, certainly Israel sees Iran's nuclear program as an existential threat.",Lean Left,npr,0,3b457c3a-7081-465a-bc51-a6bf3a9730c9,npr,42.99,-4.27
Their fervor to protect the laws reflects a bedrock philosophy within the American anti-abortion movement: that all abortion exceptions - even those that protect the pregnant person’s life or health - should be considered the same as sanctioning murder.,Lean Left,propublica,1,31f74445-4e72-4dcb-9cd5-c2fec9d8dc70,propublica,47.17,-6.77
"And we protest for change in a country that so desperately needs it.""",Lean Left,cbs-news,1,a4debbb7-1fbe-4f22-9e94-548ab9b0882f,cbs-news,41.76,-2.84
"As Santa ties himself into knots trying to humor the author and the illustrator, you get the sense he's just biding his time until he can actually do it the real, super secret correct way.",Lean Left,npr,0,c75f7625-503c-443c-872c-aac8797e56d6,npr,42.99,-4.27
Many others had warrants for drug crimes and gun possession by a felon.,Lean Left,nbc-news,0,cb437f3f-31f3-4161-b272-473bc11e05a5,nbc-news,43.21,-5.79
Another factor is that cash-strapped councils are hiring out their green spaces to festivals and there are simply not enough big headliners to fill the huge number of events on offer.,Lean Left,the-guardian,0,c3f35678-fb56-4049-8b4d-9da15f01e139,the-guardian,40.67,-7.97
"This distinction is awarded neither to forests, nor to the atmosphere, but to our soils.",Lean Left,the-conversation,0,d1b3bd49-c9e4-4e10-91f1-80e96985660f,the-conversation,40.75,-4.86
"By the end of the day, 90,000 people had been driven from their homes.",Lean Left,the-guardian,0,c63b8069-c2a5-468e-a44d-fcf427003a69,the-guardian,40.67,-7.97
They can separate the gullible from their money in New Age healing shops.,Lean Left,the-economist,1,e619abc2-fda2-4a49-bae9-f082438c8b99,the-economist,42.4,-1.43
"In one particularly horrifying incident in 2009, a chimpanzee called Travis who had been raised by humans from birth mauled his owner’s friend, biting and tearing her face, ripping out her eyes, removing one of her hands and most of the other.",Lean Left,the-guardian,1,a8e4d662-c268-434b-81cd-76cf2e955875,the-guardian,40.67,-7.97
"Other weapons in Carter-Ruck’s arsenal have included the super-injunction, a legal order which not only prevents a news outlet from running a story but which demands the injunction itself remain secret.",Lean Left,the-economist,1,f9627e68-0369-4a28-9df2-b4808d8ecd8c,the-economist,42.4,-1.43
How are you seeking to maintain Taiwan’s place in the world through informal ties or other methods?,Lean Left,time-magazine,0,571f005e-07b1-490b-b6ac-edd2b2215d3b,time-magazine,41.12,-7.42
Photograph: Reinaldo Coddou H/Bundesliga Collection/Getty Images The biggest improvement from last season has been in defence.,Lean Left,the-guardian,1,2569cd78-a4a7-45bb-a451-3022703c8f88,the-guardian,40.67,-7.97
"When you get a guy like Luis, you make it to work on him.",Lean Left,vanity-fair,1,4b3bdf52-532c-4ac1-a916-7957e435f4c2,vanity-fair,33.19,-13.87
"And thus, can we make it smell like roses ... or, as comedians in the film say, ... like a cheap candle?",Lean Left,npr,1,60da2ac1-d984-45a1-a393-a57ad89cf587,npr,42.99,-4.27
"This massive use of eel is the driving force behind its illegal trade, which is the world’s largest wildlife crime and affects multiple species.",Lean Left,the-conversation,1,97fb0ab5-ddf8-4e58-94fc-51af7735d33d,the-conversation,40.75,-4.86
"Josh seemed the obvious winner from the start of the last episode, despite presenters and judges trying to impress us with his rivals’ achievements in earlier rounds.",Lean Left,the-guardian,1,9f00f024-3dbc-49de-8ffb-34e0247278d6,the-guardian,40.67,-7.97
The number of active online users is at least 200 million.,Lean Left,time-magazine,0,c0186ebc-7d47-4c9d-a6d3-f1065bca9cb4,time-magazine,41.12,-7.42
"The rate of emissions decline has slowed, and factors such as the increasing popularity of SUVs, failure to insulate homes and the slow deployment of windfarms and solar power in England have hampered further cuts.",Lean Left,the-guardian,0,73d259dd-21d2-4183-9339-c9747aa770dc,the-guardian,40.67,-7.97
"In Alaska land, ice and oil stack neatly one over the other.",Lean Left,the-economist,0,b347b6ba-8b21-4e29-b668-e8f152fe2d61,the-economist,42.4,-1.43
Get in the holiday spirit with these other USA TODAY reads Just Curious for more?,Lean Left,usa-today,0,558a79eb-bbf2-4f7b-a4a4-01aceb15c761,usa-today,40.78,-4.12
"At the national level, over nine out of ten citizens in Lithuania (94%), Ireland (93%), Luxembourg (93%) and Malta (92%) say their country has benefited from EU membership, while the lowest shares are found in Italy (57%), Bulgaria (57%) and Austria (55%).",Lean Left,the-guardian,0,766d36af-5dbc-4903-b8f8-fb7762dc7f7d,the-guardian,40.67,-7.97
"By reinforcing people’s biases, they cut off the competition ideas need if they are to improve.",Lean Left,the-economist,1,7b3c321e-1b30-4acc-80e8-2bddea6b6b00,the-economist,42.4,-1.43
"Both times, Hoggard delivered in-pocket passes, both times Walker drilled 3s.",Lean Left,detroit-free-press,0,b2176ff8-8eb9-4d33-89a5-82e12e20d47e,detroit-free-press,43.46,-5.43
The witch casts a spell to magic the hanky out of the little girl's pocket - and gets a piece of string and a toffee instead.,Lean Left,npr,1,4b06422e-1f3a-42b5-b5c9-670e71e78054,npr,42.99,-4.27
"No, Shohei Ohtani didn't sign with a team, but Juan Soto was traded in a blockbuster deal.",Lean Left,usa-today,0,749637fc-575e-433e-bc89-34d6252cace1,usa-today,40.78,-4.12
"W hen Europeans turn their attention to what markets have to say, it is usually because trouble is brewing.",Lean Left,the-economist,1,fd00da99-db8f-4b09-9a45-b18c4b7a3ab8,the-economist,42.4,-1.43
"He also knows that the next tranche of federal funding for broadband connectivity will be the biggest ever, at $42.5bn nationwide, and is bracing for shortages of both workers and parts.",Lean Left,the-economist,0,20af8d88-b1ed-4a8b-a808-39891070c5b0,the-economist,42.4,-1.43
"Re-board the train to continue to seaside Port Erin, a resort boasting glorious beaches, views out to the offshore Calf of Man and a Railway Museum that's must-see for enthusiasts.",Lean Left,the-guardian,0,dbb37dac-a908-43cc-8ee2-e36f14c0a4da,the-guardian,40.67,-7.97
"A slight majority of Democratic voters hold unfavorable views of Israel, and recent polling from Ipsos/University of Maryland found that 57 percent want the U.S. to play a neutral role in the conflict instead of leaning toward one side.",Lean Left,abc-news,0,f66acbe2-6405-4ad7-b8d6-1bcd88ed6adb,abc-news,45.25,-2.91
Baku maintains that Azerbaijani forces have simply set up checkpoints to prevent the smuggling of weapons to separatist militants.,Lean Left,al-jazeera,0,9e660573-2b47-44f0-860b-deac53bf5618,al-jazeera,41.34,-7.05
Climate forecast for the Amazon until 2100 The projections for changes in Amazonia’s climate by the year 2100 are truly catastrophic.,Lean Left,the-conversation,1,d0c05a64-f8e1-4b90-bf70-60f5758ae9b4,the-conversation,40.75,-4.86
"But the minute the strike question is resolved, it will be hard to fend off all the offers that are sure to follow.",Lean Left,vanity-fair,0,e0a92264-4bf8-4db4-9d6a-e2202ae3e237,vanity-fair,33.19,-13.87
"That left more money for rural people who plant trees and young people on apprenticeships, his signature programmes.",Lean Left,the-economist,0,1f6aeb91-dfbd-49c2-90b3-d531df9a0f3a,the-economist,42.4,-1.43
Remember how getting a variety pack was the absolute ultimate in weekend breakfast excitement?,Lean Left,the-guardian,1,850a8bc0-7d2a-4708-8158-663af61bc1ea,the-guardian,40.67,-7.97
"Raised in Clifton, Mueller was a songwriter, guitarist, and singer who first appeared at a talent show at Clifton High School.",Lean Left,nj,0,a9a7639d-8acb-4919-b4cf-fbd9664e1435,nj,43.92,-2.88
"Even without implementing the referendum, which would require further constitutional steps and the likely use of force, Maduro may stand to gain politically from the vote amid a challenging re-election campaign.",Lean Left,cnn,0,29a3dabf-c4da-44f8-9e04-529c747cce92,cnn,42.06,-6.28
"The upper house of Nigeria’s parliament refused to approve an intervention, urging President Tinubu to consider other alternatives.",Lean Left,al-jazeera,0,30740ab8-9440-499f-a15c-ed497054234a,al-jazeera,41.34,-7.05
"Even before he became a clown he wore loud shirts in crazy colors, unusual ties and wild hats, his daughter the Rev.",Lean Left,san-diego-uniontribune,1,22158210-d8f6-4187-a05a-202d434db0f0,san-diego-uniontribune,45.68,-1.76
"And, in practical terms, UBIs would mean either eye-popping increases in tax or cuts in support for the genuinely needy, particularly in countries where welfare spending is already relatively targeted on the poor.",Lean Left,the-economist,1,5ba57853-5011-4732-aaf7-b1176d4bcdb1,the-economist,42.4,-1.43
"The extraordinary story of how Williams carved an unprecedented role for herself inside a male-dominated world, while managing secretly to have two children by a married Daily Mail journalist and conceal the pregnancies from her colleagues, is one begging to be told by another woman, and McDougall brings nuance to it.",Lean Left,the-guardian,1,02cd5cd6-f336-43d8-9655-b0d079b03909,the-guardian,40.67,-7.97
"Yet McGregor has found a way to leverage anti-immigrant tensions and diminishing faith in his government’s policies to resonate with a subset of Irish conservatives, as well as the far-right community around the world.",Lean Left,the-guardian,1,e789651d-f045-4ba3-b909-69a8c81c7b9a,the-guardian,40.67,-7.97
"Although there is growing awareness of the impact that high meat and dairy consumption has on certain countries’ carbon footprints, politicians are, in the main, profoundly reluctant to tackle the issue, particularly in this era of culture wars.",Lean Left,the-guardian,1,10c8a480-f2f6-4c9a-9a59-7a4433cc7743,the-guardian,40.67,-7.97
Is Trump right about World War III?Here's why we should be worried.,Lean Left,usa-today,1,b0986b41-ca32-4071-af88-e620e5847f7b,usa-today,40.78,-4.12
Remove from the grill and leave covered in a warm place until ready to serve.,Lean Left,the-guardian,0,b6474ab5-e72f-447e-8d64-8a058bec83e7,the-guardian,40.67,-7.97
Employees involved in managing their own data are also well placed to reduce the risks of bias and incorrect assumptions in their data-driven decision making.,Lean Left,the-guardian,0,c12b0186-b230-4d62-9b08-79353e0c640d,the-guardian,40.67,-7.97
Inadequate nutrition during pregnancy can also increase the risk of giving birth to a stunted infant.,Lean Left,al-jazeera,0,745dc0cd-82b3-4221-9c8a-8d11b15e6750,al-jazeera,41.34,-7.05
"In new lawsuits against the University of North Carolina and Harvard, Blum strategically featured the plight of Asian Americans, in part because they could be depicted as especially sympathetic victims and model minorities cruelly harmed by affirmative action.",Lean Left,the-conversation,1,82322db7-b4ae-4522-8586-45387896ee90,the-conversation,40.75,-4.86
Some of these fans have paid hundreds of dollars for meet-and-greet tickets after the show.,Lean Left,washington-blade,0,8199b156-b680-4a38-bb7c-00f58d7936b6,washington-blade,42.71,-7.49
"Everyone has a right to clean water, and the pressure for this will only grown as the climate and nature crisis intensifies.",Lean Left,the-guardian,1,da566e13-4cb2-4287-bc64-090f8901eb67,the-guardian,40.67,-7.97
"As part of the settlement, the fake electors acknowledged that Biden won the state, withdrew their filings and agreed not to serve as presidential electors in the future or participate in the transmission of such documents again, among other terms.",Lean Left,usa-today,0,18c24fe1-0537-4028-871d-17367c0383cc,usa-today,40.78,-4.12
US tour tickets for Bruce Springsteen can go for several thousand dollars.,Lean Left,the-guardian,0,b30423ae-9ce4-4fd0-afe0-e29fbee22f4a,the-guardian,40.67,-7.97
"Otherwise, we will be a fascist state,"" Pima County, Arizona, Democratic Party Chairwoman Bonnie Heidler told ABC News.",Lean Left,abc-news,1,59f926c8-e40d-423d-83da-dfc2eedb76fa,abc-news,45.25,-2.91
The cock-of-the-walk confidence with which liberals strode into the 21st century has given way to trembling self-doubt.,Lean Left,the-economist,1,6a95e83e-3e1f-40c0-92a9-2f0febb86599,the-economist,42.4,-1.43
"We are incredibly lucky to live in a democracy where we enjoy freedom of speech, have the right to peaceful protest and can hope to shift the dial of our country’s foreign policy.",Lean Left,cnn,1,945ca2a6-70be-492c-a8c5-fcc422bfc348,cnn,42.06,-6.28
