text,source_party,label,source,reliability,bias
"Use our Freedom of Information Act (FOIA) Handbook and other resources (www.judicialwatch.org/open-records-laws-and-resources/) to learn how you can ask your local, state or federal government for information about their activities.",Lean Right,0,judicial-watch,23.64,23.27
"Never before in our quarter-century history has Judicial Watch... Uncovered such important new information through our investigations and litigation to expose the corrupt Deep State swamp in Washington, DC and hold its operatives accountable; such important new information through our investigations and litigation to expose the corrupt Deep State swamp in Washington, DC and hold its operatives accountable; Prosecuted as many active lawsuits on this and a host of other issues critical to the rule of law and the integrity and well-being of our country; as many active lawsuits on this and a host of other issues critical to the rule of law and the integrity and well-being of our country; Conducted thousands of investigations and filed hundreds of Freedom of Information Act (FOIA) requests attempting to learn what our government is up to; thousands of investigations and filed hundreds of Freedom of Information Act (FOIA) requests attempting to learn what our government is up to; Achieved such important progress fighting for honest elections across the country (capped this year by our historic legal settlement with California and Los Angeles County that will remove as many as 1.59 MILLION ineligible voters from their rolls); and such important progress fighting for honest elections across the country (capped this year by our historic legal settlement with California and Los Angeles County that will remove as many as 1.59 MILLION ineligible voters from their rolls); and So persistently held to account corrupt politicians (including Joe Biden and Hillary Clinton) in both parties who have corrupted government institutions for their own personal and ideological agendas.",Lean Right,1,judicial-watch,23.64,23.27
Linda Shenwick was escorted from her office during working hours by armed guards like a common criminal and forced to go on leave without pay.,Lean Right,1,judicial-watch,23.64,23.27
And support Judicial Watch’s INDEPENDENT investigations and lawsuits to hold Joe Biden accountable under the law!,Lean Right,1,judicial-watch,23.64,23.27
"Simultaneously, U.S. Secret Service Rescue Swimmers immediately deployed from the shore at [redacted] and began searching the immediate area and underwater for CAMPBELL, subsequently not locating him.",Lean Right,0,judicial-watch,23.64,23.27
"First, American forces in Afghanistan would gracefully exit and the War on Terror would finally end.",Lean Right,1,the-dispatch,41.19,5.33
Republicans appear to have reached broad agreement-even in a political moment when GOP in-fighting seems to be the norm-on insisting any Ukraine aid be paired with the imposition of stricter border security measures.,Lean Right,0,the-dispatch,41.19,5.33
"Prosecuting it was more popular, and enabling it was considered more villainous.",Lean Left,1,propublica,47.17,-6.77
"He has gone with Crow to the Bohemian Grove, the exclusive California all-male retreat, and to Crow’s sprawling ranch in East Texas.",Lean Left,1,propublica,47.17,-6.77
The judge asked the foreperson for the jury’s verdict on the first charge.,Lean Left,0,propublica,47.17,-6.77
"The company built a vaccine research facility in Rockville, Maryland, to be closer to the NIH and the Food and Drug Administration; at the same time, it was retreating from TB and other global public health projects, according to former employees of the vaccine division.",Lean Left,0,propublica,47.17,-6.77
"In the aftermath of Rep. Matt Gaetz’s (R-Fla.) unprecedented move to ally with Democrats and oust Rep. Kevin McCarthy (R-Calif.) from the speakership, fellow Republicans have expressed that they’re not pleased.",Left,1,jezebel,29.2,-18.18
"Procession, that Netflix movie about abuse in the Catholic Church immediately sprung to mind because the recreation process is so much part of it, as well as that catharsis you’re talking about.",Left,1,jezebel,29.2,-18.18
"The suit and the federal charges against Golubski, in particular, show why so few rape victims report their experiences to the police, who are frequently accused of sexual violence themselves.",Left,1,jezebel,29.2,-18.18
Mix up your winter vacation and hit the slopes at Breckenridge Ski Resort or Eldora Mountain resort which are under 120 miles from the Colorado Springs area.,Center,0,military-times,46.49,-0.19
Reliving the story of this ambush year after year is difficult.,Center,1,military-times,46.49,-0.19
"After a must-see trip to the Pearl Harbor Memorial, make time for the annual Honolulu City Lights featuring the lighting of the city’s 50-foot Christmas tree and downtown parade.",Center,0,military-times,46.49,-0.19
Pakistan said its crackdown will not affect the estimated 1.4 million Afghans registered as refugees and living in various parts of Pakistan.,Lean Left,0,al-jazeera,41.34,-7.05
"For Israeli arms makers, Shuki Sadeh explains, the Gaza war is a cash cow.",Lean Left,1,al-jazeera,41.34,-7.05
Relations between Ankara and Riyadh essentially followed an institutional line until the recent disagreements in regional policies.,Lean Left,0,al-jazeera,41.34,-7.05
"North Gaza is home to the Jabalia refugee camp, the largest in the Gaza Strip.",Lean Left,0,al-jazeera,41.34,-7.05
"Israeli settlements and checkpoints However, the Oslo Accords slowly broke down as Israeli settlements, Jewish communities built on Palestinian land in the West Bank, grew at a rapid pace.",Lean Left,1,al-jazeera,41.34,-7.05
"The Israeli army has not only cut off electricity to Gaza but also targeted and damaged its already temperamental mobile network, thus leaving most of the people there with almost no access to the internet.",Lean Left,1,al-jazeera,41.34,-7.05
"Matthew Wade smashed an unbeaten 36 off 23 balls, but it was not enough in the end.",Lean Left,0,al-jazeera,41.34,-7.05
"‘Not Trump’ Muslim Americans said they did not expect former President Donald Trump to treat their community any better if re-elected, but saw denying Biden votes as their only means to shape US policy.",Lean Left,1,al-jazeera,41.34,-7.05
But the interest of the book does not lie in this scattershot history.,Left,1,new-republic,29.53,-17.18
This will be followed by a post-lunch afternoon sail on the Nile.,Left,0,new-republic,29.53,-17.18
And who wants to start a Fortune 500 company in a city that doesn’t have an airport?,Left,1,new-republic,29.53,-17.18
"People across the income spectrum are moving out of the area, but low- and middle-income earners are leaving at higher rates.",Left,0,new-republic,29.53,-17.18
"When she was in charge in San Francisco, she’s famous for these meetings she would have where staff was arrayed hierarchically around tables with the most senior staff in the middle and then radiating outward junior to junior to junior.",Left,1,new-republic,29.53,-17.18
"We’ll then continue to Trinidad, a UNESCO world heritage site known for its history, cobblestone streets, pastel-colored homes, art, and music.",Left,0,new-republic,29.53,-17.18
"Like so many Irish in Britain, his identity married the nation of his parents with the city where he lived: London-, Manchester-, Birmingham-, not Anglo-Irish.",Left,1,boing-boing,19.23,-14.43
"Trump claims Cheney is lying; he was overeating, not starving himself.",Left,1,boing-boing,19.23,-14.43
"This giant, funky statue has stood guard over a Long Island community since 1977.",Left,0,boing-boing,19.23,-14.43
Ye and Musk were interviewed separately by sex pest Charlie Rose.,Left,1,boing-boing,19.23,-14.43
"The two great humanitarian geniuses of the 21st century, Ye and Elon Musk, sat down with each other to talk about how smart and special they are.",Left,1,boing-boing,19.23,-14.43
"Andrew was also with brother Charles at Balmoral Castle in Scotland this summer, having spent last Christmas with Charles and the rest of the royal family at Sandringham.",Left,0,boing-boing,19.23,-14.43
"It took a real genius, Patrick Blumenthal, to get them together.",Left,1,boing-boing,19.23,-14.43
"Trump has been dominating his rivals both nationally and in Iowa, which will kick off the election with its caucuses on Jan. 15.",Lean Left,0,nowthis-news,41.47,-7.95
"But once his father-in-law is elected president, Kushner finds himself--or maneuvers his way into--the middle of everything, whether it’s building the wall, devising a solution to the Israel-Palestine imbroglio, or negotiating a trade deal with China.",Lean Left,1,nowthis-news,41.47,-7.95
"While at the time FTX was the world’s second or third largest crypto exchange, it didn’t operate a large business in the U.S.",Lean Left,0,nowthis-news,41.47,-7.95
Having an oil baron at the helm of the world’s most important event focused on curtailing greenhouse gas emissions is an irony that’s been hard to swallow for many.,Lean Left,1,chicago-sun-times,45.44,-4.35
"Two teenagers jumped out of a tan SUV, stuck a gun in his abdomen and made off with his wallet, phone and computer.",Lean Left,1,chicago-sun-times,45.44,-4.35
"Hackett was sensational in the second half, scoring 20 points in the second half.",Lean Left,0,chicago-sun-times,45.44,-4.35
"Collier has shown he is a blend of power and athleticism at the rim, unafraid to play quarterback or fullback, if needed.",Lean Left,0,chicago-sun-times,45.44,-4.35
"Obviously, it hasn’t worked, so you’ve got to be creative and find ways to improve it.",Lean Left,0,chicago-sun-times,45.44,-4.35
She is afraid that someone will try to harm her son or her family.,Left,0,newsone,35.06,-17.17
"He would eventually meet his love, Alva Dean, marrying her and uniting two prominent slave-owning families for better profits.",Left,1,newsone,35.06,-17.17
"To learn more about MULTAQ, including the risk of serious side effects, visit Multaq.com.",Lean Left,0,sfgate,43.52,-1.26
A wolf in sheep’s clothing: Are you underestimating the burden of flu?,Lean Left,1,sfgate,43.52,-1.26
Cost Per Acquisition (CPA) Digital marketing bills can soar wildly out of control without diligent measuring cost efficiency across initiatives from pay-per-click campaigns to purchased email lists and partner promotions.,Lean Left,0,sfgate,43.52,-1.26
"Investors were understandably very pleased with the company’s revenue rising 32%, gross margins of 90%, and net retention of 128%: GitLab’s market cap increased by almost a billion dollars to $9.18 billion the day after its Q3 results, per YCharts.",Center,0,techcrunch,45.28,-0.4
"The ethical questions involved in cloning someone’s voice are obvious, particularly someone long dead who can’t meaningfully consent.",Center,0,techcrunch,45.28,-0.4
"That at least seems more honest, as it’s an admission that Bard is not quite there yet.",Center,1,techcrunch,45.28,-0.4
"Gays Against Groomers maintains that their content is based on facts and scientific studies and accuses Meta of biased content moderation, challenging the impartiality of the process.",Lean Left,0,the-advocate-–-baton-rouge,45.85,-4.0
"His defeat in the school board election, where he campaigned against the inclusion of LGBTQ+ content in educational settings, reflects the ongoing cultural and political tensions in the region.",Lean Left,1,the-advocate-–-baton-rouge,45.85,-4.0
"And to all of our haters, of which there are many, cope and seethe.",Lean Left,1,the-advocate-–-baton-rouge,45.85,-4.0
"Had America’s Founding Fathers watched last night’s debate, they would be high-fiving each other no matter if their respective jerseys were red or blue.",Center,1,smerconish,35.9,1.61
"As directors of the privately owned Purdue, they carefully orchestrated and oversaw the aggressive marketing campaign that made OxyContin into a lethal blockbuster.",Center,1,smerconish,35.9,1.61
And we Americans genuinely love their predictable levels of quality and delivery.,Center,1,smerconish,35.9,1.61
"The question the Supreme Court must decide is whether the Sackler family, owners of the company that sold $35 billion of its narcotic painkiller, OxyContin, should be granted full immunity from all civil litigation because they contributed several billion dollars to the settlement.",Center,0,smerconish,35.9,1.61
"A top official in a St. Louis-area school system talks about how his district weighs digital use, equity, and student control over their learning.",Center,0,education-week,43.11,-3.02
1 goal is to win the election - and the No.,Center,1,education-week,43.11,-3.02
"She has more than 25 years’ experience in public, start-up, and non-profit sectors and has advocated for communities of color working to increase social sector outcomes and shareholder value.",Center,0,education-week,43.11,-3.02
WIN A BEAUTIFULLY DECORATED GINGERBREAD HOUSE FROM GERHARD'S ELEGANT EUROPEAN DESSERTS.,Center,0,chicago-tribune,44.67,-4.24
"There was a lot of anger in those early sackings - we all had a sort of codependent relationship with BuzzFeed, and people felt like they were being dumped.",Left,1,buzzfeed-news,39.98,-5.98
"After hearing this, several fans of Taylor’s decided to raise a reported R$30,000 - which is around $6,000 - in less than 12 hours for Ana’s family.",Left,0,buzzfeed-news,39.98,-5.98
Our alums are scattered across every major media organization in the world.,Left,0,buzzfeed-news,39.98,-5.98
But i will say at least she shows the real situation and nanny.,Left,1,buzzfeed-news,39.98,-5.98
The Steelers were lovable losers before Harris arrived as a rookie first-round pick in 1972.,Center,1,pittsburgh-post-gazette,47.59,-0.45
"Viagra Online is an online pharmacy that provides customers with access to a wide range of prescription medications, including Viagra.",Center,0,pittsburgh-post-gazette,47.59,-0.45
"Henderson had been in the news all week for his taunts of Bradshaw, including the infamous quote that Bradshaw was so dumb he could not have spelled cat if he was spotted the c and the a.",Center,1,pittsburgh-post-gazette,47.59,-0.45
"With the hold, we have already shaken their faith in us.",Center,1,voice-of-america,46.29,-3.24
