text,source_party,label,source,reliability,bias
Biden told a brazen lie about wanting to play lacrosse and football at the same time.,Right,1,the-gateway-pundit,14.91,23.64
"Chairman Comer also uncovered a $200,000 direct payment to Joe Biden after he received James and Hunter’s subpoenaed documents.",Right,1,the-gateway-pundit,14.91,23.64
"The hotel in Pasto, Colombia, was packed with Chinese nationals heading to America and eager to cross Joe Biden’s open border.",Right,1,the-gateway-pundit,14.91,23.64
"DocGo, which has fallen under scrutiny for their lack of quality care for the migrants, is facing a class action lawsuit by their investors due to the negative press they have been receiving.",Right,1,the-gateway-pundit,14.91,23.64
Wisconsin was one of six battleground states that witnessed President Trump’s enormous lead reverse in the middle of the night after a mysterious and still unexplained ballot dump for Joe Biden.,Right,1,the-gateway-pundit,14.91,23.64
"We know the average American treats the media with scorn, and that scorn is duly earned.",Right,1,the-gateway-pundit,14.91,23.64
"In cases in which there is a real concern, a simple cheek swab is all that would be necessary to determine sex.",Right,1,the-gateway-pundit,14.91,23.64
"She was told this was not a point of order, and the hearing briefly paused.",Right,0,the-gateway-pundit,14.91,23.64
What we are witnessing is the outcome of a state stuck in one-party control and the controlling parties policies fail miserably.,Right,1,the-gateway-pundit,14.91,23.64
"Every time you think the left cannot possibly come up with a new idea that is worse than the last, they somehow manage to do it.",Right,1,the-gateway-pundit,14.91,23.64
FIRST LOOK: Las Vegas police seen on the roof of UNLV responding to active shooter situation.,Right,0,the-gateway-pundit,14.91,23.64
Joe Biden on Wednesday delivered remarks at the White House Tribal Nations Summit at the Department of Interior.,Right,0,the-gateway-pundit,14.91,23.64
The Gateway Pundit will be distributing Gateway: Beyond the Headlines on its well-read news site and the show will also be distributed among our growing network of digital partners.,Right,0,the-gateway-pundit,14.91,23.64
New Left: Black educational outcomes are poor because black students are in integrated schools.,Right,1,the-gateway-pundit,14.91,23.64
"The NYC Mayor who has stated proudly in the past that NYC would welcome these migrants with open arms, is now singing a different tune.",Right,1,the-gateway-pundit,14.91,23.64
Former House Speaker Kevin McCarthy (CA) has announced he is retiring from Congress at the end of the year.,Right,0,the-gateway-pundit,14.91,23.64
"We must get them to realize that if we remain on the current trajectory, we will live as slaves.",Right,1,the-gateway-pundit,14.91,23.64
Chairmen James Comer and Jim Jordan will initiate CONTEMPT OF CONGRESS PROCEEDINGS if Hunter Biden does not appear.,Right,1,the-gateway-pundit,14.91,23.64
"They send them to Texas, they send them to Florida, every deplorable state that we can think about.",Right,1,the-gateway-pundit,14.91,23.64
"In 2021, the school district was hit with a lawsuit alleging violations of the 14th Amendment’s equal protection clause as well as statutory violations of the Civil Rights Act of 1964.",Right,0,the-gateway-pundit,14.91,23.64
For only a desperate people will accept a life of techno-slavery in a 24/7 surveillance state.,Right,1,the-gateway-pundit,14.91,23.64
"Iowa Satanic Temple display at Capitol sparks mixed emotions  In recent years, the Satanic Temple has been attempting to infiltrate every sector of society.",Right,1,the-gateway-pundit,14.91,23.64
Oversight Committee Chairman James Comer and Judiciary Chairman Jim Jordan fired a letter off on Wednesday to Hunter Biden’s attorney Abb Lowell.,Right,0,the-gateway-pundit,14.91,23.64
UPDATE: The police confirmed at least three victims and the shooter is dead.,Right,0,the-gateway-pundit,14.91,23.64
When you’re in the military and you refuse an order like the one reported above you are in a state of rebellion.,Right,1,the-gateway-pundit,14.91,23.64
The GOP leaders are threatening Hunter with legal action if he does not show up next Wednesday to testify behind closed doors.,Right,0,the-gateway-pundit,14.91,23.64
She said the alarming prospect that underage girls across the country could be subjected to genital examinations as a means of verifying their sex for sports participation.,Right,0,the-gateway-pundit,14.91,23.64
"UPDATE on UNLV SHOOTING There are at least three victims of the shooting, police said, adding the suspect is dead.",Right,0,the-gateway-pundit,14.91,23.64
These polling numbers are going to lead to more talk of the Democrats replacing Biden before the election.,Right,1,the-gateway-pundit,14.91,23.64
Fox 5 reported: University Police are responding to reports of a shooting at UNLV on Wednesday.,Right,0,the-gateway-pundit,14.91,23.64
"Weary old Cincinnatus would just love to go back to his farm, but duty calls.",Right,0,the-gateway-pundit,14.91,23.64
Attorney Sidney Powell and bail bondsman Scott Hall both pleaded guilty in exchange for reduced charges because Fani Willis does not have a RICO case.,Right,1,the-gateway-pundit,14.91,23.64
"This year, the Iowa Satanic Temple caused a stir with their contribution to the holiday festivities.",Right,0,the-gateway-pundit,14.91,23.64
"According to data from US Customs and Border Protection, there has been a drastic increase in illegal activity being committed by illegal aliens since 2021.",Right,1,the-gateway-pundit,14.91,23.64
"Breaking News: Mark Lamb (R) Pinal County AZ Sherriff says that every illegal crossing the border receives a $5,000 gift card.",Right,1,the-gateway-pundit,14.91,23.64
She will receive all the medical attention she requires and thanks you for your support.,Right,0,the-gateway-pundit,14.91,23.64
"The Ardsley Acres Hotel Court, located at 560 Saw Mill River Pkwy, Ardsley, NY, has been the home of migrants since June 2023.",Right,0,the-gateway-pundit,14.91,23.64
The barbarians targeted a concert where they murdered over 200 young adults and we now know that they targeted a beach in Israel.,Right,1,the-gateway-pundit,14.91,23.64
She is also on the board of the Central Florida Tourism Oversight District that Gov.,Left,0,daily-beast,33.54,-10.51
"Should she show up, she is likely to get a well deserved taste of the condemnation she allowed others to suffer unjustly.",Left,1,daily-beast,33.54,-10.51
"Aiming for delightfulness and coming up with merely strained triteness, Wonka reconfirms the reliable pointlessness of prequels and the inimitability of true classics.",Left,1,daily-beast,33.54,-10.51
"She claims to have authored the bill, and she stood smiling behind DeSantis at the signing.",Left,0,daily-beast,33.54,-10.51
Speaker Johnson must at least feign that he is pushing this impeachment threat as far as he can.,Left,1,daily-beast,33.54,-10.51
"It’s also famed for its excellent oysters, making it an dream destination for foodies.",Lean Left,1,the-independent,38.37,-6.99
"As with anything, there is a limit to this new, sex-positive world.",Lean Left,0,the-independent,38.37,-6.99
Leavitt is president of the Empower Oversight center that represents the IRS whistleblowers.,Lean Right,0,just-the-news,33.31,10.7
The chief of staff for Republican Rep. Nancy Mace has reportedly been fired and two other staffers have quit in her Capitol Hill office.,Lean Right,0,just-the-news,33.31,10.7
"But attitudes changed once major Apple supplier Foxconn , officially known as Hon Hai, raised its fourth quarter outlook, expecting strong end of year sales.",Center,0,cnbc,43.82,-1.81
"Everyone wants a more inclusive market, yet there are perhaps more cutting indictments of a market than pointing out investors keep rewarding the highest-quality companies with clearest profit-growth prospects.",Center,1,cnbc,43.82,-1.81
"Additional features include a pool house with a retractable glass roof, a putting green, a jumbo-size chessboard and a tennis court.",Center,0,cnbc,43.82,-1.81
"Similarly, smaller companies that provide health-related and a broad range of consumer staples are also a target for investors,"" he said.",Center,0,cnbc,43.82,-1.81
"As a result, some members of Gen Z are turning to flip phones.",Center,0,cnbc,43.82,-1.81
"But Americans do notice higher prices from what they used to be accustomed to,"" she added.",Center,0,cnbc,43.82,-1.81
Mr. Trump’s heart was in the right place - he was sick and tired of war - but his head was not.,Lean Right,1,washington-times,34.92,11.31
"The feud started last year after Disney publicly opposed the state’s so-called don’t say gay law, which bans classroom lessons on sexual orientation and gender identity in early grades.",Lean Right,0,washington-times,34.92,11.31
"Mr. DeSantis and Mr. Ramaswamy jumped all over her early, reflecting their concern about her surge in recent polls.",Lean Right,0,washington-times,34.92,11.31
"Momentum has been building ever since the series first aired, and theatrical presentations have often sold out venues as hundreds of fans gather for communal viewing.",Lean Right,0,washington-times,34.92,11.31
"As assistant secretary for preparedness and response at the Department Health and Human Services, Dr. Kadlec played a key role in developing the COVID-19 vaccine through Operation Warp Speed.",Lean Right,0,washington-times,34.92,11.31
He also continued to share polls on social media showing him with massive leads in the GOP nomination race and also leading Mr. Biden in battleground states.,Lean Right,0,washington-times,34.92,11.31
"By the time Mr. Biden became president, he was faced with that deadline and the realization that the Taliban former prisoners, in a number that exceeded the number of American troops there, had been freed and were now armed.",Lean Right,0,washington-times,34.92,11.31
"Her rage stands out against the softness of the woman’s world around her, challenging the viewer to place themselves in her shoes.",Lean Left,1,the-conversation,40.75,-4.86
"This is the bitter truth we face today - for the official State of Israel, the concept of the Holocaust and antisemitism are purely political means, and as such can be manipulated, distorted, and deceived, just like any other political tool.",Lean Left,1,the-conversation,40.75,-4.86
"It is another illusion that a government that cannot identify and respond to citizens’ basic needs - water, electricity, education, or healthcare - can somehow predict and carefully manage a regional migrant labour system.",Lean Left,1,the-conversation,40.75,-4.86
"By contrast, the German foreign minister, Annalena Baerbock, attended in person and launched a scathing condemnation of Russia and Lavrov in her statement, underscoring that the Kremlin’s illegal war of aggression against Ukraine is also a war against the OSCE.",Lean Left,1,the-conversation,40.75,-4.86
That record really painted a picture of where he was from and what it was like to grow up there.,Left,0,new-york-magazine,39.84,-9.95
"Crafted from high-quality Tuscan leather, this briefcase is made to last (plus it comes with a convenient and comfortable shoulder strap).",Left,0,new-york-magazine,39.84,-9.95
"Hopelessly romantic, it’s the kind of movie they don’t make that much anymore.",Left,0,new-york-magazine,39.84,-9.95
"We may benefit, temporarily, from a saner Evangelicalism, a tradition gripped less by Trump and more by spiritual concerns.",Left,1,new-york-magazine,39.84,-9.95
"One of my many rules of restaurant-going is: if you see an unsexy vegetable given pride of place on a menu, order it.",Left,1,the-new-yorker,40.91,-12.25
"Even if you were a pretty run-of-the-mill retail campaigner, surely it wasn’t too much to ask of an aspirant to the Presidency of the United States that he match Ted Cruz.",Left,1,the-new-yorker,40.91,-12.25
"Runciman, a witty and refined writer, is a professor of politics at Cambridge and a contributing editor to the London Review of Books, which has also provided a home for his enlivening podcasts.",Left,0,the-new-yorker,40.91,-12.25
"The most obvious thing was anything specifically having to do with the pandemic, and its disastrous impact on global supply chains.",Left,1,the-new-yorker,40.91,-12.25
"But Jim Tierney, the hardboiled detective on the case, is not looking for a perp.",Left,1,the-new-yorker,40.91,-12.25
"We live in a country undergoing a severe case of ancestor worship (a symptom of insecurity and fear of the future), which is exacerbated by an absurdly unworkable and manipulable doctrine called originalism.",Left,1,the-new-yorker,40.91,-12.25
"Her mother, Diana, could be cruel and strangely absent, particularly after she married Louis Kind, a man who seemed to resent Streisand’s existence.",Left,1,the-new-yorker,40.91,-12.25
"Nevertheless, under the Biden administration, even after Putin marched on Ukraine and Chancellor Scholz bluffed about modernizing the feeble Bundeswehr, Washington continues to ignore that Berlin pays far less than its fair share.",Right,1,the-american-conservative,31.63,14.44
U.S. public policymakers should consider valuable lessons from Germany on stopping and reversing Washington’s never-ending slide into more and more national debt.,Right,1,the-american-conservative,31.63,14.44
"These conversations need to occur; the future of the Republican Party and the conservative movement requires serious conversations about policy, principle, and guidelines to hold corporations accountable.",Right,0,the-american-conservative,31.63,14.44
The Wall Street Journal has published an attack on Khan approximately once every 11 days.,Lean Left,1,washington-monthly,35.78,-12.08
"So, instead of getting closer scrutiny as it exploded in size, SVB would lurch along until it failed.",Lean Left,1,washington-monthly,35.78,-12.08
"Many have also evolved into quasi-government actors practically colonizing large swaths of urban landscapes while, at the same time, often battling to avoid public scrutiny.",Lean Left,1,washington-monthly,35.78,-12.08
The promise of belonging and community touted in our recruiting materials clashes with the reality that we are bound by our academic mission and the lack of unanimous opinion on even the most critical issues.,Lean Left,1,washington-monthly,35.78,-12.08
Imagine if Matt Gaetz focused on his distaste for omnibus bills!,Lean Left,1,washington-monthly,35.78,-12.08
"In Austin, his supporters couldn’t drown out the boos that greeted him on the podium.",Lean Left,0,time-magazine,41.12,-7.42
But as for-profits they often end up substituting their own targeted ads (presumably without sharing information) for what you would otherwise see on a Google search or a Facebook feed.,Lean Left,1,time-magazine,41.12,-7.42
It’s made from water-resistant polyester and comes with a large water bottle pocket.,Lean Left,0,time-magazine,41.12,-7.42
Money market funds are limited to 6 withdrawals per statement cycle.,Lean Left,0,time-magazine,41.12,-7.42
"Even as entire business models (journalism, Hollywood, and government, among them) contorted to meet the whims and needs of platforms, they are singing a very different tune today.",Lean Left,0,time-magazine,41.12,-7.42
"Real estate platform Cadre, dreamed up by Josh and Jared Kushner, was another.",Center,1,fortune,36.93,-2.44
"It’s revealing to examine where relative prices in the Midwest and Sunbelt stood over a decade ago, and the factors leading to the current, giant gap between the two regions.",Center,0,fortune,36.93,-2.44
They should look in their own house before pointing the finger at us.,Center,1,fortune,36.93,-2.44
"So our pitch is, we are not servicing U.S. customers, and we are not interested in European customers.",Center,0,fortune,36.93,-2.44
"It’s not the first time Spotify has splashed out on wining and dining for a corporate event, a fairly run-of-the-mill strategy designed to boost user engagement.",Center,0,fortune,36.93,-2.44
"The sale slightly more than doubled Kushner’s investment, giving him a calling card that validated his acumen and his patience.",Center,0,fortune,36.93,-2.44
"PRO’s position - a national-conservative-based populist backlash against the decadence of Western liberalism - seems to be a welcome alternative to many disaffected Czechs, many of whom saw Fiala and his Civic Democratic Party (ODS), the party of the country’s first president, Vaclav Havel, as a return to normalcy.",Lean Right,1,rt,28.66,11.46
"Namely, the US Empire ensuring a pliable, servile leader - who doesn’t stand in its way - is safely installed in the Kremlin, and that Europe, as a whole, remains subjugated to its economic, political, and military will.",Lean Right,1,rt,28.66,11.46
"That means that, if the elections were held then, Rajchl would be an MP, a position he hopes to wield to form an alliance with other parties, such as the right-wing party Freedom and Direct Democracy (SPD) or potentially Andrej Babis’ ANO, which is topping polls.",Lean Right,0,rt,28.66,11.46
World hit by major health crisis as obesity drugs make people stop exercising A global health crisis will erupt as taking obesity drugs makes people stop exercising and increases consumption of junk food.,Lean Right,1,rt,28.66,11.46
"Yet despite its low mobility, the container-type system is still used in the Ukrainian army.",Lean Right,0,rt,28.66,11.46
Biden Says Evidence Of His Involvement With Hunter’s Business Buddies Is ‘A Bunch Of Lies’,Right,0,the-federalist,21.77,18.67
Many ostensible disagreements are rooted more in rhetoric and priority disagreements than ideology.,Right,0,the-federalist,21.77,18.67
It’s like some kind of digital-age fairy tale: The answer was in the picture all along.,Left,1,vogue,39.13,-10.91
"The Sept. 11 attacks, along with several far more localized events and interactions, did much to awaken me to the implications of the narratives I’d grown up immersed with.",Right,1,national-catholic-register,22.39,11.81
There are many people for whom hate and rage pay a higher dividend of immediate satisfaction than love.,Right,1,national-catholic-register,22.39,11.81
"A Priest’s Influence on Film Born in Chicago in 1888, Daniel Lord grew up in a golden age of theater.",Right,0,national-catholic-register,22.39,11.81
My parents always had us wait until it was almost Christmas to do these Christmas things.,Right,0,national-catholic-register,22.39,11.81
FiveThirtyEight notes the state has set the record for the longest period of time without having a Republican governor - 40 years.,Right,0,independent-journal-review,25.81,12.82
The COP President is clear that phasing down and out of fossil fuels is inevitable and that we must keep 1.5C within reach.,Right,0,independent-journal-review,25.81,12.82
"If a story has serious issues that cannot be fixed, a retraction should be made at the beginning of the story that notes the problems with the piece.",Right,0,independent-journal-review,25.81,12.82
"Leaked documents showed that Emirati officials planned to use COP28-related meetings to discuss potential business dealings related to the two firms with foreign officials, and separate documents revealed how the companies viewed Special Presidential Envoy for Climate John Kerry as a key player in efforts to secure their future financial success.",Right,0,independent-journal-review,25.81,12.82
"It’s difficult to focus on the joys of Christmas when every moment leading up to it is spinning out of control, fast tracking us to oblivion.",Right,1,independent-journal-review,25.81,12.82
"The league’s busts for PED use (performance-enhancing drugs) are relatively rare, the penalties are laughably light, and the NFL has refused to use independent testers, which ought to tell you something.",Center,1,deseret-news,42.29,2.55
Williams noted that each of the university presidents testified that education is the solution to push back against antisemitism.,Center,0,deseret-news,42.29,2.55
"It has become a national pastime every December to criticize the shortcomings of college football’s postseason selection process, and it would take an entire day to review all the times that deserving teams were robbed.",Center,1,deseret-news,42.29,2.55
"Most often they talk about online predators, followed by personal information and privacy, pornography, bullying and cybersecurity.",Center,0,deseret-news,42.29,2.55
It’s difficult to believe that 13 reasonably intelligent adults conferred and arrived at this decision.,Center,1,deseret-news,42.29,2.55
But you don’t have to go pixel-peeping to see that the iPhone produces a darker image overall.,Lean Left,1,the-verge,39.43,-4.75
"Slack just unhelpfully spreads the phone app across the whole screen instead of utilizing multiple columns, which results in a lot of unused blank space.",Lean Left,1,the-verge,39.43,-4.75
Apple revolutionized personal technology with the introduction of the Macintosh in 1984.,Lean Left,0,the-verge,39.43,-4.75
"Hydro Temp Corporation - Pocahontas, Arkansas; and Albany, New York - geothermal heat pumps.",Lean Left,0,the-verge,39.43,-4.75
It shows very well the relationship that people have with their cats.,Lean Right,0,new-york-post,31.92,9.28
Yet even the Times had to acknowledge the elephant in the room: domestic politics.,Lean Right,1,new-york-post,31.92,9.28
He is going to let a game of Darwinian Hot Corner begin.,Lean Right,1,new-york-post,31.92,9.28
"Stearns isn’t necessarily looking for more left-handed relievers, but he is looking for relievers who can pitch to lefties.",Left,0,new-york-daily-news,40.47,-8.12
"The move comes nearly three months after Lander’s office retroactively rejected the city’s $432 million, no-bid contract with DocGo, a for-profit medical services firm that was said to have mistreated migrants.",Left,0,new-york-daily-news,40.47,-8.12
"Since it was announced on Nov. 21, over 1,300 homeowners submitted preliminary applications for up to 15 slots in the Housing Preservation Department’s program, indicating that accessory dwelling units, or ADUs as they’re known, are a popular choice as the city grapples with a housing crisis.",Left,0,new-york-daily-news,40.47,-8.12
"They remained married until 1992, two years after his release from prison, and had two daughters together: Zindzi and Zenani.",Left,0,new-york-daily-news,40.47,-8.12
"4 stabbed to death, including girl, 11, and boy, 12, by relative fatally shot by NYPD cops outside burning Queens home NYPD veteran Edmond Decio, suffering from a stab wound, opened fire and fatally shot the attacker, police and sources said.",Left,0,new-york-daily-news,40.47,-8.12
One of his first recordings is addressed to someone named Megan.,Left,0,new-york-daily-news,40.47,-8.12
"Majors backtracked and Jabbari again followed him, asking him questions about the other woman.",Left,0,new-york-daily-news,40.47,-8.12
"Speaking of brains, you should never mention the sad state of American education at present.",Right,1,american-thinker,13.67,24.85
"Last Sunday, Houthi rebels managed to kidnap the crew of an Israeli-chartered ship in the Red Sea shipping lane.",Right,0,american-thinker,13.67,24.85
The law cannot assume that minorities do not know what day it is.,Right,0,american-thinker,13.67,24.85
"Just as astonishing, the U.S. government has plumbed to insidious depths to keep Trump from the presidency.",Right,1,american-thinker,13.67,24.85
They didn’t indict Donald Trump four times because they think they have a winning position.,Right,1,american-thinker,13.67,24.85
"Haley criticized the former president for adding trillions to the national debt, while Ramaswamy raved semi-coherently about being young.",Right,1,washington-free-beacon,23.47,14.45
"It’s unclear what the payment was for, or whether Owasco made any subsequent payments to the president’s checking account.",Right,0,washington-free-beacon,23.47,14.45
"Ramaswamy and Haley have sparred in prior debates, with Ramaswamy accusing the former U.N. ambassador of being bought off by the defense industry.",Right,0,washington-free-beacon,23.47,14.45
"His clutch shots are as likely to be free throws earned through obstinate forward motion into the paint, 2006-Dwyane Wade-style, as a deep three.",Left,0,esquire,27.41,-18.14
"Still, it took rock critics years to catch on to his greatness.",Left,0,esquire,27.41,-18.14
And now we've got continuing war happening in the Middle East and in Ukraine and nuclear threat reappears.,Left,1,esquire,27.41,-18.14
"Done in a culturally respectful way, veterans are given the honor of harvesting the buffalo.",Lean Left,0,cnn,42.06,-6.28
Jeter and senior Maddie McLaughlin have been imposing blockers with Corona Del Sol alum Mary Shroll as the defensive anchor at libero.,Center,0,az-central,42.22,-7.0
"Taking underdogs on the puck line can turn quickly, especially in the final minute or so with an unwanted empty-net goal, so AVOID.",Center,1,az-central,42.22,-7.0
"An undemocratic idea won't fix democracy This country is split down the middle, and for three years the infection has been oozing out of the chasm.",Center,1,az-central,42.22,-7.0
"Yes, the Group of Five team rises up and rocks in this throw-them-a-cookie bowl slot, and Liberty’s ground game will have a few moments.",Center,1,az-central,42.22,-7.0
"He has the talent, but can he do it every night?",Center,0,az-central,42.22,-7.0
D. Watkins shares five of his favorite pairs of sneakers from his collection.,Left,0,salon,32.38,-13.86
"Watch those votes when they come in, when they’re being, you know, shoved around in wheelbarrows and dumped on the floor and everyone’s saying what’s going on?....We’re like a third world nation, a third world nation.",Left,1,salon,32.38,-13.86
