text,source_party,label,source,reliability,bias
"The White House decision to lump additional funding for the border in with Ukraine assistance has given lawmakers, Republicans say, an implicit nod to negotiate policy changes that would otherwise make Democrats feel uncomfortable.",Lean Left,1,san-diego-union-tribune,45.68,-1.76
"Once sugar is completely melted, immediately stir in the butter until melted and combined.",Lean Left,0,san-diego-union-tribune,45.68,-1.76
"Some people living with the condition become apathetic, start missing work deadlines, drastically change their eating habits or make extravagant purchases.",Lean Left,0,san-diego-union-tribune,45.68,-1.76
"Grand Canyon has a tough team, crazy fans and a massive homecourt advantage. So why is SDSU playing there?",Lean Left,0,san-diego-union-tribune,45.68,-1.76
Client is responsible for ensuring that its payment information is up to date at all times.,Lean Left,0,san-diego-union-tribune,45.68,-1.76
Everyone needs to see what we’re dealing with no matter how short and stupid the messages are.,Left,1,alternet,32.71,-14.76
"But Trump is desperate to shore himself up with his almighty base, and that means maximum pandering to the people who have a fetish for forced childbirth.",Left,1,alternet,32.71,-14.76
Democrats and those who lean to the Democratic Party are more than four times as likely as Republicans and Republican leaners to say that a person’s gender can be different from the sex they were assigned at birth (61% vs. 13%).,Left,0,alternet,32.71,-14.76
"READ MORE: School’s LGBTQ Pride Celebration Destroyed by Students Tearing Down Posters, Chanting Their Pronouns Are ‘USA’ He did not allow for people who do not hold religious beliefs, or for people who are spiritual but not religious.",Left,1,alternet,32.71,-14.76
"White supremacy as a concept has been around since the founding of America and dates back prior to and with the rise of slavery and the genocide of Native American groups in this country, Johnson said.",Left,1,alternet,32.71,-14.76
"He voted against bipartisan legislation to codify same-sex marriage, which Biden signed into law last year.",Left,0,alternet,32.71,-14.76
The governor maintains that many of the migrants who cross the U.S.-Mexico border in Texas plan to travel to Florida and that it's easier to meet them at the source.,Left,0,alternet,32.71,-14.76
"Ultimately, it is the clumsy maneuvering of the United States that might prove most responsible for making Putin’s eastern development agenda a success.",Left,1,alternet,32.71,-14.76
"One of the emerging criticisms of Bezos’s philanthropy is that in striving not to be controversial, it misses funding approaches that attack the deeper roots of the climate crisis and homelessness that advocates say need urgent attention.",Left,1,alternet,32.71,-14.76
Debate over the policy turned Monday’s school board meeting into a political circus.,Left,1,alternet,32.71,-14.76
John Kerry continues to insult every American who works hard to put food on the table.,Lean Right,1,boston-herald,36.31,9.68
He was bleeding from his ear when police officers arrived at the One Brigham Circle mall on Friday morning.,Lean Right,0,boston-herald,36.31,9.68
"Meanwhile, Jonathan Case makes the tiny part of Seyton glimmer with emotion; his drop earring begins to look like a tear.",Lean Left,0,the-guardian,40.67,-7.97
"The Toymaker’s Child features an epic cast The Toymaker’s Child Rayne theatre, London, 22 November-13 January You’ll be hard pressed to find a bigger festive cast than Chickenshed’s annual Christmas show.",Lean Left,0,the-guardian,40.67,-7.97
"In response, the U.S., its allies, and all people of goodwill must insist they are an illegitimate regime who have abused the Chinese people and the world for too long: it is time for them to go.",Right,1,american-greatness,18.93,22.45
We anticipate that our amphibian option will be ready in late 2024 and our piscine pavilion will likely be ready by mid-2025!,Right,0,american-greatness,18.93,22.45
Pelosi set aside her personal feelings to recruit a Republican willing to savage Trump precisely as Pelosi wished!,Right,1,townhall,24.95,19.79
Vice President Kamala Harris on Tuesday reached what she and Senate Majority Leader Chuck Schumer (D-NY) regarded as a major milestone.,Right,0,townhall,24.95,19.79
But let’s assume Trump keeps his lead and wins the nomination.,Right,0,townhall,24.95,19.79
"The overwhelming number of Mustangs after already attending basic training, have had the pleasure of their physical fitness needs shaped up by OCS.",Right,0,townhall,24.95,19.79
"According to Gallup, the GOP now has its biggest lead since 1991 - 53 percent to 39 percent - among Americans asked which party they trust to keep America prosperous.",Right,0,townhall,24.95,19.79
Our dedicated team of expert researchers has carefully searched the internet for the best real money online gambling sites in Pennsylvania and found five highly recommended sites.,Right,0,newsmax,28.9,13.54
"Originally from Washington, D.C., Michael Clark has written for over 30 local and national film industry media outlets and is based in the Atlanta Top 10 media marketplace.",Right,0,newsmax,28.9,13.54
"Other tried and tested withdrawal options commonly accepted are PayPal (e-Wallet), Apple Pay (Mobile Payments Digital Wallet), MasterCard (MasterCard Send - Debit Card), and Visa (Visa Fast Funds - Debit Card/Prepaid Card).",Right,0,newsmax,28.9,13.54
It will lead to a safer and far more enjoyable experience each time.,Right,1,newsmax,28.9,13.54
"Although there is no precise legal definition of ethnic cleansing under international law, the term was used to describe the abhorrent conduct that occurred in the conflict that ensued among the constituent nations that emerged in the aftermath of the dissolution of Yugoslavia.",Right,0,newsmax,28.9,13.54
"These casinos are hand-picked by Maple Casino’s team, providing you with casinos to go the extra mile with.",Right,1,newsmax,28.9,13.54
But wiping Ukraine off the face of the map has not.,Right,1,infowars,15.78,23.58
Here are four photos of Biden meeting with his deadbeat son's business associates.,Right,1,infowars,15.78,23.58
Peled would dart forward to the fence to shoot at him.,Lean Left,1,the-economist,42.4,-1.43
"In Alaska land, ice and oil stack neatly one over the other.",Lean Left,0,the-economist,42.4,-1.43
"But that is still enough to provide all the proteins used in the ribosomes and the various polymerases, to catalyse all the reactions that build up the other molecules the bacterium needs-such as those which make up its outer surface-and to break down the food it uses to provide the energy which drives everything else.",Lean Left,0,the-economist,42.4,-1.43
"My goal is [to] make this so people say, 'My God, they stop him three times, they destroy his bubble, but he made it.",Lean Right,1,reason,36.26,4.84
"The past decade of near-zero interest rates provided venture, real estate, and private equity a prosperous environment for growth-with plenty of liquidity and capital.",Lean Right,0,reason,36.26,4.84
"And online, where the brand has always been viewed with a sneering skepticism that Demna was a cynic pulling the wool over shoppers’ eyes, the criticism has only sharpened.",Lean Left,1,washington-post,38.8,-6.85
Sunday’s two-hour forum marked the first time the Latino Democrats of Prince George’s County hosted any campaign forum event - both live-streamed and translated into Spanish - signaling the growing political power and organization of a voting bloc that has often been taken for granted nationally by the Democratic establishment.,Lean Left,1,washington-post,38.8,-6.85
"So far, the May 14 primary has largely been a contest between three-term congressman Trone, a self-funded business executive, and two-term Alsobrooks with her phalanx of the state’s Democratic establishment.",Lean Left,1,washington-post,38.8,-6.85
"FED PAUSE LIKELY WON’T HELP STRUGGLING CONSUMERS Proponents of releasing barrels from the emergency stockpile say that doing so increases oil supplies and reduces prices at the pump, while also generating billions in revenue for the federal government.",Lean Right,1,fox-business,38.81,9.11
They bore the brunt of many COVID closure mandates and did not receive nearly enough compensation through the flawed PPP program and other efforts to compensate for the damage inflicted upon them.,Lean Right,1,fox-business,38.81,9.11
"Of course, it’s hard to beat something with nothing and the Chinese yuan has major problems of its own, such as a lack of transparency and China’s own massive debt.",Lean Right,1,fox-business,38.81,9.11
He pointed to factors such as the business changing and the quality of some of the films.,Lean Right,0,fox-business,38.81,9.11
"US farmer tears into Biden administration over China, Russia payment claims: ‘A real slap in the face’",Lean Right,1,fox-business,38.81,9.11
That means their starting prices stayed flat from where the prior models stood for the same versions.,Lean Right,0,fox-business,38.81,9.11
"The NIA found that while most older Canadians report they have a network of family and friends they can count on, more than four in 10 are considered to be socially isolated.",Lean Left,0,global-news,44.54,-4.26
"Cold winter weather has rolled in, and so has dull, flaky skin-but it doesn’t have to stick around.",Lean Left,0,global-news,44.54,-4.26
"She said she was trafficked for a year before she was able to escape, though she said she also returned a few times afterwards because of the coercion and manipulation her trafficker exerted on her.",Lean Left,0,global-news,44.54,-4.26
"In the consummation of human history, we will no longer need the light of the sun or the moon because the light of Jesus will be our Light (John 1:9, John 8:12, Revelations 22:5).",Lean Right,1,the-christian-post,36.41,10.31
This is fundamentally at odds with a Christian understanding of human dignity.,Lean Right,1,the-christian-post,36.41,10.31
"At a time when retail sales are up, these trans-embracing giants are underwater.",Lean Right,1,the-christian-post,36.41,10.31
Another method involves interviewing them with questions without giving away your intentions.,Lean Right,0,the-christian-post,36.41,10.31
That’s because the moon’s orbit isn’t perfectly matched up with the Earth’s.,Left,0,vox,39.59,-10.05
"Or, at least, it was correctly decided under the Supreme Court’s incompetently drafted decision in New York State Rifle & Pistol Association v. Bruen (2022), which places an extraordinarily high burden on any government lawyer tasked with defending any gun law in court.",Left,1,vox,39.59,-10.05
"There’s no good reason why the trial court can’t draw such a map in May, or why the state can’t run its 2024 congressional elections using the court-drawn map.",Left,1,vox,39.59,-10.05
A responsible Court would confess that it erred in Bruen and come up with a new framework that can be applied in a sensible and predictable way by lower court judges.,Left,1,vox,39.59,-10.05
Normal systems just don’t seem to work (I’ve tried strict budgeting [too rigid and hard to maintain] buckets [the world got in the way of the allocations] and berating myself for being terrible with money).,Left,1,vox,39.59,-10.05
"Dreadful in its own terms, aesthetically, and dreadful for the people who were already in that space before you broke ground on it.",Left,1,vox,39.59,-10.05
"Part of that is due to how small the sample sizes of college-educated voters of color are; the overwhelming majority of these voters do not have college degrees, so he classifies them as working-class voters.",Left,0,vox,39.59,-10.05
"Israel’s current right-wing government also seems uninterested in creating a multiethnic state with equal rights for Israeli Jews and Palestinians, guaranteeing ongoing strife.",Center,1,foreign-affairs,44.56,-6.55
"In fact, Xi seems to view taking the island as his personal mission.",Center,1,foreign-affairs,44.56,-6.55
One does not have to see everything through the lens of the Iraq war or insist that the United States somehow forced Putin to invade Ukraine to be worried about the underground empire’s lack of accountability.,Center,0,foreign-affairs,44.56,-6.55
"But Kissinger welcomed the result and refused to apply any pressure on the new, pro-U.S. regime to prevent human rights abuses-indeed, Kissinger did the opposite.",Center,1,foreign-affairs,44.56,-6.55
"A throughline in Kissinger’s complex career was the conviction that whenever American credibility was at stake, the blood of foreign citizens had to be shed.",Center,1,foreign-affairs,44.56,-6.55
"In the struggle to combat climate change, the world is fighting the last war.",Center,1,foreign-affairs,44.56,-6.55
"These episodes unleashed cataclysmic consequences, but few communities had to face them more than once over several generations.",Center,0,foreign-affairs,44.56,-6.55
"Although Hanoi’s military support for the Khmer Rouge was the greatest cause of Cambodian instability, the U.S. intervention, first in the form of secret bombing and then in the form of an invasion, contributed to the conditions that enabled the rise of what became a genocidal Khmer Rouge regime.",Center,1,foreign-affairs,44.56,-6.55
"These tendencies are magnified by communist ideology, which defines the United States as inherently hostile, and by Hanoi’s experience in previous negotiations with the United States.",Center,1,foreign-affairs,44.56,-6.55
"Such is the case not only with individual terrorists, who often compete with their enemies over who is more victimized, but also with terrorist groups and nation states.",Center,1,foreign-affairs,44.56,-6.55
"Ron DeSantis’s posts a total of seven times, according to CensorTrack data.",Right,0,newsbusters,19.99,20.48
"Liberals desire being dominated by conservatives and called pejoratives that imply they are weak and unintelligent, while conservatives want to be mocked for supporting former president Donald Trump, among other perceived transgressions, according to those who participate in this subculture.",Right,1,newsbusters,19.99,20.48
He made deals with dictators and helped overthrow regimes that backed the Soviets.,Right,1,newsbusters,19.99,20.48
Maria Elena Salinas went to D.C. to find out where the battle for a potential museum- the National Museum of the American Latino stands.,Right,0,newsbusters,19.99,20.48
Contact The Washington Post at 202-334-6000 and demand it stop acting as a shill for Argentina’s leftist political elite.,Right,1,newsbusters,19.99,20.48
Taylor Wilson: And so we expect this authorization for the probe to come next week.,Lean Left,0,usa-today,40.78,-4.12
"David Jackson Eliana Johnson, Megyn Kelly, Elizabeth Vargas are moderating Talk show host Megyn Kelly, NewsNation anchor Elizabeth Vargas and The Washington Free Beacon editor-in-chief Eliana Johnson will moderate the fourth GOP debate.",Lean Left,0,usa-today,40.78,-4.12
The LSU senior has put together one of the most productive seasons by a quarterbacks in Bowl Subdivision history.,Lean Left,0,usa-today,40.78,-4.12
"Emma McIntyre, Getty Images For Balenciaga Tracee Ellis Ross attends the Balenciaga show in Los Angeles on Dec. 2, 2023.",Lean Left,0,usa-today,40.78,-4.12
He appealed the order and we just got a decision on Thursday from an appellate court saying the order would stand for now.,Lean Left,0,usa-today,40.78,-4.12
"When the Reformers looked at the Bible, they saw the vibrancy and diversity of language as a necessary vehicle for communicating God’s speech to the church in all places and times.",Lean Right,0,christianity-today,41.75,5.39
Any church where being unmarried (for whatever reason) means living a life without love is failing to be a New Testament church.,Lean Right,1,christianity-today,41.75,5.39
"And so the father, his little guy was three or four years old, and he held the door open with his right arm, and the little boy was kinda lollygagging around, gawking around.",Lean Right,1,christianity-today,41.75,5.39
"The right question should be, What are we called to do and what's the best way to do it?",Lean Right,0,christianity-today,41.75,5.39
Hellbound Imagine a supernatural figure appears and tells you precisely when you are going to die-what would you do?,Center,0,wired,36.77,-7.24
"What society seems to throw to one side, and they'll realize they made a big mistake.",Center,1,wired,36.77,-7.24
Red blood cells are pretty much all the same thing in your body.,Center,0,wired,36.77,-7.24
But when you do this (puts gun to his right temple) how you gonna get your hand - your second hand around there to do it (reaches around with his left hand to try and reach the button)?,Lean Left,1,cbs-news,41.76,-2.84
Nikki Battiste: Do you think Alex Murdaugh still thinks he can try to play the system - Ronnie Richter: A hundred percent.,Lean Left,1,cbs-news,41.76,-2.84
"So, it gives a platform to all this inflammatory rhetoric and does nothing to help Israelis and Palestinians on the ground,"" said Gregory.",Lean Left,1,cbs-news,41.76,-2.84
"Artificial intelligence is the magic of the moment but this is a story about what's next, something incomprehensible.",Lean Left,1,cbs-news,41.76,-2.84
Streaming site Twitch has hit its Korean community with a whirlwind of bad news.,Center,0,quartz,43.87,-4.77
"Her Lyda Hill Philanthropies supports museums, basic research, and programs like National Geographic Explorers.",Center,0,quartz,43.87,-4.77
"Lengthy commitment periods, like the three or more years specified in the contracts reviewed by Quartz and Type Investigations, undermine the free movement of labor and deny workers one of their strongest bargaining chips: the ability to quit their jobs if the conditions of employment don’t suit them.",Center,1,quartz,43.87,-4.77
"As a result, experienced nurses are more than qualified to fill them.",Center,0,quartz,43.87,-4.77
"Rob Wittman (R-VA); Mara Karlin, assistant secretary of defense for strategy, plans, and capabilities; Elizabeth Rosenberg, assistant secretary of treasury for terrorist financing and financial crimes 8 a.m. 2401 M St., NW - George Washington University Project for Media and National Security Defense Writers Group breakfast conversation with Benedetta Berti, head of NATO policy planning in the office of the NATO Secretary-General.",Lean Right,0,washington-examiner,34.07,11.3
"Last week saw a violent confrontation at the annual Rockefeller Center tree lighting ceremony in New York City, when a large pro-Palestinian crowd clashed with the police.",Lean Right,0,washington-examiner,34.07,11.3
"When we wake, during the day, before we return to sleep and whenever we need to restore some balance and calm into our lives, think and give thanks for all of the abundance you encounter each day and share that with others.",Right,0,fox-news,35.44,11.06
"He says, ‘You’re not going to be a dictator, are you?",Right,0,wnd,13.06,21.0
"This event is historic by all measures, exceeding even the storied chronicles of Ellis Island, and portends the same permanent change for the nation.",Right,1,wnd,13.06,21.0
"The Telegraph reports that at least 100 children, some as young as 12, have been given the drugs since July 2022 regardless of the NHS’ decision that month to stop doing so based on a damning review by Dr Hilary Cass, former president of the Royal College of Paediatrics and Child Health.",Right,0,wnd,13.06,21.0
"Biden's dire approval ratings are an issue for him, but not necessarily predictive, they said.",Lean Left,0,abc-news,45.25,-2.91
Now you’re calling for a permanent ceasefire or is it not - KHANNA: A lasting ceasefire.,Lean Left,1,abc-news,45.25,-2.91
FILE - This combination of photos shows Republican presidential candidates Florida Gov.,Lean Left,0,abc-news,45.25,-2.91
"Those with eyes to see will recognize that when he’s not beefing up his presence in Iowa, or his credentials in New Hampshire, DeSantis is, by deed, auditioning for the White House in his eye-catching governance of the Sunshine State.",Lean Right,1,hotair,24.77,12.78
Noted Kabul bug-out strategist and American-abandoner Lloyd Austin publicly advised that the IDF could never accomplish that goal without being a lot nicer to people.,Lean Right,1,hotair,24.77,12.78
"The waves of change are here, and Republicans have the opportunity to ride them toward a future of greater unity and understanding.",Right,1,the-american-spectator,17.46,22.97
"After all, his June and July town halls with Donald Trump drew only 2.8 and 2.9 million, respectively.",Right,1,the-american-spectator,17.46,22.97
"In return, Xi got a year of reduced pressure, new nonmilitary dialogues, sanctions lifted, advance warning of U.S. actions, and reduced U.S. Navy presence around Taiwan-not to mention the $40,000-per-plate private-sector dinner Xi used to propagandize to the willing ears of the pro-China lobby.",Right,1,the-american-spectator,17.46,22.97
"As venture-capital funding poured in-seven more rounds followed-Neumann hired engineers to work on techie-sounding projects, such as building an exclusive social-networking platform for WeWork members.",Left,1,the-atlantic,37.96,-9.01
Lili Wood Lionel had to wait a few days for the drama of Hollis’s injury to play out before asking Warren for some space in the paper to profile Nathan.,Left,0,the-atlantic,37.96,-9.01
"Read: What Big Tech wants out of the pandemic MacGillis, a reporter at ProPublica and the author of a Mitch McConnell biography titled The Cynic, was one of the first journalists to begin documenting the socioeconomic upheaval that helped shift the rural Rust Belt from blue to red and put Donald Trump in the White House.",Left,0,the-atlantic,37.96,-9.01
It makes the right tribute to beauty and it’s the correct moral stance toward the more ephemeral qualities of childhood.,Left,1,the-atlantic,37.96,-9.01
"Twenty-five thousand people were here tonight, some of them sitting 200 feet in the air, to see men play as silly a game as has ever been conjured.",Left,1,the-atlantic,37.96,-9.01
"If Xi could vote in November, he would surely cast his ballot for Trump.",Left,1,the-atlantic,37.96,-9.01
"Rosin: Without enough clean water, people get dehydrated, hygiene deteriorates, sewage backs up.",Left,0,the-atlantic,37.96,-9.01
November 2010: Joe Biden had a sit-down meeting with Eric Schwerin - the president of Hunter’s private equity firm - in the West Wing.,Right,0,the-gateway-pundit,14.91,23.64
But such anodyne-sounding definitions come at a time when censorship by government in tandem with news outlets and social media has stirred controversy and court challenges.,Right,0,the-gateway-pundit,14.91,23.64
"She does her ‘yas queen’ rantings for the camera, accusing others of bigotry but can’t take the slightest bit of pushback.",Right,1,the-gateway-pundit,14.91,23.64
"The Biden regime’s policies have stripped the Border Patrol of any respect by foreign governments, cartels and smugglers.",Right,1,the-gateway-pundit,14.91,23.64
Six Trump electors were indicted on felony charges by a grand jury in the Eighth Judicial District Court in Nevada.,Right,0,the-gateway-pundit,14.91,23.64
This entire affair has exposed massive rot at some of America’s ‘top’ schools.,Right,1,the-gateway-pundit,14.91,23.64
"In this case, Zaluzhny has more guns than Zelensky and he and his team have better fire discipline.",Right,1,the-gateway-pundit,14.91,23.64
"They don’t want to live by their own standards, and that’s not a tenable position for a functioning society.",Right,1,the-gateway-pundit,14.91,23.64
She will be missed by all those who knew and loved her.,Right,0,the-gateway-pundit,14.91,23.64
"Sheriff Lamb alleges that illegal border crossers in Arizona are immediately given a $5,000 gift card once they step foot inside the United States - and free plane ticket!",Right,1,the-gateway-pundit,14.91,23.64
"From this point, the Chinese will either cross the Darién Gap and trek up to the United States or will fly directly into Mexico if they have a visa.",Right,1,the-gateway-pundit,14.91,23.64
The president and his allies have largely shrugged off polling that some point to as warning signs for his reelection bid - as concerns about the economy and other issues continue to circulate.,Right,0,the-gateway-pundit,14.91,23.64
These people need to feel the heat and pressure of the public otherwise they will think they can get away with anything and never have to answer for their decisions.,Right,1,the-gateway-pundit,14.91,23.64
"CNN reported: Prosecutors in the Georgia election subversion case against former President Donald Trump have officially listed former Vice President Mike Pence as one of the witnesses who could be called to testify at trial, according to multiple sources familiar with court documents that remain under seal.",Right,0,the-gateway-pundit,14.91,23.64
"To be clear, taking Biden at his word is always hazardous.",Right,1,the-gateway-pundit,14.91,23.64
DocGo is the company NYC has contracted to organize the housing and services given to the illegal immigrants.,Right,1,the-gateway-pundit,14.91,23.64
"If it wasn’t enough that the Mayor of New York City was boldly stating to send migrants to their areas of jurisdiction, the Governor saw her opportunity to score political points as well.",Right,1,the-gateway-pundit,14.91,23.64
"Millions of Americans watched in horror this week as the presidents of Harvard, MIT and Penn testified before Congress about the vile anti-Semitism we have seen on their campuses in recent weeks.",Right,1,the-gateway-pundit,14.91,23.64
"Having a decent pair of eyes, the ability to read English, and an honest, functioning brain will do the trick even without political sympathies.",Right,1,the-gateway-pundit,14.91,23.64
