text,source_party,label,source,reliability,bias
"The event features boutique shopping, silent auction, luncheon and fashion show.",Lean Left,0,san-diego-union-tribune,45.68,-1.76
"Rees, who served as a deputy assistant for domestic policy to former Vice President Dick Cheney, knows all too well how that game is played.",Left,1,alternet,32.71,-14.76
"They got the third PP of the game early in the second but, again, they were kept off the board thanks to Columbus goalie Spencer Martin.",Lean Right,0,boston-herald,36.31,9.68
Simply email letterstoeditor .com Go here for our letters page and let us print your opinions!,Lean Right,0,boston-herald,36.31,9.68
This absurdity also exposes the problems that have come from the Supreme Court allowing Congress to ignore constitutional limits on its authority and then delegate its power to bureaucrats.,Lean Right,1,boston-herald,36.31,9.68
They punched him from behind before he was able to run away.,Lean Right,0,boston-herald,36.31,9.68
Building a reliable pipeline of homegrown arms is exactly how Breslow made his name as an executive in the first place.,Lean Right,0,boston-herald,36.31,9.68
"Like Monday’s blowout in Washington, D.C., the Celtics rested their starters for the entire fourth quarter.",Lean Right,0,boston-herald,36.31,9.68
"But if you want to continue to interact with these former in-laws, refrain from the temptation to use it to cut their brother down to size.",Lean Right,0,boston-herald,36.31,9.68
But there is no debating they are the NFL’s most boring.,Lean Right,1,boston-herald,36.31,9.68
"And their offense, averaging a measly four yards per play - four!",Lean Right,1,boston-herald,36.31,9.68
"So, Healey should say basta and hire Giovanbattista Fazzolari right away.",Lean Right,1,boston-herald,36.31,9.68
He’s hauled a few goose-neck trailers with it and some cows for a friend.,Lean Right,0,boston-herald,36.31,9.68
The two-seeded Skippers finished with 226 yards on the ground as well as four rushing scores to take down the No.,Lean Right,0,boston-herald,36.31,9.68
"Even Belichick's lame, mumbly and defensive press conferences are scoring more points with a ticked-off fan base than his offense is.",Lean Right,1,boston-herald,36.31,9.68
"There’s much critics hate here - including that some lower-income households might end up paying more, not less - but don’t lay blame or thanks for this sea change at the CPUC’s feet.",Lean Right,1,boston-herald,36.31,9.68
"But reconstructing how a large operation handles its animals, grazing and birthing is easier said than done - and often comes with other consequences, Deal said.",Lean Right,0,boston-herald,36.31,9.68
Smith has serious reservations about allowing others to drive his truck.,Lean Right,0,boston-herald,36.31,9.68
Has workplace culture become so impersonal that people no longer have or employ basic social skills?,Lean Right,0,boston-herald,36.31,9.68
"Yet, with all these Wonder Woman-sized missions of self-fulfillment on the go, there’s still more to do.",Lean Right,1,boston-herald,36.31,9.68
But just look at his ingenious schemes to foil a pair of not-so-bright burglars.,Lean Right,1,boston-herald,36.31,9.68
"Its question is: When your job is welcoming the world to your house, how do you greet them?",Lean Right,1,boston-herald,36.31,9.68
"Whereas Iowa Republicans tend to be very conservative, 40-50% of the vote in the New Hampshire primary is likely to be unaffiliated voters who are less inclined to vote for Trump than the average GOP primary voter.",Lean Right,1,boston-herald,36.31,9.68
"Speaking on background, the official said that it is not the goal of his nation’s military to target the Palestinian people also held hostage by Hamas terrorists, and that resulting calls by some in the U.S. to show the hostage takers some quarter demonstrate a fundamental misunderstanding of the situation on the ground.",Lean Right,1,boston-herald,36.31,9.68
Obviously you guys have been here longer than me watching Patriots games.,Lean Right,0,boston-herald,36.31,9.68
"During that time, he said he came to accept the wolves and changes that were coming, though other ranchers remain bitter.",Lean Right,0,boston-herald,36.31,9.68
Poor people in rural areas are relatively expensive to serve; rich people in condos in urbanized areas are cheap to serve.,Lean Right,1,boston-herald,36.31,9.68
"A wave of impactful arms soon materialized, helping accelerate Chicago’s rebuild and getting the Cubs back into playoff contention years ahead of schedule.",Lean Right,0,boston-herald,36.31,9.68
"Then, if they also lost out on Yamamoto, they may find themselves empty-handed and suddenly facing a heavily depleted pitching market.",Lean Right,0,boston-herald,36.31,9.68
The former Celtic galloped around the court and chest-pumped Myles Turner as the rest of his Pacers teammates flooded the court to celebrate an imminent victory.,Lean Right,0,boston-herald,36.31,9.68
"DUBAI, United Arab Emirates - The United States committed to the idea of phasing out coal power plants, joining 56 other nations in kicking the coal habit that’s a huge factor in global warming.",Lean Right,0,boston-herald,36.31,9.68
"There’s no legal requirement for PBMs to provide equal reimbursement, so they can favor affiliated pharmacies while leaving independents out.",Lean Right,1,boston-herald,36.31,9.68
Senate Republicans claimed victory for pushing the branch to agree to a formal session which never occurred because the House did not move on the motion.,Lean Right,0,boston-herald,36.31,9.68
The Wu Administration is actually exploring such an idea as a basic income program.,Lean Right,0,boston-herald,36.31,9.68
Even worse than lax application of U.S. immigration laws are consistent efforts to reward immigration law breakers.,Lean Right,1,boston-herald,36.31,9.68
The Celtics led by 21 at halftime after another blistering hot offensive first half and kept their foot on the gas pedal.,Lean Right,1,boston-herald,36.31,9.68
This progressive bit of ratemaking is brought to you via unassuming little paragraphs in a bill passed (with precious little public comment or debate) by the Legislature and signed by the governor last year: Assembly Bill 205.,Lean Right,1,boston-herald,36.31,9.68
"Around mile marker 2.6 near Exit 3, police said, the truck hit the Honda head on in the southbound left lane.",Lean Right,0,boston-herald,36.31,9.68
Tatum scored 12 of his 30 in the second quarter as he attacked mismatches like T.J. McConnell.,Lean Right,0,boston-herald,36.31,9.68
"Fans feel it, like the rain droplets that soaked their jerseys and sweatshirts Sunday; tears from the Foxboro football gods above.",Lean Right,1,boston-herald,36.31,9.68
Mortenson said he took his second shot at the buck in the range of 75 to 80 yards.,Lean Right,0,boston-herald,36.31,9.68
"And once vulnerable to horrible losses to inferior teams, the Celtics have not overlooked their opponents this week.",Lean Right,0,boston-herald,36.31,9.68
"Our original plan was to stay with a group of people, but at the last minute, Chris admitted to being upset that we weren’t going alone.",Lean Right,1,boston-herald,36.31,9.68
The police did not indicate whether Kenney was a restaurant patron or a passerby.,Lean Right,0,boston-herald,36.31,9.68
Our economy was not shackled by regulations and we controlled the oil market across the globe.,Lean Right,1,boston-herald,36.31,9.68
"What you get is coming-of-age memoir, triptych and the most charmingly casual of art educations.",Lean Right,0,boston-herald,36.31,9.68
Left-leaning think tanks and policy institutes such as The Brennan Center for Justice took it upon themselves to issue public statements castigating Trump.,Lean Right,1,boston-herald,36.31,9.68
"November’s tax numbers, due out this week, are also expected to miss benchmark, according to the Senate Ways and Means Chair.",Lean Right,0,boston-herald,36.31,9.68
"The Alabama Crimson Tide who lost to Texas were chosen because, well let’s be honest the TV networks pressured the selection committee to choose Alabama because they are historically a much better known team than Florida State University.",Lean Right,1,boston-herald,36.31,9.68
That’s the message you’ll receive - loud and clear - when you are pushed out.,Lean Right,1,boston-herald,36.31,9.68
"Harvey Silverglate Cambridge Slamming Court In the wake of the Supreme Court’s affirmative action ruling striking down race-based admissions at colleges and universities, President Biden, his fellow Democrats and their coat holders in the liberal media immediately began attacking the Court and even individual justices.",Lean Right,1,boston-herald,36.31,9.68
How about for the taxpayers whose money would be used for these free money handouts?,Lean Right,1,boston-herald,36.31,9.68
She was paddleboarding with a male relative at the rear of the resort in western New Providence.,Lean Right,0,boston-herald,36.31,9.68
"Part of the stress from the reintroduction is the potential to lose animals and income, Deal said.",Lean Right,0,boston-herald,36.31,9.68
"Adrienne Shelley, who is no longer with us, was a huge part of our creative conversations and continued the legacy of this beautiful story and film that she made.",Lean Right,0,boston-herald,36.31,9.68
The whole thing is even more absurd given that Stellantis is simply responding to government mandates.,Lean Right,1,boston-herald,36.31,9.68
Lawmakers barred Healey from using the entire $250 million until her administration finds and opens the overflow site by Dec. 31.,Lean Right,0,boston-herald,36.31,9.68
"These bills aim to curb the power of pharmacy benefit managers (PBMs) - the giant, secretive corporations that have played a significant role in driving drug prices higher and independent pharmacies out of business.",Lean Right,1,boston-herald,36.31,9.68
"They went on a 14-0 run in the opening minutes, a stretch that was a testament to how scary they can be offensively.",Lean Right,0,boston-herald,36.31,9.68
"Justin Turner was arguably Boston’s most valuable player last season, greatly exceeding expectations at the plate while immediately establishing himself as an indispensable clubhouse leader.",Lean Right,1,boston-herald,36.31,9.68
The only parts of our immigration system that are currently broken are the moral and political compasses of those we have chosen to oversee it.,Lean Right,1,boston-herald,36.31,9.68
A car fire on the northbound side of Interstate 93 in Stoneham Thursday before noon tied up traffic as firefighters tackled the blazing vehicle.,Lean Right,0,boston-herald,36.31,9.68
"Its photos, by Mark Seliger, make a strong argument that Hollywood hasn’t lost its glamour, only changed its faces.",Lean Right,0,boston-herald,36.31,9.68
"Even though we’ve got five games left and are not going to the playoffs, you don’t wanna put (expletive) on film and look bad.",Lean Right,1,boston-herald,36.31,9.68
History and comments from Democratic operatives suggest the answer is no.,Lean Right,1,boston-herald,36.31,9.68
It’s time to put an end to secret and unsavory practices.,Lean Right,1,boston-herald,36.31,9.68
"Despite the size of predicted shortfalls, the news did not seem surprising to the committee, which is understandable considering the state is about half-way through the fiscal year and has already taken in about $350 million less than originally forecast by the same policy group.",Lean Right,0,boston-herald,36.31,9.68
"Massachusetts, like urban states elsewhere in the country, is overwhelmed with illegal immigrants and is in a quandary what to do about them.",Lean Right,1,boston-herald,36.31,9.68
"Even when they built big leads, they lost focus and lost them.",Lean Right,1,boston-herald,36.31,9.68
"Being proactive for the sake of being proactive, she said, doesn’t make financial sense.",Lean Right,1,boston-herald,36.31,9.68
"To search on this database, click the magnifying glass icon (at right) and enter names and more.",Lean Right,0,boston-herald,36.31,9.68
"There will be endless protests, upheaval and legal attempts to deny Republicans the win.",Lean Right,1,boston-herald,36.31,9.68
"Also, a loving filmography, a minor class in underground cinema, a cast yearbook, a lionizing and some great contextual essays (including one by David Simon).",Lean Right,0,boston-herald,36.31,9.68
But this excellent new survey of Chicago sculptor Simone Leigh feels both very overdue and right on time.,Lean Right,1,boston-herald,36.31,9.68
That or they understood early on that books were easier to tailor than silk dresses.,Lean Right,1,boston-herald,36.31,9.68
"The Pacers entered the night allowing the fewest 3-pointers in the league at nine per game, but they hadn’t faced a team like the Celtics, who scorched them for eight 3-pointers in the opening period.",Lean Right,0,boston-herald,36.31,9.68
"Yet today, Mr. Trump’s loudest critics are now overtly engaging in the very behavior they once condemned.",Lean Right,1,boston-herald,36.31,9.68
"Historic or not, it is indicative of Europe’s growing concern with illegal immigration.",Lean Right,1,boston-herald,36.31,9.68
"Burns countered with a jumper on the baseline, but Zackery answered with a drive to make it 68-68 with 1:02 remaining.",Lean Right,0,boston-herald,36.31,9.68
"In a playoff-like atmosphere, the C’s couldn’t get the job done on Monday night in Indiana.",Lean Right,0,boston-herald,36.31,9.68
"Paul McCartney was a prolific photographer as a Beatle, and 250 of his images are making their U.S. debut in Norfolk at the Chrysler Museum of Art.",Lean Right,0,boston-herald,36.31,9.68
"Half an hour from Folkestone and then just over two hours to Brakel, a small town in the south of Flanders, handily placed for the Ronde van Vlaanderen loops, three circuits of the region: red, yellow and blue, between 80km and 115km, each carefully planned to ferret out the steepest of hills in this flattest of countries, and all punctuated with sections of teeth-shattering cobbles.",Lean Left,0,the-guardian,40.67,-7.97
Some members of Congress have criticized the border security request as inadequate and lacking any serious measures to secure the U.S. southern border.,Right,0,american-greatness,18.93,22.45
"In December 2015, when Biden was vice president, the United Nations held the COP21 climate change conference in Paris that resulted in an international agreement.",Right,0,townhall,24.95,19.79
"Guterres invoked Article 99 of the U.N. Charter, which says the secretary-general may inform the council of matters he believes threaten international peace and security.",Right,0,newsmax,28.9,13.54
"More importantly, however, it can also serve as a basis for channeling the Russian assets seized by the West into uses that would be appealing to all parties.",Right,0,infowars,15.78,23.58
One is that offsetting is voluntary; no one has to do it.,Lean Left,0,the-economist,42.4,-1.43
A parent's supervised visitation with a child is required where it is shown that unsupervised visitation would be detrimental to the child.,Lean Right,0,reason,36.26,4.84
Catherine Rampell writes that Trump’s economic track record and his recent signals that he’d strong-arm the Federal Reserve as again-president mean that price hikes under him could make the inflation under President Biden look like a three-day-old birthday balloon.,Lean Left,1,washington-post,38.8,-6.85
Roughly 1-2 million people reportedly had subscribed to the paid version in March.,Lean Right,0,fox-business,38.81,9.11
"After days of shaving off the edges of key warming issues, climate negotiators Tuesday zeroed in on the tough job of dealing with the main cause of what’s overheating the planet: fossil fuels.",Lean Left,1,global-news,44.54,-4.26
"The present discussion is a disagreement among complementarians, not a debate between complementarians and egalitarians.",Lean Right,0,the-christian-post,36.41,10.31
An account posing as the Jerusalem Post fueled a false rumor that Israeli Prime Minister Benjamin Netanyahu was in the hospital.,Left,0,vox,39.59,-10.05
"This task was brought into stark relief by Russia’s unprovoked invasion of Ukraine in February 2022, as well as by China’s increasing assertiveness in the South China Sea and across the Taiwan Strait.",Center,1,foreign-affairs,44.56,-6.55
"CNN's Daniel Dale weaseled through it: ""the committee subpoenaed years of financial records; the fraction CNN has seen does not prove with absolute certainty that there was a loan.",Right,1,newsbusters,19.99,20.48
"Without that experience and sensitivity, another loud voice just adds to a problem.",Lean Left,1,usa-today,40.78,-4.12
He described walking into Josh’s room and finding him with his hands raised in a posture of worship.,Lean Right,0,christianity-today,41.75,5.39
"The Missouri dog first got sick on October 7, a light cough quickly progressing into a wet hacking one, loss of appetite, and lowered blood oxygen levels.",Center,0,wired,36.77,-7.24
He spoke exclusively with CBS News Texas Friday afternoon at the Texas Capitol.,Lean Left,0,cbs-news,41.76,-2.84
"Airlines then use the money made from selling those certificates to buy a certain amount of SAF instead of traditional jet fuel, reducing their emissions.",Center,0,quartz,43.87,-4.77
Immunity debt is a concept that claims efforts to avoid infectious diseases for a prolonged period make entire populations more susceptible to illness when those precautions are lifted.,Lean Right,0,washington-examiner,34.07,11.3
"They would happily vote for hollow border concessions to make it look like they’re standing strong, while really they’re just tacking a fig leaf onto more money for foreign wars.",Right,1,fox-news,35.44,11.06
He clearly and strongly points out the utter fallacy and failure of Free Trade.,Right,1,wnd,13.06,21.0
"ABC News Asked whether the ABC News investigation influenced their decision to take the directory offline, Butler said it played a part in calling the problems to Stina's attention, but in combination with larger issues.",Lean Left,0,abc-news,45.25,-2.91
He knows that Hamas must be completely destroyed or the war will have been lost.,Lean Right,1,hotair,24.77,12.78
"Back in 2021, Manfred egregiously politicized America’s beloved national pastime by punishing Atlanta - pulling the MLB All-Star game from that city - in protest of the state of Georgia’s crucial new election-integrity laws.",Right,1,the-american-spectator,17.46,22.97
"President Lincoln knew that whichever way the vote went, there was going to be mayhem.",Left,1,the-atlantic,37.96,-9.01
The negative impacts of tourism on the environment have become so severe that some are suggesting drastic changes to our travel habits are inevitable.,Right,0,the-gateway-pundit,14.91,23.64
"If you only need to update the expiration date on your current credit card, click here for those steps.",Left,0,daily-beast,33.54,-10.51
"Paddle the mangroves With some 200-odd islands, it would take years to see all of Abu Dhabi.",Lean Left,0,the-independent,38.37,-6.99
This is a project of the Colorado Division of Motor Vehicles: a DMV on wheels.,Center,0,christian-science-monitor,44.22,-2.47
This new revelation fits a pattern that has emerged in the House investigation into the President and his family’s business dealings.,Lean Right,1,just-the-news,33.31,10.7
"If you really want to build your family office, you keep investing.",Center,0,cnbc,43.82,-1.81
"A New Jersey elementary school had an unexpected visitor over the Thanksgiving holiday weekend - a deer that jumped through a window and made a paid a visit to an elementary school in New Jersey on Nov. 25, just in time for the holidays.",Lean Right,0,washington-times,34.92,11.31
"And while Balzac is at pains to show us his deep detestation of these dangers, we also sense a certain fascination with the profound immorality of his terrible bachelors.",Lean Left,1,the-conversation,40.75,-4.86
"The Big Lebowski Year: 2020 Runtime: 2h 3m Director: David Dobkin Why did it take so long to satirize the wonderful, unapologetic excess of the Eurovision Song Contest?",Left,1,new-york-magazine,39.84,-9.95
"For an outsider, those directions might be almost inscrutable-where is the new tree, and why speak of its predecessor?",Left,0,the-new-yorker,40.91,-12.25
He was a Commonwealth Scholar at Oxford University from 1989 to 1991 and a Woodrow Wilson Scholar at Princeton University from 2004 to 2006.,Right,0,the-american-conservative,31.63,14.44
"A century ago, amid the Roaring Twenties, three Republican presidential administrations devoted themselves to the interests of the wealthy, promoting union-busting and slashing regulations.",Lean Left,1,washington-monthly,35.78,-12.08
"And while Verstappen’s loyal fans show up decked out in orange wherever he goes, over the past two seasons he’s won with such relative ease, it’s drained some drama from the races.",Lean Left,1,time-magazine,41.12,-7.42
"Seattle reported 59 F at 1 a.m. Tuesday morning, breaking its previous daily record high, the weather service said.",Center,0,fortune,36.93,-2.44
"However, he admitted that even a delay in the provision of American aid could pose a challenge for Kiev.",Lean Right,0,rt,28.66,11.46
"This contrasts with renewable sources such as wind and solar, which are intermittent and reliant on weather conditions.",Right,0,the-federalist,21.77,18.67
"But suddenly, it was day two, the Sky News tech correspondent started to show us all the thing you have seen in all the afternoon, how the reality was at our eyes totally hacked.",Left,1,vogue,39.13,-10.91
"They were really well done, especially because Ray is an engineer and has a scientific mindset.",Right,0,national-catholic-register,22.39,11.81
"Haun shared the story of one impacted family, the Morrisons, whose 10-year-old daughter has Down syndrome and attention deficit disorder.",Right,0,national-catholic-register,22.39,11.81
Governor: There are a couple of gubernatorial races across the country that could have national ramifications and others that appear to be much more competitive than many would have expected.,Right,0,independent-journal-review,25.81,12.82
"Cox’s new housing innovation adviser Cox said he recognizes his vision for housing in the state will require a coordinated push from city and county governments as well as buy-in from the homebuilding industry, and Utah’s Legislature.",Center,0,deseret-news,42.29,2.55
"FEMA is the only agency that provides flood insurance for homes in floodplains, and they’re responsible for drawing flood maps.",Lean Left,0,the-verge,39.43,-4.75
"Devin Booker and coach Frank Vogel both fumed after the game, with the star guard later posting a screenshot on Instagram that seemingly supported his belief that the refs blew the call.",Lean Right,1,new-york-post,31.92,9.28
Transit officials say the tolls should go into effect in May.,Left,0,new-york-daily-news,40.47,-8.12
There is no negotiating with government; you either give them the price they set or you don’t get access to the 65 million Americans on Medicare.,Right,1,american-thinker,13.67,24.85
"More recently, Rhodes has been writing his own columns for the Times and attacking Israel for waging war on Hamas, the Iranian-funded terrorist group that murdered more than 1,200 Israelis on Oct. 7.",Right,1,washington-free-beacon,23.47,14.45
Now the good news: There's a new book out that will teach us how to survive it.,Left,0,esquire,27.41,-18.14
"There, marchers joined an ongoing candlelight vigil and protest in front of a controversial housing project.",Lean Left,0,cnn,42.06,-6.28
While ASU now finds itself going head-to-head with a regional No.,Center,1,az-central,42.22,-7.0
"And with politicians entering an election year when many will promise the moon, the fiscal backdrop could get worse before it gets better.",Center,1,az-central,42.22,-7.0
"The athletes who had the biggest impact on D. Watkins, Salon's editor at large, this year are not just recognized for their athletic greatness.",Left,0,salon,32.38,-13.86
"On top of the court workload, with the voluminous reading it requires, she takes seriously her role as a public figure, answering mail, delivering speeches and receiving visitors to the court, whether from abroad or from a local high school.",Left,0,daily-kos,28.4,-17.51
The simple explanation is that lawyers have way too much heft within environmental organizations.,Left,1,mother-jones,37.08,-15.12
"Robinson To an ordinary human being with an ordinary sense of ethics, a number of the ways in which he lived his life and made decisions strike one as bizarre.",Left,1,current-affairs,34.3,-18.14
"War in the Shadows For almost 10 years, the U.S. has battled a rotating cast of enemies in Syria, including the Syrian Armed Forces and pro-Syrian government forces; terrorist organizations such as ISIS; Iran’s Islamic Revolutionary Guard Corps; Iranian-backed militias; the Russian-backed Wagner Group; and the armed forces of Turkey, according to Paul’s bill, which notes that Congress has not declared war against Syria or any group in that country.",Left,0,the-intercept,37.46,-14.1
"People who want to split up simply deal with all the angst and difficult feelings because of their belief that what’s on the other side is worth it, and is what they need.",Left,0,slate,35.17,-12.93
Articles in the app are also limited to those published in the last few days.,Lean Left,0,atlanta-journal-constitution,44.83,-3.84
"Advertisement Some McCarthy loyalists on Wednesday expressed disappointment over their former leader’s retirement, with some blaming the eight Republicans who voted to oust him in October.",Lean Right,1,fiscal-times,43.33,-4.18
This is the prime minister’s responsibility and moral and ethical duty.,Lean Left,1,detroit-free-press,43.46,-5.43
