text,source_party,label,source,reliability,bias
"Snoop, whose music catalog speaks for itself, spent the nascent stages of his career unapologetically money-minded but also in fierce opposition to the systems that keep white men rich and Black men behind bars.",Lean Left,1,the-root,26.43,-18.51
‘Worship of the Holy Framers Offers Us Nothing to Deal With the Problems We Have Today’,Lean Left,1,fair,32.6,-19.36
"He was barely getting by in a one-bedroom apartment in L.A.'s Crenshaw neighborhood, making ends meet on his income from Social Security and odd jobs.",Lean Left,0,npr,42.99,-4.27
"But every time she appears on-screen, it distracts from the film’s main selling point: expansive, cast-of-hundreds combat scenes that prove both Napoleon’s keen military strategy and Scott’s gift for staging such clashes.",Lean Left,1,variety,41.29,-3.85
HBO has obtained the rights to turn the text into a movie.,Left,0,occupy-democrats,25.3,-21.06
Roman said Gat called him at around 7:30 a.m. on Oct. 8 and told him what had happened the previous day.,Lean Left,0,washington-blade,42.71,-7.49
"Torture is commonplace, including the blasting of music like popular Israeli children’s songs.",Lean Left,1,truthout,34.51,-16.87
Relatives and friends of UNLV students lined up across the street from the campus as they waited for word about their loved ones.,Lean Left,0,nbc-news,43.21,-5.79
NOTE TO TEACHERS: Here is the full Is This Legit video created by Ian Fox.,Center,0,poynter,41.75,-7.32
"She is, to use the nomenclature of the American bureaucracy, an alien.",Left,1,the-nation,31.32,-19.23
"Advertisement There’s a real sense that an inclusive Hispanic-American identity died along with Selena, or that maybe we’d be further along as a community if she were still here.",Left,1,huffpost,37.82,-10.75
Sacajewea’s fictive journals describe the brutality she endured and her mental rebellions.,Lean Left,1,montana-free-press,46.33,-3.8
These are the sorts of people who know what they like and when they want it -- and that usually means they don't wait to make those special purchases.,Center,1,cnet,40.02,-1.39
"Consider all-white linens Having crisp, all-white linens is one of the easiest ways to recreate that high-end hotel look at home.",Center,1,cnet,40.02,-1.39
"Citing policy, the RCMP could not confirm if Nippak is a part of the MacDonald investigation.",Left,0,vice,38.96,-9.39
"Rao’s suit, which makes other claims of impropriety, is pending in state Superior Court in Newark.",Lean Left,0,nj.com,43.92,-2.88
One aspect of genocide is the forcible transferrence of children from one group to another.,Right,0,cbn,34.17,15.24
Ms. Blackburn said they spoke briefly after the abrupt end to the late November hearing.,Lean Right,0,zerohedge,20.78,16.08
The Gamble of Signing Evans Did Not Pay Off The team had been pretty quiet when it came to the topic of Evans’ practice reps.,Center,0,heavy,43.64,-2.71
"Based on the terms of that borrowing, the city is required to pitch in money if the Baltimore Hilton cannot cover its bond payments.",Center,0,baltimore-sun,44.41,-4.13
"At the same time, tax watchers are concerned the justices - who are no experts in the arcana of taxation - could inadvertently blow big holes in the code if they don’t tread carefully.",Lean Left,0,politico,42.32,-5.58
"This guy has been watching FOX News regularly for years now, and he just got tired of having Democrats be on the back foot, when they have got policies, when they have got accomplishments that they should be fighting for.",Lean Left,1,pbs-newshour,43.07,-9.07
"With more than three weeks left in the year, 2023 has set a gruesome gun violence record for the U.S.",Left,1,msnbc,34.51,-14.03
Concerns that the smaller event on Capitol Hill would still be politicized were quickly vindicated.,Left,1,the-young-turks,25.16,-24.96
The worst part is that he was in no hurry to get another job.,Center,1,marketwatch,40.93,-3.88
It was just one of the funniest things that I've ever read.,Lean Left,1,vanity-fair,33.19,-13.87
"Because cash-out refinances are riskier for lenders, companies usually set stricter eligibility requirements.",Lean Left,0,business-insider,40.58,-4.19
"For anyone who is interested in applying for the scheme, but is unsure if they are eligible or their circumstances make it challenging to access, please contact brc .nhs.uk to discuss.",Center,0,nature,46.33,-1.48
"He’s talked to six teams... What is this, the atomic bomb?",Lean Left,1,mediaite,37.25,-8.64
"Members of the Federation Council, Russia’s upper house of parliament, voted unanimously to approve a decree setting the date.",Left,0,the-rachel-maddow-show,36.71,-17.67
"But even more surprisingly in the context of US politics, Mamdani and his fellow protesters had the support of major labor unions.",Left,1,jacobin,31.69,-21.47
"We’ve rounded up the best mini projectors that’ll will help elevate your Netflix binge-watching session, no matter your budget.",Left,1,teen-vogue,37.79,-15.5
Lamar Jackson just doesn't like it when people get too close to him.,Center,0,detroit-news,45.92,-2.2
In his prepared statement Wray failed to include the dire security threats created by the Biden administration’s disastrous open border policies.,Lean Right,1,judicial-watch,23.64,23.27
"As a result, much of what passes for political journalism is really party work by proxy.",Lean Right,1,the-dispatch,41.19,5.33
"But in St. Louis, perhaps because the two detectives are alive and their absences cannot easily be explained to jurors, local prosecutors have tried to salvage what they can from them.",Lean Left,1,propublica,47.17,-6.77
Their fervor to protect the laws reflects a bedrock philosophy within the American anti-abortion movement: that all abortion exceptions - even those that protect the pregnant person’s life or health - should be considered the same as sanctioning murder.,Lean Left,1,propublica,47.17,-6.77
"Specifically, her office determined that Trump and his Large Adult sons, Donald Trump Jr. and Eric Trump, have spent years committing business fraud by both inflating and deflating the value of their company’s assets at different points.",Left,1,jezebel,29.2,-18.18
Reliving the story of this ambush year after year is difficult.,Center,1,military-times,46.49,-0.19
"It also awakened African governments and their people regarding the Palestinian cause, especially since before the Hamas attack the issue had been ignored among many governments in the region except South Africa.",Lean Left,1,al-jazeera,41.34,-7.05
"After all, Republicans had won control of the White House and Congress in 1952 on a campaign that emphasized Democratic weakness in fighting communism at home and abroad.",Left,1,new-republic,29.53,-17.18
"Andrew was also with brother Charles at Balmoral Castle in Scotland this summer, having spent last Christmas with Charles and the rest of the royal family at Sandringham.",Left,0,boing-boing,19.23,-14.43
"The issue came to a head when U.S. Marine Corps Commandant Gen. Eric Smith suffered a heart attack in October, just two days after he'd talked about the stress of the holds at a military conference.",Lean Left,0,nowthis-news,41.47,-7.95
"Hackett was sensational in the second half, scoring 20 points in the second half.",Lean Left,0,chicago-sun-times,45.44,-4.35
The filing also accuses the commander-in-lying-and-losing of doubling down on his nonsense after Freeman and Moss’ Jan. 6 committee testimony.,Left,1,newsone,35.06,-17.17
"For Fluzone High-Dose Quadrivalent, in adults 65 years of age and older, the most common side effects were pain, redness, and/or swelling where you got the shot; muscle aches, headache, and general discomfort.",Lean Left,0,sfgate,43.52,-1.26
"Given how long the crypto world has been dealing with a downturn, what’s driving Bitcoin’s price ascent and similar value gains among other tokens?",Center,0,techcrunch,45.28,-0.4
"This news, reported by the Florida Center for Government Accountability, adds a layer of controversy to the Zieglers, who are prominent in GOP politics.",Lean Left,1,the-advocate-–-baton-rouge,45.85,-4.0
"Donald Trump’s former sycophants at Fox News appeared somewhat reformed on Saturday, interrupting the GOP presidential candidate’s unhinged campaign speech to fact-check his election lies.",Center,1,smerconish,35.9,1.61
"If you wish to use such content, please send your request to reprints .org .",Center,0,education-week,43.11,-3.02
WIN A BEAUTIFULLY DECORATED GINGERBREAD HOUSE FROM GERHARD'S ELEGANT EUROPEAN DESSERTS.,Center,0,chicago-tribune,44.67,-4.24
"After hearing this, several fans of Taylor’s decided to raise a reported R$30,000 - which is around $6,000 - in less than 12 hours for Ana’s family.",Left,0,buzzfeed-news,39.98,-5.98
"Henderson had been in the news all week for his taunts of Bradshaw, including the infamous quote that Bradshaw was so dumb he could not have spelled cat if he was spotted the c and the a.",Center,1,pittsburgh-post-gazette,47.59,-0.45
"With the hold, we have already shaken their faith in us.",Center,1,voice-of-america,46.29,-3.24
