text,source_party,label,source,reliability,bias
His extremist rhetoric and horrific record of discrimination toward the LGBTQ community doesn’t represent where most of America is - but it does clue us into the priorities of today’s Republicans.,Lean Left,1,washington-blade,42.71,-7.49
"Apartheid, military occupation and genocide are incompatible with a free press.",Lean Left,1,truthout,34.51,-16.87
And we follow what’s the instruction that - what we receive.,Lean Left,0,truthout,34.51,-16.87
"The attack comes six years after the deadliest mass shooting in modern U.S. history took place in Las Vegas, during a country music festival in October 2017.",Lean Left,0,nbc-news,43.21,-5.79
He added the the entire hospital is without fuel and the Israeli troops were firing on people.,Lean Left,1,nbc-news,43.21,-5.79
"For more info on how to avoid being swindled, read about how to spot Social Security scams.",Center,0,cnet,40.02,-1.39
"He played a strong right field with the Red Sox in 2023, flashing elite arm strength.",Lean Left,0,nj.com,43.92,-2.88
That shot against Freehold Township gave Rutgers Prep the juice to upset the No.,Lean Left,0,nj.com,43.92,-2.88
"Great American Family has consistently been the fastest-growing channel on cable, and Abbott recently took over as head of Great American Pure Flix, the streaming platform formerly known as Pure Flix, following a highly publicized merger.",Right,0,cbn,34.17,15.24
"This is especially concerning given the expected increase of these contaminants in our water and food, he added.",Lean Right,1,zerohedge,20.78,16.08
Via CNN/Getty Images And the ground war and aerial bombardment is expected to continue with great intensity through at least January.,Lean Right,1,zerohedge,20.78,16.08
"But the reality is that Ukrainian forces were already losing the war, given top US officials have long acknowledged the counteroffensive has stalled and failed, even with all the weapons the US has already poured in.",Lean Right,1,zerohedge,20.78,16.08
"It was a blunt take from Brady, especially since some felt he may have benefited from protection at times during his illustrious career.",Center,1,heavy,43.64,-2.71
Eric Bieniemy Has Better Shot to Land With Bears Than Jim Harbaugh Another splashy name floating around the Bears potential head coaching opening is that of Michigan’s Jim Harbaugh.,Center,0,heavy,43.64,-2.71
The Houston Texans (7-5) are right on their heels in the No.,Center,0,heavy,43.64,-2.71
Sometimes you can think yourself in circles when it comes to getting your ambitions straightened out.,Center,0,baltimore-sun,44.41,-4.13
"Philanthropist Mark Joseph, from right, and Baltimore Museum of Arts director Asma Naeem interact with Ardyn Redmon, 8, as Aiden Tull, 8, plays.",Center,0,baltimore-sun,44.41,-4.13
"While some leaders are willing to force a shutdown unless drastic cuts are made to important economic security programs, what you won’t hear is a lot of talk about cutting defense.",Center,1,baltimore-sun,44.41,-4.13
"Walker: There are so many answers to this question, starting with Macdonald, who’s deservedly talked up as one of the league’s top young defensive minds and as a head coaching candidate.",Center,1,baltimore-sun,44.41,-4.13
"The full extent of Pentagon waste can only be guessed at because, believe it or not, the Pentagon has never passed an independent audit.",Center,1,baltimore-sun,44.41,-4.13
"The visual has primacy over the vocal when it comes to trustworthiness, and DeSantis’ stiff smile undermines his authenticity.",Lean Left,1,politico,42.32,-5.58
"Nixon he treated with craven flattery in his presence but scorn, even pity, behind his back.",Lean Left,1,politico,42.32,-5.58
"Instead, the U.S. has expressed hope that al-Jaber’s influence with his fellow oil and gas producers - historically, one of the major obstacles to climate action - could help win real commitments to cut greenhouse gas pollution.",Lean Left,1,politico,42.32,-5.58
The inquiry chamber is larger than it looks and full of weary lawyers and representatives of the inquiry’s core participants.,Lean Left,0,politico,42.32,-5.58
That was the main thing that the Cubans wanted to know: are we going to be invaded?,Lean Left,0,politico,42.32,-5.58
"And the Koch thing was interesting, that they would endorse, because -- or that he's pledged to support her, because her foreign policy is not their foreign policy.",Lean Left,1,pbs-newshour,43.07,-9.07
Had Ertegun’s life turned into some nightmare reminiscent of What Ever Happened to Baby Jane?,Lean Left,1,vanity-fair,33.19,-13.87
"The current trial is all about whether Trump's exaggerations were intentional, and Moens was called to the stand Tuesday to testify that Mar-a-Lago, at the least, was undervalued, not over-valued, in those net-worth statements.",Lean Left,1,business-insider,40.58,-4.19
Access your favorite topics in a personalized feed while you're on the go.,Lean Left,0,business-insider,40.58,-4.19
"This will enable fellows protected time to concentrate on research, training and development The cost of tuition fees based on the UK (Home) rate PhD tuition fees for three years full time.",Center,0,nature,46.33,-1.48
And we’d obviously gone through a huge debate internally about it.,Lean Left,0,mediaite,37.25,-8.64
"Members of the Pennsylvania chapter are forming an independent group, and Paige said she has heard from members in other states interested in doing the same.",Left,0,the-rachel-maddow-show,36.71,-17.67
It is also one of the reasons why the insistence on combining the socialist project with strong (radical) democratic ideals and commitments is so central.,Left,1,jacobin,31.69,-21.47
"More than anything, this time around showed me how emotionally connected we can be to our clothes.",Left,0,teen-vogue,37.79,-15.5
"Come the fall, he’ll release his debut album, Sincerely, Benson, and further cement his place as a global force in music - a feat even more impressive considering that he’s an independent artist.",Left,0,teen-vogue,37.79,-15.5
"And in the meantime, then I'm also gonna bring in an amazing, amazing honoree.",Left,1,teen-vogue,37.79,-15.5
"Among the discoveries made by Ms. Shenwick and shared with Members of Congress: Gross nepotism at the U.S. Mission to the U.N.; Conflicts of interest in appointments and contracting; Misrepresentations by members of the U.S. Mission staff of the existence and waste and mismanagement at the U.N; Failure by U.S. Mission staff to deal with overbudgeting of U.N. peacekeeping operations, resulting in the overbilling of U.S. taxpayers; Theft and mishandling of cash in U.N. peacekeeping operations in Somalia; In short, Linda Shenwick learned that the U.S. mission was squandering American taxpayer dollars.",Lean Right,0,judicial-watch,23.64,23.27
"Now back on testosterone, Max looks forward to turning 18 early next year, which will help ensure he can access gender-affirming care.",Lean Left,1,propublica,47.17,-6.77
"Private Flights to China In mid-April, Illinois officials spent nearly $1.8 million to charter two FedEx flights to Shanghai to pick up supplies of personal protective equipment.",Lean Left,0,propublica,47.17,-6.77
We tried our best to stay on her good side by humoring these interruptions.,Left,0,jezebel,29.2,-18.18
"So Detroit, for example, in the period of regulation in 1977, the biggest airline in Detroit, Delta, had 21 percent of the airport.",Left,0,new-republic,29.53,-17.18
"Just get four or five giant private equity firms, each of whom is writing a check for a billion dollars, which sounds preposterous, but if you look at the regular amounts of money that are spent in the sports spaces, it starts to look like pennies, and all of a sudden that becomes a viable way for the tours to not only continue but thrive.",Left,0,new-republic,29.53,-17.18
"For much the same reason, Congress in 1962 slapped a tax on unrealized shareholder income in foreign subsidiaries of U.S.-based corporations.",Left,0,new-republic,29.53,-17.18
Winnie the Witch was a roadside attraction in danger of extinction until some kind-hearted people decided to help save her.,Left,0,boing-boing,19.23,-14.43
Not that Garner is saying that in so many words - she hasn't spoken to the rag at all.,Left,0,boing-boing,19.23,-14.43
"Presidents and Senate power breakers might get the press, but for the power behind the throne, look for the man in the black robe.",Lean Left,1,nowthis-news,41.47,-7.95
"This could be because some women are able to mimic neurotypical behaviors more effectively than men, so the condition goes undetected and thus, untreated.",Lean Left,1,nowthis-news,41.47,-7.95
Are you dialing it back on all your traveling and business responsibilities?,Lean Left,0,nowthis-news,41.47,-7.95
"But once his father-in-law is elected president, Kushner finds himself--or maneuvers his way into--the middle of everything, whether it’s building the wall, devising a solution to the Israel-Palestine imbroglio, or negotiating a trade deal with China.",Lean Left,1,nowthis-news,41.47,-7.95
"A separate lawsuit filed by an unnamed woman accused Combs and another man of sexually assaulting her and a friend, then beating her several days later.",Lean Left,0,nowthis-news,41.47,-7.95
How does it get away with war in Yemen and human rights violations at home?,Lean Left,1,nowthis-news,41.47,-7.95
Having an oil baron at the helm of the world’s most important event focused on curtailing greenhouse gas emissions is an irony that’s been hard to swallow for many.,Lean Left,1,chicago-sun-times,45.44,-4.35
"The sold-out arena was decked and stuffed with scores of revelers dressed in their best ballgowns, sequined frocks, Santa hats and flashing light necklaces like one big citywide Christmas party.",Lean Left,0,chicago-sun-times,45.44,-4.35
"On Tuesday, we reported that sunken Trump-humper Trevian Kutti-who is accused in Trump’s RICO indictment of harassing Freeman and Moss-appeared to be making veiled threats directed at the former election workers as well.",Left,1,newsone,35.06,-17.17
They are commonly found at the top or bottom of web pages and are ideal for brand awareness campaigns.,Lean Left,0,sfgate,43.52,-1.26
Expand Organic Reach - SEO and sharing metrics underscore paths to increase visibility.,Lean Left,0,sfgate,43.52,-1.26
"The required minimum monthly payments may or may not pay off the promo balance before the end of the promo period, depending on purchase amount, promo length and payment allocation.",Center,0,chicago-tribune,44.67,-4.24
He still holds Super Bowl records for most rushing yards (354) and rushing attempts (101) in the game’s history.,Center,0,pittsburgh-post-gazette,47.59,-0.45
"Viagra Online is an online pharmacy that provides customers with access to a wide range of prescription medications, including Viagra.",Center,0,pittsburgh-post-gazette,47.59,-0.45
But even Punxsutawney Phil is just a meteorologically inclined caricature misrepresenting the unseen world of a biological marvel: the whistle pig.,Center,1,pittsburgh-post-gazette,47.59,-0.45
"With the hold, we have already shaken their faith in us.",Center,1,voice-of-america,46.29,-3.24
