text,source_party,label,source,reliability,bias
"Transfer pan to a wire rack to cool for 5 minutes, then brush the rolls with the remaining butter mixture.",Lean Left,0,san-diego-union-tribune,45.68,-1.76
All of the characters feel authentically rich: old money rich mixed with trying to appear leftwing and stay connected with the modern world.,Lean Left,1,the-guardian,40.67,-7.97
"The third leg of the triad, equity, is a risky strategy.",Right,1,american-greatness,18.93,22.45
"Even the biased Washington Post took note, with an alarming article and this graphic: Source: Washington Post This path is totally unsustainable.",Right,1,american-greatness,18.93,22.45
"Clearly, Jackson was an affirmative action student who somehow missed the lecture on the meaning of equal opportunity before the law.",Right,1,american-greatness,18.93,22.45
"To protect scarce dollars, the government imposes capital controls, prohibiting Argentines from buying more than $200 a month, even though the greenback is the currency most people save in.",Lean Left,1,the-economist,42.4,-1.43
"Also, avoid basic economy, which kicks you to the back of the queue.",Lean Left,1,washington-post,38.8,-6.85
Populist issues such as corruption and elite power rank at the bottom with 7%.,Lean Right,0,fox-business,38.81,9.11
CLICK HERE TO SIGN UP FOR OUR LIFESTYLE NEWSLETTER Fox News Digital reached out to Burn Boot Camp for further comment.,Lean Right,0,fox-business,38.81,9.11
BIDEN'S AGE CANNOT BE IGNORED ANY LONGER: VARNEY His voice was weak.,Lean Right,1,fox-business,38.81,9.11
GET FOX BUSINESS ON THE GO BY CLICKING HERE But this regulation is also an enormous boost to federal spending.,Lean Right,0,fox-business,38.81,9.11
"But the plane began rolling on its own, right over the chocks, and its nose collided with the hangar wall while the right engine of the aircraft hit a tow tractor inside the hangar.",Lean Left,0,global-news,44.54,-4.26
"She said she was trafficked for a year before she was able to escape, though she said she also returned a few times afterwards because of the coercion and manipulation her trafficker exerted on her.",Lean Left,0,global-news,44.54,-4.26
One forecast has clear skies while another has mostly cloudy skies.,Lean Left,0,global-news,44.54,-4.26
"To gain that sort of leverage, workers will likely need a lot more power, not just a tight labor market and slightly higher wages.",Left,0,vox,39.59,-10.05
"Then, as now, the American economy experienced a severe shock, which left a lasting hangover.",Center,0,foreign-affairs,44.56,-6.55
"In the face of North Korea’s dangerous and illicit nuclear and missile programs, we are working to ensure that the United States’ extended deterrence is stronger than ever so that the region remains peaceful and stable.",Center,0,foreign-affairs,44.56,-6.55
"Coakley’s explanations of each concept, as well as examples from biblical and nonbiblical works, will help readers deepen their understanding of Scripture and appreciate its literary beauty.",Lean Right,0,christianity-today,41.75,5.39
"Like the best gear from Hisense, this 55-inch TV offers an awful lot for not that much money.",Center,1,wired,36.77,-7.24
"Whatever the case, this is a slick laptop for those of us who think ThinkPads are, ahem, slick.",Center,1,wired,36.77,-7.24
"In addition to numerous awards, he was inducted into the U.S. Astronaut Hall of Fame in 1993.",Lean Left,0,cbs-news,41.76,-2.84
"But often, short-term CDs are the best way to get a top rate today.",Lean Left,1,cbs-news,41.76,-2.84
"But before a grand jury could hear the evidence and decide if there was enough to go to trial, COVID shut down the courts.",Lean Left,0,cbs-news,41.76,-2.84
The goal of the flight is to send the Starship on a looping trajectory around the planet before re-entry and splashdown in the Pacific Ocean north of Hawaii.,Lean Left,0,cbs-news,41.76,-2.84
Picked up the firearm ... and demonstrated how he could ... shoot himself ... and ... call 911.,Lean Left,1,cbs-news,41.76,-2.84
"The ADL unjustly attacks the majority of the West, despite the majority of the West supporting the Jewish people and Israel.",Lean Left,1,cbs-news,41.76,-2.84
"Once, the agency uploaded a photo of her 18-month-old child on a WhatsApp group, as part of its effort to intimidate her.",Center,1,quartz,43.87,-4.77
Count former Justice Department whistleblower J. Christian Adams among those who would have approved of Garrett’s report if it had been more narrowly focused instead of a conduit for accusations of a race-based conspiracy.,Lean Right,1,washington-examiner,34.07,11.3
"Both Georgia and Pennsylvania’s courts, specifically the Pennsylvania Supreme Court and the Philadelphia Court of Common Pleas, shared the No.",Lean Right,0,washington-examiner,34.07,11.3
"BIDEN SKIPS CLIMATE CONFERENCE AS HIS GREEN AGENDA IS CRITICIZED AT HOME Some of that pushback is designed to improve Biden’s dreadful job rating on the economy, and many in media are happy to help.",Lean Right,1,washington-examiner,34.07,11.3
The Florida governor has bet his campaign viability on winning the Iowa caucuses on Jan. 15.,Lean Right,0,washington-examiner,34.07,11.3
This ensures you get the rate you want as you complete the homebuying process .,Right,0,fox-news,35.44,11.06
"However, it remains unclear whether or not the debate helped or hurt Governor DeSantis, who is actively running for president.",Right,0,fox-news,35.44,11.06
"Grossi noted the political pushback science can see in nuclear issues, particularly over Japan discharging treated and diluted wastewater from the damaged Fukushima nuclear plant into the Pacific Ocean.",Lean Left,0,abc-news,45.25,-2.91
"But if tonight’s debate revealed anything, it’s that her Republican competitors aren’t ready to let her have that chance.",Left,1,the-atlantic,37.96,-9.01
"They are saying simply that there’s one sole objective right now, which is to destroy Hamas, and then whatever comes after that, well, we’ll figure it out once that moment comes.",Left,1,the-atlantic,37.96,-9.01
Speaker Johnson must at least feign that he is pushing this impeachment threat as far as he can.,Left,1,daily-beast,33.54,-10.51
Please try again later {{ /verifyErrors }} South Korean dog farmers have threatened to unleash two million canines on Seoul if the government goes ahead with its proposed ban on dog meat.,Lean Left,1,the-independent,38.37,-6.99
Mr Trump lamented that what happened to his administration has not happened in the history of America and that he has been indicted more times than the gangster Al Capone.,Lean Left,1,the-independent,38.37,-6.99
A decline in natural gas production and new wells also means less local revenue for gas-producing counties.,Lean Right,0,just-the-news,33.31,10.7
"In a case a decade ago in Costa Rica, organ sellers collected $3,000 to $6,000 for a kidney, which was shipped to clients in Israel or Eastern Europe for as much as $100,000.",Lean Right,0,washington-times,34.92,11.31
"The lid here functions pretty much the same as the MiiR, which means you can sip from the hole or take the whole thing off.",Left,0,new-york-magazine,39.84,-9.95
"There can be a dizzying disorientation to Bamford’s work at times, especially as she cycles through voices and characters she barely names, sometimes launching into stories with little prelude or explanatory hand-holding.",Left,1,new-york-magazine,39.84,-9.95
"The surprisingly high stakes of the documentary are her happiness, with the viewer not so much wondering whether a B.B.L.",Left,1,the-new-yorker,40.91,-12.25
"Indeed, thanks in no small part to the Trumpian uprising of 2015-16, this has now become conventional wisdom in the political center.",Right,1,the-american-conservative,31.63,14.44
"In his essay, Dr. Gilley argues that the book is rife with errors and outright dishonesty, rendering its thesis untenable, and suggests that this presentation has inaccurately colored the interpretation of European colonialism in Africa and elsewhere.",Right,0,the-american-conservative,31.63,14.44
"Although it’s true that Kennedy is not your average establishment Democrat, he’s certainly not aligned with conservative or libertarian values.",Right,1,the-federalist,21.77,18.67
"It’s every online purchase, every visit to the gas pump, every month of paying home energy bills that only increase in baseline prices.",Right,0,the-federalist,21.77,18.67
Senate and House conferees should use the power of the Constitution and the power of the purse to produce a defense bill that replaces wokeism with sound social priorities that put military readiness first.,Right,1,the-federalist,21.77,18.67
"Thursday night, Kate Middleton and husband, Prince William, attended the the Royal Variety Performance along with Crown Princess Victoria and Prince Daniel of Sweden and American-Armenian royalty (at least, in my books), Cher.",Left,1,vogue,39.13,-10.91
The Farmington Phoenix earned a convincing 60-43 win over the Bonneville Lakers.,Center,0,deseret-news,42.29,2.55
"Riverton held a slim 24-22 lead at halftime, but pulled away with a 16-5 third-quarter advantage to seal the game.",Center,0,deseret-news,42.29,2.55
"Now serving pan-Latin cuisine (with an Asian twist), this slightly far-flung jewel box dining room is hidden behind a defunct dry cleaner.",Lean Right,0,new-york-post,31.92,9.28
"Getty Images The couple were married for almost 30 years, and infamously reached a divorce settlement in 1986 estimated at more than $100 million.",Lean Right,0,new-york-post,31.92,9.28
Drop a chef’s knife on this LP-styled tempered-glass prep board instead of a needle.,Lean Right,0,new-york-post,31.92,9.28
"AFP via Getty Images When asked if there’s a drug interaction between Paxlovid and verapamil, ChatGPT responded that there were no reported interactions for this combination of drugs, per LIU.",Lean Right,0,new-york-post,31.92,9.28
5 Harvard President Dr. Claudine Gay claimed that free expression is alive and well at Harvard - which recently came in last place in a ranking of free speech on campus.,Lean Right,1,new-york-post,31.92,9.28
"Its rich scents all come personalized to a particular recipient or vibe, like this Rooftop Soirée option that’s ideal for your next alfresco dinner moment.",Lean Right,0,new-york-post,31.92,9.28
There is a clever political meme rumbling around online that breaks society into four groups of people: (1) Those who believe the narrative and comply; (2) Those who know it’s BS and comply anyway; (3) Those who are waking up to the lie and are starting to refuse to comply; and (4) Those who knew it was BS right from the start and refused to partake in the lie.,Right,1,american-thinker,13.67,24.85
"The polls also need to survey at least 8,000 registered likely Republican voters, among other requirements.",Right,0,washington-free-beacon,23.47,14.45
"The force of the explosion blows the roof and several walls apart, causing the structure to collapse.",Lean Left,0,cnn,42.06,-6.28
My visit to the Anne Frank House in Amsterdam in my 20s.,Left,0,salon,32.38,-13.86
"There's going to be a primary in both these seats in January, a regular party primary.",Left,0,daily-kos,28.4,-17.51
"Former Arizona Senate President Leo Corbet, a Republican who served with O'Connor, said she was known for her serious and professional demeanor.",Left,0,daily-kos,28.4,-17.51
"Fong Just quickly, one thing: one of the foremost proponents of legalization is Milton Friedman.",Left,0,current-affairs,34.3,-18.14
We can make a better workplace than management most of the time.,Left,1,current-affairs,34.3,-18.14
Israel’s bombing campaign on the Gaza Strip in recent weeks rivals the concentrated bombing of Vietnam and Cambodia that Kissinger oversaw decades ago.,Left,1,the-intercept,37.46,-14.1
"Make of this what you will - it’s foolishness on a grand scale, and yet it’s central to the Nordhaus model.",Left,1,the-intercept,37.46,-14.1
"After Felix finishes the deed and leaves, Oliver jumps in and laps up the last of the, uh, fortified bathwater with a kind of guttural slurp, backed up lovingly by the movie’s foley artists.",Left,1,slate,35.17,-12.93
He also recalled O’Connor taking him and another of her clerks to a Supreme Court picnic and instructing them to fill empty spots in a softball game.,Lean Left,0,atlanta-journal-constitution,44.83,-3.84
Aerial spotters located a second adult pair about nine nautical miles off Sea Island.,Lean Left,0,atlanta-journal-constitution,44.83,-3.84
"When there is the potential for a shortage, drug manufacturers are required to notify the F.D.A.",Lean Right,0,fiscal-times,43.33,-4.18
"McCarthy’s sticking around for another year is just too much to ask, apparently.",Lean Right,1,fiscal-times,43.33,-4.18
"Johnson noted that the House has already passed a bill, H.R.",Lean Right,0,fiscal-times,43.33,-4.18
"Strap on a game-changing accessory for outdoor sports lovers - Garmin fenix 6s Pro Solar, currently available at a massive 45% discount exclusively on Amazon.",Lean Left,1,the-root,26.43,-18.51
"The whole paranoia about the jack-booted thugs from government coming to take away your guns, or the woke liberals trying to take away your guns, the whole working people up to such an extent, into a fantasy world of polarized gun zero sum game really gets in the way.",Lean Left,1,fair,32.6,-19.36
"Holding a politician accountable to the facts across the universe of possible topics is a herculean task for a journalist in the best of circumstances, and impossible in a town hall format that’s set up more like a campaign rally than a serious journalistic forum.",Lean Left,1,fair,32.6,-19.36
"As for US use of those weapons, the piece buried a single sentence with a deficient summary at the end of the 24-paragraph article, telling readers: NATO forces used cluster bombs during the Kosovo war in 1999, and the United States dropped more than 1,000 cluster bombs in Afghanistan from October 2001 to March 2002, according to a Human Rights Watch report.",Lean Left,0,fair,32.6,-19.36
"It’s a move completely inimical to Biden’s stated commitment to tackling the climate emergency and shifting to renewable energy, made all the more striking as temperatures surpass records in India, Pakistan, Europe, and the Southwest and Central US.",Lean Left,1,fair,32.6,-19.36
Only seven wildfire pollution segments (6% of all 115 segments) named or even alluded to fossil fuels-by far the largest contributor to climate change-in a way that did not engage in climate denial.,Lean Left,1,fair,32.6,-19.36
"This choice is all the more disquieting, given the lack of diversity in trans perspectives that the paper has highlighted in its opinion section.",Lean Left,1,fair,32.6,-19.36
"And, for the ending: Mr. McCarthy is right to assume that most people don’t want their tax dollars being used by the government to subsidize laziness.",Lean Left,1,fair,32.6,-19.36
"Unfortunately, President Biden and congressional leaders refuse even to discuss these key drivers.",Lean Left,1,fair,32.6,-19.36
"The bottom line, obscured by these demographic gee-whiz stories, is that Trump had a 15-point advantage among whites and a 46-point deficit with people of color.",Lean Left,1,fair,32.6,-19.36
"In response to the letters about its anti-trans coverage, Times leadership forcefully denied any wrongdoing and attempted to silence their critics, threatening retaliation for speaking out against the paper (FAIR.org, 2/17/23).",Lean Left,1,fair,32.6,-19.36
"Thus, a count of mentions could be used to provide a more fine-grained estimate of the extent of coverage in those cases.",Lean Left,0,fair,32.6,-19.36
"And sure, some cisgender women and some parents of trans kids feel their rights are being trampled on when trans people are acknowledged and granted the same rights as their peers.",Lean Left,1,fair,32.6,-19.36
"Confronting the full scope of gun violence, however, has to include confronting misogyny.",Lean Left,1,fair,32.6,-19.36
"Almost 50 years after the end of the US government’s war of aggression against Laos, unexploded cluster bombs continue to kill and maim innocent people-frequently children.",Lean Left,1,fair,32.6,-19.36
"This background is rarely mentioned in media accounts, which rely primarily on pro-deregulation mainstream economists, government officials and self-serving industry reps as sources.",Lean Left,1,fair,32.6,-19.36
"As he projected a view of himself as a victim, he also nurtured the same aggrieved sensibility in his listeners.",Lean Left,1,fair,32.6,-19.36
"Corporate media seemed to be having a reaction similar to the cartoon alien as they opined on the nomination of former Vice President Joe Biden as the Democratic presidential candidate, with Sen. Kamala Harris as his running mate.",Lean Left,1,fair,32.6,-19.36
Mainstream journalists respond to such criticism by explaining that articles for the daily press are not history texts and cannot include everything.,Lean Left,0,fair,32.6,-19.36
"CNN on a few occasions featured a guest advocating a ceasefire, such as Dr. Mustafa Barghouti, the leader of the Palestinian National Initiative party.",Lean Left,0,fair,32.6,-19.36
"GOP-friendly framing Republicans have introduced more than 500 anti-trans bills in 49 states, 63 of which have passed to date this year.",Lean Left,1,fair,32.6,-19.36
"Like many facts in this war, the Ukrainian Nazi problem and its origins have been relegated to the memory hole by US corporate media (FAIR.org, 2/23/22).",Lean Left,1,fair,32.6,-19.36
"Inskeep’s lauding description of Karzai leaves out the massive, US-financed, heroin-fueled reign of corruption that was endemic to US occupation.",Lean Left,1,fair,32.6,-19.36
Yet America’s rich are worried that a President Biden would be swayed by progressive forces in his party.,Lean Left,1,fair,32.6,-19.36
"Play Stop pop out X MP3 Link Janine Jackson: We have major media afroth with tales of Russian hacking of the presidential election, giving millions of Americans the idea that Russian agents actually tampered with voting machines.",Lean Left,1,fair,32.6,-19.36
"Obama will now have the opportunity to show his true colors, in terms of both his ideological convictions and his ability to produce the kind of cross-party consensus he said he yearns to create.",Lean Left,1,fair,32.6,-19.36
Now we’re being asked to give some of those unearned profits back.,Lean Left,1,fair,32.6,-19.36
"This portrays the economy as a zero sum game between workers and consumers, who appear to be intractably at odds if corporate profits are left out of the equation.",Lean Left,1,fair,32.6,-19.36
"The omission is glaring, given the enormity of the Afghan crisis and the direct role the US plays in making it worse.",Lean Left,1,fair,32.6,-19.36
Its next piece (4/3/23) took the bold step of calling for cuts to veterans’ disability benefits.,Lean Left,1,fair,32.6,-19.36
"During Russia’s invasion of Ukraine, NBC Nightly News reported on the possible use of cluster bombs by the Russian military, while incorrectly stating that the US had not used these inhumane weapons since the first Gulf War.",Lean Left,1,fair,32.6,-19.36
"Boot cited the probability that the dud rate of US cluster munitions is much higher than the given 2.35%, but immediately downplayed this fact on the basis that Ukraine’s democratically elected leaders, whose relatives, friends and neighbors are in the line of fire, are more mindful of minimizing Ukrainian casualties than are self-appointed humanitarians in the West watching the war on television.",Lean Left,1,fair,32.6,-19.36
"Many of the articles did, in fact, back Kosovars’ self-determination claims.",Lean Left,0,fair,32.6,-19.36
"Amid Israel’s rightward shift, a permissive environment toward illegal settlement has cultivated Israeli military apathy in the face of settler violence.",Lean Left,1,fair,32.6,-19.36
"In the same timeframe, the Wall Street Journal ran six articles assessing Putin’s actions, and did not find any space in these articles to criticize US policy.",Lean Left,1,fair,32.6,-19.36
"The bias in favor of US officials, and the marginalization of experts from the country being invaded-as well as civil society experts from any country-recalls US TV news coverage of another large-scale invasion in recent history: the US invasion of Iraq.",Lean Left,1,fair,32.6,-19.36
"And they were great at aggravating all sorts of hardship, with disenrolled individuals struggling much more with medical bills and delays in care than people who were able to stay enrolled.",Lean Left,1,fair,32.6,-19.36
As the Ottawa Citizen’s David Pugliese (9/27/23) explained: The federal government has withheld a second part of a 1986 government commission report about Nazis who settled in Canada.,Lean Left,0,fair,32.6,-19.36
"To some extent, all US media indulge in this kind of double standard.",Lean Left,1,fair,32.6,-19.36
"So he would cut anything he can, and the economy would probably go into recession, almost certainly.",Lean Left,1,fair,32.6,-19.36
"McCarthyism, in other words, was going full steam even before McCarthy showed up at the station.",Lean Left,1,fair,32.6,-19.36
"As a complement to that, it was also used to fuel concern about our ostensibly inferior military systems, giving advocates an opportunity to demand more resources for the war machine.",Lean Left,1,fair,32.6,-19.36
"At least 19 more US guests have taken money from military industry political action committees (PACs) during their political careers; of the 23 elected officials for whom data was available, only Rep. Pramila Jayapal (D-Wash.",Lean Left,1,fair,32.6,-19.36
"By November 5, the Gaza death toll was nearly 10,000, including at least 4,000 children, rendering absurd the claim that Israel was merely targeting Hamas.",Lean Left,1,fair,32.6,-19.36
"But overall, trans-centered perspectives were flashes in the pan, and hardly sufficient to counteract the present emergency plaguing trans people and their loved ones.",Lean Left,1,fair,32.6,-19.36
"The conservative media establishment that the right dreamed of since the days of Richard Nixon (Extra!, 3-4/95) and the Powell Memo had been realized.",Lean Left,1,fair,32.6,-19.36
"Shows that mentioned Biden’s pleas to drill for more oil (e.g., All Things Considered, 6/22/22; ABC World News Tonight, 6/2/22) or calls for a gas tax holiday (e.g., NBC Nightly News, 6/22/22; CNN‘s Situation Room, 6/20/22) never included any points of view from environmentalists or Indigenous activists.",Lean Left,1,fair,32.6,-19.36
"President Yeltsin did it by simply dissolving parliament on Sept. 21, a blatantly unconstitutional move that won immediate support from the Clinton administration - and immediate excuses from most U.S. media.",Lean Left,1,fair,32.6,-19.36
"Instead, its main purpose seems to be to stir up hatred for a state enemy, and blind support for a state ally.",Lean Left,1,fair,32.6,-19.36
But the trouble with the situation now is that trying to call gun violence a public health matter is perceived on the other side as just another trick to get the guns out of our hands.,Lean Left,1,fair,32.6,-19.36
"Take Roy Gutman of Newsday, who habitually challenged the lies and contradictions in Nicaragua policy, but not its democratic purpose.",Lean Left,1,fair,32.6,-19.36
"Attention has rightly been paid to the Islamophobia industry-a loose consortium of professional far-right trolls such as Pam Geller, Frank Gaffney, Steve Emerson, Breitbart, Infowars, etc.",Lean Left,1,fair,32.6,-19.36
"This narrative may appeal to the paper’s upper-class readership, who are generally insulated from the worst effects of rate hikes.",Lean Left,1,fair,32.6,-19.36
Crimes on live TV Both-sidesing Lula’s FBI-backed political persecution and Bolsonaro’s guilty verdict as examples of judicial overreach is an act of bad faith.,Lean Left,1,fair,32.6,-19.36
"The story itself revealed that it was 618 workers out of 677,348-or 0.09%.",Lean Left,0,fair,32.6,-19.36
"Two noteworthy S&L proposals were put forward recently by progressive leaders, who began with the premise that if middle- and working-class people weren’t invited to the party, they shouldn’t have to clean up the mess.",Lean Left,1,fair,32.6,-19.36
"A consequence of this binary worldview is the tendency to present the deployment of increasingly horrific means, like President Joe Biden’s recent decision to arm Ukraine with US cluster munitions, as essentially just and necessary to achieve the West’s always-noble ends.",Lean Left,1,fair,32.6,-19.36
The Post (1/21/22) even ran an article that misleadingly suggested the US had ceased to be a major factor in the war: The United States once strongly backed the Saudi-led coalition.,Lean Left,1,fair,32.6,-19.36
"Nightline‘s four most frequent guests were all Reagan sympathizers: Henry Kissinger, Alexander Haig, Elliott Abrams and Jerry Falwell.",Lean Left,1,fair,32.6,-19.36
"Indeed, speculating on the company’s M&A future has become something of a pastime for analysts, with most observers agreeing Paramount Global is not long for this world as an independent entity.",Lean Left,0,variety,41.29,-3.85
"The classic show, from Kander and Ebb/Bob Fosse, centers on Roxie Hart and Velma Kelly, two merry murderesses who try to leverage their celebrity as they await trial in jail.",Lean Left,0,variety,41.29,-3.85
This 4K TV even has Dolby Atmos support inside for high-quality audio and 3D virtual surround sound.,Lean Left,0,variety,41.29,-3.85
It’s no secret that House Speaker Mike Johnson (R-LA) supports some rather horrifying conspiracy theories and anti-freedom beliefs.,Left,1,occupy-democrats,25.3,-21.06
Cheney says that her party now accepts threats of violence as a means to political ends.,Left,1,occupy-democrats,25.3,-21.06
Entering a dark room without a switch that connects to an overhead light can be daunting.,Lean Left,0,washington-blade,42.71,-7.49
