text,source,label,reliability,bias
"Mr. Schiff, clearly prepared for the ambush, argued that there was a difference between prosecutors proving a criminal conspiracy and the committee investigating evidence of foreign compromise.",the-new-york-times,1,40.94,-7.94
"Senator Lamar Alexander, Republican of Tennessee, wrote an opinion article in The Washington Post suggesting three ways out: Grant the president the $1.6 billion for border security that he requested, without wall funding, plus an additional $1 billion for security at ports of entry; approve a bipartisan bill linking wall funding with protection for young immigrants brought illegally to the country as children; or resurrect the 2013 comprehensive immigration overhaul that included huge increases in border security measures, sweeping changes to immigration law and a pathway to citizenship for the nation’s 11 million undocumented immigrants.",the-new-york-times,0,40.94,-7.94
"“This is plainly a power grab by a disappointed president, who has gone outside the bounds of the law to try to get what he failed to achieve in the constitutional legislative process,” Speaker Nancy Pelosi of California and Senator Chuck Schumer of New York, the Democratic leader, said in a joint statement.",the-new-york-times,0,40.94,-7.94
"“If we don’t get a fair deal from Congress, the government will either shut down on Feb. 15, or I will use the powers afforded to me under the laws and Constitution of the United States to address this emergency.”",the-new-york-times,0,40.94,-7.94
"“I look forward to being fully and completely vindicated,” he added, then flashed twin V-for-victory hand signs reminiscent of his political hero, former President Richard M. Nixon.",the-new-york-times,0,40.94,-7.94
The state’s four legislative caucuses have said that they believe all four would have to agree for a special session to be scheduled.,the-new-york-times,0,40.94,-7.94
"In fact, Republicans may have gotten more than they bargained for by shunning him.",the-new-york-times,0,40.94,-7.94
He doesn’t even know how to run a business.”,the-new-york-times,0,40.94,-7.94
"In a December court filing, prosecutors working for Mr. Mueller described how Mr. Cohen had repeatedly lied to Congress both about the length of negotiations over the Trump Tower Moscow deal and about Mr. Trump’s involvement in the project.",the-new-york-times,0,40.94,-7.94
States might also respond to the federal ruling with changes of their own.,the-new-york-times,0,40.94,-7.94
"Mr. Huckabee opposes same-sex marriage, suggesting as recently as February that homosexuality is a lifestyle choice akin to drinking or swearing.",the-new-york-times,0,40.94,-7.94
He and wife Stacy have two young sons.,fox-news,0,35.44,11.06
"When Beck asked what America is suffering from, someone shouted ""President Obama,"" though Beck, an outspoken critic of the president, said it's ""not that simple.""",fox-news,0,35.44,11.06
"This is a bad deal.""",fox-news,0,35.44,11.06
"A male suspect was arrested in Florida on Friday morning in connection with the rash of suspicious packages sent to prominent Democrats nationwide, law enforcement sources confirmed to Fox News.",fox-news,0,35.44,11.06
You have a bill here that's so toxic it's going to divide this Legislature.,fox-news,0,35.44,11.06
"Rep. Anthony Weiner, in an interview with Fox News, said Wednesday he's certain he did not send a lewd photo of somebody's bulging underwear to a college student via Twitter.",fox-news,0,35.44,11.06
Flynn is also being investigated over whether he was fully forthcoming about his foreign contacts and earnings from organizations linked to the governments of Russia and Turkey.,fox-news,0,35.44,11.06
That's a clear contrast with President Obama's plan.”,fox-news,0,35.44,11.06
"In a televised White House address on Saturday afternoon, Trump offered Democrats a three-year extension of protections for 700,000 Deferred Action for Childhood Arrivals (DACA) recipients, in exchange for the $5.7 billion he has been seeking for a barrier along the nation's southern border with Mexico.",fox-news,0,35.44,11.06
"""We take no issue with the Tea Party movement.",fox-news,0,35.44,11.06
"In that interview, he invoked the Catholic teaching of ""subsidiarity,"" saying it means ""not having big government crowd out civic society, but ... having enough space in our communities so that we can interact with each other"" and take care of people.",fox-news,0,35.44,11.06
Slightly more has been requested for fiscal 2013.,fox-news,0,35.44,11.06
A Microsoft spokesperson said that the company only provides customer data after receiving a legally binding order or subpoena.,fox-news,0,35.44,11.06
"The video, which was posted online by the conservative super PAC America Rising, apparently shows Braley speaking to a group of lawyers at a fundraiser in Texas.",fox-news,0,35.44,11.06
"""Ah-hah,"" she said when told the story headline.",fox-news,0,35.44,11.06
"Now he's holding federal workers hostage, saying he'll temporarily give back what he took away -- only if we give him a pointless, ineffective wall he falsely promised Mexico would pay for.",fox-news,0,35.44,11.06
"Sen. Mitt Romney, R-Utah, whose views on the president and his policies have fluctuated, said Trump ""put forth a reasonable, good faith proposal that will reopen the government and help secure the border.""",fox-news,1,35.44,11.06
"And more than a half-dozen House and Senate Democrats also have said they will skip the event, calling it an affront to Obama and the administration as they negotiate with Iran over its nuclear program.",fox-news,1,35.44,11.06
"Committee Chairman Rep. Trey Gowdy, R-S.C., made the request in a letter sent Tuesday to Clinton's lawyer.",fox-news,0,35.44,11.06
"The president, speaking at the White House, said he would use ""whatever weight this office holds"" to get the proposals passed.",fox-news,0,35.44,11.06
He said having anything to do with Cuba is to avail oneself of properties stolen from Cubans by the Cuban government during the revolution.,fox-news,0,35.44,11.06
The legislation was immediately dismissed by Republican leadership. ,fox-news,0,35.44,11.06
"""I understand how it offends people,"" she said, adding ""I've made a lot of mistakes in my career.""",fox-news,0,35.44,11.06
"“I want to make sure that other Americans hear ... the president make this issue of Russian interference a priority in the meeting,” Warner, D-Va., told reporters on Capitol Hill Friday.",fox-news,0,35.44,11.06
"Some expressed concern that Trump, who previously flirted with a possible Republican presidential bid before shelving the idea, would not definitively rule out running as a third-party candidate.",fox-news,1,35.44,11.06
"Of that, $3 billion could be diverted with help from the emergency declaration.",fox-news,0,35.44,11.06
The White House claimed Monday that politics were not at play in Obama's decision to dive into the controversy over a planned mosque near Ground Zero.,fox-news,0,35.44,11.06
The backlash built quickly over the weekend as some prominent conservatives called for Steele's resignation.,fox-news,0,35.44,11.06
"""I think that the BuzzFeed piece was a disgrace to our country, it was a disgrace to journalism and I think also that the coverage by the mainstream media was disgraceful and I think it's going to take a longtime for the mainstream media to recover its credibility,"" he went on to say. ",fox-news,0,35.44,11.06
"But the measure is not expected to succeed in the Senate, where Majority Leader Mitch McConnell, R-Ky., has said the bill is dead on arrival.",fox-news,0,35.44,11.06
"Meanwhile, Vice President Joe Biden voiced his support of Hillary Thursday evening at the American Constitution Society's national convention.",fox-news,0,35.44,11.06
"She also exercises regularly, practices yoga, swims, walks and weight trains, her doctor said.",fox-news,0,35.44,11.06
"Senate Majority Leader Mitch McConnell, R-Ky., who backed Moore’s rival Luther Strange in the GOP primary, said in a statement: ""If these allegations are true, he must step aside.""",fox-news,0,35.44,11.06
"A spokesperson for Grassley fired back Tuesday, telling FoxNews.com that by Braley’s logic he, as a trial lawyer, would not be eligible to speak out on a number of policy issues like agriculture, energy or health care.",fox-news,0,35.44,11.06
"“Seattleites know that discrimination has no place in our city,” he said in a statement.",fox-news,0,35.44,11.06
"Some Republican senators who pushed the bill through the Legislature are now calling for a veto as well, but they cite ""inaccurate"" information about the measure for igniting a firestorm.",fox-news,0,35.44,11.06
NJ Gov Chris Christie to Throw His Hat in the Ring for White House Run,fox-news,0,35.44,11.06
"As Senate Democrats float new options for complicating a vote on President Trump’s Supreme Court nominee, Republicans appear ready to return fire with a bomb of their own – a nuclear one.",fox-news,1,35.44,11.06
Sestak was also a loyal and tireless supporter of Hillary Clinton's run for the presidency in 2008.,fox-news,0,35.44,11.06
"Labrador says this about himself on his website: “Born to a single mother in Puerto Rico, Raúl Labrador moved with his mother to the mainland U.S. at age 13.”",fox-news,0,35.44,11.06
"His campaign-style visit to Detroit, though, threatens to muddy the waters on talks.",fox-news,1,35.44,11.06
"""Trump says he wants to run the nation like he's running his business?",fox-news,0,35.44,11.06
"This triggered a fiery response from Fox, also on Twitter, as he called on Trump to apologize and ""stop lying.""",fox-news,0,35.44,11.06
They include keeping marijuana in-state — something Oklahoma and Nebraska says Colorado has failed to do.,fox-news,0,35.44,11.06
"""We've got to break that habit before it starts,"" the president said.",fox-news,0,35.44,11.06
The statement also quotes from the U.S. Conference of Catholic Bishops' letters to Congress saying budgets cannot rely on disproportionate cuts in essential services to the poor.,fox-news,0,35.44,11.06
"""It seems to me first of all, from what I understand from doctors, that's really rare,"" Akin told KTVI.",fox-news,0,35.44,11.06
The release comes on the same day the State Department released thousands of emails relating to her tenure as secretary of state.,fox-news,0,35.44,11.06
"… Today, we made our caucus more representative of our members.”",fox-news,0,35.44,11.06
One demand Sanders was thought to be considering – as part of a party-unity deal -- is the removal of Democratic boss Debbie Wasserman Schultz.,fox-news,0,35.44,11.06
Trump's allies cheered the former agent's termination on Monday. ,fox-news,1,35.44,11.06
"In his statement, he said; “Compromise in divided government means that everyone can’t get everything they want every time.",fox-news,0,35.44,11.06
The presumptive Republican presidential nominee went so far as to say Obama should “step down” for not using the term and Clinton should “get out of this race” if she won’t either.,fox-news,1,35.44,11.06
"The speech capped three days of panel discussions and high-profile speakers, including numerous politicians mentioned as contenders for the 2012 Republican presidential nomination.",fox-news,0,35.44,11.06
"While President Obama repeatedly promised to pull all troops out of Afghanistan by 2014, U.S. and NATO forces remain there in a predominately training and advising role.",fox-news,0,35.44,11.06
"“National liberal organizations know their chosen candidate Doug Jones is in a death spiral, and this is their last ditch Hail Mary,” Moore campaign chairman Bill Armistead said.",fox-news,0,35.44,11.06
"But on Friday, after Democrats had called for investigations and hinted at impeachment proceedings, the special counsel’s office took the extraordinary step of releasing a statement disputing the article.",fox-news,0,35.44,11.06
"“We spent about five days on the road, five working hour or so days,” he said.",fox-news,0,35.44,11.06
"“Those are not Republican principles. He is not a Democrat. He is just himself. He is egocentric.""",fox-news,0,35.44,11.06
"Murray, a Democrat who is openly gay, issued his ban via executive order over the weekend, and Inslee issued his Monday afternoon.",fox-news,0,35.44,11.06
The illegal immigration issue has also been a hotbed for clashes between Perry and GOP presidential candidate and former Massachusetts Governor Mitt Romney.,fox-news,0,35.44,11.06
"“This is not just about Donald Trump. This is about all of us. In the face of this constitutional crisis, we must rise,” she tweeted.",fox-news,0,35.44,11.06
"Already facing stiff opposition from gun-rights advocates and Republican lawmakers, the president called on Congress to pass several major changes to the country's current gun laws -- some of which are already being considered like the restrictions on semi-automatic weapons and high-capacity magazines.",fox-news,0,35.44,11.06
"Weiner's office initially said the congressman's account was ""obviously hacked,"" but the representative has since taken to calling the incident a ""prank"" -- he used both terms Wednesday.",fox-news,0,35.44,11.06
"A late and somewhat unlikely addition to Trump's short list, Lieberman is nonetheless the sudden frontrunner.",fox-news,0,35.44,11.06
Trump has a substantial lead in the delegate chase for the GOP nomination.,fox-news,0,35.44,11.06
"“When you open your heart to patriotism, there is no room for prejudice,” he said.",fox-news,0,35.44,11.06
"The most high-profile potential Republican candidate is former Sen. Scott Brown, who pulled off a surprise 2010 victory in the race for the open seat of Sen. Ted Kennedy.",fox-news,0,35.44,11.06
"Police are spending more time and money making arrests, housing inmates, impounding vehicles, seizing drugs and handling other problems related to Colorado pot.",fox-news,0,35.44,11.06
"""We are currently fighting proposals to cut Social Security to pay the nation's bills,"" he said.",fox-news,0,35.44,11.06
"""The time has come for them to accept the responsibility that comes with influence and make clear there is no place for racism and anti-Semitism, homophobia and other forms of bigotry in their movement.""",fox-news,0,35.44,11.06
"One of its members, Demetrios Minor, said critics of Dan Cathy have taken his statements completely out of context.",fox-news,0,35.44,11.06
"Every Senate Republican has signed onto a letter vowing to block all Democratic-backed legislation until the chamber extends the Bush tax cuts and approves a spending bill to keep the government running, Fox News has learned.",fox-news,0,35.44,11.06
"The Post story centered on allegations made by Leigh Corfman, now 53.",fox-news,0,35.44,11.06
Even political figures and newspaper editorial writers who might agree with the comments swiftly said they were out of line for a high court justice.,fox-news,0,35.44,11.06
"But the president's budget director told Fox News that even when the trust funds run out, both Social Security and Medicare would still have some income.",fox-news,0,35.44,11.06
"“Politicization, real or perceived, undermines public faith in the impartiality of the courts.”",fox-news,0,35.44,11.06
"Earlier this month, U.S. Attorney Paul Fishman said only that his office was reviewing the matter ""to determine whether a federal law was implicated.""",fox-news,0,35.44,11.06
"Then White House spokesman Bill Burton said Obama was not ""backing off"" his original remarks.",fox-news,0,35.44,11.06
Much of the hour-long argument delved into the tedious details of class action law and if the Wal-Mart women could properly certify their claims into a single case.,fox-news,0,35.44,11.06
"Schiff, a vocal critic of the president, has doubled down on his claim that Trump and his administration colluded with foreign powers despite Mueller’s findings.",fox-news,1,35.44,11.06
"“His mother worked many different jobs to make ends meet,” it says.",fox-news,0,35.44,11.06
Clinton did not reference radical Islam.,fox-news,0,35.44,11.06
"… Let it be known -- we will be watching, and will make sure voters this November know if their representatives stood for Dreamers or for their deportations.”",fox-news,0,35.44,11.06
"“We start surrounding these folks with layers of guards—it will really cripple the ability to be a free society,” he said on “Outnumbered.”",fox-news,0,35.44,11.06
"“However, we would be remiss … if we did not challenge your continuing misuse of Catholic teaching to defend a budget plan that decimates food programs for struggling families, radically weakens protections for the elderly and sick and gives more tax breaks to the wealthiest few.”",fox-news,0,35.44,11.06
"“Family dental bills paid with campaign funds were characterized as a charitable contribution to ‘Smiles for Life,’” the press release from the U.S. Attorney’s Office said as an example.",fox-news,0,35.44,11.06
Attorneys general in Utah and New Mexico said they had no immediate plans to join the suit.,fox-news,0,35.44,11.06
"It has the full support of the President and could be signed into law to quickly reopen the government.""",fox-news,0,35.44,11.06
"Members of Congress are calling her evasive, and question why she didn't reveal the program sooner -- plus her history at the Federal Elections Commission is coming under scrutiny.",fox-news,1,35.44,11.06
"A source within the National Republican Senatorial Committee told Fox News that Sen. John Cornyn, head of the Senate GOP campaign arm, already has told Akin that if he stays in the race, the $5 million set aside for the Missouri race will be withdrawn.",fox-news,0,35.44,11.06
"""We can confirm that the Christie for Governor re-election campaign and the New Jersey Republican State Committee received subpoenas for documents from the U.S. Attorney's office, in addition to the subpoena the campaign previously received from the state legislative committee,"" he said.",fox-news,0,35.44,11.06
"It's irrefutable and that's why I think this is a debate we want to have, and that's the debate we're going to win.”",fox-news,0,35.44,11.06
And she said the country needs to “keep guns like the ones used last night out of the hands of terrorists or other violent criminals.”,fox-news,0,35.44,11.06
"""Mr. vice president, I know you're under a lot of duress to make up for lost ground, but I think people would be better served if we don't keep interrupting each other,"" Ryan said.",fox-news,0,35.44,11.06
"""It is important for me personally to go ahead and affirm that same-sex couples should be able to get married,"" Obama stated.",fox-news,0,35.44,11.06
"Labrador supports a path to legal status, but only after evidence that enforcement has been improved, he has said.",fox-news,0,35.44,11.06
"Some phony theology. Not a theology based on the Bible. A different theology.""",fox-news,1,35.44,11.06
"Chief Justice John Roberts also offered his doubts about the merits of lawsuit, suggesting that any discriminatory acts at Wal-Mart are no worse than anywhere else.",fox-news,0,35.44,11.06
"The moment now turns to Nancy Pelosi and Chuck Schumer. The country is watching.""",fox-news,0,35.44,11.06
There is also concern about abandoning the U.S.' Kurdish allies.,fox-news,0,35.44,11.06
The president was joined by four children who wrote to the White House about gun violence following the Connecticut mass shooting in which 20 children were killed.,fox-news,0,35.44,11.06
Pelosi was challenged by Ohio Rep. Tim Ryan in a secret-ballot vote among House Democrats.,fox-news,0,35.44,11.06
"Obama, speaking from the White House on Sunday, said the nightclub massacre in which 50 people were killed and at least 53 others were wounded is being investigated as an “act of terror,” though did not say whether it was tied to radical Islam.",fox-news,0,35.44,11.06
“We cannot rely on empty promises from those who have already proven to play politics with the lives of Dreamers.,fox-news,0,35.44,11.06
"""Well, we'll have to take a look at that, won't we?""",fox-news,0,35.44,11.06
"The bad guy sometimes wins.""",fox-news,0,35.44,11.06
"Some Republican senators called the idea of Lieberman replacing Comey “intriguing,” but Sen. Claire McCaskill, D-Mo., said it was a “mistake” to nominate him.",fox-news,0,35.44,11.06
President Obama met with top GOP and Democratic congressional leaders Tuesday but left the nitty-gritty negotiations to the panel -- he assigned Treasury Secretary Tim Geithner and budget director Jacob Lew to represent the administration. ,fox-news,0,35.44,11.06
Jackson told the judge that he had been hospitalized for psychological issues.,fox-news,0,35.44,11.06
"As for what he wants, Sanders said he’ll continue to fight what he called the “drift” toward an oligarchic society.",fox-news,0,35.44,11.06
"""He's getting into conspiracy land and he's acting like an Oliver Stone type figure.",fox-news,0,35.44,11.06
"Tiny bits of genetic material – traces of sweat, skin cells, saliva, hair or fingerprints – are typically used as a roadmap to the suspect’s door, investigators and bomb experts say.",fox-news,0,35.44,11.06
"“When the Democrat filibuster of the government funding bill ends, the serious, bipartisan negotiations that have been going on for months now to resolve our unfinished business -- military spending; disaster relief; healthcare; immigration and border security -- will continue,” he said.",fox-news,0,35.44,11.06
"President Trump said Friday that he will support a short-term spending bill to re-open the government, temporarily ending the partial government shutdown that has dragged on for more than a month -- despite a day earlier saying Republicans would not “cave” on his demands for funding for a wall on the southern border.",fox-news,0,35.44,11.06
"Two other lawmakers, Rep. Vern Buchanan, R-Fla., and Rep. Earl Blumenauer, D-Ore., co-chairs of the Congressional Animal Protection Caucus, assailed the administration's decision.",fox-news,1,35.44,11.06
"While Netanyahu has long been skeptical of the negotiations, his opposition has increased over what he sees as Obama's willingness to make concessions that would leave Iran on the brink of being able to build a nuclear weapon.",fox-news,0,35.44,11.06
"“And in this country, you cannot do that.",fox-news,0,35.44,11.06
He said AARP remains opposed to cutting Social Security for the sake of deficit reduction and to any privatization plan.,fox-news,0,35.44,11.06
"Ryan shot back: ""They got caught with their hand in the cookie jar turning Medicare into a piggy bank for ObamaCare.""",fox-news,0,35.44,11.06
"Farenthold pledged to repay the $84,000 in taxpayer money spent to settle the claim.",fox-news,0,35.44,11.06
"McCarthy tweeted: ""President Trump has put forward a serious and reasonable offer to reform parts of our broken immigration system and reopen government.",fox-news,0,35.44,11.06
Supreme Court justices have faced more pushback from the opposition party in recent years.,fox-news,0,35.44,11.06
"Rep. Michele Bachmann has declined to get into the scrum with Newsweek over its cover story of the presidential candidate called ""The Queen of Rage,"" accompanied by an unflattering photo of the Minnesota Republican, but others are calling the magazine out of bounds in its depiction.",fox-news,0,35.44,11.06
Boehner last week put a counter-proposal on the table that included $800 billion in revenue increases over the next decade.,fox-news,0,35.44,11.06
"At hastily arranged news conference Friday afternoon, Sestak said Clinton called him last summer to express concerns over his jumping into the Senate primary, and how his military background could help him leave a mark on the House.",fox-news,0,35.44,11.06
"""There does not seem to be a majority of the Democrats who support the deal negotiated by Vice President Biden,"" he told Fox News.",fox-news,0,35.44,11.06
The truth is that the Romney-Ryan budget would end Medicare as we know it: people with Medicare would be left with nothing but a voucher in place of the guaranteed benefits they rely on today.”,fox-news,0,35.44,11.06
The Wall Street Journal reported late Sunday that she was expected to formally launch her candidacy next month.,fox-news,0,35.44,11.06
"Cornyn, the Senate's No. 2 Republican, and other supporters said the bill is narrowly tailored and applies only to acts of terrorism that occur on U.S. soil.",fox-news,0,35.44,11.06
"""She was in effect being promoted for what she had done at the Federal Election Commission and now was going to be expected ... to replicate that at the IRS and now we know that's exactly what happened,"" he said.",fox-news,0,35.44,11.06
"The Clintons' effective federal tax rate for 2014 was 35.7 percent, while the effective tax rate for federal, state and local taxes was 45.8 percent.",fox-news,0,35.44,11.06
"The Texas lawmaker blamed his rival for the National Enquirer story published Friday that alleged Cruz has had extramarital affairs, and after hits from Trump’s campaign about the mental health of his wife, the firebrand senator appears to be backing away from his pledge to support Trump if the billionaire real estate mogul wins the GOP nomination.",fox-news,0,35.44,11.06
"I hope that instead of choosing the road of endless obstruction, Democrats will decide to work with him to reach an agreement and end the shutdown,” he said.",fox-news,0,35.44,11.06
"He called the disclosure of the program that allows the NSA to collect communications data from Internet companies ""reprehensible"" and said the phone-records monitoring leak could cause harm to the nation's intelligence gathering activities.",fox-news,0,35.44,11.06
Ramos’ interview with Fox also occurred as U.S. Vice President Joe Biden paid a visit to Mexico for an economic summit.,fox-news,0,35.44,11.06
