text,source,label,reliability,bias
"The Republican demand and the barbed response of the committee’s chairman, Representative Adam B. Schiff, echoed well outside the wood-paneled House hearing room.",the-new-york-times,1,40.94,-7.94
"One of them told investigators that Mr. Stone not only seemed to predict WikiLeaks’ actions, but also that he took credit afterward for the timing of its disclosures that damaged Mrs. Clinton’s candidacy.",the-new-york-times,0,40.94,-7.94
"The backlash has been an unexpected political headache for Mr. Pence, who is juggling whether to run for re-election or for president in 2016.",the-new-york-times,1,40.94,-7.94
The reluctance to talk about the platform reflects the delicate position that Mr. Romney is in when it comes to abortion policy.,the-new-york-times,0,40.94,-7.94
She even joked ruefully about moving to New Zealand.,the-new-york-times,0,40.94,-7.94
"That anger has been compounded by Mr. Obama’s inability to persuade lawmakers to impose new restrictions on the availability of firearms, especially the assault-style rifles like the one believed to have been used by the gunman in Sunday morning’s attack in Orlando.",the-new-york-times,0,40.94,-7.94
“I have not done anything wrong.,the-new-york-times,0,40.94,-7.94
"“The Easter Egg Roll with my kids,” he said.",the-new-york-times,0,40.94,-7.94
"Indeed, in the hours after the announcement of the report, Democratic candidates reacted over Twitter or in remarks at events rather than in back-and-forth conversations with voters.",the-new-york-times,0,40.94,-7.94
Mr. Boehner pointed to what aides called “orphan districts” in Democratic-leaning states that would not be a factor in the presidential campaign.,the-new-york-times,0,40.94,-7.94
"On Tuesday, Mr. Weiner presided over two testy news briefings at which he had dodged a variety of questions.",the-new-york-times,1,40.94,-7.94
"“Tone down our own rhetoric and not ascribe the worst motives to our colleagues,” he said hopefully.",the-new-york-times,0,40.94,-7.94
The Justice Department wrote Mr. Issa last week that it did not need a special prosecutor to investigate if it chose to do so.,the-new-york-times,0,40.94,-7.94
"WASHINGTON — Representative Raúl R. Labrador, a Republican of Idaho who has barely served two terms in Congress, jumped into the race for House majority leader on Friday, offering himself as the more conservative alternative who could pull the House rightward in the wake of Representative Eric Cantor’s loss in a primary.",the-new-york-times,0,40.94,-7.94
"In a report that set off the latest tempest over the talking points, ABC News reported incorrectly that Mr. Rhodes had emphasized the need to protect the State Department’s interests.",the-new-york-times,0,40.94,-7.94
"But with the exception of Mr. McCain, Republicans steered clear of discussing whether Mr. Trump should cancel Monday’s meeting in Helsinki.",the-new-york-times,0,40.94,-7.94
"The document is expected to call for border security and enforcement measures, as well as providing a path to legal status — but not citizenship — for many of the 11 million undocumented immigrants in the country, the aides said.",the-new-york-times,0,40.94,-7.94
"As with Mr. Trump’s abrupt firing of Attorney General Jeff Sessions, the split with Mr. Mattis was a full turn in a relationship that once appeared strong.",the-new-york-times,0,40.94,-7.94
"She also released a list of paid speeches showing that she had earned nearly $10 million in speaking fees in 2013, the year she left the State Department.",the-new-york-times,0,40.94,-7.94
"Representative Adam B. Schiff, Democrat of California and chairman of the House Intelligence Committee, said that his panel would investigate the BuzzFeed report and was “already working to secure additional witness testimony and documents related to the Trump Tower Moscow deal and other investigative matters.”",the-new-york-times,0,40.94,-7.94
But other advocacy groups that are pushing to preserve Social Security benefits accused AARP of effectively abandoning its core constituency.,the-new-york-times,0,40.94,-7.94
"And unlike the courtly Mr. Bentsen in 1988, Mr. Biden turned his temperature up, singeing the young man across the table with patronizing grins, but mostly withering retorts.",the-new-york-times,0,40.94,-7.94
"We’re going to continue to explain it to people who don’t understand it, and if possible, we will find a way to amplify what this bill really is in the legislative process.”",the-new-york-times,0,40.94,-7.94
"A day before Mr. Stone and Mr. Bannon emailed about WikiLeaks, Donald Trump Jr. exchanged messages on Twitter with the WikiLeaks account and asked, “What’s behind this Wednesday leak I keep reading about.”",the-new-york-times,0,40.94,-7.94
"Supporters from both parties raised hot dogs and beers, catching up on acquaintances in common.",the-new-york-times,0,40.94,-7.94
“Greatest Witch Hunt in the History of our Country!” he wrote on Twitter. “NO COLLUSION!”,the-new-york-times,0,40.94,-7.94
"Mr. Collins, who is accused of passing insider information to his son about a drug company on whose board he served, has said he expects to be “fully vindicated and exonerated.”",the-new-york-times,0,40.94,-7.94
"He joked about the need for a new and refined tax code that would finally put his father, a certified public account standing nearby, out of business.",the-new-york-times,0,40.94,-7.94
“Political capital in the gun debate only goes so far.,the-new-york-times,0,40.94,-7.94
"“I told President Clinton that my only consideration in getting into the Senate race or not was whether it was the right thing to do for Pennsylvania working families and not any offer,” Mr. Sestak said.",the-new-york-times,0,40.94,-7.94
"PHOENIX — As the Arizona Legislature sent a bill to her desk Monday that would grant business owners the right to invoke religion to refuse service to gays and others, Gov. Jan Brewer, a Republican, faced pressure from many corners to veto the measure, which has cast unwanted national attention on Arizona.",the-new-york-times,0,40.94,-7.94
"It promises to be another bruising campaign, with two Democratic congressmen likely to face off in a primary in April.",the-new-york-times,0,40.94,-7.94
"The speech, scheduled for March 3, was arranged by Mr. Boehner and the Israeli ambassador without consulting the White House — a move that Mr. Obama’s team has called a breach of protocol.",the-new-york-times,0,40.94,-7.94
"The first speaker who preceded him to the stage had no microphone, causing a delay; later on, she was booed when she disclosed that she was a Democrat.",the-new-york-times,0,40.94,-7.94
"While officially a Republican, he has taken on leaders of both parties and, with no prior political career of his own, made clear that he saw himself as the ultimate outsider not beholden to the current system.",the-new-york-times,0,40.94,-7.94
"WASHINGTON — The tableau at the White House was chillingly familiar: The somber president, nearing the end of his eight-year term, walked grim-faced to the podium to offer his condolences, promised action in the wake of suffering and pleaded for a new resolve that just might prevent more deaths in a hail of bullets.",the-new-york-times,0,40.94,-7.94
"One candidate, Scott Smith, the mayor of Mesa, who is a Mormon, said that the bill “gives carte blanche for anybody to discriminate under the guise of religion.”",the-new-york-times,0,40.94,-7.94
"It is the largest employment discrimination class action in history, and the court’s decision, expected by June, will probably be its most important business ruling this term.",the-new-york-times,0,40.94,-7.94
Two other measures also zero in on the costs of administration officials’ travel.,the-new-york-times,0,40.94,-7.94
“How would this be possible if the U.S. had no jurisdiction over them?”,the-new-york-times,0,40.94,-7.94
"“It is very troubling to see President Obama again turning a deaf ear to the thoughts and concerns of a majority of Americans,” said James Renacci, a Republican candidate in Ohio’s 16th District, who said people at a recent public meeting were furious about the mosque proposal.",the-new-york-times,0,40.94,-7.94
It does not appear that Mr. Blumenthal ever sought to correct those mistakes.,the-new-york-times,0,40.94,-7.94
"At the same time, same-sex couples will also be able to file amended returns for certain prior tax years, meaning that many couples might be eligible for refunds.",the-new-york-times,0,40.94,-7.94
"“Under these circumstances, we did not have confidence that Strzok’s decision to prioritize the Russia investigation over following up on the Midyear-related investigative lead discovered on the Weiner laptop was free from bias,” he wrote.",the-new-york-times,0,40.94,-7.94
"The investigation of the second-term congressman, by the F.B.I. and the United States attorney’s office in Brooklyn, began more than two years ago with an examination of Mr. Grimm’s fund-raising for his 2010 race and expanded.",the-new-york-times,0,40.94,-7.94
Ms. Townsend said she had her own agenda for the meeting at Trump Tower.,the-new-york-times,0,40.94,-7.94
“It’s a fake question.”,the-new-york-times,0,40.94,-7.94
"In an indictment filled with colorful details about clandestine meetings, angry texts — even a reference to “The Godfather: Part II” — Mr. Stone was charged with seven counts, including obstruction, making false statements and witness tampering.",the-new-york-times,0,40.94,-7.94
They also said Mr. Cohen discussed the progress of the Moscow project with Mr. Trump more frequently than he had told the committee and had briefed members of Mr. Trump’s family about the negotiations.,the-new-york-times,0,40.94,-7.94
But there is no other evidence in the e-mails that Mr. Morell himself objected to the inclusion of this material.,the-new-york-times,0,40.94,-7.94
"Then an unseen announcer concludes: “The world needs American strength, not apologies.”",the-new-york-times,0,40.94,-7.94
"Even before Judge Gorsuch’s nomination, Ms. McCaskill inadvertently drew the ire of liberal activists by expressing support for “a full confirmation hearing process and a vote,” before making clear she believed in a 60-vote threshold.",the-new-york-times,0,40.94,-7.94
"Mr. Nadler, Ms. Pelosi and other party elders believe Mr. Trump is threatening the country’s democratic institutions.",the-new-york-times,0,40.94,-7.94
"On Thursday, representatives of the American Bar Association told the committee that it had unanimously found Judge Gorsuch to be “well qualified,” the group’s highest rating.",the-new-york-times,0,40.94,-7.94
Republicans said Mr. Obama’s defense of the right of the developers to pursue the project showed that he was out of touch with average Americans.,the-new-york-times,0,40.94,-7.94
“We will be more proactive and not back down.”,the-new-york-times,0,40.94,-7.94
"On at least a few occasions, Mr. Bloomberg and Mr. Trump met up on the golf links.",the-new-york-times,0,40.94,-7.94
"“These are the issues that we will take to the Democratic National Convention in Philadelphia in July,” Mr. Sanders said, declining to answer reporters’ shouted questions about whether he would leave the race.",the-new-york-times,0,40.94,-7.94
"Mr. Etheridge, who represents a conservative district south of Raleigh, faces a re-election challenge, but his race is not among the top Republican targets in the country. ",the-new-york-times,0,40.94,-7.94
"“In recent days, these e-mails have been selectively and inaccurately read out to the media,” said a White House spokesman, Eric Schultz.",the-new-york-times,0,40.94,-7.94
"Down the line, the witnesses warned that Vladimir V. Putin’s Russia would only grow bolder in its efforts to destabilize western democracies, including the United States.",the-new-york-times,0,40.94,-7.94
"“The numbers that you gave are wrong,” he told one reporter.",the-new-york-times,0,40.94,-7.94
The Bush Doctrine argued for preventive strikes in the interest of self-defense and national security.,the-new-york-times,0,40.94,-7.94
"At other times, he has used more ambiguous language, but the impression left on audiences can be similar.",the-new-york-times,0,40.94,-7.94
Mr. Sasse echoed that sentiment.,the-new-york-times,0,40.94,-7.94
"Mr. Obama has shown a certificate of live birth from Hawaii, which is the standard form of birth certificate in the state, and state officials – including the Republican who was governor during the 2008 campaign – have confirmed its authenticity.",the-new-york-times,0,40.94,-7.94
"“I will not resign,” said Mr. LePage, who tried to put to rest swirling questions about his state of mind.",the-new-york-times,0,40.94,-7.94
“I asked him to sign on to Dream bill.,the-new-york-times,0,40.94,-7.94
"But Mr. Royce, of California, called Friday for Mr. Trump to “use today’s indictments to challenge”",the-new-york-times,0,40.94,-7.94
"“Ultimately, we’re responsible.”",the-new-york-times,0,40.94,-7.94
"Speaking to reporters, Mr. Obama said the country had again been traumatized by grievous violence, which shattered more than 100 lives during a three-hour nightmare early Sunday, with 50 people killed and 53 wounded in the attack.",the-new-york-times,0,40.94,-7.94
"Firing Mr. Strzok, however, removes a favorite target of Mr. Trump from the ranks of the F.B.I. and gives Mr. Bowdich and the F.B.I. director, Christopher A. Wray, a chance to move beyond the president’s ire.",the-new-york-times,0,40.94,-7.94
"“But more to the point, I disagree with what she said.",the-new-york-times,0,40.94,-7.94
"House conservatives — lacking a rationale to fight Mr. McCarthy, a well-liked member of leadership who has raised millions of dollars for Republican incumbents — have begun protesting that his voting record is actually to the left of Mr. Cantor’s.",the-new-york-times,0,40.94,-7.94
"However, he made clear that party unity was on his mind.",the-new-york-times,0,40.94,-7.94
"As part of a plea agreement, prosecutors recommended that Mr. Jackson receive a sentence of 46 to 57 months in prison.",the-new-york-times,0,40.94,-7.94
"Donald J. Trump, the presumptive Republican presidential nominee, seized on the attacks as evidence of America’s weakness in facing terrorism.",the-new-york-times,1,40.94,-7.94
"In a letter signed by the 42 members of the Republican caucus, delivered to the Senate majority leader, Harry Reid of Nevada, and mentioned Wednesday on the Senate floor by the minority leader, Mitch McConnell of Kentucky, the Republicans informed their Democratic counterparts that they would not go forward with “any legislative item until the Senate has acted to fund the government and we have prevented the tax increase that is currently awaiting all American taxpayers.”",the-new-york-times,0,40.94,-7.94
"Her spokesman, Andrew Wilder, suggested that she would not take that long, but he would not say what she was inclined to do.",the-new-york-times,0,40.94,-7.94
"This is just another one, but a lot of families disagree politically.",the-new-york-times,0,40.94,-7.94
"When Mr. Shulman said he had, Mr. Jordan produced White House visitor records that he said indicated Mr. Shulman had been there at least 118 times.",the-new-york-times,0,40.94,-7.94
"Marian Wright Edelman, president of the Children’s Defense Fund, an advocacy group here, criticized the study as “nothing more than a continuation of the N.R.A.’s attempts to prey on America’s fears, saturate our schools with more guns and turn them into armed fortresses.”",the-new-york-times,0,40.94,-7.94
"“But at least for now, the healthy competition will bring us together.”",the-new-york-times,0,40.94,-7.94
The chief justice also asked Mr. Sellers “how many examples of abuse of the subjective discrimination delegation need to be shown before you can say that flows from the policy rather than from bad actors?”,the-new-york-times,0,40.94,-7.94
"Jack Levin, the chief executive of yFrog, the Twitter-affiliated image and video service that was used to upload the photo, said in an interview on Wednesday that his company did not have reason to believe that its user passwords were exposed or stolen.",the-new-york-times,0,40.94,-7.94
"“There won’t be any daylight there at all,” he said.",the-new-york-times,0,40.94,-7.94
"“I would say that there is a two-in-three chance that we win control of the House again, but there’s a one-in-three chance that we could lose, and I’m being myself, frank,” he said in an interview first posted online by the newspaper The Hill.",the-new-york-times,0,40.94,-7.94
"Mr. Trump’s view of the United States was strikingly grim for an Inaugural Address — a country where mothers and children are “trapped in poverty in our inner cities,” where “rusted-out factories” are “scattered like tombstones across the landscape” and where drugs and crime “have stolen too many lives.”",the-new-york-times,0,40.94,-7.94
WASHINGTON — The chairman of the House committee investigating the Benghazi attacks asked Hillary Rodham Clinton on Tuesday to appear for a private interview about her exclusive use of a personal email account when she was secretary of state.,the-new-york-times,0,40.94,-7.94
"Republicans must be willing to take these challenges head on with new leadership, fresh ideas and a different approach.”",the-new-york-times,0,40.94,-7.94
"“It would be surprising to me if he didn’t do that,” said Shawn Standefer, a childhood friend of the younger Mr. Hutchinson who captained their national championship-winning Quiz Bowl team in high school.",the-new-york-times,0,40.94,-7.94
"The report added another jolt to a chaotic week for the White House, which has had to fend off questions about recent revelations that F.B.I. counterintelligence agents began investigating Mr. Trump in 2017 and that Mr. Trump has tried to conceal the details from senior administration officials about his interactions with President Vladimir V. Putin of Russia.",the-new-york-times,0,40.94,-7.94
"“Well, I don’t see how that’s possible,” Mr. Paul said on the CNN program “State of the Union.”",the-new-york-times,0,40.94,-7.94
"Representative Jackie Speier, Democrat of California, said Vice President Biden had informed lawmakers during a two-hour briefing on Monday that there are “19 independent steps that the president can take by executive order.”",the-new-york-times,0,40.94,-7.94
"At a news conference on Friday morning, John Miller, the New York Police Department’s deputy commissioner of intelligence and counterterrorism, said a postal worker at the mail facility on 52nd Street recognized the package addressed to Mr. Clapper as similar to other suspicious packages discovered this week and “froze it in the system.”",the-new-york-times,0,40.94,-7.94
"“The decision to fire Special Agent Strzok is not only a departure from typical bureau practice, but also contradicts Director Wray’s testimony to Congress and his assurances that the F.B.I. intended to follow its regular process in this and all personnel matters,” Mr. Goelman said.",the-new-york-times,0,40.94,-7.94
The evening began in a familiar fashion: Demonstrators marched along the street and chanted “Hands up! Don’t shoot!” and other slogans that have become common here since Mr. Brown’s death.,the-new-york-times,0,40.94,-7.94
"“The campaign and the state party intend to cooperate with the U.S. attorney’s office and the state legislative committee and will respond to the subpoenas accordingly,” Mr. Sheridan said.",the-new-york-times,0,40.94,-7.94
The convention is intended to return the campaign’s message to one of how Mr. Romney will get the nation’s economy back on track.,the-new-york-times,0,40.94,-7.94
"The spot featured an old nude photo shoot of Mr. Trump’s wife Melania Trump, a former model, posing on his jet.",the-new-york-times,0,40.94,-7.94
That is on top of projections that currently are in the range of 2 percent to 3 percent.,the-new-york-times,0,40.94,-7.94
"Joining them was Ivanka’s husband, Jared Kushner, who will serve as an unpaid senior adviser.",the-new-york-times,0,40.94,-7.94
"“The former president said he knew I’d say that, and the conversation moved on to other subjects.”",the-new-york-times,0,40.94,-7.94
"Instead, Mr. Christie will plant himself in New Hampshire for a week, holding one town hall after another.",the-new-york-times,0,40.94,-7.94
"He described the decision to enter politics as a “coin toss” between him and his wife, Mary Pat, herself a nimble political mind.",the-new-york-times,0,40.94,-7.94
"He conceded that “we do not need 2,000 miles of concrete wall from sea to shining sea — we never did” and invoked the utility of “smart walls” that substitute some physical barriers for drones and other sensors.",the-new-york-times,0,40.94,-7.94
"Some called the article a partisan plot, even as the reporters behind it described in detail how they had uncovered the story and corroborated the allegations.",the-new-york-times,0,40.94,-7.94
"Earlier in the day, Mr. Trump had asked on Twitter, “How do you impeach a president who has won perhaps the greatest election of all time?",the-new-york-times,0,40.94,-7.94
"“I mean, for us as a party in Congress to send the message that we didn’t learn a blessed thing from this amazing election result, we aren’t paying attention.”",the-new-york-times,0,40.94,-7.94
But a release from Mr. Seel’s office about the planned meeting noted that Mr. Trump “has brought the issue of President Barack Obama failing to provide a birth certificate front and center recently.”,the-new-york-times,0,40.94,-7.94
"Governor Christie? “Strong,” he said.",the-new-york-times,0,40.94,-7.94
"At least six top Republicans have already taken steps to run for party chairman and several members have withdrawn their support for Mr. Steele, leading many party leaders to conclude that Mr. Steele will not seek reelection.",the-new-york-times,0,40.94,-7.94
"“No, not $2.5 billion, no — we’re asking for $5.6” billion, Mr. Trump said during a cabinet meeting, hours before the Situation Room briefing.",the-new-york-times,0,40.94,-7.94
"“Anyone who has in any way been a critic, publicly been a critic of President Trump, needs to be on an extra alert.”",the-new-york-times,0,40.94,-7.94
"To that effect, the Office of Management and Budget circulated a letter to affected agencies and departments on Friday afternoon instructing management to prepare for an “orderly reopening” and to prioritize pay and benefits for workers.",the-new-york-times,0,40.94,-7.94
"Benjamin Todd Jealous, the president of the N.A.A.C.P., said the resolution was not an attempt to label the entire Tea Party movement as racist.",the-new-york-times,0,40.94,-7.94
"Some also said the White House should not have put lawmakers on the spot in the first place and could have been better prepared for the president’s statement, lining up religious and community leaders to offer support for the right to build the mosque and undermine Republican attacks.",the-new-york-times,0,40.94,-7.94
"One strain of criticism came from human rights and civil liberties activists, who expressed alarm over Judge Gorsuch’s experiences as a Justice Department official in the Bush administration in 2005 and 2006, when he helped to defend and advance the executive branch’s positions on matters like detainee treatment and surveillance.",the-new-york-times,0,40.94,-7.94
"“I’d like to know who those Hispanics are,” Mr. Fox said.",the-new-york-times,0,40.94,-7.94
"While a parade of witnesses addressed the Senate Judiciary Committee, trading dueling views of Judge Gorsuch, the Senate Democratic leader, Chuck Schumer of New York, went to the Senate floor and announced that he would try to lead Democrats in blocking an up-or-down vote on Judge Gorsuch.",the-new-york-times,0,40.94,-7.94
Mr. Mattis was the primary author of a new American defense strategy whose central goal was to take on “revisionist” powers — an approach that some of Mr. Trump’s former advisers say the president never fully comprehended.,the-new-york-times,0,40.94,-7.94
"“He’s cool,” Lt. Gov. Timothy Murray said of Mr. Cowan. “Tom Brady, George Clooney, James Bond and the president have nothing on Mo.”",the-new-york-times,0,40.94,-7.94
"“Mr. Farenthold made a commitment that he would reimburse taxpayers for the settlement,” said AshLee Strong, a spokeswoman for Speaker Paul Ryan, Republican of Wisconsin.",the-new-york-times,0,40.94,-7.94
The White House did not immediately respond to requests for clarification of the legal grounds the president’s lawyers have given him for validating such a move.,the-new-york-times,0,40.94,-7.94
The subpoenas issued this week show that prosecutors have begun taking the necessary steps to answer that question.,the-new-york-times,0,40.94,-7.94
"“I think the parent should be in charge,” he added, “working with the local school district to try to design an educational environment for each child that optimizes their potential.”",the-new-york-times,0,40.94,-7.94
"The process began in earnest at 4:20 p.m. on Friday, Sept. 14, when Stephen W. Preston, the C.I.A. general counsel, sent an e-mail to other agency officials warning them not to disclose information that might interfere with the F.B.I.’s investigation.",the-new-york-times,0,40.94,-7.94
"“Rather than drag out this political charade into 2016 and selectively leak portions of a closed-door interview, the committee should schedule the public hearing, make her records public and refocus its efforts on the attacks in Benghazi,” he said.",the-new-york-times,0,40.94,-7.94
