text,source,label,reliability,bias
"At the time, LaPierre assailed the media and gun control advocates for their responses to the massacre, and he proposed that armed volunteers protect schools and that gun-free school zones be eliminated.",huffpost,0,37.82,-10.75
"""Those findings are confirmed by the emails released today, and they contradict statements made by the White House that it and the State Department only changed one word in the talking points.",huffpost,0,37.82,-10.75
"Holder was greeted as a star at Drake's Place, posing for selfies and group photos with residents and shaking hands.",huffpost,0,37.82,-10.75
"“While I planned on serving out the remainder of my term in Congress, I know in my heart it’s time for me to move along and look for new ways to serve,” he said in the statement.",huffpost,0,37.82,-10.75
"“Not only would I have not been in favor of it, but President [George W.] Bush wouldn’t have been in favor of it,” Rubio said.",huffpost,0,37.82,-10.75
"There is no national emergency,” California Attorney General Xavier Becerra, who has sued the Trump administration multiple times, said in a statement.",huffpost,0,37.82,-10.75
"""But if you want to become a citizen, you'll have to go through the path.",huffpost,0,37.82,-10.75
I think this is a big mistake on part of President Peña.”,huffpost,0,37.82,-10.75
CNN shared footage of FBI agents arriving at the property:,huffpost,0,37.82,-10.75
"""I've been a conservative my whole life,"" he added.",huffpost,0,37.82,-10.75
"All of the confirmed packages listed the Florida office of Rep. Debbie Wasserman Schultz (D-Fla.), the former chairwoman of the Democratic National Committee, as the return address.",huffpost,0,37.82,-10.75
"Earlier, Sen. Mark Warner (D-Va.) released a statement immediately after the Mueller report was revealed to be complete, demanding that Barr quickly put together a redacted, releasable version for Congress to access.",huffpost,0,37.82,-10.75
"UPDATE: AARP CEO A. Barry Rand said in a statement, ""It has long been AARP's policy that Social Security should be strengthened to provide adequate benefits and that it is sufficiently financed to ensure solvency with a stable trust fund for the next 75 years.""",huffpost,0,37.82,-10.75
"The New York Times reported the charges against Grimm ""will include mail fraud and wire fraud and focus on his conduct in connection with a health food restaurant he owned on the Upper East Side of Manhattan after he left the Federal Bureau of Investigation in 2006,"" citing someone familiar with the case.",huffpost,0,37.82,-10.75
"The pollster for Secure America Now is John McLaughlin, who has worked with Netanyahu’s Likud Party.”",huffpost,0,37.82,-10.75
"“I don’t think there’s a big wave right now,” Hunter said, referring to a wave of Democratic gains.",huffpost,0,37.82,-10.75
"According to the Times, Mary Cheney, who is openly gay and married her partner, Heather Poe, in Washington, DC last year, took to Facebook to rebuke her sister's remarks.",huffpost,0,37.82,-10.75
"""We are going to limit it to the manufacturing of assault weapons and clips going forward.""",huffpost,0,37.82,-10.75
"Behind the scenes, White House Counsel Bob Bauer's office began investigating the matter when stories first surfaced.",huffpost,0,37.82,-10.75
"Buying a car, by contrast he said, is ""designed to meet the needs of a customer.",huffpost,0,37.82,-10.75
A spokeswoman for Brevard College in North Carolina confirmed to HuffPost that Sayoc attended the school for three semesters starting in the fall of 1980 and did not graduate.,huffpost,0,37.82,-10.75
The Washington Post reported last week that reading the founding document in full appears to be a first in the chamber’s 221-year history:,huffpost,0,37.82,-10.75
"In a statement to The Atlantic, Trump Jr.’s attorney, Alan Futerfas, said, “We can say with confidence that we have no concerns about these documents and any questions raised about them have been easily answered in the appropriate forum.”",huffpost,0,37.82,-10.75
"Obama will meet with Sanders in Washington on Thursday, the same day the Vermont senator plans to hold a rally there.",huffpost,0,37.82,-10.75
"""I'm saying that local communities and parents should be the ones in control over public education, certainly not the federal government, and I think the state governments have not done a particularly good job in public education, either,"" Santorum said.",huffpost,0,37.82,-10.75
"The YouTube video is published under an account titled TonyManization, and even more damning is that the faces of the individuals asking the Congressman questions are blurred out.",huffpost,0,37.82,-10.75
"""I was in the ICU at 2 a.m. with families faced with the decision to disconnect a respirator on their loved one; I counseled fifteen-year-old pregnant girls who were afraid to tell their parents about their condition; I spent hours hearing the grief of women who had been physically and emotionally clobbered by an abusive husband.""",huffpost,0,37.82,-10.75
"He was involved in the Clinton investigation, which was highly public, as well as the investigation into the Trump campaign and Russian interference in the 2016 election, which the bureau never publicly acknowledged until months into Trump’s presidency.",huffpost,0,37.82,-10.75
"Meanwhile, CNN reports that the “principal conclusion” of the report, which the attorney general will soon give to Congress, is expected to be made public.",huffpost,0,37.82,-10.75
"""It is going to be a very good year.",huffpost,0,37.82,-10.75
"“I’m not going to pay for that fucking wall,” Fox told Fusion’s Jorge Ramos in an interview airing Thursday.",huffpost,0,37.82,-10.75
"“Throughout his career, Trump has left behind a well-documented record of bankruptcies, thousands of lawsuits, angry stockholders and contractors who feel cheated and disillusioned customers who feel ripped off,” Bloomberg said.",huffpost,0,37.82,-10.75
"“As a counterintelligence concern of the greatest magnitude, and given that these alleged efforts were intended to interfere with our investigation, our Committee is determined to get to the bottom of this and follow the evidence wherever it may lead,” he added.",huffpost,0,37.82,-10.75
“I think the President Peña is taking an enormous political risk by hosting Trump.,huffpost,0,37.82,-10.75
"And if McConnell doesn’t follow through on immigration, Democrats will still be able to use his promise to vote against the next spending bill on Feb. 8 and pin the blame on Republicans.",huffpost,0,37.82,-10.75
"""It turns out, Senator McCain would pay for part of his plan by making drastic cuts in Medicare: $882 billion worth -- $882 billion in Medicare cuts to pay for a ill-conceived, badly thought-through health care plan that won't provide more health care to people, even though Medicare is already facing a looming shortfall,"" Obama declared at a campaign stop in Roanoke, Va.",huffpost,0,37.82,-10.75
"The bill aims to answer rising attacks on voting rights from courts and politicians across the country, and also to stem the increasing inequality of campaign funding by empowering small donors with matching contributions from public funds, among many other things.",huffpost,0,37.82,-10.75
"“Despite the fact that e-mails relating to the Benghazi talking points were made available to members of Congress several months ago, in recent days these e-mails have been selectively and inaccurately read out to the media.",huffpost,0,37.82,-10.75
"Trump said that he was ending the debate because he did not want to ""give up my right to run as an independent candidate,"" which he claimed the Republican Party was asking him to do if he wanted to moderate the debate.",huffpost,0,37.82,-10.75
Cowan's appointment means that there will be two black senators serving together for the first time in American history.,huffpost,0,37.82,-10.75
"And the 5-4 decision in Bush v. Gore, along partisan lines, also shows the political nature of the court,” Bam said.",huffpost,0,37.82,-10.75
"Governor Perry has a superior border security record and plan to make our border and our nation safer.""",huffpost,0,37.82,-10.75
"“If not us, then who? If not now, then when?”",huffpost,0,37.82,-10.75
"For two months, Democrats in Congress have been enmeshed in stalled negotiations with Trump as he refused to accept anything less than $5.7 billion in the federal budget for his border wall.",huffpost,0,37.82,-10.75
"Sen. Bernie Sanders (I-Vt.), who is running for the Democratic presidential nomination, echoed Trump’s own earlier call to release the report.",huffpost,0,37.82,-10.75
"Four states have legalized recreational marijuana, along with voters in D.C. -- though the D.C. measure is the subject of a congressional Republican effort to block its implementation.",huffpost,0,37.82,-10.75
That the administration wavered over its public declarations of the cause of the assault -- repeatedly citing the video before eventually confirming that it was clearly an act of terrorism -- was widely interpreted among critics as evidence of a desire to suppress or conceal the truth.,huffpost,0,37.82,-10.75
"Federally or state-run education is not designed to meet the needs of the customer.""",huffpost,0,37.82,-10.75
"The question, in some respects, is not what's missing from the set of ideas, but what took the administration so long to get to this point.",huffpost,0,37.82,-10.75
"The report marks the culmination of a controversial process that began in December, when NRA CEO Wayne LaPierre held a press conference the week after the shooting in Newtown, Conn.",huffpost,0,37.82,-10.75
"“I believe that, based upon the interview he gave today on ABC, it said that he had changed his view, but you’re a better judge of that than I am,"" Romney said.",huffpost,0,37.82,-10.75
Those restrictions would be overturned by the For The People Act.,huffpost,0,37.82,-10.75
"Instead, Christie was seen that October praising President Barack Obama for responsiveness and ""leadership"" in the storm's aftermath.",huffpost,0,37.82,-10.75
"The offer would also give a three-year extension to 300,000 people from El Salvador, Haiti, Nicaragua and Honduras who are living in the U.S. under the temporary protected status program.",huffpost,0,37.82,-10.75
The group sent a letter to Rep. Ryan in advance of his appearance on the Catholic campus on Thursday morning to give the Whittington Lecture.,huffpost,0,37.82,-10.75
"Rep. Bruce Braley (D-Iowa), who is running to succeed retiring Sen. Tom Harkin (D-Iowa), faced tough local coverage Tuesday after critical comments he made about Sen. Chuck Grassley (R-Iowa) were made public.",huffpost,0,37.82,-10.75
"All we've heard, the Fox News host complained, is ""we need a big tent. We need a big tent. Can we get a bigger tent? How can we get a big tent?",huffpost,1,37.82,-10.75
Read the full rant via Gawker:,huffpost,0,37.82,-10.75
"“I deeply respect the president and the reasons he has given for vetoing the Justice Against Sponsors of Terrorism Act,” Sen. Richard Blumenthal (D-Conn.) said ahead of the vote.",huffpost,0,37.82,-10.75
"Obama has said he will not meet with Netanyahu ahead of his speech in March, saying it would be ""inappropriate"" to meet with the leader two weeks before the Israeli elections.",huffpost,0,37.82,-10.75
"Obama Gun Control Proposals Unveiled, Marking Biggest Legislative Effort In A Generation",huffpost,0,37.82,-10.75
"“The other justices should hold an intervention, and tell her to be quiet or step down,” wrote Josh Blackman, a Houston College of Law professor who frequently writes about the high court.",huffpost,0,37.82,-10.75
The White House nevertheless insists that its package of proposals has teeth.,huffpost,0,37.82,-10.75
The request comes after reports revealed Clinton used a private email address and a server located in her New York home during her time as secretary of state.,huffpost,0,37.82,-10.75
It will be interesting to follow how this story plays out in the news media.,huffpost,0,37.82,-10.75
Trump spent most of his speech on Friday rehashing his usual talking points about crime at the border.,huffpost,0,37.82,-10.75
"But since vice presidential debates often have a negligible impact on the overall race anyway, Biden's sometimes over-the-top performance probably accomplished what he appeared intent on doing: rallying the Democratic base after Obama's woeful debate performance last week.",huffpost,1,37.82,-10.75
"Also on Thursday, the House is to take up its first spending cut measure, a proposed 5 percent trim in the budgets of leadership, rank-and-file member and committee offices.",huffpost,0,37.82,-10.75
"Among the suggested recommendations on the gun-policy front, only the ban on high-capacity magazines could have had a tangible impact on the shooting in Newtown, and it's unclear what, exactly, the effect would have been.",huffpost,0,37.82,-10.75
"He has no federal law enforcement experience and, while currently at a high-profile law firm, is most associated as a centrist Democrat.",huffpost,0,37.82,-10.75
"Although I did not serve in Vietnam, I have seen first-hand the affects of military action, and no one wants it to be the first resort, nor do we want to mortgage the countries future....""",huffpost,0,37.82,-10.75
"As part of its policy recommendations, the White House called on Congress to act on an old administration proposal to spend $4 billion to keep 15,000 cops on the streets.",huffpost,0,37.82,-10.75
"The flight is ultimately going to be $1 million, the official said - a media-tracking source said about $400,000 has been placed so far.",huffpost,0,37.82,-10.75
A pillar of their grass-roots movement will become a staple in the bureaucracy that governs Congress.”,huffpost,0,37.82,-10.75
"The cache of emails paint a fuller picture than did an email leaked earlier this week, which portrayed a State Department concerned about its public image.",huffpost,0,37.82,-10.75
A terse response from the GOP only said: “No collusion.”,huffpost,0,37.82,-10.75
Officials with the Democratic National Committee quickly called the Republican abortion position the “Akin plank” and scheduled a news conference to denounce it.,the-new-york-times,0,40.94,-7.94
"The administration was quick to highlight comments from Mark Zandi, chief economist for Moody’sEconomy.com, projecting that the Obama tax deal would increase economic growth next year by 1.25 percentage points and create 1.6 million jobs.",the-new-york-times,0,40.94,-7.94
"Asked, for example, if he would vote for military cuts if they cost jobs in Massachusetts, he called for “a balanced approach,” with some cuts and some revenue growth.",the-new-york-times,0,40.94,-7.94
I didn’t see those requests. They didn’t come to me. I didn’t approve them. I didn’t deny them.”,the-new-york-times,0,40.94,-7.94
“So we’ll just have to see how it comes.”,the-new-york-times,0,40.94,-7.94
"All three men are under consideration, the administration officials said, even if Mr. Lieberman, who was Al Gore’s running mate in the 2000 presidential campaign, is the front-runner.",the-new-york-times,0,40.94,-7.94
"“After more than two years of investigation plagued by malicious leaks, violations of grand jury secrecy and strong-arm tactics, the U.S. attorney’s office has disclosed its intent to file criminal charges against Congressman Grimm,” Mr. McGinley said.",the-new-york-times,0,40.94,-7.94
That position — deferring to the will of the voters on a state-by-state basis — may represent something of a compromise between total support or opposition.,the-new-york-times,0,40.94,-7.94
Family dental bills paid with campaign funds were characterized as a charitable contribution to “Smiles for Life.”,the-new-york-times,0,40.94,-7.94
But the divisions that have slowed progress in the House have not been entirely mended.,the-new-york-times,0,40.94,-7.94
"The plaintiffs’ theory is that a centralized companywide policy gave local managers too much discretion in pay and promotion decisions, leaving Wal-Mart vulnerable to gender stereotypes.",the-new-york-times,0,40.94,-7.94
"Any optimism is a step forward from Friday, when Mr. Boehner told reporters that he did not have a progress report because there was “no progress to report.”",the-new-york-times,0,40.94,-7.94
I haven’t spoken to her in way over a year.”,the-new-york-times,0,40.94,-7.94
"In victory, Mr. Brat said that his candidacy had resonated with voters who believed that politics had been dumbed down by partisan infighting.",the-new-york-times,0,40.94,-7.94
"“Dear Members, Please join me for a private conference call,” Mr. Steele wrote in a message to Republicans, which was provided to the New York Times by a committee member.",the-new-york-times,0,40.94,-7.94
"At another point, Mr. Smythe said, “We assume the repeal of all of the expansions in the Affordable Care Act.”",the-new-york-times,0,40.94,-7.94
"Mr. Putin at Monday’s summit meeting, adding, “We can’t afford to give an inch of ground in defending democracy.”",the-new-york-times,0,40.94,-7.94
Mr. Boutrous said Mr. Sellers was trying to have it both ways.,the-new-york-times,0,40.94,-7.94
"But Mr. Corker is part of a group of Republicans who say the party will ultimately have to yield to the Obama demand of higher tax rates for top earners, potentially back to the levels that prevailed under President Bill Clinton.",the-new-york-times,0,40.94,-7.94
"A 1898 Supreme Court decision held that Wong Kim Ark, who was born in San Francisco to Chinese parents residing in the United States, was a citizen because of his birth on American soil.",the-new-york-times,0,40.94,-7.94
"Mr. Sestak first mentioned publicly in February that he had been offered a job but provided no details, and the White House for three months had refused to discuss it, generating intense criticism from Republicans who accused it of trying to bribe a congressman and deep consternation among Democrats who called on the administration to answer questions.",the-new-york-times,0,40.94,-7.94
"On Tuesday, Mr. Weiner presided over two testy news briefings at which he had dodged a variety of questions.",the-new-york-times,1,40.94,-7.94
"Shortly after a “Fox and Friends” segment reporting that Democrats no longer want to hear testimony from Carter Page, a onetime Trump campaign adviser, Mr. Trump wrote that it was all part of a “witch hunt” against him.",the-new-york-times,0,40.94,-7.94
Mr. Trump drew considerable criticism from the Republican establishment for moderating a presidential debate while openly saying that he might still run if he was displeased with the candidates.,the-new-york-times,0,40.94,-7.94
"Mr. Obama’s transportation secretary, Ray LaHood, a former Republican congressman from Illinois, appeared with him at the Key Bridge and then went to the Capitol to meet with lawmakers.",the-new-york-times,0,40.94,-7.94
"He received a standing ovation when he was introduced as a team member, with Democrats waving their caps at his image on the screen beyond the outfield fence.",the-new-york-times,0,40.94,-7.94
"“Have I not been clear on a wall?” Ms. Pelosi said at a news conference with Senator Chuck Schumer of New York, the Democratic leader.",the-new-york-times,0,40.94,-7.94
“It will just be a matter of which one comes first.”,the-new-york-times,0,40.94,-7.94
"“The charges brought against Mr. Stone have nothing to do with the president,” she told CNN. Asked whether he directed a campaign aide to contact Mr. Stone about the WikiLeaks emails, she repeated that the charges did not involve Mr. Trump.",the-new-york-times,0,40.94,-7.94
The president said he would name a replacement soon.,the-new-york-times,0,40.94,-7.94
"On Saturday, the mayor of Hoboken, Dawn Zimmer, said Mr. Christie’s lieutenant governor and another senior administration official had threatened in May to withhold federal recovery aid for Hurricane Sandy unless she supported a development favored by the Christie administration.",the-new-york-times,1,40.94,-7.94
Let’s get it done!”,the-new-york-times,0,40.94,-7.94
And Mr. Gingrich? “Newt is Newt. He’s a good guy.”,the-new-york-times,0,40.94,-7.94
"WASHINGTON — In one of her final appearances as secretary of state, Hillary Rodham Clinton on Wednesday vigorously defended her handling of last September’s attack on the United States diplomatic compound in Benghazi, Libya, which killed four Americans and prompted a scathing review of State Department procedures.",the-new-york-times,1,40.94,-7.94
"Jameel Jaffer, who litigated national-security cases against the government as the former deputy legal director of the American Civil Liberties Union, urged the committee to scrutinize more closely Judge Gorsuch’s views on executive power and individual rights.",the-new-york-times,0,40.94,-7.94
"“I am running for majority leader because I want to help create a vision of growth and opportunity for everyone and start getting to work for the American people,” he said.",the-new-york-times,0,40.94,-7.94
“I have not done anything wrong.,the-new-york-times,0,40.94,-7.94
“Has no furniture.”,the-new-york-times,0,40.94,-7.94
"The backlash has been an unexpected political headache for Mr. Pence, who is juggling whether to run for re-election or for president in 2016.",the-new-york-times,1,40.94,-7.94
"Mr. Hunter easily won California’s nonpartisan primary with 48 percent of the vote; the next highest vote-getter, Ammar Campa-Najjar, a Democrat, took only 17 percent.",the-new-york-times,0,40.94,-7.94
"“It actually creates zero precedent,” Mick Mulvaney, the acting White House chief of staff, told reporters.",the-new-york-times,0,40.94,-7.94
“Now we have Schiff chasing after Russian collusion.”,the-new-york-times,0,40.94,-7.94
"He added, “It was interesting sitting up onstage with a bunch of billionaires hearing him say how bad the country was.”",the-new-york-times,0,40.94,-7.94
Beck Wows the CPAC Crowd,the-new-york-times,0,40.94,-7.94
"But, he added, “if we can make some compromises here for the good of the country, I think we have a very good chance for the first time in a long time of changing something that is really damaging all of us.”",the-new-york-times,0,40.94,-7.94
"“That’s not on my agenda,” he said on “This Week.”",the-new-york-times,0,40.94,-7.94
"In a city that gave just 4 percent of its vote to Mr. Trump, many residents left town and about 60 House Democrats boycotted the event.",the-new-york-times,0,40.94,-7.94
"“It was the president who was trying to be cute by half by flipping a script demonizing Iraq, while saying the battle really should be Afghanistan,” Mr. Steele said, according to a video of his remarks that was circulated by Democrats on Friday.",the-new-york-times,0,40.94,-7.94
"In a joint appearance at the White House with Mr. Komorowski, Mr. Obama said that “economists across the country have upwardly revised their forecasts for growth” after the tax deal was announced on Monday night.",the-new-york-times,0,40.94,-7.94
He belatedly registered as a foreign agent for that work after being forced out of the Trump administration for misrepresenting his communications with the Russian ambassador to Vice President Mike Pence.,the-new-york-times,0,40.94,-7.94
"His appointment makes Mr. Cowan the second black member to be seated in the current Senate, after Tim Scott of South Carolina was appointed by Gov. Nikki R. Haley.",the-new-york-times,0,40.94,-7.94
He said he regretted that Ms. Cordova was caught in the middle of the controversy.,the-new-york-times,0,40.94,-7.94
"To conceal their personal spending, the Hunters mischaracterized the purchases as “campaign travel,” “dinner with volunteers/contributors,” “toy drives,” “teacher/parent and supporter events,” “gift cards” for charitable donations and “gift basket items,” the statement said.",the-new-york-times,0,40.94,-7.94
"Federal law makes it a crime for anyone “who directly or indirectly, promises any employment, position, compensation, contract, appointment, or any other benefit” to someone else “as consideration, favor, or reward for any political activity or for the support of or opposition to any candidate or any political party in connection with any general or special election to any political office.”",the-new-york-times,0,40.94,-7.94
"What the staff member did not know was that the interior designer was actually an undercover F.B.I. employee who was investigating the Jacksons, the documents say.",the-new-york-times,0,40.94,-7.94
"The mere certification of a class-action suit can prompt defendants to settle in light of the sums at stake, and the justices struggled to find a way to distinguish between gaps in pay that might have benign explanations and those caused by unlawful discrimination.",the-new-york-times,0,40.94,-7.94
"Late Wednesday night, two days after The New York Times first reported that she had exclusively used a personal email account as secretary of state, Mrs. Clinton announced that she had asked the State Department to release those communications.",the-new-york-times,0,40.94,-7.94
“Then you would say every single company is in violation of Title VII” of the Civil Rights Act?,the-new-york-times,0,40.94,-7.94
"“He is not welcome to Mexico,” Mr. Fox told CNN.",the-new-york-times,0,40.94,-7.94
"“And to actively do nothing is a decision, as well.”",the-new-york-times,0,40.94,-7.94
"In another appeal to Iowa farmers, Joni Ernst, a candidate in the Republican Senate primary on June 3, announced in an ad that she grew up “castrating hogs on an Iowa farm.”",the-new-york-times,0,40.94,-7.94
