text,source,label,reliability,bias
"“We need to use whatever compulsory mechanism necessary to get the information he possesses … the Fifth Amendment right not to provide materials or documents is limited,” he added.",huffpost,0,37.82,-10.75
"""I have decided not to be the moderator of the Newsmax debate,"" Trump said in a statement.",huffpost,0,37.82,-10.75
"Previously, she had spoken out against the military's former ""don't ask, don't tell"" policy.",huffpost,0,37.82,-10.75
"At times, Biden repeatedly butted in on Ryan's answers, refusing to let Ryan finish his thought.",huffpost,0,37.82,-10.75
"WASHINGTON ― President Donald Trump’s offer to Democrats over the weekend seeking to trade temporary protections for some immigrants in exchange for funding for a wall on the U.S.-Mexico border received positive coverage from some outlets, including being called a “compromise” and a move by Trump “toward the center.”",huffpost,0,37.82,-10.75
"""Their side is all spending their time talking about laughing and facial tics,"" said Obama campaign manager Jim Messina.",huffpost,0,37.82,-10.75
"""I recommend that every member read the classified version, which goes into greater detail that I cannot speak to here today.",huffpost,0,37.82,-10.75
"Boehner also dismissed top Obama campaign strategist David Axelrod's comment on Sunday that House Republicans are under a ""reign of terror"" brought about by the far right of their party.",huffpost,1,37.82,-10.75
"A U.S. intelligence official told The Huffington Post the review was completed ""early this year.""",huffpost,0,37.82,-10.75
"According to New York Magazine writer Yashar Ali, Griffin claims that the image is an “expression of art” inspired by Trump’s comments about former Fox News correspondent Megyn Kelly having “blood coming out of her eyes” and “out of her — wherever.”",huffpost,0,37.82,-10.75
"The ad features Netanyahu laying out Israel’s security concerns about Iran’s nuclear program, which Republicans have used to knock President Barack Obama’s sometimes frosty relationship with the Israeli prime minister. ",huffpost,1,37.82,-10.75
"However, there's not a lot of time for that to happen before next Thursday's election, and leadership elections generally are dominated by inside baseball politics and arcane political interests.",huffpost,0,37.82,-10.75
"Farenthold used $84,000 in taxpayer funds to settle a sexual harassment lawsuit his former communications director, Lauren Greene, had filed in 2014, Politico reported in December.",huffpost,0,37.82,-10.75
"As a possible victory in the 2018 elections loomed, they made it clear that the reforms would be their No. 1 priority.",huffpost,0,37.82,-10.75
I couldn’t agree more.,huffpost,0,37.82,-10.75
"Mueller’s office, the report said, learned of Trump’s orders to Cohen “through interviews with multiple witnesses from the Trump Organization and internal company emails, text messages, and a cache of other documents.”",huffpost,0,37.82,-10.75
"He added that the report found that ""local school authorities are in the best position"" to determine their own school security measures, ""specifically whether an armed security guard is necessary and supported by the education and citizen community.""",huffpost,0,37.82,-10.75
"Jackson said he was clearheaded and had not been under treatment for alcohol or drug abuse, though he did have a beer last night.",huffpost,0,37.82,-10.75
"A few of his GOP colleagues urged him to resign over the accusations, which Farenthold has repeatedly denied.",huffpost,0,37.82,-10.75
"White House deputy chief of staff Joe Hagin, who also served in the Ronald Reagan, George H.W. Bush and George W. Bush administrations, is expected to leave his post in July, Politico reported.",huffpost,0,37.82,-10.75
"But since taking office, Trump has never asked Mexico for payment.",huffpost,0,37.82,-10.75
But then Certner acknowledged that AARP believes the program needs to be changed.,huffpost,0,37.82,-10.75
NEW YORK -- U.S. Sen. Marco Rubio (R-Fla.) set forth a foreign policy vision Wednesday that invoked President John F. Kennedy in an assertive call to project American power abroad.,huffpost,1,37.82,-10.75
"“For the country, it could be four years.",huffpost,0,37.82,-10.75
"""However, it appears the plaintiffs’ primary grievance stems from non-enforcement of federal laws regarding marijuana, as opposed to choices made by the voters of Colorado.",huffpost,0,37.82,-10.75
"""I'm not going to talk about this anymore,"" Weiner told reporters on Capitol Hill.",huffpost,0,37.82,-10.75
The move essentially left protections for Dreamers in place for at least the next several months ― giving Democrats less incentive to agree to Trump’s offer of protections to DACA recipients.,huffpost,0,37.82,-10.75
"Boehner’s chief of staff, Mike Sommers, and his policy director, Brett Loper, were also in attendance.",huffpost,0,37.82,-10.75
Both the Des Moines Register and the Quad-City Times featured the backlash over Braley’s comments on their front pages.,huffpost,0,37.82,-10.75
"The measure has sparked national backlash, with critics warning that the law provides legal justification for discrimination against LGBT individuals.",huffpost,0,37.82,-10.75
"I love this country, but this country is going to hell. ...",huffpost,0,37.82,-10.75
"Will we see what happened with the large stimulus happen here, which is once the stimulus is over the economy returns to slow growth? That's the danger.",huffpost,0,37.82,-10.75
"In remarks at the White House before a youth leadership summit, Trump congratulated local and national law enforcement agencies for apprehending the suspect.",huffpost,0,37.82,-10.75
"Boehner, meanwhile, told lawmakers earlier Thursday not to make plans for Christmas, signaling that there may not realistically be a final deal until the very end of the month.",huffpost,0,37.82,-10.75
“We need immediate federal action to reverse these policies and protect these amazing animals.”,huffpost,0,37.82,-10.75
"Before the surgery, Scalise was “in good spirits and spoke to his wife by phone,” his office said.",huffpost,0,37.82,-10.75
"""We will not allow law-abiding gun owners to be blamed for the acts of criminals and madmen.""",huffpost,0,37.82,-10.75
"With the year-end deadline for all rates to expire and $1 trillion in spending cuts to kick in, the prospect of actually failing to find agreement is coming into focus.",huffpost,0,37.82,-10.75
FBI officials said they believed the package to be related to the others mailed out this week.,huffpost,0,37.82,-10.75
"Rep. Pete Sessions (R-Texas) was the other conservative alternate to McCarthy, though he is almost as much an establishment character as anyone else in leadership.",huffpost,0,37.82,-10.75
"“For the record, I love my sister, but she is dead wrong on the issue of marriage,"" she wrote.",huffpost,0,37.82,-10.75
"UPDATE - May 30, 10 p.m.: Kathy Griffin issued a formal apology for the controversial images on Twitter.",huffpost,0,37.82,-10.75
"“We’re going in that direction but we’re not to that place,” said Pelosi.",huffpost,0,37.82,-10.75
You've had legislation reaffirming that 'In God We Trust' is our motto.,huffpost,0,37.82,-10.75
"Weeks before the election, asked if the campaign was “in cahoots” with WikiLeaks, Pence denied it.",huffpost,0,37.82,-10.75
"As governor, Huckabee signed a ban on gay marriage (which was overturned by a federal judge last year), and he has been outspoken in his opposition against states legalizing marriage equality.",huffpost,0,37.82,-10.75
"He is the figurehead of the Republican Party whose tenure, once again, seems shaky.",huffpost,0,37.82,-10.75
"WASHINGTON ― President Donald Trump is “very close” to selecting an interim candidate to replace former FBI Director James Comey, he told White House reporters on Thursday.",huffpost,0,37.82,-10.75
"Over at Big Government, a post accompanying the video provides the following commentary on the encounter:",huffpost,0,37.82,-10.75
"""We're talking about specifically prenatal testing, and specifically amniocentesis, which is a procedure that actually creates a risk of having a miscarriage when you have it, and is done for the purposes of identifying maladies of a child in the womb.",huffpost,0,37.82,-10.75
"In a briefing with reporters at the White House on Wednesday afternoon, senior administration officials used the 100 pages of emails to show that a number of government agencies, not just the State Department, drove many of the changes to the talking points that were ultimately used by U.N. Ambassador Susan Rice.",huffpost,0,37.82,-10.75
"Shortly after Kristol called for his resignation, a GOP operative began pitching the column to reporters, hoping that the meme of Steele’s troubles would spread far and wide.",huffpost,0,37.82,-10.75
"Rennie's article was initially re-posted on Linda McMahon's website, but the story has since been removed.",huffpost,0,37.82,-10.75
"""It was a private fact, but now known publicly thanks to the lieutenant governor, that he also brought cool,"" Patrick said to laughs.",huffpost,0,37.82,-10.75
"Bruning, along with Oklahoma Attorney General Scott Pruitt, argue that under the U.S. Constitution's Supremacy Clause, Colorado's legalization of recreational marijuana is unconstitutional because marijuana remains illegal under federal law.",huffpost,0,37.82,-10.75
"At a January fundraiser in Texas, Braley urged the attorneys present to contribute to his campaign and contrasted his background with Grassley's.",huffpost,0,37.82,-10.75
Presumptive GOP presidential nominee Mitt Romney on Tuesday joined a chorus of Republicans calling for Rep. Todd Akin (R-Mo.) to drop out of the U.S. Senate race in Missouri.,huffpost,1,37.82,-10.75
"Pointing to his time as a recovering alcoholic, the Fox News host urged the GOP to embark on a 12-step program of recovery.",huffpost,0,37.82,-10.75
"Christie also took hits at lawmakers in Washington, including President Barack Obama, claiming a lack of productivity from Congress is giving Americans anxiety.",huffpost,0,37.82,-10.75
“We are giving him a Republican path to do that.,huffpost,0,37.82,-10.75
The approach is so sweeping that what would have otherwise been a headline-grabbing announcement received second billing.,huffpost,0,37.82,-10.75
"“I believe in my heart, if we’re going to win as Democrats, we have to have the kind of message that resonates in every corner of this country.”",huffpost,0,37.82,-10.75
"Asked whether the country would find itself dipping towards the economic doldrums if Congress waited a month or two to get a tax cut package passed, Rob Shapiro, a former commerce official in the Clinton White House and a proponent of the current tax cut deal, offered more sober-minded analysis.",huffpost,0,37.82,-10.75
"""You're going to do that when you've lost a debate.",huffpost,0,37.82,-10.75
Pressing this question did not knock Gorsuch off his steady stream of non-answers.,huffpost,0,37.82,-10.75
The site said the photo was tweeted to a female college student in Seattle.,huffpost,0,37.82,-10.75
"According to HuffPost Pollster, Christie is in the middle of the pack of GOP presidential candidates.",huffpost,0,37.82,-10.75
"The president's full-throated defense of the programs, albeit with the qualification that he welcomes debate, is unlikely to quell the outrage over the revelations.",huffpost,0,37.82,-10.75
"A day after Trump’s suspension, the Safari Club sent out a “call to arms,” encouraging hunters to contact Trump and Zinke and “tell them how much you appreciate the efforts of the Fish & Wildlife Service to remove barriers to sustainable use conservation for African wildlife.”",huffpost,0,37.82,-10.75
Boehner is heading back to Ohio for the weekend.,huffpost,0,37.82,-10.75
Their concerns at other times were more mundane.,huffpost,0,37.82,-10.75
Congressman Grimm asserts his innocence of any wrongdoing.,huffpost,0,37.82,-10.75
And the Washington Post reported earlier this week that Trump asked Director of National Intelligence Dan Coats and National Security Agency Director Mike Rogers to push back on the FBI’s Russia investigation.,huffpost,0,37.82,-10.75
"""They’re trying to make this election, as I said earlier, about anything other than the president’s failed economic policies.",huffpost,0,37.82,-10.75
"Since then, much intrigue has surrounded what conversations actually took place.",huffpost,0,37.82,-10.75
"In the face of widespread public backlash, Tump announced late Friday that he has suspended — at least for now — his administration’s decision to reverse an Obama-era ban on the importation of elephant trophies from Zimbabwe and Zambia.",huffpost,0,37.82,-10.75
Boehner has refused to budge from his refusal to consider raising tax rates on top earners while arguing that heavy spending cuts are needed.,huffpost,1,37.82,-10.75
"Earlier Thursday, the Republican-controlled state legislature passed a new version of the bill at the governor's request, amending provisions that would have allowed businesses to discriminate against LGBT customers.",huffpost,0,37.82,-10.75
“He was constantly interrupting and trying to talk over people.,huffpost,0,37.82,-10.75
"“There’s going to be a review of exactly what funds can and should be used in the event there are security concerns by any member,” said House Minority Whip Steny Hoyer (D-Md.).",huffpost,0,37.82,-10.75
The amended legislation mirrors the federal RFRA.,huffpost,0,37.82,-10.75
"Christie has maintained that he had no involvement in, or knowledge of, the plan.",huffpost,0,37.82,-10.75
"""The wait would not cause a double dip,"" he said.",huffpost,0,37.82,-10.75
"The offer for that position was made more than a month before -- on March 26, 2009 -- to Ray Mabus.",huffpost,0,37.82,-10.75
"Once DOMA was overturned in June, the question became: What about same-sex married couples who moved to a state that didn’t recognize their marriage (a couple married in Massachusetts who moved to Arkansas, for example)?",huffpost,0,37.82,-10.75
"The state legislature passed the bill, known as SB 1062, last week.",huffpost,0,37.82,-10.75
"“Former President Vicente Fox, who is railing against my visit to Mexico today, also invited me when he apologized for using the “f bomb.””",huffpost,0,37.82,-10.75
"It’s not clear what the executive order would look like or when it would be proposed ― if Trump follows through at all, considering his tendency for pre-election bluster and warnings he has received from fellow Republicans, including House Speaker Paul Ryan (Wis.), who have said doing so would be outside the bounds the president’s authority.",huffpost,1,37.82,-10.75
"Earlier this year, Fox railed against Trump in an expletive-laden outburst, promising that Mexico would “never pay for that fucking wall.”",huffpost,0,37.82,-10.75
"When one chamber of Congress is in session but not working, we the people still have to pay for members’ salaries and expenses, and for their police protection, and for keeping their lights and phones and coffee machines on.”",huffpost,0,37.82,-10.75
"Other Democrats, such as Sen. Kamala Harris (Calif.), remained unconvinced that McConnell and the House Republicans would follow through on immigration.",huffpost,0,37.82,-10.75
"Jonathan Cowan, president of centrist think tank Third Way, hailed AARP's apparent reversal, per the Journal story.",huffpost,1,37.82,-10.75
Republicans know if they admit their involvement in this game of gotcha it will undermine their credibility.,huffpost,0,37.82,-10.75
HuffPost reported in November 2012 Christie turned down an invitation to appear at an event with Republican presidential candidate Mitt Romney days ahead of the election.,huffpost,0,37.82,-10.75
"Trump won the Republican nomination against a crowded field of 16 other candidates, many far more experienced in politics.",huffpost,0,37.82,-10.75
These are two standout changes on a long list of new rules Republicans will institute in the House when they assume the majority on Jan. 5.,huffpost,0,37.82,-10.75
"When HuffPost asked Hunter how his campaign was going at the end of July, just before House lawmakers left for the August break, Hunter said things were good.",huffpost,0,37.82,-10.75
"Labrador is an ambitious, sometimes savvy politician.",huffpost,0,37.82,-10.75
"Santorum had said that because of this trend, health insurance providers should not be forced to make the procedures available free of charge.",huffpost,0,37.82,-10.75
"More recently, Grimm was in the news in January after he physically threatened a reporter in the Capitol.",huffpost,0,37.82,-10.75
"In a speech to Tea Party conservatives on Saturday in Columbus, Ohio, Santorum had dismissed Obama’s politics as being based in “some phony theology.”",huffpost,0,37.82,-10.75
"If the Republicans are being sincere, they would help us pass this long overdue bill to help the first responders whose health and livelihoods have been devastated because of their bravery on 911, rather than continuing to block this much-needed legislation.""",huffpost,0,37.82,-10.75
Republican lawmakers have argued that the State Department and the White House were attempting to alter the talking points for political reasons and ignored suggestions and language put forward by the CIA.,huffpost,1,37.82,-10.75
"""When the dust settles, he will be vindicated,"" McGinley added.",huffpost,0,37.82,-10.75
The more substantive criticism concerned McCain's proposal to tax worker health care plans as a way of generating money to give people a new tax credit so that they could buy private insurance.,huffpost,0,37.82,-10.75
"The resolution was adopted during the annual convention in Kansas City of the National Association for the Advancement of Colored People, spokesman Chris Fleming said.",huffpost,0,37.82,-10.75
"Senor, who served under the Bush administration as chief spokesman in Iraq and has been a major booster of efforts to escalate U.S. military presence in Afghanistan, noted that Steele’s RNC actually sponsored a conference call for his group to praise Obama’s Afghan surge last year. ",huffpost,0,37.82,-10.75
"""He stole $700 billion from Medicare to fund Obamacare,"" said RNC Chair Reince Priebus.",huffpost,1,37.82,-10.75
Blumenthal's campaign said he planned an event Tuesday with veterans showing their support for him.,huffpost,0,37.82,-10.75
Gattine said after their meeting he believes the governor should resign even though he apologized for the voicemail.,huffpost,0,37.82,-10.75
"The White House did not respond to HuffPost queries about whether Trump understood that what he was saying was false and, if he did, why he was doing so anyway.",huffpost,0,37.82,-10.75
Economists credit the program for drastically reducing poverty among the elderly since its creation in the 1930s.,huffpost,0,37.82,-10.75
The case also could affect the future of other class-action lawsuits that pool modest individual claims into a single action that creates the potential for a large judgment and increases the pressure on businesses to settle.,huffpost,0,37.82,-10.75
"-On a few occasions out of hundreds, Dick misspoke and he'll be the first to admit that those were mistakes.",huffpost,0,37.82,-10.75
It is also critical that all documents related to the Special Counsel’s investigation be preserved and made available to the appropriate Congressional committees.,huffpost,0,37.82,-10.75
What is this the circus? America is not a clown show. America is not a circus.,huffpost,0,37.82,-10.75
I do think the deal that they announced is stimulative.,huffpost,0,37.82,-10.75
"""I want to see the birth certificate,"" said Trump in an interview on NBC's ""Today"" show, according to TIME.",huffpost,0,37.82,-10.75
"Had they been a heterosexual couple, Windsor's tax burden would have been zero.",huffpost,0,37.82,-10.75
While the president's team has pointed to the Republican plan to turn Medicare into a quasi-voucher program -- in which recipients would receive a check to buy either insurance through the private market or traditional Medicare -- the Romney team has responded by noting that Obama took more than $700 billion out of Medicare as part of his health care overhaul.,huffpost,0,37.82,-10.75
"The vote broke down on party lines, with Republicans in hardened opposition.",huffpost,1,37.82,-10.75
He has previously said that he would support an independent commission to investigate ties between Trump’s administration and Russia.,huffpost,0,37.82,-10.75
"The special counsel’s statement Friday homed in on the statements, documents and testimony that was obtained by Mueller, but it did not directly dispute that Trump had directed Cohen to lie to Congress, nor did it make mention of the Trump Tower deal in Moscow.",huffpost,0,37.82,-10.75
"“And that weakness, on the other hand, is the friend of danger and the enemy of peace.""",huffpost,0,37.82,-10.75
"The attack took place shortly after 7 a.m. at Eugene Simpson Stadium Park, less than 8 miles south of the White House.",huffpost,0,37.82,-10.75
"President Donald Trump and first lady Melania Trump on Wednesday night visited Scalise in the hospital, bringing flowers and offering support to the lawmaker’s family.",huffpost,0,37.82,-10.75
"""Although I have tremendous tea party support and just wonderful people in the tea party and grassroots helping me out, and they're clearly responsible for the win...",huffpost,0,37.82,-10.75
“This isn’t funny anymore.” He added that Ginsburg’s comments are “beyond the pale.”,huffpost,0,37.82,-10.75
"He joined a number of other Democrats, including several 2020 presidential candidates, who either had statements prepared or tweeted about a prompt release.",huffpost,0,37.82,-10.75
"-Here are the facts: unlike many of his peers, Dick Blumenthal voluntarily joined the Marine Corps Reserves in 1970 and served for six months in Parris Island, SC and six years in the reserves.",huffpost,0,37.82,-10.75
"""It was a prank,"" Weiner reiterated.",huffpost,0,37.82,-10.75
But let's assume maybe that didn't work or something.,huffpost,0,37.82,-10.75
"NBC further notes, “Strikingly, Trump . . . finishes first among Tea Party supporters (at 20 percent), followed by Romney (17 percent), Huckabee (14 percent), Palin (12 percent) and Gingrich (9 percent).”",huffpost,1,37.82,-10.75
"""I have not heard people in the Republican Party admit yet that they have a problem,"" he said.",huffpost,0,37.82,-10.75
"The package addressed Brennan was sent to CNN’s New York City bureau, sparking an evacuation Wednesday.",huffpost,0,37.82,-10.75
"“This is a fight that will not end until we win it,” Pelosi said.",huffpost,0,37.82,-10.75
"Trump Jr. is expected to publicly testify before the Senate Judiciary Committee, according to the panel’s top Democrat, Sen. Dianne Feinstein of California.",huffpost,0,37.82,-10.75
"He obtained at least five military deferments from 1965 to 1970 and took repeated steps that enabled him to avoid going to war, according to records.""",huffpost,1,37.82,-10.75
Mattis had previously argued that a small U.S. presence should remain because the counterterrorism mission there is ongoing and removing troops now would cause more problems for the region.,huffpost,0,37.82,-10.75
I have nothing to do with the National Enquirer and unlike Lyin' Ted Cruz I do not surround myself with political hacks and henchman (sic) and then pretend total innocence.,huffpost,1,37.82,-10.75
"“It’s great that public outrage has forced Trump to reconsider this despicable decision, but it takes more than a tweet to stop trophy hunters from slaughtering elephants and lions,” Tanya Sanerib, senior attorney with the Center for Biological Diversity, said in a statement.",huffpost,0,37.82,-10.75
"But the recommendation that states allow non-law enforcement officers, such as teachers and principals, to carry guns in schools would essentially eliminate gun-free school zones.",huffpost,0,37.82,-10.75
"A Kaine spokesman later told HuffPost that the senator was traveling during the vote, but had he been there, he would have voted to sustain the veto.",huffpost,0,37.82,-10.75
"""Nebraska officials are acting like bullies, and they have no business trying to dictate Colorado's marijuana laws,"" Tvert said to HuffPost.",huffpost,0,37.82,-10.75
AARP initially pushed back against the newspaper's story.,huffpost,0,37.82,-10.75
"Like Patrick, who grew up on the South Side of Chicago before attending Milton Academy, Harvard and Harvard Law, Cowan came from a poor background to Boston for education and made a career there.",huffpost,0,37.82,-10.75
"The top folks like to be in the inside game,"" one union official said.",huffpost,0,37.82,-10.75
"Of Obama, he said, ""I want him to do well. ...",huffpost,0,37.82,-10.75
The most recent back-and-forth between the Romney and Obama campaigns concerns which candidate would do more harm to people's benefits.,huffpost,0,37.82,-10.75
"Changing that policy would dramatically reshape the U.S. ― effectively punishing the children of undocumented immigrants, whom Trump has vowed to remove from the country.",huffpost,0,37.82,-10.75
"""These are programs that have been authored by large bipartisan majorities repeatedly since 2006.""",huffpost,0,37.82,-10.75
He was one of several members of the House Foreign Affairs Committee who signed a letter calling on Trump to cancel.,huffpost,0,37.82,-10.75
"Holder told the students he understands ""the mistrust"" between some residents and the police.",huffpost,0,37.82,-10.75
This feels like an “America’s Next Top Model” challenge gone so horribly wrong.,huffpost,0,37.82,-10.75
"""If you go door to door knocking, the American people know the country is headed in the wrong direction,"" Brat said.",huffpost,0,37.82,-10.75
“This is the kind of trade we don’t need.”,huffpost,0,37.82,-10.75
