text,source_party,label,source,reliability,bias
"Because lenders use different methods to evaluate borrowers, it’s a good idea to request personal loan rates from multiple lenders so you can compare your options.",Lean Right,0,fox-business,38.81,9.11
"Its chief financial officer, Gustavo Arnal, jumped to his death from a Tribeca skyscraper this month.",Lean Right,0,fox-business,38.81,9.11
"IRISH SENATOR UNDER FIRE FOR ADVOCATING BILL TO RESTRICT FREE SPEECH Ireland’s president is a directly elected head of state who has similar powers to the American president when it comes to signing or vetoing new laws, while the prime minister (also known as the Taoiseach) represents the majority party in parliament and proposes and shapes new legislation.",Lean Right,0,fox-business,38.81,9.11
"In that case, 51-year-old Charles Pitre had been reported missing to police.",Lean Left,0,global-news,44.54,-4.26
"But the plane began rolling on its own, right over the chocks, and its nose collided with the hangar wall while the right engine of the aircraft hit a tow tractor inside the hangar.",Lean Left,0,global-news,44.54,-4.26
"The NIA found that while most older Canadians report they have a network of family and friends they can count on, more than four in 10 are considered to be socially isolated.",Lean Left,0,global-news,44.54,-4.26
He finds it outrageous that regime-connected insiders have been able to use Canada as their safe haven for so long.,Lean Left,1,global-news,44.54,-4.26
The incoming tropical storm is anticipated to make landfall on Tuesday morning and has already triggered torrential downpours and mass floods in the region and caused floods across the state at a mass scale.,Lean Left,0,global-news,44.54,-4.26
"In one video she claims the Patek Philippe Nautilus 5711 on her wrist costs 100,000 pounds, or about CAD$170,000 - more than double the average Canadian’s yearly income.",Lean Left,1,global-news,44.54,-4.26
McLean said survivors often require services like housing and mental health or addictions services.,Lean Left,0,global-news,44.54,-4.26
"Conclusion From a biblically-informed Christian perspective, surrogacy raises significant ethical and moral concerns.",Lean Right,1,the-christian-post,36.41,10.31
"We begin to understand His power and majesty, responding with humility and respect.",Lean Right,1,the-christian-post,36.41,10.31
"For example, after Jesus raised Lazarus, the Jewish leaders decided He had to die because of the signs He had performed to reveal God’s glory to them.",Lean Right,1,the-christian-post,36.41,10.31
"Ed Sheeran is one of the biggest global pop stars in the 21st century, and he reveals in a new documentary that he also has asked those questions.",Lean Right,0,the-christian-post,36.41,10.31
"The more we realize our true poverty, the more we will realize our true importance and glory as His image bearers.",Lean Right,1,the-christian-post,36.41,10.31
"Here everyone has heard the skeptic charge that Christ didn't have to die, because God could have forgiven sins without allowing such suffering.",Lean Right,1,the-christian-post,36.41,10.31
"Because mis-historying (yes, I’ve made it a verb) is a weapon.",Lean Right,1,the-christian-post,36.41,10.31
"Starting out, she made a video about a dog named Albie who she claims told her he didn’t like his nickname.",Lean Right,0,the-christian-post,36.41,10.31
Think about all the places you strictly avoid because they are so dangerous.,Lean Right,1,the-christian-post,36.41,10.31
"He spit into the dirt, made some mud, and rubbed it on the man’s eyes.",Lean Right,0,the-christian-post,36.41,10.31
"Humanity has taken God’s gift of life, His intellectual and creative gifts, its God-given free will, and audaciously used them to replace Him with humanistic thought.",Lean Right,1,the-christian-post,36.41,10.31
"Maybe these Fortune 500 companies thought this wave of consumer activism rocking the country was a fad, that it would just blow over, and we’d all return to business as usual.",Lean Right,1,the-christian-post,36.41,10.31
"It’s not just something the government states explicitly, though it does and has repeatedly.",Left,1,vox,39.59,-10.05
"At the same time, these shifts have become an invitation for invasive species like lionfish.",Left,1,vox,39.59,-10.05
"To find that content, Signal would need access to user conversations, which would mean breaking the service’s end-to-end encryption.",Left,0,vox,39.59,-10.05
"Many Republican lawyers, including Thomas, Justice Neil Gorsuch, and Barrett, view originalism as an important part of their identity.",Left,0,vox,39.59,-10.05
But explaining psychedelic meaningfulness via the activation of serotonin receptors is like saying that turning the keys in the ignition explains what makes a car go.,Left,1,vox,39.59,-10.05
Synchron could theoretically build toward increasing bandwidth by miniaturizing its tech and going into deeper branches of the blood vessels; research shows this is viable.,Left,0,vox,39.59,-10.05
"What makes this crisis especially harrowing, however, is that it’s undoing years or perhaps even decades of work to revive Florida’s reefs through restoration.",Left,1,vox,39.59,-10.05
"There’s something else happening in Renaissance, though, that elevates the experience beyond merely witnessing the biggest superstar on the planet put on the best performance of her life.",Left,1,vox,39.59,-10.05
They aren’t well-suited to an institutional caliber crypto trader like himself.,Left,0,vox,39.59,-10.05
"The Roman Empire, straining under its own weight, faced increased resistance and rebellion from an overtaxed population in the Middle East.",Left,0,vox,39.59,-10.05
"In no world do those prices make any logical sense, but they do allow consumers to normalize low price tags and buy a high volume of low-quality products.",Left,1,vox,39.59,-10.05
"For years on her popular cooking show, The French Chef, Julia Child used a crude, makeshift kitchen that she and her husband would haul to the set for each filming.",Left,0,vox,39.59,-10.05
"In states like North Carolina and Georgia, delegates are elected at congressional district elections and the presidential primary merely serves to decide who they are pledged to cast their votes for on the convention floor.",Left,0,vox,39.59,-10.05
"These protests posed the biggest challenge to Sudan’s longest-serving dictator, Omar al-Bashir.",Left,1,vox,39.59,-10.05
"Last June, a previously obscure Oklahoma state board voted to allow two Roman Catholic dioceses to operate a charter school in that state.",Left,0,vox,39.59,-10.05
"Although Chief Justice John Roberts and Justice Brett Kavanaugh both joined Thomas’s opinion in Bruen, they also joined a separate concurring opinion by Kavanaugh, which enumerated several categorical exceptions to the right to bear arms: [N]othing in our opinion should be taken to cast doubt on longstanding prohibitions on the possession of firearms by felons and the mentally ill, or laws forbidding the carrying of firearms in sensitive places such as schools and government buildings, or laws imposing conditions and qualifications on the commercial sale of arms.",Left,0,vox,39.59,-10.05
"He had local officials in his pocket, openly terrified to disobey him.",Left,1,vox,39.59,-10.05
But Christie also seemed tired in the more typical sense - he didn’t appear particularly fired up about a presidential bid that seems to be going nowhere.,Left,1,vox,39.59,-10.05
She merely alleges she is unable to find information online that is also unavailable to everyone else in the world.,Left,1,vox,39.59,-10.05
"More than 70 percent of the country’s healthcare facilities have been forced to close, contributing to deaths from cholera, malaria, dengue, and childbirth in a nation that already had some of the world’s highest rates of maternal mortality even before the war.",Left,0,vox,39.59,-10.05
"Judge Reed O’Connor, who is known for handing down dubiously reasoned opinions that implement Republican Party policies, ruled that these ghost gun kits are immune from the laws requiring serial numbers and background checks.",Left,1,vox,39.59,-10.05
But the fact that this is the primary line of attack speaks to how deeply October 7 wounded the Israeli psyche - and why the country is so bent on waging war until Hamas is ground into dust.,Left,1,vox,39.59,-10.05
And they risk the sort of economic catastrophe that the United States hasn’t experienced for nearly a century.,Left,1,vox,39.59,-10.05
"Just as Putin has disastrously miscalculated in Ukraine, there is a considerable danger Xi will do so in Taiwan.",Center,1,foreign-affairs,44.56,-6.55
"Nor can one extrapolate from past experience, since the climate is evolving well outside of what humans have lived through.",Center,1,foreign-affairs,44.56,-6.55
"Nothing in a nation’s life is costlier than war, nor does anything else represent a greater threat to its security and prosperity.",Center,1,foreign-affairs,44.56,-6.55
It would be absurd in the case of a coalition government.,Center,0,foreign-affairs,44.56,-6.55
"They must understand that a legacy of trauma makes Israeli Jews and Palestinians vulnerable to reactive violence, leading to a seemingly endless cycle of bloodshed.",Center,1,foreign-affairs,44.56,-6.55
"Taken together, Xi’s and Putin’s convictions portend a dangerous period ahead for the United States.",Center,1,foreign-affairs,44.56,-6.55
"Other countries, of course, can and do spy on the United States.",Center,0,foreign-affairs,44.56,-6.55
"In fact, with each unsuccessful attempt, the Venezuelan opposition has grown weaker.",Center,1,foreign-affairs,44.56,-6.55
British Prime Minister Neville Chamberlain’s infamous appeasement of Adolf Hitler provides another case in point.,Center,1,foreign-affairs,44.56,-6.55
"Scientists working for Microsoft, Google, Amazon, Meta, OpenAI, and a handful of smaller startups are far ahead of any analogous effort in government.",Center,1,foreign-affairs,44.56,-6.55
POOR PAYOFF And yet investing in coal-fired power is not an economical choice.,Center,1,foreign-affairs,44.56,-6.55
"The author does not explain why this supposedly racist and religiously intolerant form of regional nationalism should be viewed as the primary motivating force underlying European integration, a claim for which he provides next to no empirical evidence or scholarly backing-beyond the obvious fact that Europe limits immigration.",Center,1,foreign-affairs,44.56,-6.55
"At that stage, the authors claim, the current war might have been avoided.",Center,0,foreign-affairs,44.56,-6.55
"By that point, Kissinger had become obsessed with what he saw as the challenge of maintaining American credibility as the country withdrew from Vietnam.",Center,1,foreign-affairs,44.56,-6.55
HOW TO RESIST Hamas’s leaders have always been willing to let young Palestinians die to carry out suicide bombings.,Center,1,foreign-affairs,44.56,-6.55
"As the growth of China’s economy exploded, the country’s emissions likewise skyrocketed, surpassing those of the United States in 2005 and tripling in only 14 years.",Center,0,foreign-affairs,44.56,-6.55
Differences remain on issues such as Milei’s climate denialism and his close ties to Trump.,Center,1,foreign-affairs,44.56,-6.55
"These episodes unleashed cataclysmic consequences, but few communities had to face them more than once over several generations.",Center,0,foreign-affairs,44.56,-6.55
He regularly judges his hosts as either witty and intelligent or boring and vulgar but rarely reports their thoughts or words.,Center,1,foreign-affairs,44.56,-6.55
"Bashir abandons the constraints of the conventionally linear printed book for an online, open-access format.",Center,0,foreign-affairs,44.56,-6.55
"Dr. Jenn Jury McIntosh: It's intrinsically vague, which then causes physicians to potentially second guess like is this risky enough?",Right,0,newsbusters,19.99,20.48
"And now, we suffer this obnoxious rant which aired on the desiccated husk of The Daily Show.",Right,1,newsbusters,19.99,20.48
We can’t know if this is deliberate manipulation of the numbers or merely a symptom of Otero’s system of conformity.,Right,0,newsbusters,19.99,20.48
"What turned out to be errors in the way accounting was handled helped focus the minds of many Americans about government overspending and held up to ridicule those who were spending money like it wasn’t their own, which it wasn’t.",Right,1,newsbusters,19.99,20.48
But Americans and Israelis do not celebrate death and do not take joy in killing.,Right,1,newsbusters,19.99,20.48
Colts (15): How to best explain QB Gardner Minshew II's first four-game winning streak in the NFL?,Lean Left,0,usa-today,40.78,-4.12
That was something he had to sign just to get released as the charges were filed.,Lean Left,1,usa-today,40.78,-4.12
Getty Images The strongest argument for Congress to end federal marijuana prohibition finds its roots in the far reaching harms and disparities that stem from its criminalization.,Lean Left,0,usa-today,40.78,-4.12
Churchill was first elected a Conservative Member of Parliament in 1900 but later held high ranks in the Liberal government as well.,Lean Left,0,usa-today,40.78,-4.12
"His rationale for voting in favor on wife rape is disgraceful, disrespectful, disgusting and equally obtuse.",Lean Left,1,usa-today,40.78,-4.12
Conair Tabletop Mount Lighted Makeup Mirror The stereotype of teen girls hogging the family bathroom has most to do with the fact that water closet lighting is perfect for applying makeup.,Lean Left,1,usa-today,40.78,-4.12
Apple MacBook Pro 16 M3 Max Apple's M3 Max is an early look into what Mac gaming could become.,Lean Left,0,usa-today,40.78,-4.12
"If my memory serves me correctly, it would be safe to say that it's one of his favorite ballparks to hit.",Lean Left,0,usa-today,40.78,-4.12
"U.S. Navy sailors stand among wrecked airplanes at Ford Island Naval Air Station as they watch the explosion of the USS Shaw in the background, during the Japanese surprise attack on Pearl Harbor.",Lean Left,0,usa-today,40.78,-4.12
"Emma McIntyre, Getty Images For Balenciaga Tracee Ellis Ross attends the Balenciaga show in Los Angeles on Dec. 2, 2023.",Lean Left,0,usa-today,40.78,-4.12
Hatcher-Frazier also noted that it's not a fair expectation to assume teachers will prepare work ahead of time for your child for unexcused absences.,Lean Left,0,usa-today,40.78,-4.12
"Meanwhile, America's ill-considered finite game in Ukraine has helped the Chinese with their energy and materials vulnerabilities and handed them a major new customer and ally for their products.",Lean Left,1,usa-today,40.78,-4.12
Thanks also goes to the 75 of 99 House members who supported the measure - Republicans and Democrats - that returns humanity to married rape victims regardless of gender.,Lean Left,1,usa-today,40.78,-4.12
The parties said that a resolution had been reached in the case in a release sent by attorney Wigdor; they did not disclose a settlement amount.,Lean Left,0,usa-today,40.78,-4.12
"Shutting Trump up would help GOP win:Trump battles gag order, but Republicans should pray he shuts up if they want to win 2024 Haley might be surging, but there's still the matter of this guy named Trump While the DeSantis campaign’s death rattle is satisfying to those of us who have found him, his often-cruel policies and his bullying demeanor repulsive, there is an orange-hued elephant in the room that minimizes Haley’s admirable progress.",Lean Left,1,usa-today,40.78,-4.12
That move had many people scratching their heads on both sides.,Lean Left,0,usa-today,40.78,-4.12
"Clearly Florida State's chance at championship was STOLEN This is a clear case of selection interference, and we’re looking very strongly at interference from big media, big money and big tech.",Lean Left,1,usa-today,40.78,-4.12
"The Takeya Deluxe Cold Brew Coffee Maker is our favorite cold brew maker because it's easy to use, easier to clean, and makes seriously tasty coffee.",Lean Left,0,usa-today,40.78,-4.12
"Standout plant based meals included the tamarind cauliflower with gingered fried rice and cashews, which was addictively tasty, and the buffalo tempeh quinoa bowl, which had a satisfying balance of heat and freshness.",Lean Left,0,usa-today,40.78,-4.12
"But fruit can be tricky to navigate for picky eaters, who may be uncomfortable with soft, squishy textures and seeds.",Lean Left,0,usa-today,40.78,-4.12
"Those filed in court last month were subject to New York under the Adult Survivors Act, which expired on Nov. 23.",Lean Left,0,usa-today,40.78,-4.12
"Grisham has been a phenomenal defensive player for years, earning two Gold Gloves in center with the Padres.",Lean Left,0,usa-today,40.78,-4.12
Cuz you’ve gotta really have a passion for something in order to actually put in the time to write a book about it.,Lean Right,1,christianity-today,41.75,5.39
We have the promise and the hope of redemption in a careerist society where there is no distinction between who you are and what you're able to accomplish at the office.,Lean Right,1,christianity-today,41.75,5.39
"Elizabeth Oldfield is host of The Sacred podcast and a former director of Theos, a UK-based think tank.",Lean Right,0,christianity-today,41.75,5.39
"On a Sunday morning, you can get great teaching, great worship and the fellowship part of it as well.",Lean Right,0,christianity-today,41.75,5.39
"So the excellent standup comic is unbelievably empathetic, and they deliver it all while coming off as unbelievably socially inept.",Lean Right,1,christianity-today,41.75,5.39
"Sources said that when families fled their apartments six weeks ago, they came to the church in summer clothing.",Lean Right,0,christianity-today,41.75,5.39
Where has that come from and what is that doing to us?,Lean Right,0,christianity-today,41.75,5.39
"On boarding the ship, people discovered a load of wool and a dead crew.",Lean Right,0,christianity-today,41.75,5.39
"And also in the blockchain space, for example, if you wanna speed up the generation of proofs, if that could be done in a distributed way, then that would be great.",Center,0,wired,36.77,-7.24
"Daisy Jones & the Six Spanning a decade, Daisy Jones & the Six follows the formation, stratospheric success, and crushing breakup of the greatest band the 1970s never saw.",Center,0,wired,36.77,-7.24
"He ollied onto a fire hydrant and grabbed a pole and spun around and this is like way, way back.",Center,1,wired,36.77,-7.24
How does an archeologist look at an ancient column and conclude this was a Roman brothel?,Center,1,wired,36.77,-7.24
What happened after Patil shut his laptop and moved on from Kesapuri is also a chilling lesson in the power of video to shape opinion and the ability of the extreme right to use propaganda and disinformation to stoke division and violence.,Center,1,wired,36.77,-7.24
To realize the extent to which these digital platforms have fascinated your daughter is to feel that you have failed to inoculate her.,Center,1,wired,36.77,-7.24
"One of them, by accident, he dropped his goggles, and one of them on purpose.",Center,0,wired,36.77,-7.24
Each one was a different size to get this clock to be built.,Center,0,wired,36.77,-7.24
One example of somebody motivated by sexual fantasy would be Ted Bundy.,Center,1,wired,36.77,-7.24
"If Mrs. Maisel is anything to go by, the answer is to head to a dingy watering hole in your nightgown, do a little standup comedy, and get hauled away by the police after flashing the entire audience.",Center,1,wired,36.77,-7.24
"Spider-Man 2, a big element of the story is the Symbiote, they talked about it forever.",Center,1,wired,36.77,-7.24
"This lethally sharp satire from writer and debut director Juel Taylor masterfully blends genres, from the use of visual motifs and dated clichés from 1970s Blaxploitation cinema to its frequent steps into sci-fi territory and laugh-out-loud comedy.",Center,0,wired,36.77,-7.24
"A carom shot is used when, you are coming off a ball that doesn't have access to a pocket and you want to come off that ball and use it almost kind of like a cushion to bounce a cue ball off of it, in order to pocket another ball.",Center,0,wired,36.77,-7.24
"A micronation in the extreme, Sealand has all the trappings of a country: a constitution, a permanent population (of one), a government, a defined space-even a rousing national anthem.",Lean Left,1,cbs-news,41.76,-2.84
So Alex had to go out and steal new money from different clients and put that money back.,Lean Left,1,cbs-news,41.76,-2.84
Robert Richman: There was nothing about murdering the woman who everyone agreed he loved that would help his situation.,Lean Left,1,cbs-news,41.76,-2.84
"Kruse was one of the best billiard players in the building, until Kriks moved in and started beating the socks off him.",Lean Left,1,cbs-news,41.76,-2.84
"With such compelling perks, it wouldn't be surprising if you want to put as much money as possible into a high-yield savings account.",Lean Left,1,cbs-news,41.76,-2.84
"In addition to its massive screen, its crisp 4K offering makes for eye-popping visuals with HDR and its PurColor crystal display.",Lean Left,1,cbs-news,41.76,-2.84
"It washes over vast terrain: an entire sector, a national economy, or the world at large.",Center,0,quartz,43.87,-4.77
"A representative from Tallahassee Memorial was also at the event, ready to meet any nurses who were interested in relocating.",Center,0,quartz,43.87,-4.77
The Justice Department has not indicated whether it will challenge that deal.,Center,0,quartz,43.87,-4.77
"And if they didn’t behave, they believed, he could take it away.",Center,1,quartz,43.87,-4.77
"Beyond the possibility of criminal charges for Christian Ziegler, he and his wife, a co-founder of Moms for Liberty, are being called out for hypocrisy after admitting to a sexual relationship together with the accuser even though they very publicly have fought against LGBTQ+ rights.",Center,1,quartz,43.87,-4.77
"The NHS’s process for hiring nurses from abroad is relatively watertight, and offers a glimpse of what principled recruitment looks like.",Center,1,quartz,43.87,-4.77
"It’s a tale of bureaucratic obstruction, technical obstacles, and oil companies fighting to protect their profit margins.",Center,1,quartz,43.87,-4.77
A trial run of over-the-counter sales of the morning-after pill started in Japan yesterday (Nov. 28).,Center,0,quartz,43.87,-4.77
"Since 2000, the entire San Francisco metropolitan area has only permitted roughly 950 new units a month, on average.",Lean Right,0,washington-examiner,34.07,11.3
It isn’t a good solution by any stretch to the problem of providing care for the masses.,Lean Right,1,washington-examiner,34.07,11.3
"Kash was told by doctors that her unborn baby had severe skeletal dysplasia, a genetic disorder that affects the development of bones, joints, and cartilage.",Lean Right,0,washington-examiner,34.07,11.3
The Biden administration has done little to help alleviate the problem.,Lean Right,1,washington-examiner,34.07,11.3
"By continuing to kick the can down the road on these reforms, lawmakers are only leaving us handcuffed in our efforts to shore up domestic energy capacity and improve our ability to ride out future storms from global conflicts.",Lean Right,1,washington-examiner,34.07,11.3
"Heat pumps use less electricity than older electric furnaces, and their high energy efficiency makes them less greenhouse-gas-intensive.",Lean Right,0,washington-examiner,34.07,11.3
"Summing it all up, they concluded that 20 million houses would be needed to bring housing prices in line with construction costs.",Lean Right,0,washington-examiner,34.07,11.3
Washington Examiner : Opinion: Hamas is just one part of the threat to Israel and the West Washington Post : Israel has vowed to destroy Hamas.,Lean Right,0,washington-examiner,34.07,11.3
"We left it to the guild to schedule a meeting and they did not respond,"" the spokesperson said.",Right,0,fox-news,35.44,11.06
And they're doing it with our jobs and people cannot afford electricity.,Right,1,fox-news,35.44,11.06
The Air Force did not immediately respond to questions and a request for comment from The Associated Press.,Right,0,fox-news,35.44,11.06
Being grateful can also influence our physical health in surprising ways.,Right,0,fox-news,35.44,11.06
"VIRAL MYTH ABOUT GUESTS WEARING RED TO WEDDINGS CARRIES SCANDALOUS MEANING, BUT IS IT TRUE?",Right,0,fox-news,35.44,11.06
"If we remove Jewish voices, we will only intensify the one-sided narrative on Israel and Jewish issues.",Right,1,fox-news,35.44,11.06
"Ben takes a look at the life of Kissinger, from his rise to political office in the Nixon Administration to his ideological differences with President Reagan, and explains how his background as a European immigrant shaped his views on foreign affairs.",Right,0,fox-news,35.44,11.06
"Benchmark Brent Crude traded Wednesday at around $77 a barrel, down from nearly $100 in September, over concerns about a weakening economy worldwide.",Right,0,fox-news,35.44,11.06
"MORE: THIS ROBOT PUMPS GAS FOR YOU How HEAP builds walls using its sensors and algorithms For its latest project, HEAP scanned a construction site, created a 3D map of it, and then recorded the locations of the multi-ton boulders.",Right,0,fox-news,35.44,11.06
"In addition to the body image struggles, Friar’s condition also came with extreme pain .",Right,0,fox-news,35.44,11.06
At least Fannie saved Kamala the trouble of having to bail the two arsonists out.,Right,1,fox-news,35.44,11.06
"If nobody's holding anyone to account for all this, what is our criminal justice system actually doing?",Right,1,fox-news,35.44,11.06
"Tanner Kaltenberg, Merax Dockery and Ivan Garcia, the latter of whom owned the 2000 Lexus sedan where the trio died, were found on July 23 in the parking lot of a Hampstead, North Carolina, convenience store.",Right,0,fox-news,35.44,11.06
