text,source_party,label,source,reliability,bias
"In 2022, for instance, Disney brought in close to $83 billion - which is double the GDP of whole European and South American countries.",Right,0,the-federalist,21.77,18.67
"The dissembling on matters of historical fact and interpretation is bad, but so is the film’s broader message.",Right,1,the-federalist,21.77,18.67
Were they only persons because their mother (and doctor) wanted them to be so?,Right,1,the-federalist,21.77,18.67
Quinnipiac further found that Kennedy is likely to draw more voters away from Trump than from Biden.,Right,0,the-federalist,21.77,18.67
"Suppose, for example, that the State of Illinois required all residents to sign a document expressing support for a particular set of positions on controversial public issues-say, the platform of one of the major political parties.",Right,0,the-federalist,21.77,18.67
"In Janus v. American Federation of State, County and Municipal Employees, the justices overturned an Illinois law that compelled public employees to subsidize unions regardless of their personal objections to the unions’ activism.",Right,0,the-federalist,21.77,18.67
"So when different groups realize that even though they have different interests at different aims, et cetera, they actually share something in common, that's where change can happen.",Left,0,vogue,39.13,-10.91
"Being the creative souls that jewellers Bianca Zaveri and Devkrsna Sagar are, it was only fitting that they had a wedding that reflected the same.",Left,1,vogue,39.13,-10.91
Every city has an icon like Marlowe Hampton is obviously a great dresser.,Left,1,vogue,39.13,-10.91
"This is the repair of the helm of the craft, which is the wheel that is often used on ships to navigate.",Left,0,vogue,39.13,-10.91
"Whether an individual product your giftee adores or a carefully-curated set of minis she can travel with, these stellar picks will put a smile on anyone’s face even before the main gifts are unwrapped.",Left,0,vogue,39.13,-10.91
"Sharp shoulders, blinding metallics, dazzling sequins, and loud colors-it’s time to revive the best of 80s fashion at the 2022 Ball of Arabia.",Left,1,vogue,39.13,-10.91
"We’re normally anti-gift cards, but for Daisy, we’ll make an exception: Give that girl a dollar amount of your choosing and watch her go buck wild.",Left,1,vogue,39.13,-10.91
You're just having one of those days that you just wanna stuff your face.,Left,0,vogue,39.13,-10.91
"In revisiting some of these older essays, were there any that you wished you would have written differently, or could have edited for this anthology?",Left,0,vogue,39.13,-10.91
Obfuscation of the female form is one form of body anxiety that was expressed in different ways.,Left,0,vogue,39.13,-10.91
"The energizing benefits of coffee are well documented, but less so is its impact on everything from improving your gut health to reducing inflammation and protecting against liver disease.",Left,0,vogue,39.13,-10.91
"There is a nostalgia about that time, as well, right before the internet and smartphones took over our lives, when everything seemed simpler and the pressures of maintaining a public image were less acute.",Left,1,vogue,39.13,-10.91
"For the phera ceremony, the bride wore a dazzling ivory-hued lehenga embellished with zardozi, gota and nakshi work from Matsya by Utkarsh Ahuja, while the groom donned a pearl-white raw silk sherwani by Diwan Saheb featuring tonal embroidery.",Left,0,vogue,39.13,-10.91
"We worked with the 3D assets for each of the jewelry, and then we created, recreated the background.",Left,0,vogue,39.13,-10.91
"And then, but it's romantic because you see the fog and you just sit down and you see it from the window and you, is mellow.",Left,1,vogue,39.13,-10.91
"Schumer captivated the audience with heartfelt tales of his childhood, recounting how his father introduced him to the magical halls of AMNH as a young kid growing up in Brooklyn.",Left,0,vogue,39.13,-10.91
"Allison Bornstein’s goal in life is to help others look, and thus feel, their best.",Left,0,vogue,39.13,-10.91
"His first nickname, while he was in my stomach, was Bubba.",Left,0,vogue,39.13,-10.91
Tolkien Lord of the Flies by William Golding by William Golding To Kill a Mockingbird by Harper Lee by Harper Lee Of Mice and Men by John Steinbeck by John Steinbeck Catcher in the Rye by J.D.,Right,0,national-catholic-register,22.39,11.81
"Bishop Joe Vasquez of the Diocese of Austin celebrated Mass on Friday at the prison housing Texas’ seven female death-row inmates, five of whom have converted to Catholicism during their time awaiting execution.",Right,0,national-catholic-register,22.39,11.81
Clark guided Reagan in trying to make the law more amenable to protecting unborn life.,Right,0,national-catholic-register,22.39,11.81
"According to a paper published by the Environmental Review, deforestation in Brazil has been a concern since the start of the 1900s.",Right,0,independent-journal-review,25.81,12.82
A year is an eternity in politics - minds can change depending on circumstances.,Right,0,independent-journal-review,25.81,12.82
The novella is about the healing power of Christmas and follows a man who tells his story to a nurse after being admitted to the hospital.,Right,0,independent-journal-review,25.81,12.82
"Practical remedies for that lunacy include daily saunas, spending time with his dogs and getting outside every day.",Right,0,independent-journal-review,25.81,12.82
He and his wife formed the Instituto Terra organization to help restore areas devastated by deforestation and focus on sustainable farming practices.,Right,0,independent-journal-review,25.81,12.82
It helps defend a democracy in the reason and is forcing Russia to expend massive amounts of resources and degrade its military abilities without having to put U.S. boots on the ground.,Right,0,independent-journal-review,25.81,12.82
"Cox’s new housing innovation adviser Cox said he recognizes his vision for housing in the state will require a coordinated push from city and county governments as well as buy-in from the homebuilding industry, and Utah’s Legislature.",Center,0,deseret-news,42.29,2.55
"Naia Tanuvasa paced the Knights with an incredible 24 points, including four 3-pointers.",Center,0,deseret-news,42.29,2.55
"It’s been a productive month for Haley, who is seeing a big surge in support from establishment Republicans desperate for a post-Trump GOP.",Center,1,deseret-news,42.29,2.55
"Addy Scrivner was the top scorer for the Pioneers, racking up 20 points, four of which were 3-pointers.",Center,0,deseret-news,42.29,2.55
He loves to constantly find ways to be faster and faster.,Center,0,deseret-news,42.29,2.55
"Six straight points scored by Barker midway through the final quarter gave Copper Hills its biggest lead of the night at 23, sealing the victory for the visitors, keeping them undefeated on the season.",Center,0,deseret-news,42.29,2.55
"Kealah Faumuina led the Flyers in scoring with 21 points, followed by Brinlee Bennett’s 6.",Center,0,deseret-news,42.29,2.55
"If you want to live your life seeing half of this country as your enemy, that sounds like a pretty hopeless life.",Center,1,deseret-news,42.29,2.55
"7:30 Aaron Sherinian: Well, let’s go back to the pause in Times Square, if we can.",Center,0,deseret-news,42.29,2.55
"For the Wildcats, the highest scorer was Mari Nichols with nine points.",Center,0,deseret-news,42.29,2.55
"This survey also finds a related pattern that has been consistent over the course of the survey: A solid share believe their personal marriage is doing fine, but that marriage overall is weaker.",Center,0,deseret-news,42.29,2.55
And the parents were egging her on and encouraging her to do what she was doing.,Center,1,deseret-news,42.29,2.55
Analysts say BYU should stick with the bomb-launching as a national leader in makes per game (12.6) and attempts (33.0).,Center,1,deseret-news,42.29,2.55
"Don’t panic There is no shortage of YouTube video clips showing Black Friday shoppers running through a store in a mad panic, fearing they might miss out on a particular deal.",Center,1,deseret-news,42.29,2.55
"The Grand Red Devils delivered a resounding win over the Monticello Buckaroos, scoring 88-38.",Center,0,deseret-news,42.29,2.55
"The money, appropriated in last year’s climate bill, will be sent out in grants to fund climate resiliency and adaptation, mitigating climate and health risks from urban heat islands and wildfires, and community-led air and other types of monitoring.",Lean Left,0,the-verge,39.43,-4.75
"OnePlus is making a lot of noise about its design, which is meant to catch the light like a CD, and there’s a gap between the lenses and cover glass that’s supposed to remind you of the face on a luxury watch.",Lean Left,0,the-verge,39.43,-4.75
The Nest Learning Thermostat may have grabbed all the headlines when it launched in 2011 and kick-started the current home automation trend.,Lean Left,0,the-verge,39.43,-4.75
"Not every search query takes EEAT into account; Google has described heightened concern over sites that could impact safety, happiness, and the ability to be an informed citizen.",Lean Left,0,the-verge,39.43,-4.75
"But all said and done, I’m glad Meta didn’t bother attempting a smart display.",Lean Left,1,the-verge,39.43,-4.75
The thing about smart glasses is that you’ll never wear a pair if they make you look like a low-rent Warby Parker model.,Lean Left,1,the-verge,39.43,-4.75
"The damage, however, did not stop with the customers who had their accounts accessed.",Lean Left,0,the-verge,39.43,-4.75
And why are you paying for something that we don’t need?,Lean Left,1,the-verge,39.43,-4.75
Life During Wartime - Fixed an issue where Panam would not get on the motorcycle when required to follow her to the gas station.,Lean Left,0,the-verge,39.43,-4.75
And the DOJ has shown evidence that even Google finds the power of its Apple alliance uncomfortable.,Lean Left,0,the-verge,39.43,-4.75
"But a startup called Biomemory is bringing it a little closer to reality with the release of new DNA cards that anyone can purchase - if you have $1,000 to blow.",Lean Left,1,the-verge,39.43,-4.75
"In the 1980s, the government settled on Yucca Mountain in Nevada as the most likely spot and planned to start taking shipments of spent nuclear fuel in 1998.",Lean Left,0,the-verge,39.43,-4.75
There are a lot of things that are pretty fucked up in crypto.,Lean Left,1,the-verge,39.43,-4.75
"For those folks, the price is less of an issue because this is probably a business expense that can be written off.",Lean Left,1,the-verge,39.43,-4.75
It also doesn’t have a back-up battery (common in wired doorbells).,Lean Left,0,the-verge,39.43,-4.75
"For the past 25 years, the internet as we know it has been almost entirely defined and controlled by Google.",Lean Left,1,the-verge,39.43,-4.75
"The chassis for the 16-inch remains the same as the 2021 and early 2023 models: same keyboard, same gorgeous display (though in SDR mode, it can now go up to 600 nits, 20 percent brighter than before), same camera, same trackpad, and the same ports.",Lean Left,1,the-verge,39.43,-4.75
All I’m asking you to do is to swap out your tractor for ours.,Lean Left,0,the-verge,39.43,-4.75
"Sleep Coach is a new feature that contextualizes your sleep data by factoring in your nightly heart rate variability (new to the Venu 3 series), age, activity history, and any naps you might have taken.",Lean Left,0,the-verge,39.43,-4.75
This is for the Garmin users who want an itty bitty bit more smart functionality from their device - and don’t mind paying a premium for it.,Lean Left,1,the-verge,39.43,-4.75
"Apple released details about iOS 16 today at its Worldwide Developers Conference, including which phones will be eligible for the update - and which didn’t make the cut.",Lean Left,0,the-verge,39.43,-4.75
"A decade after Skyhook, Google still uses a tangled web of contracts and deals to make partners fall in line - incentivizing phone makers and the biggest app developers to share, rather than compete for, an ever-growing pile of app store cash.",Lean Left,1,the-verge,39.43,-4.75
Coates insisted in her Instagram post that the picture wasn’t altered; it just came out that way.,Lean Left,0,the-verge,39.43,-4.75
"Sales of heat pumps are booming all over the world; some 4 million were installed in the US in 2021, up from 1.7 million in 2012.",Lean Left,0,the-verge,39.43,-4.75
Project Hug targeted a who’s who of mobile game developers - and 20 of them signed.,Lean Left,0,the-verge,39.43,-4.75
"Delicate rose appliqués, crafted petal by petal, adorn each dress, evening cape, sweater and sandal.",Lean Right,0,new-york-post,31.92,9.28
"In the fever pitch of holiday pressure this retrograde commands us to take pause, take stock and revisit themes and threads that need addressing so we can sail into the new year free and clean.",Lean Right,1,new-york-post,31.92,9.28
2-overall pick in last April’s draft who’s having an MVP season.,Lean Right,0,new-york-post,31.92,9.28
Swift took the opportunity to gush over her romance with Kelce and gave a rundown of their relationship timeline to clarify they got to know each other privately before she attended his first game in September.,Lean Right,0,new-york-post,31.92,9.28
The musician has had a stellar year (and career) - taking her mega-successful Eras Tour internationally and generating $100M in Spotify streaming revenue for 2023.,Lean Right,0,new-york-post,31.92,9.28
"Etsy Although countdown calendar comes filled with toys and treats for your cat, it’s fun for people as you get to watch your feline friend enjoy a new toy for eight nights in a row.",Lean Right,0,new-york-post,31.92,9.28
"Oak Essentials If your wife is a self-care lover, the Oak Essentials Moisture Rich Balm will instantly transport her to a five-star resort.",Lean Right,1,new-york-post,31.92,9.28
Is it any wonder that it sold out in every color?,Lean Right,1,new-york-post,31.92,9.28
"The state allowed the gender on the birth certificate to change from male to female, according to the family’s lawsuit.",Left,0,new-york-daily-news,40.47,-8.12
Israel’s PM Netanyahu vows vengeance against Hamas that will ‘reverberate with them for generations’,Left,0,new-york-daily-news,40.47,-8.12
"After nearly five decades in the acting world, Michael Douglas was honored with a star on the Hollywood Walk of Fame on Nov. 6, 2018.",Left,0,new-york-daily-news,40.47,-8.12
"Majors backtracked and Jabbari again followed him, asking him questions about the other woman.",Left,0,new-york-daily-news,40.47,-8.12
Both are also capable of playing second if the Yankees trade Torres.,Left,0,new-york-daily-news,40.47,-8.12
"It’s full-bodied with lifelike needle tips, so it won’t end up looking sad and limp.",Left,0,new-york-daily-news,40.47,-8.12
Republican leaders say they have the near-unanimous support of the slender GOP majority to pass the impeachment inquiry even though ex-Speaker Kevin McCarthy avoided taking a vote in the fall because he feared it would fail.,Left,1,new-york-daily-news,40.47,-8.12
"Michael Nicholoulias, 74, was arrested Monday night as he drew a swastika on a bench in the posh seaside village, according to News 12 Long Island.",Left,0,new-york-daily-news,40.47,-8.12
The incident occurred around noon on Monday outside the The Lauren Wendroff Early Children’s Academy in Bayonne.,Left,0,new-york-daily-news,40.47,-8.12
"Hamas, as the world has long known, has used hospitals, mosques, schools, and ambulances in clear contravention of international law to store military weaponry and hide and transport fighters.",Right,1,american-thinker,13.67,24.85
"Missing from the visa waiver program are the 150 remaining countries where most residents want to simply visit friends and family for the holidays, or otherwise travel to and spend money in New York, Las Vegas, or Miami.",Right,0,american-thinker,13.67,24.85
"The brilliant, new ‘initiative’ du jour becomes unworkable-either upon execution or, worse, is frankly untenable for America--eventually.",Right,1,american-thinker,13.67,24.85
"There are some products that depart from these rules, but these are the basics.",Right,0,american-thinker,13.67,24.85
"Ironically, one could take a bus or train from Mexico City to the Texas border and be in the U.S. within a few days.",Right,0,american-thinker,13.67,24.85
"When a group blames others, they will not succeed because they are always relying on those others to change.",Right,1,american-thinker,13.67,24.85
"A good example is last Wednesday’s heavily-promoted launch of a new CNN prime time program, King Charles, hosted by popular figures Gayle King and Charles Barkley.",Right,1,american-thinker,13.67,24.85
"Cut their funding and boot them out of Gaza, Judea, and Samaria.",Right,1,american-thinker,13.67,24.85
"If this is the case, then what is the intent and purpose of this grandfathered exemption?",Right,0,american-thinker,13.67,24.85
"In the United States, Jews feel no better or worse than other religious or ethnic groups.",Right,0,american-thinker,13.67,24.85
"With so many global institutions dominating private life, is it any wonder why so many people now behave as if they should be committed to institutions?",Right,1,american-thinker,13.67,24.85
"With his trademark directness in describing the facts and his wry humor, Sowell is always a pleasure to read; despite the slim size of this volume, it contains a thorough debunking of the fallacies noted in the title.",Right,0,washington-free-beacon,23.47,14.45
Though its plot is not dissimilar to that of Juwanna Mann-which came out in 2002 and starred Vivica A.,Right,1,washington-free-beacon,23.47,14.45
"Methamphetamine and cocaine played a role in just over 51 percent and 46 percent of the deaths, respectively.",Right,0,washington-free-beacon,23.47,14.45
"Hours before the debate, CNN released a poll that showed the president's approval rating at an all-time low.",Right,1,washington-free-beacon,23.47,14.45
"Lady Ballers stars Daily Wire cofounder Jeremy Boreing (who also produced and directed the film) as Rob, a boys basketball coach and divorced dad besieged by wokeness.",Right,1,washington-free-beacon,23.47,14.45
"Sowell notes not only Rousseau but also the social control proposals of Progressive Era reformer John Dewey and, more recently, John Rawls.",Right,0,washington-free-beacon,23.47,14.45
"Needless to say, the black moped driver did not commit a crime.",Right,1,washington-free-beacon,23.47,14.45
The richest man in the world is starting to sound more like Norman Podhoretz than Norman Finkelstein.,Right,1,washington-free-beacon,23.47,14.45
"While imitation should never be your style goal, you’d do well to take these five outfits into account as inspiration if you’re thinking of where to next take your look.",Left,0,esquire,27.41,-18.14
"And then you’ve got to remember, we’re in solitary confinement, so I’d get hungry and I’d eat the dice.",Left,0,esquire,27.41,-18.14
Stories about how the previous administration* used its power and influence for pecuniary gain come to sound like nursery rhymes.,Left,1,esquire,27.41,-18.14
"Unfortunately, FX has not announced any release dates for Season Three just yet.",Left,0,esquire,27.41,-18.14
"Serious but rare side effects include delayed onset infections, recurrence of herpetic eruptions, and superficial necrosis at the injection site.",Left,0,esquire,27.41,-18.14
"Quirky and shaggy and unlike anything Taos has ever seen, Corner Office is the après-ski lodge of your dreams: a warren for quaffing natural wines and feasting on funky comfort food.",Left,1,esquire,27.41,-18.14
"His clutch shots are as likely to be free throws earned through obstinate forward motion into the paint, 2006-Dwyane Wade-style, as a deep three.",Left,0,esquire,27.41,-18.14
He wears the fabled number 10 jersey-traditionally reserved for a team’s supreme creative force-at Chelsea in England’s Premier League.,Left,0,esquire,27.41,-18.14
"In early July, you might get a plate of tempura-fried anchovies, followed by a bowl of hyper-fresh stone fruits.",Left,0,esquire,27.41,-18.14
"The Chiefs liked Mahomes, he said; he just had some questions.",Left,0,esquire,27.41,-18.14
"CNN - The Supreme Court spent nearly two hours Monday morning grappling with whether federal bankruptcy code permits a controversial agreement that would give billions of dollars to victims of the opioid epidemic while protecting members of the Sackler family, who owned the company Purdue Pharma, from current and future opioid-related civil lawsuits.",Lean Left,0,cnn,42.06,-6.28
She began searching for answers about her father’s shadowy past His confession turned the Randele family upside down.,Lean Left,0,cnn,42.06,-6.28
"Video Ad Feedback Using tribal traditions as a guide, she's providing a lifeline for her Native American community 10:20 - Source: CNN When Tescha Hawley received her breast cancer diagnosis at age 46, the lifesaving treatment she needed several times a month was at a hospital a three-hour drive away.",Lean Left,0,cnn,42.06,-6.28
These ones are filled with their own kind of magic: marshmallow and chocolatey goodness!,Lean Left,1,cnn,42.06,-6.28
The ex-president’s assault on the fabric of American democracy is also evident in how he tries to paint efforts to hold him to account for his attempts to destroy the integrity of the 2020 election as a bid by the Biden administration to cheat in the 2024 election.,Lean Left,1,cnn,42.06,-6.28
"And that, no matter how you slice it, is good news for Democrats as the parties plot their strategies ahead of the 2024 elections.",Lean Left,1,cnn,42.06,-6.28
"The Soviet Union’s forward momentum had been thwarted by a diplomatic coup, the opening of relations between Washington and Beijing.",Lean Left,1,cnn,42.06,-6.28
"A shift could allow home buyers and sellers to negotiate not only commission rates with brokers, but also who is responsible for paying them - the buyer or the seller.",Lean Left,0,cnn,42.06,-6.28
The Ukraine aid package is now caught in the most intractable US political issue - immigration.,Lean Left,1,cnn,42.06,-6.28
Guz explained that there has been rising pressure from labels and artists to change the way Spotify makes distinctions between functional noise and music.,Lean Left,0,cnn,42.06,-6.28
"In October, attorneys representing the Two-Spirit nonprofit Montana Two Spirit Society along with a group of transgender, intersex and nonbinary Montana residents, filed a lawsuit in Missoula County District Court challenging the law.",Lean Left,0,cnn,42.06,-6.28
"Instead, they’re more like chord changes; variations in the key of Tay - eyebrow-raising, but never too extreme or off-putting.",Lean Left,1,cnn,42.06,-6.28
"If the twice-impeached former president wins the Republican nomination and the presidency, it is already clear that a second term would risk destroying the principle that presidents do not hold monarchial power.",Lean Left,1,cnn,42.06,-6.28
A cookline employee had barehanded contact with a customer who ordered crab legs for service.,Center,0,az-central,42.22,-7.0
"Buffeted by reports of ethically questionable conduct, principally by O’Connor’s friend and colleague, Justice Clarence Thomas, the court recently put forth its first ethics policy.",Center,1,az-central,42.22,-7.0
The first was getting canceled within an inch of my life and sanity.,Center,1,az-central,42.22,-7.0
Mexico is already slotted into Group B and will play a group stage game on June 30 against an opponent to be determined by the draw.,Center,0,az-central,42.22,-7.0
This was Kelly's second trip to the apprentice center because of his vested interest in this field.,Center,0,az-central,42.22,-7.0
Fans may also carry a clutch purse no larger than 6.5 inches by 4.5 inches.,Center,0,az-central,42.22,-7.0
Torrid Mini Stretch Sequin Shirred One Shoulder Dress Credit: Reviewed / Torrid Try on this mini dress from Torrid for a showstopping party look.,Center,0,az-central,42.22,-7.0
And it’s not just because of the Michigan vs Everybody thing.,Center,1,az-central,42.22,-7.0
"From soaps to a thematic cruise inspired by her eras, the insatiable thirst for Swift gear skyrocketed.",Center,1,az-central,42.22,-7.0
"Maybe it will still happen, but this looks like a proper political defenestration with DeSantis hitting the eject button.",Left,1,salon,32.38,-13.86
"If anything, rape charges just burnish one's reputation in MAGA circles, which have made a virtue out of toxic masculinity.",Left,1,salon,32.38,-13.86
It was not really responsible for the wave of COVID infections that surged at the end of summer.,Left,0,salon,32.38,-13.86
Gregory said these variants can and do establish as evolving lineages in the larger population.,Left,0,salon,32.38,-13.86
"After a relationship marked by Turner being neat freak and a skinflint, they broke up after he shamed her for gaining 10 pounds.",Left,1,salon,32.38,-13.86
"In a breakout role, Charles Melton delivers a superb performance as Joe, a man who is unexpectedly forced to confront the ripple effects of his past.",Left,0,salon,32.38,-13.86
"The parade driver-some man I’d still like to hit in the mouth, very hard-dropped them off at the wrong spot several streets over.",Left,1,salon,32.38,-13.86
"Think of the fury that will have built up inside him, a fury that, from his point of view, he has worked hard to contain.",Left,1,salon,32.38,-13.86
But the pleasure of this film is watching how Gracie responds and reacts to this interloper.,Left,0,salon,32.38,-13.86
"The result was a public that has come to believe that everyone in politics is full of crap, and that nothing anyone says about anything in politics can be trusted.",Left,1,salon,32.38,-13.86
S2E84 on Omny.FM (and links to all of his podcasts) ivoox also carries his podcast.,Left,0,daily-kos,28.4,-17.51
